티커	종목코드	유니버스	현재가	3M수익률(보조,%)	6M수익률(보조,%)	12M수익률(보조,%)	52주고점대비(보조,%)	40일이평(보조)	200일이평(보조)	40일선상회(보조)	200일선상회(보조)	추세판정(보조)	종목명	시장	통화	섹터	산업	업종	사업설명	시가총액	배당수익률(%)	EPS(FY)	EPS Growth 1Y(%)	EPS Growth 3Y CAGR(%)	EPS Growth 5Y CAGR(%)	현금및단기투자	장기부채	단기위험부채	총부채	주주지분	주당순현금(린치식)	주당잉여현금흐름	잉여현금흐름수익률(%)	순현금차감PER(린치식)	사용연성장률(%)	린치PER배수	배당감안점수	린치PER판정	배당감안점수판정	그레이엄적정PER(3년)	그레이엄내재가치(3년)	그레이엄괴리율(3년,%)	종합판정	데이터상태
0700.HK	0700.HK	China / Hong Kong	466.3999938964844	-9.961391139674836	-25.316253979746296		-31.158672487603777	474.1400016784668	573.131000366211	N	N	주의	TENCENT	HKG	HKD	Communication Services	Internet Content & Information	Internet Content & Information	Tencent Holdings Limited, an investment holding company, provides value-added services, marketing services, fintech, and business services in Mainland China and internationally. The company's consumers business includes communications and social services, such as instant messaging and social networks; digital content, including online games, videos, live streaming, news, music, and literature; fintech services, which include mobile payment, wealth management, consumer loans, and securities tradi	4142676836352.0	1.14	27.98	15.854343468694765	6.10101407396777		712465000000.0	334573000000.0	53160000000.0	387733000000.0	1154152000000.0	41.86965002835781	21.070552474100623	4.5176999892451	15.172635592141765	6.10101407396777	2.486903883221876	0.4772416782828454	매우 불리	불리(<1)	20.70202814793554	579.2427475792364	24.194415771754272	보류	충분
9988.HK	9988.HK	China / Hong Kong	126.5999984741211	-11.406575310402655	-18.058253414808355		-31.604541167156363	129.85499954223633	145.2235001373291	N	N	주의	BABA-W	HKG	HKD	Consumer Cyclical	Internet Retail	Internet Retail	Alibaba Group Holding Limited, through its subsidiaries, provides technology infrastructure and marketing reach to help merchants, brands, retailers, and other businesses in the People's Republic of China and internationally. It operates through the Alibaba China E-Commerce Group, Alibaba International Digital Commerce Group, Cloud Intelligence Group, and All Others segments. The Alibaba China E-commerce Group segment operates Taobao and Tmall, which are digital retail platforms; Taobao Instant 	2370344321024.0	81.0	6.37	-20.380603955145304	12.486072925161418		502258000000.0	231772000000.0	28224000000.0	281722000000.0	1060886000000.0	14.092897718088157	-2.642828626443896	-2.087542384121062	17.662025236425894	12.486072925161418	1.414538049095814	5.293055109691337	보통	안심(>=2)	33.47214585032283	213.21756906655645	68.41830303034425	보류	충분
3690.HK	3690.HK	China / Hong Kong	80.4000015258789	-0.9242144003667407	-18.084564161030514		-45.82209916938306	83.23999977111816	95.09875019073486	N	N	주의	MEITUAN-W	HKG	HKD	Consumer Cyclical	Internet Retail	Internet Retail	Meituan operates as a technology driven retail company in the People's Republic of China, Hong Kong, Macao, Taiwan, and internationally. It operates through Core Local Commerce and New Initiatives segments. The company offers daily goods and services, such as food delivery, in-store, hotel and travel booking, and other services and sales; bike sharing, e-moped sharing, power banks and micro-credit; and operates Kuailv and Xiaoxiang Supermarkets. It also sells goods from B2B food distribution ser	485306499072.0		-4.54				226896042000.0	65904021000.0	14379078000.0	86619106000.0	151045913000.0	28.773081962634354	-4.8408568339735485	-6.020966097140419					판정불가	판정불가				보류	일부부족
9618.HK	9618.HK	China / Hong Kong	115.0999984741211	10.249039072657329	2.402132483619712		-19.397761894722688	118.90500030517578	118.41975048065186	N	N	중립	JD-SW	HKG	HKD	Consumer Cyclical	Internet Retail	Internet Retail	JD.com, Inc. operates as a supply chain-based technology and service provider in the People's Republic of China and Europe. It operates through three segments: JD Retail, JD Logistics, and New Businesses. The company provides home appliances; mobile handsets and other digital products; computers, including desktop, laptop, and other various products, as well as printers and other office equipment; furniture and household goods; apparel; cosmetics and other personal care items; and pet products. 	314138755072.0	3.4	5.36	-52.53511932106676	23.66544269567723		288976000000.0	62473000000.0	11525000000.0	107105000000.0	225040000000.0	93.98950734042998	1.9947089521350574	1.7330225704421227	3.938524465240879	23.66544269567723	0.1664251337229494	6.871975262446901	매우 유망	안심(>=2)	55.83088539135446	299.2535456976599	159.9943958860639	매우 유망	충분
9999.HK	9999.HK	China / Hong Kong	195.0	8.816966138856186	-9.972301705842401		-20.860387650041147	181.78250007629396	205.00150009155274	Y	N	상승전환/양호	NTES-S	HKG	HKD	Communication Services	Electronic Gaming & Multimedia	Electronic Gaming & Multimedia	NetEase, Inc. engages in online games, music streaming, online intelligent learning services, and internet content services businesses in China and internationally. The company operates through Games and Related Value-Added Services; Youdao; NetEase Cloud Music; and Innovative Businesses and Others segments. It develops and operates mobile and PC games; and offers games licensed from other developers. The company also provides live streaming service, and other related or ancillary value-added se	617970073600.0	2.31	12.27	13.67851196370724	18.404094603117294		278053666000.0	427997000.0	6384417000.0	6729742000.0	160296119000.0	86.66114128527116	15.197802250909037	7.793744744055917	8.829572837386214	18.404094603117294	0.47976132636759306	2.3459905688086726	매우 유망	안심(>=2)	45.30818920623459	555.9314815604984	185.09306746692224	매우 유망	충분
1810.HK	1810.HK	China / Hong Kong	28.579999923706055	-18.108886320496197	-26.073460847105533		-52.48545436626496	30.667499923706053	40.502499980926515	N	N	주의	XIAOMI-W	HKG	HKD	Technology	Consumer Electronics	Consumer Electronics	Xiaomi Corporation, an investment holding company, engages in the development and sales of smartphones in Mainland China and internationally. It operates through Smartphones, IoT and Lifestyle Products, Internet Services, and smart electric vehicles segments. The company also offers internet of things (IoT) and lifestyle products comprising smart large home appliances, smart TVs, tablets, wearables and other IoT and lifestyle products; hardware repairment services for products; installation serv	731988688896.0		1.81	76.02150314018954	156.2794016865734		188478801000.0	22921433000.0	13202226000.0	41837896000.0	266218661000.0	7.758501113429436	1.001611518036301	3.5045889458015753	11.503590502915259	156.2794016865734	0.07360912813056654	13.585271628624891	매우 유망	안심(>=2)	60.0	108.60000000000001	279.98600521310817	매우 유망	충분
9888.HK	9888.HK	China / Hong Kong	132.89999389648438	7.437346140025847	18.872978773496385		-17.19626548505646	126.01749954223632	122.29299983978271	Y	Y	상승전환/양호	BIDU-SW	HKG	HKD	Communication Services	Internet Content & Information	Internet Content & Information	Baidu, Inc. provides internet content, value-added telecommunication-based, internet map, and online audio and video services in the People's Republic of China. It operates in two segments, Baidu General Business and iQIYI. The Baidu General Business segment offers products and services for mobile ecosystem, AI cloud, and intelligent driving. This segment operates Baidu App that enables users to access search, feed, content, and other services through mobile devices; and Haokan, which offers a r	354134982656.0		-0.15	-76.47727272727273	-9.574707672764294		205928000000.0	61102000000.0	28410000000.0	97077000000.0	266330000000.0	65.88987137071996	-7.474974014478953	-5.624510427217325		-9.574707672764294			판정불가	판정불가				보류	일부부족
1024.HK	1024.HK	China / Hong Kong	46.7400016784668	-25.63245375779555	-31.81619314710118		-49.11268105068518	46.490000057220456	65.70884977340698	Y	N	주의	KUAISHOU-W	HKG	HKD	Communication Services	Internet Content & Information	Internet Content & Information	Kuaishou Technology, an investment holding company, provides live streaming, online marketing, and other services in the People's Republic of China. It offers Kuaishou Flagship, a short video and content based social networking platform; Kuaishou Express; Kuaishou Concept; Yitian Camera, an app to create features Japanese-and-Korean-style filters and cute stickers; Kmovie, a shooting, editing, and production tool; and AcFun, a video sharing website. The company also provides entertainment, e-com	203421745152.0	1.48	4.9	21.402021519400073			113106000000.0	11098000000.0	13916000000.0	34953000000.0	79558000000.0	27.83273004978727	3.212518269216094	6.873166781883337	3.8586268629958216	21.402021519400073	0.18029263541755303	5.930094391566685	매우 유망	안심(>=2)	8.5	41.650000000000006	-10.890033152933675	양호	충분
1211.HK	1211.HK	China / Hong Kong	93.25	-1.7904128519023232	-1.6868724300060367		-33.771308253650055	100.62250022888183	101.69850006103516	N	N	주의	BYD COMPANY	HKG	HKD	Consumer Cyclical	Auto Manufacturers	Auto Manufacturers	BYD Company Limited, together with its subsidiaries, engages in automobiles and batteries business in the People's Republic of China, Hong Kong, Macau, Taiwan, and internationally. It operates in two segments, Mobile Handset Components, Assembly Service and Other Products; and Automobiles and Related Products and Other Products. The Mobile Handset Components, Assembly Service and Other Products segment manufactures and sells mobile handset components, such as housings and electronic components, 	836958748672.0	43.0	2.26	-18.967701027859206	25.196441286638958		184489829000.0	65703479000.0	38484710000.0	119120640000.0	246274606000.0	32.249104088613784	-26.516889015583427	-28.436342107864267	26.99154686344523	25.196441286638958	1.0712444093348281	2.52658514280994	보통	안심(>=2)	58.892882573277916	133.0979146156081	42.73234811325264	보류	충분
2318.HK	2318.HK	China / Hong Kong	57.79999923706055	-15.000001121969786	2.2104332747378663		-21.3070093416201	61.92500009536743	61.290500202178954	N	N	중립	PING AN	HKG	HKD	Financial Services	Insurance - Life	Insurance - Life	Ping An Insurance (Group) Company of China, Ltd. provides financial products and services in the People's Republic of China. It operates through Life and Health Insurance; Property and Casualty Insurance; Banking; Asset Management; and Finance Enablement segments. The company offers life insurance products, including term, whole-life, endowment, annuity, investment-linked, universal life, and health care and medical insurance; property and casualty insurance, such as auto insurance, non-auto ins	1033040953344.0	5.31	8.4	6.453829567085556	6.681286200386016		1018674000000.0	1345587000000.0	84520000000.0	1438514000000.0	1000419000000.0	-43.89521637208706	87.31390191516293	151.06211603404049	12.106573286803286	6.681286200386016	1.8120123766145237	0.9904773147870886	보통	불리(<1)	21.86257240077203	183.64560816648506	217.72596987983016	보류	충분
0939.HK	0939.HK	China / Hong Kong	8.569999694824219	7.259073095378654	4.384892265585161		-4.671858587174427	8.7177499294281	8.006299993991853	N	Y	상승전환/양호	CCB	HKG	HKD	Financial Services	Banks - Diversified	Banks - Diversified	China Construction Bank Corporation engages in the provision of various banking and related financial services to individuals and corporate customers in the People's Republic of China and internationally. It operates through Corporate Finance Business, Personal Finance Business, Treasury and Asset Management Business, and Others segments. The company offers corporate and personal loans; trade financing; deposit taking and wealth management, agency, financial consulting and advisory, cash managem	2236683386880.0	5.07	1.51	0.9920226952383482	1.4347942111190504		4254869000000.0	0.0	0.0	3093481000000.0	3663411000000.0	17.69784723548096	8.641964734641563	100.83973211645278	-6.044932146130292	1.4347942111190504	-4.213100456695892		판정불가	판정불가	11.3695884222381	17.16807851757953	100.32764444493564	보류	충분
1398.HK	1398.HK	China / Hong Kong	6.71999979019165	4.1860463397017655	3.543914132278303		-7.438022336995919	6.956249988079071	6.343699977397919	N	Y	상승전환/양호	ICBC	HKG	HKD	Financial Services	Banks - Diversified	Banks - Diversified	Industrial and Commercial Bank of China Limited, together with its subsidiaries, provides banking products and services in the People's Republic of China and internationally. It operates through Corporate Banking, Personal Banking, and Treasury Operations segments. The Corporate Banking segment offers corporate loans, trade financing, deposit-taking activities, corporate wealth management services, custody services, and various types of corporate intermediary services, as well as corporate loans	2395050082304.0	5.21	1.17	0.7377078305267348	0.6811562101320723		5268700000000.0	0.0	0.0	2751358000000.0	4244259000000.0	60.703473692423984	21.341222310857273	317.5777228744323	-46.13972128395926	0.6811562101320723	-67.73735686123017		판정불가	판정불가	9.862312420264145	11.538905531709048	71.70990910670795	보류	충분
3988.HK	3988.HK	China / Hong Kong	5.269999980926514	13.577589063986096	11.652546931840678		-0.7532949582686688	5.158749997615814	4.6319499945640565	Y	Y	상승전환/양호	BANK OF CHINA	HKG	HKD	Financial Services	Banks - Diversified	Banks - Diversified	Bank of China Limited, together with its subsidiaries, provides various banking and financial services in Chinese Mainland, Hong Kong, Macao, Taiwan, and internationally. The company operates through six segments: Corporate Banking, Personal Banking, Treasury Operations, Investment Banking, Insurance, and Other. The Corporate Banking segment provides current accounts, deposits, overdrafts, loans, payments and settlements, trade-related products, and other credit facilities, as well as foreign cu	1691615100928.0	4.8	0.86	2.1779255889438742	2.3712026525481544		4330456000000.0	0.0	0.0	2782404000000.0	3064044000000.0	51.78591383406694	9.097539947447396	172.62884213232894	-54.08827192225631	2.3712026525481544	-22.810480523093073		판정불가	판정불가	13.242405305096309	11.388468562382826	116.09997350285815	보류	충분
0941.HK	0941.HK	China / Hong Kong	85.55000305175781	7.881462496187708	-2.3401774635520067		-5.3126679617356505	84.24499969482422	83.76849998474121	Y	Y	상승전환/양호	CHINA MOBILE	HKG	HKD	Communication Services	Telecom Services	Telecom Services	China Mobile Limited provides communication, computing, and AI services in Mainland China and Hong Kong. It offers communications services, including mobile communications, broadband networks, cellular IoT, and satellite Internet; computing services comprising data centers, cloud computing services, and cloud computing applications; and AI services, such as data algorithms, embodied intelligence, digital intelligence culture, digital intelligence e-commerce, and industry digital intelligence ser	1834380427264.0	5.89	7.3	-0.9235905848684389	3.000641948799565		520239000000.0	9748000000.0	42507000000.0	101197000000.0	1428475000000.0	24.61165600002836	3.6625489636646966	4.2811792320438045	8.347718774209515	3.000641948799565	2.781977629003386	1.0650385080373606	매우 불리	보통(1~1.5)	14.50128389759913	105.85937245247365	23.73976467122818	보류	충분
0883.HK	0883.HK	China / Hong Kong	27.260000228881836	7.661929531753442	28.463718713346786		-10.622950069239877	27.149500036239623	23.061899976730345	Y	Y	상승전환/양호	CNOOC	HKG	HKD	Energy	Oil & Gas E&P	Oil & Gas E&P	CNOOC Limited, an investment holding company, engages in the exploration, development, production, and sale of crude oil and natural gas in worldwide. The company produces offshore crude oil and natural gas primarily in Bohai Sea, the Western South China Sea, the Eastern South China Sea, and the East China Sea in China. It also holds interests in various oil and gas assets in Asia, Africa, North America, South America, Oceania, and Europe. In addition, the company is involved in the sales and tr	1284259446784.0	4.7	2.98	-11.493736225495887	-4.845953497090038		402707000000.0	58832000000.0	1308000000.0	69800000000.0	802750000000.0	7.72059621174125	2.1887539451661775	8.029178014632603	6.556846985617646	-4.845953497090038		-0.02225970766287287	판정불가	불리(<1)	0.0	0.0	-100.0	보류	일부부족
0857.HK	0857.HK	China / Hong Kong	10.6899995803833	12.054503387093307	23.726842078714117		-11.138821133264775	10.98199999332428	9.012450025081634	N	Y	상승전환/양호	PETROCHINA	HKG	HKD	Energy	Oil & Gas Integrated	Oil & Gas Integrated	PetroChina Company Limited, together with its subsidiaries, engages in a range of petroleum related products, services, and activities in Mainland China and internationally. It operates through the Oil and Gas and New Energy; Refining, Chemicals and New Materials; Sales; and Natural Gas Sales Segments. The Oil, Gas and New Energy Resource segment engages in the exploration, development, transportation, production, and marketing of crude oil and natural gas, as well as is involved in the new ener	1930871308288.0	4.9	1.0	-4.477883844640385	1.8835578227509364		251258000000.0	163462000000.0	34513000000.0	353775000000.0	1586061000000.0	4.161164800060667	5.674276858035253	53.08023461897832	6.528834780322634	1.8835578227509364	3.4662247696687483	1.0390150847737818	매우 불리	보통(1~1.5)	12.267115645501873	12.267115645501873	14.753191085364126	보류	충분
0386.HK	0386.HK	China / Hong Kong	4.369999885559082	-19.816513055101904	-0.9070286448309095		-22.791519375090562	4.547749996185303	4.580199990272522	N	N	주의	SINOPEC CORP	HKG	HKD	Energy	Oil & Gas Integrated	Oil & Gas Integrated	China Petroleum & Chemical Corporation, an energy and chemical company, engages in the oil and gas and chemical operations in Mainland China. It operates through Exploration and Production, Refining, Marketing and Distribution, Chemicals, and Corporate and Others segments. The company explores and develops oil fields; produces and sells crude oil and natural gas; processes, purifies, imports, and trades in crude oil; manufactures, produces, sells, stores, and trades in petroleum products; owns a	526025949184.0	5.9	0.31	-33.63983734853593	-21.420834213525552		231381000000.0	235264000000.0	120256000000.0	531006000000.0	827463000000.0	-0.16327062230528314	1.2139547093937237	27.779284695299594	14.623453251175373	-21.420834213525552		-1.0613658721327024	판정불가	불리(<1)	0.0	0.0	-100.0	보류	일부부족
0005.HK	0005.HK	China / Hong Kong	146.89999389648438	-0.27156086013988556	36.905861806569476		-0.27156086013988556	141.33250007629394	121.53399993896484	Y	Y	상승전환/양호	HSBC HOLDINGS	HKG	HKD	Financial Services	Banks - Diversified	Banks - Diversified	HSBC Holdings plc engages in the provision of banking and financial products and services worldwide. It operates through four segments: Hong Kong, UK, Corporate and Institutional Banking, and International Wealth and Premier Banking. The Hong Kong segment is involved in the retail banking and wealth and commercial banking of HSBC Hong Kong and Hang Seng Bank. The UK segment engages in UK retail banking and wealth, as well as first direct and M&S Bank, UK Commercial Banking, and HSBC Innovation B	2510497775616.0	3.99	9.49	-7.064514783769127	12.722423966662477		307737000000.0	0.0	0.0	256139000000.0	198225000000.0	17.94572196649868	1.4640012412187986	0.9965972103786693	13.588437505794065	12.722423966662477	1.0680698537795053	1.2299003442843488	보통	보통(1~1.5)	33.94484793332495	322.1366068872538	119.2897346981872	보류	충분
1299.HK	1299.HK	China / Hong Kong	82.25	-5.241938815422276	4.113924050632911		-9.56569240259918	85.08749980926514	80.64175003051758	N	Y	상승전환/양호	AIA	HKG	HKD	Financial Services	Insurance - Life	Insurance - Life	AIA Group Limited, together with its subsidiaries, provides life insurance based financial services in Hong Kong. The company offers life insurance, accident, and health insurance and savings plans; and employee benefits, credit life, and pension services to corporate clients. It is also involved in the distribution of investment and other financial services products. It sells its products through a network of agents and partners in Mainland China, Macau, Thailand, Singapore, Malaysia, Australia	793995771904.0	2.35	4.62	-8.806319485078994	23.234050071757984		221334000000.0	14245000000.0	0.0	14671000000.0	43245000000.0	20.00479778205963	0.6485724123866954	0.7885378874002376	13.472987493060687	23.234050071757984	0.5798811421792406	1.8989144081767424	헐값	양호(>=1.5)	54.96810014351597	253.95262266304377	208.75698804017478	양호	충분
0388.HK	0388.HK	China / Hong Kong	409.3999938964844	-2.291170907760287	-1.3969215173468719		-11.538460523981819	412.0750022888184	421.1210006713867	N	N	주의	HKEX	HKG	HKD	Financial Services	Financial Data & Stock Exchanges	Financial Data & Stock Exchanges	Hong Kong Exchanges and Clearing Limited, together with its subsidiaries, owns and operates stock and futures exchanges, and related clearing houses in Hong Kong, the United Kingdom, and Mainland China. It operates through Cash, Equity and Financial Derivatives, Commodities, and Data and Connectivity segments. The Cash segment covers various equity products traded on the cash market platforms of the Stock Exchange of Hong Kong Limited, as well as through the Shanghai-Hong Kong and the Shenzhen-H	506623655936.0	3.19	14.86	36.04597701149426	20.77414004603453		453788000000.0	61000000.0	430000000.0	851000000.0	58147000000.0	358.9524103091035	18.903016333446587	4.617248806854199	3.3948575765397613	20.77414004603453	0.16341747812505908	7.058952991618633	매우 유망	안심(>=2)	50.04828009206906	743.7174421681461	81.66034520171317	매우 유망	충분
2382.HK	2382.HK	China / Hong Kong	83.80000305175781	43.86266618327521	30.6313344637285		-7.8107792683587025	67.14999980926514	68.92025011062623	Y	Y	상승전환/양호	SUNNY OPTICAL	HKG	HKD	Technology	Electronic Components	Electronic Components	Sunny Optical Technology (Group) Company Limited, an investment holding company, engages in designing, researching, developing, manufacturing, and selling optical and optical related products, and scientific instruments. It operates through Optical Components, Optoelectronic Products, and Optical Instruments segments. The Optical Components segment offers vehicle lens sets and optical parts for vehicle light detection and ranging, handset lens sets, glass spherical and aspherical lenses for digi	88297168896.0	1.44	4.92	71.87231282040072	24.433762661282877		38549973000.0	1405760000.0	4655009000.0	6244099000.0	29148588000.0	34.57930031499529	2.931125362464284	3.4977628349893	10.004207873325717	24.433762661282877	0.4094419681491845	2.5862879889041746	매우 유망	안심(>=2)	57.367525322565754	282.2482245870235	236.81171158513817	매우 유망	충분
9868.HK	9868.HK	China / Hong Kong	68.05000305175781	-0.4389106496862083	-16.34910346875329		-37.2811031781034	64.50999965667725	76.54949995040893	Y	N	주의	XPENG-W	HKG	HKD	Consumer Cyclical	Auto Manufacturers	Auto Manufacturers	XPeng Inc. designs, develops, manufactures, and markets smart electric vehicles (EVs) in the People's Republic of China. The company offers P7 and P7i, a four-door sports sedan; G9, a smart EV and a mid- to large-sized sport utility vehicle (SUV); G7 for families and individual consumers seeking advanced technology and comfort; G6, a smart EV and a coupe SUV; X9, Smart EV and a large seven-seater multi-purpose vehicle (MPV); MONA M03, an all-electric hatchback coupe; Next P7, an all-new coupe sp	127019261952.0		-1.37				52582500000.0	6755098000.0	7309923000.0	19553678000.0	30368590000.0	29.32403614712095	3.1427525056640224	4.618298846031927					판정불가	판정불가				판정불가	일부부족
2015.HK	2015.HK	China / Hong Kong	59.099998474121094	-14.036365855823863	-17.168886141522655		-52.53012170753326	68.55499992370605	75.98350006103516	N	N	주의	LI AUTO-W	HKG	HKD	Consumer Cyclical	Auto Manufacturers	Auto Manufacturers	Li Auto Inc. operates in the energy vehicle market in the People's Republic of China. The company designs, develops, manufactures, and sells premium smart electric vehicles. Its product line comprises multi-purpose vehicles and sport utility vehicles. The company offers sales and after sales management, and technology development and corporate management services, as well as manufacturing equipment. It offers its products through online and offline channels. The company was formerly known as Lea	116193976320.0		-1.04	-86.00113291875977			145354579000.0	3299203000.0	6217745000.0	17814767000.0	72619255000.0	84.83508752685823	-7.654226482876752	-12.951314180199871		-86.00113291875977			판정불가	판정불가				보류	일부부족
