티커	종목코드	유니버스	현재가	3M수익률(보조,%)	6M수익률(보조,%)	12M수익률(보조,%)	52주고점대비(보조,%)	40일이평(보조)	200일이평(보조)	40일선상회(보조)	200일선상회(보조)	추세판정(보조)	종목명	시장	통화	섹터	산업	업종	사업설명	시가총액	배당수익률(%)	EPS(FY)	EPS Growth 1Y(%)	EPS Growth 3Y CAGR(%)	EPS Growth 5Y CAGR(%)	현금및단기투자	장기부채	단기위험부채	총부채	주주지분	주당순현금(린치식)	주당잉여현금흐름	잉여현금흐름수익률(%)	순현금차감PER(린치식)	사용연성장률(%)	린치PER배수	배당감안점수	린치PER판정	배당감안점수판정	그레이엄적정PER(3년)	그레이엄내재가치(3년)	그레이엄괴리율(3년,%)	종합판정	데이터상태
0700.HK	0700.HK	China / Hong Kong	471.3999938964844	-22.211222129293006	-27.588326590401792		-30.420665107529977	503.97500076293943	581.0975001525879	N	N	주의	TENCENT	HKG	HKD	Communication Services	Internet Content & Information	Internet Content & Information	Tencent Holdings Limited, an investment holding company, provides value-added services, marketing services, fintech, and business services in Mainland China and internationally. The company's consumers business includes communications and social services, such as instant messaging and social networks; digital content, including online games, videos, live streaming, news, music, and literature; fintech services, which include mobile payment, wealth management, consumer loans, and securities tradi	4259994402816.0	1.11	27.69	15.854343468694765	6.10101407396777		712465000000.0	334573000000.0	53160000000.0	406399000000.0	1154152000000.0	41.816556661752635	21.043833679787245	4.464114118000668	15.514028069148852	6.10101407396777	2.542860560729598	0.4648060479088323	매우 불리	불리(<1)	20.70202814793554	573.2391594163352	21.603556817655335	보류	충분
9988.HK	9988.HK	China / Hong Kong	139.0	-17.84869828188016	-19.23300693179898		-24.905458986173446	129.28999938964844	144.23000015258788	Y	N	주의	BABA-W	HKG	HKD	Consumer Cyclical	Internet Retail	Internet Retail	Alibaba Group Holding Limited, through its subsidiaries, provides technology infrastructure and marketing reach to help merchants, brands, retailers, and other businesses to engage with their users and customers in the People's Republic of China and internationally. It operates digital retail platforms under the Taobao and Tmall names; wholesale marketplaces through 1688.com and Alibaba.com; global e-commerce platform under the AliExpress name; e-commerce platforms under the Lazada, Trendyol, an	2667744067584.0	73.0	5.55	62.617955480008504	27.857140301211246		710699000000.0	208141000000.0	22562000000.0	248110000000.0	1009858000000.0	26.18525543229398	4.03998374407288	2.9064631252322877	20.326981003190273	27.857140301211246	0.7296865645001774	4.961737322693515	헐값	안심(>=2)	60.0	333.0	139.56834532374103	양호	충분
3690.HK	3690.HK	China / Hong Kong	84.05000305175781	-13.528800729784574	-17.919920117856257		-43.362529306849936	83.02624969482422	98.94475021362305	Y	N	주의	MEITUAN-W	HKG	HKD	Consumer Cyclical	Internet Retail	Internet Retail	Meituan operates as a technology driven retail company in the People's Republic of China, Hong Kong, Macao, Taiwan, and internationally. It operates through Core Local Commerce and New Initiatives segments. The company offers daily goods and services, such as food delivery, in-store, hotel and travel booking, and other services and sales; bike sharing, e-moped sharing, power banks and micro-credit; and operates Kuailv and Xiaoxiang Supermarkets. It also sells goods from B2B food distribution ser	518956908544.0		-4.5				226896042000.0	65904021000.0	14379078000.0	86619106000.0	151045913000.0	28.773081962634354	-4.8408568339735485	-5.759496321484437					판정불가	판정불가				보류	일부부족
9618.HK	9618.HK	China / Hong Kong	118.5	5.4270448321271925	-9.472875840078554		-17.01680849611067	114.51249980926514	118.94675037384033	Y	N	상승전환/양호	JD-SW	HKG	HKD	Consumer Cyclical	Internet Retail	Internet Retail	JD.com, Inc. operates as a supply chain-based technology and service provider in the People's Republic of China and Europe. It operates through three segments: JD Retail, JD Logistics, and New Businesses. The company provides home appliances; mobile handsets and other digital products; computers, including desktop, laptop, and other various products, as well as printers and other office equipment; furniture and household goods; apparel; cosmetics and other personal care items; and pet products. 	323699507200.0	3.29	7.4	-52.53511932106676	23.66544269567723		288976000000.0	62473000000.0	11525000000.0	107105000000.0	225040000000.0	93.98950734042998	1.9947089521350574	1.6832986937848584	3.312228737779732	23.66544269567723	0.13996056530076023	8.13815857226881	매우 유망	안심(>=2)	55.83088539135446	413.148551896023	248.64856700086327	매우 유망	충분
9999.HK	9999.HK	China / Hong Kong	183.5	-10.48780487804878	-16.59090909090909		-25.52759555785924	179.15500030517578	207.01300010681152	Y	N	주의	NTES-S	HKG	HKD	Communication Services	Electronic Gaming & Multimedia	Electronic Gaming & Multimedia	NetEase, Inc. engages in online games, music streaming, online intelligent learning services, and internet content services businesses in China and internationally. The company operates through Games and Related Value-Added Services; Youdao; NetEase Cloud Music; and Innovative Businesses and Others segments. It develops and operates mobile and PC games; and offers games licensed from other developers. The company also provides live streaming service, and other related or ancillary value-added se	585482567680.0	2.51	12.03	13.67851196370724	18.404094603117294		278053666000.0	427997000.0	6384417000.0	6729742000.0	160296119000.0	87.01251887753399	15.25942349294914	8.31576212149817	8.020571996879967	18.404094603117294	0.43580367140263665	2.607556494880035	매우 유망	안심(>=2)	45.30818920623459	545.057516151002	197.03406874714005	매우 유망	충분
1810.HK	1810.HK	China / Hong Kong	31.68000030517578	-10.7605625206316	-28.260868626265832		-47.33167165166938	32.105000019073486	42.69420001029968	N	N	주의	XIAOMI-W	HKG	HKD	Technology	Consumer Electronics	Consumer Electronics	Xiaomi Corporation, an investment holding company, engages in the development and sales of smartphones in Mainland China and internationally. It operates through Smartphones, IoT and Lifestyle Products, Internet Services, and smart electric vehicles segments. The company also offers internet of things (IoT) and lifestyle products comprising smart large home appliances, smart TVs, tablets, wearables and other IoT and lifestyle products; hardware repairment services for products; installation serv	818120622080.0		1.79	76.02150314018954	156.2794016865734		188478801000.0	22921433000.0	13202226000.0	41837896000.0	266218661000.0	7.752099426521218	1.0007850693127152	3.159043748964895	13.367542390309811	156.2794016865734	0.08553617588784428	11.690959873062457	매우 유망	안심(>=2)	60.0	107.4	239.01514824939355	매우 유망	충분
9888.HK	9888.HK	China / Hong Kong	145.1999969482422	-4.973825884637762	20.398008943092872		-9.532712181780568	118.31750049591065	118.38899997711182	Y	Y	상승전환/양호	BIDU-SW	HKG	HKD	Communication Services	Internet Content & Information	Internet Content & Information	Baidu, Inc. provides internet content, value-added telecommunication-based, internet map, and online audio and video services in the People's Republic of China. It operates in two segments, Baidu General Business and iQIYI. The Baidu General Business segment offers products and services for mobile ecosystem, AI cloud, and intelligent driving. This segment operates Baidu App that enables users to access search, feed, content, and other services through mobile devices; and Haokan, which offers a r	395237490688.0		1.69	-76.47727272727273	-9.574707672764294		205928000000.0	61102000000.0	28410000000.0	97077000000.0	266330000000.0	65.88987137071996	-7.474974014478953	-5.148053837179813	46.92906838906641	-9.574707672764294		-0.20402509577613992	판정불가	불리(<1)	0.0	0.0	-100.0	보류	일부부족
1024.HK	1024.HK	China / Hong Kong	52.95000076293945	-33.936369613364384	-29.068989041368898		-42.351658527399735	48.979000091552734	67.95629974365234	Y	N	주의	KUAISHOU-W	HKG	HKD	Communication Services	Internet Content & Information	Internet Content & Information	Kuaishou Technology, an investment holding company, provides live streaming, online marketing, and other services in the People's Republic of China. It offers Kuaishou Flagship, a short video and content based social networking platform; Kuaishou Express; Kuaishou Concept; Yitian Camera, an app to create features Japanese-and-Korean-style filters and cute stickers; Kmovie, a shooting, editing, and production tool; and AcFun, a video sharing website. The company also provides entertainment, e-com	229702172672.0	1.43	4.85	21.402021519400073			113106000000.0	11098000000.0	13916000000.0	34953000000.0	79558000000.0	27.930616660567658	3.2238165689114933	6.0884164730133365	5.1586358973962465	21.402021519400073	0.2410349832010098	4.425980428454785	매우 유망	안심(>=2)	8.5	41.224999999999994	-22.143532755425333	양호	충분
1211.HK	1211.HK	China / Hong Kong	99.75	2.0460358056265893	-4.2706305936386695		-35.67282846880707	104.33000011444092	104.14125011444092	N	N	주의	BYD COMPANY	HKG	HKD	Consumer Cyclical	Auto Manufacturers	Auto Manufacturers	BYD Company Limited, together with its subsidiaries, engages in automobiles and batteries business in the People's Republic of China, Hong Kong, Macau, Taiwan, and internationally. It operates in two segments, Mobile Handset Components, Assembly Service and Other Products; and Automobiles and Related Products and Other Products. The Mobile Handset Components, Assembly Service and Other Products segment manufactures and sells mobile handset components, such as housings and electronic components, 	909440450560.0	40.0	2.24	-18.967701027859206	25.196441286638958		184489829000.0	65703479000.0	38484710000.0	119120640000.0	246274606000.0	32.249104088613784	-26.516889015583427	-26.583347384043538	30.13432853186884	25.196441286638958	1.1959755819901565	2.1635272615313084	보통	안심(>=2)	58.892882573277916	131.92005696414253	32.25068367332584	보류	충분
2318.HK	2318.HK	China / Hong Kong	65.5999984741211	-9.766160621954146	14.886165021269449		-10.687540912564952	61.81125011444092	60.67450019836426	Y	Y	상승전환/양호	PING AN	HKG	HKD	Financial Services	Insurance - Life	Insurance - Life	Ping An Insurance (Group) Company of China, Ltd. provides financial products and services in the People's Republic of China. It operates through Life and Health Insurance; Property and Casualty Insurance; Banking; Asset Management; and Finance Enablement segments. The company offers life insurance products, including term, whole-life, endowment, annuity, investment-linked, universal life, and health care and medical insurance; property and casualty insurance, such as auto insurance, non-auto ins	1187861233664.0	4.59	8.32	6.453829567085556	6.681286200386016		1018674000000.0	1345587000000.0	84520000000.0	1438514000000.0	1000419000000.0	-43.89521637208706	87.31390191516293	133.1004633324921	13.160482553630787	6.681286200386016	1.9697528528070585	0.8564493098527326	보통	불리(<1)	21.86257240077203	181.8966023744233	177.2814125082346	보류	충분
0939.HK	0939.HK	China / Hong Kong	8.760000228881836	10.74589630678462	11.450382698212746		-2.558393193459685	8.439499998092652	7.963050010204316	Y	Y	상승전환/양호	CCB	HKG	HKD	Financial Services	Banks - Diversified	Banks - Diversified	China Construction Bank Corporation engages in the provision of various banking and related financial services to individuals and corporate customers in the People's Republic of China and internationally. It operates through Corporate Finance Business, Personal Finance Business, Treasury and Asset Management Business, and Others segments. The company offers corporate and personal loans; trade financing; deposit taking and wealth management, agency, financial consulting and advisory, cash managem	2291619332096.0	4.89	1.49	0.9920226952383482	1.4347942111190504		4254869000000.0	0.0	0.0	3093481000000.0	3663411000000.0	17.69784723548096	8.641964734641563	98.65256288634437	-5.99855503798599	1.4347942111190504	-4.180777279068815		판정불가	판정불가	11.3695884222381	16.94068674913477	93.38682998296169	보류	충분
1398.HK	1398.HK	China / Hong Kong	6.920000076293945	6.625582747928149	14.380162944315678		-4.683197546403606	6.827499985694885	6.282499976158142	Y	Y	상승전환/양호	ICBC	HKG	HKD	Financial Services	Banks - Diversified	Banks - Diversified	Industrial and Commercial Bank of China Limited, together with its subsidiaries, provides banking products and services in the People's Republic of China and internationally. It operates through Corporate Banking, Personal Banking, and Treasury Operations segments. The Corporate Banking segment offers corporate loans, trade financing, deposit-taking activities, corporate wealth management services, custody services, and various types of corporate intermediary services, as well as corporate loans	2466331492352.0	5.0	1.16	0.7377078305267348	0.6811562101320723		5268700000000.0	0.0	0.0	2751358000000.0	4244259000000.0	60.703473692423984	21.341222310857273	308.3991629417252	-46.36506346218107	0.6811562101320723	-68.06817991601537		판정불가	판정불가	9.862312420264145	11.440282407506407	65.32199828577647	보류	충분
3988.HK	3988.HK	China / Hong Kong	5.110000133514404	9.421842613108433	14.831468596360642		-2.6666641235351562	4.939500033855438	4.5812499976158145	Y	Y	상승전환/양호	BANK OF CHINA	HKG	HKD	Financial Services	Banks - Diversified	Banks - Diversified	Bank of China Limited, together with its subsidiaries, provides various banking and financial services in Chinese Mainland, Hong Kong, Macao, Taiwan, and internationally. The company operates through six segments: Corporate Banking, Personal Banking, Treasury Operations, Investment Banking, Insurance, and Other. The Corporate Banking segment provides current accounts, deposits, overdrafts, loans, payments and settlements, trade-related products, and other credit facilities, as well as foreign cu	1646505361408.0	4.92	0.85	2.1779255889438742	2.3712026525481544		4330456000000.0	0.0	0.0	2782404000000.0	3064044000000.0	51.78591383406694	9.097539947447396	178.03404520051473	-54.912839647708864	2.3712026525481544	-23.15822293328583		판정불가	판정불가	13.242405305096309	11.256044509331863	120.27483787149168	보류	충분
0941.HK	0941.HK	China / Hong Kong	85.44999694824219	7.080192581972478	-0.523870278979155		-5.423355405238228	81.26374969482421	83.82474998474122	Y	Y	상승전환/양호	CHINA MOBILE	HKG	HKD	Communication Services	Telecom Services	Telecom Services	China Mobile Limited provides communication, computing, and AI services in Mainland China and Hong Kong. It offers communications services, including mobile communications, broadband networks, cellular IoT, and satellite Internet; computing services comprising data centers, cloud computing services, and cloud computing applications; and AI services, such as data algorithms, embodied intelligence, digital intelligence culture, digital intelligence e-commerce, and industry digital intelligence ser	1849531695104.0	5.91	7.22	-0.9235905848684389	3.000641948799565		520239000000.0	9748000000.0	42507000000.0	101197000000.0	1428475000000.0	24.61165600002836	3.6625489636646966	4.286189695106876	8.426363012217982	3.000641948799565	2.8081867666980482	1.0574718815079998	매우 불리	보통(1~1.5)	14.50128389759913	104.69926974066571	22.526943803266587	보류	충분
0883.HK	0883.HK	China / Hong Kong	26.440000534057617	8.449554734218623	32.06793171577724		-13.311473658827488	28.003499889373778	22.373649959564208	N	Y	상승전환/양호	CNOOC	HKG	HKD	Energy	Oil & Gas E&P	Oil & Gas E&P	CNOOC Limited, an investment holding company, engages in the exploration, development, production, and sale of crude oil and natural gas in worldwide. The company produces offshore crude oil and natural gas primarily in Bohai Sea, the Western South China Sea, the Eastern South China Sea, and the East China Sea in China. It also holds interests in various oil and gas assets in Asia, Africa, North America, South America, Oceania, and Europe. In addition, the company is involved in the sales and tr	1256691990528.0	4.84	2.95	-11.493736225495887	-4.845953497090038		402707000000.0	58832000000.0	1308000000.0	69800000000.0	802750000000.0	7.72059621174125	2.1887539451661775	8.27819175853201	6.345560787225887	-4.845953497090038		-0.0009382144919363467	판정불가	불리(<1)	0.0	0.0	-100.0	보류	일부부족
0857.HK	0857.HK	China / Hong Kong	10.59000015258789	14.116384238270596	32.873280192812125		-11.970071590580556	10.89650001525879	8.717850027084351	N	Y	상승전환/양호	PETROCHINA	HKG	HKD	Energy	Oil & Gas Integrated	Oil & Gas Integrated	PetroChina Company Limited, together with its subsidiaries, engages in a range of petroleum related products, services, and activities in Mainland China and internationally. It operates through the Oil and Gas and New Energy; Refining, Chemicals and New Materials; Sales; and Natural Gas Sales Segments. The Oil, Gas and New Energy Resource segment engages in the exploration, development, transportation, production, and marketing of crude oil and natural gas, as well as is involved in the new ener	1938192203776.0	4.9	0.99	-4.477883844640385	1.8835578227509364		251258000000.0	163462000000.0	34513000000.0	353775000000.0	1586061000000.0	4.161164800060667	5.674276858035253	53.58146153235535	6.493773083360832	1.8835578227509364	3.447610158246523	1.0446250177932193	매우 불리	보통(1~1.5)	12.267115645501873	12.144444489046855	14.678416563375606	보류	충분
0386.HK	0386.HK	China / Hong Kong	4.610000133514404	-14.31226699902275	11.893210232184991		-18.551232194428245	4.650500023365021	4.58254998922348	N	Y	상승전환/양호	SINOPEC CORP	HKG	HKD	Energy	Oil & Gas Integrated	Oil & Gas Integrated	China Petroleum & Chemical Corporation, an energy and chemical company, engages in the oil and gas and chemical operations in Mainland China. It operates through Exploration and Production, Refining, Marketing and Distribution, Chemicals, and Corporate and Others segments. The company explores and develops oil fields; produces and sells crude oil and natural gas; processes, purifies, imports, and trades in crude oil; manufactures, produces, sells, stores, and trades in petroleum products; owns a	557466648576.0	4.82	0.31	-33.63983734853593	-21.420834213525552		231381000000.0	235264000000.0	120256000000.0	531006000000.0	827463000000.0	-0.16327062230528314	1.2139547093937237	26.333073193823815	15.397647599418349	-21.420834213525552		-1.0781409372008652	판정불가	불리(<1)	0.0	0.0	-100.0	보류	일부부족
0005.HK	0005.HK	China / Hong Kong	138.6999969482422	1.537328514564762	28.42592310022425		-5.838429005662538	134.2375	117.7677498626709	Y	Y	상승전환/양호	HSBC HOLDINGS	HKG	HKD	Financial Services	Banks - Diversified	Banks - Diversified	HSBC Holdings plc engages in the provision of banking and financial products and services worldwide. It operates through four segments: Hong Kong, UK, Corporate and Institutional Banking, and International Wealth and Premier Banking. The Hong Kong segment is involved in the retail banking and wealth and commercial banking of HSBC Hong Kong and Hang Seng Bank. The UK segment engages in UK retail banking and wealth, as well as first direct and M&S Bank, UK Commercial Banking, and HSBC Innovation B	2378456104960.0	4.1	9.49	-7.064514783769127	12.722423966662477		307737000000.0	0.0	0.0	256139000000.0	198225000000.0	17.94572543253067	1.4640015239756103	1.055516623062308	12.724370022730403	12.722423966662477	1.0001529626801484	1.3220634056233387	보통	보통(1~1.5)	33.94484793332495	322.1366068872538	132.25422781188917	보류	충분
1299.HK	1299.HK	China / Hong Kong	86.5999984741211	-4.150525803355832	18.306013776685948		-4.782846201299584	84.99875011444092	79.51500011444092	Y	Y	상승전환/양호	AIA	HKG	HKD	Financial Services	Insurance - Life	Insurance - Life	AIA Group Limited, together with its subsidiaries, provides life insurance based financial services in Hong Kong. The company offers life insurance, accident, and health insurance and savings plans; and employee benefits, credit life, and pension services to corporate clients. It is also involved in the distribution of investment and other financial services products. It sells its products through a network of agents and partners in Mainland China, Macau, Thailand, Singapore, Malaysia, Australia	901285740544.0	2.17	4.63	-8.806319485078994	23.234050071757984		221334000000.0	14245000000.0	0.0	14671000000.0	43245000000.0	19.898136805532985	0.64511437358985	0.7449357793956904	14.406449604446676	23.234050071757984	0.6200576119941462	1.7633803448642063	헐값	양호(>=1.5)	54.96810014351597	254.50230366447892	193.882572920059	양호	충분
0388.HK	0388.HK	China / Hong Kong	424.20001220703125	-1.8509948574846113	-1.8963880215539963		-8.340530813325131	406.6700019836426	422.902000579834	Y	Y	상승전환/양호	HKEX	HKG	HKD	Financial Services	Financial Data & Stock Exchanges	Financial Data & Stock Exchanges	Hong Kong Exchanges and Clearing Limited, together with its subsidiaries, owns and operates stock and futures exchanges, and related clearing houses in Hong Kong, the United Kingdom, and Mainland China. It operates through Cash, Equity and Financial Derivatives, Commodities, and Data and Connectivity segments. The Cash segment covers various equity products traded on the cash market platforms of the Stock Exchange of Hong Kong Limited, as well as through the Shanghai-Hong Kong and the Shenzhen-H	536202018816.0	3.05	14.86	36.04597701149426	20.77414004603453		453788000000.0	61000000.0	430000000.0	851000000.0	58147000000.0	358.9524103091035	18.903016333446587	4.456156480311686	4.390821123682889	20.77414004603453	0.2113599462578491	5.425896290225451	매우 유망	안심(>=2)	50.04828009206906	743.7174421681461	75.32235284452892	매우 유망	충분
2382.HK	2382.HK	China / Hong Kong	67.5	7.827478666640175	-12.280698275528723		-25.742575503936603	60.319999885559085	69.2547501564026	Y	N	상승전환/양호	SUNNY OPTICAL	HKG	HKD	Technology	Electronic Components	Electronic Components	Sunny Optical Technology (Group) Company Limited, an investment holding company, engages in designing, researching, developing, manufacturing, and selling optical and optical related products, and scientific instruments. It operates through Optical Components, Optoelectronic Products, and Optical Instruments segments. The Optical Components segment offers vehicle lens sets and optical parts for vehicle light detection and ranging, handset lens sets, glass spherical and aspherical lenses for digi	72506802176.0	1.79	4.87	71.87231282040072	24.433762661282877		38549973000.0	1405760000.0	4655009000.0	6244099000.0	29148588000.0	34.57930031499529	2.931125362464284	4.342407944391532	6.759897265914725	24.433762661282877	0.2766621481768867	3.8793137868396834	매우 유망	안심(>=2)	57.367525322565754	279.37984832089523	313.8960715865115	매우 유망	충분
9868.HK	9868.HK	China / Hong Kong	61.29999923706055	-14.445222705375793	-30.65611065728873		-43.50230485063544	68.63999938964844	77.40725004196167	N	N	주의	XPENG-W	HKG	HKD	Consumer Cyclical	Auto Manufacturers	Auto Manufacturers	XPeng Inc. designs, develops, manufactures, and markets smart electric vehicles (EVs) in the People's Republic of China. The company offers P7 and P7i, a four-door sports sedan; G9, a smart EV and a mid- to large-sized sport utility vehicle (SUV); G7 for families and individual consumers seeking advanced technology and comfort; G6, a smart EV and a coupe SUV; X9, Smart EV and a large seven-seater multi-purpose vehicle (MPV); MONA M03, an all-electric hatchback coupe; Next P7, an all-new coupe sp	117175033856.0		-0.69				52582500000.0	6755098000.0	7309923000.0	19553678000.0	30368590000.0	29.32403614712095	3.1427525056640224	5.1268393878934795					판정불가	판정불가				판정불가	일부부족
2015.HK	2015.HK	China / Hong Kong	70.05000305175781	6.21684047496367	-13.035381256600543		-43.73493730782505	70.08500022888184	79.97625011444092	N	N	주의	LI AUTO-W	HKG	HKD	Consumer Cyclical	Auto Manufacturers	Auto Manufacturers	Li Auto Inc. operates in the energy vehicle market in the People's Republic of China. The company designs, develops, manufactures, and sells premium smart electric vehicles. Its product line comprises multi-purpose vehicles and sport utility vehicles. The company offers sales and after sales management, and technology development and corporate management services, as well as manufacturing equipment. It offers its products through online and offline channels. The company was formerly known as Lea	143114158080.0		0.62	-86.00113291875977			145354579000.0	3299203000.0	6217745000.0	17814767000.0	72619255000.0	84.15961713571197	-7.593282320419515	-10.83980298303352	-22.757442070893802	-86.00113291875977			판정불가	판정불가	8.5	5.27	-92.47680261183406	보류	일부부족
