티커	종목코드	유니버스	현재가	3M수익률(보조,%)	6M수익률(보조,%)	12M수익률(보조,%)	52주고점대비(보조,%)	40일이평(보조)	200일이평(보조)	40일선상회(보조)	200일선상회(보조)	추세판정(보조)	종목명	시장	통화	섹터	산업	업종	사업설명	시가총액	배당수익률(%)	EPS(FY)	EPS Growth 1Y(%)	EPS Growth 3Y CAGR(%)	EPS Growth 5Y CAGR(%)	현금및단기투자	장기부채	단기위험부채	총부채	주주지분	주당순현금(린치식)	주당잉여현금흐름	잉여현금흐름수익률(%)	순현금차감PER(린치식)	사용연성장률(%)	린치PER배수	배당감안점수	린치PER판정	배당감안점수판정	그레이엄적정PER(3년)	그레이엄내재가치(3년)	그레이엄괴리율(3년,%)	종합판정	데이터상태
9866.HK	9866.HK	China / Hong Kong	39.58000183105469	-24.465647560129888	1.8004134354654422		-35.32679519993906	41.42150020599365	45.03485021591187	N	N	중립	NIO-SW	HKG	HKD	Consumer Cyclical	Auto Manufacturers	Auto Manufacturers	NIO Inc. designs, develops, manufactures, and sells smart electric vehicles in China, Europe, and internationally. It offers five and six-seater electric SUVs, as well as smart electric sedans. The company also offers power solutions, including Power Home, a home charging solution; Power Swap, a battery-swapping service; Power Charger and Destination Charger; Power Mobile, a mobile charging service through charging vans; Power Map, an application that provides access to a network of public charg	99708960768.0		-4.34				12045850000.0	8626272000.0	5347881000.0	31263135000.0	4159460000.0	1.4507151882256395	-1.3035198487517274	-3.29337996070778					판정불가	판정불가				보류	일부부족
0981.HK	0981.HK	China / Hong Kong	76.30000305175781	33.50831323636505	0.9259319996895776		-16.199889627258212	78.40125007629395	71.50024990081788	N	Y	상승전환/양호	SMIC	HKG	HKD	Technology	Semiconductors	Semiconductors	Semiconductor Manufacturing International Corporation, an investment holding company, engages in the manufacture, testing, and sale of integrated circuits wafer and various compound semiconductors in the United States, China, and Eurasia. The company is also involved in the manufacturing, sale, and trading of semiconductor products; and research and development activities. In addition, it offers semiconductor foundry and technology services; supporting services comprising design and IP support, 	653189513216.0		0.71	39.04287790107723	-27.767740812712226		14935414000.0	9994773000.0	2593077000.0	12596181000.0	21439670000.0	0.8215148954383642	-0.8661647557150728	-1.1352093329898207	106.30772979763303	-27.767740812712226		-0.261201521898462	판정불가	불리(<1)	0.0	0.0	-100.0	보류	일부부족
1347.HK	1347.HK	China / Hong Kong	169.3000030517578	90.01123002368023	99.05937328271351		-21.32899374878885	161.44500102996827	103.28900030136109	Y	Y	상승전환/양호	HUA HONG GRACE	HKG	HKD	Technology	Semiconductors	Semiconductors	Hua Hong Grace Semiconductor Limited, an investment holding company, engages in the manufacture and sale of semiconductor products in China, North America, Asia, and Europe. The company offers embedded non-volatile memory; standalone non-volatile memory, including NOR flash and EEPROM; power discrete devices; analog and power management platform; and specialty logic RF processes and image sensors. It also provides design services which covers design methodologies and design flow support, standar	294178095104.0	0.640874176280019	0.26	-5.5534521924692	-50.40573254396763		4893808000.0	2787096000.0	403748000.0	3209752000.0	6612663000.0	1.5841557439391858	-0.8751683112652993	-0.516933429113847	645.0609511839177	-50.40573254396763		-0.07714752889064402	판정불가	불리(<1)	0.0	0.0	-100.0	보류	일부부족
1876.HK	1876.HK	China / Hong Kong	6.349999904632568	-16.993466333707595	-19.005104833620322		-28.32956940526564	6.728500008583069	7.618600013256073	N	N	주의	BUD APAC	HKG	HKD	Consumer Defensive	Beverages - Brewers	Beverages - Brewers	Budweiser Brewing Company APAC Limited, an investment holding company, engages in brewing and distribution of beer in South Korea, Japan, New Zealand, China, India, Vietnam, Southeast Asia, and internationally. It brews, imports, markets, distributes, and sells a portfolio of beer brands, including Budweiser, Stella Artois, Corona, Harbin, Hoegaarden, and Cass. The company was founded in 1876 and is headquartered in Causeway Bay, Hong Kong. Budweiser Brewing Company APAC Limited operates as a su	84009033728.0	6.97	0.29	-32.64462809917356	-18.789404729568137		2970000000.0	77000000.0	178000000.0	277000000.0	10262000000.0	0.21867350814101938	0.04867809859758607	0.7665842413961853	21.1425048154881	-18.789404729568137		-0.5590352152082636	판정불가	불리(<1)	0.0	0.0	-100.0	보류	일부부족
0020.HK	0020.HK	China / Hong Kong	1.350000023841858	-32.499998807907104	-43.03797092701574		-53.28719810248516	1.5247500032186507	2.1204500043392183	N	N	주의	SENSETIME-W	HKG	HKD	Technology	Software - Application	Software - Application	SenseTime Group Inc., an investment holding company, research, develops and sells artificial intelligence software platforms in Mainland China, Northeast Asia, Southeast Asia, and internationally. The company offers SenseFoundry Enterprise Platform that facilitate and accelerate the digital transformation of enterprise customers; SenseFoundry Platform for smart city management; SenseME that enables a range of IoT devices to facilitate perceptial intelligence and content enhancement; SenseMARS, a	54697398272.0		-0.06				16596316000.0	3710335000.0	2014279000.0	5962982000.0	26718959000.0	0.3220952009870681	-0.09470465227907975	-7.01515930418781					판정불가	판정불가				보류	일부부족
2269.HK	2269.HK	China / Hong Kong	39.540000915527344	12.074836404842326	15.953087052290439		-6.2588889771167056	33.56899995803833	35.26150001525879	Y	Y	상승전환/양호	WUXI BIO	HKG	HKD	Healthcare	Biotechnology	Biotechnology	WuXi Biologics (Cayman) Inc., an investment holding company, provides end-to-end solutions and services for biologics discovery, development, and manufacturing for biologics industry in the People's Republic of China, North America, Europe, Singapore, Japan, South Korea, Australia, and Brazil. It operates through two segments: Biologics and XDC. The company provides a suite of solutions for biologic discovery, from concept to IND, that seamlessly transits to CMC and downstream process developmen	162361081856.0		1.34	46.25222096844504	3.552720117093622		22251738000.0	169381000.0	873517000.0	3104066000.0	47248676000.0	5.377744764059911	0.634448432862632	1.6045736423174546	25.494221008557783	3.552720117093622	7.175972260211107	0.13935393891427633	매우 불리	불리(<1)	15.605440234187244	20.911289913810908	-47.113582626147455	보류	충분
2388.HK	2388.HK	China / Hong Kong	46.720001220703125	7.106837149765166	17.151454286335486		-4.536161561709351	46.56699962615967	41.61	Y	Y	상승전환/양호	BOC HONG KONG	HKG	HKD	Financial Services	Banks - Regional	Banks - Regional	BOC Hong Kong (Holdings) Limited, an investment holding company, provides banking and related financial services to corporate and individual customers in Hong Kong, China, and internationally. The company operates through four segments: Personal Banking, Corporate Banking, Treasury, and Insurance. It offers savings, current, and time deposit accounts, as well as monthly deposit plans; mortgage plans; corporate deposits, and payroll and e-cheque services. The company also offers cross-border fina	493960331264.0	7.67	3.8	4.938142442392701	13.652075841362565		678118000000.0	0.0	0.0	88602000000.0	358528000000.0	64.13809640787629	-8.378874597903234	-17.93423454404853	-4.583709259782412	13.652075841362565	-0.3357518162838545		판정불가	판정불가	35.804151682725134	136.0557763943555	191.21526720779457	보류	충분
600519.SS	600519.SS	China / Hong Kong	1251.06005859375	-13.320076227232391	-12.267878078979667		-19.545976939308684	1246.246499633789	1393.5508026123048	Y	N	주의	KWEICHOW MOUTAI	SHH	CNY	Consumer Defensive	Beverages - Wineries & Distilleries	Beverages - Wineries & Distilleries	Kweichow Moutai Co., Ltd., together with its subsidiaries, produces and sells liquor products in China and internationally. The company offers liquor and soy sauce products under the Kweichow Moutai, Moutai Wangzi liquor, Moutai 1935 liquor, Han Jiang liquor, and Lai Mao liquor brands. It also engages in the production and sale of beverage, food, and packaging materials; development of anti-counterfeiting technology; research and development of information industry related products; operation an	1563927248896.0	4.28	66.09	-4.532254817158088	9.489481701387037		51939124226.5	0.0	44206237.05	233711179.82	244637811032.18	41.5485870561981	46.71263861993278	3.733844614337698	18.300975511235464	9.489481701387037	1.9285537489956368	0.7523905866620924	보통	불리(<1)	27.478963402774074	1816.0846912893387	45.163669706688815	보류	충분
601318.SS	601318.SS	China / Hong Kong	50.95000076293945	-11.774890453784492	-29.58816979936464		-31.44510095243218	51.60124998092651	59.339500160217284	N	N	주의	PING AN INSURANCE(GROUP)CO.OF C	SHH	CNY	Financial Services	Insurance - Life	Insurance - Life	Ping An Insurance (Group) Company of China, Ltd. provides financial products and services in the People's Republic of China. It operates through Life and Health Insurance; Property and Casualty Insurance; Banking; Asset Management; and Finance Enablement segments. The company offers life insurance products, including term, whole-life, endowment, annuity, investment-linked, universal life, and health care and medical insurance; property and casualty insurance, such as auto insurance, non-auto ins	922584350720.0	5.44	7.25	6.453829567085556	6.681286200386016		1018674000000.0	1345587000000.0	84520000000.0	1438514000000.0	1000419000000.0	-30.66707355486415	61.00122231308144	119.72761805619668	11.25752749211084	6.681286200386016	1.6849341810055118	1.0767272128698322	보통	보통(1~1.5)	21.86257240077203	158.50364990559723	211.09646228090205	보류	충분
600036.SS	600036.SS	China / Hong Kong	37.7599983215332	-3.129813327425024	-10.838253407240883		-16.55248989716419	37.54249982833862	39.91159996032715	Y	N	주의	CHINA MERCHANTS BANK CO LTD	SHH	CNY	Financial Services	Banks - Regional	Banks - Regional	China Merchants Bank Co., Ltd., together with its subsidiaries, provides various banking products and services. It operates through Wholesale Finance Business, Retail Finance Business, and Other Business segments. It offers current, demand, time, call, savings, notice, and renminbi accounts. The company also offers loan products include personal commercial real estate, consumption, housing, and car loans; loans to finance for studying abroad; micro-business loans; mortgage loans for equipment; j	952301322240.0	10.8	5.71	1.2062726176115701	2.8567302131919714		1321522000000.0	0.0	0.0	405441000000.0	1272875000000.0	64.06154248698326	20.520487679675256	54.3445142792105	-4.60622489762698	2.8567302131919714	-1.6124115873301905		판정불가	판정불가	14.213460426383943	81.15885903465231	114.93342860762326	보류	충분
601012.SS	601012.SS	China / Hong Kong	12.0	-32.12669800414525	-35.100053279912444		-47.368419291460114	13.176249980926514	17.362250027656554	N	N	주의	LONGI GREEN ENERGY TECHNOLOGY C	SHH	CNY	Technology	Semiconductor Equipment & Materials	Semiconductor Equipment & Materials	LONGi Green Energy Technology Co., Ltd. manufactures and sells monocrystalline silicon wafers, solar modules, and green hydrogen equipment in China, Europe, the Asia Pacific, and the United States. The company offers monocrystalline silicon wafers, including tere, p-type, and n-type silicon wafers; high conversion rate components comprising Hi-MO X10, Hi-MO 9, Hi-MO 7, Hi-MO X6 Max, Hi-MO X6, Hi-MO 5m, and Hi-MO 5; green hydrogen production equipment that include ALK Hi1 and ALK G; and building 	90936827904.0	7.982141666666667	-0.91				56023052877.85	16335318135.43	300193416.63	35325725056.02	54275611054.63	5.237182977262007	-0.20250408838048253	-1.6875340698373547					판정불가	판정불가				보류	일부부족
300750.SZ	300750.SZ	China / Hong Kong	373.0	-12.672957709366173	-1.192052980132452		-18.91304347826087	394.47250137329104	387.02175048828127	N	N	주의	CATL	SHZ	CNY	Industrials	Electrical Equipment & Parts	Electrical Equipment & Parts	Contemporary Amperex Technology Co., Limited, together with its subsidiaries, engages in the research, development, production, and sale of electric vehicle and energy storage system batteries in China and internationally. The company offers power battery systems, including cells, modules/battery boxes, and battery packs, as well as lithium iron phosphate, ternary high-voltage medium-nickel, ternary high-nickel, super hybrid, sodium-ion, and condensed matter batteries; energy storage battery sys	1725740744704.0	1.53	17.55	42.283445583519466	32.94277002353567		451499983000.0	81678369000.0	12935498000.0	119656488000.0	337107747000.0	83.89115359194774	20.614382350614516	5.526644061826948	16.473438541769358	32.94277002353567	0.5000623362880552	2.0926274703443344	헐값	안심(>=2)	60.0	1053.0	182.30563002680964	양호	충분
000858.SZ	000858.SZ	China / Hong Kong	76.4000015258789	-25.40519147456488	-29.193697455551003		-41.19910272255426	77.9667501449585	103.05969989776611	N	N	주의	WULIANGYE	SHZ	CNY	Consumer Defensive	Beverages - Wineries & Distilleries	Beverages - Wineries & Distilleries	Wuliangye Yibin Co.,Ltd. manufactures and sells liquor and wine products and related auxiliary products under the Wuliangye brand in China. The company's Wuliangye products include eighth-generation Wuliangye, 39 -degree Wuliangye, classic Wuliangye, 29 -degree Wuliangye, etc. It also offers other alcoholic beverage products, such as Wuliangchun, Wuliangchun, Wuliangtequ, Jianzhuang, etc. The company was founded in 1997 and is headquartered in Xuzhou, China.	296554856448.0	7.03	3.24	-71.88896273061067	-30.51456952275814		127014443016.86	0.0	364149470.84	408530653.28	119932271234.99	32.72212002171507	7.1462271736452685	9.35370030225017	13.480827624741924	-30.51456952275814		-1.742071790878472	판정불가	불리(<1)	0.0	0.0	-100.0	보류	일부부족
002594.SZ	002594.SZ	China / Hong Kong	91.76000213623047	-11.980813298579884	-6.472325384381971		-19.677867776526327	89.46650047302246	97.11815010070801	Y	N	주의	BYD	SHZ	CNY	Consumer Cyclical	Auto Manufacturers	Auto Manufacturers	BYD Company Limited, together with its subsidiaries, engages in automobiles and batteries business in the People's Republic of China, Hong Kong, Macau, Taiwan, and internationally. It operates in two segments, Mobile Handset Components, Assembly Service and Other Products; and Automobiles and Related Products and Other Products. The Mobile Handset Components, Assembly Service and Other Products segment manufactures and sells mobile handset components, such as housings and electronic components, 	836594040832.0	1.52	2.98	-18.967701027859206	25.196441286638958		184489829000.0	65703479000.0	38484710000.0	119120640000.0	246274606000.0	21.86065060007439	-17.97496278277345	-19.58910458184942	23.456158233609422	25.196441286638958	0.9309313949048684	1.1389947586710087	헐값	보통(1~1.5)	58.892882573277916	175.5007900683682	91.26066475871795	보류	충분
300760.SZ	300760.SZ	China / Hong Kong	146.0	-7.559834276839295	-26.853709651550727		-41.18595038299719	144.1127502441406	184.17920028686524	Y	N	주의	MR	SHZ	CNY	Healthcare	Medical Devices	Medical Devices	Shenzhen Mindray Bio-Medical Electronics Co., Ltd. provides medical devices and solutions in China and internationally. The company offers various products, including patient monitoring, ultrasound, radiology, AED, defibrillation system, anesthesia, CLIA, chemistry, hematology, ventilators, electrocardiograph, endoscope camera system, operating tables, surgical lights, medical supply units, accessories, infusion system, orthopedics, IT Products, cardiovascular intervention, animal medical, and O	177016438784.0	4.43	6.47	-30.275662177520644	-5.39056908556913		18191343800.0	4062631.0	328106.0	349283522.0	38093330471.0	15.000544569826854	6.6866938378384	4.579927286190685	20.247211040212235	-5.39056908556913		-0.047442044420902184	판정불가	불리(<1)	0.0	0.0	-100.0	보류	일부부족
603501.SS	603501.SS	China / Hong Kong	111.12000274658203	17.17810882736135	-13.686501471772605		-26.49334914829066	96.62925033569336	114.63635013580323	Y	N	상승전환/양호	OMNIVISION INTEGRATED CIRCUITS 	SHH	CNY	Technology	Semiconductors	Semiconductors	OmniVision Integrated Circuits Group, Inc., together with its subsidiaries, engages in the design, development, and sale of integrated circuits and computer software and hardware in China and internationally. It operates in two segments, Semiconductor Design and Electronic Components Agency. The company offers image sensors, application-specific integrated circuits, camera cube chips, liquid crystal on silicon, display solutions, in-system programming, and cable modules. It also provides semicon	139733729280.0	68.0	3.04	21.730996944226554	59.85671328521085		13072154645.060001	1617721215.79	2078985512.66	9796924850.61	28172055029.35	9.491875084021855	1.477586990023052	1.3297218804006028	33.43030515215795	59.85671328521085	0.5585055262367332	3.8245751183924686	헐값	안심(>=2)	60.0	182.4	64.14686419327909	양호	충분
688981.SS	688981.SS	China / Hong Kong	153.63999938964844	52.66295739410689	18.230090802419753		-11.190751797891075	142.75900020599366	122.02015003204346	Y	Y	상승전환/양호	SEMICONDUCTOR MANUFACTURING INT	SHH	CNY	Technology	Semiconductors	Semiconductors	Semiconductor Manufacturing International Corporation, an investment holding company, engages in the manufacture, testing, and sale of integrated circuits wafer and various compound semiconductors in the United States, China, and Eurasia. The company is also involved in the manufacturing, sale, and trading of semiconductor products; and research and development activities. In addition, it offers semiconductor foundry and technology services; supporting services comprising design and IP support, 	1315282223104.0		0.61	39.04287790107723	-27.767740812712226		14935414000.0	9994773000.0	2593077000.0	12596181000.0	21439670000.0	1.9399828931885734	-2.045422204880973	-1.3313083916991895	248.68855163354075	-27.767740812712226		-0.11165669119192045	판정불가	불리(<1)	0.0	0.0	-100.0	보류	일부부족
600183.SS	600183.SS	China / Hong Kong	152.42999267578125	140.16068968667432	108.0955531409983		-18.573720533806572	150.18449897766112	81.82519981384277	Y	Y	상승전환/양호	SHENGYI TECHNOLOGY CO LTD	SHH	CNY	Technology	Electronic Components	Electronic Components	Shengyi Technology Co.,Ltd. engages in the design, production, and sales of copper clad laminates, bonding sheets, and printed circuit boards in China and internationally. The company offers flame-retardant epoxy glass fabric reinforced laminates, composite epoxy materials, and flexible circuit materials, as well as prereg for multilayer circuit boards; and smart and rigid materials, automotive and RF materials, IMS and HTC materials, IC substrate and flexible materials, HSD materials, and speci	370253037568.0	81.0	1.63	91.75319663725077	29.622792505245087		3239977726.09	902984683.16	2304818271.34	3676930770.8	16723501226.33	0.9621200131533767	1.1930710788427914	0.782701001226481	92.92507525314595	29.622792505245087	3.1369451491344846	1.1904514707562746	매우 불리	보통(1~1.5)	60.0	97.8	-35.839398609681304	보류	충분
000725.SZ	000725.SZ	China / Hong Kong	6.380000114440918	58.3126496845598	50.827425193212036		-29.890111571506395	6.602000033855438	4.650000013113022	N	Y	상승전환/양호	BOE	SHZ	CNY	Technology	Electronic Components	Electronic Components	BOE Technology Group Company Limited operates display, Internet of Things (IoT) innovation, sensor, and MLED, smart medicine engineering, and other business in Mainland China and internationally. The Display Business segment designs and manufactures display devices, including TFT-LCD, AMOLED, micro displays, and other intelligent interface devices. Its IoT Innovation Business segment designs integrated manufacturing models for system solutions; smart terminal products, such as tablets, laptops, 	236342804480.0	80.0	0.17	10.026166023922677	-8.080747892061046		75564037635.0	112545341525.0	3655021437.0	143558438547.0	134478628806.0	-1.017326958293365	0.24016032744476673	3.764268387725759	43.51368866314284	-8.080747892061046		1.6527960353969333	판정불가	양호(>=1.5)	0.0	0.0	-100.0	보류	일부부족
002916.SZ	002916.SZ	China / Hong Kong	377.2300109863281	40.39599819818061	55.61010388401708		-17.617380210839883	408.47299880981444	271.85744987487794	N	Y	상승전환/양호	SCC	SHZ	CNY	Technology	Electronic Components	Electronic Components	Shennan Circuits Co., Ltd. engages in the design, manufacture, and sale of printed circuit boards, packaging substrates, and electronic assemblies in China and internationally. It operates through Packaging Substrates, Packaging Substrates, and Distribution Substrates segments. The company provides RF and microwave, thermal management, miniaturization, and chip package substrate solutions. It also offers schematic design, PCB / SiP design, PCB / SUB production, electronic assembly, package testi	256956481536.0	59.0	5.24	74.46731868482586	25.905809548765156		1588756438.22	2679204686.22	15009670.83	3557910474.95	17149430529.85	-1.600853970239101	0.10703819865094824	0.02837478343016235	72.29596659476474	25.905809548765156	2.7907240829001942	1.1744197297296188	매우 불리	보통(1~1.5)	60.0	314.40000000000003	-16.655623666327337	보류	충분
601888.SS	601888.SS	China / Hong Kong	54.40999984741211	-21.030480925351412	-39.73862078225417		-43.96498382859052	55.49800004959106	73.40319980621338	N	N	주의	CHINA TOURISM GROUP DUTY FREE C	SHH	CNY	Consumer Cyclical	Specialty Retail	Specialty Retail	China Tourism Group Duty Free Corporation Limited engages in duty-free tourism retail business in China. The company engages in the wholesale and retail of duty-free commodities, such as tobacco, alcohol, cosmetics, watches and jewelry, apparel and bags, and electronic products, as well as food. It is also involved in the investment and development of commercial complexes for duty-free businesses. The company was formerly known as China International Travel Service Corporation Limited and change	113052909568.0	1.37	1.93	-15.957728143438166	-10.667335366687835		33781245387.6	2848679969.93	226682371.28	5029157635.92	55469259598.08	15.842741545586293	2.450990266390758	4.504668761742947	19.983035389547055	-10.667335366687835		-0.4652614172695299	판정불가	불리(<1)	0.0	0.0	-100.0	보류	일부부족
601899.SS	601899.SS	China / Hong Kong	28.829999923706055	-14.34937595247019	-18.559325759830546		-33.64787245689415	28.865000104904176	32.26245007514954	N	N	주의	ZIJIN MINING GROUP CO.LTD	SHH	CNY	Basic Materials	Gold	Gold	Zijin Mining Group Company Limited, together with its subsidiaries, engages in exploration and extraction of metals in Mainland China and internationally. The company offers copper, gold, zinc concentrate, lead concentrate, silver, lithium, iron concentrate, tungsten concentrate, and molybdenum concentrate; smelted copper, smelted and processed gold and silver, smelted zinc ingots, sulfuric acid, and battery -grade lithium carbonate; and copper pipes, copper plates and strips, potassium gold cya	766610309120.0	2.06	2.27	61.54868816202652	37.21424266296107		85546185108.0	105866683144.0	32353609318.0	164492766171.0	185541965085.0	-0.9863460863776055	2.1574441715319543	7.483330479504968	13.134954189464167	37.21424266296107	0.35295503144921564	2.9900555492202474	매우 유망	안심(>=2)	60.0	136.2	372.4245590025367	매우 유망	충분
600276.SS	600276.SS	China / Hong Kong	57.5	4.166665226940958	-8.84591260158718		-20.656824849654498	50.58850011825562	58.27905006408692	Y	N	상승전환/양호	JIANGSU HENGRUI PHARMACEUTICALS	SHH	CNY	Healthcare	Drug Manufacturers - Specialty & Generic	Drug Manufacturers - Specialty & Generic	Jiangsu Hengrui Pharmaceuticals Co.,Ltd, a pharmaceutical company, researches, develops, manufactures, and commercializes medicines to address unmet clinical needs in China and internationally. The company develops medicines in the areas of oncology, metabolic and cardiovascular, immunological and respiratory, neuroscience, pain management, infectious, respiratory system, hematological, ophthalmology, and autoimmune and other diseases. The company was founded in 1970 and is headquartered in Lian	381639000064.0	36.0	1.22	21.69213188913122	25.443053499049604		41183164773.950005	0.0	1260943473.97	74233076.53	61272068641.41	6.456051119750707	1.2969852479550943	2.2556265181827726	41.83930236086008	25.443053499049604	1.6444292884273084	1.468548709754025	보통	보통(1~1.5)	59.38610699809921	72.45105053768103	26.00182702205396	보류	충분
