티커	종목코드	유니버스	현재가	3M수익률(보조,%)	6M수익률(보조,%)	12M수익률(보조,%)	52주고점대비(보조,%)	40일이평(보조)	200일이평(보조)	40일선상회(보조)	200일선상회(보조)	추세판정(보조)	종목명	시장	통화	섹터	산업	업종	사업설명	시가총액	배당수익률(%)	EPS(FY)	EPS Growth 1Y(%)	EPS Growth 3Y CAGR(%)	EPS Growth 5Y CAGR(%)	현금및단기투자	장기부채	단기위험부채	총부채	주주지분	주당순현금(린치식)	주당잉여현금흐름	잉여현금흐름수익률(%)	순현금차감PER(린치식)	사용연성장률(%)	린치PER배수	배당감안점수	린치PER판정	배당감안점수판정	그레이엄적정PER(3년)	그레이엄내재가치(3년)	그레이엄괴리율(3년,%)	종합판정	데이터상태
9866.HK	9866.HK	China / Hong Kong	37.119998931884766	-15.827663908724066	-4.428427430344694		-39.34640773017225	44.28300008773804	45.65145017623902	N	N	주의	NIO-SW	HKG	HKD	Consumer Cyclical	Auto Manufacturers	Auto Manufacturers	NIO Inc. designs, develops, manufactures, and sells smart electric vehicles in China, Europe, and internationally. It offers five and six-seater electric SUVs, as well as smart electric sedans. The company also offers power solutions, including Power Home, a home charging solution; Power Swap, a battery-swapping service; Power Charger and Destination Charger; Power Mobile, a mobile charging service through charging vans; Power Map, an application that provides access to a network of public charg	96282877952.0		-4.34				12045850000.0	8626272000.0	5347881000.0	31263135000.0	4159460000.0	1.4507151882256395	-1.3035198487517274	-3.5116376246230168					판정불가	판정불가				보류	일부부족
0981.HK	0981.HK	China / Hong Kong	80.0	47.73776130323299	26.08352882278804		-12.13619185215885	76.43125	70.3737498664856	Y	Y	상승전환/양호	SMIC	HKG	HKD	Technology	Semiconductors	Semiconductors	Semiconductor Manufacturing International Corporation, an investment holding company, engages in the manufacture, testing, and sale of integrated circuits wafer and various compound semiconductors in the United States, China, and Eurasia. The company is also involved in the manufacturing, sale, and trading of semiconductor products; and research and development activities. In addition, it offers semiconductor foundry and technology services; supporting services comprising design and IP support, 	725945483264.0		0.7	39.04287790107723	-27.767740812712226		14935414000.0	9994773000.0	2593077000.0	12596181000.0	21439670000.0	0.8215323866324047	-0.8661831975667024	-1.082728996958378	113.11209659052516	-27.767740812712226		-0.24548869351466157	판정불가	불리(<1)	0.0	0.0	-100.0	보류	일부부족
1347.HK	1347.HK	China / Hong Kong	189.5	127.49098806425691	185.8220079598862		-1.7116198130307736	143.26250076293945	95.09915023803711	Y	Y	상승전환/양호	HUA HONG GRACE	HKG	HKD	Technology	Semiconductors	Semiconductors	Hua Hong Grace Semiconductor Limited, an investment holding company, engages in the manufacture and sale of semiconductor products in China, North America, Asia, and Europe. The company offers embedded non-volatile memory; standalone non-volatile memory, including NOR flash and EEPROM; power discrete devices; analog and power management platform; and specialty logic RF processes and image sensors. It also provides design services which covers design methodologies and design flow support, standar	354820816896.0	0.5725593667546174	0.25	-5.5534521924692	-50.40573254396763		4893808000.0	2787096000.0	403748000.0	3209752000.0	6612663000.0	1.5841557439391858	-0.8751683112652993	-0.4618302434117674	751.6633770242432	-50.40573254396763		-0.0662971945959338	판정불가	불리(<1)	0.0	0.0	-100.0	보류	일부부족
1876.HK	1876.HK	China / Hong Kong	6.320000171661377	-10.354609919484192	-19.38775448141771		-28.6681668559843	7.241000032424926	7.75010000705719	N	N	주의	BUD APAC	HKG	HKD	Consumer Defensive	Beverages - Brewers	Beverages - Brewers	Budweiser Brewing Company APAC Limited, an investment holding company, engages in brewing and distribution of beer in South Korea, Japan, New Zealand, China, India, Vietnam, Southeast Asia, and internationally. It brews, imports, markets, distributes, and sells a portfolio of beer brands, including Budweiser, Stella Artois, Corona, Harbin, Hoegaarden, and Cass. The company was founded in 1876 and is headquartered in Causeway Bay, Hong Kong. Budweiser Brewing Company APAC Limited operates as a su	84273627136.0	7.0	0.29	-32.64462809917356	-18.789404729568137		2970000000.0	77000000.0	178000000.0	277000000.0	10262000000.0	0.21867350814101938	0.04867809859758607	0.7702230581552304	21.039057460415027	-18.789404729568137		-0.5603580270527753	판정불가	불리(<1)	0.0	0.0	-100.0	보류	일부부족
0020.HK	0020.HK	China / Hong Kong	1.2799999713897705	-31.55080384353698	-36.000001430511475		-55.70934515823445	1.718999993801117	2.1647000026702883	N	N	주의	SENSETIME-W	HKG	HKD	Technology	Software - Application	Software - Application	SenseTime Group Inc., an investment holding company, research, develops and sells artificial intelligence software platforms in Mainland China, Northeast Asia, Southeast Asia, and internationally. The company offers SenseFoundry Enterprise Platform that facilitate and accelerate the digital transformation of enterprise customers; SenseFoundry Platform for smart city management; SenseME that enables a range of IoT devices to facilitate perceptial intelligence and content enhancement; SenseMARS, a	54292234240.0		-0.06				16596316000.0	3710335000.0	2014279000.0	5962982000.0	26718959000.0	0.3220952009870681	-0.09470465227907975	-7.3988011246791965					판정불가	판정불가				보류	일부부족
2269.HK	2269.HK	China / Hong Kong	33.040000915527344	1.9753066651470697	3.056767000180982		-21.66903585471738	32.50950002670288	35.267600002288816	Y	N	상승전환/양호	WUXI BIO	HKG	HKD	Healthcare	Biotechnology	Biotechnology	WuXi Biologics (Cayman) Inc., an investment holding company, provides end-to-end solutions and services for biologics discovery, development, and manufacturing for biologics industry in the People's Republic of China, North America, Europe, Singapore, Japan, South Korea, Australia, and Brazil. It operates through two segments: Biologics and XDC. The company provides a suite of solutions for biologic discovery, from concept to IND, that seamlessly transits to CMC and downstream process developmen	144947740672.0		1.34	46.25222096844504	3.552720117093622		22251738000.0	169381000.0	873517000.0	3104066000.0	47248676000.0	5.37480254543447	0.6341013196994106	1.9191928030528926	20.645670425442443	3.552720117093622	5.811229070961006	0.17208063695114836	매우 불리	불리(<1)	15.605440234187244	20.911289913810908	-36.70917271680969	보류	충분
2388.HK	2388.HK	China / Hong Kong	45.560001373291016	13.220674634492013	19.580060886976213		-6.90641060127316	46.89849977493286	41.222600021362304	N	Y	상승전환/양호	BOC HONG KONG	HKG	HKD	Financial Services	Banks - Regional	Banks - Regional	BOC Hong Kong (Holdings) Limited, an investment holding company, provides banking and related financial services to corporate and individual customers in Hong Kong, China, and internationally. The company operates through four segments: Personal Banking, Corporate Banking, Treasury, and Insurance. It offers savings, current, and time deposit accounts, as well as monthly deposit plans; mortgage plans; corporate deposits, and payroll and e-cheque services. The company also offers cross-border fina	460973211648.0	7.78	3.8	4.938142442392701	13.652075841362565		678118000000.0	0.0	0.0	88602000000.0	358528000000.0	64.13809640787629	-8.378874597903234	-18.39085677204401	-4.888972377522441	13.652075841362565	-0.3581120141971384		판정불가	판정불가	35.804151682725134	136.0557763943555	198.62987772892495	보류	충분
600519.SS	600519.SS	China / Hong Kong	1168.6300048828125	-16.96119308374896	-18.04838675436098		-24.846945023613344	1297.8057525634765	1411.956002807617	N	N	주의	KWEICHOW MOUTAI	SHH	CNY	Consumer Defensive	Beverages - Wineries & Distilleries	Beverages - Wineries & Distilleries	Kweichow Moutai Co., Ltd., together with its subsidiaries, produces and sells liquor products in China and internationally. The company offers liquor and soy sauce products under the Kweichow Moutai, Moutai Wangzi liquor, Moutai 1935 liquor, Han Jiang liquor, and Lai Mao liquor brands. It also engages in the production and sale of beverage, food, and packaging materials; development of anti-counterfeiting technology; research and development of information industry related products; operation an	1493797568512.0	4.45	66.03	-4.532254817158088	9.489481701387037		51939124226.5	0.0	44206237.05	233711179.82	244637811032.18	41.5485870561981	46.71263861993278	3.997213696786522	17.06923243717423	9.489481701387037	1.7987528691560986	0.8166437332606086	보통	불리(<1)	27.478963402774074	1814.4359534851721	55.26179765229624	보류	충분
601318.SS	601318.SS	China / Hong Kong	47.22999954223633	-18.73709495833139	-29.591535102834175		-36.45048474680562	54.434750175476076	59.93290016174316	N	N	주의	PING AN INSURANCE(GROUP)CO.OF C	SHH	CNY	Financial Services	Insurance - Life	Insurance - Life	Ping An Insurance (Group) Company of China, Ltd. provides financial products and services in the People's Republic of China. It operates through Life and Health Insurance; Property and Casualty Insurance; Banking; Asset Management; and Finance Enablement segments. The company offers life insurance products, including term, whole-life, endowment, annuity, investment-linked, universal life, and health care and medical insurance; property and casualty insurance, such as auto insurance, non-auto ins	880031367168.0	5.72	7.25	6.453829567085556	6.681286200386016		1018674000000.0	1345587000000.0	84520000000.0	1438514000000.0	1000419000000.0	-30.66707355486415	61.00122231308144	129.15778722066244	10.744423875462134	6.681286200386016	1.6081370492468003	1.1542067163515193	보통	보통(1~1.5)	21.86257240077203	158.50364990559723	235.59951607421107	보류	충분
600036.SS	600036.SS	China / Hong Kong	36.0	-8.280254777070063	-13.87559651416973		-25.37313692493184	37.87275009155273	40.296499977111814	N	N	주의	CHINA MERCHANTS BANK CO LTD	SHH	CNY	Financial Services	Banks - Regional	Banks - Regional	China Merchants Bank Co., Ltd., together with its subsidiaries, provides various banking products and services. It operates through Wholesale Finance Business, Retail Finance Business, and Other Business segments. It offers current, demand, time, call, savings, notice, and renminbi accounts. The company also offers loan products include personal commercial real estate, consumption, housing, and car loans; loans to finance for studying abroad; micro-business loans; mortgage loans for equipment; j	918506766336.0	8.37	5.71	1.2062726176115701	2.8567302131919714		1321522000000.0	0.0	0.0	405441000000.0	1272875000000.0	64.06154248698326	20.520487679675256	57.0013546657646	-4.914455777054861	2.8567302131919714	-1.7203079781074906		판정불가	판정불가	14.213460426383943	81.15885903465231	125.4412750962564	보류	충분
601012.SS	601012.SS	China / Hong Kong	12.670000076293945	-33.45588515197281	-29.61111068725586		-44.429822367277396	14.469749999046325	17.68220003604889	N	N	주의	LONGI GREEN ENERGY TECHNOLOGY C	SHH	CNY	Technology	Semiconductor Equipment & Materials	Semiconductor Equipment & Materials	LONGi Green Energy Technology Co., Ltd. manufactures and sells monocrystalline silicon wafers, solar modules, and green hydrogen equipment in China, Europe, the Asia Pacific, and the United States. The company offers monocrystalline silicon wafers, including tere, p-type, and n-type silicon wafers; high conversion rate components comprising Hi-MO X10, Hi-MO 9, Hi-MO 7, Hi-MO X6 Max, Hi-MO X6, Hi-MO 5m, and Hi-MO 5; green hydrogen production equipment that include ALK Hi1 and ALK G; and building 	97075027968.0	7.560039417775435	-0.91				56023052877.85	16335318135.43	300193416.63	35325725056.02	54275611054.63	5.237185108606886	-0.20250417079235428	-1.5982965238591225					판정불가	판정불가				보류	일부부족
300750.SZ	300750.SZ	China / Hong Kong	381.0	-4.027806903880582	-1.1673151750972721		-17.17391304347826	414.3370018005371	382.624100189209	N	N	주의	CONTEMPORARY AMPEREX TECHNOLOGY	SHZ	CNY	Industrials	Electrical Equipment & Parts	Electrical Equipment & Parts	Contemporary Amperex Technology Co., Limited, together with its subsidiaries, engages in the research, development, production, and sale of electric vehicle and energy storage system batteries in China and internationally. The company offers power battery systems, including cells, modules/battery boxes, and battery packs, as well as lithium iron phosphate, ternary high-voltage medium-nickel, ternary high-nickel, super hybrid, sodium-ion, and condensed matter batteries; energy storage battery sys	1815303290880.0	1.46	17.53	42.283445583519466	32.94277002353567		451499983000.0	81678369000.0	12935498000.0	119656488000.0	337107747000.0	83.89160443540341	20.61449313535137	5.410628119514795	16.948567915835515	32.94277002353567	0.5144852088554411	2.0298334463640564	헐값	안심(>=2)	60.0	1051.8000000000002	176.0629921259843	양호	충분
000858.SZ	000858.SZ	China / Hong Kong	73.16999816894531	-27.797512519163824	-34.93108034264905		-43.68505942155411	83.91524963378906	106.60369987487793	N	N	주의	WULIANGYE YIBIN CO. LTD.	SHZ	CNY	Consumer Defensive	Beverages - Wineries & Distilleries	Beverages - Wineries & Distilleries	Wuliangye Yibin Co.,Ltd. manufactures and sells liquor and wine products and related auxiliary products under the Wuliangye brand in China. The company's Wuliangye products include eighth-generation Wuliangye, 39 -degree Wuliangye, classic Wuliangye, 29 -degree Wuliangye, etc. It also offers other alcoholic beverage products, such as Wuliangchun, Wuliangchun, Wuliangtequ, Jianzhuang, etc. The company was founded in 1997 and is headquartered in Xuzhou, China.	287238979584.0	7.85	3.25	-71.88896273061067	-30.51456952275814		127014443016.86	0.0	364149470.84	408530653.28	119932271234.99	32.72212002171507	7.1462271736452685	9.766608381135997	12.445500968378536	-30.51456952275814		-1.8211054404595013	판정불가	불리(<1)	0.0	0.0	-100.0	보류	일부부족
002594.SZ	002594.SZ	China / Hong Kong	78.19999694824219	-26.669169733854037	-18.14090029571991		-31.547620438950652	93.85325050354004	98.56864994049073	N	N	주의	BYD COMPANY LIMITED	SHZ	CNY	Consumer Cyclical	Auto Manufacturers	Auto Manufacturers	BYD Company Limited, together with its subsidiaries, engages in automobiles and batteries business in the People's Republic of China, Hong Kong, Macau, Taiwan, and internationally. It operates in two segments, Mobile Handset Components, Assembly Service and Other Products; and Automobiles and Related Products and Other Products. The Mobile Handset Components, Assembly Service and Other Products segment manufactures and sells mobile handset components, such as housings and electronic components, 	726093594624.0	1.69	1.95	-18.967701027859206	25.196441286638958		184489829000.0	65703479000.0	38484710000.0	119120640000.0	246274606000.0	21.86065060007439	-17.97496278277345	-22.98588680850006	28.891972486239894	25.196441286638958	1.1466687758624303	0.930585175499662	보통	불리(<1)	58.892882573277916	114.84112101789194	46.85565920661252	보류	충분
300760.SZ	300760.SZ	China / Hong Kong	133.97999572753906	-19.468654409007836	-31.993300104939514		-46.028040298593794	152.40299949645996	190.86235023498534	N	N	주의	SHENZHEN MINDRAY BIO-MEDICAL EL	SHZ	CNY	Healthcare	Medical Devices	Medical Devices	Shenzhen Mindray Bio-Medical Electronics Co., Ltd. provides medical devices and solutions in China and internationally. The company offers various products, including patient monitoring, ultrasound, radiology, AED, defibrillation system, anesthesia, CLIA, chemistry, hematology, ventilators, electrocardiograph, endoscope camera system, operating tables, surgical lights, medical supply units, accessories, infusion system, orthopedics, IT Products, cardiovascular intervention, animal medical, and O	166698565632.0	4.62	6.47	-30.275662177520644	-5.39056908556913		18191343800.0	4062631.0	328106.0	349283522.0	38093330471.0	15.000544569826854	6.6866938378384	4.990815085138846	18.389405124839598	-5.39056908556913		-0.041902882683696976	판정불가	불리(<1)	0.0	0.0	-100.0	보류	일부부족
603501.SS	603501.SS	China / Hong Kong	86.72000122070312	-13.26265422185634	-30.250140799851156		-42.63411902420865	96.76100044250488	116.98785011291504	N	N	주의	OMNIVISION INTEGRATED CIRCUITS 	SHH	CNY	Technology	Semiconductors	Semiconductors	OmniVision Integrated Circuits Group, Inc., together with its subsidiaries, engages in the design, development, and sale of integrated circuits and computer software and hardware in China and internationally. It operates in two segments, Semiconductor Design and Electronic Components Agency. The company offers image sensors, application-specific integrated circuits, camera cube chips, liquid crystal on silicon, display solutions, in-system programming, and cable modules. It also provides semicon	111380602880.0	83.0	3.04	21.730996944226554	59.85671328521085		13072154645.060001	1617721215.79	2078985512.66	9796924850.61	28172055029.35	9.461412779849878	1.4728449655092226	1.6983913108589794	25.41400935554383	59.85671328521085	0.42458076898490543	5.621179692138894	매우 유망	안심(>=2)	60.0	182.4	110.33210036031997	매우 유망	충분
688981.SS	688981.SS	China / Hong Kong	148.75999450683594	49.88412544769365	31.63436129087922		-5.16384423817291	131.48949947357178	119.20869998931884	Y	Y	상승전환/양호	SEMICONDUCTOR MANUFACTURING INT	SHH	CNY	Technology	Semiconductors	Semiconductors	Semiconductor Manufacturing International Corporation, an investment holding company, engages in the manufacture, testing, and sale of integrated circuits wafer and various compound semiconductors in the United States, China, and Eurasia. The company is also involved in the manufacturing, sale, and trading of semiconductor products; and research and development activities. In addition, it offers semiconductor foundry and technology services; supporting services comprising design and IP support, 	1292662341632.0		0.61	39.04287790107723	-27.767740812712226		14935414000.0	9994773000.0	2593077000.0	12596181000.0	21439670000.0	1.9399828931885734	-2.045422204880973	-1.374981366234845	240.6885436289301	-27.767740812712226		-0.11536793731039312	판정불가	불리(<1)	0.0	0.0	-100.0	보류	일부부족
600183.SS	600183.SS	China / Hong Kong	178.5	213.8185595078343	201.9282869163431		-4.647434342986445	127.8904993057251	74.98399988174438	Y	Y	상승전환/양호	SHENGYI TECHNOLOGY CO LTD	SHH	CNY	Technology	Electronic Components	Electronic Components	Shengyi Technology Co.,Ltd. engages in the design, production, and sales of copper clad laminates, bonding sheets, and printed circuit boards in China and internationally. The company offers flame-retardant epoxy glass fabric reinforced laminates, composite epoxy materials, and flexible circuit materials, as well as prereg for multilayer circuit boards; and smart and rigid materials, automotive and RF materials, IMS and HTC materials, IC substrate and flexible materials, HSD materials, and speci	415768051712.0	67.0	1.62	91.75319663725077	29.622792505245087		3239977726.09	902984683.16	2304818271.34	3676930770.8	16723501226.33	0.962074242411724	1.1930143211125952	0.6683553619678404	109.59131219604214	29.622792505245087	3.699560471101353	0.8816647101770407	매우 불리	불리(<1)	60.0	97.2	-45.54621848739495	보류	충분
000725.SZ	000725.SZ	China / Hong Kong	7.789999961853027	94.74999904632568	88.61984857130123		0.0	5.417250001430512	4.409550007581711	Y	Y	상승전환/양호	BOE TECHNOLOGY GROUP	SHZ	CNY	Technology	Electronic Components	Electronic Components	BOE Technology Group Company Limited operates display, Internet of Things (IoT) innovation, sensor, and MLED, smart medicine engineering, and other business in Mainland China and internationally. The Display Business segment designs and manufactures display devices, including TFT-LCD, AMOLED, micro displays, and other intelligent interface devices. Its IoT Innovation Business segment designs integrated manufacturing models for system solutions; smart terminal products, such as tablets, laptops, 	294502400000.0	72.0	0.17	10.026166023922677	-8.080747892061046		75564037635.0	112545341525.0	3655021437.0	143558438547.0	134478628806.0	-1.017326958293365	0.24016032744476673	3.0829310477639487	51.80780541262583	-8.080747892061046		1.2337764859725462	판정불가	보통(1~1.5)	0.0	0.0	-100.0	보류	일부부족
002916.SZ	002916.SZ	China / Hong Kong	433.5	84.44453995299335	114.83794361311008		-5.212751241699232	376.43649826049807	256.0957498931885	Y	Y	상승전환/양호	SHENNAN CIRCUITS CO LTD	SHZ	CNY	Technology	Electronic Components	Electronic Components	Shennan Circuits Co., Ltd. engages in the design, manufacture, and sale of printed circuit boards, packaging substrates, and electronic assemblies in China and internationally. It operates through Packaging Substrates, Packaging Substrates, and Distribution Substrates segments. The company provides RF and microwave, thermal management, miniaturization, and chip package substrate solutions. It also offers schematic design, PCB / SiP design, PCB / SUB production, electronic assembly, package testi	295735296000.0	55.00000000000001	5.2	74.46731868482586	25.905809548765156		1588756438.22	2679204686.22	15009670.83	3557910474.95	17149430529.85	-1.600853970239101	0.10703819865094824	0.02469162598637791	83.6732411481229	25.905809548765156	3.229902581913767	0.9669257272530094	매우 불리	불리(<1)	60.0	312.0	-28.02768166089965	보류	충분
601888.SS	601888.SS	China / Hong Kong	53.31999969482422	-24.71053385401096	-32.86325746142699		-45.087538071347176	58.55275001525879	74.51349979400635	N	N	주의	CHINA TOURISM GROUP DUTY FREE C	SHH	CNY	Consumer Cyclical	Specialty Retail	Specialty Retail	China Tourism Group Duty Free Corporation Limited engages in duty-free tourism retail business in China. The company engages in the wholesale and retail of duty-free commodities, such as tobacco, alcohol, cosmetics, watches and jewelry, apparel and bags, and electronic products, as well as food. It is also involved in the investment and development of commercial complexes for duty-free businesses. The company was formerly known as China International Travel Service Corporation Limited and change	111369895936.0	2.44	1.93	-15.957728143438166	-10.667335366687835		33781245387.6	2848679969.93	226682371.28	5029157635.92	55469259598.08	15.842741545586293	2.450990266390758	4.5967559647767136	19.418268471107734	-10.667335366687835		-0.42369047368611745	판정불가	불리(<1)	0.0	0.0	-100.0	보류	일부부족
601899.SS	601899.SS	China / Hong Kong	25.100000381469727	-22.04969010324206	-20.089141982158488		-42.23245122960114	30.894500017166138	32.06295006752014	N	N	주의	ZIJIN MINING GROUP CO.LTD	SHH	CNY	Basic Materials	Gold	Gold	Zijin Mining Group Company Limited, together with its subsidiaries, engages in exploration and extraction of metals in Mainland China and internationally. The company offers copper, gold, zinc concentrate, lead concentrate, silver, lithium, iron concentrate, tungsten concentrate, and molybdenum concentrate; smelted copper, smelted and processed gold and silver, smelted zinc ingots, sulfuric acid, and battery -grade lithium carbonate; and copper pipes, copper plates and strips, potassium gold cya	685774536704.0	2.39	2.27	61.54868816202652	37.21424266296107		85546185108.0	105866683144.0	32353609318.0	164492766171.0	185541965085.0	-0.9863460863776055	2.1574441715319543	8.59539497507221	11.491782584954771	37.21424266296107	0.3088006570235115	3.446309775718485	매우 유망	안심(>=2)	60.0	136.2	442.62947382483196	매우 유망	충분
600276.SS	600276.SS	China / Hong Kong	48.66999816894531	-9.265475908380127	-20.707075070046432		-32.841179316771786	50.323000240325925	59.16745008468628	N	N	주의	JIANGSU HENGRUI PHARMACEUTICALS	SHH	CNY	Healthcare	Drug Manufacturers - Specialty & Generic	Drug Manufacturers - Specialty & Generic	Jiangsu Hengrui Pharmaceuticals Co.,Ltd, a pharmaceutical company, researches, develops, manufactures, and commercializes medicines to address unmet clinical needs in China and internationally. The company develops medicines in the areas of oncology, metabolic and cardiovascular, immunological and respiratory, neuroscience, pain management, infectious, respiratory system, hematological, ophthalmology, and autoimmune and other diseases. The company was founded in 1970 and is headquartered in Lian	351307005952.0	41.0	1.22	21.69213188913122	25.443053499049604		41183164773.950005	0.0	1260943473.97	74233076.53	61272068641.41	6.456051119750707	1.2969852479550943	2.6648557566263826	34.60159594196279	25.443053499049604	1.3599623937926828	1.9202308936990777	보통	양호(>=1.5)	59.38610699809921	72.45105053768103	48.86183123776981	보류	충분
