티커	종목코드	유니버스	현재가	3M수익률(보조,%)	6M수익률(보조,%)	12M수익률(보조,%)	52주고점대비(보조,%)	40일이평(보조)	200일이평(보조)	40일선상회(보조)	200일선상회(보조)	추세판정(보조)	종목명	시장	통화	섹터	산업	업종	사업설명	시가총액	배당수익률(%)	EPS(FY)	EPS Growth 1Y(%)	EPS Growth 3Y CAGR(%)	EPS Growth 5Y CAGR(%)	현금및단기투자	장기부채	단기위험부채	총부채	주주지분	주당순현금(린치식)	주당잉여현금흐름	잉여현금흐름수익률(%)	순현금차감PER(린치식)	사용연성장률(%)	린치PER배수	배당감안점수	린치PER판정	배당감안점수판정	그레이엄적정PER(3년)	그레이엄내재가치(3년)	그레이엄괴리율(3년,%)	종합판정	데이터상태
9866.HK	9866.HK	China / Hong Kong	48.31999969482422	35.73034203905865	-14.250220047449824		-21.04575311690994	48.562250232696535	45.182850189208985	N	Y	상승전환/양호	NIO-SW	HKG	HKD	Consumer Cyclical	Auto Manufacturers	Auto Manufacturers	NIO Inc. designs, develops, manufactures, and sells smart electric vehicles in China, Europe, and internationally. It offers five and six-seater electric SUVs, as well as smart electric sedans. The company also offers power solutions, including Power Home, a home charging solution; Power Swap, a battery-swapping service; Power Charger and Destination Charger; Power Mobile, a mobile charging service through charging vans; Power Map, an application that provides access to a network of public charg	121726541824.0		-7.89				12045850000.0	8626272000.0	5347881000.0	31263135000.0	4159460000.0	1.4507151882256395	-1.3035198487517274	-2.6976818232293023					판정불가	판정불가				보류	일부부족
0981.HK	0981.HK	China / Hong Kong	74.1500015258789	7.854547674005685	3.201117746141957		-18.56123114710059	61.85875043869019	66.61829986572266	Y	Y	상승전환/양호	SMIC	HKG	HKD	Technology	Semiconductors	Semiconductors	Semiconductor Manufacturing International Corporation, an investment holding company, engages in the manufacture, testing, and sale of integrated circuits wafer and various compound semiconductors in the United States, China, and Eurasia. The company is also involved in the manufacturing, sale, and trading of semiconductor products; and research and development activities. In addition, it offers semiconductor foundry and technology services; supporting services comprising design and IP support, 	594173231104.0		0.7	39.04287790107723	-27.767740812712226		14935414000.0	9994773000.0	2593077000.0	12596181000.0	21439670000.0	0.821583099937418	-0.866236667172296	-1.1682220490177238	104.75488346563071	-27.767740812712226		-0.26507347337007553	판정불가	불리(<1)	0.0	0.0	-100.0	보류	일부부족
1347.HK	1347.HK	China / Hong Kong	129.8000030517578	26.75781359139362	71.24010267272374		-8.2036713899851	99.90625019073487	79.5648000717163	Y	Y	상승전환/양호	HUA HONG SEMI	HKG	HKD	Technology	Semiconductors	Semiconductors	Hua Hong Semiconductor Limited, an investment holding company, engages in the manufacture and sale of semiconductor products in China, North America, Asia, and Europe. The company offers embedded non-volatile memory; standalone non-volatile memory, including NOR flash and EEPROM; power discrete devices; analog and power management platform; and specialty logic RF processes and image sensors. It also provides design services which covers design methodologies and design flow support, standard and 	225542324224.0	0.8359013670957741	0.25	-5.5534521924692	-50.40573254396763		4893808000.0	2787096000.0	403748000.0	3209752000.0	6612663000.0	1.5841557439391858	-0.8751683112652993	-0.674243675415266	512.8633892312745	-50.40573254396763		-0.09665308972662594	판정불가	불리(<1)	0.0	0.0	-100.0	보류	일부부족
1876.HK	1876.HK	China / Hong Kong	7.889999866485596	-0.8793991372602061	1.6752530124924059		-11.348312307135433	7.55250004529953	7.9727500057220455	Y	N	중립	BUD APAC	HKG	HKD	Consumer Defensive	Beverages - Brewers	Beverages - Brewers	Budweiser Brewing Company APAC Limited, an investment holding company, engages in brewing and distribution of beer in South Korea, Japan, New Zealand, China, India, Vietnam, Southeast Asia, and internationally. It brews, imports, markets, distributes, and sells a portfolio of beer brands, including Budweiser, Stella Artois, Corona, Harbin, Hoegaarden, and Cass. The company was founded in 1876 and is headquartered in Causeway Bay, Hong Kong. Budweiser Brewing Company APAC Limited operates as a su	104382873600.0	5.5	0.29	-32.64462809917356	-18.789404729568137		2970000000.0	77000000.0	178000000.0	277000000.0	10262000000.0	0.21867350814101938	0.04867809859758607	0.6169594349976651	26.45284951153302	-18.789404729568137		-0.5023808389252797	판정불가	불리(<1)	0.0	0.0	-100.0	보류	일부부족
0020.HK	0020.HK	China / Hong Kong	1.9800000190734863	-16.4556913636135	-12.389379317314775		-31.48789110029675	1.9874999850988389	2.1809000033140182	N	N	주의	SENSETIME-W	HKG	HKD	Technology	Software - Application	Software - Application	SenseTime Group Inc., an investment holding company, research, develops and sells artificial intelligence software platforms in Mainland China, Northeast Asia, Southeast Asia, and internationally. The company offers SenseFoundry Enterprise Platform that facilitate and accelerate the digital transformation of enterprise customers; SenseFoundry Platform for smart city management; SenseME that enables a range of IoT devices to facilitate perceptial intelligence and content enhancement; SenseMARS, a	80222855168.0		-0.06				16596316000.0	3710335000.0	2014279000.0	5962982000.0	26718959000.0	0.3220952009870681	-0.09470465227907975	-4.783063200342568					판정불가	판정불가				보류	일부부족
2269.HK	2269.HK	China / Hong Kong	33.86000061035156	-7.385122159519241	-2.6451932180427518		-19.724987279820617	34.23950023651123	35.10085000991821	N	N	주의	WUXI BIO	HKG	HKD	Healthcare	Biotechnology	Biotechnology	WuXi Biologics (Cayman) Inc., an investment holding company, provides end-to-end solutions and services for biologics discovery, development, and manufacturing for biologics industry in the People's Republic of China, North America, Europe, Singapore, Japan, South Korea, Australia, and Brazil. It operates through two segments: Biologics and XDC. The company provides a suite of solutions for biologic discovery, from concept to IND, that seamlessly transits to CMC and downstream process developmen	139962990592.0		1.33	46.25222096844504	3.552720117093622		22251738000.0	169381000.0	873517000.0	3104066000.0	47248676000.0	5.3421881934641995	0.6302535869779441	1.8613513751245037	21.44196422322358	3.552720117093622	6.035365442962232	0.16569004966651824	매우 불리	불리(<1)	15.605440234187244	20.755235511469035	-38.70279049810821	보류	충분
2388.HK	2388.HK	China / Hong Kong	46.36000061035156	12.034798003119418	20.10363327198852		0.0	43.44100017547608	39.56905012130737	Y	Y	상승전환/양호	BOC HONG KONG	HKG	HKD	Financial Services	Banks - Regional	Banks - Regional	BOC Hong Kong (Holdings) Limited, an investment holding company, provides banking and related financial services to corporate and individual customers in Hong Kong, China, and internationally. The company operates through four segments: Personal Banking, Corporate Banking, Treasury, and Insurance. It offers savings, current, and time deposit accounts, as well as monthly deposit plans; mortgage plans; corporate deposits, and payroll and e-cheque services. The company also offers cross-border fina	490154098688.0	7.67	3.8	4.938142442392701	13.652075841362565		678118000000.0	0.0	0.0	88602000000.0	358528000000.0	64.13809640787629	-8.378874597903234	-18.073499757530946	-4.678446262506507	13.652075841362565	-0.34269120072801823		판정불가	판정불가	35.804151682725134	136.0557763943555	193.47664927333085	보류	충분
600519.SS	600519.SS	China / Hong Kong	1344.0899658203125	-4.062100940734292	-6.008352624006774		-17.79215934969499	1423.700503540039	1437.1390020751953	N	N	주의	KWEICHOW MOUTAI	SHH	CNY	Consumer Defensive	Beverages - Wineries & Distilleries	Beverages - Wineries & Distilleries	Kweichow Moutai Co., Ltd., together with its subsidiaries, produces and sells liquor products in China and internationally. The company offers liquor and soy sauce products under the Kweichow Moutai, Moutai Wangzi liquor, Moutai 1935 liquor, Han Jiang liquor, and Lai Mao liquor brands. It also engages in the production and sale of beverage, food, and packaging materials; development of anti-counterfeiting technology; research and development of information industry related products; operation an	1683163840512.0	3.81	66.1	-4.532254817158088	9.489481701387037		51939124226.5	0.0	44206237.05	233711179.82	244637811032.18	41.47597188239441	46.630998145188656	3.4693360809913685	19.70671700359937	9.489481701387037	2.0766905531541227	0.6748704869998351	매우 불리	불리(<1)	27.478963402774074	1816.3594809233662	35.13674881240725	보류	충분
601318.SS	601318.SS	China / Hong Kong	58.040000915527344	-13.048687767000233	0.3631317271719059		-21.90527293614971	58.662500095367434	60.80365016937256	N	N	중립	PING AN INSURANCE(GROUP)CO.OF C	SHH	CNY	Financial Services	Insurance - Life	Insurance - Life	Ping An Insurance (Group) Company of China, Ltd. provides financial products and services in the People's Republic of China. It operates through Life and Health Insurance; Property and Casualty Insurance; Banking; Asset Management; and Finance Enablement segments. The company offers life insurance products, including term, whole-life, endowment, annuity, investment-linked, universal life, and health care and medical insurance; property and casualty insurance, such as auto insurance, non-auto ins	1050967539712.0	4.55	7.25	6.453829567085556	6.681286200386016		1018674000000.0	1345587000000.0	84520000000.0	1438514000000.0	1000419000000.0	-30.66707355486415	61.00122231308144	105.10203540806955	12.235458547640205	6.681286200386016	1.83130286305252	0.91792932456562	보통	불리(<1)	21.86257240077203	158.50364990559723	173.09381014015975	보류	충분
600036.SS	600036.SS	China / Hong Kong	37.880001068115234	-2.0429199333774517	-7.361209015559933		-21.47595408350913	39.24449996948242	41.32749992370606	N	N	주의	CHINA MERCHANTS BANK CO LTD	SHH	CNY	Financial Services	Banks - Regional	Banks - Regional	China Merchants Bank Co., Ltd., together with its subsidiaries, provides various banking products and services. It operates through Wholesale Finance Business, Retail Finance Business, and Other Business segments. It offers current, demand, time, call, savings, notice, and renminbi accounts. The company also offers loan products include personal commercial real estate, consumption, housing, and car loans; loans to finance for studying abroad; micro-business loans; mortgage loans for equipment; j	955327774720.0	7.95	5.71	1.2062726176115701	2.8567302131919714		1321522000000.0	0.0	0.0	405441000000.0	1272875000000.0	64.06154248698326	20.520487679675256	54.172352431499746	-4.585208654792999	2.8567302131919714	-1.6050548398372242		판정불가	판정불가	14.213460426383943	81.15885903465231	114.25252572911417	보류	충분
601012.SS	601012.SS	China / Hong Kong	16.780000686645508	-6.152117034405558	-20.511604919531756		-26.403503297621857	17.585250091552734	18.039350032806396	N	N	주의	LONGI GREEN ENERGY TECHNOLOGY C	SHH	CNY	Technology	Semiconductor Equipment & Materials	Semiconductor Equipment & Materials	LONGi Green Energy Technology Co., Ltd. manufactures and sells monocrystalline silicon wafers, solar modules, and green hydrogen equipment in China, Europe, the Asia Pacific, and the United States. The company offers monocrystalline silicon wafers, including tere, p-type, and n-type silicon wafers; high conversion rate components comprising Hi-MO X10, Hi-MO 9, Hi-MO 7, Hi-MO X6 Max, Hi-MO X6, Hi-MO 5m, and Hi-MO 5; green hydrogen production equipment that include ALK Hi1 and ALK G; and building 	127159951360.0	5.708325153778556	-0.91				56023052877.85	16335318135.43	300193416.63	35325725056.02	54275611054.63	5.237185108606886	-0.20250417079235428	-1.2068186084969517					판정불가	판정불가				보류	일부부족
300750.SZ	300750.SZ	China / Hong Kong	434.04998779296875	24.0142822265625	11.64698923756291		-5.641307001528528	420.5564994812012	362.2144500732422	Y	Y	상승전환/양호	CONTEMPORARY AMPEREX TECHNOLOGY	SHZ	CNY	Industrials	Electrical Equipment & Parts	Electrical Equipment & Parts	Contemporary Amperex Technology Co., Limited, together with its subsidiaries, engages in the research, development, production, and sale of electric vehicle and energy storage system batteries in China and internationally. The company offers power battery systems, including cells, modules/battery boxes, and battery packs, as well as lithium iron phosphate, ternary high-voltage medium-nickel, ternary high-nickel, super hybrid, sodium-ion, and condensed matter batteries; energy storage battery sys	2008136286208.0	1.29	17.55	42.283445583519466	32.94277002353567		451499983000.0	81678369000.0	12935498000.0	119656488000.0	337107747000.0	83.89384850557329	20.615044565609782	4.749463228977824	19.951916768512564	32.94277002353567	0.6056538886759703	1.7157634737911829	헐값	양호(>=1.5)	60.0	1053.0	142.59878576525966	양호	충분
000858.SZ	000858.SZ	China / Hong Kong	89.1500015258789	-15.095236642020094	-25.077734997570257		-34.08989712669748	100.61949939727783	113.25674983978271	N	N	주의	WULIANGYE YIBIN CO. LTD.	SHZ	CNY	Consumer Defensive	Beverages - Wineries & Distilleries	Beverages - Wineries & Distilleries	Wuliangye Yibin Co.,Ltd. manufactures and sells liquor and wine products and related auxiliary products under the Wuliangye brand in China. The company's Wuliangye products include eighth-generation Wuliangye, 39 -degree Wuliangye, classic Wuliangye, 29 -degree Wuliangye, etc. It also offers other alcoholic beverage products, such as Wuliangchun, Wuliangchun, Wuliangtequ, Jianzhuang, etc. The company was founded in 1997 and is headquartered in Xuzhou, China.	346045349888.0	6.35	3.24	-71.88896273061067	-30.51456952275814		127014443016.86	0.0	364149470.84	408530653.28	119932271234.99	32.72212002171507	7.1462271736452685	8.015958554494054	17.416012809927107	-30.51456952275814		-1.3874914876603883	판정불가	불리(<1)	0.0	0.0	-100.0	보류	일부부족
002594.SZ	002594.SZ	China / Hong Kong	98.5999984741211	8.48278043376327	-2.1728370091411153		-26.962964093243635	102.39075050354003	101.12761653900147	N	N	주의	BYD COMPANY LIMITED	SHZ	CNY	Consumer Cyclical	Auto Manufacturers	Auto Manufacturers	BYD Company Limited, together with its subsidiaries, engages in automobiles and batteries business in the People's Republic of China, Hong Kong, Macau, Taiwan, and internationally. It operates in two segments, Mobile Handset Components, Assembly Service and Other Products; and Automobiles and Related Products and Other Products. The Mobile Handset Components, Assembly Service and Other Products segment manufactures and sells mobile handset components, such as housings and electronic components, 	898955673600.0	1.33	1.94	-18.967701027859206	25.196441286638958		184489829000.0	65703479000.0	38484710000.0	119120640000.0	246274606000.0	21.86065060007439	-17.97496278277345	-18.23018566018662	39.55636488352923	25.196441286638958	1.5699187212007188	0.6705985589106604	보통	불리(<1)	58.892882573277916	114.25219219215916	15.874436065175178	보류	충분
300760.SZ	300760.SZ	China / Hong Kong	165.94000244140625	-12.321670052984912	-22.83295776492793		-33.153400431270995	165.1652503967285	203.71170021057128	Y	N	주의	SHENZHEN MINDRAY BIO-MEDICAL EL	SHZ	CNY	Healthcare	Medical Devices	Medical Devices	Shenzhen Mindray Bio-Medical Electronics Co., Ltd. provides medical devices and solutions in China and internationally. The company offers various products, including patient monitoring, ultrasound, radiology, AED, defibrillation system, anesthesia, CLIA, chemistry, hematology, ventilators, electrocardiograph, endoscope camera system, operating tables, surgical lights, medical supply units, accessories, infusion system, orthopedics, IT Products, cardiovascular intervention, animal medical, and O	201192521728.0	3.25	6.47	-30.275662177520644	-5.39056908556913		18191343800.0	4062631.0	328106.0	349283522.0	38093330471.0	15.000544569826854	6.6866938378384	4.029585235301829	23.329127955421857	-5.39056908556913		-0.0917552121819301	판정불가	불리(<1)	0.0	0.0	-100.0	보류	일부부족
603501.SS	603501.SS	China / Hong Kong	103.51000213623047	-14.595705657951575	-20.809427878907027		-31.527417219024343	98.82924995422363	121.50075008392334	Y	N	주의	OMNIVISION INTEGRATED CIRCUITS 	SHH	CNY	Technology	Semiconductors	Semiconductors	OmniVision Integrated Circuits Group, Inc., together with its subsidiaries, engages in the design, development, and sale of integrated circuits and computer software and hardware in China and internationally. It operates in two segments, Semiconductor Design and Electronic Components Agency. The company offers image sensors, application-specific integrated circuits, camera cube chips, liquid crystal on silicon, display solutions, in-system programming, and cable modules. It also provides semicon	130546868224.0	60.0	3.04	21.730996944226554	59.85671328521085		13072154645.060001	1617721215.79	2078985512.66	9796924850.61	28172055029.35	9.462880618100037	1.4730734618476904	1.4231218543585429	30.93655313096396	59.85671328521085	0.5168434989665167	3.8742749645644246	헐값	안심(>=2)	60.0	182.4	76.2148548310739	양호	충분
688981.SS	688981.SS	China / Hong Kong	121.86000061035156	-0.9026596725484004	-1.8682555074269303		-13.037895979336989	106.23500003814698	112.36590003967285	Y	Y	상승전환/양호	SEMICONDUCTOR MANUFACTURING INT	SHH	CNY	Technology	Semiconductors	Semiconductors	Semiconductor Manufacturing International Corporation, an investment holding company, engages in the manufacture, testing, and sale of integrated circuits wafer and various compound semiconductors in the United States, China, and Eurasia. The company is also involved in the manufacturing, sale, and trading of semiconductor products; and research and development activities. In addition, it offers semiconductor foundry and technology services; supporting services comprising design and IP support, 	976479387648.0		0.61	39.04287790107723	-27.767740812712226		14935414000.0	9994773000.0	2593077000.0	12596181000.0	21439670000.0	2.4708609402945965	-2.60515381357045	-2.137825209685049	195.71990109845405	-27.767740812712226		-0.14187489701797912	판정불가	불리(<1)	0.0	0.0	-100.0	보류	일부부족
600183.SS	600183.SS	China / Hong Kong	94.18000030517578	36.59173962817239	46.46966692889001		0.0	66.84525003433228	59.42055006027222	Y	Y	상승전환/양호	SHENGYI TECHNOLOGY CO LTD	SHH	CNY	Technology	Electronic Components	Electronic Components	Shengyi Technology Co.,Ltd. engages in the design, production, and sales of copper clad laminates, bonding sheets, and printed circuit boards in China and internationally. The company offers flame-retardant epoxy glass fabric reinforced laminates, composite epoxy materials, and flexible circuit materials, as well as prereg for multilayer circuit boards; and smart and rigid materials, automotive and RF materials, IMS and HTC materials, IC substrate and flexible materials, HSD materials, and speci	228774445056.0	1.17	1.62	91.75319663725077	29.622792505245087		3239977726.09	902984683.16	2304818271.34	3676930770.8	16723501226.33	0.962074242411724	1.1930143211125952	1.2667384978199363	57.541929668372866	29.622792505245087	1.9424883612233501	0.535136598350297	보통	불리(<1)	60.0	97.2	3.206625276107844	보류	충분
000725.SZ	000725.SZ	China / Hong Kong	4.230000019073486	-3.2036583558785248	4.187194056400911		-8.043475939781274	4.087000036239624	4.139500013589859	Y	Y	상승전환/양호	BOE TECHNOLOGY GROUP	SHZ	CNY	Technology	Electronic Components	Electronic Components	BOE Technology Group Company Limited operates display, Internet of Things (IoT) innovation, sensor, and MLED, smart medicine engineering, and other business in Mainland China and internationally. The Display Business segment designs and manufactures display devices, including TFT-LCD, AMOLED, micro displays, and other intelligent interface devices. Its IoT Innovation Business segment designs integrated manufacturing models for system solutions; smart terminal products, such as tablets, laptops, 	156697493504.0	1.2	0.17	10.026166023922677	-8.080747892061046		75564037635.0	112545341525.0	3655021437.0	143558438547.0	134478628806.0	-1.017326958293365	0.24016032744476673	5.677549086568798	30.866629278628537	-8.080747892061046		-0.2229186682468482	판정불가	불리(<1)	0.0	0.0	-100.0	보류	일부부족
002916.SZ	002916.SZ	China / Hong Kong	348.5	49.18663993765844	62.48601591857121		0.0	271.6804973602295	216.96375026702881	Y	Y	상승전환/양호	SHENNAN CIRCUITS CO LTD	SHZ	CNY	Technology	Electronic Components	Electronic Components	Shennan Circuits Co., Ltd. engages in the design, manufacture, and sale of printed circuit boards, packaging substrates, and electronic assemblies in China and internationally. It operates through Packaging Substrates, Packaging Substrates, and Distribution Substrates segments. The company provides RF and microwave, thermal management, miniaturization, and chip package substrate solutions. It also offers schematic design, PCB / SiP design, PCB / SUB production, electronic assembly, package testi	237386563584.0	35.0	5.21	74.46731868482586	25.905809548765156		1588756438.22	2679204686.22	15009670.83	3557910474.95	17149430529.85	-1.600853970239101	0.10703819865094824	0.030713973787933502	67.19786064687891	25.905809548765156	2.593930157649986	0.9063653063126795	매우 불리	불리(<1)	60.0	312.6	-10.30129124820659	보류	충분
601888.SS	601888.SS	China / Hong Kong	61.380001068115234	-31.319235558082468	-19.31115904514521		-36.78681562031733	68.41999950408936	75.76114980697632	N	N	주의	CHINA TOURISM GROUP DUTY FREE C	SHH	CNY	Consumer Cyclical	Specialty Retail	Specialty Retail	China Tourism Group Duty Free Corporation Limited engages in duty-free tourism retail business in China. The company engages in the wholesale and retail of duty-free commodities, such as tobacco, alcohol, cosmetics, watches and jewelry, apparel and bags, and electronic products, as well as food. It is also involved in the investment and development of commercial complexes for duty-free businesses. The company was formerly known as China International Travel Service Corporation Limited and change	127535161344.0	2.11	1.93	-15.957728143438166	-10.667335366687835		33781245387.6	2848679969.93	226682371.28	5029157635.92	55469259598.08	15.842741545586293	2.450990266390758	3.99314145281754	23.59443498576629	-10.667335366687835		-0.362684479278702	판정불가	불리(<1)	0.0	0.0	-100.0	보류	일부부족
601899.SS	601899.SS	China / Hong Kong	34.65999984741211	-13.652216306833198	13.639343762006906		-20.230151349099046	33.857500076293945	30.539200048446656	Y	Y	상승전환/양호	ZIJIN MINING GROUP CO.LTD	SHH	CNY	Basic Materials	Gold	Gold	Zijin Mining Group Company Limited, together with its subsidiaries, engages in exploration and extraction of metals in Mainland China and internationally. The company offers copper, gold, zinc concentrate, lead concentrate, silver, lithium, iron concentrate, tungsten concentrate, and molybdenum concentrate; smelted copper, smelted and processed gold and silver, smelted zinc ingots, sulfuric acid, and battery -grade lithium carbonate; and copper pipes, copper plates and strips, potassium gold cya	921634144256.0	1.45	2.27	61.54868816202652	37.21424266296107		85546185108.0	105866683144.0	32353609318.0	164492766171.0	185541965085.0	-0.9863460863776055	2.1574441715319543	6.224593713300434	15.703236094180491	37.21424266296107	0.4219684446194508	2.4621831086962875	매우 유망	안심(>=2)	60.0	136.2	292.9601863808703	매우 유망	충분
600276.SS	600276.SS	China / Hong Kong	55.86000061035156	-3.9546066765729027	-12.922838220328103		-22.919829350860343	55.500000190734866	60.99690013885498	Y	N	주의	JIANGSU HENGRUI PHARMACEUTICALS	SHH	CNY	Healthcare	Drug Manufacturers - Specialty & Generic	Drug Manufacturers - Specialty & Generic	Jiangsu Hengrui Pharmaceuticals Co.,Ltd, a pharmaceutical company, researches, develops, manufactures, and commercializes medicines to address unmet clinical needs in China and internationally. The company develops medicines in the areas of oncology, metabolic and cardiovascular, immunological and respiratory, neuroscience, pain management, infectious, respiratory system, hematological, ophthalmology, and autoimmune and other diseases. The company was founded in 1970 and is headquartered in Lian	370753994752.0	36.0	1.22	21.69213188913122	25.443053499049604		41183164773.950005	0.0	1260943473.97	74233076.53	61272068641.41	6.456051119750707	1.2969852479550943	2.321849684539292	40.49504056606628	25.443053499049604	1.5915951506205388	1.5172982330714635	보통	양호(>=1.5)	59.38610699809921	72.45105053768103	29.701127364926915	보류	충분
