티커	종목코드	유니버스	현재가	3M수익률(보조,%)	6M수익률(보조,%)	12M수익률(보조,%)	52주고점대비(보조,%)	40일이평(보조)	200일이평(보조)	40일선상회(보조)	200일선상회(보조)	추세판정(보조)	종목명	시장	통화	섹터	산업	업종	사업설명	시가총액	배당수익률(%)	EPS(FY)	EPS Growth 1Y(%)	EPS Growth 3Y CAGR(%)	EPS Growth 5Y CAGR(%)	현금및단기투자	장기부채	단기위험부채	총부채	주주지분	주당순현금(린치식)	주당잉여현금흐름	잉여현금흐름수익률(%)	순현금차감PER(린치식)	사용연성장률(%)	린치PER배수	배당감안점수	린치PER판정	배당감안점수판정	그레이엄적정PER(3년)	그레이엄내재가치(3년)	그레이엄괴리율(3년,%)	종합판정	데이터상태
9866.HK	9866.HK	China / Hong Kong	46.7400016784668	21.025383146445755	-15.249319337671741		-23.627449189884842	48.1597502708435	44.96690019607544	N	Y	상승전환/양호	NIO-SW	HKG	HKD	Consumer Cyclical	Auto Manufacturers	Auto Manufacturers	NIO Inc. designs, develops, manufactures, and sells smart electric vehicles in China, Europe, and internationally. It offers five and six-seater electric SUVs, as well as smart electric sedans. The company also offers power solutions, including Power Home, a home charging solution; Power Swap, a battery-swapping service; Power Charger and Destination Charger; Power Mobile, a mobile charging service through charging vans; Power Map, an application that provides access to a network of public charg	117746253824.0		-7.86				12045850000.0	8626272000.0	5347881000.0	31263135000.0	4159460000.0	1.4507151882256395	-1.3035198487517274	-2.788874201842961					판정불가	판정불가				보류	일부부족
0981.HK	0981.HK	China / Hong Kong	73.3499984741211	-2.7188368836494115	-7.386361994362344		-19.439872580317285	60.95125036239624	66.17554986953735	Y	Y	상승전환/양호	SMIC	HKG	HKD	Technology	Semiconductors	Semiconductors	Semiconductor Manufacturing International Corporation, an investment holding company, engages in the manufacture, testing, and sale of integrated circuits wafer and various compound semiconductors in the United States, China, and Eurasia. The company is also involved in the manufacturing, sale, and trading of semiconductor products; and research and development activities. In addition, it offers semiconductor foundry and technology services; supporting services comprising design and IP support, 	587762696192.0		0.71	39.04287790107723	-27.767740812712226		14935414000.0	9994773000.0	2593077000.0	12596181000.0	21439670000.0	0.821583099937418	-0.866236667172296	-1.180963442661715	102.15269771011786	-27.767740812712226		-0.27182581992606475	판정불가	불리(<1)	0.0	0.0	-100.0	보류	일부부족
1347.HK	1347.HK	China / Hong Kong	130.8000030517578	12.27468073112259	51.82820746958006		-7.496457780957588	97.0087501525879	78.13280006408691	Y	Y	상승전환/양호	HUA HONG SEMI	HKG	HKD	Technology	Semiconductors	Semiconductors	Hua Hong Semiconductor Limited, an investment holding company, engages in the manufacture and sale of semiconductor products in China, North America, Asia, and Europe. The company offers embedded non-volatile memory; standalone non-volatile memory, including NOR flash and EEPROM; power discrete devices; analog and power management platform; and specialty logic RF processes and image sensors. It also provides design services which covers design methodologies and design flow support, standard and 	227279945728.0	0.8295106840102009	0.25	-5.5534521924692	-50.40573254396763		4893808000.0	2787096000.0	403748000.0	3209752000.0	6612663000.0	1.5841557439391858	-0.8751683112652993	-0.6690889073748671	516.8633892312745	-50.40573254396763		-0.09591745690034581	판정불가	불리(<1)	0.0	0.0	-100.0	보류	일부부족
1876.HK	1876.HK	China / Hong Kong	8.029999732971191	4.285713401044222	0.3749966621398926		-9.77528003200917	7.527500033378601	7.977850005626679	Y	Y	상승전환/양호	BUD APAC	HKG	HKD	Consumer Defensive	Beverages - Brewers	Beverages - Brewers	Budweiser Brewing Company APAC Limited, an investment holding company, engages in brewing and distribution of beer in South Korea, Japan, New Zealand, China, India, Vietnam, Southeast Asia, and internationally. It brews, imports, markets, distributes, and sells a portfolio of beer brands, including Budweiser, Stella Artois, Corona, Harbin, Hoegaarden, and Cass. The company was founded in 1876 and is headquartered in Causeway Bay, Hong Kong. Budweiser Brewing Company APAC Limited operates as a su	106235035648.0	5.51	0.29	-32.64462809917356	-18.789404729568137		2970000000.0	77000000.0	178000000.0	277000000.0	10262000000.0	0.21867350814101938	0.04867809859758607	0.6062029914859614	26.93560767182818	-18.789404729568137		-0.49300557430738795	판정불가	불리(<1)	0.0	0.0	-100.0	보류	일부부족
0020.HK	0020.HK	China / Hong Kong	2.059999942779541	-16.599193566057536	-13.807537558156923		-28.719727750741885	2.0064999788999556	2.1757000029087066	Y	N	주의	SENSETIME-W	HKG	HKD	Technology	Software - Application	Software - Application	SenseTime Group Inc., an investment holding company, research, develops and sells artificial intelligence software platforms in Mainland China, Northeast Asia, Southeast Asia, and internationally. The company offers SenseFoundry Enterprise Platform that facilitate and accelerate the digital transformation of enterprise customers; SenseFoundry Platform for smart city management; SenseME that enables a range of IoT devices to facilitate perceptial intelligence and content enhancement; SenseMARS, a	83464175616.0		-0.06				16596316000.0	3710335000.0	2014279000.0	5962982000.0	26718959000.0	0.3220952009870681	-0.09470465227907975	-4.597313345130269					판정불가	판정불가				보류	일부부족
2269.HK	2269.HK	China / Hong Kong	32.65999984741211	-11.729730142129435	-10.716243267966929		-22.56993928137905	34.420000076293945	35.017999992370605	N	N	주의	WUXI BIO	HKG	HKD	Healthcare	Biotechnology	Biotechnology	WuXi Biologics (Cayman) Inc., an investment holding company, provides end-to-end solutions and services for biologics discovery, development, and manufacturing for biologics industry in the People's Republic of China, North America, Europe, Singapore, Japan, South Korea, Australia, and Brazil. It operates through two segments: Biologics and XDC. The company provides a suite of solutions for biologic discovery, from concept to IND, that seamlessly transits to CMC and downstream process developmen	135002693632.0		1.33	46.25222096844504	3.552720117093622		22251738000.0	169381000.0	873517000.0	3104066000.0	47248676000.0	5.3421881934641995	0.6302535869779441	1.9297415490584693	20.53970801048715	3.552720117093622	5.781403356729968	0.17296838471509315	매우 불리	불리(<1)	15.605440234187244	20.755235511469035	-36.45059519767994	보류	충분
2388.HK	2388.HK	China / Hong Kong	45.459999084472656	10.232776998671422	19.067571296771256		-1.1309274966086247	43.109500122070315	39.42935010910034	Y	Y	상승전환/양호	BOC HONG KONG	HKG	HKD	Financial Services	Banks - Regional	Banks - Regional	BOC Hong Kong (Holdings) Limited, an investment holding company, provides banking and related financial services to corporate and individual customers in Hong Kong, China, and internationally. The company operates through four segments: Personal Banking, Corporate Banking, Treasury, and Insurance. It offers savings, current, and time deposit accounts, as well as monthly deposit plans; mortgage plans; corporate deposits, and payroll and e-cheque services. The company also offers cross-border fina	480638599168.0	7.71	3.79	4.938142442392701	13.652075841362565		678118000000.0	0.0	0.0	88602000000.0	358528000000.0	64.13809640787629	-8.378874597903234	-18.43131272909578	-4.928257868971935	13.652075841362565	-0.36098963456095645		판정불가	판정불가	35.804151682725134	135.69773487752826	198.49920283847356	보류	충분
600519.SS	600519.SS	China / Hong Kong	1372.989990234375	2.2322976188376975	-4.983391679282012		-16.02456293707599	1427.0482543945313	1438.2010522460937	N	N	주의	KWEICHOW MOUTAI	SHH	CNY	Consumer Defensive	Beverages - Wineries & Distilleries	Beverages - Wineries & Distilleries	Kweichow Moutai Co., Ltd., together with its subsidiaries, produces and sells liquor products in China and internationally. The company offers liquor and soy sauce products under the Kweichow Moutai, Moutai Wangzi liquor, Moutai 1935 liquor, Han Jiang liquor, and Lai Mao liquor brands. It also engages in the production and sale of beverage, food, and packaging materials; development of anti-counterfeiting technology; research and development of information industry related products; operation an	1719354523648.0	3.77	66.08	-4.532254817158088	9.489481701387037		51939124226.5	0.0	44206237.05	233711179.82	244637811032.18	41.47597188239441	46.630998145188656	3.3963101316731783	20.150030544067505	9.489481701387037	2.123406860157838	0.65803779663703	매우 불리	불리(<1)	27.478963402774074	1815.8099016553108	32.25223159459048	보류	충분
601318.SS	601318.SS	China / Hong Kong	60.060001373291016	-8.038579668591517	3.9819998590622463		-19.18729599043082	58.880000019073485	60.76965017318726	Y	N	중립	PING AN INSURANCE(GROUP)CO.OF C	SHH	CNY	Financial Services	Insurance - Life	Insurance - Life	Ping An Insurance (Group) Company of China, Ltd. provides financial products and services in the People's Republic of China. It operates through Life and Health Insurance; Property and Casualty Insurance; Banking; Asset Management; and Finance Enablement segments. The company offers life insurance products, including term, whole-life, endowment, annuity, investment-linked, universal life, and health care and medical insurance; property and casualty insurance, such as auto insurance, non-auto ins	1087545016320.0	4.5	7.25	6.453829567085556	6.681286200386016		1018674000000.0	1345587000000.0	84520000000.0	1438514000000.0	1000419000000.0	-30.66707355486415	61.00122231308144	101.56713439605247	12.514079300435196	6.681286200386016	1.8730045271391287	0.8934965115649515	보통	불리(<1)	21.86257240077203	158.50364990559723	163.9088349673009	보류	충분
600036.SS	600036.SS	China / Hong Kong	37.939998626708984	-0.419947122887121	-8.798076878990646		-21.351581039342072	39.35624990463257	41.46379991531372	N	N	주의	CHINA MERCHANTS BANK CO LTD	SHH	CNY	Financial Services	Banks - Regional	Banks - Regional	China Merchants Bank Co., Ltd., together with its subsidiaries, provides various banking products and services. It operates through Wholesale Finance Business, Retail Finance Business, and Other Business segments. It offers current, demand, time, call, savings, notice, and renminbi accounts. The company also offers loan products include personal commercial real estate, consumption, housing, and car loans; loans to finance for studying abroad; micro-business loans; mortgage loans for equipment; j	956840935424.0	7.94	5.71	1.2062726176115701	2.8567302131919714		1321522000000.0	0.0	0.0	405441000000.0	1272875000000.0	64.06154248698326	20.520487679675256	54.08668535172073	-4.574701201449084	2.8567302131919714	-1.6013766999500927		판정불가	판정불가	14.213460426383943	81.15885903465231	113.91371104984209	보류	충분
601012.SS	601012.SS	China / Hong Kong	16.360000610351562	-14.791666873627229	-13.439148462671923		-28.245608957043334	17.740250062942504	18.034300022125244	N	N	주의	LONGI GREEN ENERGY TECHNOLOGY C	SHH	CNY	Technology	Semiconductor Equipment & Materials	Semiconductor Equipment & Materials	LONGi Green Energy Technology Co., Ltd. manufactures and sells photovoltaic products in China, Europe, the Asia Pacific, and the United States. The company offers tera silicon wafer, p-type silicon wafer, n-type silicon wafer; Hi-MO X10, Hi-MO 9, Hi-MO 7, Hi-MO X6 Max, Hi-MO X6, Hi-MO 5m, and Hi-MO 5; LONGi Hi ROOF S, Longji Longding 5, and Longji Longjin 3; and hydrogen product equipment, such as ALK-Hi1 and ALK-G. It also engages in research and development, production and sales of monocrystal	123977162752.0	5.854871419710886	-0.91				56023052877.85	16335318135.43	300193416.63	35325725056.02	54275611054.63	5.237185108606886	-0.20250417079235428	-1.237800508786183					판정불가	판정불가				보류	일부부족
300750.SZ	300750.SZ	China / Hong Kong	437.0	28.75663166136746	13.071824564675616		-5.000000000000004	416.98624954223635	359.72890014648436	Y	Y	상승전환/양호	CONTEMPORARY AMPEREX TECHNOLOGY	SHZ	CNY	Industrials	Electrical Equipment & Parts	Electrical Equipment & Parts	Contemporary Amperex Technology Co., Limited, together with its subsidiaries, engages in the research, development, production, and sale of electric vehicle and energy storage system batteries in China and internationally. The company offers power battery systems, including cells, modules/battery boxes, and battery packs, as well as lithium iron phosphate, ternary high-voltage medium-nickel, ternary high-nickel, super hybrid, sodium-ion, and condensed matter batteries; energy storage battery sys	2021777473536.0	1.23	17.52	42.283445583519466	32.94277002353567		451499983000.0	81678369000.0	12935498000.0	119656488000.0	337107747000.0	83.89416120966192	20.615121405674195	4.717419085966635	20.1544428533298	32.94277002353567	0.6118017045600791	1.6955452587909092	헐값	양호(>=1.5)	60.0	1051.2	140.5491990846682	양호	충분
000858.SZ	000858.SZ	China / Hong Kong	92.12999725341797	-8.800237264963929	-23.28892720738047		-31.886735919716614	101.49399948120117	113.74154987335206	N	N	주의	WULIANGYE YIBIN CO. LTD.	SHZ	CNY	Consumer Defensive	Beverages - Wineries & Distilleries	Beverages - Wineries & Distilleries	Wuliangye Yibin Co.,Ltd. manufactures and sells liquor and wine products and related auxiliary products under the Wuliangye brand in China. The company's products include Wuliangye, 39-degree, 45-degree, and 68-degree Wuliangye liquors, as well as classic series such as Wuliangye 10, 20, 30, and 50, special editions like New Golden Panda Commemorative Wine, Archaeological Wuliangye, and cultural wines including Dragon Year Zodiac Wine. Additionally, the company provides other Luzhou-flavor liquo	357612519424.0	6.21	3.25	-71.88896273061067	-30.51456952275814		127014443016.86	0.0	364149470.84	408530653.28	119932271234.99	32.72212002171507	7.1462271736452685	7.756677940615207	18.279346840523967	-30.51456952275814		-1.3296191453010069	판정불가	불리(<1)	0.0	0.0	-100.0	보류	일부부족
002594.SZ	002594.SZ	China / Hong Kong	100.0199966430664	8.942380244845328	-3.567300939154039		-25.911113597728587	102.30700035095215	101.2544998550415	N	N	주의	BYD COMPANY LIMITED	SHZ	CNY	Consumer Cyclical	Auto Manufacturers	Auto Manufacturers	BYD Company Limited, together with its subsidiaries, engages in automobiles and batteries business in the People's Republic of China, Hong Kong, Macau, Taiwan, and internationally. It operates in two segments, Mobile Handset Components, Assembly Service and Other Products; and Automobiles and Related Products and Other Products. The Mobile Handset Components, Assembly Service and Other Products segment manufactures and sells mobile handset components, such as housings and electronic components, 	911902048256.0	1.32	1.95	-18.967701027859206	25.196441286638958		184489829000.0	65703479000.0	38484710000.0	119120640000.0	246274606000.0	21.86065060007439	-17.97496278277345	-17.971369112237927	40.08171591948309	25.196441286638958	1.5907689289732125	0.6615595335266007	보통	불리(<1)	58.892882573277916	114.84112101789194	14.81816124001336	보류	충분
300760.SZ	300760.SZ	China / Hong Kong	170.61000061035156	-11.214614197057859	-24.203650368254127		-31.272157253054147	166.10400009155273	204.47505012512207	Y	N	주의	SHENZHEN MINDRAY BIO-MEDICAL EL	SHZ	CNY	Healthcare	Medical Devices	Medical Devices	Shenzhen Mindray Bio-Medical Electronics Co., Ltd. provides medical devices and solutions in China and internationally. The company offers various products, including patient monitoring, ultrasound, radiology, AED, defibrillation system, anesthesia, CLIA, chemistry, hematology, ventilators, electrocardiograph, endoscope camera system, operating tables, surgical lights, medical supply units, accessories, infusion system, orthopedics, IT Products, cardiovascular intervention, animal medical, and O	206854619136.0	3.17	6.46	-30.275662177520644	-5.39056908556913		18191343800.0	4062631.0	328106.0	349283522.0	38093330471.0	15.000544569826854	6.6866938378384	3.9192859820156953	24.088151089864507	-5.39056908556913		-0.09218511945084368	판정불가	불리(<1)	0.0	0.0	-100.0	보류	일부부족
603501.SS	603501.SS	China / Hong Kong	99.18000030517578	-20.567035223165597	-27.38321937653916		-34.39174339716951	99.6542501449585	121.81315010070801	N	N	주의	OMNIVISION INTEGRATED CIRCUITS 	SHH	CNY	Technology	Semiconductors	Semiconductors	OmniVision Integrated Circuits Group, Inc., together with its subsidiaries, engages in the design, development, and sale of integrated circuits and computer software and hardware in China and internationally. It operates in two segments, Semiconductor Design and Electronic Components Agency. The company offers image sensors, application-specific integrated circuits, camera cube chips, liquid crystal on silicon, display solutions, in-system programming, and cable modules. It also provides semicon	125085868032.0	62.0	3.04	21.730996944226554	59.85671328521085		13072154645.060001	1617721215.79	2078985512.66	9796924850.61	28172055029.35	9.462880618100037	1.4730734618476904	1.4852525280450286	29.512210423380182	59.85671328521085	0.49304762663391904	4.129026987035625	매우 유망	안심(>=2)	60.0	182.4	83.90804541112844	매우 유망	충분
688981.SS	688981.SS	China / Hong Kong	120.30999755859375	-3.01491769540998	-9.330020841833441		-14.144013868260242	105.0857500076294	111.83250003814697	Y	Y	상승전환/양호	SEMICONDUCTOR MANUFACTURING INT	SHH	CNY	Technology	Semiconductors	Semiconductors	Semiconductor Manufacturing International Corporation, an investment holding company, engages in the manufacture, testing, and sale of integrated circuits wafer and various compound semiconductors in the United States, China, and Eurasia. The company is also involved in the manufacturing, sale, and trading of semiconductor products; and research and development activities. In addition, it offers semiconductor foundry and technology services; supporting services comprising design and IP support, 	964059004928.0		0.61	39.04287790107723	-27.767740812712226		14935414000.0	9994773000.0	2593077000.0	12596181000.0	21439670000.0	2.4708609402945965	-2.60515381357045	-2.1653676888337396	193.178912489015	-27.767740812712226		-0.14374105566150353	판정불가	불리(<1)	0.0	0.0	-100.0	보류	일부부족
600183.SS	600183.SS	China / Hong Kong	82.0	12.652835511241234	21.679775549301695		0.0	65.02549991607665	58.60080003738403	Y	Y	상승전환/양호	SHENGYI TECHNOLOGY CO LTD	SHH	CNY	Technology	Electronic Components	Electronic Components	Shengyi Technology Co.,Ltd. engages in the design, production, and sales of copper clad laminates, bonding sheets, and printed circuit boards in China and internationally. The company offers flame-retardant epoxy glass fabric reinforced laminates, composite epoxy materials, and flexible circuit materials, as well as prereg for multilayer circuit boards; and smart and rigid materials, automotive and RF materials, IMS and HTC materials, IC substrate and flexible materials, HSD materials, and speci	199187775488.0	1.22	1.62	91.75319663725077	29.622792505245087		3239977726.09	902984683.16	2304818271.34	3676930770.8	16723501226.33	0.962074242411724	1.1930143211125952	1.4548955135519455	50.023410961474234	29.622792505245087	1.688679787788979	0.6165671615036169	보통	불리(<1)	60.0	97.2	18.536585365853654	보류	충분
000725.SZ	000725.SZ	China / Hong Kong	4.170000076293945	-8.552628758321257	2.709362932628423		-9.347822548986983	4.101250028610229	4.136900013685226	Y	Y	상승전환/양호	BOE TECHNOLOGY GROUP	SHZ	CNY	Technology	Electronic Components	Electronic Components	BOE Technology Group Company Limited operates display, Internet of Things (IoT) innovation, sensor, and MLED, smart medicine engineering, and other business in Mainland China and internationally. The Display Business segment designs and manufactures display devices, including TFT-LCD, AMOLED, micro displays, and other intelligent interface devices. Its IoT Innovation Business segment designs integrated manufacturing models for system solutions; smart terminal products, such as tablets, laptops, 	154474840064.0	1.19	0.17	10.026166023922677	-8.080747892061046		75564037635.0	112545341525.0	3655021437.0	143558438547.0	134478628806.0	-1.017326958293365	0.24016032744476673	5.759240360930816	30.513688438748883	-8.080747892061046		-0.22582480993384554	판정불가	불리(<1)	0.0	0.0	-100.0	보류	일부부족
002916.SZ	002916.SZ	China / Hong Kong	320.3699951171875	26.15971963342374	42.86287407678373		-0.9675440132341562	265.78199768066406	213.67880023956297	Y	Y	상승전환/양호	SHENNAN CIRCUITS CO LTD	SHZ	CNY	Technology	Electronic Components	Electronic Components	Shennan Circuits Co., Ltd. engages in the design, manufacture, and sale of printed circuit boards, packaging substrates, and electronic assemblies in China and internationally. It operates through Packaging Substrates, Packaging Substrates, and Distribution Substrates segments. The company provides RF and microwave, thermal management, miniaturization, and chip package substrate solutions. It also offers schematic design, PCB / SiP design, PCB / SUB production, electronic assembly, package testi	218225344512.0	36.0	5.21	74.46731868482586	25.905809548765156		1588756438.22	2679204686.22	15009670.83	3557910474.95	17149430529.85	-1.600853970239101	0.10703819865094824	0.03341080634339522	61.79862746399743	25.905809548765156	2.3855123055570817	1.001734376460548	매우 불리	보통(1~1.5)	60.0	312.6	-2.425319235762169	보류	충분
601888.SS	601888.SS	China / Hong Kong	62.68000030517578	-30.969164979601448	-9.761011904206175		-35.44799043237767	69.36624956130981	75.75949981689453	N	N	주의	CHINA TOURISM GROUP DUTY FREE C	SHH	CNY	Consumer Cyclical	Specialty Retail	Specialty Retail	China Tourism Group Duty Free Corporation Limited engages in duty-free tourism retail business in China. The company engages in the wholesale and retail of duty-free commodities, such as tobacco, alcohol, cosmetics, watches and jewelry, apparel and bags, and electronic products, as well as food. It is also involved in the investment and development of commercial complexes for duty-free businesses. The company was formerly known as China International Travel Service Corporation Limited and change	130236293120.0	2.06	1.93	-15.957728143438166	-10.667335366687835		33781245387.6	2848679969.93	226682371.28	5029157635.92	55469259598.08	15.842741545586293	2.450990266390758	3.9103226778197193	24.268009719994556	-10.667335366687835		-0.35467825610751263	판정불가	불리(<1)	0.0	0.0	-100.0	보류	일부부족
601899.SS	601899.SS	China / Hong Kong	34.79999923706055	-14.30682414668577	16.621980761090917		-19.907943323344888	34.047750091552736	30.304800033569336	Y	Y	상승전환/양호	ZIJIN MINING GROUP CO.LTD	SHH	CNY	Basic Materials	Gold	Gold	Zijin Mining Group Company Limited, together with its subsidiaries, engages in exploration and extraction of metals in Mainland China and internationally. The company offers copper, gold, zinc concentrate, lead concentrate, silver, lithium, iron concentrate, tungsten concentrate, and molybdenum concentrate; smelted copper, smelted and processed gold and silver, smelted zinc ingots, sulfuric acid, and battery -grade lithium carbonate; and copper pipes, copper plates and strips, potassium gold cya	925356851200.0	1.45	2.27	61.54868816202652	37.21424266296107		85546185108.0	105866683144.0	32353609318.0	164492766171.0	185541965085.0	-0.9863460863776055	2.1574441715319543	6.1995523529620264	15.764909834113725	37.21424266296107	0.42362570634292035	2.452550827743742	매우 유망	안심(>=2)	60.0	136.2	291.3793189252507	매우 유망	충분
600276.SS	600276.SS	China / Hong Kong	52.79999923706055	-7.692310257327339	-17.007230236531022		-27.14226804514429	55.55475015640259	61.02790012359619	N	N	주의	JIANGSU HENGRUI PHARMACEUTICALS	SHH	CNY	Healthcare	Drug Manufacturers - Specialty & Generic	Drug Manufacturers - Specialty & Generic	Jiangsu Hengrui Pharmaceuticals Co.,Ltd, a pharmaceutical company, researches, develops, manufactures, and commercializes medicines to address unmet clinical needs in China and internationally. The company develops medicines in the areas of oncology, metabolic and cardiovascular, immunological and respiratory, neuroscience, pain management, infectious, respiratory system, hematological, ophthalmology, and autoimmune and other diseases. The company was founded in 1970 and is headquartered in Lian	350444158976.0	37.0	1.22	21.69213188913122	25.443053499049604		41183164773.950005	0.0	1260943473.97	74233076.53	61272068641.41	6.456051119750707	1.2969852479550943	2.456411489954596	37.98684271910643	25.443053499049604	1.4930143003678935	1.6438074088121652	보통	양호(>=1.5)	59.38610699809921	72.45105053768103	37.21790072835327	보류	충분
