티커	종목코드	유니버스	현재가	3M수익률(보조,%)	6M수익률(보조,%)	12M수익률(보조,%)	52주고점대비(보조,%)	40일이평(보조)	200일이평(보조)	40일선상회(보조)	200일선상회(보조)	추세판정(보조)	종목명	시장	통화	섹터	산업	업종	사업설명	시가총액	배당수익률(%)	EPS(FY)	EPS Growth 1Y(%)	EPS Growth 3Y CAGR(%)	EPS Growth 5Y CAGR(%)	현금및단기투자	장기부채	단기위험부채	총부채	주주지분	주당순현금(린치식)	주당잉여현금흐름	잉여현금흐름수익률(%)	순현금차감PER(린치식)	사용연성장률(%)	린치PER배수	배당감안점수	린치PER판정	배당감안점수판정	그레이엄적정PER(3년)	그레이엄내재가치(3년)	그레이엄괴리율(3년,%)	종합판정	데이터상태
0700.HK	0700.HK	China / Hong Kong	459.6000061035156	-16.739129329073254	-24.901959787007254		-32.16236072272832	465.35000228881836	568.2750006103515	N	N	주의	TENCENT	HKG	HKD	Communication Services	Internet Content & Information	Internet Content & Information	Tencent Holdings Limited, an investment holding company, provides value-added services, marketing services, fintech, and business services in Mainland China and internationally. The company's consumers business includes communications and social services, such as instant messaging and social networks; digital content, including online games, videos, live streaming, news, music, and literature; fintech services, which include mobile payment, wealth management, consumer loans, and securities tradi	4034018410496.0	1.15	27.94	15.854343468694765	6.10101407396777		712465000000.0	334573000000.0	53160000000.0	406399000000.0	1154152000000.0	41.91078624970387	21.091253934702067	4.589045616755646	14.949506795054107	6.10101407396777	2.4503314717534748	0.48503366521540997	매우 불리	불리(<1)	20.70202814793554	578.414666453319	25.851753431666147	보류	충분
9988.HK	9988.HK	China / Hong Kong	109.30000305175781	-17.942938771816376	-29.20983978468503		-40.95083768358565	127.77249946594239	145.0750001525879	N	N	주의	BABA-W	HKG	HKD	Consumer Cyclical	Internet Retail	Internet Retail	Alibaba Group Holding Limited, through its subsidiaries, provides technology infrastructure and marketing reach to help merchants, brands, retailers, and other businesses in the People's Republic of China and internationally. It operates through the Alibaba China E-Commerce Group, Alibaba International Digital Commerce Group, Cloud Intelligence Group, and All Others segments. The Alibaba China E-commerce Group segment operates Taobao and Tmall, which are digital retail platforms; Taobao Instant 	2053658640384.0	94.0	6.36	-20.380603955145304	12.486072925161418		502258000000.0	231772000000.0	28224000000.0	281722000000.0	1060886000000.0	14.092897718088157	-2.642828626443896	-2.4179584196282353	14.969670649948059	12.486072925161418	1.198909436111157	7.113454625371528	보통	안심(>=2)	33.47214585032283	212.88284760805323	94.76929703949313	보류	충분
3690.HK	3690.HK	China / Hong Kong	78.25	1.0981892214005917	-20.234453397425433		-43.623920547882854	81.59749965667724	93.36450012207031	N	N	주의	MEITUAN-W	HKG	HKD	Consumer Cyclical	Internet Retail	Internet Retail	Meituan operates as a technology driven retail company in the People's Republic of China, Hong Kong, Macao, Taiwan, and internationally. It operates through Core Local Commerce and New Initiatives segments. The company offers daily goods and services, such as food delivery, in-store, hotel and travel booking, and other services and sales; bike sharing, e-moped sharing, power banks and micro-credit; and operates Kuailv and Xiaoxiang Supermarkets. It also sells goods from B2B food distribution ser	464931061760.0		-4.53				226896042000.0	65904021000.0	14379078000.0	86619106000.0	151045913000.0	28.773081962634354	-4.8408568339735485	-6.186398509870349					판정불가	판정불가				보류	일부부족
9618.HK	9618.HK	China / Hong Kong	112.5	3.5911616764969567	-3.100773920271449		-21.218489078586078	118.5400001525879	117.99975044250488	N	N	주의	JD-SW	HKG	HKD	Consumer Cyclical	Internet Retail	Internet Retail	JD.com, Inc. operates as a supply chain-based technology and service provider in the People's Republic of China and Europe. It operates through three segments: JD Retail, JD Logistics, and New Businesses. The company provides home appliances; mobile handsets and other digital products; computers, including desktop, laptop, and other various products, as well as printers and other office equipment; furniture and household goods; apparel; cosmetics and other personal care items; and pet products. 	304851156992.0	3.48	5.36	-52.53511932106676	23.66544269567723		288976000000.0	62473000000.0	11525000000.0	107105000000.0	225040000000.0	93.98950734042998	1.9947089521350574	1.773074624120051	3.453450123054108	23.66544269567723	0.1459279747040152	7.860383595657889	매우 유망	안심(>=2)	55.83088539135446	299.2535456976599	166.00315173125324	매우 유망	충분
9999.HK	9999.HK	China / Hong Kong	200.39999389648438	8.676789875048385	-7.734808143556826		-18.668831631272344	184.89249954223632	204.54200004577638	Y	N	상승전환/양호	NTES-S	HKG	HKD	Communication Services	Electronic Gaming & Multimedia	Electronic Gaming & Multimedia	NetEase, Inc. engages in online games, music streaming, online intelligent learning services, and internet content services businesses in China and internationally. The company operates through Games and Related Value-Added Services; Youdao; NetEase Cloud Music; and Innovative Businesses and Others segments. It develops and operates mobile and PC games; and offers games licensed from other developers. The company also provides live streaming service, and other related or ancillary value-added se	626619777024.0	2.25	12.22	13.67851196370724	18.404094603117294		278053666000.0	427997000.0	6384417000.0	6729742000.0	160296119000.0	86.66114128527116	15.197802250909037	7.583733889113482	9.307598413356237	18.404094603117294	0.5057351971978948	2.2190573428134845	헐값	안심(>=2)	45.30818920623459	553.6660721001867	176.28048351447566	양호	충분
1810.HK	1810.HK	China / Hong Kong	26.260000228881836	-21.235752523403928	-37.44640182174969		-56.34247786746316	29.791999959945677	39.48689997673035	N	N	주의	XIAOMI-W	HKG	HKD	Technology	Consumer Electronics	Consumer Electronics	Xiaomi Corporation, an investment holding company, engages in the development and sales of smartphones in Mainland China and internationally. It operates through Smartphones, IoT and Lifestyle Products, Internet Services, and smart electric vehicles segments. The company also offers internet of things (IoT) and lifestyle products comprising smart large home appliances, smart TVs, tablets, wearables and other IoT and lifestyle products; hardware repairment services for products; installation serv	661021851648.0		1.8	76.02150314018954	156.2794016865734		188478801000.0	22921433000.0	13202226000.0	41837896000.0	266218661000.0	7.770016149149298	1.0030980928577764	3.819870845829344	10.272213377629187	156.2794016865734	0.06572979718869576	15.213800175424558	매우 유망	안심(>=2)	60.0	108.0	311.27189283577053	매우 유망	충분
9888.HK	9888.HK	China / Hong Kong	114.69999694824219	-5.8292331080636695	-0.9499188899191768		-28.535827446578075	127.35499935150146	123.55974975585937	N	N	주의	BIDU-SW	HKG	HKD	Communication Services	Internet Content & Information	Internet Content & Information	Baidu, Inc. provides internet content, value-added telecommunication-based, internet map, and online audio and video services in the People's Republic of China. It operates in two segments, Baidu General Business and iQIYI. The Baidu General Business segment offers products and services for mobile ecosystem, AI cloud, and intelligent driving. This segment operates Baidu App that enables users to access search, feed, content, and other services through mobile devices; and Haokan, which offers a r	301327745024.0		-0.15	-76.47727272727273	-9.574707672764294		205928000000.0	61102000000.0	28410000000.0	97077000000.0	266330000000.0	65.88987137071996	-7.474974014478953	-6.516978390027332		-9.574707672764294			판정불가	판정불가				보류	일부부족
1024.HK	1024.HK	China / Hong Kong	46.2400016784668	-24.009855648341194	-31.49629380967882		-49.657046873555466	46.55	64.52764980316162	N	N	주의	KUAISHOU-W	HKG	HKD	Communication Services	Internet Content & Information	Internet Content & Information	Kuaishou Technology, an investment holding company, provides live streaming, online marketing, and other services in the People's Republic of China. It offers Kuaishou Flagship, a short video and content based social networking platform; Kuaishou Express; Kuaishou Concept; Yitian Camera, an app to create features Japanese-and-Korean-style filters and cute stickers; Kmovie, a shooting, editing, and production tool; and AcFun, a video sharing website. The company also provides entertainment, e-com	192287719424.0	1.49	4.89	21.402021519400073			113106000000.0	11098000000.0	13916000000.0	34953000000.0	79558000000.0	27.884070641258763	3.2184441193845648	6.960302773698516	3.753769128263402	21.402021519400073	0.17539320408872408	6.098409555089116	매우 유망	안심(>=2)	8.5	41.565	-10.1102973805554	양호	충분
1211.HK	1211.HK	China / Hong Kong	85.5999984741211	-12.786554107641857	-13.008132980964893		-36.21460475357908	96.71875	100.69025005340576	N	N	주의	BYD COMPANY	HKG	HKD	Consumer Cyclical	Auto Manufacturers	Auto Manufacturers	BYD Company Limited, together with its subsidiaries, engages in automobiles and batteries business in the People's Republic of China, Hong Kong, Macau, Taiwan, and internationally. It operates in two segments, Mobile Handset Components, Assembly Service and Other Products; and Automobiles and Related Products and Other Products. The Mobile Handset Components, Assembly Service and Other Products segment manufactures and sells mobile handset components, such as housings and electronic components, 	766300454912.0	48.0	2.25	-18.967701027859206	25.196441286638958		184489829000.0	65703479000.0	38484710000.0	119120640000.0	246274606000.0	32.249104088613784	-26.516889015583427	-30.977674635823867	23.711508615781028	25.196441286638958	0.9410657777435676	3.0869584248183846	헐값	안심(>=2)	58.892882573277916	132.5089857898753	54.8002198036673	보류	충분
2318.HK	2318.HK	China / Hong Kong	57.70000076293945	-9.133857066237084	1.853484922821913		-21.443154308639713	60.89750003814697	61.31175022125244	N	N	중립	PING AN	HKG	HKD	Financial Services	Insurance - Life	Insurance - Life	Ping An Insurance (Group) Company of China, Ltd. provides financial products and services in the People's Republic of China. It operates through Life and Health Insurance; Property and Casualty Insurance; Banking; Asset Management; and Finance Enablement segments. The company offers life insurance products, including term, whole-life, endowment, annuity, investment-linked, universal life, and health care and medical insurance; property and casualty insurance, such as auto insurance, non-auto ins	1020365570048.0	5.29	8.38	6.453829567085556	6.681286200386016		1018674000000.0	1345587000000.0	84520000000.0	1438514000000.0	1000419000000.0	-43.89521637208706	87.31390191516293	151.32391812938138	12.123534264322972	6.681286200386016	1.8145509563147475	0.9874419405581267	보통	불리(<1)	21.86257240077203	183.20835671846964	217.51881160484118	보류	충분
0939.HK	0939.HK	China / Hong Kong	8.90999984741211	14.524416544091533	12.499996989664442		-0.8898768158267067	8.774249935150147	8.041349987983704	Y	Y	상승전환/양호	CCB	HKG	HKD	Financial Services	Banks - Diversified	Banks - Diversified	China Construction Bank Corporation engages in the provision of various banking and related financial services to individuals and corporate customers in the People's Republic of China and internationally. It operates through Corporate Finance Business, Personal Finance Business, Treasury and Asset Management Business, and Others segments. The company offers corporate and personal loans; trade financing; deposit taking and wealth management, agency, financial consulting and advisory, cash managem	2325627535360.0	4.88	1.5	0.9920226952383482	1.4347942111190504		4254869000000.0	0.0	0.0	3093481000000.0	3663411000000.0	17.69784723548096	8.641964734641563	96.99174952457045	-5.858564925379234	1.4347942111190504	-4.083209201694449		판정불가	판정불가	11.3695884222381	17.05438263335715	91.40721577352843	보류	충분
1398.HK	1398.HK	China / Hong Kong	7.159999847412109	15.11254162263398	15.11254162263398		-1.3774156792985215	6.957999980449676	6.380699973106385	Y	Y	상승전환/양호	ICBC	HKG	HKD	Financial Services	Banks - Diversified	Banks - Diversified	Industrial and Commercial Bank of China Limited, together with its subsidiaries, provides banking products and services in the People's Republic of China and internationally. It operates through Corporate Banking, Personal Banking, and Treasury Operations segments. The Corporate Banking segment offers corporate loans, trade financing, deposit-taking activities, corporate wealth management services, custody services, and various types of corporate intermediary services, as well as corporate loans	2562561146880.0	4.89	1.17	0.7377078305267348	0.6811562101320723		5268700000000.0	0.0	0.0	2751358000000.0	4244259000000.0	60.703473692423984	21.341222310857273	298.0617704701598	-45.763652858984514	0.6811562101320723	-67.18525380560092		판정불가	판정불가	9.862312420264145	11.538905531709048	61.15790192201804	보류	충분
3988.HK	3988.HK	China / Hong Kong	5.489999771118164	21.72947876943454	21.72947876943454		-0.7233352110771807	5.2229999780654905	4.667399995326996	Y	Y	상승전환/양호	BANK OF CHINA	HKG	HKD	Financial Services	Banks - Diversified	Banks - Diversified	Bank of China Limited, together with its subsidiaries, provides various banking and financial services in Chinese Mainland, Hong Kong, Macao, Taiwan, and internationally. The company operates through six segments: Corporate Banking, Personal Banking, Treasury Operations, Investment Banking, Insurance, and Other. The Corporate Banking segment provides current accounts, deposits, overdrafts, loans, payments and settlements, trade-related products, and other credit facilities, as well as foreign cu	1762501722112.0	4.61	0.86	2.1779255889438742	2.3712026525481544		4330456000000.0	0.0	0.0	2782404000000.0	3064044000000.0	51.78591383406694	9.097539947447396	165.71111706247802	-53.83245821273113	2.3712026525481544	-22.70259699434859		판정불가	판정불가	13.242405305096309	11.388468562382826	107.44023747132694	보류	충분
0941.HK	0941.HK	China / Hong Kong	81.8499984741211	3.6075930052165806	-5.919541983768861		-9.407858487606557	84.53125	83.54399997711181	N	N	주의	CHINA MOBILE	HKG	HKD	Communication Services	Telecom Services	Telecom Services	China Mobile Limited provides communication, computing, and AI services in Mainland China and Hong Kong. It offers communications services, including mobile communications, broadband networks, cellular IoT, and satellite Internet; computing services comprising data centers, cloud computing services, and cloud computing applications; and AI services, such as data algorithms, embodied intelligence, digital intelligence culture, digital intelligence e-commerce, and industry digital intelligence ser	1759706611712.0	6.16	7.28	-0.9235905848684389	3.000641948799565		520239000000.0	9748000000.0	42507000000.0	101197000000.0	1428475000000.0	24.61165600002836	3.6625489636646966	4.4747086523437165	7.862409680507243	3.000641948799565	2.620242539651448	1.1651188784414204	매우 불리	보통(1~1.5)	14.50128389759913	105.56934677452168	28.97904550102104	보류	충분
0883.HK	0883.HK	China / Hong Kong	24.200000762939453	-13.756232275371117	10.502288513571823		-20.6557352034772	27.005500030517577	23.344999980926513	N	Y	상승전환/양호	CNOOC	HKG	HKD	Energy	Oil & Gas E&P	Oil & Gas E&P	CNOOC Limited, an investment holding company, engages in the exploration, development, production, and sale of crude oil and natural gas in worldwide. The company produces offshore crude oil and natural gas primarily in Bohai Sea, the Western South China Sea, the Eastern South China Sea, and the East China Sea in China. It also holds interests in various oil and gas assets in Asia, Africa, North America, South America, Oceania, and Europe. In addition, the company is involved in the sales and tr	1120756301824.0	5.29	2.97	-11.493736225495887	-4.845953497090038		402707000000.0	58832000000.0	1308000000.0	69800000000.0	802750000000.0	7.72059621174125	2.1887539451661775	9.044437504804113	5.548621061009496	-4.845953497090038		0.08002826252279222	판정불가	불리(<1)	0.0	0.0	-100.0	보류	일부부족
0857.HK	0857.HK	China / Hong Kong	9.989999771118164	-4.857145036969868	13.522722211258586		-16.95760604434514	10.899999952316284	9.121650023460388	N	Y	상승전환/양호	PETROCHINA	HKG	HKD	Energy	Oil & Gas Integrated	Oil & Gas Integrated	PetroChina Company Limited, together with its subsidiaries, engages in a range of petroleum related products, services, and activities in Mainland China and internationally. It operates through the Oil and Gas and New Energy; Refining, Chemicals and New Materials; Sales; and Natural Gas Sales Segments. The Oil, Gas and New Energy Resource segment engages in the exploration, development, transportation, production, and marketing of crude oil and natural gas, as well as is involved in the new ener	1791775342592.0	5.75	1.0	-4.477883844640385	1.8835578227509364		251258000000.0	163462000000.0	34513000000.0	353775000000.0	1586061000000.0	4.161164800060667	5.674276858035253	56.79956944984135	5.828834971057497	1.8835578227509364	3.094587753374347	1.309619822941396	매우 불리	보통(1~1.5)	12.267115645501873	12.267115645501873	22.79395321876805	보류	충분
0386.HK	0386.HK	China / Hong Kong	4.369999885559082	-13.465352069161597	-2.8888914320204018		-22.791519375090562	4.464749991893768	4.572049992084503	N	N	주의	SINOPEC CORP	HKG	HKD	Energy	Oil & Gas Integrated	Oil & Gas Integrated	China Petroleum & Chemical Corporation, an energy and chemical company, engages in the oil and gas and chemical operations in Mainland China. It operates through Exploration and Production, Refining, Marketing and Distribution, Chemicals, and Corporate and Others segments. The company explores and develops oil fields; produces and sells crude oil and natural gas; processes, purifies, imports, and trades in crude oil; manufactures, produces, sells, stores, and trades in petroleum products; owns a	517561221120.0	5.9	0.31	-33.63983734853593	-21.420834213525552		231381000000.0	235264000000.0	120256000000.0	531006000000.0	827463000000.0	-0.16327062230528314	1.2139547093937237	27.779284695299594	14.623453251175373	-21.420834213525552		-1.0613658721327024	판정불가	불리(<1)	0.0	0.0	-100.0	보류	일부부족
0005.HK	0005.HK	China / Hong Kong	145.8000030517578	9.624062444930681	30.76233457556754		-1.018329917802474	141.94000053405762	123.21875003814698	Y	Y	상승전환/양호	HSBC HOLDINGS	HKG	HKD	Financial Services	Banks - Diversified	Banks - Diversified	HSBC Holdings plc engages in the provision of banking and financial products and services worldwide. It operates through four segments: Hong Kong, UK, Corporate and Institutional Banking, and International Wealth and Premier Banking. The Hong Kong segment is involved in the retail banking and wealth and commercial banking of HSBC Hong Kong and Hang Seng Bank. The UK segment engages in UK retail banking and wealth, as well as first direct and M&S Bank, UK Commercial Banking, and HSBC Innovation B	2503638515712.0	4.02	9.48	-7.064514783769127	12.722423966662477		307737000000.0	0.0	0.0	256139000000.0	198225000000.0	17.94572196649868	1.4640012412187986	1.0041160566362197	13.486738511103283	12.722423966662477	1.060076173097485	1.2413990197021225	보통	보통(1~1.5)	33.94484793332495	321.79715840792056	120.7113523129936	보류	충분
1299.HK	1299.HK	China / Hong Kong	76.5	-11.509539964702686	-3.164556962025311		-15.887847644970666	82.45374984741211	80.59675006866455	N	N	주의	AIA	HKG	HKD	Financial Services	Insurance - Life	Insurance - Life	AIA Group Limited, together with its subsidiaries, provides life insurance based financial services in Hong Kong. The company offers life insurance, accident, and health insurance and savings plans; and employee benefits, credit life, and pension services to corporate clients. It is also involved in the distribution of investment and other financial services products. It sells its products through a network of agents and partners in Mainland China, Macau, Thailand, Singapore, Malaysia, Australia	777481551872.0	2.52	4.62	-8.806319485078994	23.234050071757984		221334000000.0	14245000000.0	0.0	14671000000.0	43245000000.0	20.030175488535328	0.6493951790294327	0.8488825869665786	12.222905738412267	23.234050071757984	0.5260772745458507	2.1070317175744977	헐값	안심(>=2)	54.96810014351597	253.95262266304377	231.96421263142977	양호	충분
0388.HK	0388.HK	China / Hong Kong	386.79998779296875	-5.979583487720086	-4.822836219950344		-16.421780899872928	407.80500106811525	419.1840005493164	N	N	주의	HKEX	HKG	HKD	Financial Services	Financial Data & Stock Exchanges	Financial Data & Stock Exchanges	Hong Kong Exchanges and Clearing Limited, together with its subsidiaries, owns and operates stock and futures exchanges, and related clearing houses in Hong Kong, the United Kingdom, and Mainland China. It operates through Cash, Equity and Financial Derivatives, Commodities, and Data and Connectivity segments. The Cash segment covers various equity products traded on the cash market platforms of the Stock Exchange of Hong Kong Limited, as well as through the Shanghai-Hong Kong and the Shenzhen-H	487916011520.0	3.37	14.89	36.04597701149426	20.77414004603453		453788000000.0	61000000.0	430000000.0	851000000.0	58147000000.0	358.9524103091035	18.903016333446587	4.887026093590328	1.870220113086986	20.77414004603453	0.090026355312069	12.90978525847538	매우 유망	안심(>=2)	50.04828009206906	745.2188905709082	92.66259412856547	매우 유망	충분
2382.HK	2382.HK	China / Hong Kong	76.25	33.889374852511224	12.463121781560327		-16.11661306926172	69.98874969482422	68.87725008010864	Y	Y	상승전환/양호	SUNNY OPTICAL	HKG	HKD	Technology	Electronic Components	Electronic Components	Sunny Optical Technology (Group) Company Limited, an investment holding company, engages in designing, researching, developing, manufacturing, and selling optical and optical related products, and scientific instruments. It operates through Optical Components, Optoelectronic Products, and Optical Instruments segments. The Optical Components segment offers vehicle lens sets and optical parts for vehicle light detection and ranging, handset lens sets, glass spherical and aspherical lenses for digi	80133439488.0	1.58	4.91	71.87231282040072	24.433762661282877		38549973000.0	1405760000.0	4655009000.0	6244099000.0	29148588000.0	34.57930031499529	2.931125362464284	3.844098836018733	8.486904212831917	24.433762661282877	0.3473433187709583	3.065165107195499	매우 유망	안심(>=2)	57.367525322565754	281.67454933379787	269.40924502793166	매우 유망	충분
9868.HK	9868.HK	China / Hong Kong	55.70000076293945	-25.881570682658715	-26.902883210385266		-48.663593766876076	62.99499959945679	75.79224990844726	N	N	주의	XPENG-W	HKG	HKD	Consumer Cyclical	Auto Manufacturers	Auto Manufacturers	XPeng Inc. designs, develops, manufactures, and markets smart electric vehicles (EVs) in the People's Republic of China. The company offers P7 and P7i, a four-door sports sedan; G9, a smart EV and a mid- to large-sized sport utility vehicle (SUV); G7 for families and individual consumers seeking advanced technology and comfort; G6, a smart EV and a coupe SUV; X9, Smart EV and a large seven-seater multi-purpose vehicle (MPV); MONA M03, an all-electric hatchback coupe; Next P7, an all-new coupe sp	105228148736.0		-1.36				52582500000.0	6755098000.0	7309923000.0	19553678000.0	30368590000.0	29.32403614712095	3.1427525056640224	5.642284493028381					판정불가	판정불가				판정불가	일부부족
2015.HK	2015.HK	China / Hong Kong	56.849998474121094	-18.611310356458212	-18.08357748677856		-54.33735062319591	65.2649998664856	74.41575002670288	N	N	주의	LI AUTO-W	HKG	HKD	Consumer Cyclical	Auto Manufacturers	Auto Manufacturers	Li Auto Inc. operates in the energy vehicle market in the People's Republic of China. The company designs, develops, manufactures, and sells premium smart electric vehicles. Its product line comprises multi-purpose vehicles and sport utility vehicles. The company offers sales and after sales management, and technology development and corporate management services, as well as manufacturing equipment. It offers its products through online and offline channels. The company was formerly known as Lea	112907321344.0		-1.04	-86.00113291875977			145354579000.0	3299203000.0	6217745000.0	17814767000.0	72619255000.0	85.51877255922645	-7.715911809470451	-13.572404602583834		-86.00113291875977			판정불가	판정불가				보류	일부부족
