티커	종목코드	유니버스	현재가	3M수익률(보조,%)	6M수익률(보조,%)	12M수익률(보조,%)	52주고점대비(보조,%)	40일이평(보조)	200일이평(보조)	40일선상회(보조)	200일선상회(보조)	추세판정(보조)	종목명	시장	통화	섹터	산업	업종	사업설명	시가총액	배당수익률(%)	EPS(FY)	EPS Growth 1Y(%)	EPS Growth 3Y CAGR(%)	EPS Growth 5Y CAGR(%)	현금및단기투자	장기부채	단기위험부채	총부채	주주지분	주당순현금(린치식)	주당잉여현금흐름	잉여현금흐름수익률(%)	순현금차감PER(린치식)	사용연성장률(%)	린치PER배수	배당감안점수	린치PER판정	배당감안점수판정	그레이엄적정PER(3년)	그레이엄내재가치(3년)	그레이엄괴리율(3년,%)	종합판정	데이터상태
0700.HK	0700.HK	China / Hong Kong	411.79998779296875	-17.37560336357109	-30.963958458848495		-39.217713978897606	451.4950012207031	561.5040003967285	N	N	주의	TENCENT	HKG	HKD	Communication Services	Internet Content & Information	Internet Content & Information	Tencent Holdings Limited, an investment holding company, provides value-added services, marketing services, fintech, and business services in Mainland China and internationally. The company's consumers business includes communications and social services, such as instant messaging and social networks; digital content, including online games, videos, live streaming, news, music, and literature; fintech services, which include mobile payment, wealth management, consumer loans, and securities tradi	3785430138880.0	1.29	27.88	15.854343468694765	6.10101407396777		712465000000.0	334573000000.0	53160000000.0	387733000000.0	1154152000000.0	41.947733908795875	21.10984753625274	5.126238018944686	13.265862764855555	6.10101407396777	2.174370129952537	0.5571453741816428	매우 불리	불리(<1)	20.70202814793554	577.1725447644428	40.15846572939061	보류	충분
9988.HK	9988.HK	China / Hong Kong	89.5	-25.229739112942962	-37.93342448396563		-51.64775956303973	121.38374977111816	144.34775016784667	N	N	주의	BABA-W	HKG	HKD	Consumer Cyclical	Internet Retail	Internet Retail	Alibaba Group Holding Limited, through its subsidiaries, provides technology infrastructure and marketing reach to help merchants, brands, retailers, and other businesses in the People's Republic of China and internationally. It operates through the Alibaba China E-Commerce Group, Alibaba International Digital Commerce Group, Cloud Intelligence Group, and All Others segments. The Alibaba China E-commerce Group segment operates Taobao and Tmall, which are digital retail platforms; Taobao Instant 	1785986023424.0	1.15	6.35	-20.380603955145304	12.486072925161418		502258000000.0	231772000000.0	28224000000.0	281722000000.0	1060886000000.0	14.084766928839528	-2.641303866737858	-2.9511775047350373	11.876414656875665	12.486072925161418	0.9511729370843899	1.148164098267403	헐값	보통(1~1.5)	33.47214585032283	212.54812614954997	137.4839398318994	보류	충분
3690.HK	3690.HK	China / Hong Kong	64.25	-16.06793280392347	-35.42713567839196		-52.19493830521622	78.87624988555908	91.57400012969971	N	N	주의	MEITUAN-W	HKG	HKD	Consumer Cyclical	Internet Retail	Internet Retail	Meituan operates as a technology driven retail company in the People's Republic of China, Hong Kong, Macao, Taiwan, and internationally. It operates through Core Local Commerce and New Initiatives segments. The company offers daily goods and services, such as food delivery, in-store, hotel and travel booking, and other services and sales; bike sharing, e-moped sharing, power banks and micro-credit; and operates Kuailv and Xiaoxiang Supermarkets. It also sells goods from B2B food distribution ser	417697038336.0		-4.52				226896042000.0	65904021000.0	14379078000.0	86619106000.0	151045913000.0	28.773081962634354	-4.8408568339735485	-7.534407523694239					판정불가	판정불가				보류	일부부족
9618.HK	9618.HK	China / Hong Kong	96.0	-8.658419225726055	-13.435528693299382		-32.773110680393444	115.54125022888184	117.3370004272461	N	N	주의	JD-SW	HKG	HKD	Consumer Cyclical	Internet Retail	Internet Retail	JD.com, Inc. operates as a supply chain-based technology and service provider in the People's Republic of China and Europe. It operates through three segments: JD Retail, JD Logistics, and New Businesses. The company provides home appliances; mobile handsets and other digital products; computers, including desktop, laptop, and other various products, as well as printers and other office equipment; furniture and household goods; apparel; cosmetics and other personal care items; and pet products. 	270432485376.0	4.08	5.35	-52.53511932106676	23.66544269567723		288976000000.0	62473000000.0	11525000000.0	107105000000.0	225040000000.0	93.98950734042998	1.9947089521350574	2.077821825140685	0.37579302048037744	23.66544269567723	0.015879399566399003	73.8317136923143	매우 유망	안심(>=2)	55.83088539135446	298.69523684374633	211.14087171223574	매우 유망	충분
9999.HK	9999.HK	China / Hong Kong	187.5	6.6552882509322675	-11.137440758293838		-23.904218894270336	187.30749969482423	203.7010001373291	Y	N	상승전환/양호	NTES-S	HKG	HKD	Communication Services	Electronic Gaming & Multimedia	Electronic Gaming & Multimedia	NetEase, Inc. engages in online games, music streaming, online intelligent learning services, and internet content services businesses in China and internationally. The company operates through Games and Related Value-Added Services; Youdao; NetEase Cloud Music; and Innovative Businesses and Others segments. It develops and operates mobile and PC games; and offers games licensed from other developers. The company also provides live streaming service, and other related or ancillary value-added se	638793285632.0	2.41	12.21	13.67851196370724	18.404094603117294		278053666000.0	427997000.0	6384417000.0	6729742000.0	160296119000.0	86.66114128527116	15.197802250909037	8.105494533818153	8.258710787447079	18.404094603117294	0.44874311752604307	2.520259534303334	매우 유망	안심(>=2)	45.30818920623459	553.2129902081243	195.04692811099963	매우 유망	충분
1810.HK	1810.HK	China / Hong Kong	21.420000076293945	-33.18777554969535	-47.62836362551053		-64.38902820795738	28.21099987030029	38.31729999542236	N	N	주의	XIAOMI-W	HKG	HKD	Technology	Consumer Electronics	Consumer Electronics	Xiaomi Corporation, an investment holding company, engages in the development and sales of smartphones in Mainland China and internationally. It operates through Smartphones, IoT and Lifestyle Products, Internet Services, and smart electric vehicles segments. The company also offers internet of things (IoT) and lifestyle products comprising smart large home appliances, smart TVs, tablets, wearables and other IoT and lifestyle products; hardware repairment services for products; installation serv	562666930176.0		1.8	76.02150314018954	156.2794016865734		188478801000.0	22921433000.0	13202226000.0	41837896000.0	266218661000.0	7.777763392309374	1.004098250989961	4.687666888018463	7.579020379991428	156.2794016865734	0.048496604787312624	20.620000191469355	매우 유망	안심(>=2)	60.0	108.0	404.20167887639894	매우 유망	충분
9888.HK	9888.HK	China / Hong Kong	98.75	-10.063754776535871	-15.308746747610657		-38.47352024922118	124.2537488937378	124.33624969482422	N	N	주의	BIDU-SW	HKG	HKD	Communication Services	Internet Content & Information	Internet Content & Information	Baidu, Inc. provides internet content, value-added telecommunication-based, internet map, and online audio and video services in the People's Republic of China. It operates in two segments, Baidu General Business and iQIYI. The Baidu General Business segment offers products and services for mobile ecosystem, AI cloud, and intelligent driving. This segment operates Baidu App that enables users to access search, feed, content, and other services through mobile devices; and Haokan, which offers a r	283906834432.0		-0.15	-76.47727272727273	-9.574707672764294		205928000000.0	61102000000.0	28410000000.0	97077000000.0	266330000000.0	65.88987137071996	-7.474974014478953	-7.569593938712864		-9.574707672764294			판정불가	판정불가				보류	일부부족
1024.HK	1024.HK	China / Hong Kong	40.880001068115234	-20.928432369734917	-36.224645801482204		-55.49264915923406	46.42900009155274	63.274799842834476	N	N	주의	KUAISHOU-W	HKG	HKD	Communication Services	Internet Content & Information	Internet Content & Information	Kuaishou Technology, an investment holding company, provides live streaming, online marketing, and other services in the People's Republic of China. It offers Kuaishou Flagship, a short video and content based social networking platform; Kuaishou Express; Kuaishou Concept; Yitian Camera, an app to create features Japanese-and-Korean-style filters and cute stickers; Kmovie, a shooting, editing, and production tool; and AcFun, a video sharing website. The company also provides entertainment, e-com	177303306240.0	1.69	4.88	21.402021519400073			113106000000.0	11098000000.0	13916000000.0	34953000000.0	79558000000.0	27.87595572228316	3.217507476611265	7.870614952407112	2.6647633905393597	21.402021519400073	0.12450989212041763	8.665693022270975	매우 유망	안심(>=2)	8.5	41.48	1.4677077206652456	매우 유망	충분
1211.HK	1211.HK	China / Hong Kong	72.6500015258789	-29.052733942080533	-23.16234883026982		-45.86437915203655	91.06250019073487	99.24850002288818	N	N	주의	BYD COMPANY	HKG	HKD	Consumer Cyclical	Auto Manufacturers	Auto Manufacturers	BYD Company Limited, together with its subsidiaries, engages in automobiles and batteries business in the People's Republic of China, Hong Kong, Macau, Taiwan, and internationally. It operates in two segments, Mobile Handset Components, Assembly Service and Other Products; and Automobiles and Related Products and Other Products. The Mobile Handset Components, Assembly Service and Other Products segment manufactures and sells mobile handset components, such as housings and electronic components, 	664643698688.0	56.99999999999999	2.25	-18.967701027859206	25.196441286638958		184489829000.0	65703479000.0	38484710000.0	119120640000.0	246274606000.0	32.249104088613784	-26.516889015583427	-36.49950235188605	17.955954416562278	25.196441286638958	0.7126385116172684	4.5776704139336815	헐값	안심(>=2)	58.892882573277916	132.5089857898753	82.39364488199472	보류	충분
2318.HK	2318.HK	China / Hong Kong	50.54999923706055	-12.086957848590352	-20.892021862333966		-31.17767006487219	59.46624984741211	61.16925018310547	N	N	주의	PING AN	HKG	HKD	Financial Services	Insurance - Life	Insurance - Life	Ping An Insurance (Group) Company of China, Ltd. provides financial products and services in the People's Republic of China. It operates through Life and Health Insurance; Property and Casualty Insurance; Banking; Asset Management; and Finance Enablement segments. The company offers life insurance products, including term, whole-life, endowment, annuity, investment-linked, universal life, and health care and medical insurance; property and casualty insurance, such as auto insurance, non-auto ins	939786633216.0	6.04	8.37	6.453829567085556	6.681286200386016		1018674000000.0	1345587000000.0	84520000000.0	1438514000000.0	1000419000000.0	-43.89521637208706	87.31390191516293	172.72780065869725	11.283777253183706	6.681286200386016	1.6888630294765365	1.1273960762382755	보통	보통(1~1.5)	21.86257240077203	182.9897309944619	261.9974950668321	보류	충분
0939.HK	0939.HK	China / Hong Kong	8.260000228881836	6.033379580620801	11.77267088111571		-8.120128596460818	8.71499993801117	8.078549990653991	N	Y	상승전환/양호	CCB	HKG	HKD	Financial Services	Banks - Diversified	Banks - Diversified	China Construction Bank Corporation engages in the provision of various banking and related financial services to individuals and corporate customers in the People's Republic of China and internationally. It operates through Corporate Finance Business, Personal Finance Business, Treasury and Asset Management Business, and Others segments. The company offers corporate and personal loans; trade financing; deposit taking and wealth management, agency, financial consulting and advisory, cash managem	2155587043328.0	5.26	1.5	0.9920226952383482	1.4347942111190504		4254869000000.0	0.0	0.0	3093481000000.0	3663411000000.0	17.69784723548096	8.641964734641563	104.62426749607287	-6.291898004399417	1.4347942111190504	-4.3852267841895785		판정불가	판정불가	11.3695884222381	17.05438263335715	106.46951768505963	보류	충분
1398.HK	1398.HK	China / Hong Kong	6.619999885559082	3.924646852298297	10.702338870305805		-8.8154314482897	6.895249974727631	6.420649974346161	N	Y	상승전환/양호	ICBC	HKG	HKD	Financial Services	Banks - Diversified	Banks - Diversified	Industrial and Commercial Bank of China Limited, together with its subsidiaries, provides banking products and services in the People's Republic of China and internationally. It operates through Corporate Banking, Personal Banking, and Treasury Operations segments. The Corporate Banking segment offers corporate loans, trade financing, deposit-taking activities, corporate wealth management services, custody services, and various types of corporate intermediary services, as well as corporate loans	2359409508352.0	5.29	1.17	0.7377078305267348	0.6811562101320723		5268700000000.0	0.0	0.0	2751358000000.0	4244259000000.0	60.703473692423984	21.341222310857273	322.3749649514523	-46.22519128791872	0.6811562101320723	-67.86283469243556		판정불가	판정불가	9.862312420264145	11.538905531709048	74.30371195141716	보류	충분
3988.HK	3988.HK	China / Hong Kong	5.059999942779541	10.239646504731814	17.129623650768888		-8.499100347142608	5.242499971389771	4.702749993801117	N	Y	상승전환/양호	BANK OF CHINA	HKG	HKD	Financial Services	Banks - Diversified	Banks - Diversified	Bank of China Limited, together with its subsidiaries, provides various banking and financial services in Chinese Mainland, Hong Kong, Macao, Taiwan, and internationally. The company operates through six segments: Corporate Banking, Personal Banking, Treasury Operations, Investment Banking, Insurance, and Other. The Corporate Banking segment provides current accounts, deposits, overdrafts, loans, payments and settlements, trade-related products, and other credit facilities, as well as foreign cu	1640061206528.0	5.0	0.85	2.1779255889438742	2.3712026525481544		4330456000000.0	0.0	0.0	2782404000000.0	3064044000000.0	51.78591383406694	9.097539947447396	179.79328162699483	-54.97166340151459	2.3712026525481544	-23.18303049401562		판정불가	판정불가	13.242405305096309	11.256044509331863	122.45147503200826	보류	충분
0941.HK	0941.HK	China / Hong Kong	77.4000015258789	-0.5780307733618928	-8.18505489453245		-14.333145729882279	83.67500019073486	83.12875	N	N	주의	CHINA MOBILE	HKG	HKD	Communication Services	Telecom Services	Telecom Services	China Mobile Limited provides communication, computing, and AI services in Mainland China and Hong Kong. It offers communications services, including mobile communications, broadband networks, cellular IoT, and satellite Internet; computing services comprising data centers, cloud computing services, and cloud computing applications; and AI services, such as data algorithms, embodied intelligence, digital intelligence culture, digital intelligence e-commerce, and industry digital intelligence ser	1672045920256.0	6.51	7.28	-0.9235905848684389	3.000641948799565		520239000000.0	9748000000.0	42507000000.0	101197000000.0	1428475000000.0	24.61165600002836	3.6625489636646966	4.731975311964449	7.251146363441008	3.000641948799565	2.416531691274228	1.311605292750748	매우 불리	보통(1~1.5)	14.50128389759913	105.56934677452168	36.394502187734815	보류	충분
0883.HK	0883.HK	China / Hong Kong	20.860000610351562	-31.606555375896516	3.2673258538831185		-31.606555375896516	25.931500053405763	23.47144998550415	N	N	중립	CNOOC	HKG	HKD	Energy	Oil & Gas E&P	Oil & Gas E&P	CNOOC Limited, an investment holding company, engages in the exploration, development, production, and sale of crude oil and natural gas in worldwide. The company produces offshore crude oil and natural gas primarily in Bohai Sea, the Western South China Sea, the Eastern South China Sea, and the East China Sea in China. It also holds interests in various oil and gas assets in Asia, Africa, North America, South America, Oceania, and Europe. In addition, the company is involved in the sales and tr	1001931472896.0	6.14	2.97	-11.493736225495887	-4.845953497090038		402707000000.0	58832000000.0	1308000000.0	69800000000.0	802750000000.0	7.72059621174125	2.1887539451661775	10.492588116608351	4.4240418850539776	-4.845953497090038		0.2925032213826278	판정불가	불리(<1)	0.0	0.0	-100.0	보류	일부부족
0857.HK	0857.HK	China / Hong Kong	8.779999732971191	-18.401491206254406	9.33997540399034		-27.01579444837867	10.539499926567078	9.189450013637543	N	N	중립	PETROCHINA	HKG	HKD	Energy	Oil & Gas Integrated	Oil & Gas Integrated	PetroChina Company Limited, together with its subsidiaries, engages in a range of petroleum related products, services, and activities in Mainland China and internationally. It operates through the Oil and Gas and New Energy; Refining, Chemicals and New Materials; Sales; and Natural Gas Sales Segments. The Oil, Gas and New Energy Resource segment engages in the exploration, development, transportation, production, and marketing of crude oil and natural gas, as well as is involved in the new ener	1608754397184.0	6.54	1.0	-4.477883844640385	1.8835578227509364		251258000000.0	163462000000.0	34513000000.0	353775000000.0	1586061000000.0	4.161164800060667	5.674276858035253	64.6273010319905	4.6188349329105245	1.8835578227509364	2.452186429915231	1.8237408231956223	매우 불리	양호(>=1.5)	12.267115645501873	12.267115645501873	39.7165833551868	보류	충분
0386.HK	0386.HK	China / Hong Kong	4.070000171661377	-10.154525758099997	-6.864982191168279		-28.091867820062213	4.38199999332428	4.562849996089935	N	N	주의	SINOPEC CORP	HKG	HKD	Energy	Oil & Gas Integrated	Oil & Gas Integrated	China Petroleum & Chemical Corporation, an energy and chemical company, engages in the oil and gas and chemical operations in Mainland China. It operates through Exploration and Production, Refining, Marketing and Distribution, Chemicals, and Corporate and Others segments. The company explores and develops oil fields; produces and sells crude oil and natural gas; processes, purifies, imports, and trades in crude oil; manufactures, produces, sells, stores, and trades in petroleum products; owns a	493158105088.0	6.33	0.31	-33.63983734853593	-21.420834213525552		231381000000.0	235264000000.0	120256000000.0	531006000000.0	827463000000.0	-0.16338898048667666	1.2148347297529853	29.84851789962183	13.656094039187272	-21.420834213525552		-1.1050622652583657	판정불가	불리(<1)	0.0	0.0	-100.0	보류	일부부족
0005.HK	0005.HK	China / Hong Kong	147.6999969482422	24.222031162964175	27.10843444688793		-0.8724852696361141	143.2025001525879	125.1184999847412	Y	Y	상승전환/양호	HSBC HOLDINGS	HKG	HKD	Financial Services	Banks - Diversified	Banks - Diversified	HSBC Holdings plc engages in the provision of banking and financial products and services worldwide. It operates through four segments: Hong Kong, UK, Corporate and Institutional Banking, and International Wealth and Premier Banking. The Hong Kong segment is involved in the retail banking and wealth and commercial banking of HSBC Hong Kong and Hang Seng Bank. The UK segment engages in UK retail banking and wealth, as well as first direct and M&S Bank, UK Commercial Banking, and HSBC Innovation B	2531075817472.0	3.97	9.48	-7.064514783769127	12.722423966662477		307737000000.0	0.0	0.0	256139000000.0	198225000000.0	17.94572196649868	1.4640012412187986	0.9911992359294507	13.68715980820079	12.722423966662477	1.0758295623590506	1.2195681354331127	보통	보통(1~1.5)	33.94484793332495	321.79715840792056	117.87214966611437	보류	충분
1299.HK	1299.HK	China / Hong Kong	70.80000305175781	-10.775041697261967	-11.278195057414543		-22.155024268941236	80.62749977111817	80.60200008392334	N	N	주의	AIA	HKG	HKD	Financial Services	Insurance - Life	Insurance - Life	AIA Group Limited, together with its subsidiaries, provides life insurance based financial services in Hong Kong. The company offers life insurance, accident, and health insurance and savings plans; and employee benefits, credit life, and pension services to corporate clients. It is also involved in the distribution of investment and other financial services products. It sells its products through a network of agents and partners in Mainland China, Macau, Thailand, Singapore, Malaysia, Australia	744032894976.0	2.73	4.62	-8.806319485078994	23.234050071757984		221334000000.0	14245000000.0	0.0	14671000000.0	43245000000.0	20.0956498825624	0.6515179140926074	0.9202230028384604	10.974968218440566	23.234050071757984	0.47236569537142925	2.36575173203073	매우 유망	안심(>=2)	54.96810014351597	253.95262266304377	258.6901295433471	매우 유망	충분
0388.HK	0388.HK	China / Hong Kong	362.20001220703125	-5.331937681925957	-8.535350452769885		-21.737246810589895	400.1900001525879	416.15800064086915	N	N	주의	HKEX	HKG	HKD	Financial Services	Financial Data & Stock Exchanges	Financial Data & Stock Exchanges	Hong Kong Exchanges and Clearing Limited, together with its subsidiaries, owns and operates stock and futures exchanges, and related clearing houses in Hong Kong, the United Kingdom, and Mainland China. It operates through Cash, Equity and Financial Derivatives, Commodities, and Data and Connectivity segments. The Cash segment covers various equity products traded on the cash market platforms of the Stock Exchange of Hong Kong Limited, as well as through the Shanghai-Hong Kong and the Shenzhen-H	463899426816.0	3.6	14.89	36.04597701149426	20.77414004603453		453788000000.0	61000000.0	430000000.0	851000000.0	58147000000.0	358.9524103091035	18.903016333446587	5.218944145877538	0.2181062389474629	20.77414004603453	0.01049892984567109	111.75352050294048	매우 유망	안심(>=2)	50.04828009206906	745.2188905709082	105.747892174268	매우 유망	충분
2382.HK	2382.HK	China / Hong Kong	60.900001525878906	15.55977351845883	-7.164629660923416		-33.00329977602817	71.94374990463257	68.53325010299683	N	N	주의	SUNNY OPTICAL	HKG	HKD	Technology	Electronic Components	Electronic Components	Sunny Optical Technology (Group) Company Limited, an investment holding company, engages in designing, researching, developing, manufacturing, and selling optical and optical related products, and scientific instruments. It operates through Optical Components, Optoelectronic Products, and Optical Instruments segments. The Optical Components segment offers vehicle lens sets and optical parts for vehicle light detection and ranging, handset lens sets, glass spherical and aspherical lenses for digi	63805988864.0	1.98	4.9	71.87231282040072	24.433762661282877		38549973000.0	1405760000.0	4655009000.0	6244099000.0	29148588000.0	34.57930031499529	2.931125362464284	4.813013610876067	5.371571675690534	24.433762661282877	0.21984218108994694	4.9173248084579075	매우 유망	안심(>=2)	57.367525322565754	281.1008740805722	361.57777838662446	매우 유망	충분
9868.HK	9868.HK	China / Hong Kong	45.58000183105469	-36.34077820891435	-37.04419769278262		-57.99078172253025	59.93449983596802	74.30839988708496	N	N	주의	XPENG-W	HKG	HKD	Consumer Cyclical	Auto Manufacturers	Auto Manufacturers	XPeng Inc. designs, develops, manufactures, and markets smart electric vehicles (EVs) in the People's Republic of China. The company offers P7 and P7i, a four-door sports sedan; G9, a smart EV and a mid- to large-sized sport utility vehicle (SUV); G7 for families and individual consumers seeking advanced technology and comfort; G6, a smart EV and a coupe SUV; X9, Smart EV and a large seven-seater multi-purpose vehicle (MPV); MONA M03, an all-electric hatchback coupe; Next P7, an all-new coupe sp	90683015168.0		-1.36				52582500000.0	6755098000.0	7309923000.0	19553678000.0	30368590000.0	29.29325260445298	3.139453333088747	6.887786763864863					판정불가	판정불가				판정불가	일부부족
2015.HK	2015.HK	China / Hong Kong	46.279998779296875	-28.580252160896393	-27.912771060397944		-62.82731021743223	61.08225002288818	72.76645004272461	N	N	주의	LI AUTO-W	HKG	HKD	Consumer Cyclical	Auto Manufacturers	Auto Manufacturers	Li Auto Inc. operates in the energy vehicle market in the People's Republic of China. The company designs, develops, manufactures, and sells premium smart electric vehicles. Its product line comprises multi-purpose vehicles and sport utility vehicles. The company offers sales and after sales management, and technology development and corporate management services, as well as manufacturing equipment. It offers its products through online and offline channels. The company was formerly known as Lea	91642601472.0		-1.04	-86.00113291875977			145354579000.0	3299203000.0	6217745000.0	17814767000.0	72619255000.0	86.54155190249875	-7.808191843164478	-16.87163364113448		-86.00113291875977			판정불가	판정불가				보류	일부부족
