티커	종목코드	유니버스	현재가	3M수익률(보조,%)	6M수익률(보조,%)	12M수익률(보조,%)	52주고점대비(보조,%)	40일이평(보조)	200일이평(보조)	40일선상회(보조)	200일선상회(보조)	추세판정(보조)	종목명	시장	통화	섹터	산업	업종	사업설명	시가총액	배당수익률(%)	EPS(FY)	EPS Growth 1Y(%)	EPS Growth 3Y CAGR(%)	EPS Growth 5Y CAGR(%)	현금및단기투자	장기부채	단기위험부채	총부채	주주지분	주당순현금(린치식)	주당잉여현금흐름	잉여현금흐름수익률(%)	순현금차감PER(린치식)	사용연성장률(%)	린치PER배수	배당감안점수	린치PER판정	배당감안점수판정	그레이엄적정PER(3년)	그레이엄내재가치(3년)	그레이엄괴리율(3년,%)	종합판정	데이터상태
0700.HK	0700.HK	China / Hong Kong	447.3999938964844	-18.13357842699279	-26.655738705494368		-33.96310053188423	463.77250213623046	567.559500579834	N	N	주의	TENCENT	HKG	HKD	Communication Services	Internet Content & Information	Internet Content & Information	Tencent Holdings Limited, an investment holding company, provides value-added services, marketing services, fintech, and business services in Mainland China and internationally. The company's consumers business includes communications and social services, such as instant messaging and social networks; digital content, including online games, videos, live streaming, news, music, and literature; fintech services, which include mobile payment, wealth management, consumer loans, and securities tradi	4015985262592.0	1.18	27.92	15.854343468694765	6.10101407396777		712465000000.0	334573000000.0	53160000000.0	406399000000.0	1154152000000.0	41.91078624970387	21.091253934702067	4.7141828838696815	14.523252422878958	6.10101407396777	2.3804653204862745	0.5013349532159717	매우 불리	불리(<1)	20.70202814793554	578.0006258903603	29.19102230119681	보류	충분
9988.HK	9988.HK	China / Hong Kong	107.0	-18.693012889502025	-30.967741935483872		-42.19341087424863	127.03749961853028	145.0225001525879	N	N	주의	BABA-W	HKG	HKD	Consumer Cyclical	Internet Retail	Internet Retail	Alibaba Group Holding Limited, through its subsidiaries, provides technology infrastructure and marketing reach to help merchants, brands, retailers, and other businesses in the People's Republic of China and internationally. It operates through the Alibaba China E-Commerce Group, Alibaba International Digital Commerce Group, Cloud Intelligence Group, and All Others segments. The Alibaba China E-commerce Group segment operates Taobao and Tmall, which are digital retail platforms; Taobao Instant 	2051739353088.0	96.0	6.36	-20.380603955145304	12.486072925161418		502258000000.0	231772000000.0	28224000000.0	281722000000.0	1060886000000.0	14.092897718088157	-2.642828626443896	-2.469933295741959	14.60803494998614	12.486072925161418	1.1699463103846393	7.426465865983183	보통	안심(>=2)	33.47214585032283	212.88284760805323	98.95593234397498	보류	충분
3690.HK	3690.HK	China / Hong Kong	75.30000305175781	-1.8252854656944817	-23.977788256694577		-45.474294189882094	81.31749973297119	93.13700012207032	N	N	주의	MEITUAN-W	HKG	HKD	Consumer Cyclical	Internet Retail	Internet Retail	Meituan operates as a technology driven retail company in the People's Republic of China, Hong Kong, Macao, Taiwan, and internationally. It operates through Core Local Commerce and New Initiatives segments. The company offers daily goods and services, such as food delivery, in-store, hotel and travel booking, and other services and sales; bike sharing, e-moped sharing, power banks and micro-credit; and operates Kuailv and Xiaoxiang Supermarkets. It also sells goods from B2B food distribution ser	459374100480.0		-4.53				226896042000.0	65904021000.0	14379078000.0	86619106000.0	151045913000.0	28.773081962634354	-4.8408568339735485	-6.428760475143889					판정불가	판정불가				보류	일부부족
9618.HK	9618.HK	China / Hong Kong	111.5999984741211	1.9178068256813674	-4.615385919554615		-21.84874223450002	118.26500015258789	117.94525043487549	N	N	주의	JD-SW	HKG	HKD	Consumer Cyclical	Internet Retail	Internet Retail	JD.com, Inc. operates as a supply chain-based technology and service provider in the People's Republic of China and Europe. It operates through three segments: JD Retail, JD Logistics, and New Businesses. The company provides home appliances; mobile handsets and other digital products; computers, including desktop, laptop, and other various products, as well as printers and other office equipment; furniture and household goods; apparel; cosmetics and other personal care items; and pet products. 	303485353984.0	3.51	5.36	-52.53511932106676	23.66544269567723		288976000000.0	62473000000.0	11525000000.0	107105000000.0	225040000000.0	93.98950734042998	1.9947089521350574	1.7873736374625577	3.2855393906140136	23.66544269567723	0.13883278808108482	8.271227176064562	매우 유망	안심(>=2)	55.83088539135446	299.2535456976599	168.14834210508863	매우 유망	충분
9999.HK	9999.HK	China / Hong Kong	195.60000610351562	6.710312518808137	-10.275226558020357		-20.61687867342661	185.22499961853026	204.50900009155274	Y	N	상승전환/양호	NTES-S	HKG	HKD	Communication Services	Electronic Gaming & Multimedia	Electronic Gaming & Multimedia	NetEase, Inc. engages in online games, music streaming, online intelligent learning services, and internet content services businesses in China and internationally. The company operates through Games and Related Value-Added Services; Youdao; NetEase Cloud Music; and Innovative Businesses and Others segments. It develops and operates mobile and PC games; and offers games licensed from other developers. The company also provides live streaming service, and other related or ancillary value-added se	626299371520.0	2.31	12.23	13.67851196370724	18.404094603117294		278053666000.0	427997000.0	6384417000.0	6729742000.0	160296119000.0	86.66114128527116	15.197802250909037	7.769837309138958	8.907511432399383	18.404094603117294	0.48399617718171395	2.325463712319661	매우 유망	안심(>=2)	45.30818920623459	554.119153992249	183.29199217866977	매우 유망	충분
1810.HK	1810.HK	China / Hong Kong	25.65999984741211	-22.942941635703274	-40.018698972403634		-57.339984710769855	29.633499956130983	39.35244997978211	N	N	주의	XIAOMI-W	HKG	HKD	Technology	Consumer Electronics	Consumer Electronics	Xiaomi Corporation, an investment holding company, engages in the development and sales of smartphones in Mainland China and internationally. It operates through Smartphones, IoT and Lifestyle Products, Internet Services, and smart electric vehicles segments. The company also offers internet of things (IoT) and lifestyle products comprising smart large home appliances, smart TVs, tablets, wearables and other IoT and lifestyle products; hardware repairment services for products; installation serv	654839250944.0		1.8	76.02150314018954	156.2794016865734		188478801000.0	22921433000.0	13202226000.0	41837896000.0	266218661000.0	7.770016149149298	1.0030980928577764	3.909189784967758	9.938879832368228	156.2794016865734	0.06359686385478475	15.724045800172965	매우 유망	안심(>=2)	60.0	108.0	320.8885449813911	매우 유망	충분
9888.HK	9888.HK	China / Hong Kong	110.69999694824219	-8.05648210523634	-8.96381715678939		-31.02803928458431	127.07499923706055	123.67699974060059	N	N	주의	BIDU-SW	HKG	HKD	Communication Services	Internet Content & Information	Internet Content & Information	Baidu, Inc. provides internet content, value-added telecommunication-based, internet map, and online audio and video services in the People's Republic of China. It operates in two segments, Baidu General Business and iQIYI. The Baidu General Business segment offers products and services for mobile ecosystem, AI cloud, and intelligent driving. This segment operates Baidu App that enables users to access search, feed, content, and other services through mobile devices; and Haokan, which offers a r	305410801664.0		-0.15	-76.47727272727273	-9.574707672764294		205928000000.0	61102000000.0	28410000000.0	97077000000.0	266330000000.0	65.88987137071996	-7.474974014478953	-6.752460903837133		-9.574707672764294			판정불가	판정불가				보류	일부부족
1024.HK	1024.HK	China / Hong Kong	44.439998626708984	-26.17940521012867	-35.780345973212		-51.61676715843383	46.49949998855591	64.39034978866577	N	N	주의	KUAISHOU-W	HKG	HKD	Communication Services	Internet Content & Information	Internet Content & Information	Kuaishou Technology, an investment holding company, provides live streaming, online marketing, and other services in the People's Republic of China. It offers Kuaishou Flagship, a short video and content based social networking platform; Kuaishou Express; Kuaishou Concept; Yitian Camera, an app to create features Japanese-and-Korean-style filters and cute stickers; Kmovie, a shooting, editing, and production tool; and AcFun, a video sharing website. The company also provides entertainment, e-com	206393442304.0	1.55	4.89	21.402021519400073			113106000000.0	11098000000.0	13916000000.0	34953000000.0	79558000000.0	27.884070641258763	3.2184441193845648	7.242223714764565	3.3856703446728473	21.402021519400073	0.15819395105288878	6.779166068401706	매우 유망	안심(>=2)	8.5	41.565	-6.46939404939828	양호	충분
1211.HK	1211.HK	China / Hong Kong	84.05000305175781	-14.409362867844433	-15.229448554450986		-37.369593917223455	96.03500003814698	100.54350006103516	N	N	주의	BYD COMPANY	HKG	HKD	Consumer Cyclical	Auto Manufacturers	Auto Manufacturers	BYD Company Limited, together with its subsidiaries, engages in automobiles and batteries business in the People's Republic of China, Hong Kong, Macau, Taiwan, and internationally. It operates in two segments, Mobile Handset Components, Assembly Service and Other Products; and Automobiles and Related Products and Other Products. The Mobile Handset Components, Assembly Service and Other Products segment manufactures and sells mobile handset components, such as housings and electronic components, 	746698506240.0	49.0	2.25	-18.967701027859206	25.196441286638958		184489829000.0	65703479000.0	38484710000.0	119120640000.0	246274606000.0	32.249104088613784	-26.516889015583427	-31.548944738591363	23.022621761397346	25.196441286638958	0.9137251367956342	3.2227624662212078	헐값	안심(>=2)	58.892882573277916	132.5089857898753	57.65494465036076	보류	충분
2318.HK	2318.HK	China / Hong Kong	56.349998474121094	-10.34208457885073	-6.782468547679454		-23.281142524990027	60.79125003814697	61.30450021743774	N	N	주의	PING AN	HKG	HKD	Financial Services	Insurance - Life	Insurance - Life	Ping An Insurance (Group) Company of China, Ltd. provides financial products and services in the People's Republic of China. It operates through Life and Health Insurance; Property and Casualty Insurance; Banking; Asset Management; and Finance Enablement segments. The company offers life insurance products, including term, whole-life, endowment, annuity, investment-linked, universal life, and health care and medical insurance; property and casualty insurance, such as auto insurance, non-auto ins	1015838670848.0	10.354765142859232	8.38	6.453829567085556	6.681286200386016		1018674000000.0	1345587000000.0	84520000000.0	1438514000000.0	1000419000000.0	-43.89521637208706	87.31390191516293	154.9492533797709	11.96243613916565	6.681286200386016	1.7904391131268276	1.4241289270057889	보통	보통(1~1.5)	21.86257240077203	183.20835671846964	225.12575275864228	보류	충분
0939.HK	0939.HK	China / Hong Kong	8.890000343322754	12.247478001069755	11.403512807947624		-1.1123407156991783	8.779499936103822	8.047049989700318	Y	Y	상승전환/양호	CCB	HKG	HKD	Financial Services	Banks - Diversified	Banks - Diversified	China Construction Bank Corporation engages in the provision of various banking and related financial services to individuals and corporate customers in the People's Republic of China and internationally. It operates through Corporate Finance Business, Personal Finance Business, Treasury and Asset Management Business, and Others segments. The company offers corporate and personal loans; trade financing; deposit taking and wealth management, agency, financial consulting and advisory, cash managem	2278539395072.0	4.89	1.5	0.9920226952383482	1.4347942111190504		4254869000000.0	0.0	0.0	3093481000000.0	3663411000000.0	17.69784723548096	8.641964734641563	97.20994826656572	-5.871897928105471	1.4347942111190504	-4.0925018254191		판정불가	판정불가	11.3695884222381	17.05438263335715	91.83781748857449	보류	충분
1398.HK	1398.HK	China / Hong Kong	7.190000057220459	13.946119214278152	13.58610021926976		-0.9641896619080104	6.96199997663498	6.386999974250793	Y	Y	상승전환/양호	ICBC	HKG	HKD	Financial Services	Banks - Diversified	Banks - Diversified	Industrial and Commercial Bank of China Limited, together with its subsidiaries, provides banking products and services in the People's Republic of China and internationally. It operates through Corporate Banking, Personal Banking, and Treasury Operations segments. The Corporate Banking segment offers corporate loans, trade financing, deposit-taking activities, corporate wealth management services, custody services, and various types of corporate intermediary services, as well as corporate loans	2509100023808.0	9.538734277355946	1.17	0.7377078305267348	0.6811562101320723		5268700000000.0	0.0	0.0	2751358000000.0	4244259000000.0	60.703473692423984	21.341222310857273	296.8181104452933	-45.73801165402011	0.6811562101320723	-67.14761015707656		판정불가	판정불가	9.862312420264145	11.538905531709048	60.48547204281676	보류	충분
3988.HK	3988.HK	China / Hong Kong	5.46999979019165	20.219770569024952	20.219770569024952		-1.0849985052492128	5.2319999694824215	4.672599995136261	Y	Y	상승전환/양호	BANK OF CHINA	HKG	HKD	Financial Services	Banks - Diversified	Banks - Diversified	Bank of China Limited, together with its subsidiaries, provides various banking and financial services in Chinese Mainland, Hong Kong, Macao, Taiwan, and internationally. The company operates through six segments: Corporate Banking, Personal Banking, Treasury Operations, Investment Banking, Insurance, and Other. The Corporate Banking segment provides current accounts, deposits, overdrafts, loans, payments and settlements, trade-related products, and other credit facilities, as well as foreign cu	1714169970688.0	4.62	0.86	2.1779255889438742	2.3712026525481544		4330456000000.0	0.0	0.0	2782404000000.0	3064044000000.0	51.78591383406694	9.097539947447396	166.3170072466977	-53.85571400450615	2.3712026525481544	-22.712404587870815		판정불가	판정불가	13.242405305096309	11.388468562382826	108.19870199636354	보류	충분
0941.HK	0941.HK	China / Hong Kong	81.30000305175781	2.911396268047861	-6.712562675496859		-10.016597205538936	84.52750015258789	83.5084999847412	N	N	주의	CHINA MOBILE	HKG	HKD	Communication Services	Telecom Services	Telecom Services	China Mobile Limited provides communication, computing, and AI services in Mainland China and Hong Kong. It offers communications services, including mobile communications, broadband networks, cellular IoT, and satellite Internet; computing services comprising data centers, cloud computing services, and cloud computing applications; and AI services, such as data algorithms, embodied intelligence, digital intelligence culture, digital intelligence e-commerce, and industry digital intelligence ser	1748884389888.0	12.742926950943087	7.28	-0.9235905848684389	3.000641948799565		520239000000.0	9748000000.0	42507000000.0	101197000000.0	1428475000000.0	24.61165600002836	3.6625489636646966	4.504980106006905	7.7868608587540455	3.000641948799565	2.595064986633694	2.0218120222404665	매우 불리	안심(>=2)	14.50128389759913	105.56934677452168	29.851590174373467	보류	충분
0883.HK	0883.HK	China / Hong Kong	23.579999923706055	-18.969073489355324	6.793478284343357		-22.688524840308023	26.92050004005432	23.369649982452394	N	Y	상승전환/양호	CNOOC	HKG	HKD	Energy	Oil & Gas E&P	Oil & Gas E&P	CNOOC Limited, an investment holding company, engages in the exploration, development, production, and sale of crude oil and natural gas in worldwide. The company produces offshore crude oil and natural gas primarily in Bohai Sea, the Western South China Sea, the Eastern South China Sea, and the East China Sea in China. It also holds interests in various oil and gas assets in Asia, Africa, North America, South America, Oceania, and Europe. In addition, the company is involved in the sales and tr	1085584179200.0	5.43	2.97	-11.493736225495887	-4.845953497090038		402707000000.0	58832000000.0	1308000000.0	69800000000.0	802750000000.0	7.72059621174125	2.1887539451661775	9.282247465004115	5.339866569685119	-4.845953497090038		0.10937473723138395	판정불가	불리(<1)	0.0	0.0	-100.0	보류	일부부족
0857.HK	0857.HK	China / Hong Kong	9.789999961853027	-7.81544192702559	10.872027706021203		-18.620114886444185	10.877499961853028	9.133350024223327	N	Y	상승전환/양호	PETROCHINA	HKG	HKD	Energy	Oil & Gas Integrated	Oil & Gas Integrated	PetroChina Company Limited, together with its subsidiaries, engages in a range of petroleum related products, services, and activities in Mainland China and internationally. It operates through the Oil and Gas and New Energy; Refining, Chemicals and New Materials; Sales; and Natural Gas Sales Segments. The Oil, Gas and New Energy Resource segment engages in the exploration, development, transportation, production, and marketing of crude oil and natural gas, as well as is involved in the new ener	1780793999360.0	5.87	1.0	-4.477883844640385	1.8835578227509364		251258000000.0	163462000000.0	34513000000.0	353775000000.0	1586061000000.0	4.161164800060667	5.674276858035253	57.95992727421053	5.62883516179236	1.8835578227509364	2.9884058210495743	1.3774711107869806	매우 불리	보통(1~1.5)	12.267115645501873	12.267115645501873	25.302509635352276	보류	충분
0386.HK	0386.HK	China / Hong Kong	4.28000020980835	-14.056221015745486	-5.518763541306249		-24.381619696239554	4.457749998569488	4.571399993896485	N	N	주의	SINOPEC CORP	HKG	HKD	Energy	Oil & Gas Integrated	Oil & Gas Integrated	China Petroleum & Chemical Corporation, an energy and chemical company, engages in the oil and gas and chemical operations in Mainland China. It operates through Exploration and Production, Refining, Marketing and Distribution, Chemicals, and Corporate and Others segments. The company explores and develops oil fields; produces and sells crude oil and natural gas; processes, purifies, imports, and trades in crude oil; manufactures, produces, sells, stores, and trades in petroleum products; owns a	513933410304.0	6.02	0.31	-33.63983734853593	-21.420834213525552		231381000000.0	235264000000.0	120256000000.0	531006000000.0	827463000000.0	-0.16327062230528314	1.2139547093937237	28.363426399179602	14.333131716495592	-21.420834213525552		-1.0744919197108314	판정불가	불리(<1)	0.0	0.0	-100.0	보류	일부부족
0005.HK	0005.HK	China / Hong Kong	146.0	13.266103113432347	31.53153153153154		-0.8825546672263318	142.05250053405763	123.45125003814697	Y	Y	상승전환/양호	HSBC HOLDINGS	HKG	HKD	Financial Services	Banks - Diversified	Banks - Diversified	HSBC Holdings plc engages in the provision of banking and financial products and services worldwide. It operates through four segments: Hong Kong, UK, Corporate and Institutional Banking, and International Wealth and Premier Banking. The Hong Kong segment is involved in the retail banking and wealth and commercial banking of HSBC Hong Kong and Hang Seng Bank. The UK segment engages in UK retail banking and wealth, as well as first direct and M&S Bank, UK Commercial Banking, and HSBC Innovation B	2537935077376.0	4.01	9.48	-7.064514783769127	12.722423966662477		307737000000.0	0.0	0.0	256139000000.0	198225000000.0	17.94572196649868	1.4640012412187986	1.0027405761772592	13.507835235601403	12.722423966662477	1.0617344046226567	1.2387198744149848	보통	보통(1~1.5)	33.94484793332495	321.79715840792056	120.40901260816477	보류	충분
1299.HK	1299.HK	China / Hong Kong	75.19999694824219	-10.84766057071852	-3.959139186069327		-17.317207837800154	82.29374980926514	80.60225006103515	N	N	주의	AIA	HKG	HKD	Financial Services	Insurance - Life	Insurance - Life	AIA Group Limited, together with its subsidiaries, provides life insurance based financial services in Hong Kong. The company offers life insurance, accident, and health insurance and savings plans; and employee benefits, credit life, and pension services to corporate clients. It is also involved in the distribution of investment and other financial services products. It sells its products through a network of agents and partners in Mainland China, Macau, Thailand, Singapore, Malaysia, Australia	775930773504.0	2.57	4.62	-8.806319485078994	23.234050071757984		221334000000.0	14245000000.0	0.0	14671000000.0	43245000000.0	20.030175488535328	0.6493951790294327	0.8635574539669079	11.941519796473345	23.234050071757984	0.5139663450664932	2.1608681735283493	헐값	안심(>=2)	54.96810014351597	253.95262266304377	237.7029693735645	양호	충분
0388.HK	0388.HK	China / Hong Kong	386.0	-5.0196836129088425	-5.252821359128901		-16.594639113803268	407.24000091552733	418.90800048828123	N	N	주의	HKEX	HKG	HKD	Financial Services	Financial Data & Stock Exchanges	Financial Data & Stock Exchanges	Hong Kong Exchanges and Clearing Limited, together with its subsidiaries, owns and operates stock and futures exchanges, and related clearing houses in Hong Kong, the United Kingdom, and Mainland China. It operates through Cash, Equity and Financial Derivatives, Commodities, and Data and Connectivity segments. The Cash segment covers various equity products traded on the cash market platforms of the Stock Exchange of Hong Kong Limited, as well as through the Shanghai-Hong Kong and the Shenzhen-H	484629512192.0	3.38	14.86	36.04597701149426	20.77414004603453		453788000000.0	61000000.0	430000000.0	851000000.0	58147000000.0	358.9524103091035	18.903016333446587	4.8971544905302045	1.8201608136538676	20.77414004603453	0.08761666233213389	13.270332964451908	매우 유망	안심(>=2)	50.04828009206906	743.7174421681461	92.67291247879434	매우 유망	충분
2382.HK	2382.HK	China / Hong Kong	74.5999984741211	30.305674190604527	8.746355879677559		-17.931796235577902	70.25124969482422	68.83900007247925	Y	Y	상승전환/양호	SUNNY OPTICAL	HKG	HKD	Technology	Electronic Components	Electronic Components	Sunny Optical Technology (Group) Company Limited, an investment holding company, engages in designing, researching, developing, manufacturing, and selling optical and optical related products, and scientific instruments. It operates through Optical Components, Optoelectronic Products, and Optical Instruments segments. The Optical Components segment offers vehicle lens sets and optical parts for vehicle light detection and ranging, handset lens sets, glass spherical and aspherical lenses for digi	85450612736.0	3.29356575101317	4.91	71.87231282040072	24.433762661282877		38549973000.0	1405760000.0	4655009000.0	6244099000.0	29148588000.0	34.57930031499529	2.931125362464284	3.9291225501580915	8.150855022225215	24.433762661282877	0.33358984186012636	3.4017693035504855	매우 유망	안심(>=2)	57.367525322565754	281.67454933379787	277.57983256730415	매우 유망	충분
9868.HK	9868.HK	China / Hong Kong	55.04999923706055	-29.827914112756325	-29.3778044999629		-49.26267351422992	62.62874965667724	75.66524991989135	N	N	주의	XPENG-W	HKG	HKD	Consumer Cyclical	Auto Manufacturers	Auto Manufacturers	XPeng Inc. designs, develops, manufactures, and markets smart electric vehicles (EVs) in the People's Republic of China. The company offers P7 and P7i, a four-door sports sedan; G9, a smart EV and a mid- to large-sized sport utility vehicle (SUV); G7 for families and individual consumers seeking advanced technology and comfort; G6, a smart EV and a coupe SUV; X9, Smart EV and a large seven-seater multi-purpose vehicle (MPV); MONA M03, an all-electric hatchback coupe; Next P7, an all-new coupe sp	101978595328.0		-1.37				52582500000.0	6755098000.0	7309923000.0	19553678000.0	30368590000.0	29.32403614712095	3.1427525056640224	5.708905629826551					판정불가	판정불가				판정불가	일부부족
2015.HK	2015.HK	China / Hong Kong	56.0	-20.17106374639045	-19.885552535693062		-55.020080321285135	64.87874994277954	74.23500001907348	N	N	주의	LI AUTO-W	HKG	HKD	Consumer Cyclical	Auto Manufacturers	Auto Manufacturers	Li Auto Inc. operates in the energy vehicle market in the People's Republic of China. The company designs, develops, manufactures, and sells premium smart electric vehicles. Its product line comprises multi-purpose vehicles and sport utility vehicles. The company offers sales and after sales management, and technology development and corporate management services, as well as manufacturing equipment. It offers its products through online and offline channels. The company was formerly known as Lea	108673302528.0		-1.04	-86.00113291875977			145354579000.0	3299203000.0	6217745000.0	17814767000.0	72619255000.0	85.51877255922645	-7.715911809470451	-13.778413945482948		-86.00113291875977			판정불가	판정불가				보류	일부부족
