티커	종목코드	유니버스	현재가	3M수익률(보조,%)	6M수익률(보조,%)	12M수익률(보조,%)	52주고점대비(보조,%)	40일이평(보조)	200일이평(보조)	40일선상회(보조)	200일선상회(보조)	추세판정(보조)	종목명	시장	통화	섹터	산업	업종	사업설명	시가총액	배당수익률(%)	EPS(FY)	EPS Growth 1Y(%)	EPS Growth 3Y CAGR(%)	EPS Growth 5Y CAGR(%)	현금및단기투자	장기부채	단기위험부채	총부채	주주지분	주당순현금(린치식)	주당잉여현금흐름	잉여현금흐름수익률(%)	순현금차감PER(린치식)	사용연성장률(%)	린치PER배수	배당감안점수	린치PER판정	배당감안점수판정	그레이엄적정PER(3년)	그레이엄내재가치(3년)	그레이엄괴리율(3년,%)	종합판정	데이터상태
9866.HK	9866.HK	China / Hong Kong	41.70000076293945	-4.1379292805989625	5.891314453779062		-31.862744700827694	46.6975001335144	45.98830017089844	N	N	중립	NIO-SW	HKG	HKD	Consumer Cyclical	Auto Manufacturers	Auto Manufacturers	NIO Inc. designs, develops, manufactures, and sells smart electric vehicles in China, Europe, and internationally. It offers five and six-seater electric SUVs, as well as smart electric sedans. The company also offers power solutions, including Power Home, a home charging solution; Power Swap, a battery-swapping service; Power Charger and Destination Charger; Power Mobile, a mobile charging service through charging vans; Power Map, an application that provides access to a network of public charg	102631202816.0		-4.35				12045850000.0	8626272000.0	5347881000.0	31263135000.0	4159460000.0	1.4507151882256395	-1.3035198487517274	-3.1259468223085034					판정불가	판정불가				보류	일부부족
0981.HK	0981.HK	China / Hong Kong	76.6500015258789	20.23529651118259	9.813750966517443		-15.815487142480556	72.97624998092651	69.4727498626709	Y	Y	상승전환/양호	SMIC	HKG	HKD	Technology	Semiconductors	Semiconductors	Semiconductor Manufacturing International Corporation, an investment holding company, engages in the manufacture, testing, and sale of integrated circuits wafer and various compound semiconductors in the United States, China, and Eurasia. The company is also involved in the manufacturing, sale, and trading of semiconductor products; and research and development activities. In addition, it offers semiconductor foundry and technology services; supporting services comprising design and IP support, 	592971235328.0		0.71	39.04287790107723	-27.767740812712226		14935414000.0	9994773000.0	2593077000.0	12596181000.0	21439670000.0	0.821583099937418	-0.866236667172296	-1.1301195693777428	106.80058933231197	-27.767740812712226		-0.2599961384699142	판정불가	불리(<1)	0.0	0.0	-100.0	보류	일부부족
1347.HK	1347.HK	China / Hong Kong	153.1999969482422	66.9754735130705	100.91802878457995		-9.882354736328125	129.03000030517578	90.31480018615723	Y	Y	상승전환/양호	HUA HONG GRACE	HKG	HKD	Technology	Semiconductors	Semiconductors	Hua Hong Grace Semiconductor Limited, an investment holding company, engages in the manufacture and sale of semiconductor products in China, North America, Asia, and Europe. The company offers embedded non-volatile memory; standalone non-volatile memory, including NOR flash and EEPROM; power discrete devices; analog and power management platform; and specialty logic RF processes and image sensors. It also provides design services which covers design methodologies and design flow support, standar	254908006400.0	0.7082245571888369	0.25	-5.5534521924692	-50.40573254396763		4893808000.0	2787096000.0	403748000.0	3209752000.0	6612663000.0	1.5841557439391858	-0.8751683112652993	-0.5712587001949943	606.463364817212	-50.40573254396763		-0.08194643051811978	판정불가	불리(<1)	0.0	0.0	-100.0	보류	일부부족
1876.HK	1876.HK	China / Hong Kong	7.03000020980835	-8.93781864165273	-13.209878040366563		-20.65462209685004	7.450750041007995	7.829450004100799	N	N	주의	BUD APAC	HKG	HKD	Consumer Defensive	Beverages - Brewers	Beverages - Brewers	Budweiser Brewing Company APAC Limited, an investment holding company, engages in brewing and distribution of beer in South Korea, Japan, New Zealand, China, India, Vietnam, Southeast Asia, and internationally. It brews, imports, markets, distributes, and sells a portfolio of beer brands, including Budweiser, Stella Artois, Corona, Harbin, Hoegaarden, and Cass. The company was founded in 1876 and is headquartered in Causeway Bay, Hong Kong. Budweiser Brewing Company APAC Limited operates as a su	90227023872.0	6.29	0.29	-32.64462809917356	-18.789404729568137		2970000000.0	77000000.0	178000000.0	277000000.0	10262000000.0	0.21867350814101938	0.04867809859758607	0.69243381429306	23.487333454025276	-18.789404729568137		-0.5321764070848997	판정불가	불리(<1)	0.0	0.0	-100.0	보류	일부부족
0020.HK	0020.HK	China / Hong Kong	1.5	-34.7826073435619	-29.906545492100932		-48.096887697181025	1.8382499903440475	2.1854000020027162	N	N	주의	SENSETIME-W	HKG	HKD	Technology	Software - Application	Software - Application	SenseTime Group Inc., an investment holding company, research, develops and sells artificial intelligence software platforms in Mainland China, Northeast Asia, Southeast Asia, and internationally. The company offers SenseFoundry Enterprise Platform that facilitate and accelerate the digital transformation of enterprise customers; SenseFoundry Platform for smart city management; SenseME that enables a range of IoT devices to facilitate perceptial intelligence and content enhancement; SenseMARS, a	58749059072.0		-0.06				16596316000.0	3710335000.0	2014279000.0	5962982000.0	26718959000.0	0.3220952009870681	-0.09470465227907975	-6.313643485271983					판정불가	판정불가				보류	일부부족
2269.HK	2269.HK	China / Hong Kong	30.920000076293945	-14.34902663926847	-6.1323577250460115		-26.695116518290195	33.13150010108948	35.29560000419617	N	N	주의	WUXI BIO	HKG	HKD	Healthcare	Biotechnology	Biotechnology	WuXi Biologics (Cayman) Inc., an investment holding company, provides end-to-end solutions and services for biologics discovery, development, and manufacturing for biologics industry in the People's Republic of China, North America, Europe, Singapore, Japan, South Korea, Australia, and Brazil. It operates through two segments: Biologics and XDC. The company provides a suite of solutions for biologic discovery, from concept to IND, that seamlessly transits to CMC and downstream process developmen	123525259264.0		1.34	46.25222096844504	3.552720117093622		22251738000.0	169381000.0	873517000.0	3104066000.0	47248676000.0	5.366613831439228	0.6331352424701299	2.047656018460195	19.06969122750352	3.552720117093622	5.3676311668209555	0.18630192144745708	매우 불리	불리(<1)	15.605440234187244	20.911289913810908	-32.36969643527464	보류	충분
2388.HK	2388.HK	China / Hong Kong	48.63999938964844	15.809522356305795	30.682422875883987		0.0	46.26499996185303	40.78770004272461	Y	Y	상승전환/양호	BOC HONG KONG	HKG	HKD	Financial Services	Banks - Regional	Banks - Regional	BOC Hong Kong (Holdings) Limited, an investment holding company, provides banking and related financial services to corporate and individual customers in Hong Kong, China, and internationally. The company operates through four segments: Personal Banking, Corporate Banking, Treasury, and Insurance. It offers savings, current, and time deposit accounts, as well as monthly deposit plans; mortgage plans; corporate deposits, and payroll and e-cheque services. The company also offers cross-border fina	517431853056.0	7.29	3.79	4.938142442392701	13.652075841362565		678118000000.0	0.0	0.0	88602000000.0	358528000000.0	64.13809640787629	-8.378874597903234	-17.226304899350854	-4.0892076565245	13.652075841362565	-0.29953010106603467		판정불가	판정불가	35.804151682725134	135.69773487752826	178.98383342991457	보류	충분
600519.SS	600519.SS	China / Hong Kong	1271.0999755859375	-8.68534658147001	-11.055909502427863		-18.257236296724276	1338.3114990234376	1420.9818017578125	N	N	주의	KWEICHOW MOUTAI	SHH	CNY	Consumer Defensive	Beverages - Wineries & Distilleries	Beverages - Wineries & Distilleries	Kweichow Moutai Co., Ltd., together with its subsidiaries, produces and sells liquor products in China and internationally. The company offers liquor and soy sauce products under the Kweichow Moutai, Moutai Wangzi liquor, Moutai 1935 liquor, Han Jiang liquor, and Lai Mao liquor brands. It also engages in the production and sale of beverage, food, and packaging materials; development of anti-counterfeiting technology; research and development of information industry related products; operation an	1569690091520.0	4.06	66.1	-4.532254817158088	9.489481701387037		51939124226.5	0.0	44206237.05	233711179.82	244637811032.18	41.5485870561981	46.71263861993278	3.6749775404880882	18.60138257987503	9.489481701387037	1.9602105958174876	0.7284126135896114	보통	불리(<1)	27.478963402774074	1816.3594809233662	42.896665550330226	보류	충분
601318.SS	601318.SS	China / Hong Kong	54.22999954223633	-11.964284276696846	-7.0608381141809895		-27.031754891122528	55.96200008392334	60.303500156402585	N	N	주의	PING AN INSURANCE(GROUP)CO.OF C	SHH	CNY	Financial Services	Insurance - Life	Insurance - Life	Ping An Insurance (Group) Company of China, Ltd. provides financial products and services in the People's Republic of China. It operates through Life and Health Insurance; Property and Casualty Insurance; Banking; Asset Management; and Finance Enablement segments. The company offers life insurance products, including term, whole-life, endowment, annuity, investment-linked, universal life, and health care and medical insurance; property and casualty insurance, such as auto insurance, non-auto ins	959523979264.0	4.98	7.25	6.453829567085556	6.681286200386016		1018674000000.0	1345587000000.0	84520000000.0	1438514000000.0	1000419000000.0	-30.66707355486415	61.00122231308144	112.48611991149187	11.709941116841446	6.681286200386016	1.7526477336302244	0.9958449905110579	보통	불리(<1)	21.86257240077203	158.50364990559723	192.28038215664878	보류	충분
600036.SS	600036.SS	China / Hong Kong	38.95000076293945	-1.3924031317988583	-9.439659886155095		-19.257878508064362	38.35725021362305	40.54619997024536	Y	N	주의	CHINA MERCHANTS BANK CO LTD	SHH	CNY	Financial Services	Banks - Regional	Banks - Regional	China Merchants Bank Co., Ltd., together with its subsidiaries, provides various banking products and services. It operates through Wholesale Finance Business, Retail Finance Business, and Other Business segments. It offers current, demand, time, call, savings, notice, and renminbi accounts. The company also offers loan products include personal commercial real estate, consumption, housing, and car loans; loans to finance for studying abroad; micro-business loans; mortgage loans for equipment; j	972729483264.0	7.74	5.71	1.2062726176115701	2.8567302131919714		1321522000000.0	0.0	0.0	405441000000.0	1272875000000.0	64.06154248698326	20.520487679675256	52.6841778632269	-4.397818165331665	2.8567302131919714	-1.539458694777396		판정불가	판정불가	14.213460426383943	81.15885903465231	108.36677136056485	보류	충분
601012.SS	601012.SS	China / Hong Kong	13.380000114440918	-29.355862000208454	-25.749168842688196		-41.31578700804416	15.395250010490418	17.816750054359435	N	N	주의	LONGI GREEN ENERGY TECHNOLOGY C	SHH	CNY	Technology	Semiconductor Equipment & Materials	Semiconductor Equipment & Materials	LONGi Green Energy Technology Co., Ltd. manufactures and sells monocrystalline silicon wafers, solar modules, and green hydrogen equipment in China, Europe, the Asia Pacific, and the United States. The company offers monocrystalline silicon wafers, including tere, p-type, and n-type silicon wafers; high conversion rate components comprising Hi-MO X10, Hi-MO 9, Hi-MO 7, Hi-MO X6 Max, Hi-MO X6, Hi-MO 5m, and Hi-MO 5; green hydrogen production equipment that include ALK Hi1 and ALK G; and building 	100788281344.0	7.158871388694483	-0.91				56023052877.85	16335318135.43	300193416.63	35325725056.02	54275611054.63	5.237185108606886	-0.20250417079235428	-1.5134840736943889					판정불가	판정불가				보류	일부부족
300750.SZ	300750.SZ	China / Hong Kong	398.1000061035156	0.6573972448838505	5.855142607281172		-13.456520412279216	423.3240028381348	378.0400503540039	N	Y	상승전환/양호	CONTEMPORARY AMPEREX TECHNOLOGY	SHZ	CNY	Industrials	Electrical Equipment & Parts	Electrical Equipment & Parts	Contemporary Amperex Technology Co., Limited, together with its subsidiaries, engages in the research, development, production, and sale of electric vehicle and energy storage system batteries in China and internationally. The company offers power battery systems, including cells, modules/battery boxes, and battery packs, as well as lithium iron phosphate, ternary high-voltage medium-nickel, ternary high-nickel, super hybrid, sodium-ion, and condensed matter batteries; energy storage battery sys	1866982752256.0	1.4	17.56	42.283445583519466	32.94277002353567		451499983000.0	81678369000.0	12935498000.0	119656488000.0	337107747000.0	83.89160443540341	20.61449313535137	5.178219748630475	17.89341695148703	32.94277002353567	0.543166738519658	1.9192963600326556	헐값	양호(>=1.5)	60.0	1053.6	164.6571172686791	양호	충분
000858.SZ	000858.SZ	China / Hong Kong	79.62999725341797	-22.137479351509647	-31.11591842170792		-38.71315189548158	89.08199939727783	108.58669979095458	N	N	주의	WULIANGYE YIBIN CO. LTD.	SHZ	CNY	Consumer Defensive	Beverages - Wineries & Distilleries	Beverages - Wineries & Distilleries	Wuliangye Yibin Co.,Ltd. manufactures and sells liquor and wine products and related auxiliary products under the Wuliangye brand in China. The company's Wuliangye products include eighth-generation Wuliangye, 39 -degree Wuliangye, classic Wuliangye, 29 -degree Wuliangye, etc. It also offers other alcoholic beverage products, such as Wuliangchun, Wuliangchun, Wuliangtequ, Jianzhuang, etc. The company was founded in 1997 and is headquartered in Xuzhou, China.	304046342144.0	7.22	3.25	-71.88896273061067	-30.51456952275814		127014443016.86	0.0	364149470.84	408530653.28	119932271234.99	32.72212002171507	7.1462271736452685	8.974290368116934	14.433192994370122	-30.51456952275814		-1.6139581540858303	판정불가	불리(<1)	0.0	0.0	-100.0	보류	일부부족
002594.SZ	002594.SZ	China / Hong Kong	90.81999969482422	-8.355195667797222	-4.450292710280312		-21.99158195574672	97.24400081634522	99.49130001068116	N	N	주의	BYD COMPANY LIMITED	SHZ	CNY	Consumer Cyclical	Auto Manufacturers	Auto Manufacturers	BYD Company Limited, together with its subsidiaries, engages in automobiles and batteries business in the People's Republic of China, Hong Kong, Macau, Taiwan, and internationally. It operates in two segments, Mobile Handset Components, Assembly Service and Other Products; and Automobiles and Related Products and Other Products. The Mobile Handset Components, Assembly Service and Other Products segment manufactures and sells mobile handset components, such as housings and electronic components, 	817265573888.0	1.46	1.95	-18.967701027859206	25.196441286638958		184489829000.0	65703479000.0	38484710000.0	119120640000.0	246274606000.0	21.86065060007439	-17.97496278277345	-19.79185514553336	35.36376876653837	25.196441286638958	1.4035223611237073	0.7537782938978385	보통	불리(<1)	58.892882573277916	114.84112101789194	26.449153714803053	보류	충분
300760.SZ	300760.SZ	China / Hong Kong	146.5	-17.779769883270003	-26.56641604010025		-40.98453240485678	156.33924980163573	194.83815017700195	N	N	주의	SHENZHEN MINDRAY BIO-MEDICAL EL	SHZ	CNY	Healthcare	Medical Devices	Medical Devices	Shenzhen Mindray Bio-Medical Electronics Co., Ltd. provides medical devices and solutions in China and internationally. The company offers various products, including patient monitoring, ultrasound, radiology, AED, defibrillation system, anesthesia, CLIA, chemistry, hematology, ventilators, electrocardiograph, endoscope camera system, operating tables, surgical lights, medical supply units, accessories, infusion system, orthopedics, IT Products, cardiovascular intervention, animal medical, and O	173257867264.0	4.23	6.46	-30.275662177520644	-5.39056908556913		18191343800.0	4062631.0	328106.0	349283522.0	38093330471.0	15.000544569826854	6.6866938378384	4.564296135043277	20.35595285296798	-5.39056908556913		-0.057013744036055455	판정불가	불리(<1)	0.0	0.0	-100.0	보류	일부부족
603501.SS	603501.SS	China / Hong Kong	88.72000122070312	-21.36145943920501	-25.53923618588163		-41.311105182689104	97.92325038909912	118.58995014190674	N	N	주의	OMNIVISION INTEGRATED CIRCUITS 	SHH	CNY	Technology	Semiconductors	Semiconductors	OmniVision Integrated Circuits Group, Inc., together with its subsidiaries, engages in the design, development, and sale of integrated circuits and computer software and hardware in China and internationally. It operates in two segments, Semiconductor Design and Electronic Components Agency. The company offers image sensors, application-specific integrated circuits, camera cube chips, liquid crystal on silicon, display solutions, in-system programming, and cable modules. It also provides semicon	111254454272.0	81.0	3.04	21.730996944226554	59.85671328521085		13072154645.060001	1617721215.79	2078985512.66	9796924850.61	28172055029.35	9.461412779849878	1.4728449655092226	1.660104762448458	26.071904092385935	59.85671328521085	0.43557192938670214	5.402624709959207	매우 유망	안심(>=2)	60.0	182.4	105.59061935341401	매우 유망	충분
688981.SS	688981.SS	China / Hong Kong	130.52000427246094	23.12046188314698	16.932450332212202		-16.333330594576324	124.39550018310547	117.225950050354	Y	Y	상승전환/양호	SEMICONDUCTOR MANUFACTURING INT	SHH	CNY	Technology	Semiconductors	Semiconductors	Semiconductor Manufacturing International Corporation, an investment holding company, engages in the manufacture, testing, and sale of integrated circuits wafer and various compound semiconductors in the United States, China, and Eurasia. The company is also involved in the manufacturing, sale, and trading of semiconductor products; and research and development activities. In addition, it offers semiconductor foundry and technology services; supporting services comprising design and IP support, 	1042828034048.0		0.61	39.04287790107723	-27.767740812712226		14935414000.0	9994773000.0	2593077000.0	12596181000.0	21439670000.0	2.4708609402945965	-2.60515381357045	-1.995980484441437	209.91662841338746	-27.767740812712226		-0.13227985330456715	판정불가	불리(<1)	0.0	0.0	-100.0	보류	일부부족
600183.SS	600183.SS	China / Hong Kong	166.41000366210938	165.1529765975367	187.31009827851244		0.0	106.40599975585937	69.59639999389648	Y	Y	상승전환/양호	SHENGYI TECHNOLOGY CO LTD	SHH	CNY	Technology	Electronic Components	Electronic Components	Shengyi Technology Co.,Ltd. engages in the design, production, and sales of copper clad laminates, bonding sheets, and printed circuit boards in China and internationally. The company offers flame-retardant epoxy glass fabric reinforced laminates, composite epoxy materials, and flexible circuit materials, as well as prereg for multilayer circuit boards; and smart and rigid materials, automotive and RF materials, IMS and HTC materials, IC substrate and flexible materials, HSD materials, and speci	435783991296.0	72.0	1.61	91.75319663725077	29.622792505245087		3239977726.09	902984683.16	2304818271.34	3676930770.8	16723501226.33	0.962074242411724	1.1930143211125952	0.716912622353507	102.76268908055755	29.622792505245087	3.4690412479634434	0.9889074859220658	매우 불리	불리(<1)	60.0	96.60000000000001	-41.950605207518976	보류	충분
000725.SZ	000725.SZ	China / Hong Kong	5.920000076293945	33.93665099792737	46.89825727268329		-9.202452551960072	4.862750005722046	4.293000007867813	Y	Y	상승전환/양호	BOE TECHNOLOGY GROUP	SHZ	CNY	Technology	Electronic Components	Electronic Components	BOE Technology Group Company Limited operates display, Internet of Things (IoT) innovation, sensor, and MLED, smart medicine engineering, and other business in Mainland China and internationally. The Display Business segment designs and manufactures display devices, including TFT-LCD, AMOLED, micro displays, and other intelligent interface devices. Its IoT Innovation Business segment designs integrated manufacturing models for system solutions; smart terminal products, such as tablets, laptops, 	225970388992.0	95.0	0.17	10.026166023922677	-8.080747892061046		75564037635.0	112545341525.0	3655021437.0	143558438547.0	134478628806.0	-1.017326958293365	0.24016032744476673	4.056762235636871	40.807806085807705	-8.080747892061046		2.129966309023608	판정불가	안심(>=2)	0.0	0.0	-100.0	보류	일부부족
002916.SZ	002916.SZ	China / Hong Kong	399.79998779296875	58.26768015002553	105.03614366377607		-4.696069656026525	347.84199752807615	244.48020011901855	Y	Y	상승전환/양호	SHENNAN CIRCUITS CO LTD	SHZ	CNY	Technology	Electronic Components	Electronic Components	Shennan Circuits Co., Ltd. engages in the design, manufacture, and sale of printed circuit boards, packaging substrates, and electronic assemblies in China and internationally. It operates through Packaging Substrates, Packaging Substrates, and Distribution Substrates segments. The company provides RF and microwave, thermal management, miniaturization, and chip package substrate solutions. It also offers schematic design, PCB / SiP design, PCB / SUB production, electronic assembly, package testi	275109576704.0	60.0	5.24	74.46731868482586	25.905809548765156		1588756438.22	2679204686.22	15009670.83	3557910474.95	17149430529.85	-1.600853970239101	0.10703819865094824	0.02677293694825638	76.60321407694806	25.905809548765156	2.9569897799468494	1.1214387096404677	매우 불리	보통(1~1.5)	60.0	314.40000000000003	-21.36067793908788	보류	충분
601888.SS	601888.SS	China / Hong Kong	59.08000183105469	-19.880656980487522	-27.801539155491405		-39.15550694184555	60.73374977111816	74.9323998260498	N	N	주의	CHINA TOURISM GROUP DUTY FREE C	SHH	CNY	Consumer Cyclical	Specialty Retail	Specialty Retail	China Tourism Group Duty Free Corporation Limited engages in duty-free tourism retail business in China. The company engages in the wholesale and retail of duty-free commodities, such as tobacco, alcohol, cosmetics, watches and jewelry, apparel and bags, and electronic products, as well as food. It is also involved in the investment and development of commercial complexes for duty-free businesses. The company was formerly known as China International Travel Service Corporation Limited and change	121343328256.0	2.2	1.93	-15.957728143438166	-10.667335366687835		33781245387.6	2848679969.93	226682371.28	5029157635.92	55469259598.08	15.842741545586293	2.450990266390758	4.148595447575671	22.402725536512122	-10.667335366687835		-0.37796005458745235	판정불가	불리(<1)	0.0	0.0	-100.0	보류	일부부족
601899.SS	601899.SS	China / Hong Kong	31.309999465942383	-14.80272254165338	4.4711384160452505		-27.94016359914969	32.17049999237061	31.764700050354005	N	N	중립	ZIJIN MINING GROUP CO.LTD	SHH	CNY	Basic Materials	Gold	Gold	Zijin Mining Group Company Limited, together with its subsidiaries, engages in exploration and extraction of metals in Mainland China and internationally. The company offers copper, gold, zinc concentrate, lead concentrate, silver, lithium, iron concentrate, tungsten concentrate, and molybdenum concentrate; smelted copper, smelted and processed gold and silver, smelted zinc ingots, sulfuric acid, and battery -grade lithium carbonate; and copper pipes, copper plates and strips, potassium gold cya	805432721408.0	1.6	2.27	61.54868816202652	37.21424266296107		85546185108.0	105866683144.0	32353609318.0	164492766171.0	185541965085.0	-0.9863460863776055	2.1574441715319543	6.890591530922016	14.227465001022022	37.21424266296107	0.38231236169109156	2.7281207622139902	매우 유망	안심(>=2)	60.0	136.2	335.0047982215786	매우 유망	충분
600276.SS	600276.SS	China / Hong Kong	47.880001068115234	-13.417718392973565	-21.469575021335274		-33.9312815487618	51.80050039291382	59.76250013351441	N	N	주의	JIANGSU HENGRUI PHARMACEUTICALS	SHH	CNY	Healthcare	Drug Manufacturers - Specialty & Generic	Drug Manufacturers - Specialty & Generic	Jiangsu Hengrui Pharmaceuticals Co.,Ltd, a pharmaceutical company, researches, develops, manufactures, and commercializes medicines to address unmet clinical needs in China and internationally. The company develops medicines in the areas of oncology, metabolic and cardiovascular, immunological and respiratory, neuroscience, pain management, infectious, respiratory system, hematological, ophthalmology, and autoimmune and other diseases. The company was founded in 1970 and is headquartered in Lian	314271399936.0	42.0	1.22	21.69213188913122	25.443053499049604		41183164773.950005	0.0	1260943473.97	74233076.53	61272068641.41	6.456051119750707	1.2969852479550943	2.7088246011314245	33.95405733472503	25.443053499049604	1.3345118869475845	1.9863032224450878	보통	양호(>=1.5)	59.38610699809921	72.45105053768103	51.317980203489185	보류	충분
