티커	종목코드	유니버스	현재가	3M수익률(보조,%)	6M수익률(보조,%)	12M수익률(보조,%)	52주고점대비(보조,%)	40일이평(보조)	200일이평(보조)	40일선상회(보조)	200일선상회(보조)	추세판정(보조)	종목명	시장	통화	섹터	산업	업종	사업설명	시가총액	배당수익률(%)	EPS(FY)	EPS Growth 1Y(%)	EPS Growth 3Y CAGR(%)	EPS Growth 5Y CAGR(%)	현금및단기투자	장기부채	단기위험부채	총부채	주주지분	주당순현금(린치식)	주당잉여현금흐름	잉여현금흐름수익률(%)	순현금차감PER(린치식)	사용연성장률(%)	린치PER배수	배당감안점수	린치PER판정	배당감안점수판정	그레이엄적정PER(3년)	그레이엄내재가치(3년)	그레이엄괴리율(3년,%)	종합판정	데이터상태
0700.HK	0700.HK	China / Hong Kong	462.6000061035156	-17.09677309972838	-26.4546890137495		-31.719556294684036	497.2800010681152	580.256000213623	N	N	주의	TENCENT	HKG	HKD	Communication Services	Internet Content & Information	Internet Content & Information	Tencent Holdings Limited, an investment holding company, provides value-added services, marketing services, fintech, and business services in Mainland China and internationally. The company's consumers business includes communications and social services, such as instant messaging and social networks; digital content, including online games, videos, live streaming, news, music, and literature; fintech services, which include mobile payment, wealth management, consumer loans, and securities tradi	4180469612544.0	1.16	27.8	15.854343468694765	6.10101407396777		712465000000.0	334573000000.0	53160000000.0	387733000000.0	1154152000000.0	41.816556661752635	21.043833679787245	4.549034457876398	15.136095303660538	6.10101407396777	2.4809146676524283	0.47971513975680075	매우 불리	불리(<1)	20.70202814793554	575.5163825126081	24.4090736963426	보류	충분
9988.HK	9988.HK	China / Hong Kong	132.8000030517578	-16.739809998897925	-16.477985502039118		-28.25499801578044	129.3324993133545	144.51950012207033	Y	N	주의	BABA-W	HKG	HKD	Consumer Cyclical	Internet Retail	Internet Retail	Alibaba Group Holding Limited, through its subsidiaries, provides technology infrastructure and marketing reach to help merchants, brands, retailers, and other businesses to engage with their users and customers in the People's Republic of China and internationally. It operates digital retail platforms under the Taobao and Tmall names; wholesale marketplaces through 1688.com and Alibaba.com; global e-commerce platform under the AliExpress name; e-commerce platforms under the Lazada, Trendyol, an	2548751400960.0	77.0	5.57	62.617955480008504	27.857140301211246		710699000000.0	208141000000.0	22562000000.0	248110000000.0	1009858000000.0	26.18525543229398	4.03998374407288	3.0421563638807494	19.14088826202223	27.857140301211246	0.6871088724491211	5.478175247972171	헐값	안심(>=2)	60.0	334.20000000000005	151.6566207229288	양호	충분
3690.HK	3690.HK	China / Hong Kong	87.5999984741211	-4.937604966267973	-12.312315179065859		-40.97034900471357	83.59874973297119	98.34075019836426	Y	N	주의	MEITUAN-W	HKG	HKD	Consumer Cyclical	Internet Retail	Internet Retail	Meituan operates as a technology driven retail company in the People's Republic of China, Hong Kong, Macao, Taiwan, and internationally. It operates through Core Local Commerce and New Initiatives segments. The company offers daily goods and services, such as food delivery, in-store, hotel and travel booking, and other services and sales; bike sharing, e-moped sharing, power banks and micro-credit; and operates Kuailv and Xiaoxiang Supermarkets. It also sells goods from B2B food distribution ser	540875948032.0		-4.51				226896042000.0	65904021000.0	14379078000.0	86619106000.0	151045913000.0	28.773081962634354	-4.8408568339735485	-5.526092372482907					판정불가	판정불가				보류	일부부족
9618.HK	9618.HK	China / Hong Kong	128.1999969482422	18.813711895541086	3.8897855453888797		-10.224093691527347	115.47499980926514	118.88525039672851	Y	Y	상승전환/양호	JD-SW	HKG	HKD	Consumer Cyclical	Internet Retail	Internet Retail	JD.com, Inc. operates as a supply chain-based technology and service provider in the People's Republic of China and Europe. It operates through three segments: JD Retail, JD Logistics, and New Businesses. The company provides home appliances; mobile handsets and other digital products; computers, including desktop, laptop, and other various products, as well as printers and other office equipment; furniture and household goods; apparel; cosmetics and other personal care items; and pet products. 	350196400128.0	3.31	5.33	-52.53511932106676	23.66544269567723		288976000000.0	62473000000.0	11525000000.0	107105000000.0	225040000000.0	93.98950734042998	1.9947089521350574	1.5559352571126623	6.418478350433809	23.66544269567723	0.27121733715153445	4.202778481577962	매우 유망	안심(>=2)	55.83088539135446	297.57861913591927	132.12061327588006	매우 유망	충분
9999.HK	9999.HK	China / Hong Kong	186.10000610351562	-3.022401238896033	-14.16051499819998		-24.472398249450244	179.12750053405762	206.6460001373291	Y	N	주의	NTES-S	HKG	HKD	Communication Services	Electronic Gaming & Multimedia	Electronic Gaming & Multimedia	NetEase, Inc. engages in online games, music streaming, online intelligent learning services, and internet content services businesses in China and internationally. The company operates through Games and Related Value-Added Services; Youdao; NetEase Cloud Music; and Innovative Businesses and Others segments. It develops and operates mobile and PC games; and offers games licensed from other developers. The company also provides live streaming service, and other related or ancillary value-added se	593778245632.0	2.5	12.06	13.67851196370724	18.404094603117294		278053666000.0	427997000.0	6384417000.0	6729742000.0	160296119000.0	87.01251887753399	15.25942349294914	8.19958247849884	8.21620955439317	18.404094603117294	0.44643378180644133	2.5442504192142916	매우 유망	안심(>=2)	45.30818920623459	546.4167618271891	193.61458565630144	매우 유망	충분
1810.HK	1810.HK	China / Hong Kong	31.799999237060547	-6.360423750422639	-26.761859562204172		-47.13217218560014	31.972500038146972	42.31675000190735	N	N	주의	XIAOMI-W	HKG	HKD	Technology	Consumer Electronics	Consumer Electronics	Xiaomi Corporation, an investment holding company, engages in the development and sales of smartphones in Mainland China and internationally. It operates through Smartphones, IoT and Lifestyle Products, Internet Services, and smart electric vehicles segments. The company also offers internet of things (IoT) and lifestyle products comprising smart large home appliances, smart TVs, tablets, wearables and other IoT and lifestyle products; hardware repairment services for products; installation serv	821219557376.0		1.8	76.02150314018954	156.2794016865734		188478801000.0	22921433000.0	13202226000.0	41837896000.0	266218661000.0	7.752099426521218	1.0007850693127152	3.1471229349791123	13.359944339188514	156.2794016865734	0.08548755750922689	11.69760874138985	매우 유망	안심(>=2)	60.0	108.0	239.62264965759493	매우 유망	충분
9888.HK	9888.HK	China / Hong Kong	137.5	0.2186611213052636	12.797373485519836		-14.330218068535828	119.69500007629395	119.17874992370605	Y	Y	상승전환/양호	BIDU-SW	HKG	HKD	Communication Services	Internet Content & Information	Internet Content & Information	Baidu, Inc. provides internet content, value-added telecommunication-based, internet map, and online audio and video services in the People's Republic of China. It operates in two segments, Baidu General Business and iQIYI. The Baidu General Business segment offers products and services for mobile ecosystem, AI cloud, and intelligent driving. This segment operates Baidu App that enables users to access search, feed, content, and other services through mobile devices; and Haokan, which offers a r	374277931008.0		1.69	-76.47727272727273	-9.574707672764294		205928000000.0	61102000000.0	28410000000.0	97077000000.0	266330000000.0	65.88987137071996	-7.474974014478953	-5.436344737802875	42.37285717708878	-9.574707672764294		-0.2259632300165349	판정불가	불리(<1)	0.0	0.0	-100.0	보류	일부부족
1024.HK	1024.HK	China / Hong Kong	51.599998474121094	-29.460017227933864	-27.781664551364894		-43.82144874105851	48.31274995803833	67.68804973602295	Y	N	주의	KUAISHOU-W	HKG	HKD	Communication Services	Internet Content & Information	Internet Content & Information	Kuaishou Technology, an investment holding company, provides live streaming, online marketing, and other services in the People's Republic of China. It offers Kuaishou Flagship, a short video and content based social networking platform; Kuaishou Express; Kuaishou Concept; Yitian Camera, an app to create features Japanese-and-Korean-style filters and cute stickers; Kmovie, a shooting, editing, and production tool; and AcFun, a video sharing website. The company also provides entertainment, e-com	223845728256.0	1.31	4.87	21.402021519400073			113106000000.0	11098000000.0	13916000000.0	34953000000.0	79558000000.0	27.930616660567658	3.2238165689114933	6.247706713651032	4.860242672187564	21.402021519400073	0.22709269158438838	4.673022120761212	매우 유망	안심(>=2)	8.5	41.395	-19.77712941065143	양호	충분
1211.HK	1211.HK	China / Hong Kong	98.1500015258789	9.055557250976554	1.0813625831700202		-36.704641764991884	104.4900001525879	103.77625007629395	N	N	중립	BYD COMPANY	HKG	HKD	Consumer Cyclical	Auto Manufacturers	Auto Manufacturers	BYD Company Limited, together with its subsidiaries, engages in automobiles and batteries business in the People's Republic of China, Hong Kong, Macau, Taiwan, and internationally. It operates in two segments, Mobile Handset Components, Assembly Service and Other Products; and Automobiles and Related Products and Other Products. The Mobile Handset Components, Assembly Service and Other Products segment manufactures and sells mobile handset components, such as housings and electronic components, 	894852923392.0	41.0	2.25	-18.967701027859206	25.196441286638958		184489829000.0	65703479000.0	38484710000.0	119120640000.0	246274606000.0	32.249104088613784	-26.516889015583427	-27.016697507225	29.289287749895607	25.196441286638958	1.1624374814163532	2.2600905099467603	보통	안심(>=2)	58.892882573277916	132.5089857898753	35.00660593972287	보류	충분
2318.HK	2318.HK	China / Hong Kong	64.0999984741211	-11.034010049834075	12.852111505483066		-12.7297465794447	61.92000017166138	60.86425022125244	Y	Y	상승전환/양호	PING AN	HKG	HKD	Financial Services	Insurance - Life	Insurance - Life	Ping An Insurance (Group) Company of China, Ltd. provides financial products and services in the People's Republic of China. It operates through Life and Health Insurance; Property and Casualty Insurance; Banking; Asset Management; and Finance Enablement segments. The company offers life insurance products, including term, whole-life, endowment, annuity, investment-linked, universal life, and health care and medical insurance; property and casualty insurance, such as auto insurance, non-auto ins	1160699838464.0	4.66	8.35	6.453829567085556	6.681286200386016		1018674000000.0	1345587000000.0	84520000000.0	1438514000000.0	1000419000000.0	-43.89521637208706	87.31390191516293	136.21513883563338	12.933558664216546	6.681286200386016	1.935788750296208	0.8768882946164003	보통	불리(<1)	21.86257240077203	182.55247954644645	184.79326660225715	보류	충분
0939.HK	0939.HK	China / Hong Kong	8.869999885559082	12.563448689599465	10.186331371370594		-1.3348152237400601	8.514499986171723	7.97025000333786	Y	Y	상승전환/양호	CCB	HKG	HKD	Financial Services	Banks - Diversified	Banks - Diversified	China Construction Bank Corporation engages in the provision of various banking and related financial services to individuals and corporate customers in the People's Republic of China and internationally. It operates through Corporate Finance Business, Personal Finance Business, Treasury and Asset Management Business, and Others segments. The company offers corporate and personal loans; trade financing; deposit taking and wealth management, agency, financial consulting and advisory, cash managem	2320395403264.0	4.88	1.5	0.9920226952383482	1.4347942111190504		4254869000000.0	0.0	0.0	3093481000000.0	3663411000000.0	17.69784723548096	8.641964734641563	97.42914144464902	-5.885231566614586	1.4347942111190504	-4.101794892261568		판정불가	판정불가	11.3695884222381	17.05438263335715	92.27038166170394	보류	충분
1398.HK	1398.HK	China / Hong Kong	7.0	8.864699640414342	12.17949129420639		-3.581270257368574	6.882999992370605	6.294899978637695	Y	Y	상승전환/양호	ICBC	HKG	HKD	Financial Services	Banks - Diversified	Banks - Diversified	Industrial and Commercial Bank of China Limited, together with its subsidiaries, provides banking products and services in the People's Republic of China and internationally. It operates through Corporate Banking, Personal Banking, and Treasury Operations segments. The Corporate Banking segment offers corporate loans, trade financing, deposit-taking activities, corporate wealth management services, custody services, and various types of corporate intermediary services, as well as corporate loans	2494843846656.0	4.96	1.16	0.7377078305267348	0.6811562101320723		5268700000000.0	0.0	0.0	2751358000000.0	4244259000000.0	60.703473692423984	21.341222310857273	304.8746044408182	-46.29609801071033	0.6811562101320723	-67.96693228669791		판정불가	판정불가	9.862312420264145	11.440282407506407	63.432605821520106	보류	충분
3988.HK	3988.HK	China / Hong Kong	5.21999979019165	12.258057701806969	15.486721509269795		-0.5714325677780852	4.991500020027161	4.589249997138977	Y	Y	상승전환/양호	BANK OF CHINA	HKG	HKD	Financial Services	Banks - Diversified	Banks - Diversified	Bank of China Limited, together with its subsidiaries, provides various banking and financial services in Chinese Mainland, Hong Kong, Macao, Taiwan, and internationally. The company operates through six segments: Corporate Banking, Personal Banking, Treasury Operations, Investment Banking, Insurance, and Other. The Corporate Banking segment provides current accounts, deposits, overdrafts, loans, payments and settlements, trade-related products, and other credit facilities, as well as foreign cu	1681948672000.0	4.83	0.85	2.1779255889438742	2.3712026525481544		4330456000000.0	0.0	0.0	2782404000000.0	3064044000000.0	51.78591383406694	9.097539947447396	174.2823814771338	-54.783428286912105	2.3712026525481544	-23.10364667821219		판정불가	판정불가	13.242405305096309	11.256044509331863	115.63304524421447	보류	충분
0941.HK	0941.HK	China / Hong Kong	86.55000305175781	9.07372995096516	-0.17300334690197872		-4.2058610808407675	81.82499961853027	83.80924999237061	Y	Y	상승전환/양호	CHINA MOBILE	HKG	HKD	Communication Services	Telecom Services	Telecom Services	China Mobile Limited provides communication, computing, and AI services in Mainland China and Hong Kong. It offers communications services, including mobile communications, broadband networks, cellular IoT, and satellite Internet; computing services comprising data centers, cloud computing services, and cloud computing applications; and AI services, such as data algorithms, embodied intelligence, digital intelligence culture, digital intelligence e-commerce, and industry digital intelligence ser	1873340792832.0	5.83	7.25	-0.9235905848684389	3.000641948799565		520239000000.0	9748000000.0	42507000000.0	101197000000.0	1428475000000.0	24.61165600002836	3.6625489636646966	4.2317144246366505	8.543220282997165	3.000641948799565	2.8471308569204536	1.0336432464903698	매우 불리	보통(1~1.5)	14.50128389759913	105.13430825759369	21.472333391741504	보류	충분
0883.HK	0883.HK	China / Hong Kong	26.6200008392334	12.415542635846233	30.49020263242166		-12.72130872382492	27.901499938964843	22.497949962615966	N	Y	상승전환/양호	CNOOC	HKG	HKD	Energy	Oil & Gas E&P	Oil & Gas E&P	CNOOC Limited, an investment holding company, engages in the exploration, development, production, and sale of crude oil and natural gas in worldwide. The company produces offshore crude oil and natural gas primarily in Bohai Sea, the Western South China Sea, the Eastern South China Sea, and the East China Sea in China. It also holds interests in various oil and gas assets in Asia, Africa, North America, South America, Oceania, and Europe. In addition, the company is involved in the sales and tr	1265247453184.0	4.75	2.96	-11.493736225495887	-4.845953497090038		402707000000.0	58832000000.0	1308000000.0	69800000000.0	802750000000.0	7.72059621174125	2.1887539451661775	8.222215913458285	6.384933995774375	-4.845953497090038		-0.015028111042892747	판정불가	불리(<1)	0.0	0.0	-100.0	보류	일부부족
0857.HK	0857.HK	China / Hong Kong	11.0600004196167	20.74236467090531	32.773115497173436		-8.063169866047204	10.93100004196167	8.774250032901763	Y	Y	상승전환/양호	PETROCHINA	HKG	HKD	Energy	Oil & Gas Integrated	Oil & Gas Integrated	PetroChina Company Limited, together with its subsidiaries, engages in a range of petroleum related products, services, and activities in Mainland China and internationally. It operates through the Oil and Gas and New Energy; Refining, Chemicals and New Materials; Sales; and Natural Gas Sales Segments. The Oil, Gas and New Energy Resource segment engages in the exploration, development, transportation, production, and marketing of crude oil and natural gas, as well as is involved in the new ener	2024212135936.0	4.74	1.0	-4.477883844640385	1.8835578227509364		251258000000.0	163462000000.0	34513000000.0	353775000000.0	1586061000000.0	4.161164800060667	5.674276858035253	51.3044904408051	6.898835619556032	1.8835578227509364	3.662661977363818	0.9600979336245135	매우 불리	불리(<1)	12.267115645501873	12.267115645501873	10.914242134603903	보류	충분
0386.HK	0386.HK	China / Hong Kong	4.650000095367432	-14.522057969548518	9.929079773052575		-17.844519068432028	4.620000016689301	4.5870499873161314	Y	Y	상승전환/양호	SINOPEC CORP	HKG	HKD	Energy	Oil & Gas Integrated	Oil & Gas Integrated	China Petroleum & Chemical Corporation, an energy and chemical company, engages in the oil and gas and chemical operations in Mainland China. It operates through Exploration and Production, Refining, Marketing and Distribution, Chemicals, and Corporate and Others segments. The company explores and develops oil fields; produces and sells crude oil and natural gas; processes, purifies, imports, and trades in crude oil; manufactures, produces, sells, stores, and trades in petroleum products; owns a	562303664128.0	4.85	0.31	-33.63983734853593	-21.420834213525552		231381000000.0	235264000000.0	120256000000.0	531006000000.0	827463000000.0	-0.16327062230528314	1.2139547093937237	26.10655235476506	15.526679734428114	-21.420834213525552		-1.0672490511143975	판정불가	불리(<1)	0.0	0.0	-100.0	보류	일부부족
0005.HK	0005.HK	China / Hong Kong	141.10000610351562	1.510795757924921	30.6481537995515		-4.209094921786017	134.81500053405762	118.40724990844727	Y	Y	상승전환/양호	HSBC HOLDINGS	HKG	HKD	Financial Services	Banks - Diversified	Banks - Diversified	HSBC Holdings plc engages in the provision of banking and financial products and services worldwide. It operates through four segments: Hong Kong, UK, Corporate and Institutional Banking, and International Wealth and Premier Banking. The Hong Kong segment is involved in the retail banking and wealth and commercial banking of HSBC Hong Kong and Hang Seng Bank. The UK segment engages in UK retail banking and wealth, as well as first direct and M&S Bank, UK Commercial Banking, and HSBC Innovation B	2419611926528.0	4.23	9.48	-7.064514783769127	12.722423966662477		307737000000.0	0.0	0.0	256139000000.0	198225000000.0	17.94572543253067	1.4640015239756103	1.0375630479431521	12.990957876686176	12.722423966662477	1.0211071342007905	1.304940261340207	보통	보통(1~1.5)	33.94484793332495	321.79715840792056	128.06317823391132	보류	충분
1299.HK	1299.HK	China / Hong Kong	86.94999694824219	-4.1345095106672725	9.165091377922273		-4.398021038171473	85.0875	79.79300006866455	Y	Y	상승전환/양호	AIA	HKG	HKD	Financial Services	Insurance - Life	Insurance - Life	AIA Group Limited, together with its subsidiaries, provides life insurance based financial services in Hong Kong. The company offers life insurance, accident, and health insurance and savings plans; and employee benefits, credit life, and pension services to corporate clients. It is also involved in the distribution of investment and other financial services products. It sells its products through a network of agents and partners in Mainland China, Macau, Thailand, Singapore, Malaysia, Australia	904340242432.0	2.23	4.62	-8.806319485078994	23.234050071757984		221334000000.0	14245000000.0	0.0	14671000000.0	43245000000.0	19.911076342147165	0.6455338842776587	0.7424196744502692	14.510588875778142	23.234050071757984	0.6245397952988146	1.7548598674905573	헐값	양호(>=1.5)	54.96810014351597	253.95262266304377	192.06743137002235	양호	충분
0388.HK	0388.HK	China / Hong Kong	423.79998779296875	0.85672905315477	-0.4229366270518953		-8.426966514408473	407.635001373291	422.86000045776365	Y	Y	상승전환/양호	HKEX	HKG	HKD	Financial Services	Financial Data & Stock Exchanges	Financial Data & Stock Exchanges	Hong Kong Exchanges and Clearing Limited, together with its subsidiaries, owns and operates stock and futures exchanges, and related clearing houses in Hong Kong, the United Kingdom, and Mainland China. It operates through Cash, Equity and Financial Derivatives, Commodities, and Data and Connectivity segments. The Cash segment covers various equity products traded on the cash market platforms of the Stock Exchange of Hong Kong Limited, as well as through the Shanghai-Hong Kong and the Shenzhen-H	535696375808.0	3.08	14.88	36.04597701149426	20.77414004603453		453788000000.0	61000000.0	430000000.0	851000000.0	58147000000.0	358.9524103091035	18.903016333446587	4.4603626422662686	4.358036121227501	20.77414004603453	0.20978178213732535	5.473598516048022	매우 유망	안심(>=2)	50.04828009206906	744.7184077699876	75.72402765943242	매우 유망	충분
2382.HK	2382.HK	China / Hong Kong	65.80000305175781	10.310144792218923	-6.864824302013006		-27.612759133975608	60.92499990463257	69.08500017166138	Y	N	상승전환/양호	SUNNY OPTICAL	HKG	HKD	Technology	Electronic Components	Electronic Components	Sunny Optical Technology (Group) Company Limited, an investment holding company, engages in designing, researching, developing, manufacturing, and selling optical and optical related products, and scientific instruments. It operates through Optical Components, Optoelectronic Products, and Optical Instruments segments. The Optical Components segment offers vehicle lens sets and optical parts for vehicle light detection and ranging, handset lens sets, glass spherical and aspherical lenses for digi	70680707072.0	1.9	4.89	71.87231282040072	24.433762661282877		38549973000.0	1405760000.0	4655009000.0	6244099000.0	29148588000.0	34.57930031499529	2.931125362464284	4.454597608694154	6.384601786659004	24.433762661282877	0.2613024393813844	4.124574020623934	매우 유망	안심(>=2)	57.367525322565754	280.5271988273465	326.3331091439096	매우 유망	충분
9868.HK	9868.HK	China / Hong Kong	62.400001525878906	-6.235914854355951	-29.808773391624545		-42.48847785633281	67.67999935150146	77.27800004959107	N	N	주의	XPENG-W	HKG	HKD	Consumer Cyclical	Auto Manufacturers	Auto Manufacturers	XPeng Inc. designs, develops, manufactures, and markets smart electric vehicles (EVs) in the People's Republic of China. The company offers P7 and P7i, a four-door sports sedan; G9, a smart EV and a mid- to large-sized sport utility vehicle (SUV); G7 for families and individual consumers seeking advanced technology and comfort; G6, a smart EV and a coupe SUV; X9, Smart EV and a large seven-seater multi-purpose vehicle (MPV); MONA M03, an all-electric hatchback coupe; Next P7, an all-new coupe sp	119277690880.0		-0.69				52582500000.0	6755098000.0	7309923000.0	19553678000.0	30368590000.0	29.32403614712095	3.1427525056640224	5.036462225662993					판정불가	판정불가				판정불가	일부부족
2015.HK	2015.HK	China / Hong Kong	73.6500015258789	8.468335597619214	-5.2733099345608885		-40.84337226837036	70.38125019073486	79.2722501373291	Y	N	상승전환/양호	LI AUTO-W	HKG	HKD	Consumer Cyclical	Auto Manufacturers	Auto Manufacturers	Li Auto Inc. operates in the energy vehicle market in the People's Republic of China. The company designs, develops, manufactures, and sells premium smart electric vehicles. Its product line comprises multi-purpose vehicles and sport utility vehicles. The company offers sales and after sales management, and technology development and corporate management services, as well as manufacturing equipment. It offers its products through online and offline channels. The company was formerly known as Lea	150343860224.0		0.62	-86.00113291875977			145354579000.0	3299203000.0	6217745000.0	17814767000.0	72619255000.0	84.2444660106201	-7.600937790865733	-10.320349807725313	-17.08784594313096	-86.00113291875977			판정불가	판정불가	8.5	5.27	-92.84453511090798	보류	일부부족
