티커	종목코드	유니버스	현재가	3M수익률(보조,%)	6M수익률(보조,%)	12M수익률(보조,%)	52주고점대비(보조,%)	40일이평(보조)	200일이평(보조)	40일선상회(보조)	200일선상회(보조)	추세판정(보조)	종목명	시장	통화	섹터	산업	업종	사업설명	시가총액	배당수익률(%)	EPS(FY)	EPS Growth 1Y(%)	EPS Growth 3Y CAGR(%)	EPS Growth 5Y CAGR(%)	현금및단기투자	장기부채	단기위험부채	총부채	주주지분	주당순현금(린치식)	주당잉여현금흐름	잉여현금흐름수익률(%)	순현금차감PER(린치식)	사용연성장률(%)	린치PER배수	배당감안점수	린치PER판정	배당감안점수판정	그레이엄적정PER(3년)	그레이엄내재가치(3년)	그레이엄괴리율(3년,%)	종합판정	데이터상태
6976.T	6976.T	Global Semicon / PCB / Memory / OSAT	16925.0	331.10035659704533	380.96050014208583		-18.805468937395055	12320.95	5532.2225	Y	Y	상승전환/양호	TAIYO YUDEN CO LTD	JPX	JPY	Technology	Electronic Components	Electronic Components	Taiyo Yuden Co., Ltd. develops, manufactures, and sells electronic components in Japan, North America, China, Europe, Hong Kong, Taiwan and internationally. The company provides products, such as multilayer ceramic capacitors, inductors, high frequency devices, RF devices, and aluminum electrolytic capacitors, as well as conductive polymer hybrid aluminum electrolytic capacitors. Taiyo Yuden Co., Ltd. was incorporated in 1950 and is headquartered in Tokyo, Japan.	2355264749568.0	53.0	108.32	535.9965635738831	-13.923727854616875		100072000000.0	136017000000.0	35195000000.0	171212000000.0	344412000000.0	-287.2224492842623	464.3902374475859	2.743812333516017	158.9016104993008	-13.923727854616875		0.24591489049480134	판정불가	불리(<1)	0.0	0.0	-100.0	보류	일부부족
4062.T	4062.T	Global Semicon / PCB / Memory / OSAT	24785.0	228.71352785145888	316.90496215306985		-6.206244087038792	18910.0	9226.13	Y	Y	상승전환/양호	IBIDEN CO LTD	JPX	JPY	Technology	Electronic Components	Electronic Components	Ibiden Co.,Ltd. provides electronics in Japan, the rest of Asia, North America, Europe, and internationally. It operates through Electronics, Ceramics, and Others segments. The company offers plastic packaging; printed circuit boards; and integrated circuit package substrates for use as MPUs for PCs and data centers, as well as GPUs for AI and vehicles. It also provides diesel particulate filter substrates for passenger cars mounted with diesel engines, buses, and trucks; substrate holding mats 	7363704651776.0	14.000000000000002	215.63	89.0369095656302	6.8780630049970926		295681000000.0	177476000000.0	15000000000.0	192537000000.0	550071000000.0	423.30130570108736	-2.997362149416777	-0.012093452287338217	112.97917123915464	6.8780630049970926	16.42601574848505	0.18479568203595997	매우 불리	불리(<1)	22.256126009994183	4799.088451535045	-80.63712547292698	보류	충분
6861.T	6861.T	Global Semicon / PCB / Memory / OSAT	76750.0	36.371712864250185	35.816669615997164		-8.815492455744323	76531.75	61664.55	Y	Y	상승전환/양호	KEYENCE CORP	JPX	JPY	Technology	Scientific & Technical Instruments	Scientific & Technical Instruments	Keyence Corporation, together with its subsidiaries, manufactures and sells electronic application equipment in Japan and internationally. The company offers photoelectric, fiber optic, laser, inductive proximity, positioning, vision, and specific solution sensors, as well as network communication units; laser profiler/3D laser snapshot sensor, laser displacement sensors, optical micrometer/laser micrometer, spectral interference displacement sensor, inductive displacement sensors, and LVDT/cont	18764168953856.0	72.0	1834.33	11.671466126183972	7.043275268619209		2390802000000.0	0.0	0.0	0.0	3471471000000.0	9857.955506929393	1658.8342414124036	2.1613475458142064	36.46674507480694	7.043275268619209	5.177526602897634	2.1675440214494572	매우 불리	안심(>=2)	22.586550537238416	41431.18724697254	-46.01799707234848	보류	충분
8035.T	8035.T	Global Semicon / PCB / Memory / OSAT	69900.0	82.5065274151436	124.47013487475913		-10.15424164524421	57012.0	39374.425	Y	Y	상승전환/양호	TOKYO ELECTRON	JPX	JPY	Technology	Semiconductor Equipment & Materials	Semiconductor Equipment & Materials	Tokyo Electron Limited, together with its subsidiaries, develops, manufactures, and sells semiconductor production equipment in Japan, South Korea, Taiwan, China, North America, Europe, and internationally. The company provides coaters/developers, plasma etch systems, cleaning systems, deposition systems, test systems, 3D integration systems, SiC Epitaxial CVD systems, and gas cluster beam systems, as well as other deposition and lithography and other products. It also offers engineering service	34268776497152.0	1.03	1251.21	5.572350877450916	6.798560410225418		561248000000.0	0.0	0.0	0.0	2069994000000.0	1233.905321334538	704.1606727784518	1.0073829367359826	54.87975214285809	6.798560410225418	8.072260718653885	0.14264933977556615	매우 불리	불리(<1)	22.097120820450836	27648.138541756292	-60.446153731393	보류	충분
6857.T	6857.T	Global Semicon / PCB / Memory / OSAT	31200.0	37.26352837659481	60.41131105398458		-3.0152315822194575	28044.75	22276.775	Y	Y	상승전환/양호	ADVANTEST CORP	JPX	JPY	Technology	Semiconductor Equipment & Materials	Semiconductor Equipment & Materials	Advantest Corporation, together with its subsidiaries, manufactures and sells semiconductors, component test systems, and mechatronics-related products in Japan, rest of Asia, the Americas, and Europe. The company offers automated test equipment, including system on chip, power device, and memory test systems, as well as burn-in and SSD test systems; and metrology and SEM tools. It also provides component test systems, such as die level, SoC, and memory test handlers, as well as change kits, and	26020811898880.0	19.0	514.8	158.75260876545192	22.676473519396858		262544000000.0	3000000.0	74952000000.0	93503000000.0	506539000000.0	362.2186109216693	367.7358909848814	1.1786406762335941	59.90245025073491	22.676473519396858	2.6416122506656925	0.6957390448128714	매우 불리	불리(<1)	53.852947038793715	27723.497135571	-11.142637385990383	보류	충분
6146.T	6146.T	Global Semicon / PCB / Memory / OSAT	79740.0	22.113323124042882	67.16981132075472		-9.877938517179018	72539.5	59953.85	Y	Y	상승전환/양호	DISCO CORPORATION	JPX	JPY	Technology	Semiconductor Equipment & Materials	Semiconductor Equipment & Materials	Disco Corporation manufactures and sells precision cutting, grinding, and polishing machines in Japan and internationally. The company offers precision machines include dicing saws, laser saws, grinders, polishers, wafer mounters, die separators, inspection systems, surface planers, and waterjet saws. It also provides precision processing tools, such as dicing blades, grinding wheels, and dry polishing wheels; and other products, such as accessory equipment, cut-off wheels, and related products.	9324970639360.0	63.0	1243.94	9.387283983501638	17.80572767187141		284575000000.0	0.0	0.0	0.0	587758000000.0	2623.5914876982993	906.4078738629394	1.1367041307536236	61.993672132338936	17.80572767187141	3.481670239755122	1.3034512215920047	매우 불리	보통(1~1.5)	44.11145534374282	54872.00376029545	-31.18635094018629	보류	충분
7735.T	7735.T	Global Semicon / PCB / Memory / OSAT	16130.0	71.23142250530785	145.50989345509896		-5.173427395649622	12366.625	8972.0975	Y	Y	상승전환/양호	SCREEN HOLDINGS CO LTD	JPX	JPY	Technology	Semiconductor Equipment & Materials	Semiconductor Equipment & Materials	SCREEN Holdings Co., Ltd. develops, manufactures, and markets semiconductor production equipment in Japan, Taiwan, South Korea, China, the United States, Europe, and internationally. It operates through Semiconductor Production Equipment, Graphic Arts Equipment, Display Production Equipment and Coater, and Printed Circuit Board (PCB)-Related Equipment segments. The company offers wafer cleaning systems, such as wet stations, spin processors, and spin scrubbers; coat/develop trackers, and spray c	3332672847872.0	1.43	487.13	40.930021677836194	29.8024843823244		260397000000.0	757000000.0	1013000000.0	4562000000.0	420639000000.0	1373.118513232713	241.51210577645318	1.4972852187008878	30.293518130206078	29.8024843823244	1.016476268943971	1.0309956158965263	보통	보통(1~1.5)	60.0	29227.8	81.20148791072535	보류	충분
6723.T	6723.T	Global Semicon / PCB / Memory / OSAT	4703.0	106.63444639718804	117.53006475485664		-6.70501884546717	4089.25	2596.44	Y	Y	상승전환/양호	RENESAS ELECTRONICS CORP	JPX	JPY	Technology	Semiconductors	Semiconductors	Renesas Electronics Corporation engages in the design, research, development, manufacturing, sale, and service of semiconductors in Japan, China, rest of Asia, Europe, North America, and internationally. The company operates through Automotive Business and Industrial/Infrastructure/IoT Business segments. It offers microcontrollers and microprocessors; amplifiers, audio and video, data converters, power line communication, and switches and multiplexer products; custom ASICS and processor IP solut	8788444184576.0	60.0	-28.69	162.1			373099000000.0	964089000000.0	242478000000.0	1206567000000.0	2443034000000.0	-325.7409006245188	175.87385024717142	3.7396098287725157		162.1			판정불가	판정불가				판정불가	일부부족
6758.T	6758.T	Global Semicon / PCB / Memory / OSAT	3250.0	1.8170426065162948	-21.47861802367722		-30.85106382978723	3400.15	3803.392468261719	N	N	주의	SONY GROUP CORPORATION	JPX	JPY	Technology	Consumer Electronics	Consumer Electronics	Sony Group Corporation develops, designs, produces, manufactures, supplies, and sells electronic equipment, instruments, and devices for consumer, professional, and industrial use in Japan, the United States, Europe, China, the Asia-Pacific, and internationally. The company operates through Game & Network Services, Music, Pictures, Entertainment Technology & Services, and Imaging & Sensing Solutions. It develops, designs, produces, manufactures, provides, and sells smartphones and image sensors;	18829904183296.0	1.08	171.6	-58.099999999999994			2265213000000.0	824393000000.0	217593000000.0	1669669000000.0	8119011000000.0	244.62693454769231	252.62643667019827	7.773121128313792	17.513829052752378	-58.099999999999994		-3.2557129470804695	판정불가	불리(<1)	8.5	1458.6	-55.120000000000005	보류	일부부족
3407.T	3407.T	Global Semicon / PCB / Memory / OSAT	1796.0	21.804001356392	27.829181494661913		-4.696205890156535	1708.6875	1476.835	Y	Y	상승전환/양호	ASAHI KASEI CORP	JPX	JPY	Industrials	Conglomerates	Conglomerates	Asahi Kasei Corporation engages in material, homes, and healthcare businesses in Japan, the United States, China, and internationally. The company offers Pimel, a photosensitive PI material applied for semiconductor applications, such as buffer coating, passivation layers, and dielectric layers; Sunfort, a dry film photoresist; Novacure, a latent curing agent for epoxy resin; glass fabric for printed circuit boards; plastic optical fiber; sensors and devices; artificial suede products under the 	2425356025856.0	2.45	116.92	17.6277991362771			377023000000.0	837618000000.0	129926000000.0	1011221000000.0	2088459000000.0	-340.69531078718956	68.09098261857802	3.791257384107908	18.274848706698506	17.6277991362771	1.03670620282312	1.0986574750092315	보통	보통(1~1.5)	8.5	993.82	-44.66481069042316	보류	충분
5201.T	5201.T	Global Semicon / PCB / Memory / OSAT	7178.0	35.17890772128061	35.84405753217259		-12.687021043668656	6701.25	5653.775	Y	Y	상승전환/양호	AGC INC	JPX	JPY	Industrials	Conglomerates	Conglomerates	AGC Inc. manufactures and sells architectural glass, electronics, chemicals, automotive, and ceramics worldwide. The company offers architectural glass products, including insulated, laminated, wired, toughened, solar control, sound insulation, decorative, float and patterned, and industrial glass, as well as structural glazing systems and industrial glass; automotive glass for displays, sensors and connected drive, windows, and trains; and glass substrates used for thin-film-transistor liquid c	1542828457984.0	2.93	325.88	243.8			94671000000.0	429514000000.0	216949000000.0	646463000000.0	1485126000000.0	-1576.5197055452556	305.7104404176256	4.258991925572939	26.864243603612543	243.8	0.11018967843975612	9.184327079539333	매우 유망	안심(>=2)	8.5	2769.98	-61.41014210086375	양호	충분
3110.T	3110.T	Global Semicon / PCB / Memory / OSAT	20010.0	-0.5467196819085474	80.5956678700361		-37.370892018779344	23285.0	16201.75	N	Y	상승전환/양호	NITTO BOSEKI CO	JPX	JPY	Consumer Cyclical	Textile Manufacturing	Textile Manufacturing	Nitto Boseki Co., Ltd. manufactures, processes, and sells glass fiber products, chemical and pharmaceutical products, and textile products in Japan. It operates through six segments: Electronic Materials Business, Medical Business, Composite Materials Business, Materials Solution Business, Insulation Materials Business, and Other Businesses. The company engages in the development, manufacture, and sale of glass fiber products for electronic materials; in vitro diagnostic reagents; glass fiber pr	744120647680.0	14.000000000000002	1146.57	75.94572368421053	25.34129768244895		28546000000.0	33743000000.0	17826000000.0	52746000000.0	129733000000.0	-142.75464550041312	525.2283195330766	2.624829183073846	17.576558470481885	25.34129768244895	0.6935934651308397	2.2382821841100933	헐값	안심(>=2)	59.1825953648979	67856.98836753098	239.1153841455821	양호	충분
600183.SS	600183.SS	Global Semicon / PCB / Memory / OSAT	187.1999969482422	235.18353099863384	206.88524089875767		0.0	125.34474925994873	74.34084987640381	Y	Y	상승전환/양호	SHENGYI TECHNOLOGY CO LTD	SHH	CNY	Technology	Electronic Components	Electronic Components	Shengyi Technology Co.,Ltd. engages in the design, production, and sales of copper clad laminates, bonding sheets, and printed circuit boards in China and internationally. The company offers flame-retardant epoxy glass fabric reinforced laminates, composite epoxy materials, and flexible circuit materials, as well as prereg for multilayer circuit boards; and smart and rigid materials, automotive and RF materials, IMS and HTC materials, IC substrate and flexible materials, HSD materials, and speci	454731104256.0	68.0	1.61	91.75319663725077	29.622792505245087		3239977726.09	902984683.16	2304818271.34	3676930770.8	16723501226.33	0.962074242411724	1.1930143211125952	0.6372939853425557	115.67572838871457	29.622792505245087	3.904956913438621	0.8439349711911497	매우 불리	불리(<1)	60.0	96.60000000000001	-48.39743505620443	보류	충분
002916.SZ	002916.SZ	Global Semicon / PCB / Memory / OSAT	455.0	94.86915469421287	136.6340768091323		-0.5116535524178789	373.6439979553223	254.73374992370606	Y	Y	상승전환/양호	SHENNAN CIRCUITS CO LTD	SHZ	CNY	Technology	Electronic Components	Electronic Components	Shennan Circuits Co., Ltd. engages in the design, manufacture, and sale of printed circuit boards, packaging substrates, and electronic assemblies in China and internationally. It operates through Packaging Substrates, Packaging Substrates, and Distribution Substrates segments. The company provides RF and microwave, thermal management, miniaturization, and chip package substrate solutions. It also offers schematic design, PCB / SiP design, PCB / SUB production, electronic assembly, package testi	309930786816.0	56.00000000000001	5.23	74.46731868482586	25.905809548765156		1588756438.22	2679204686.22	15009670.83	3557910474.95	17149430529.85	-1.600853970239101	0.10703819865094824	0.02352487882438423	87.30417857939561	25.905809548765156	3.3700617776508404	0.9381659719102552	매우 불리	불리(<1)	60.0	313.8	-31.03296703296703	보류	충분
688981.SS	688981.SS	Global Semicon / PCB / Memory / OSAT	156.86000061035156	59.99591916110278	34.29794221909557		0.0	130.68499965667723	118.9807500076294	Y	Y	상승전환/양호	SEMICONDUCTOR MANUFACTURING INT	SHH	CNY	Technology	Semiconductors	Semiconductors	Semiconductor Manufacturing International Corporation, an investment holding company, engages in the manufacture, testing, and sale of integrated circuits wafer and various compound semiconductors in the United States, China, and Eurasia. The company is also involved in the manufacturing, sale, and trading of semiconductor products; and research and development activities. In addition, it offers semiconductor foundry and technology services; supporting services comprising design and IP support, 	1256938668032.0		0.61	39.04287790107723	-27.767740812712226		14935414000.0	9994773000.0	2593077000.0	12596181000.0	21439670000.0	2.4708609402945965	-2.60515381357045	-1.6608146139446909	253.09695027878195	-27.767740812712226		-0.10971187437117096	판정불가	불리(<1)	0.0	0.0	-100.0	보류	일부부족
603501.SS	603501.SS	Global Semicon / PCB / Memory / OSAT	89.70999908447266	-9.034682025922148	-29.094213195753373		-40.65621474426816	97.20875034332275	117.2396501159668	N	N	주의	OMNIVISION INTEGRATED CIRCUITS 	SHH	CNY	Technology	Semiconductors	Semiconductors	OmniVision Integrated Circuits Group, Inc., together with its subsidiaries, engages in the design, development, and sale of integrated circuits and computer software and hardware in China and internationally. It operates in two segments, Semiconductor Design and Electronic Components Agency. The company offers image sensors, application-specific integrated circuits, camera cube chips, liquid crystal on silicon, display solutions, in-system programming, and cable modules. It also provides semicon	113159151616.0	80.0	3.04	21.730996944226554	59.85671328521085		13072154645.060001	1617721215.79	2078985512.66	9796924850.61	28172055029.35	9.461412779849878	1.4728449655092226	1.6417846177017164	26.397561284415385	59.85671328521085	0.44101254204576557	5.298092190348643	매우 유망	안심(>=2)	60.0	182.4	103.3218168113553	매우 유망	충분
1888.HK	1888.HK	Global Semicon / PCB / Memory / OSAT	104.19999694824219	407.3027862889312	777.8432851967489		0.0	56.62999963760376	23.965699906349183	Y	Y	상승전환/양호	KB LAMINATES	HKG	HKD	Technology	Electronic Components	Electronic Components	Kingboard Laminates Holdings Limited, an investment holding company, engages in the manufacture and sale of laminates in the People's Republic of China, Europe, other Asian countries, and the United States. It operates through Laminates, Properties, and Investments segments. The company offers glass epoxy and paper laminates. It also provides upstream component materials, such as copper foils, glass yarns, glass fabrics, bleached kraft papers, epoxy resins, kraft papers for copper-clad laminates	328381104128.0	53.0	0.78	84.16268505447569	8.55356145230186		3010761000.0	637441000.0	3552115000.0	4191710000.0	16341745000.0	0.753088260959241	0.27968173380507383	0.26840858157030106	132.624241906773	8.55356145230186	15.505148661915827	0.46411998717074954	매우 불리	불리(<1)	25.60712290460372	19.973555865590903	-80.8315197211454	보류	충분
0981.HK	0981.HK	Global Semicon / PCB / Memory / OSAT	86.0	51.142350955625226	32.92118092184315		-5.5464062410707555	76.08250007629394	70.2772498703003	Y	Y	상승전환/양호	SMIC	HKG	HKD	Technology	Semiconductors	Semiconductors	Semiconductor Manufacturing International Corporation, an investment holding company, engages in the manufacture, testing, and sale of integrated circuits wafer and various compound semiconductors in the United States, China, and Eurasia. The company is also involved in the manufacturing, sale, and trading of semiconductor products; and research and development activities. In addition, it offers semiconductor foundry and technology services; supporting services comprising design and IP support, 	689128734720.0		0.7	39.04287790107723	-27.767740812712226		14935414000.0	9994773000.0	2593077000.0	12596181000.0	21439670000.0	0.821583099937418	-0.866236667172296	-1.0072519385724372	121.68345271437514	-27.767740812712226		-0.22819652297252632	판정불가	불리(<1)	0.0	0.0	-100.0	보류	일부부족
2382.HK	2382.HK	Global Semicon / PCB / Memory / OSAT	67.0	23.04866677908757	0.9036121390558316		-26.29263050020374	71.98249988555908	68.64500009536744	N	N	중립	SUNNY OPTICAL	HKG	HKD	Technology	Electronic Components	Electronic Components	Sunny Optical Technology (Group) Company Limited, an investment holding company, engages in designing, researching, developing, manufacturing, and selling optical and optical related products, and scientific instruments. It operates through Optical Components, Optoelectronic Products, and Optical Instruments segments. The Optical Components segment offers vehicle lens sets and optical parts for vehicle light detection and ranging, handset lens sets, glass spherical and aspherical lenses for digi	71969718272.0	1.59	4.92	71.87231282040072	24.433762661282877		38549973000.0	1405760000.0	4655009000.0	6244099000.0	29148588000.0	34.57930031499529	2.931125362464284	4.3748139738272895	6.589573106708275	24.433762661282877	0.2696912955264948	3.949233469280481	매우 유망	안심(>=2)	57.367525322565754	282.2482245870235	321.26600684630375	매우 유망	충분
TTMI	TTMI	Global Semicon / PCB / Memory / OSAT	208.2899932861328	92.86110489456743	193.77995599916284		-5.951148174436471	179.07225074768067	101.25659990310669	Y	Y	상승전환/양호	TTM Technologies, Inc.	NMS	USD	Technology	Electronic Components	Electronic Components	TTM Technologies, Inc. manufactures and sells mission systems, radio frequency (RF) components, RF microwave/microelectronic assemblies, and printed circuit boards (PCBs) and substrates in the United States, Taiwan, and internationally. It operates in three segments, A&D, Commercial, and RF&S Components. The company offers various engineered systems and RF and microwave assemblies; PCBs and IC substrates, custom assemblies and integrated systems, passive and advanced ceramic RF components, hi-re	21630926848.0		1.84	215.1885468658413	23.334906230221144		501234000.0	912336000.0	3815000.0	1028413000.0	1762253000.0	-3.958611135695166	-0.006576789715641856	-0.0031575159285771193	115.35250240316738	23.334906230221144	4.943345444164409	0.2022921544316702	매우 불리	불리(<1)	55.16981246044229	101.51245492721381	-51.263882951993864	보류	충분
005930.KS	005930.KS	Global Semicon / PCB / Memory / OSAT	340500.0	82.76972624798711	224.90458015267177		-6.0689655172413755	297287.5	167034.5	Y	Y	상승전환/양호	SamsungElec	KSC	KRW	Technology	Consumer Electronics	Consumer Electronics	Samsung Electronics Co., Ltd. engages in the consumer electronics, information technology and mobile communications, and device solutions businesses worldwide. The company operates through four divisions: Device eXperience (DX), Device Solutions (DS), SDC, and Harman. The company offers smartphones, tablets, audio sounds, watches, switches, and accessories; TVs, and sound devices; appliances, including refrigerators, washing machines and dryers, vacuum cleaners, cooking appliances, dishwashers, 	2354112913997824.0	44.0	7678.605560818366	31.645335140041773	-6.832366066754158		193837850000000.0	2813148000000.0	17584050000000.0	25239139000000.0	424313255000000.0	33139.892844403796	5753.104608252318	1.689604877607142	40.02811509474626	-6.832366066754158		0.9285381998445421	판정불가	불리(<1)	0.0	0.0	-100.0	보류	일부부족
000660.KS	000660.KS	Global Semicon / PCB / Memory / OSAT	2621000.0	180.92175777063235	373.1046931407942		-10.208975676601572	2016000.0	947657.5	Y	Y	상승전환/양호	SK hynix	KSC	KRW	Technology	Semiconductors	Semiconductors	SK hynix Inc. through its subsidiaries, engages in research, develops, manufactures, distributes, and sells semiconductor devices in Korea, China, rest of Asia, the United States, Europe, and internationally. It offers DRAM, such as server memory, graphics memory, mobile memory, PC memory, consumer memory; NAND flash memory; SSD; and MCP products. It also engages in foundry business, produces non-memory semiconductors. The company serves its products for server, networking, mobile, personal comp	2070646817292288.0	11.0	60462.05716711756	116.88806343383877	168.00595548778566		55351258000000.0	14086148000000.0	8161757000000.0	24757848000000.0	120516178000000.0	58131.75414184756	34927.9596638012	1.3326195980084397	42.3880424507285	168.00595548778566	0.25230083259643843	4.223029541783173	매우 유망	안심(>=2)	60.0	3627723.430027053	38.40989813151672	매우 유망	충분
042700.KS	042700.KS	Global Semicon / PCB / Memory / OSAT	270000.0	-9.090909090909093	127.8481012658228		-34.065934065934066	327100.0	206096.0	N	Y	상승전환/양호	HANMISemi	KSC	KRW	Technology	Semiconductor Equipment & Materials	Semiconductor Equipment & Materials	HANMI Semiconductor Co., Ltd. manufactures and sells semiconductor equipment in South Korea and internationally. The company offers bonder; micro SAW equipment; vision placement equipment; meta grinder; EMI shield vision attach and detach, EMI shield vision placement, EMI shield tape mounter, EMI shield tape laser cutting, EMI shield tape demounter, vision inspection, and converlay attach equipment; laser marking, laser ablation, and laser cutting equipment; and pick and place, strip mounter, an	25894869532672.0	30.0	2256.2021643764106	40.22753487679789	32.37512374110017		278201051520.0	0.0	1339920070.0	2554319940.0	690327519530.0	2932.9704453634477	1422.1134652122028	0.5267086908193344	118.37016813980894	32.37512374110017	3.6562074352641996	0.5269496928265566	매우 불리	불리(<1)	60.0	135372.12986258464	-49.86217412496865	보류	충분
