티커	종목코드	유니버스	현재가	3M수익률(보조,%)	6M수익률(보조,%)	12M수익률(보조,%)	52주고점대비(보조,%)	40일이평(보조)	200일이평(보조)	40일선상회(보조)	200일선상회(보조)	추세판정(보조)	종목명	시장	통화	섹터	산업	업종	사업설명	시가총액	배당수익률(%)	EPS(FY)	EPS Growth 1Y(%)	EPS Growth 3Y CAGR(%)	EPS Growth 5Y CAGR(%)	현금및단기투자	장기부채	단기위험부채	총부채	주주지분	주당순현금(린치식)	주당잉여현금흐름	잉여현금흐름수익률(%)	순현금차감PER(린치식)	사용연성장률(%)	린치PER배수	배당감안점수	린치PER판정	배당감안점수판정	그레이엄적정PER(3년)	그레이엄내재가치(3년)	그레이엄괴리율(3년,%)	종합판정	데이터상태
6976.T	6976.T	Global Semicon / PCB / Memory / OSAT	14730.0	193.42629482071715	301.03457664034846		-34.98124034429486	15774.875	6435.8	N	Y	상승전환/양호	TAIYO YUDEN CO LTD	JPX	JPY	Technology	Electronic Components	Electronic Components	Taiyo Yuden Co., Ltd. develops, manufactures, and sells electronic components in Japan, North America, China, Europe, Hong Kong, Taiwan and internationally. The company provides products, such as multilayer ceramic capacitors, inductors, high frequency devices, RF devices, and aluminum electrolytic capacitors, as well as conductive polymer hybrid aluminum electrolytic capacitors. Taiyo Yuden Co., Ltd. was incorporated in 1950 and is headquartered in Tokyo, Japan.	1489248190464.0	61.0	107.53	535.9965635738831	-13.923727854616875		100072000000.0	136017000000.0	35195000000.0	171212000000.0	344412000000.0	-287.2224492842623	464.3902374475859	3.1526832141723418	139.65611875089985	-13.923727854616875		0.33708707191950227	판정불가	불리(<1)	0.0	0.0	-100.0	보류	일부부족
4062.T	4062.T	Global Semicon / PCB / Memory / OSAT	20300.0	107.26975699407801	183.5987706063146		-23.178807947019862	21216.0	10359.3725	N	Y	상승전환/양호	IBIDEN CO LTD	JPX	JPY	Technology	Electronic Components	Electronic Components	Ibiden Co.,Ltd. provides electronics in Japan, the rest of Asia, North America, Europe, and internationally. It operates through Electronics, Ceramics, and Others segments. The company offers plastic packaging; printed circuit boards; and integrated circuit package substrates for use as MPUs for PCs and data centers, as well as GPUs for AI and vehicles. It also provides diesel particulate filter substrates for passenger cars mounted with diesel engines, buses, and trucks; substrate holding mats 	5219098820608.0	17.0	215.18	89.0369095656302	6.8780630049970926		295681000000.0	177476000000.0	15000000000.0	192537000000.0	550071000000.0	423.30130570108736	-2.997362149416777	-0.01476533078530432	92.37242631424348	6.8780630049970926	13.430005838436273	0.2584977352848334	매우 불리	불리(<1)	22.256126009994183	4789.073194830548	-76.40850642940616	보류	충분
6861.T	6861.T	Global Semicon / PCB / Memory / OSAT	76970.0	27.181097157964306	34.610003497726474		-8.554116668646783	77169.0	62985.65	N	Y	상승전환/양호	KEYENCE CORP	JPX	JPY	Technology	Scientific & Technical Instruments	Scientific & Technical Instruments	Keyence Corporation, together with its subsidiaries, manufactures and sells electronic application equipment in Japan and internationally. The company offers photoelectric, fiber optic, laser, inductive proximity, positioning, vision, and specific solution sensors, as well as network communication units; laser profiler/3D laser snapshot sensor, laser displacement sensors, optical micrometer/laser micrometer, spectral interference displacement sensor, inductive displacement sensors, and LVDT/cont	18601677422592.0	71.0	1831.89	11.671466126183972	7.043275268619209		2390802000000.0	0.0	0.0	0.0	3471471000000.0	9857.955506929393	1658.8342414124036	2.1551698602213896	36.635411784043036	7.043275268619209	5.201473801154613	2.130268815556533	매우 불리	안심(>=2)	22.586550537238416	41376.07606366168	-46.243892342910634	보류	충분
8035.T	8035.T	Global Semicon / PCB / Memory / OSAT	72940.0	71.987738740863	97.50880043325209		-7.436548223350259	64187.25	42531.3	Y	Y	상승전환/양호	TOKYO ELECTRON	JPX	JPY	Technology	Semiconductor Equipment & Materials	Semiconductor Equipment & Materials	Tokyo Electron Limited, together with its subsidiaries, develops, manufactures, and sells semiconductor production equipment in Japan, South Korea, Taiwan, China, North America, Europe, and internationally. The company provides coaters/developers, plasma etch systems, cleaning systems, deposition systems, test systems, 3D integration systems, SiC Epitaxial CVD systems, and gas cluster beam systems, as well as other deposition and lithography and other products. It also offers engineering service	32431161737216.0	99.0	1247.27	5.572350877450916	6.798560410225418		561248000000.0	0.0	0.0	0.0	2069994000000.0	1233.905321334538	704.1606727784518	0.9653971384404331	57.490434852650566	6.798560410225418	8.45626594215177	1.8402810951315605	매우 불리	양호(>=1.5)	22.097120820450836	27561.075885723716	-62.21404457674291	보류	충분
6857.T	6857.T	Global Semicon / PCB / Memory / OSAT	29830.0	18.279143536875498	40.873671782762685		-16.90807799442897	28561.625	23411.45	Y	Y	상승전환/양호	ADVANTEST CORP	JPX	JPY	Technology	Semiconductor Equipment & Materials	Semiconductor Equipment & Materials	Advantest Corporation, together with its subsidiaries, manufactures and sells semiconductors, component test systems, and mechatronics-related products in Japan, rest of Asia, the Americas, and Europe. The company offers automated test equipment, including system on chip, power device, and memory test systems, as well as burn-in and SSD test systems; and metrology and SEM tools. It also provides component test systems, such as die level, SoC, and memory test handlers, as well as change kits, and	20889131286528.0	20.0	516.06	132.8824832327193	42.25059773479647		339966000000.0	0.0	0.0	20192000000.0	795726000000.0	469.03916828455834	412.72952374844016	1.3836055103869935	56.89447124697796	42.25059773479647	1.3465956530153698	1.09414142306671	보통	보통(1~1.5)	60.0	30963.6	3.8002011397921587	보류	충분
6146.T	6146.T	Global Semicon / PCB / Memory / OSAT	72560.0	7.575982209043741	41.996086105675154		-17.99276672694394	73777.5	62232.05	N	Y	상승전환/양호	DISCO CORPORATION	JPX	JPY	Technology	Semiconductor Equipment & Materials	Semiconductor Equipment & Materials	Disco Corporation manufactures and sells precision cutting, grinding, and polishing machines in Japan and internationally. The company offers precision machines include dicing saws, laser saws, grinders, polishers, wafer mounters, die separators, inspection systems, surface planers, and waterjet saws. It also provides precision processing tools, such as dicing blades, grinding wheels, and dry polishing wheels; and other products, such as accessory equipment, cut-off wheels, and related products.	7687108034560.0	70.0	1248.03	9.387283983501638	17.80572767187141		284575000000.0	0.0	0.0	0.0	587758000000.0	2623.5914876982993	906.4078738629394	1.2491839496457269	56.03744181814676	17.80572767187141	3.147158198239316	1.5669117793924174	매우 불리	양호(>=1.5)	44.11145534374282	55052.41961265135	-24.1284183949127	보류	충분
7735.T	7735.T	Global Semicon / PCB / Memory / OSAT	18150.0	81.04738154613467	126.87499999999999		-6.875320677270391	14371.625	9698.8975	Y	Y	상승전환/양호	SCREEN HOLDINGS CO LTD	JPX	JPY	Technology	Semiconductor Equipment & Materials	Semiconductor Equipment & Materials	SCREEN Holdings Co., Ltd. develops, manufactures, and markets semiconductor production equipment in Japan, Taiwan, South Korea, China, the United States, Europe, and internationally. It operates through Semiconductor Production Equipment, Graphic Arts Equipment, Display Production Equipment and Coater, and Printed Circuit Board (PCB)-Related Equipment segments. The company offers wafer cleaning systems, such as wet stations, spin processors, and spin scrubbers; coat/develop trackers, and spray c	3357254352896.0	96.0	486.42	-7.503996300280491	16.968083827819402		307370000000.0	79000000.0	3167000000.0	6091000000.0	486568000000.0	1625.1230975573626	327.0596526492477	1.8019815572961304	33.97244542256206	16.968083827819402	2.00213800021802	3.3252856078707276	매우 불리	안심(>=2)	42.436167655638805	20641.80067105583	13.728929317112005	보류	충분
6723.T	6723.T	Global Semicon / PCB / Memory / OSAT	4762.0	82.38222903102259	114.02247191011234		-7.046652352137417	4505.925	2781.605	Y	Y	상승전환/양호	RENESAS ELECTRONICS CORP	JPX	JPY	Technology	Semiconductors	Semiconductors	Renesas Electronics Corporation engages in the design, research, development, manufacturing, sale, and service of semiconductors in Japan, China, rest of Asia, Europe, North America, and internationally. The company operates through Automotive Business and Industrial/Infrastructure/IoT Business segments. It offers microcontrollers and microprocessors; amplifiers, audio and video, data converters, power line communication, and switches and multiplexer products; custom ASICS and processor IP solut	8108083511296.0	59.0	-28.57	162.1			373099000000.0	964089000000.0	242478000000.0	1206567000000.0	2443034000000.0	-325.7409006245188	175.87385024717142	3.6932769896508066		162.1			판정불가	판정불가				판정불가	일부부족
6758.T	6758.T	Global Semicon / PCB / Memory / OSAT	3359.0	-0.8559622195985828	-17.651385143417507		-28.531914893617017	3411.275	3756.4824682617186	N	N	주의	SONY GROUP CORPORATION	JPX	JPY	Technology	Consumer Electronics	Consumer Electronics	Sony Group Corporation develops, designs, produces, manufactures, supplies, and sells electronic equipment, instruments, and devices for consumer, professional, and industrial use in Japan, the United States, Europe, China, the Asia-Pacific, and internationally. The company operates through Game & Network Services, Music, Pictures, Entertainment Technology & Services, and Imaging & Sensing Solutions. It develops, designs, produces, manufactures, provides, and sells smartphones and image sensors;	19617883881472.0	1.04	171.31	-58.099999999999994			2265213000000.0	824393000000.0	217593000000.0	1669669000000.0	8119011000000.0	245.3771097786831	253.4011432487435	7.543945913925082	18.175371491572687	-58.099999999999994		-3.139413135321983	판정불가	불리(<1)	8.5	1456.135	-56.649746948496585	보류	일부부족
3407.T	3407.T	Global Semicon / PCB / Memory / OSAT	1842.0	11.636363636363644	29.718309859154935		-3.1036296685954756	1779.0875	1513.63	Y	Y	상승전환/양호	ASAHI KASEI CORP	JPX	JPY	Industrials	Conglomerates	Conglomerates	Asahi Kasei Corporation engages in material, homes, and healthcare businesses in Japan, the United States, China, and internationally. The company offers Pimel, a photosensitive PI material applied for semiconductor applications, such as buffer coating, passivation layers, and dielectric layers; Sunfort, a dry film photoresist; Novacure, a latent curing agent for epoxy resin; glass fabric for printed circuit boards; plastic optical fiber; sensors and devices; artificial suede products under the 	2454422290432.0	2.39	116.97	17.6277991362771			377023000000.0	837618000000.0	129926000000.0	1011221000000.0	2088459000000.0	-340.69531078718956	68.09098261857802	3.6965788609434322	18.660300169164653	17.6277991362771	1.0585723166519818	1.0727479705474223	보통	보통(1~1.5)	8.5	994.245	-46.02361563517915	보류	충분
5201.T	5201.T	Global Semicon / PCB / Memory / OSAT	6426.0	7.981851789615191	22.985645933014354		-21.834326724242793	7008.85	5778.805	N	Y	상승전환/양호	AGC INC	JPX	JPY	Industrials	Conglomerates	Conglomerates	AGC Inc. manufactures and sells architectural glass, electronics, chemicals, automotive, and ceramics worldwide. The company offers architectural glass products, including insulated, laminated, wired, toughened, solar control, sound insulation, decorative, float and patterned, and industrial glass, as well as structural glazing systems and industrial glass; automotive glass for displays, sensors and connected drive, windows, and trains; and glass substrates used for thin-film-transistor liquid c	1346364243968.0	3.27	325.8	243.8			94671000000.0	429514000000.0	216949000000.0	646463000000.0	1485126000000.0	-1576.5197055452556	305.7104404176256	4.757398699309455	24.562675584853455	243.8	0.10074928459743009	10.058757611583465	매우 유망	안심(>=2)	8.5	2769.3	-56.904761904761905	양호	충분
3110.T	3110.T	Global Semicon / PCB / Memory / OSAT	3445.0	-30.684104627766594	64.51766953199618		-46.087636932707355	4118.3	3392.3	N	Y	상승전환/양호	NITTO BOSEKI CO	JPX	JPY	Consumer Cyclical	Textile Manufacturing	Textile Manufacturing	Nitto Boseki Co., Ltd. manufactures, processes, and sells glass fiber products, chemical and pharmaceutical products, and textile products in Japan. It operates through six segments: Electronic Materials Business, Medical Business, Composite Materials Business, Materials Solution Business, Insulation Materials Business, and Other Businesses. The company engages in the development, manufacture, and sale of glass fiber products for electronic materials; in vitro diagnostic reagents; glass fiber pr	618887053312.0	81.0	229.44	75.94572368421053	25.34129768244895		28546000000.0	33743000000.0	17826000000.0	52746000000.0	129733000000.0	-28.550929100082627	105.04566390661533	3.0492210132544364	15.139256141475256	25.34129768244895	0.5974143996564354	7.024208896969389	헐값	안심(>=2)	59.1825953648979	13578.854680522174	294.1612389121095	양호	충분
600183.SS	600183.SS	Global Semicon / PCB / Memory / OSAT	134.4499969482422	127.11147840459311	90.00846931772664		-28.178419262786914	147.66949920654298	80.82724988937377	N	Y	상승전환/양호	SHENGYI TECHNOLOGY CO LTD	SHH	CNY	Technology	Electronic Components	Electronic Components	Shengyi Technology Co.,Ltd. engages in the design, production, and sales of copper clad laminates, bonding sheets, and printed circuit boards in China and internationally. The company offers flame-retardant epoxy glass fabric reinforced laminates, composite epoxy materials, and flexible circuit materials, as well as prereg for multilayer circuit boards; and smart and rigid materials, automotive and RF materials, IMS and HTC materials, IC substrate and flexible materials, HSD materials, and speci	326595084288.0	80.0	1.61	91.75319663725077	29.622792505245087		3239977726.09	902984683.16	2304818271.34	3676930770.8	16723501226.33	0.962074242411724	1.1930143211125952	0.8873293776063509	82.91175323343506	29.622792505245087	2.798917530099652	1.3221622777244386	매우 불리	보통(1~1.5)	60.0	96.60000000000001	-28.15172763656729	보류	충분
002916.SZ	002916.SZ	Global Semicon / PCB / Memory / OSAT	393.5899963378906	61.971191908596964	68.38074709642379		-14.044550866085414	405.52299880981445	269.8510998535156	N	Y	상승전환/양호	SCC	SHZ	CNY	Technology	Electronic Components	Electronic Components	Shennan Circuits Co., Ltd. engages in the design, manufacture, and sale of printed circuit boards, packaging substrates, and electronic assemblies in China and internationally. It operates through Packaging Substrates, Packaging Substrates, and Distribution Substrates segments. The company provides RF and microwave, thermal management, miniaturization, and chip package substrate solutions. It also offers schematic design, PCB / SiP design, PCB / SUB production, electronic assembly, package testi	268100354048.0	56.00000000000001	5.24	74.46731868482586	25.905809548765156		1588756438.22	2679204686.22	15009670.83	3557910474.95	17149430529.85	-1.600853970239101	0.10703819865094824	0.027195355483338478	75.41810120384154	25.905809548765156	2.911242787525105	1.0860232257424316	매우 불리	보통(1~1.5)	60.0	314.40000000000003	-20.119921002745013	보류	충분
688981.SS	688981.SS	Global Semicon / PCB / Memory / OSAT	163.5800018310547	64.03930989633145	30.571522529490224		-5.4450856467891935	140.8042501449585	121.51795001983642	Y	Y	상승전환/양호	SEMICONDUCTOR MANUFACTURING INT	SHH	CNY	Technology	Semiconductors	Semiconductors	Semiconductor Manufacturing International Corporation, an investment holding company, engages in the manufacture, testing, and sale of integrated circuits wafer and various compound semiconductors in the United States, China, and Eurasia. The company is also involved in the manufacturing, sale, and trading of semiconductor products; and research and development activities. In addition, it offers semiconductor foundry and technology services; supporting services comprising design and IP support, 	1400376655872.0		0.62	39.04287790107723	-27.767740812712226		14935414000.0	9994773000.0	2593077000.0	12596181000.0	21439670000.0	1.9399828931885734	-2.045422204880973	-1.2504109194187951	260.70970796430015	-27.767740812712226		-0.10650827324203269	판정불가	불리(<1)	0.0	0.0	-100.0	보류	일부부족
603501.SS	603501.SS	Global Semicon / PCB / Memory / OSAT	102.48999786376953	8.754244680614232	-19.171927920274033		-32.20215710446179	96.25775032043457	114.88105014801026	Y	N	상승전환/양호	OMNIVISION INTEGRATED CIRCUITS 	SHH	CNY	Technology	Semiconductors	Semiconductors	OmniVision Integrated Circuits Group, Inc., together with its subsidiaries, engages in the design, development, and sale of integrated circuits and computer software and hardware in China and internationally. It operates in two segments, Semiconductor Design and Electronic Components Agency. The company offers image sensors, application-specific integrated circuits, camera cube chips, liquid crystal on silicon, display solutions, in-system programming, and cable modules. It also provides semicon	128881475584.0	70.0	3.04	21.730996944226554	59.85671328521085		13072154645.060001	1617721215.79	2078985512.66	9796924850.61	28172055029.35	9.491875084021855	1.477586990023052	1.4416889655779597	30.591487756495944	59.85671328521085	0.511078642269093	4.244864268088317	헐값	안심(>=2)	60.0	182.4	77.96858601016604	양호	충분
1888.HK	1888.HK	Global Semicon / PCB / Memory / OSAT	51.04999923706055	130.78660623970282	279.83631570622885		-51.00767684051095	67.01149978637696	27.580699911117552	N	Y	상승전환/양호	KB LAMINATES	HKG	HKD	Technology	Electronic Components	Electronic Components	Kingboard Laminates Holdings Limited, an investment holding company, engages in the manufacture and sale of laminates in the People's Republic of China, Europe, other Asian countries, and the United States. It operates through Laminates, Properties, and Investments segments. The company offers glass epoxy and paper laminates. It also provides upstream component materials, such as copper foils, glass yarns, glass fabrics, bleached kraft papers, epoxy resins, kraft papers for copper-clad laminates	160881524736.0	80.0	0.78	84.16268505447569	8.55356145230186		3010761000.0	637441000.0	3552115000.0	4191710000.0	16341745000.0	0.753088260959241	0.27968173380507383	0.547858448550249	64.48321920012988	8.55356145230186	7.538756757604952	1.3732807162971712	매우 불리	보통(1~1.5)	25.60712290460372	19.973555865590903	-60.874522695211354	보류	충분
0981.HK	0981.HK	Global Semicon / PCB / Memory / OSAT	78.3499984741211	40.66426822430502	4.327563336928586		-13.94838457107721	78.10125007629395	71.35799989700317	Y	Y	상승전환/양호	SMIC	HKG	HKD	Technology	Semiconductors	Semiconductors	Semiconductor Manufacturing International Corporation, an investment holding company, engages in the manufacture, testing, and sale of integrated circuits wafer and various compound semiconductors in the United States, China, and Eurasia. The company is also involved in the manufacturing, sale, and trading of semiconductor products; and research and development activities. In addition, it offers semiconductor foundry and technology services; supporting services comprising design and IP support, 	670739136512.0		0.71	39.04287790107723	-27.767740812712226		14935414000.0	9994773000.0	2593077000.0	12596181000.0	21439670000.0	0.8215148954383642	-0.8661647557150728	-1.105507048607239	109.19504729391933	-27.767740812712226		-0.25429487418023683	판정불가	불리(<1)	0.0	0.0	-100.0	보류	일부부족
2382.HK	2382.HK	Global Semicon / PCB / Memory / OSAT	55.04999923706055	-10.705599554685929	-18.984544945612914		-39.43894575030562	69.97375030517578	67.39925008773804	N	N	주의	SUNNY OPTICAL	HKG	HKD	Technology	Electronic Components	Electronic Components	Sunny Optical Technology (Group) Company Limited, an investment holding company, engages in designing, researching, developing, manufacturing, and selling optical and optical related products, and scientific instruments. It operates through Optical Components, Optoelectronic Products, and Optical Instruments segments. The Optical Components segment offers vehicle lens sets and optical parts for vehicle light detection and ranging, handset lens sets, glass spherical and aspherical lenses for digi	59133325312.0	2.16	4.9	71.87231282040072	24.433762661282877		38549973000.0	1405760000.0	4655009000.0	6244099000.0	29148588000.0	34.57930031499529	2.931125362464284	5.324478479721765	4.177693657564339	24.433762661282877	0.1709803649760504	6.365656470079106	매우 유망	안심(>=2)	57.367525322565754	281.1008740805722	410.62829786804167	매우 유망	충분
TTMI	TTMI	Global Semicon / PCB / Memory / OSAT	143.9600067138672	18.49535702131955	115.31559288017515		-34.997965448871035	180.06600074768068	107.38580001831055	N	Y	상승전환/양호	TTM Technologies, Inc.	NMS	USD	Technology	Electronic Components	Electronic Components	TTM Technologies, Inc. manufactures and sells mission systems, radio frequency (RF) components, RF microwave/microelectronic assemblies, and printed circuit boards (PCBs) and substrates in the United States, Taiwan, and internationally. It operates in three segments, A&D, Commercial, and RF&S Components. The company offers various engineered systems and RF and microwave assemblies; PCBs and IC substrates, custom assemblies and integrated systems, passive and advanced ceramic RF components, hi-re	14950254592.0		1.84	215.1885468658413	23.334906230221144		501234000.0	912336000.0	3815000.0	1028413000.0	1762253000.0	-3.958611135695166	-0.006576789715641856	-0.004568483890608444	80.39055317910997	23.334906230221144	3.4450771897679964	0.29026925810836285	매우 불리	불리(<1)	55.16981246044229	101.51245492721381	-29.4856556036577	보류	충분
005930.KS	005930.KS	Global Semicon / PCB / Memory / OSAT	285000.0	35.39192399049882	106.37219406227372		-21.379310344827584	315287.5	181429.5	N	Y	상승전환/양호	SamsungElec	KSC	KRW	Technology	Consumer Electronics	Consumer Electronics	Samsung Electronics Co., Ltd. engages in the consumer electronics, information technology and mobile communications, and device solutions businesses worldwide. The company operates through four divisions: Device eXperience (DX), Device Solutions (DS), SDC, and Harman. The company offers smartphones, tablets, audio sounds, watches, switches, and accessories; TVs, and sound devices; appliances, including refrigerators, washing machines and dryers, vacuum cleaners, cooking appliances, dishwashers, 	1671190431137792.0	52.0	7678.605560818366	31.645335140041773	-6.832366066754158		193837850000000.0	2813148000000.0	17584050000000.0	25239139000000.0	424313255000000.0	33139.892844403796	5753.104608252318	2.0186331958780066	32.80024024684419	-6.832366066754158		1.3770519238069163	판정불가	보통(1~1.5)	0.0	0.0	-100.0	보류	일부부족
000660.KS	000660.KS	Global Semicon / PCB / Memory / OSAT	2180000.0	111.03581800580832	213.2183908045977		-25.316889345666326	2279850.0	1076557.5	N	Y	상승전환/양호	SK hynix	KSC	KRW	Technology	Semiconductors	Semiconductors	SK hynix Inc. through its subsidiaries, engages in research, develops, manufactures, distributes, and sells semiconductor devices in Korea, China, rest of Asia, the United States, Europe, and internationally. It offers DRAM, such as server memory, graphics memory, mobile memory, PC memory, consumer memory; NAND flash memory; SSD; and MCP products. It also engages in foundry business, produces non-memory semiconductors. The company serves its products for server, networking, mobile, personal comp	1309682362744832.0	14.000000000000002	60462.05716711756	116.88806343383877	168.00595548778566		55351258000000.0	14086148000000.0	8161757000000.0	24757848000000.0	120516178000000.0	58131.75414184756	34927.9596638012	1.6021999845780368	35.09421189545856	168.00595548778566	0.2088867135308782	5.186210080168192	매우 유망	안심(>=2)	60.0	3627723.430027053	66.40933165261711	매우 유망	충분
042700.KS	042700.KS	Global Semicon / PCB / Memory / OSAT	222000.0	-20.85561497326203	32.695756126718464		-45.78754578754579	285155.0	215075.5	N	Y	상승전환/양호	HANMISemi	KSC	KRW	Technology	Semiconductor Equipment & Materials	Semiconductor Equipment & Materials	HANMI Semiconductor Co., Ltd. manufactures and sells semiconductor equipment in South Korea and internationally. The company offers bonder; micro SAW equipment; vision placement equipment; meta grinder; EMI shield vision attach and detach, EMI shield vision placement, EMI shield tape mounter, EMI shield tape laser cutting, EMI shield tape demounter, vision inspection, and converlay attach equipment; laser marking, laser ablation, and laser cutting equipment; and pick and place, strip mounter, an	19492291739648.0	36.0	2256.2021643764106	40.22753487679789	32.37512374110017		278201051520.0	0.0	1339920070.0	2554319940.0	690327519530.0	2932.9704453634477	1422.1134652122028	0.6405916509964877	97.09547885979636	32.37512374110017	2.9990766872817787	0.7042050211198019	매우 불리	불리(<1)	60.0	135372.12986258464	-39.02156312496188	보류	충분
