티커	종목코드	유니버스	현재가	3M수익률(보조,%)	6M수익률(보조,%)	12M수익률(보조,%)	52주고점대비(보조,%)	40일이평(보조)	200일이평(보조)	40일선상회(보조)	200일선상회(보조)	추세판정(보조)	종목명	시장	통화	섹터	산업	업종	사업설명	시가총액	배당수익률(%)	EPS(FY)	EPS Growth 1Y(%)	EPS Growth 3Y CAGR(%)	EPS Growth 5Y CAGR(%)	현금및단기투자	장기부채	단기위험부채	총부채	주주지분	주당순현금(린치식)	주당잉여현금흐름	잉여현금흐름수익률(%)	순현금차감PER(린치식)	사용연성장률(%)	린치PER배수	배당감안점수	린치PER판정	배당감안점수판정	그레이엄적정PER(3년)	그레이엄내재가치(3년)	그레이엄괴리율(3년,%)	종합판정	데이터상태
GFS	GFS	Global Semicon / PCB / Memory / OSAT	66.62000274658203	36.15369370748811	71.21563353337537		-25.944860577393193	78.01574954986572	50.14182497024536	N	Y	상승전환/양호	GlobalFoundries Inc.	NMS	USD	Technology	Semiconductors	Semiconductors	GLOBALFOUNDRIES Inc., a semiconductor foundry, provides range of mainstream wafer fabrication services and technologies in the United States, Europe, the Middle East, Africa, and internationally. It offers semiconductor devices, including microprocessors, mobile application processors, baseband processors, network processors, radio frequency modems, microcontrollers, and power management units. The company also provides quantum technology solutions. GLOBALFOUNDRIES Inc. has a strategic partnersh	36554452992.0	70.0	1.39	-51.0	-15.135725474232498		4397000000.0	1065000000.0	86000000.0	1707000000.0	11928000000.0	6.0725258640166855	1.8388891346917273	2.7602657743601973	43.559335886737664	-15.135725474232498		1.2595296371924671	판정불가	보통(1~1.5)	0.0	0.0	-100.0	보류	일부부족
UMC	UMC	Global Semicon / PCB / Memory / OSAT	23.625	142.55647387235842	176.31578330958445		-15.65512385951482	22.41862497329712	11.876575002670288	Y	Y	상승전환/양호	United Microelectronics Corpora	NYQ	USD	Technology	Semiconductors	Semiconductors	United Microelectronics Corporation operates as a semiconductor wafer foundry in Taiwan, China, Hong Kong, Japan, Korea, the United States, Europe, and internationally. It manufactures and sells integrated circuits. The company offers circuit design; mask tooling; wafer fabrication; and assembly and testing services for communication devices, consumer electronics, computer, and other applications. It also provides venture capital and marketing support; consulting and planning; energy technical; 	59281895424.0	1.69	0.62	-17.259341564967112	-23.3089317909408		146070330000.0	45372054000.0	8408772000.0	59781672000.0	365824997000.0	40.130238218838194	19.579483903181806	82.8761223415103	-26.621351965868055	-23.3089317909408			판정불가	판정불가	0.0	0.0	-100.0	판정불가	일부부족
2330.TW	2330.TW	Global Semicon / PCB / Memory / OSAT	2440.0	22.613065326633162	60.52631578947369		-2.7888446215139417	2362.25	1822.375	Y	Y	상승전환/양호	TAIWAN SEMICONDUCTOR MANUFACTUR	TAI	TWD	Technology	Semiconductors	Semiconductors	Taiwan Semiconductor Manufacturing Company Limited, together with its subsidiaries, manufactures, packages, tests, and sells integrated circuits and other semiconductor devices in Taiwan, China, Europe, the Middle East, Africa, Japan, the United States, and internationally. It provides various wafer fabrication processes, such as processes to manufacture complementary metal- oxide-semiconductor (CMOS) logic, mixed-signal, radio frequency, embedded memory, bipolar CMOS mixed-signal, and others. T	63274980737024.0	99.0	73.66	46.54981153856048	19.574951863097922		3488279800000.0	896062000000.0	136925700000.0	1064582700000.0	5355038700000.0	99.96069751058748	38.26794070252923	1.5683582255134931	31.768114342783228	19.574951863097922	1.6228961667421247	3.732514639794308	보통	안심(>=2)	47.649903726195845	3509.891908471586	43.848029035720735	보류	충분
2454.TW	2454.TW	Global Semicon / PCB / Memory / OSAT	3825.0	136.11111111111111	169.3661971830986		-17.56465517241379	4164.875	2163.475	N	Y	상승전환/양호	MEDIATEK INC	TAI	TWD	Technology	Semiconductors	Semiconductors	MediaTek Inc. engages in the research, development, production, manufacture, and marketing of multimedia integrated circuits (ICs) in Taiwan, rest of Asia, and internationally. The company offers multimedia, computer peripherals oriented, consumer-oriented, and other ICs for various applications. It also offers design, test runs, maintenance and repair, and technological consultation services for software and hardware solutions; and sale and delegation patents and circuit layout rights for its I	6105121423360.0	1.36	65.94	-1.0032496768530352	-3.7570524355304835		260128122000.0	60000000.0	4480763000.0	13730009000.0	400600988000.0	162.93870008806817	86.0675425604462	2.2501318316456524	55.53626478483366	-3.7570524355304835		-0.043161931124058805	판정불가	불리(<1)	0.985895128939033	65.00992480223984	-98.30039412281725	보류	일부부족
2303.TW	2303.TW	Global Semicon / PCB / Memory / OSAT	153.5	155.40766039469486	210.10101010101013		-14.005602240896353	143.725	74.26925003051758	Y	Y	상승전환/양호	UNITED MICRO ELECTRONICS	TAI	TWD	Technology	Semiconductors	Semiconductors	United Microelectronics Corporation operates as a semiconductor wafer foundry in Taiwan, China, Hong Kong, Japan, Korea, the United States, Europe, and internationally. It manufactures and sells integrated circuits. The company offers circuit design; mask tooling; wafer fabrication; and assembly and testing services for communication devices, consumer electronics, computer, and other applications. It also provides venture capital and marketing support; consulting and planning; energy technical; 	1925877596160.0	1.67	3.95	-17.259341564967112	-23.3089317909408		146070330000.0	45372054000.0	8408772000.0	59781672000.0	365824997000.0	8.026047643767638	3.915896780636361	2.5510728212614726	36.828848697780344	-23.3089317909408		-0.5875538485742827	판정불가	불리(<1)	0.0	0.0	-100.0	보류	일부부족
3711.TW	3711.TW	Global Semicon / PCB / Memory / OSAT	670.0	60.47904191616767	169.07630522088354		-7.840440165061901	611.2	359.685	Y	Y	상승전환/양호	ASE TECHNOLOGY HOLDING CO LTD	TAI	TWD	Technology	Semiconductors	Semiconductors	ASE Technology Holding Co., Ltd., together with its subsidiaries, provides semiconductor manufacturing services in the United States, Taiwan, rest of Asia, Europe, and internationally. It operates through Packaging, Testing, and EMS. The company offers semiconductor packaging, interconnect materials production, front-end engineering testing, wafer probing, and final testing services, as well as integrated solutions for EMS (electronic manufacturing services) in relation to computing, peripherals	2939887550464.0	97.0	10.22	23.585762669903666	-13.347387041498415		111497789000.0	214080678000.0	40733681000.0	263662466000.0	342181952000.0	-23.378628938260114	-5.3782267829267285	-0.8027204153621983	67.84526701939923	-13.347387041498415		1.23299113753333	판정불가	보통(1~1.5)	0.0	0.0	-100.0	보류	일부부족
3037.TW	3037.TW	Global Semicon / PCB / Memory / OSAT	903.0	44.249201277955265	311.38952164009106		-16.774193548387096	953.125	475.6123966217041	N	Y	상승전환/양호	UNIMICRON TECHNOLOGY	TAI	TWD	Technology	Electronic Components	Electronic Components	Unimicron Technology Corp., together with its subsidiaries, engages in the manufacturing, processing, and sale of printed circuit boards, electrical equipment, electronic products, and integrated circuit product testing and burn-in systems in Taiwan, China, Asia, the Americas, and internationally. The company offers PCB products, including HDI, ELIC, multi-layer and rigid flex PCBs, and FPC; IC carriers, such as FCCSP, FCBGA, CSP, memory module, and coreless; connectors comprising PCBeam and X-B	1421453688832.0	23.0	4.38	31.307777963397943	-39.15067182208464		55226513000.0	34873158000.0	22207016000.0	57080174000.0	100569302000.0	12.929777846074714	-7.044326051426996	-0.7801025527604646	203.21237948719758	-39.15067182208464		-0.07947681072797111	판정불가	불리(<1)	0.0	0.0	-100.0	보류	일부부족
8046.TW	8046.TW	Global Semicon / PCB / Memory / OSAT	1270.0	93.89312977099236	428.066528066528		0.0	958.6	522.6075	Y	Y	상승전환/양호	NAN YA PRINTED CIRCUIT BOARD CO	TAI	TWD	Technology	Electronic Components	Electronic Components	Nan Ya Printed Circuit Board Corporation manufactures and sells printed circuit boards (PCBs) in Taiwan, the United States, Mainland China, Korea, and internationally. It offers conventional PCBs that are used in the motherboards of desktops and notebooks, and home electrical appliances; high density connector boards that are used in smartphones, game consoles, GPS, PDAs, automobile appliances, and MP3 players; and soft and hard composite boards used in high-end handheld devices and notebook. Th	820630192128.0	16.0	3.04	855.5802618209663	-53.54257860278134		8823188000.0	0.0	0.0	1234627000.0	46122894000.0	13.654687812195082	0.9357680225344502	0.07368252145940553	413.27148427230424	-53.54257860278134		-0.0908424123887642	판정불가	불리(<1)	0.0	0.0	-100.0	보류	일부부족
4958.TW	4958.TW	Global Semicon / PCB / Memory / OSAT	646.0	150.873786407767	358.1560283687943		0.0	551.05	268.31	Y	Y	상승전환/양호	ZHEN DING TECHNOLOGY HOLDING LT	TAI	TWD	Technology	Electronic Components	Electronic Components	Zhen Ding Technology Holding Limited, together with its subsidiaries, engages in the design, development, manufacture, and sale of printed circuit boards (PCB) products in the United States, Mainland China, Taiwan, Singapore, and internationally. The company offers flexible circuit boards, substrate-like PCBs, high-density interconnect PCBs, rigid printed circuit boards, IC substrates, rigid-flex PCBs, and modules. Its products are used in various applications, including mobile phones, computers	697305858048.0	57.99999999999999	6.76	-26.026818555617737	-21.794946088339774		71187918000.0	26429839000.0	25689071000.0	53010937000.0	123981554000.0	41.46490110198955	-5.477117634530046	-0.847851027017035	89.42826906775304	-21.794946088339774		0.40485021446887653	판정불가	불리(<1)	0.0	0.0	-100.0	보류	일부부족
3044.TW	3044.TW	Global Semicon / PCB / Memory / OSAT	439.0	17.53681392235609	36.973478939157566		-23.38568935427574	502.775	381.91	N	Y	상승전환/양호	TRIPOD TECHNOLOGY CORP	TAI	TWD	Technology	Electronic Components	Electronic Components	Tripod Technology Corporation processes, manufactures, and sells printed circuit boards and other related components in Taiwan, China, Vietnam, Thailand, South Korea, Malaysia, Mexico, and internationally. The company offers printed circuit boards comprising any layer, double-sided, HDI, heavy copper, multi-layer, high layer count, flexible, rigid-flex, semi-flex, cavity, thermal, embedded ferrite, and hybrid lamination structure. It also engages in the manufacture and wholesale of electronic pa	230741032960.0	2.83	19.38	21.976442546571807	18.143871338410513		31846737000.0	1000000000.0	6478679000.0	7596649000.0	54083843000.0	58.68794686514233	11.10088164899183	2.528674635305656	19.623944950199053	18.143871338410513	1.0815743004446483	1.0687897561696822	보통	보통(1~1.5)	44.787742676821026	867.9864530767915	97.71900981248096	보류	충분
2327.TW	2327.TW	Global Semicon / PCB / Memory / OSAT	816.0	168.86326194398686	261.86252771618626		-28.421052631578945	859.475	374.53	N	Y	상승전환/양호	YAGEO CORP	TAI	TWD	Technology	Electronic Components	Electronic Components	Yageo Corporation, together with its subsidiaries, manufactures and sells electronic components in China, Europe, the United States, and the rest of Asia. It offers antennas, radio frequency, and microwave; capacitors; circuit protection; custom products; electromechanical devices; EMC; engineering kits; inductors; piezoelectric devices; power supplies; resistors; semiconductors; sensors; signal magnetics and connectors; and transformers. The company's products are used for various applications,	1679924133888.0	67.0	12.69	22.099803869339073	1.3081472653207582		114742022000.0	62087637000.0	86197379000.0	150894630000.0	170877823000.0	25.57614287504765	11.927875062251228	1.461749394883729	62.287143981477726	1.3081472653207582	47.61477979790364	1.0966652650767466	매우 불리	보통(1~1.5)	11.116294530641516	141.06577759384083	-82.71252725565677	보류	충분
2408.TW	2408.TW	Global Semicon / PCB / Memory / OSAT	423.0	87.58314855875831	117.48071979434447		-16.23762376237624	386.25	232.13449996948242	Y	Y	상승전환/양호	NANYA TECHNOLOGY CORPORATION	TAI	TWD	Technology	Semiconductors	Semiconductors	Nanya Technology Corporation research, develops, manufactures, and sells semiconductor products in Taiwan, Japan, Malaysia, China, the United States, Thailand, Germany, Singapore, Poland and internationally. It offers standard dynamic random-access memory (DRAM), low power DRAM, MCP and eMCP, and KGD products, as well as modules; and other memory products and Elixir brands. The company engages in the import and export of its machinery, equipment, and raw materials. Its products have applications	1310719606784.0	31.0	10.8		-23.232591966740635		58074065000.0	14196100000.0	5059500000.0	23617455000.0	170399852000.0	14.160449855886213	1.5764312972202954	0.37267879366910056	37.85551390223276	-23.232591966740635		0.20518564490551625	판정불가	불리(<1)	0.0	0.0	-100.0	보류	일부부족
2344.TW	2344.TW	Global Semicon / PCB / Memory / OSAT	167.0	76.90677680150087	99.52211002261836		-24.774774774774777	171.7625	99.18025003433227	N	Y	상승전환/양호	WINBOND ELECTRONIC CORP	TAI	TWD	Technology	Semiconductors	Semiconductors	Winbond Electronics Corporation engages in the research, development, production and sales of integrated circuits, various semiconductor components and other system products. The company offers customized memory solutions, including CUBE(3DCaaS), pseudo static random access memory, DDR/SDR, LPDDR/LPSDR, Known Good Die wafer products; electrical simulation, wafer-level speed testing, and other services; redistribution layers; and failure analysis services, as well as low power SDR, DDR, DDR2, DDR	751500066816.0	28.000000000000004	0.88	559.2216984663919	-32.578077486406286		42427238000.0	26398931000.0	25731058000.0	54236531000.0	107935967000.0	3.5618458472363894	0.9584377366714482	0.5739148123781126	185.725175173595	-32.578077486406286		-0.024649741114133886	판정불가	불리(<1)	0.0	0.0	-100.0	보류	일부부족
2337.TW	2337.TW	Global Semicon / PCB / Memory / OSAT	138.0	-6.440677966101694	256.1290322580645		-25.60646900269542	153.8625	91.15000014305114	N	Y	상승전환/양호	MACRONIX INTERNATIONAL	TAI	TWD	Technology	Semiconductors	Semiconductors	Macronix International Co., Ltd. engages in the design, manufacture, and supply of integrated circuits and memory chips. The company provides a range of NOR flash, NAND flash, e MMC, and read-only memory products. It also offers wafer foundry services to IC design and IDM companies; ArmorFlash, a security solution for a range of identification, authentication, and encryption requirements; and LybraFlash, a solution for gigabit flash memory. In addition, the company develops integrated circuit sy	266219388928.0	3.8407239130434783	-1.77				14927643000.0	17385877000.0	6844010000.0	24966908000.0	45802485000.0	-1.2742734274484921	1.5426975739272604	1.1178967927009131					판정불가	판정불가				판정불가	일부부족
6239.TW	6239.TW	Global Semicon / PCB / Memory / OSAT	312.5	43.02059496567505	78.57142857142858		-17.546174142480208	325.1875	219.74	N	Y	상승전환/양호	POWERTECH TECHNOLOGY INC	TAI	TWD	Technology	Semiconductors	Semiconductors	Powertech Technology Inc., together with its subsidiaries, researches, designs, develops, assembles, manufactures, packages, tests, and sells various integrated circuit (IC) products in Taiwan, Japan, Singapore, the United States, Europe, China, Hong Kong, Macao, and internationally. It provides chip probing and final test; IC packaging services, such as wafer level packing, flip chips, wire bond BGA, lead frame, and system in package; module assembly services; and quality management services. T	230874054656.0	1.41	8.38	-18.452077134528476	-13.944410754124926		16375176000.0	25413199000.0	4703164000.0	31892991000.0	56290777000.0	-12.233432187732218	-12.614909102229706	-4.036770912713506	38.751006227653	-13.944410754124926		-0.32346026527642213	판정불가	불리(<1)	0.0	0.0	-100.0	보류	일부부족
2449.TW	2449.TW	Global Semicon / PCB / Memory / OSAT	307.0	4.067796610169494	26.078028747433258		-13.276836158192095	309.9125	260.1825	N	Y	상승전환/양호	KING YUAN ELECTRONICS CO	TAI	TWD	Technology	Semiconductors	Semiconductors	King Yuan Electronics Co., Ltd. designs, manufactures, sells, tests, and assembles integrated circuits. It offers test services, such as wafer probing; final test; burn-in; system level testing; and back end service. It also provides Technology Innovation, including wafer level chip scale package (WLCSP); high power burn in; and KYEC Bio Chip Testing, as well as equipment development, spare parts and test program, automation control, and vertical card. It also provides engineering services for M	375382704128.0	1.3	6.51	41.59903530182425	17.234581996226606		17963508000.0	30274865000.0	6357000.0	33144334000.0	50429320000.0	-10.06862183038982	-15.711436153899628	-5.117731646221378	48.70485742402302	17.234581996226606	2.8259958631248856	0.3805489426827615	매우 불리	불리(<1)	42.96916399245321	279.7292575908704	-8.882977983429829	보류	충분
8150.TW	8150.TW	Global Semicon / PCB / Memory / OSAT	115.0	82.82988427700693	138.3419689119171		-1.7094017094017144	98.26500034332275	61.26750012397766	Y	Y	상승전환/양호	CHIPMOS TECHNOLOGIES INC	TAI	TWD	Technology	Semiconductors	Semiconductors	ChipMOS TECHNOLOGIES INC. engages in the research and development, manufacture, and sale of integrated circuits, and related assembly and testing services in Taiwan, Japan, the People's Republic of China, and internationally. It operates through five segments: Testing; Assembly; Display Panel Driver Semiconductor Assembly and Testing; Bumping; and Others. The company offers leadframe-based packages, such as the small outline package, thin small outline package, and quad flat package; and substra	79973081088.0	1.05	1.25	-61.74913305398406	-45.70232815746953		15097129000.0	9867797000.0	5604561000.0	16327274000.0	23987112000.0	7.519694705225443	0.20879812384988078	0.18156358595641806	85.98424423581965	-45.70232815746953		-0.5193082587899063	판정불가	불리(<1)	0.0	0.0	-100.0	보류	일부부족
2368.TW	2368.TW	Global Semicon / PCB / Memory / OSAT	1045.0	-0.9478672985781977	51.01156069364161		-30.100334448160538	1285.0	851.6025	N	Y	상승전환/양호	GOLD CIRCUIT ELECTRONICS CO	TAI	TWD	Technology	Electronic Components	Electronic Components	Gold Circuit Electronics Ltd. engages in the manufacturing, processing, and trading of electronic equipment products, such as printed circuit boards in Taiwan. Its products are used for AI/ Advanced Server, networking, notebook, handset products, automotive, and IC tests products. The company was founded in 1981 and is headquartered in Taoyuan City, Taiwan.	528119988224.0	91.0	19.03	71.06843481034197	28.12015612291836		18920059000.0	11874888000.0	6115928000.0	18073139000.0	33481159000.0	13.940399067628586	-8.980840084055895	-0.8594105343594158	54.18074623922078	28.12015612291836	1.9267583722646062	2.1985698682881694	보통	안심(>=2)	60.0	1141.8000000000002	9.263157894736862	보류	충분
3189.TW	3189.TW	Global Semicon / PCB / Memory / OSAT	819.0	123.46521145975444	453.37837837837844		-8.080808080808078	714.8	333.23762519836424	Y	Y	상승전환/양호	KINSUS INTERCONNECT TECHNOLOGY 	TAI	TWD	Technology	Semiconductor Equipment & Materials	Semiconductor Equipment & Materials	Kinsus Interconnect Technology Corp., together with its subsidiaries, engages in the manufacture and sale of electronic products in Taiwan and internationally. It operates through the IC Substrate and Optics segments. The company offers system in package substrate, a carrier substrate that provides a platform for multiple chips or packages or passive components assembly for multi-chip module, multi-chip package, stack die, package in package, and embedded substrates, as well as modules in handse	431544008704.0	19.0	3.34	3164.40712634744	-38.842006005271955		20390405000.0	11197127000.0	3124539000.0	14437615000.0	32731765000.0	17.447339210351196	3.2466631857813475	0.3964179714018739	239.9858265837272	-38.842006005271955		-0.08267990775842504	판정불가	불리(<1)	0.0	0.0	-100.0	보류	일부부족
2313.TW	2313.TW	Global Semicon / PCB / Memory / OSAT	235.0	-15.77060931899642	139.79591836734696		-21.27303182579564	252.36421699523925	170.47734340667725	N	Y	상승전환/양호	COMPEQ MANUFACTURING	TAI	TWD	Technology	Electronic Components	Electronic Components	Compeq Manufacturing Co., Ltd., together with its subsidiaries, manufactures and sells printed circuit boards for computers in Taiwan, the United States, rest of Asia, Europe, and internationally. The company offers high layer, rigid-flex, flexible, regular multi-layered, and high-density interconnection printed circuit boards. It also provides surface mount technology devices; and module assembly services. In addition, the company is involved in investment; trading; electronic manufacturing; ou	281700007936.0	1.25	5.46	17.284433058479443	-6.372141905534656		27233389000.0	7796664000.0	5205724000.0	13117147000.0	47862670000.0	16.214519041475803	3.840072380194492	1.634073353274252	40.07060090815462	-6.372141905534656		-0.12782792844247734	판정불가	불리(<1)	0.0	0.0	-100.0	보류	일부부족
2316.TW	2316.TW	Global Semicon / PCB / Memory / OSAT	185.5	64.15929203539822	80.97560975609757		-20.895522388059707	183.9625	119.20100006103516	Y	Y	상승전환/양호	WUS PRINTED CIRCUIT CO	TAI	TWD	Technology	Electronic Components	Electronic Components	WUS Printed Circuit Co., Ltd., together with its subsidiaries, manufactures, processes, assembles, and sells double side and multi-layer printed circuit boards in Taiwan, Asia, North America, Europe, and internationally. It operates through Manufacturing and Trading of Printed Circuit Boards; Assembly and Trading of PCB/Light Products; Investment; and Others segments. It is involved in imported commodity trading business; and assembly and sale of peripheral equipment, such as electronic products	33656193024.0	96.0	13.37	212.2520816393746	68.1394170953056		8070413000.0	1632969000.0	1087016000.0	2781002000.0	12575793000.0	35.48071761236807	-1.6873095047813267	-0.9096008112028715	11.220589557788477	68.1394170953056	0.16467105291045275	14.628412905574336	매우 유망	안심(>=2)	60.0	802.1999999999999	332.4528301886792	보류	충분
6981.T	6981.T	Global Semicon / PCB / Memory / OSAT	9860.0	146.5	196.09609609609612		-19.510204081632654	9632.725	4756.7475	Y	Y	상승전환/양호	MURATA MANUFACTURING CO	JPX	JPY	Technology	Electronic Components	Electronic Components	Murata Manufacturing Co., Ltd. develops, manufactures, and sells ceramic-based passive electronic components and solutions in Japan, North America, and South America, Europe, China, Asia, and internationally. It operates through three segments: Components, Devices & Modules, and Other. The company offers capacitors; inductors; high frequency device and communication modules, including surface acoustic wave filters, RF modules, multilayer resin substrates, and connectivity modules; lithium-ion se	16502742843392.0	71.0	127.19	0.04362367311327997	-1.3891842891780914		702071000000.0	1516000000.0	1745000000.0	55768000000.0	2718743000000.0	384.85915863313676	95.04093777340812	0.9639040342130641	74.4959575545787	-1.3891842891780914		0.9344240680418433	판정불가	불리(<1)	5.721631421643817	727.734300518877	-92.61932758094446	보류	일부부족
6762.T	6762.T	Global Semicon / PCB / Memory / OSAT	3389.0	54.045454545454554	50.62222222222221		-17.56263682802238	3656.15	2576.7375	N	Y	상승전환/양호	TDK CORP	JPX	JPY	Technology	Electronic Components	Electronic Components	TDK Corporation, together with its subsidiaries, engages in the manufacture and sale of electronic components in Japan, Europe, China, Asia, the Americas, and internationally. The company operates through Passive Components, Sensor Application Products, Magnetic Application Products, Energy Application Products, and Others segments. The Passive Components segment offers ceramic capacitors, aluminum electrolytic capacitors, film capacitors, high-frequency components, piezoelectric material produc	6079787827200.0	1.18	103.03	17.050627837832977	19.664137529214678		1161949000000.0	332678000000.0	210953000000.0	615970000000.0	2187234000000.0	436.88285849812115	110.14964340685454	3.250210782143834	28.652985941006296	19.664137529214678	1.4571188743181356	0.7274682496313203	보통	불리(<1)	47.828275058429355	4927.747179269976	45.40416580908753	보류	충분
