티커	종목코드	유니버스	현재가	3M수익률(보조,%)	6M수익률(보조,%)	12M수익률(보조,%)	52주고점대비(보조,%)	40일이평(보조)	200일이평(보조)	40일선상회(보조)	200일선상회(보조)	추세판정(보조)	종목명	시장	통화	섹터	산업	업종	사업설명	시가총액	배당수익률(%)	EPS(FY)	EPS Growth 1Y(%)	EPS Growth 3Y CAGR(%)	EPS Growth 5Y CAGR(%)	현금및단기투자	장기부채	단기위험부채	총부채	주주지분	주당순현금(린치식)	주당잉여현금흐름	잉여현금흐름수익률(%)	순현금차감PER(린치식)	사용연성장률(%)	린치PER배수	배당감안점수	린치PER판정	배당감안점수판정	그레이엄적정PER(3년)	그레이엄내재가치(3년)	그레이엄괴리율(3년,%)	종합판정	데이터상태
6861.T	6861.T	Global Semicon / PCB / Memory / OSAT	70880.0	12.956175298804773	21.390649083747213		-15.789473684210531	76983.25	63445.0	N	Y	상승전환/양호	KEYENCE CORP	JPX	JPY	Technology	Scientific & Technical Instruments	Scientific & Technical Instruments	Keyence Corporation, together with its subsidiaries, manufactures and sells electronic application equipment in Japan and internationally. The company offers photoelectric, fiber optic, laser, inductive proximity, positioning, vision, and specific solution sensors, as well as network communication units; laser profiler/3D laser snapshot sensor, laser displacement sensors, optical micrometer/laser micrometer, spectral interference displacement sensor, inductive displacement sensors, and LVDT/cont	17190181928960.0	78.0	1835.79	11.671466126183972	7.043275268619209		2390802000000.0	0.0	0.0	0.0	3471471000000.0	9857.955506929393	1658.8342414124036	2.3403417627150165	33.2402096607295	7.043275268619209	4.7194250392042445	2.558445814169778	매우 불리	안심(>=2)	22.586550537238416	41464.163610756914	-41.50089784035424	보류	충분
8035.T	8035.T	Global Semicon / PCB / Memory / OSAT	65100.0	49.65517241379311	58.66439190835975		-17.385786802030456	66975.0	43690.025	N	Y	상승전환/양호	TOKYO ELECTRON	JPX	JPY	Technology	Semiconductor Equipment & Materials	Semiconductor Equipment & Materials	Tokyo Electron Limited, together with its subsidiaries, develops, manufactures, and sells semiconductor production equipment in Japan, South Korea, Taiwan, China, North America, Europe, and internationally. The company provides coaters/developers, plasma etch systems, cleaning systems, deposition systems, test systems, 3D integration systems, SiC Epitaxial CVD systems, and gas cluster beam systems, as well as other deposition and lithography and other products. It also offers engineering service	29597794041856.0	1.11	1249.92	5.572350877450916	6.798560410225418		561248000000.0	0.0	0.0	0.0	2069994000000.0	1234.4584264549037	704.4763168290444	1.0821448799217273	51.09570338385264	6.798560410225418	7.515665126252584	0.15477936277367496	매우 불리	불리(<1)	22.097120820450836	27619.633255897912	-57.57352802473439	보류	충분
6857.T	6857.T	Global Semicon / PCB / Memory / OSAT	27505.0	-0.29001268805510794	25.10802820104616		-23.38440111420613	28976.5	23790.325	N	Y	상승전환/양호	ADVANTEST CORP	JPX	JPY	Technology	Semiconductor Equipment & Materials	Semiconductor Equipment & Materials	Advantest Corporation, together with its subsidiaries, manufactures and sells semiconductors, component test systems, and mechatronics-related products in Japan, rest of Asia, the Americas, and Europe. The company offers automated test equipment, including system on chip, power device, and memory test systems, as well as burn-in and SSD test systems; and metrology and SEM tools. It also provides component test systems, such as die level, SoC, and memory test handlers, as well as change kits, and	19912697315328.0	22.0	514.34	132.8824832327193	42.25059773479647		339966000000.0	0.0	0.0	20192000000.0	795726000000.0	469.58803300412427	413.21249551205057	1.5023177440903492	52.56330825328746	42.25059773479647	1.2440843697223651	1.2223469159359477	보통	보통(1~1.5)	60.0	30860.4	12.199236502454113	보류	충분
6146.T	6146.T	Global Semicon / PCB / Memory / OSAT	64780.0	-8.217625389628791	12.798189099773637		-26.785714285714292	74614.75	62858.85	N	Y	상승전환/양호	DISCO CORPORATION	JPX	JPY	Technology	Semiconductor Equipment & Materials	Semiconductor Equipment & Materials	Disco Corporation manufactures and sells precision cutting, grinding, and polishing machines in Japan and internationally. The company offers precision machines include dicing saws, laser saws, grinders, polishers, wafer mounters, die separators, inspection systems, surface planers, and waterjet saws. It also provides precision processing tools, such as dicing blades, grinding wheels, and dry polishing wheels; and other products, such as accessory equipment, cut-off wheels, and related products.	7026539233280.0	78.0	1243.78	9.387283983501638	17.80572767187141		284575000000.0	0.0	0.0	0.0	587758000000.0	2623.5914876982993	906.4078738629394	1.3992094378865998	49.97379642083142	17.80572767187141	2.806613542662314	1.9171192611641388	매우 불리	양호(>=1.5)	44.11145534374282	54864.94592744044	-15.305733363012585	보류	충분
7735.T	7735.T	Global Semicon / PCB / Memory / OSAT	16510.0	51.05215004574566	102.5766871165644		-15.289892252437143	15288.625	9987.235	Y	Y	상승전환/양호	SCREEN HOLDINGS CO LTD	JPX	JPY	Technology	Semiconductor Equipment & Materials	Semiconductor Equipment & Materials	SCREEN Holdings Co., Ltd. develops, manufactures, and markets semiconductor production equipment in Japan, Taiwan, South Korea, China, the United States, Europe, and internationally. It operates through Semiconductor Production Equipment, Graphic Arts Equipment, Display Production Equipment and Coater, and Printed Circuit Board (PCB)-Related Equipment segments. The company offers wafer cleaning systems, such as wet stations, spin processors, and spin scrubbers; coat/develop trackers, and spray c	3121839865856.0	1.06	487.04	-7.503996300280491	16.968083827819402		307370000000.0	79000000.0	3167000000.0	6091000000.0	486568000000.0	1625.1230975573626	327.0596526492477	1.9809791196199134	30.56191873858951	16.968083827819402	1.8011414281489364	0.5898871723998121	보통	불리(<1)	42.436167655638805	20668.111095002325	25.1854094185483	보류	충분
6723.T	6723.T	Global Semicon / PCB / Memory / OSAT	3822.0	43.065693430656935	57.93388429752066		-25.395276205348427	4574.225	2844.0525	N	Y	상승전환/양호	RENESAS ELECTRONICS CORP	JPX	JPY	Technology	Semiconductors	Semiconductors	Renesas Electronics Corporation engages in the design, research, development, manufacturing, sale, and service of semiconductors in Japan, China, rest of Asia, Europe, North America, and internationally. The company operates through Automotive Business and Industrial/Infrastructure/IoT Business segments. It offers microcontrollers and microprocessors; amplifiers, audio and video, data converters, power line communication, and switches and multiplexer products; custom ASICS and processor IP solut	6934234660864.0	73.0	-28.67	162.1			373099000000.0	964089000000.0	242478000000.0	1206567000000.0	2443034000000.0	-325.7409006245188	175.87385024717142	4.601618269156761		162.1			판정불가	판정불가				판정불가	일부부족
6758.T	6758.T	Global Semicon / PCB / Memory / OSAT	3470.0	3.8922155688622784	-9.51760104302477		-26.170212765957444	3386.775	3733.9474682617188	Y	N	상승전환/양호	SONY GROUP CORPORATION	JPX	JPY	Technology	Consumer Electronics	Consumer Electronics	Sony Group Corporation develops, designs, produces, manufactures, supplies, and sells electronic equipment, instruments, and devices for consumer, professional, and industrial use in Japan, the United States, Europe, China, the Asia-Pacific, and internationally. The company operates through Game & Network Services, Music, Pictures, Entertainment Technology & Services, and Imaging & Sensing Solutions. It develops, designs, produces, manufactures, provides, and sells smartphones and image sensors;	20377442975744.0	1.01	171.42	-58.099999999999994			2265213000000.0	824393000000.0	217593000000.0	1669669000000.0	8119011000000.0	245.351946564382	253.37515717662183	7.301877728432905	18.811387547751828	-58.099999999999994		-3.034863848032459	판정불가	불리(<1)	8.5	1457.07	-58.00951008645534	보류	일부부족
3407.T	3407.T	Global Semicon / PCB / Memory / OSAT	1829.5	18.760142810775715	25.179609989736562		-3.761178327196213	1798.5125	1530.125	Y	Y	상승전환/양호	ASAHI KASEI CORP	JPX	JPY	Industrials	Conglomerates	Conglomerates	Asahi Kasei Corporation engages in material, homes, and healthcare businesses in Japan, the United States, China, and internationally. The company offers Pimel, a photosensitive PI material applied for semiconductor applications, such as buffer coating, passivation layers, and dielectric layers; Sunfort, a dry film photoresist; Novacure, a latent curing agent for epoxy resin; glass fabric for printed circuit boards; plastic optical fiber; sensors and devices; artificial suede products under the 	2462941446144.0	2.41	116.91	17.6277991362771			377023000000.0	837618000000.0	129926000000.0	1011221000000.0	2088459000000.0	-342.1350539467711	68.37872807133397	3.7375637098296783	18.575272037864778	17.6277991362771	1.0537487915685304	1.0787351644396397	보통	보통(1~1.5)	8.5	993.735	-45.6827001913091	보류	충분
5201.T	5201.T	Global Semicon / PCB / Memory / OSAT	6135.0	9.202563189747238	14.780168381665115		-25.374042087337312	7031.125	5819.035	N	Y	상승전환/양호	AGC INC	JPX	JPY	Industrials	Conglomerates	Conglomerates	AGC Inc. manufactures and sells architectural glass, electronics, chemicals, automotive, and ceramics worldwide. The company offers architectural glass products, including insulated, laminated, wired, toughened, solar control, sound insulation, decorative, float and patterned, and industrial glass, as well as structural glazing systems and industrial glass; automotive glass for displays, sensors and connected drive, windows, and trains; and glass substrates used for thin-film-transistor liquid c	1303035904000.0	3.42	325.77	243.8			94671000000.0	429514000000.0	216949000000.0	646463000000.0	1485126000000.0	-1576.5197055452556	305.7104404176256	4.9830552635309795	23.671669292891476	243.8	0.09709462384286906	10.443707916882708	매우 유망	안심(>=2)	8.5	2769.045	-54.864792176039124	양호	충분
3110.T	3110.T	Global Semicon / PCB / Memory / OSAT	3035.0	-42.73584905660377	20.43650793650793		-52.503912363067286	3972.15	3439.82	N	N	중립	NITTO BOSEKI CO	JPX	JPY	Consumer Cyclical	Textile Manufacturing	Textile Manufacturing	Nitto Boseki Co., Ltd. manufactures, processes, and sells glass fiber products, chemical and pharmaceutical products, and textile products in Japan. It operates through six segments: Electronic Materials Business, Medical Business, Composite Materials Business, Materials Solution Business, Insulation Materials Business, and Other Businesses. The company engages in the development, manufacture, and sale of glass fiber products for electronic materials; in vitro diagnostic reagents; glass fiber pr	552447705088.0	92.0	229.45	75.94572368421053	25.34129768244895		28546000000.0	33743000000.0	17826000000.0	52746000000.0	129733000000.0	-28.550929100082627	105.04566390661533	3.4611421386034706	13.351714661582404	25.34129768244895	0.526875727868886	8.788481528899153	헐값	안심(>=2)	59.1825953648979	13579.446506475822	347.42822097119677	양호	충분
600183.SS	600183.SS	Global Semicon / PCB / Memory / OSAT	123.33999633789062	82.56364830522638	72.64836523354235		-34.11324874540881	152.58099880218506	83.03264980316162	N	Y	상승전환/양호	SHENGYI TECHNOLOGY CO LTD	SHH	CNY	Technology	Electronic Components	Electronic Components	Shengyi Technology Co.,Ltd. engages in the design, production, and sales of copper clad laminates, bonding sheets, and printed circuit boards in China and internationally. The company offers flame-retardant epoxy glass fabric reinforced laminates, composite epoxy materials, and flexible circuit materials, as well as prereg for multilayer circuit boards; and smart and rigid materials, automotive and RF materials, IMS and HTC materials, IC substrate and flexible materials, HSD materials, and speci	299593302016.0	91.0	1.61	91.75319663725077	29.622792505245087		3239977726.09	902984683.16	2304818271.34	3676930770.8	16723501226.33	0.9621200131533767	1.1930710788427914	0.9673026708824981	76.01110330729021	29.622792505245087	2.5659668410340277	1.5869101651847246	매우 불리	양호(>=1.5)	60.0	96.60000000000001	-21.67990686868211	보류	충분
002916.SZ	002916.SZ	Global Semicon / PCB / Memory / OSAT	324.3599853515625	20.07106232436069	36.860753312895575		-29.163575087338987	407.6312484741211	274.1106997680664	N	Y	상승전환/양호	SCC	SHZ	CNY	Technology	Electronic Components	Electronic Components	Shennan Circuits Co., Ltd. engages in the design, manufacture, and sale of printed circuit boards, packaging substrates, and electronic assemblies in China and internationally. It operates through Packaging Substrates, Packaging Substrates, and Distribution Substrates segments. The company provides RF and microwave, thermal management, miniaturization, and chip package substrate solutions. It also offers schematic design, PCB / SiP design, PCB / SUB production, electronic assembly, package testi	220943187968.0	72.0	5.21	74.46731868482586	25.905809548765156		1588756438.22	2679204686.22	15009670.83	3557910474.95	17149430529.85	-1.600853970239101	0.10703819865094824	0.03299981609474217	62.564460522418734	25.905809548765156	2.4150745185031663	1.5648789861087757	매우 불리	양호(>=1.5)	60.0	312.6	-3.6255968315007325	보류	충분
688981.SS	688981.SS	Global Semicon / PCB / Memory / OSAT	144.0	38.22230713973796	10.64157261085339		-16.763005780346816	143.84200038909913	122.56425006866455	Y	Y	상승전환/양호	SEMICONDUCTOR MANUFACTURING INT	SHH	CNY	Technology	Semiconductors	Semiconductors	Semiconductor Manufacturing International Corporation, an investment holding company, engages in the manufacture, testing, and sale of integrated circuits wafer and various compound semiconductors in the United States, China, and Eurasia. The company is also involved in the manufacturing, sale, and trading of semiconductor products; and research and development activities. In addition, it offers semiconductor foundry and technology services; supporting services comprising design and IP support, 	1232756015104.0		0.62	39.04287790107723	-27.767740812712226		14935414000.0	9994773000.0	2593077000.0	12596181000.0	21439670000.0	1.9399828931885734	-2.045422204880973	-1.420432086722898	229.12905984969584	-27.767740812712226		-0.12118821083160433	판정불가	불리(<1)	0.0	0.0	-100.0	보류	일부부족
603501.SS	603501.SS	Global Semicon / PCB / Memory / OSAT	101.16000366210938	7.950063654275663	-23.282266651098517		-33.08195747343036	96.802250289917	114.1334502029419	Y	N	상승전환/양호	OMNIVISION INTEGRATED CIRCUITS 	SHH	CNY	Technology	Semiconductors	Semiconductors	OmniVision Integrated Circuits Group, Inc., together with its subsidiaries, engages in the design, development, and sale of integrated circuits and computer software and hardware in China and internationally. It operates in two segments, Semiconductor Design and Electronic Components Agency. The company offers image sensors, application-specific integrated circuits, camera cube chips, liquid crystal on silicon, display solutions, in-system programming, and cable modules. It also provides semicon	127209005056.0	69.0	3.04	21.730996944226554	59.85671328521085		13072154645.060001	1617721215.79	2078985512.66	9796924850.61	28172055029.35	9.491875084021855	1.477586990023052	1.4606434722545378	30.153989663844577	59.85671328521085	0.5037695524671398	4.273289031458196	헐값	안심(>=2)	60.0	182.4	80.30841577393102	양호	충분
1888.HK	1888.HK	Global Semicon / PCB / Memory / OSAT	42.29999923706055	57.24907002571802	226.13722718720274		-59.40498994633212	67.74049978256225	28.524849905967713	N	Y	상승전환/양호	KB LAMINATES	HKG	HKD	Technology	Electronic Components	Electronic Components	Kingboard Laminates Holdings Limited, an investment holding company, engages in the manufacture and sale of laminates in the People's Republic of China, Europe, other Asian countries, and the United States. It operates through Laminates, Properties, and Investments segments. The company offers glass epoxy and paper laminates. It also provides upstream component materials, such as copper foils, glass yarns, glass fabrics, bleached kraft papers, epoxy resins, kraft papers for copper-clad laminates	133306335232.0	1.19	0.78	84.16268505447569	8.55356145230186		3010761000.0	637441000.0	3552115000.0	4191710000.0	16341745000.0	0.753088260959241	0.27968173380507383	0.6611861438523021	53.265270482181165	8.55356145230186	6.227262267209979	0.18292522245918894	매우 불리	불리(<1)	25.60712290460372	19.973555865590903	-52.78119095545668	보류	충분
0981.HK	0981.HK	Global Semicon / PCB / Memory / OSAT	69.75	16.34695431583517	-6.2500019227304415		-23.393742271100994	78.40874996185303	71.52874988555908	N	N	주의	SMIC	HKG	HKD	Technology	Semiconductors	Semiconductors	Semiconductor Manufacturing International Corporation, an investment holding company, engages in the manufacture, testing, and sale of integrated circuits wafer and various compound semiconductors in the United States, China, and Eurasia. The company is also involved in the manufacturing, sale, and trading of semiconductor products; and research and development activities. In addition, it offers semiconductor foundry and technology services; supporting services comprising design and IP support, 	597116190720.0		0.7	39.04287790107723	-27.767740812712226		14935414000.0	9994773000.0	2593077000.0	12596181000.0	21439670000.0	0.8215148954383642	-0.8661647557150728	-1.2418132698423983	98.46926443508805	-27.767740812712226		-0.28199399042954165	판정불가	불리(<1)	0.0	0.0	-100.0	보류	일부부족
2382.HK	2382.HK	Global Semicon / PCB / Memory / OSAT	54.79999923706055	-13.632783958816418	-15.301388219695443		-39.71397324843918	68.88000030517578	66.74600004196166	N	N	주의	SUNNY OPTICAL	HKG	HKD	Technology	Electronic Components	Electronic Components	Sunny Optical Technology (Group) Company Limited, an investment holding company, engages in designing, researching, developing, manufacturing, and selling optical and optical related products, and scientific instruments. It operates through Optical Components, Optoelectronic Products, and Optical Instruments segments. The Optical Components segment offers vehicle lens sets and optical parts for vehicle light detection and ranging, handset lens sets, glass spherical and aspherical lenses for digi	58864779264.0	2.24	4.9	71.87231282040072	24.433762661282877		38549973000.0	1405760000.0	4655009000.0	6244099000.0	29148588000.0	34.57930031499529	2.931125362464284	5.3487689840732715	4.126673249401073	24.433762661282877	0.16889225399328675	6.46374477677732	매우 유망	안심(>=2)	57.367525322565754	281.1008740805722	412.95780655863086	매우 유망	충분
TTMI	TTMI	Global Semicon / PCB / Memory / OSAT	138.2949981689453	9.54927163273942	37.06144308974595		-37.55587781338874	176.30487518310548	109.37887495040894	N	Y	상승전환/양호	TTM Technologies, Inc.	NMS	USD	Technology	Electronic Components	Electronic Components	TTM Technologies, Inc. manufactures and sells mission systems, radio frequency (RF) components, RF microwave/microelectronic assemblies, and printed circuit boards (PCBs) and substrates in the United States, Taiwan, and internationally. It operates in three segments, A&D, Commercial, and RF&S Components. The company offers various engineered systems and RF and microwave assemblies; PCBs and IC substrates, custom assemblies and integrated systems, passive and advanced ceramic RF components, hi-re	14361164800.0		1.83	215.1885468658413	23.334906230221144		501234000.0	912336000.0	3815000.0	1028413000.0	1762253000.0	-3.958611135695166	-0.006576789715641856	-0.004755623704920588	77.73421273477622	23.334906230221144	3.331241701503059	0.3001883650618324	매우 불리	불리(<1)	55.16981246044229	100.9607568026094	-26.996089418018787	보류	충분
005930.KS	005930.KS	Global Semicon / PCB / Memory / OSAT	255000.0	23.486682808716708	83.45323741007194		-29.655172413793107	313512.5	185166.0	N	Y	상승전환/양호	SamsungElec	KSC	KRW	Technology	Consumer Electronics	Consumer Electronics	Samsung Electronics Co., Ltd. engages in the consumer electronics, information technology and mobile communications, and device solutions businesses worldwide. The company operates through four divisions: Device eXperience (DX), Device Solutions (DS), SDC, and Harman. The company offers smartphones, tablets, audio sounds, watches, switches, and accessories; TVs, and sound devices; appliances, including refrigerators, washing machines and dryers, vacuum cleaners, cooking appliances, dishwashers, 	1602241442086912.0	57.99999999999999	7678.605560818366	31.645335140041773	-6.832366066754158		193837850000000.0	2813148000000.0	17584050000000.0	25239139000000.0	424313255000000.0	33139.892844403796	5753.104608252318	2.2561194542165954	28.893280869599835	-6.832366066754158		1.7709180956006294	판정불가	양호(>=1.5)	0.0	0.0	-100.0	보류	일부부족
000660.KS	000660.KS	Global Semicon / PCB / Memory / OSAT	1842000.0	66.99909338168631	147.5806451612903		-36.89619732785201	2287550.0	1108395.0	N	Y	상승전환/양호	SK hynix	KSC	KRW	Technology	Semiconductors	Semiconductors	SK hynix Inc. through its subsidiaries, engages in research, develops, manufactures, distributes, and sells semiconductor devices in Korea, China, rest of Asia, the United States, Europe, and internationally. It offers DRAM, such as server memory, graphics memory, mobile memory, PC memory, consumer memory; NAND flash memory; SSD; and MCP products. It also engages in foundry business, produces non-memory semiconductors. The company serves its products for server, networking, mobile, personal comp	1252184024940544.0	16.0	60462.05716711756	116.88806343383877	168.00595548778566		55351258000000.0	14086148000000.0	8161757000000.0	24757848000000.0	120516178000000.0	58131.75414184756	34927.9596638012	1.896197593040239	29.5039290662494	168.00595548778566	0.1756124000520588	6.236659364066756	매우 유망	안심(>=2)	60.0	3627723.430027053	96.94481161927541	매우 유망	충분
042700.KS	042700.KS	Global Semicon / PCB / Memory / OSAT	242500.0	-14.612676056338024	37.549631310266584		-40.78144078144078	273692.5	217874.0	N	Y	상승전환/양호	HANMISemi	KSC	KRW	Technology	Semiconductor Equipment & Materials	Semiconductor Equipment & Materials	HANMI Semiconductor Co., Ltd. manufactures and sells semiconductor equipment in South Korea and internationally. The company offers bonder; micro SAW equipment; vision placement equipment; meta grinder; EMI shield vision attach and detach, EMI shield vision placement, EMI shield tape mounter, EMI shield tape laser cutting, EMI shield tape demounter, vision inspection, and converlay attach equipment; laser marking, laser ablation, and laser cutting equipment; and pick and place, strip mounter, an	21057366917120.0	33.0	2256.2021643764106	40.22753487679789	32.37512374110017		278201051520.0	0.0	1339920070.0	2554319940.0	690327519530.0	2932.9704453634477	1422.1134652122028	0.5864385423555475	106.18154407313507	32.37512374110017	3.279726277565938	0.6156919671093829	매우 불리	불리(<1)	60.0	135372.12986258464	-44.17644129377953	보류	충분
009150.KS	009150.KS	Global Semicon / PCB / Memory / OSAT	1277000.0	118.66438356164383	380.07518796992485		-43.74449339207048	1784150.0	662139.5	N	Y	상승전환/양호	SamsungElecMech	KSC	KRW	Technology	Electronic Components	Electronic Components	Samsung Electro-Mechanics Co., Ltd. manufactures and sells various electronic components in Korea, China, Southeast Asia, Japan, the Americas, and Europe. The company operates through three segments: Component, Package Solution, and Optics Solution. It offers multilayer ceramic capacitors, inductors, tantalums, and chip resistors; camera modules; package substrates; and semiconductor PKG boards. The company is also involved in the real estate and real estate software, as well as investment busin	96322745008128.0	18.0	9713.540572348942	3.9731852611235574	-10.36699722244878		2741115492930.0	188444338600.0	2003354614630.0	2277190879280.0	9541761553950.0	35115.44046859304	3353.3490806410505	0.2625958559624942	127.85086450007927	-10.36699722244878		0.05970239471901644	판정불가	불리(<1)	0.0	0.0	-100.0	보류	일부부족
011070.KS	011070.KS	Global Semicon / PCB / Memory / OSAT	668000.0	80.29689608636976	155.44933078393882		-56.33986928104575	997900.0	444880.0	N	Y	상승전환/양호	LG Innotek	KSC	KRW	Technology	Electronic Components	Electronic Components	LG Innotek Co., Ltd. engages in the manufacture and sale of electronic materials and components for mobile, display, semiconductor, automobile, and Internet of Things (IoT) fields in South Korea and internationally. It offers optics solutions, including camera and 3D sensing modules, and actuators; substrates and materials comprising package and tape substrates, and display masks; automotive components, such as connectivity, autonomous driving, electrification, and lighting solutions; and electr	14246034276352.0	28.000000000000004	14420.83707892161	-24.041453545052683	-29.642622092696946		1409003000000.0	1540157000000.0	722253000000.0	2282210000000.0	5763054000000.0	-5542.2240573192585	24377.182250194353	3.6492787799692143	46.70618081122422	-29.642622092696946		-0.03516926591227933	판정불가	불리(<1)	0.0	0.0	-100.0	보류	일부부족
