티커	종목코드	유니버스	현재가	3M수익률(보조,%)	6M수익률(보조,%)	12M수익률(보조,%)	52주고점대비(보조,%)	40일이평(보조)	200일이평(보조)	40일선상회(보조)	200일선상회(보조)	추세판정(보조)	종목명	시장	통화	섹터	산업	업종	사업설명	시가총액	배당수익률(%)	EPS(FY)	EPS Growth 1Y(%)	EPS Growth 3Y CAGR(%)	EPS Growth 5Y CAGR(%)	현금및단기투자	장기부채	단기위험부채	총부채	주주지분	주당순현금(린치식)	주당잉여현금흐름	잉여현금흐름수익률(%)	순현금차감PER(린치식)	사용연성장률(%)	린치PER배수	배당감안점수	린치PER판정	배당감안점수판정	그레이엄적정PER(3년)	그레이엄내재가치(3년)	그레이엄괴리율(3년,%)	종합판정	데이터상태
GFS	GFS	Global Semicon / PCB / Memory / OSAT	86.11499786376953	84.24260755523862	136.44975890525518		-4.274123232363147	77.39662446975709	47.93379992485046	Y	Y	상승전환/양호	GlobalFoundries Inc.	NMS	USD	Technology	Semiconductors	Semiconductors	GLOBALFOUNDRIES Inc., a semiconductor foundry, provides range of mainstream wafer fabrication services and technologies in the United States, Europe, the Middle East, Africa, and internationally. It offers semiconductor devices, including microprocessors, mobile application processors, baseband processors, network processors, radio frequency modems, microcontrollers, and power management units. The company also provides quantum technology solutions. GLOBALFOUNDRIES Inc. has a strategic partnersh	47251374080.0	56.99999999999999	1.64	-51.0	-15.135725474232498		4397000000.0	1065000000.0	86000000.0	1707000000.0	11928000000.0	6.0725258640166855	1.8388891346917273	2.1353877725234063	48.80638536570296	-15.135725474232498		0.8577622418067085	판정불가	불리(<1)	0.0	0.0	-100.0	보류	일부부족
UMC	UMC	Global Semicon / PCB / Memory / OSAT	27.600000381469727	196.45541501066916	239.4833947473778		-1.463762385083267	19.46875	10.873350009918212	Y	Y	상승전환/양호	United Microelectronics Corpora	NYQ	USD	Technology	Semiconductors	Semiconductors	United Microelectronics Corporation operates as a semiconductor wafer foundry in Taiwan, China, Hong Kong, Japan, Korea, the United States, Europe, and internationally. It manufactures and sells integrated circuits. The company offers circuit design; mask tooling; wafer fabrication; and assembly and testing services for communication devices, consumer electronics, computer, and other applications. It also provides venture capital and marketing support; consulting and planning; energy technical; 	69256314880.0	1.84	0.62	-17.259341564967112	-23.3089317909408		146070330000.0	45372054000.0	8408772000.0	59781672000.0	365824997000.0	40.130238218838194	19.579483903181806	70.94015808900934	-20.21006102801366	-23.3089317909408			판정불가	판정불가	0.0	0.0	-100.0	판정불가	일부부족
2330.TW	2330.TW	Global Semicon / PCB / Memory / OSAT	2390.0	32.044198895027634	62.585034013605444		-4.7808764940239	2306.375	1747.1	Y	Y	상승전환/양호	TAIWAN SEMICONDUCTOR MANUFACTUR	TAI	TWD	Technology	Semiconductors	Semiconductors	Taiwan Semiconductor Manufacturing Company Limited, together with its subsidiaries, manufactures, packages, tests, and sells integrated circuits and other semiconductor devices in Taiwan, China, Europe, the Middle East, Africa, Japan, the United States, and internationally. It provides various wafer fabrication processes, such as processes to manufacture complementary metal- oxide-semiconductor (CMOS) logic, mixed-signal, radio frequency, embedded memory, bipolar CMOS mixed-signal, and others. T	61978366181376.0	1.0	73.61	46.54981153856048	19.574951863097922		3488279800000.0	896062000000.0	136925700000.0	1064582700000.0	5355038700000.0	99.96069751058748	38.26794070252923	1.6011690670514322	31.110437474384085	19.574951863097922	1.5892982875238888	0.6613520584543069	보통	불리(<1)	47.649903726195845	3507.509413285276	46.757716037040844	보류	충분
2454.TW	2454.TW	Global Semicon / PCB / Memory / OSAT	4310.0	166.04938271604937	208.9605734767025		-7.1120689655172376	3932.25	2004.4	Y	Y	상승전환/양호	MEDIATEK INC	TAI	TWD	Technology	Semiconductors	Semiconductors	MediaTek Inc. engages in the research, development, production, manufacture, and marketing of multimedia integrated circuits (ICs) in Taiwan, rest of Asia, and internationally. The company offers multimedia, computer peripherals oriented, consumer-oriented, and other ICs for various applications. It also offers design, test runs, maintenance and repair, and technological consultation services for software and hardware solutions; and sale and delegation patents and circuit layout rights for its I	6879234752512.0	1.25	65.99	-1.0032496768530352	-3.7570524355304835		260128122000.0	60000000.0	4480763000.0	13730009000.0	400600988000.0	162.93870008806817	86.0675425604462	1.9969267415416752	62.84378390531796	-3.7570524355304835		-0.039893403607072296	판정불가	불리(<1)	0.985895128939033	65.05921955868678	-98.4905053466662	보류	일부부족
2303.TW	2303.TW	Global Semicon / PCB / Memory / OSAT	178.5	215.929203539823	266.9064633123364		0.0	122.83000011444092	67.00375003814698	Y	Y	상승전환/양호	UNITED MICRO ELECTRONICS	TAI	TWD	Technology	Semiconductors	Semiconductors	United Microelectronics Corporation operates as a semiconductor wafer foundry in Taiwan, China, Hong Kong, Japan, Korea, the United States, Europe, and internationally. It manufactures and sells integrated circuits. The company offers circuit design; mask tooling; wafer fabrication; and assembly and testing services for communication devices, consumer electronics, computer, and other applications. It also provides venture capital and marketing support; consulting and planning; energy technical; 	2239538397184.0	1.47	3.93	-17.259341564967112	-23.3089317909408		146070330000.0	45372054000.0	8408772000.0	59781672000.0	365824997000.0	8.026047643767638	3.915896780636361	2.193779709039978	43.377596019397544	-23.3089317909408		-0.5034610904019414	판정불가	불리(<1)	0.0	0.0	-100.0	보류	일부부족
3711.TW	3711.TW	Global Semicon / PCB / Memory / OSAT	641.0	92.78195488721805	162.16768916155416		-4.896142433234418	568.6125	328.9625	Y	Y	상승전환/양호	ASE TECHNOLOGY HOLDING CO LTD	TAI	TWD	Technology	Semiconductors	Semiconductors	ASE Technology Holding Co., Ltd., together with its subsidiaries, provides semiconductor manufacturing services in the United States, Taiwan, rest of Asia, Europe, and internationally. It operates through Packaging, Testing, and EMS. The company offers semiconductor packaging, interconnect materials production, front-end engineering testing, wafer probing, and final testing services, as well as integrated solutions for EMS (electronic manufacturing services) in relation to computing, peripherals	2812638658560.0	1.01	10.19	23.585762669903666	-13.347387041498415		111497789000.0	214080678000.0	40733681000.0	263662466000.0	342181952000.0	-23.378628938260114	-5.3782267829267285	-0.8390369396141542	65.19908036685575	-13.347387041498415		-0.18922639663135774	판정불가	불리(<1)	0.0	0.0	-100.0	보류	일부부족
3037.TW	3037.TW	Global Semicon / PCB / Memory / OSAT	1020.0	121.73913043478262	353.3333333333333		-5.990783410138246	931.125	427.5223966217041	Y	Y	상승전환/양호	UNIMICRON TECHNOLOGY	TAI	TWD	Technology	Electronic Components	Electronic Components	Unimicron Technology Corp., together with its subsidiaries, engages in the manufacturing, processing, and sale of printed circuit boards, electrical equipment, electronic products, and integrated circuit product testing and burn-in systems in Taiwan, China, Asia, the Americas, and internationally. The company offers PCB products, including HDI, ELIC, multi-layer and rigid flex PCBs, and FPC; IC carriers, such as FCCSP, FCBGA, CSP, memory module, and coreless; connectors comprising PCBeam and X-B	1605628723200.0	21.0	4.38	31.307777963397943	-39.15067182208464		55226513000.0	34873158000.0	22207016000.0	57080174000.0	100569302000.0	12.929777846074714	-7.044326051426996	-0.6906202011202938	229.92470825432085	-39.15067182208464		-0.07894180647174331	판정불가	불리(<1)	0.0	0.0	-100.0	보류	일부부족
8046.TW	8046.TW	Global Semicon / PCB / Memory / OSAT	1045.0	112.83095723014256	275.8992805755396		0.0	887.625	465.3575	Y	Y	상승전환/양호	NAN YA PRINTED CIRCUIT BOARD CO	TAI	TWD	Technology	Electronic Components	Electronic Components	Nan Ya Printed Circuit Board Corporation manufactures and sells printed circuit boards (PCBs) in Taiwan, the United States, Mainland China, Korea, and internationally. It offers conventional PCBs that are used in the motherboards of desktops and notebooks, and home electrical appliances; high density connector boards that are used in smartphones, game consoles, navigation systems, GPS, PDAs, automobile appliances, and MP3 players; and soft and hard composite boards used in high-end handheld devi	675242967040.0	21.0	3.06	855.5802618209663	-53.54257860278134		8823188000.0	0.0	0.0	1234627000.0	46122894000.0	13.654687812195082	0.9357680225344502	0.08954717918989955	337.04095169536106	-53.54257860278134		-0.09655378208223012	판정불가	불리(<1)	0.0	0.0	-100.0	보류	일부부족
4958.TW	4958.TW	Global Semicon / PCB / Memory / OSAT	602.0	205.58375634517768	312.32876712328766		-6.230529595015577	498.325	243.6825	Y	Y	상승전환/양호	ZHEN DING TECHNOLOGY HOLDING LT	TAI	TWD	Technology	Electronic Components	Electronic Components	Zhen Ding Technology Holding Limited, together with its subsidiaries, engages in the design, development, manufacture, and sale of printed circuit boards (PCB) products in the United States, Mainland China, Taiwan, Singapore, and internationally. The company offers flexible circuit boards, substrate-like PCBs, high-density interconnect PCBs, rigid printed circuit boards, IC substrates, rigid-flex PCBs, and modules. Its products are used in various applications, including mobile phones, computers	649811329024.0	57.99999999999999	6.75	-26.026818555617737	-21.794946088339774		71187918000.0	26429839000.0	25689071000.0	53010937000.0	123981554000.0	41.46490110198955	-5.477117634530046	-0.9098202050714363	83.04223687377933	-21.794946088339774		0.43598360635070993	판정불가	불리(<1)	0.0	0.0	-100.0	보류	일부부족
3044.TW	3044.TW	Global Semicon / PCB / Memory / OSAT	532.0	56.01173020527859	74.14075286415711		-7.155322862129143	501.8625	371.1775	Y	Y	상승전환/양호	TRIPOD TECHNOLOGY CORP	TAI	TWD	Technology	Electronic Components	Electronic Components	Tripod Technology Corporation processes, manufactures, and sells printed circuit boards and other related components in Taiwan, China, Vietnam, Thailand, South Korea, Malaysia, Mexico, and internationally. The company offers printed circuit boards comprising any layer, double-sided, HDI, heavy copper, multi-layer, high layer count, flexible, rigid-flex, semi-flex, cavity, thermal, embedded ferrite, and hybrid lamination structure. It also engages in the manufacture and wholesale of electronic pa	279622385664.0	2.41	19.36	21.976442546571807	18.143871338410513		31846737000.0	1000000000.0	6478679000.0	7596649000.0	54083843000.0	58.68794686514233	11.10088164899183	2.086631888908239	24.447936628866614	18.143871338410513	1.347448743042529	0.8407200840884776	보통	불리(<1)	44.787742676821026	867.090698223255	62.98697335023591	보류	충분
2327.TW	2327.TW	Global Semicon / PCB / Memory / OSAT	1125.0	349.10179640718565	376.6949152542373		0.0	677.6	323.495	Y	Y	상승전환/양호	YAGEO CORP	TAI	TWD	Technology	Electronic Components	Electronic Components	Yageo Corporation, together with its subsidiaries, manufactures and sells electronic components in China, Europe, the United States, and the rest of Asia. It offers antennas, radio frequency, and microwave; capacitors; circuit protection; custom products; electromechanical devices; EMC; engineering kits; inductors; piezoelectric devices; power supplies; resistors; semiconductors; sensors; signal magnetics and connectors; and transformers. The company's products are used for various applications,	2316071862272.0	56.99999999999999	12.71	22.099803869339073	1.3081472653207582		114742022000.0	62087637000.0	86197379000.0	150894630000.0	170877823000.0	25.57614287504765	11.927875062251228	1.060255561088998	86.50069686270277	1.3081472653207582	66.12458639470745	0.674077196833104	매우 불리	불리(<1)	11.116294530641516	141.28810348445367	-87.44105746804857	보류	충분
2408.TW	2408.TW	Global Semicon / PCB / Memory / OSAT	477.0	120.32332563510391	205.76923076923075		-5.5445544554455495	343.175	209.5602499961853	Y	Y	상승전환/양호	NANYA TECHNOLOGY CORPORATION	TAI	TWD	Technology	Semiconductors	Semiconductors	Nanya Technology Corporation research, develops, manufactures, and sells semiconductor products in Taiwan, Japan, Malaysia, China, the United States, Thailand, Germany, Singapore, Poland and internationally. It offers standard dynamic random-access memory (DRAM), low power DRAM, MCP and eMCP, and KGD products, as well as modules; and other memory products and Elixir brands. The company engages in the import and export of its machinery, equipment, and raw materials. Its products have applications	1478045466624.0	30.0	10.82		-23.232591966740635		58074065000.0	14196100000.0	5059500000.0	23617455000.0	170399852000.0	14.160449855886213	1.5764312972202954	0.33048874155561747	42.776298534576135	-23.232591966740635		0.15820461949949363	판정불가	불리(<1)	0.0	0.0	-100.0	보류	일부부족
2344.TW	2344.TW	Global Semicon / PCB / Memory / OSAT	219.5	120.60301507537687	220.90642558970254		-1.1261261261261257	149.5175001144409	89.35450003623963	Y	Y	상승전환/양호	WINBOND ELECTRONIC CORP	TAI	TWD	Technology	Semiconductors	Semiconductors	Winbond Electronics Corporation engages in the research, development, production and sales of integrated circuits, various semiconductor components and other system products. The company offers customized memory solutions, including CUBE(3DCaaS), pseudo static random access memory, DDR/SDR, LPDDR/LPSDR, Known Good Die wafer products; electrical simulation, wafer-level speed testing, and other services; redistribution layers; and failure analysis services, as well as low power SDR, DDR, DDR2, DDR	987750072320.0	24.0	0.88	559.2216984663919	-32.578077486406286		42427238000.0	26398931000.0	25731058000.0	54236531000.0	107935967000.0	3.5618458472363894	0.9584377366714482	0.43664589369997636	245.38426608268594	-32.578077486406286		-0.03495773230837781	판정불가	불리(<1)	0.0	0.0	-100.0	보류	일부부족
2337.TW	2337.TW	Global Semicon / PCB / Memory / OSAT	161.5	18.315018315018317	343.68130008230946		-12.938005390835583	158.425	83.58300015449524	Y	Y	상승전환/양호	MACRONIX INTERNATIONAL	TAI	TWD	Technology	Semiconductors	Semiconductors	Macronix International Co., Ltd. engages in the design, manufacture, and supply of integrated circuits and memory chips. The company provides a range of NOR flash, NAND flash, e MMC, and read-only memory products. It also offers wafer foundry services to IC design and IDM companies; ArmorFlash, a security solution for a range of identification, authentication, and encryption requirements; and LybraFlash, a solution for gigabit flash memory. In addition, the company develops integrated circuit sy	311553851392.0	3.281856965944273	-1.77				14927643000.0	17385877000.0	6844010000.0	24966908000.0	45802485000.0	-1.2742734274484921	1.5426975739272604	0.9552306959301923					판정불가	판정불가				판정불가	일부부족
6239.TW	6239.TW	Global Semicon / PCB / Memory / OSAT	326.0	69.79166666666667	101.23456790123457		-13.984168865435354	295.1375	207.4675	Y	Y	상승전환/양호	POWERTECH TECHNOLOGY INC	TAI	TWD	Technology	Semiconductors	Semiconductors	Powertech Technology Inc., together with its subsidiaries, researches, designs, develops, assembles, manufactures, packages, tests, and sells various integrated circuit (IC) products in Taiwan, Japan, Singapore, the United States, Europe, China, Hong Kong, Macao, and internationally. It provides chip probing and final test; IC packaging services, such as wafer level packing, flip chips, wire bond BGA, lead frame, and system in package; module assembly services; and quality management services. T	240847814656.0	2.07	8.38	-18.452077134528476	-13.944410754124926		16375176000.0	25413199000.0	4703164000.0	31892991000.0	56290777000.0	-12.233432187732218	-12.614909102229706	-3.8696040190888668	40.3619847479394	-13.944410754124926		-0.2941978901255878	판정불가	불리(<1)	0.0	0.0	-100.0	보류	일부부족
2449.TW	2449.TW	Global Semicon / PCB / Memory / OSAT	334.5	20.107719928186718	51.0158013544018		-5.508474576271183	307.0875	250.175	Y	Y	상승전환/양호	KING YUAN ELECTRONICS CO	TAI	TWD	Technology	Semiconductors	Semiconductors	King Yuan Electronics Co., Ltd. designs, manufactures, sells, tests, and assembles integrated circuits. It offers test services, such as wafer probing; final test; burn-in; system level testing; and back end service. It also provides Technology Innovation, including wafer level chip scale package (WLCSP); high power burn in; and KYEC Bio Chip Testing, as well as equipment development, spare parts and test program, automation control, and vertical card. It also provides engineering services for M	409008177152.0	1.2	6.5	41.59903530182425	17.234581996226606		17963508000.0	30274865000.0	6357000.0	33144334000.0	50429320000.0	-10.06862183038982	-15.711436153899628	-4.6969913763526545	53.01055720467536	17.234581996226606	3.0758249440735876	0.34775303200549523	매우 불리	불리(<1)	42.96916399245321	279.29956595094586	-16.502371913020664	보류	충분
8150.TW	8150.TW	Global Semicon / PCB / Memory / OSAT	96.0	68.126099063749	110.29572133875564		-15.789473684210531	91.2075002670288	56.36100011825562	Y	Y	상승전환/양호	CHIPMOS TECHNOLOGIES INC	TAI	TWD	Technology	Semiconductors	Semiconductors	ChipMOS TECHNOLOGIES INC. engages in the research and development, manufacture, and sale of integrated circuits, and related assembly and testing services in Taiwan, Japan, the People's Republic of China, and internationally. It operates through five segments: Testing; Assembly; Display Panel Driver Semiconductor Assembly and Testing; Bumping; and Others. The company offers leadframe-based packages, such as the small outline package, thin small outline package, and quad flat package; and substra	66760138752.0	1.19	1.25	-61.74913305398406	-45.70232815746953		15097129000.0	9867797000.0	5604561000.0	16327274000.0	23987112000.0	7.519694705225443	0.20879812384988078	0.21749804567695913	70.78424423581964	-45.70232815746953		-0.6288451425599106	판정불가	불리(<1)	0.0	0.0	-100.0	보류	일부부족
2368.TW	2368.TW	Global Semicon / PCB / Memory / OSAT	1240.0	39.63963963963963	105.6384742951907		-17.05685618729097	1353.625	809.2375	N	Y	상승전환/양호	GOLD CIRCUIT ELECTRONICS CO	TAI	TWD	Technology	Electronic Components	Electronic Components	Gold Circuit Electronics Ltd. engages in the manufacturing, processing, and trading of electronic equipment products, such as printed circuit boards in Taiwan. Its products are used for AI/ Advanced Server, networking, notebook, handset products, automotive, and IC tests products. The company was founded in 1981 and is headquartered in Taoyuan City, Taiwan.	626668732416.0	78.0	18.95	71.06843481034197	28.12015612291836		18920059000.0	11874888000.0	6115928000.0	18073139000.0	33481159000.0	13.940399067628586	-8.980840084055895	-0.7242612971012818	64.6997150887795	28.12015612291836	2.3008305788191636	1.6401951071546863	매우 불리	양호(>=1.5)	60.0	1137.0	-8.30645161290322	보류	충분
3189.TW	3189.TW	Global Semicon / PCB / Memory / OSAT	812.0	153.35413416536662	435.973597359736		0.0	623.9625	291.36512519836424	Y	Y	상승전환/양호	KINSUS INTERCONNECT TECHNOLOGY 	TAI	TWD	Technology	Semiconductor Equipment & Materials	Semiconductor Equipment & Materials	Kinsus Interconnect Technology Corp., together with its subsidiaries, engages in the manufacture and sale of electronic products in Taiwan and internationally. It operates through the IC Substrate and Optics segments. The company offers system in package substrate, a carrier substrate that provides a platform for multiple chips or packages or passive components assembly for multi-chip module, multi-chip package, stack die, package in package, and embedded substrates, as well as modules in handse	427855609856.0	21.0	3.4	3164.40712634744	-38.842006005271955		20390405000.0	11197127000.0	3124539000.0	14437615000.0	32731765000.0	17.447339210351196	3.2466631857813475	0.3998353677070625	233.69195905577908	-38.842006005271955		-0.07634839502977213	판정불가	불리(<1)	0.0	0.0	-100.0	보류	일부부족
2313.TW	2313.TW	Global Semicon / PCB / Memory / OSAT	233.0	11.217183770883054	180.72289156626505		-21.94304857621441	259.3267169952393	161.53184345245361	N	Y	상승전환/양호	COMPEQ MANUFACTURING	TAI	TWD	Technology	Electronic Components	Electronic Components	Compeq Manufacturing Co., Ltd., together with its subsidiaries, manufactures and sells printed circuit boards for computers in Taiwan, the United States, rest of Asia, Europe, and internationally. The company offers high layer, rigid-flex, flexible, regular multi-layered, and high-density interconnection printed circuit boards. It also provides surface mount technology devices; and module assembly services. In addition, the company is involved in investment; trading; electronic manufacturing; ou	279302569984.0	1.16	5.45	17.284433058479443	-6.372141905534656		27233389000.0	7796664000.0	5205724000.0	13117147000.0	47862670000.0	16.214519041475803	3.840072380194492	1.6480997339890522	39.77715246945398	-6.372141905534656		-0.1310335602714953	판정불가	불리(<1)	0.0	0.0	-100.0	보류	일부부족
2316.TW	2316.TW	Global Semicon / PCB / Memory / OSAT	234.5	134.50000000000003	116.1290322580645		0.0	156.925	112.58750003814697	Y	Y	상승전환/양호	WUS PRINTED CIRCUIT CO	TAI	TWD	Technology	Electronic Components	Electronic Components	WUS Printed Circuit Co., Ltd., together with its subsidiaries, manufactures, processes, assembles, and sells double side and multi-layer printed circuit boards in Taiwan, Asia, North America, Europe, and internationally. It operates through Manufacturing and Trading of Printed Circuit Boards; Assembly and Trading of PCB/Light Products; Investment; and Others segments. It is involved in imported commodity trading business; and assembly and sale of peripheral equipment, such as electronic products	42546507776.0	23.0	13.36	212.2520816393746	68.1394170953056		8070413000.0	1632969000.0	1087016000.0	2781002000.0	12575793000.0	35.48071761236807	-1.6873095047813267	-0.7195349700560029	14.896652873325744	68.1394170953056	0.2186201982398824	6.1181137716179	매우 유망	안심(>=2)	60.0	801.5999999999999	241.8336886993603	보류	충분
6981.T	6981.T	Global Semicon / PCB / Memory / OSAT	11030.0	214.42417331813	237.20574747783553		-9.959183673469385	8150.275	4272.1925	Y	Y	상승전환/양호	MURATA MANUFACTURING CO	JPX	JPY	Technology	Electronic Components	Electronic Components	Murata Manufacturing Co., Ltd. develops, manufactures, and sells ceramic-based passive electronic components and solutions in Japan, North America, and South America, Europe, China, Asia, and internationally. It operates through three segments: Components, Devices & Modules, and Other. The company offers capacitors; inductors; high frequency device and communication modules, including surface acoustic wave filters, RF modules, multilayer resin substrates, and connectivity modules; lithium-ion se	21524937441280.0	63.0	127.95	0.04362367311327997	-1.3891842891780914		702071000000.0	1516000000.0	1745000000.0	55768000000.0	2718743000000.0	384.858856714945	95.04086321473532	0.8616578713937926	83.19766426951976	-1.3891842891780914		0.7405354014655146	판정불가	불리(<1)	5.721631421643817	732.0827403993264	-93.36280380417655	보류	일부부족
6762.T	6762.T	Global Semicon / PCB / Memory / OSAT	3816.0	86.82986536107711	70.09137508357477		-7.175869618097785	3451.5625	2481.405	Y	Y	상승전환/양호	TDK CORP	JPX	JPY	Technology	Electronic Components	Electronic Components	TDK Corporation, together with its subsidiaries, engages in the manufacture and sale of electronic components in Japan, Europe, China, Asia, the Americas, and internationally. The company operates through Passive Components, Sensor Application Products, Magnetic Application Products, Energy Application Products, and Others segments. The Passive Components segment offers ceramic capacitors, aluminum electrolytic capacitors, film capacitors, high-frequency components, piezoelectric material produc	7417986285568.0	1.05	103.03	17.050627837832977	19.664137529214678		1161949000000.0	332678000000.0	210953000000.0	615970000000.0	2187234000000.0	436.88285849812115	110.14964340685454	2.8865210536387456	32.7974098951944	19.664137529214678	1.6678793995652157	0.6315784568174023	보통	불리(<1)	47.828275058429355	4927.747179269976	29.133835934747808	보류	충분
