티커	종목코드	유니버스	현재가	3M수익률(보조,%)	6M수익률(보조,%)	12M수익률(보조,%)	52주고점대비(보조,%)	40일이평(보조)	200일이평(보조)	40일선상회(보조)	200일선상회(보조)	추세판정(보조)	종목명	시장	통화	섹터	산업	업종	사업설명	시가총액	배당수익률(%)	EPS(FY)	EPS Growth 1Y(%)	EPS Growth 3Y CAGR(%)	EPS Growth 5Y CAGR(%)	현금및단기투자	장기부채	단기위험부채	총부채	주주지분	주당순현금(린치식)	주당잉여현금흐름	잉여현금흐름수익률(%)	순현금차감PER(린치식)	사용연성장률(%)	린치PER배수	배당감안점수	린치PER판정	배당감안점수판정	그레이엄적정PER(3년)	그레이엄내재가치(3년)	그레이엄괴리율(3년,%)	종합판정	데이터상태
009150.KS	009150.KS	Global Semicon / PCB / Memory / OSAT	912000.0	226.2969588550984	293.10344827586204		-0.6535947712418277	570200.0	299786.0	Y	Y	상승전환/양호	SamsungElecMech	KSC	KRW	Technology	Electronic Components	Electronic Components	Samsung Electro-Mechanics Co., Ltd. manufactures and sells various electronic components in Korea, China, Southeast Asia, Japan, the Americas, and Europe. The company operates through three segments: Component, Package Solution, and Optics Solution. It offers multilayer ceramic capacitors, inductors, tantalums, and chip resistors; camera modules; package substrates; and semiconductor PKG boards. The company is also involved in the real estate and real estate software, as well as investment busin	68899089416192.0	26.0	9713.540572348942	3.9731852611235574	-10.36699722244878		2741115492930.0	188444338600.0	2003354614630.0	2277190879280.0	9541761553950.0	35115.44046859304	3353.3490806410505	0.3676917851580099	90.27445276005652	-10.36699722244878		0.17317194731828173	판정불가	불리(<1)	0.0	0.0	-100.0	보류	일부부족
011070.KS	011070.KS	Global Semicon / PCB / Memory / OSAT	632000.0	154.83870967741936	173.5930735930736		0.0	374937.5	252494.5	Y	Y	상승전환/양호	LG Innotek	KSC	KRW	Technology	Electronic Components	Electronic Components	LG Innotek Co., Ltd. engages in the manufacture and sale of electronic materials and components for mobile, display, semiconductor, automobile, and Internet of Things (IoT) fields in South Korea and internationally. It offers optics solutions, including camera and 3D sensing modules, and actuators; substrates and materials comprising package and tape substrates, and display masks; automotive components, such as connectivity, autonomous driving, electrification, and lighting solutions; and electr	14955969511424.0	32.0	14420.83707892161	-24.041453545052683	-29.642622092696946		1409003000000.0	1540157000000.0	722253000000.0	2282210000000.0	5763054000000.0	-5542.2240573192585	24377.182250194353	3.8571490902206254	44.20979313254919	-29.642622092696946		0.05332252743719465	판정불가	불리(<1)	0.0	0.0	-100.0	보류	일부부족
222800.KS	222800.KS	Global Semicon / PCB / Memory / OSAT	88200.0	47.73869346733668	51.027397260273965		-1.2318029115341522	65641.25	47910.0	Y	Y	상승전환/양호	222800.KS,0P00016I7F,139578	KOE	KRW						0.9750566893424036					55114333000.0	130960931420.0	444465223250.0	587056910110.0	575653321790.0								판정불가	판정불가				판정불가	핵심부족
272210.KS	272210.KS	Global Semicon / PCB / Memory / OSAT	122200.0	31.68103448275863	122.18181818181817		-24.892440073755374	131605.0	79280.25	N	Y	상승전환/양호	HANWHA SYSTEMS	KSC	KRW	Industrials	Aerospace & Defense	Aerospace & Defense	Hanwha Systems Co., Ltd. manufacture and sell various military equipments in South Korea and internationally. The company offers electro-optics, infra-red, and synthetic aperture radar (SAR) payloads to be mounted on mid-to-large sized satellites, as well as the system and payload development solutions for micro-satellites; avionics solutions for fixed wing, rotary wing, and unmanned aircrafts; and terminals for military satellite communication networks, including network controllers. It also pr	22850576580608.0	42.0	1295.4037454857798	-46.6802244215234			414802712120.0	1073225847000.0	401210396000.0	1609895393000.0	4849228707420.0	-3521.1062225392175	-1296.420434638016	-1.060900519343712	97.05167725556751	-46.6802244215234		-0.04822404469320916	판정불가	불리(<1)	8.5	11010.931836629128	-90.98941748230023	보류	일부부족
353200.KQ	353200.KQ	Global Semicon / PCB / Memory / OSAT	114400.0	109.90825688073396	217.77777777777777		-0.8665511265164683	86520.0	48431.7	Y	Y	상승전환/양호	353200.KQ,0P0001JYFD,174188	KOE	KRW						1.3986013986013985		100.33612913869962	-36.27084611105344		422917053930.0	6581568000.0	41020349000.0	41211519000.0	897305160160.0					-36.27084611105344			판정불가	판정불가				판정불가	핵심부족
