티커	종목코드	유니버스	현재가	3M수익률(보조,%)	6M수익률(보조,%)	12M수익률(보조,%)	52주고점대비(보조,%)	40일이평(보조)	200일이평(보조)	40일선상회(보조)	200일선상회(보조)	추세판정(보조)	종목명	시장	통화	섹터	산업	업종	사업설명	시가총액	배당수익률(%)	EPS(FY)	EPS Growth 1Y(%)	EPS Growth 3Y CAGR(%)	EPS Growth 5Y CAGR(%)	현금및단기투자	장기부채	단기위험부채	총부채	주주지분	주당순현금(린치식)	주당잉여현금흐름	잉여현금흐름수익률(%)	순현금차감PER(린치식)	사용연성장률(%)	린치PER배수	배당감안점수	린치PER판정	배당감안점수판정	그레이엄적정PER(3년)	그레이엄내재가치(3년)	그레이엄괴리율(3년,%)	종합판정	데이터상태
TSM	TSM	Global Semicon / PCB / Memory / OSAT	440.9750061035156	26.808053516467467	50.359727202319114		-5.708086162839631	419.19362487792966	339.29117500305176	Y	Y	상승전환/양호	Taiwan Semiconductor Manufactur	NYQ	USD	Technology	Semiconductors	Semiconductors	Taiwan Semiconductor Manufacturing Company Limited, together with its subsidiaries, manufactures, packages, tests, and sells integrated circuits and other semiconductor devices in Taiwan, China, Europe, the Middle East, Africa, Japan, the United States, and internationally. It provides various wafer fabrication processes, such as processes to manufacture complementary metal- oxide-semiconductor (CMOS) logic, mixed-signal, radio frequency, embedded memory, bipolar CMOS mixed-signal, and others. T	2287105474560.0	86.0	11.59	46.54981153856048	19.574951863097922		3488279800000.0	896062000000.0	136925700000.0	1064582700000.0	5355038700000.0	499.80348759148404	191.33970352740297	43.390147033069574	-5.0757965045701825	19.574951863097922	-0.25930058679423434		판정불가	판정불가	47.649903726195845	552.2623841866098	25.23666342599251	보류	충분
ASML	ASML	Global Semicon / PCB / Memory / OSAT	1813.8699951171875	30.130065934554807	71.6087370276182		-6.001516073664003	1647.861749267578	1288.7018981933593	Y	Y	상승전환/양호	ASML Holding N.V. - New York Re	NMS	USD	Technology	Semiconductor Equipment & Materials	Semiconductor Equipment & Materials	ASML Holding N.V. provides lithography solutions for the development, production, marketing, sales, upgrading, and servicing of advanced semiconductor equipment systems. The company offers lithography, metrology, and inspection systems. It also provides extreme ultraviolet lithography systems; and deep ultraviolet lithography systems comprising immersion and dry lithography systems solutions to manufacture various range of semiconductor nodes and technologies. In addition, the company offers met	699097546752.0	50.0	29.61	26.913730255164037	19.548786436855625		13727800000.0	2709000000.0	1681900000.0	4390900000.0	19612200000.0	28.589244865047895	28.611298861976138	1.5773621559977165	60.29316954583383	19.548786436855625	3.0842410469103183	1.1535102062263594	매우 불리	보통(1~1.5)	47.59757287371125	1409.36413279059	-22.30070861834086	보류	충분
ARM	ARM	Global Semicon / PCB / Memory / OSAT	354.0400085449219	125.40268162980608	212.50772855841484		-19.437487955917355	305.1694995880127	172.54852527618408	Y	Y	상승전환/양호	Arm Holdings plc	NMS	USD	Technology	Semiconductors	Semiconductors	Arm Holdings plc researches, develops, licenses, and markets central processing unit (CPU) intellectual property (IP), graphics processing unit IP, systems IP, compute subsystems (CSS), and associated software, tools and related services. The company provides a product portfolio, including CPU IP, GPU and neural processing unit (NPU) accelerators, system IP such as interconnects, compute platform products including pre-integrated CSSs, and development tools and software. The company serves semic	378142621696.0		0.86	14.141414141414144	19.934937871784243		4451000000.0	0.0	64000000.0	457000000.0	8286000000.0	4.167295677708262	0.8885112554808224	0.2509635165620229	406.8287358921089	19.934937871784243	20.40782562296977	0.049000810692662065	매우 불리	불리(<1)	48.369875743568485	41.598093139468894	-88.25045414770099	보류	충분
NVDA	NVDA	Global Semicon / PCB / Memory / OSAT	195.65499877929688	9.500227669203642	6.513689465330175		-17.00390505633952	211.73812561035157	190.53092544555665	N	Y	상승전환/양호	NVIDIA Corporation	NMS	USD	Technology	Semiconductors	Semiconductors	NVIDIA Corporation operates as a data center scale AI infrastructure company in the United States, Taiwan, China, Hong Kong, Europe, and internationally. It operates through Compute & Networking, and Graphics segments. The Compute & Networking segment provides data center accelerated computing and networking platforms and artificial intelligence solutions and software, and automotive platforms and autonomous and electric vehicle solutions, including software. The Graphics segment offers GeForce 	4738838429696.0	50.0	6.53	64.74615806805708	201.79613706779188		114507000000.0	7469000000.0	999000000.0	11040000000.0	157293000000.0	4.419222988315925	3.991412410717972	2.0400257778337534	29.28572370459126	201.79613706779188	0.1451252939235053	8.597914110222812	매우 유망	안심(>=2)	60.0	391.8	100.25044207634019	매우 유망	충분
AMD	AMD	Global Semicon / PCB / Memory / OSAT	519.3200073242188	135.7651960100072	141.60037901710965		-5.8571863880859105	467.2667510986328	268.57060005187986	Y	Y	상승전환/양호	Advanced Micro Devices, Inc.	NMS	USD	Technology	Semiconductors	Semiconductors	Advanced Micro Devices, Inc. operates as a semiconductor company internationally. It operates in three segments: Data Center, Client and Gaming, and Embedded. The company offers artificial intelligence (AI) accelerators, microprocessors, and graphics processing units (GPUs) as standalone devices or as incorporated into accelerated processing units, chipsets, and data center and professional GPUs; and embedded processors and semi-custom system-on-chip (SoC) products, microprocessor and SoC develo	846803501056.0		3.01	164.16819012797075	48.64092188805236		15565000000.0	2348000000.0	874000000.0	3847000000.0	62999000000.0	8.105602122237363	4.130379836064813	0.7953438684841887	169.83867282457854	48.64092188805236	3.49168285123099	0.2863948538875605	매우 불리	불리(<1)	60.0	180.6	-65.22375463049532	보류	충분
AVGO	AVGO	Global Semicon / PCB / Memory / OSAT	381.7200012207031	19.73275748686245	11.793816832331805		-20.734265960274236	413.6467514038086	361.1886505126953	N	Y	상승전환/양호	Broadcom Inc.	NMS	USD	Technology	Semiconductors	Semiconductors	Broadcom Inc. designs, develops, and supplies various semiconductor devices and infrastructure software solutions internationally. The company operates in two segments: Semiconductor Solutions and Infrastructure Software. The company offers networking connectivity, such as custom silicon solutions, ethernet switching & routing, ethernet NIC controllers, physical layer devices, and fiber optic components; wireless device connectivity, including RF semiconductor devices, connectivity solutions, cu	1815920771072.0	68.0	6.0	292.2985581000848	26.2400569832006		16178000000.0	61984000000.0	3152000000.0	65136000000.0	81292000000.0	-9.628003752675784	5.657077522584728	1.4819966217368616	65.22466749556315	26.2400569832006	2.485690771834881	1.4448530073320986	매우 불리	보통(1~1.5)	60.0	360.0	-5.6900348819146735	보류	충분
MU	MU	Global Semicon / PCB / Memory / OSAT	1179.0	208.56604760659167	326.2627049460235		-2.6729849223444013	865.8799987792969	420.67699989318845	Y	Y	상승전환/양호	Micron Technology, Inc.	NMS	USD	Technology	Semiconductors	Semiconductors	Micron Technology, Inc. designs, develops, manufactures, and sells memory and storage products in the United States, Taiwan, Japan, Mainland China, Hong Kong, Europe, and internationally. It operates through the Cloud Memory Business Unit; Core Data Center Business Unit; Mobile and Client Business Unit; and Automotive and Embedded Business Unit segments. The company provides memory products, including dynamic random access memory components and modules, CXL-based memory, LPDDR components and mod	1329598431232.0	6.0	44.25	997.5578406169666	-0.5711543545194875		10972000000.0	11533000000.0	106000000.0	15278000000.0	54165000000.0	-0.4974577113305591	1.4790721256673307	0.12545141014990083	26.65530977878713	-0.5711543545194875		0.20366845069648767	판정불가	불리(<1)	7.357691290961025	325.5778396250254	-72.3852553329071	보류	일부부족
MRVL	MRVL	Global Semicon / PCB / Memory / OSAT	274.5849914550781	178.90807513121086	223.80304430824697		-13.224094488280102	225.40737495422363	117.47507511138916	Y	Y	상승전환/양호	Marvell Technology, Inc.	NMS	USD	Technology	Semiconductors	Semiconductors	Marvell Technology, Inc., together with its subsidiaries, provides data infrastructure semiconductor solutions and spanning the data center core to network edge in the United States, Argentina, China, India, Israel, Japan, Singapore, South Korea, Taiwan, Vietnam, and internationally. The company develops and scales system-on-a-chip architectures, integrating analog, mixed-signal, and digital signal processing functionality. It offers a portfolio of ethernet solutions, including spanning controll	240202579968.0	9.0	2.91	-80.60000000000001			2638800000.0	3970800000.0	499800000.0	4790300000.0	14308400000.0	-1.522633744855967	1.5911065386374028	0.5794586696839571	94.88234542953062	-80.60000000000001		-0.7546187826182852	판정불가	불리(<1)	8.5	24.735	-90.99186016361472	보류	일부부족
AMAT	AMAT	Global Semicon / PCB / Memory / OSAT	632.3300170898438	71.20539972913109	144.13342853507146		-1.2262138266968758	479.11949996948243	326.8575999450684	Y	Y	상승전환/양호	Applied Materials, Inc.	NMS	USD	Technology	Semiconductor Equipment & Materials	Semiconductor Equipment & Materials	Applied Materials, Inc. provides materials engineering solutions, equipment, services, and software to the semiconductor and related industries in the United States, China, Korea, Taiwan, Japan, Southeast Asia, Europe, and internationally. The company operates through Semiconductor Systems and Applied Global Services (AGS) segments. The Semiconductor Systems segment includes semiconductor capital equipment to enable materials engineering steps, including etch, rapid thermal processing, depositio	502044360704.0	36.0	10.6	-2.4940783056987548	2.3602035200739557		9905000000.0	6455000000.0	100000000.0	7050000000.0	20415000000.0	4.345310187952551	7.176689116218444	1.1349594234427676	59.24384027376332	2.3602035200739557	25.10115749336182	0.6474969101059798	매우 불리	불리(<1)	13.220407040147911	140.13631462556785	-77.8381049708009	보류	충분
LRCX	LRCX	Global Semicon / PCB / Memory / OSAT	383.3500061035156	64.21075652809176	118.73217968665588		-6.394980196063926	319.1754974365234	215.73099910736084	Y	Y	상승전환/양호	Lam Research Corporation	NMS	USD	Technology	Semiconductor Equipment & Materials	Semiconductor Equipment & Materials	Lam Research Corporation designs, manufactures, markets, refurbishes, and services semiconductor processing equipment used in the fabrication of integrated circuits in the United States, China, Korea, Taiwan, Japan, Southeast Asia, and Europe. The company offers ALTUS systems to deposit conformal or selective films for tungsten or molybdenum metallization applications; SABRE electrochemical deposition products for copper interconnect transition that offers copper damascene manufacturing; SPEED g	479406391296.0	28.000000000000004	5.28	39.98265831925203	5.177109335177765		6428300000.0	3719694000.0	749670000.0	4484505000.0	9861619000.0	2.1658954189726134	4.329284782711258	1.1293295197032618	72.19396035692101	5.177109335177765	13.944839809809059	0.45955519230629355	매우 불리	불리(<1)	18.85421867035553	99.55027457947719	-74.03149263219375	보류	충분
KLAC	KLAC	Global Semicon / PCB / Memory / OSAT	252.5399932861328	63.5812381598404	99.5322515610854		-6.174769709410666	204.41030044555663	147.67507995605467	Y	Y	상승전환/양호	KLA Corporation	NMS	USD	Technology	Semiconductor Equipment & Materials	Semiconductor Equipment & Materials	KLA Corporation, together with its subsidiaries, designs, manufactures, and markets process control, process-enabling, and yield management solutions for the semiconductor and related electronics industries worldwide. The company operates through three segments: Semiconductor Process Control; Specialty Semiconductor Process; and PCB and Component Inspection. It offers inspection and review tools to identify, locate, characterize, review, and analyze defects on various surfaces of patterned and u	329938993152.0	38.0	3.54	47.059954466062436	6.932351532134029		6910338000.0	5884257000.0	749936000.0	6088282000.0	4692453000.0	0.7855013952228337	2.8643994553031438	1.134235975074935	71.11708810477683	6.932351532134029	10.258725019226544	0.6318080890198314	매우 불리	불리(<1)	22.364703064268056	79.17104884750891	-68.65009465736125	보류	충분
TER	TER	Global Semicon / PCB / Memory / OSAT	456.4049987792969	41.144550796254386	131.41922520756268		-0.13019720365494702	376.28362503051756	259.81412452697754	Y	Y	상승전환/양호	Teradyne, Inc.	NMS	USD	Technology	Semiconductor Equipment & Materials	Semiconductor Equipment & Materials	Teradyne, Inc. engages in the design, development, manufacture, and sale of automated test systems and robotics products in the United States, Asia Pacific, Europe, the Middle East, and Africa. The company operates through Semiconductor Test, Robotics, and Other segments. The Semiconductor Test segment offers products and services for wafer level and device package testing, and system level testing of semiconductor devices in automotive, industrial, communications, consumer, smartphones, cloud, 	71446626304.0	12.0	5.38	2.1525816229451378	-8.171225703081175		350245000.0	89244000.0	200000000.0	283239000.0	2795752000.0	1.6672888419670606	2.8772184710212447	0.6304090618456564	84.5237379065669	-8.171225703081175		0.04529821316174135	판정불가	불리(<1)	0.0	0.0	-100.0	보류	일부부족
ON	ON	Global Semicon / PCB / Memory / OSAT	118.41999816894531	87.67036613719151	110.07628244243763		-11.580673004576836	114.95324954986572	69.95204996109008	Y	Y	상승전환/양호	ON Semiconductor Corporation	NMS	USD	Technology	Semiconductors	Semiconductors	ON Semiconductor Corporation provides intelligent sensing and power solutions in Hong Kong, Singapore, the United Kingdom, the United States, and internationally. It operates through three segments: Power Solutions Group, Analog and Mixed-Signal Group, and Intelligent Sensing Group. The Power Solutions Group segment offers discrete, module, and integrated semiconductor devices designed to enable power conversion, including power switching, signal conditioning, and circuit protection technologies	46042075136.0		1.37	-92.30671414038657	-60.08129925266221		2947600000.0	2980500000.0	794000000.0	3004800000.0	7673300000.0	-0.08461864707278084	3.6486326060014256	3.0810949691082246	86.49972030366284	-60.08129925266221		-0.6945837401756091	판정불가	불리(<1)	0.0	0.0	-100.0	보류	일부부족
NXPI	NXPI	Global Semicon / PCB / Memory / OSAT	301.2099914550781	52.42649183985662	31.56721771773734		-9.456825293179083	304.36949996948243	235.34915008544922	N	Y	상승전환/양호	NXP Semiconductors N.V.	NMS	USD	Technology	Semiconductors	Semiconductors	NXP Semiconductors N.V. provides semiconductor products in the United States, Germany, Japan, South Korea, Taiwan, Singapore, the Netherlands, Mainland China, Hong Kong, and internationally. The company's product portfolio includes microcontrollers; application processors; communication processors; wireless connectivity solutions, such as near field communications, ultra-wideband, Bluetooth low-energy, Zigbee, Thread, and Wi-Fi and Wi-Fi/Bluetooth integrated SoCs; analog and interface products; 	76046811136.0	1.38	10.47	-19.48207171314741	-10.158612961649794		2906000000.0	10972000000.0	1250000000.0	12222000000.0	10056000000.0	-31.94821375956491	9.042619887563438	3.002098251748079	31.82026792881022	-10.158612961649794		-0.27588117677983465	판정불가	불리(<1)	0.0	0.0	-100.0	보류	일부부족
QCOM	QCOM	Global Semicon / PCB / Memory / OSAT	205.23500061035156	57.44916839310852	17.802203634678214		-18.239583651832636	212.10562591552736	167.7719748687744	N	Y	상승전환/양호	QUALCOMM Incorporated	NMS	USD	Technology	Semiconductors	Semiconductors	QUALCOMM Incorporated engages in the development and commercialization of foundational technologies for the wireless industry worldwide. It operates through three segments: Qualcomm CDMA Technologies (QCT); Qualcomm Technology Licensing (QTL); and Qualcomm Strategic Initiatives (QSI). The QCT segment develops and supplies integrated circuits and system software with connectivity and computing technologies for use in mobile devices; automotive systems for connectivity, digital cockpit, and ADAS/A	216307154944.0	1.86	9.3	-45.365805561033326	-24.61885768137453		14790000000.0	14811000000.0	1364000000.0	14811000000.0	21206000000.0	-0.019924098671726755	12.163187855787477	5.926468594350468	22.070422011722933	-24.61885768137453		-1.0311926826449411	판정불가	불리(<1)	0.0	0.0	-100.0	보류	일부부족
TXN	TXN	Global Semicon / PCB / Memory / OSAT	310.4700012207031	57.78319585276095	73.62151241711427		-6.56374071226602	299.9832504272461	212.76805068969728	Y	Y	상승전환/양호	Texas Instruments Incorporated	NMS	USD	Technology	Semiconductors	Semiconductors	Texas Instruments Incorporated designs, manufactures, and sells semiconductors to electronics designers and manufacturers in the United States, China, the rest of Asia, Europe, the Middle East, Africa, Japan, and internationally. It operates through Analog and Embedded Processing segments. The Analog segment offers power products to manage power requirements across various voltage levels, including battery-management solutions, DC/DC switching regulators, AC/DC and isolated controllers and conve	282556497920.0	1.87	5.85	4.209210252135853	-17.008653159691033		6537000000.0	13548000000.0	500000000.0	14048000000.0	16273000000.0	-7.703610081666937	2.8601479164996486	0.921231650482863	54.38865150467864	-17.008653159691033		-0.2783421309570209	판정불가	불리(<1)	0.0	0.0	-100.0	보류	일부부족
INTC	INTC	Global Semicon / PCB / Memory / OSAT	129.75	175.01059593203533	256.75007921501776		-7.939550338846013	115.86999988555908	57.69709999084473	Y	Y	상승전환/양호	Intel Corporation	NMS	USD	Technology	Semiconductors	Semiconductors	Intel Corporation designs, develops, manufactures, markets, sells, and services computing and related end products and services in the United States, Ireland, Israel, and internationally. It operates through three segments: CCG, DCAI, and Intel Foundry. The company offers client computing group products, including client and commercial CPUs, discrete client GPUs, edge computing, and connectivity products; data center and AI products, such as server CPUs, discrete GPUs, and networking products; a	652123504640.0	0.3853564547206166	-0.61				60567000000.0	44086000000.0	2499000000.0	46585000000.0	114281000000.0	3.2791484281734977	-0.9846796657381616	-0.7589053300486794					판정불가	판정불가				보류	일부부족
MCHP	MCHP	Global Semicon / PCB / Memory / OSAT	95.02999877929688	45.84099668268886	43.46316703502531		-7.666148008180917	95.23400001525879	73.17004991531373	N	Y	상승전환/양호	Microchip Technology Incorporat	NMS	USD	Technology	Semiconductors	Semiconductors	Microchip Technology Incorporated develops, manufactures, and sells smart, connected, and secure embedded control solutions in the Americas, Europe, and Asia. It operates through two segments, Semiconductor Products and Technology Licensing. The company offers general purpose 8-bit, 16-bit, 32-bit, and 64-bit mixed-signal microcontrollers; 32-bit and 64-bit embedded mixed-signal microprocessors; and specialized mixed-signal microcontrollers for automotive, industrial, computing, communications, 	51513794560.0	1.97	0.22		-53.15729227199735		240300000.0	5496400000.0	999400000.0	5535200000.0	6432400000.0	-9.696183167716384	1.6067760390938093	1.690809280999233	476.0280997591512	-53.15729227199735		-0.10752998047362292	판정불가	불리(<1)	0.0	0.0	-100.0	보류	일부부족
MPWR	MPWR	Global Semicon / PCB / Memory / OSAT	1445.0799560546875	29.179546234023057	52.89263163006479		-14.486745082323004	1566.4547485351563	1157.275849609375	N	Y	상승전환/양호	Monolithic Power Systems, Inc.	NMS	USD	Technology	Semiconductors	Semiconductors	Monolithic Power Systems, Inc. provides semiconductor-based power electronics solutions in China, Taiwan, South Korea, Southeast Asia, Europe, the United States, Japan, and internationally. The company offers direct current (DC) to DC solutions to convert and control voltages within a range of electronic systems, such as cloud-based and on-premises CPU servers and workstations, AI systems, memory, storage solutions, notebooks, infotainment, power sources, home appliances, network infrastructure,	70996779008.0	56.00000000000001	13.92	-60.96354529797281	12.398408861499366		1413788000.0	0.0	0.0	19972000.0	3531497000.0	28.776470588235295	13.500122124974558	0.934212814205255	101.74594004787731	12.398408861499366	8.206370767770677	0.6722470580085456	매우 불리	불리(<1)	33.29681772299873	463.49170270414237	-67.92622437518591	보류	충분
QRVO	QRVO	Global Semicon / PCB / Memory / OSAT	96.93000030517578	20.05202238018784	12.12261853890868		-10.440730574950951	97.2023754119873	87.36769981384278	N	Y	상승전환/양호	Qorvo, Inc.	NMS	USD	Technology	Semiconductors	Semiconductors	Qorvo, Inc. engages in development and commercialization of technologies and products for wireless, wired, and power markets in the United States, China, rest of Asia, Taiwan, and Europe. It operates through three segments: High Performance Analog (HPA), Connectivity and Sensors Group (CSG), and Advanced Cellular Group (ACG). The HPA segment supplies radio frequency, analog mixed signal, and power management solutions for defense and aerospace markets, as well as offers compound semiconductor fo	8534245376.0		3.62	509.528005034613	48.674328044757466		1219015000.0	1549154000.0	438740000.0	1549154000.0	3344299000.0	-3.750996734336948	7.721084427416181	7.965629220166109	27.812430121412355	48.674328044757466	0.5713983374529179	1.7500925964496667	헐값	양호(>=1.5)	60.0	217.20000000000002	124.0792317302842	양호	충분
SWKS	SWKS	Global Semicon / PCB / Memory / OSAT	71.20999908447266	26.730736474202654	9.150829883792056		-14.636776974922139	72.73499975204467	66.37289989471435	N	Y	상승전환/양호	Skyworks Solutions, Inc.	NMS	USD	Technology	Semiconductors	Semiconductors	Skyworks Solutions, Inc., together with its subsidiaries, develops, manufactures, and markets analog and mixed-signal semiconductor products and solutions in the United States, Taiwan, China, South Korea, Europe, the Middle East, Africa, and the Asia Pacific. The company offers amplifiers, antenna tuners, attenuators, automotive tuners and digital radios, wireless ASoC, DC/DC converters, demodulators, detectors, digital power isolators, diodes, directional couplers, diversity receive modules, fi	10710409216.0	3.87	2.4	-19.949664429530202	-27.942857206650984		1587100000.0	496400000.0	499400000.0	1203100000.0	5757100000.0	7.251707168019662	7.1533068140390155	10.04536849600774	26.64928829852208	-27.942857206650984		-0.9033208293215853	판정불가	불리(<1)	0.0	0.0	-100.0	보류	일부부족
COHR	COHR	Global Semicon / PCB / Memory / OSAT	392.1199951171875	44.140561241173785	105.31993082490385		-8.144959670674101	372.9477508544922	229.95525024414061	Y	Y	상승전환/양호	Coherent Corp.	NYQ	USD	Technology	Scientific & Technical Instruments	Scientific & Technical Instruments	Coherent Corp. develops, manufactures, and markets engineered materials, optoelectronic components and devices, and laser systems for the use in the industrial, communications, electronics, and instrumentation markets worldwide. It operates through three segments: Networking, Materials, and Lasers. The Networking segment offers transceivers, systems, subsystems, modules, components, optics, and semiconductor devices for datacenter and communications applications. The Materials segment provides e	76661268480.0		2.12	1118.3	-40.53482550949392		909200000.0	3498615000.0	188306000.0	3893658000.0	8127775000.0	-13.235657263398496	0.9853029494004428	0.2512758751580569	191.20549640593677	-40.53482550949392		-0.21199613123796868	판정불가	불리(<1)	0.0	0.0	-100.0	보류	일부부족
AMKR	AMKR	Global Semicon / PCB / Memory / OSAT	84.0	68.23552871337053	105.93282205106327		-10.208447611139192	74.87574996948243	49.05420003890991	Y	Y	상승전환/양호	Amkor Technology, Inc.	NMS	USD	Technology	Semiconductor Equipment & Materials	Semiconductor Equipment & Materials	Amkor Technology, Inc. provides outsourced semiconductor packaging and test services in the United States, Japan, Europe, and the Asia Pacific. It offers turnkey packaging and test services, including semiconductor wafer bump, wafer probe, wafer back-grind, package design, packaging, burn-in, system-level and final test, and drop shipment services; flip chip scale package products for smartphones, tablets, and other mobile consumer electronic devices; flip chip stacked chip scale packages that a	20821291008.0	38.0	1.74	5.616476277640303	-21.25788348738783		2604423000.0	1282816000.0	162430000.0	1560981000.0	4471106000.0	5.3318012447027305	0.7705251132358287	0.9172918014712248	45.2116084800559	-21.25788348738783		0.3703057041201616	판정불가	불리(<1)	0.0	0.0	-100.0	보류	일부부족
