티커	종목코드	유니버스	현재가	3M수익률(보조,%)	6M수익률(보조,%)	12M수익률(보조,%)	52주고점대비(보조,%)	40일이평(보조)	200일이평(보조)	40일선상회(보조)	200일선상회(보조)	추세판정(보조)	종목명	시장	통화	섹터	산업	업종	사업설명	시가총액	배당수익률(%)	EPS(FY)	EPS Growth 1Y(%)	EPS Growth 3Y CAGR(%)	EPS Growth 5Y CAGR(%)	현금및단기투자	장기부채	단기위험부채	총부채	주주지분	주당순현금(린치식)	주당잉여현금흐름	잉여현금흐름수익률(%)	순현금차감PER(린치식)	사용연성장률(%)	린치PER배수	배당감안점수	린치PER판정	배당감안점수판정	그레이엄적정PER(3년)	그레이엄내재가치(3년)	그레이엄괴리율(3년,%)	종합판정	데이터상태
009150.KS	009150.KS	Global Semicon / PCB / Memory / OSAT	1964000.0	359.4152046783626	645.3510436432637		-13.480176211453742	1461075.0	538154.0	Y	Y	상승전환/양호	SamsungElecMech	KSC	KRW	Technology	Electronic Components	Electronic Components	Samsung Electro-Mechanics Co., Ltd. manufactures and sells various electronic components in Korea, China, Southeast Asia, Japan, the Americas, and Europe. The company operates through three segments: Component, Package Solution, and Optics Solution. It offers multilayer ceramic capacitors, inductors, tantalums, and chip resistors; camera modules; package substrates; and semiconductor PKG boards. The company is also involved in the real estate and real estate software, as well as investment busin	150867856588800.0	12.0	9713.540572348942	3.9731852611235574	-10.36699722244878		2741115492930.0	188444338600.0	2003354614630.0	2277190879280.0	9541761553950.0	35115.44046859304	3353.3490806410505	0.17074078822001276	198.57687782993028	-10.36699722244878		0.008223529322229512	판정불가	불리(<1)	0.0	0.0	-100.0	보류	일부부족
011070.KS	011070.KS	Global Semicon / PCB / Memory / OSAT	957000.0	229.99999999999997	232.86956521739128		-37.450980392156865	935000.0	393284.5	Y	Y	상승전환/양호	LG Innotek	KSC	KRW	Technology	Electronic Components	Electronic Components	LG Innotek Co., Ltd. engages in the manufacture and sale of electronic materials and components for mobile, display, semiconductor, automobile, and Internet of Things (IoT) fields in South Korea and internationally. It offers optics solutions, including camera and 3D sensing modules, and actuators; substrates and materials comprising package and tape substrates, and display masks; automotive components, such as connectivity, autonomous driving, electrification, and lighting solutions; and electr	22552275582976.0	20.0	14420.83707892161	-24.041453545052683	-29.642622092696946		1409003000000.0	1540157000000.0	722253000000.0	2282210000000.0	5763054000000.0	-5542.2240573192585	24377.182250194353	2.5472499738970065	66.74662634280992	-29.642622092696946		-0.14446605950048394	판정불가	불리(<1)	0.0	0.0	-100.0	보류	일부부족
222800.KS	222800.KS	Global Semicon / PCB / Memory / OSAT	117700.0	107.21830985915494	134.46215139442234		-12.229679343773302	111615.0	63545.75	Y	Y	상승전환/양호	222800.KS,0P00016I7F,139578	KOE	KRW						0.7306711979609175					55114333000.0	130960931420.0	444465223250.0	587056910110.0	575653321790.0								판정불가	판정불가				판정불가	핵심부족
272210.KS	272210.KS	Global Semicon / PCB / Memory / OSAT	82600.0	-33.387096774193544	56.73624288425047		-49.23171481253842	104910.0	86936.0	N	N	중립	HANWHA SYSTEMS	KSC	KRW	Industrials	Aerospace & Defense	Aerospace & Defense	Hanwha Systems Co., Ltd. manufacture and sell various military equipments in South Korea and internationally. The company offers electro-optics, infra-red, and synthetic aperture radar (SAR) payloads to be mounted on mid-to-large sized satellites, as well as the system and payload development solutions for micro-satellites; avionics solutions for fixed wing, rotary wing, and unmanned aircrafts; and terminals for military satellite communication networks, including network controllers. It also pr	14772467662848.0	61.0	1295.4037454857798	-46.6802244215234			414802712120.0	1073225847000.0	401210396000.0	1609895393000.0	4849228707420.0	-3521.1062225392175	-1296.420434638016	-1.5695162646949348	66.48205744552914	-46.6802244215234		0.21539308692739012	판정불가	불리(<1)	8.5	11010.931836629128	-86.66957404766448	보류	일부부족
353200.KQ	353200.KQ	Global Semicon / PCB / Memory / OSAT	138100.0	74.36868686868688	201.528384279476		-27.65845992666317	144867.5	70407.75	N	Y	상승전환/양호	353200.KQ,0P0001JYFD,174188	KOE	KRW						1.1585807385952207		100.33612913869962	-36.27084611105344		422917053930.0	6581568000.0	41020349000.0	41211519000.0	897305160160.0					-36.27084611105344			판정불가	판정불가				판정불가	핵심부족
