티커	종목코드	유니버스	현재가	3M수익률(보조,%)	6M수익률(보조,%)	12M수익률(보조,%)	52주고점대비(보조,%)	40일이평(보조)	200일이평(보조)	40일선상회(보조)	200일선상회(보조)	추세판정(보조)	종목명	시장	통화	섹터	산업	업종	사업설명	시가총액	배당수익률(%)	EPS(FY)	EPS Growth 1Y(%)	EPS Growth 3Y CAGR(%)	EPS Growth 5Y CAGR(%)	현금및단기투자	장기부채	단기위험부채	총부채	주주지분	주당순현금(린치식)	주당잉여현금흐름	잉여현금흐름수익률(%)	순현금차감PER(린치식)	사용연성장률(%)	린치PER배수	배당감안점수	린치PER판정	배당감안점수판정	그레이엄적정PER(3년)	그레이엄내재가치(3년)	그레이엄괴리율(3년,%)	종합판정	데이터상태
TSM	TSM	Global Semicon / PCB / Memory / OSAT	414.1000061035156	27.125934339705804	35.83284983300719		0.0	362.25075073242186	307.90235015869143	Y	Y	상승전환/양호	Taiwan Semiconductor Manufactur	NYQ	USD	Technology	Semiconductors	Semiconductors	Taiwan Semiconductor Manufacturing Company Limited, together with its subsidiaries, manufactures, packages, tests, and sells integrated circuits and other semiconductor devices in Taiwan, China, Europe, the Middle East, Africa, Japan, the United States, and internationally. It provides various wafer fabrication processes, such as processes to manufacture complementary metal- oxide-semiconductor (CMOS) logic, mixed-signal, radio frequency, embedded memory, bipolar CMOS mixed-signal, and others. T	2146651078656.0	89.0	11.6	46.54981153856048	19.574951863097922		3488739000000.0	896062000000.0	136925700000.0	1064582700000.0	5355038700000.0	499.89915933981183	191.34243405830634	46.20681749289206	-7.396478727266914	19.574951863097922	-0.37785424858236927		판정불가	판정불가	47.649903726195845	552.7388832238718	33.47956413352469	보류	충분
ASML	ASML	Global Semicon / PCB / Memory / OSAT	1521.0250244140625	13.583074000882212	42.57560797442477		-0.3593153871558674	1398.6341278076172	1126.9975735473633	Y	Y	상승전환/양호	ASML Holding N.V. - New York Re	NMS	USD	Technology	Semiconductor Equipment & Materials	Semiconductor Equipment & Materials	ASML Holding N.V. provides lithography solutions for the development, production, marketing, sales, upgrading, and servicing of advanced semiconductor equipment systems. The company offers lithography, metrology, and inspection systems. It also provides extreme ultraviolet lithography systems; and deep ultraviolet lithography systems comprising immersion and dry lithography systems solutions to manufacture various range of semiconductor nodes and technologies. In addition, the company offers met	586229940224.0	61.0	30.3	26.913730255164037	19.548786436855625		13727800000.0	2709000000.0	1681900000.0	4390900000.0	19612200000.0	28.589244865047895	28.611298861976138	1.8810537895652266	49.25530625574305	19.548786436855625	2.519609409762709	1.635332161343811	매우 불리	양호(>=1.5)	47.59757287371125	1442.206458073451	-5.181937514208523	보류	충분
ARM	ARM	Global Semicon / PCB / Memory / OSAT	225.84730529785156	115.29771402542339	33.890985952288524		-3.816997723236071	163.012308883667	142.09316181182862	Y	Y	상승전환/양호	Arm Holdings plc	NMS	USD	Technology	Semiconductors	Semiconductors	Arm Holdings plc architects, develops, and licenses central processing unit products and related technologies for semiconductor companies and original equipment manufacturers. The company is involved in the licensing, marketing, research, and development of microprocessors, systems intellectual property (IPs), graphics processing units, physical IP and associated systems IPs, software, tools, and other related services. It also offers arm central processing units, accelerators, system IP product	239849521152.0		0.75	158.82352941176472	12.992845523476216		3565000000.0	0.0	40000000.0	356000000.0	6839000000.0	3.356878346226849	0.14877609500809036	0.06587463809314958	296.6539026021663	12.992845523476216	22.832096484650346	0.04379799291196426	매우 불리	불리(<1)	34.48569104695243	25.864268285214322	-88.54789599942136	보류	충분
NVDA	NVDA	Global Semicon / PCB / Memory / OSAT	204.58999633789062	17.452203611232097	-1.1069259913344731		-5.5491455789629445	188.78174934387206	184.2702001953125	Y	Y	상승전환/양호	NVIDIA Corporation	NMS	USD	Technology	Semiconductors	Semiconductors	NVIDIA Corporation operates as a data center scale AI infrastructure company. The company operates through two segments, Compute & Networking, and Graphics segments. The Compute & Networking segment provides data center accelerated computing and networking platforms and artificial intelligence solutions and software, and automotive platforms and autonomous and electric vehicle solutions, including software. The Graphics segment offers GeForce GPUs for gaming and PCs; Quadro/NVIDIA RTX GPUs for e	4972316983296.0	2.0	4.89	64.74615806805708	201.79613706779188		114507000000.0	7469000000.0	999000000.0	11040000000.0	157293000000.0	4.4048559670781895	3.9784362139917695	1.9445898065422431	40.93765651754856	201.79613706779188	0.20286640325426977	4.97820721565807	매우 유망	안심(>=2)	60.0	293.4	43.40877132400707	매우 유망	충분
AMD	AMD	Global Semicon / PCB / Memory / OSAT	415.25	107.4279409240428	59.92682833089118		0.0	256.6530002593994	214.57084968566895	Y	Y	상승전환/양호	Advanced Micro Devices, Inc.	NMS	USD	Technology	Semiconductors	Semiconductors	Advanced Micro Devices, Inc. operates as a semiconductor company internationally. It operates in three segments: Data Center, Client and Gaming, and Embedded. The company offers artificial intelligence (AI) accelerators, microprocessors, and graphics processing units (GPUs) as standalone devices or as incorporated into accelerated processing units, chipsets, and data center and professional GPUs; and embedded processors and semi-custom system-on-chip (SoC) products, microprocessor and SoC develo	675805331456.0		2.59	164.16819012797075	48.64092188805236		15565000000.0	2348000000.0	874000000.0	3847000000.0	62999000000.0	8.106904019118593	4.131043244969639	0.9948328103478963	157.1981065563249	48.64092188805236	3.231807713639107	0.30942434965413573	매우 불리	불리(<1)	60.0	155.39999999999998	-62.57676098735703	보류	충분
AVGO	AVGO	Global Semicon / PCB / Memory / OSAT	424.6700134277344	37.85750048889549	17.134196035399896		-0.6294393523098019	361.9625015258789	342.1404006958008	Y	Y	상승전환/양호	Broadcom Inc.	NMS	USD	Technology	Semiconductors	Semiconductors	Broadcom Inc. designs, develops, and supplies various semiconductor devices and infrastructure software solutions internationally. The company operates in two segments: Semiconductor Solutions and Infrastructure Software. The company offers networking connectivity, such as custom silicon solutions, ethernet switching & routing, ethernet NIC controllers, physical layer devices, and fiber optic components; wireless device connectivity, including RF semiconductor devices, connectivity solutions, cu	2009901694976.0	61.0	5.13	292.2985581000848	26.2400569832006		16178000000.0	61984000000.0	3152000000.0	65136000000.0	81292000000.0	-9.674595604142553	5.6844532613607965	1.3385577228489935	84.6675651134263	26.2400569832006	3.226653248795616	1.030383439825251	매우 불리	보통(1~1.5)	60.0	307.8	-27.520194440953148	보류	충분
MU	MU	Global Semicon / PCB / Memory / OSAT	646.6900024414062	70.45071503555411	175.53899056250063		0.0	446.74000244140626	284.6292504119873	Y	Y	상승전환/양호	Micron Technology, Inc.	NMS	USD	Technology	Semiconductors	Semiconductors	Micron Technology, Inc. designs, develops, manufactures, and sells memory and storage products in the United States, Taiwan, Japan, Mainland China, Hong Kong, Europe, and internationally. It operates through the Cloud Memory Business Unit; Core Data Center Business Unit; Mobile and Client Business Unit; and Automotive and Embedded Business Unit segments. The company provides memory products, including dynamic random access memory components and modules, CXL-based memory, LPDDR components and mod	728995463168.0	9.0	21.19	997.5578406169666	-0.5711543545194875		10972000000.0	11533000000.0	106000000.0	15278000000.0	54165000000.0	-0.4974577113305591	1.4790721256673307	0.22871424022073744	30.542117043545858	-0.5711543545194875		0.27597450541699403	판정불가	불리(<1)	7.357691290961025	155.90947845546413	-75.89115683451587	보류	일부부족
MRVL	MRVL	Global Semicon / PCB / Memory / OSAT	168.39999389648438	128.400903606697	86.34501358677184		-0.20741102430555935	123.18550033569336	89.83255001068115	Y	Y	상승전환/양호	Marvell Technology, Inc.	NMS	USD	Technology	Semiconductors	Semiconductors	Marvell Technology, Inc., together with its subsidiaries, provides data infrastructure semiconductor solutions and spanning the data center core to network edge in the United States, Argentina, China, India, Israel, Japan, Singapore, South Korea, Taiwan, Vietnam, and internationally. The company develops and scales system-on-a-chip architectures, integrating analog, mixed-signal, and digital signal processing functionality. It offers a portfolio of ethernet solutions, including spanning controll	147258769408.0	14.000000000000002	3.07	97.89999999999999			2638800000.0	3970800000.0	499800000.0	4790300000.0	14308400000.0	-1.5232288192331014	1.5917283734914067	0.9452069068778255	55.34958394648778	97.89999999999999	0.5653685796372604	2.021695413432292	헐값	안심(>=2)	8.5	26.095	-84.50415620796244	양호	충분
AMAT	AMAT	Global Semicon / PCB / Memory / OSAT	421.9700012207031	41.79099212582922	77.51461415279446		0.0	374.73424835205077	272.5847999572754	Y	Y	상승전환/양호	Applied Materials, Inc.	NMS	USD	Technology	Semiconductor Equipment & Materials	Semiconductor Equipment & Materials	Applied Materials, Inc. provides materials engineering solutions, equipment, services, and software to the semiconductor and related industries in the United States, China, Korea, Taiwan, Japan, Southeast Asia, Europe, and internationally. The company operates through Semiconductor Systems and Applied Global Services (AGS) segments. The Semiconductor Systems segment includes semiconductor capital equipment to enable materials engineering steps, including etch, rapid thermal processing, depositio	334879555584.0	52.0	9.74	-2.4940783056987548	2.3602035200739557		9905000000.0	6455000000.0	100000000.0	7050000000.0	20415000000.0	4.3472241758304655	7.179850247502026	1.7015072698845117	42.87708183212245	2.3602035200739557	18.166688367102733	1.267814907108455	매우 불리	보통(1~1.5)	13.220407040147911	128.76676457104065	-69.48437941120564	보류	충분
LRCX	LRCX	Global Semicon / PCB / Memory / OSAT	292.29998779296875	39.336442698947984	81.28254641206962		0.0	242.94099922180175	176.86144943237304	Y	Y	상승전환/양호	Lam Research Corporation	NMS	USD	Technology	Semiconductor Equipment & Materials	Semiconductor Equipment & Materials	Lam Research Corporation designs, manufactures, markets, refurbishes, and services semiconductor processing equipment used in the fabrication of integrated circuits in the United States, China, Korea, Taiwan, Japan, Southeast Asia, and Europe. The company offers ALTUS systems to deposit conformal or selective films for tungsten or molybdenum metallization applications; SABRE electrochemical deposition products for copper interconnect transition that offers copper damascene manufacturing; SPEED g	365541883904.0	38.0	5.3	39.98265831925203	5.177109335177765		6428300000.0	3719694000.0	749670000.0	4484505000.0	9861619000.0	2.1658954189726134	4.329284782711258	1.4811101483102418	54.742281579999265	5.177109335177765	10.573908727025096	0.7887341939169928	매우 불리	불리(<1)	18.85421867035553	99.9273589528843	-65.81342349433787	보류	충분
KLAC	KLAC	Global Semicon / PCB / Memory / OSAT	1769.25	35.34447450709914	45.122789732252144		-8.565891472868215	1638.7029937744142	1272.7012466430665	Y	Y	상승전환/양호	KLA Corporation	NMS	USD	Technology	Semiconductor Equipment & Materials	Semiconductor Equipment & Materials	KLA Corporation, together with its subsidiaries, designs, manufactures, and markets process control, process-enabling, and yield management solutions for the semiconductor and related electronics industries worldwide. The company operates through three segments: Semiconductor Process Control; Specialty Semiconductor Process; and PCB and Component Inspection. It offers inspection and review tools to identify, locate, characterize, review, and analyze defects on various surfaces of patterned and u	231112736768.0	44.0	35.35	47.059954466062436	6.932351532134029		6910338000.0	5884257000.0	749936000.0	6088282000.0	4692453000.0	7.855013952228337	28.64399455303144	1.618990790054059	49.827298049441914	6.932351532134029	7.187647339935641	1.0221776721987936	매우 불리	보통(1~1.5)	22.364703064268056	790.5922533218758	-55.314836607496076	보류	충분
TER	TER	Global Semicon / PCB / Memory / OSAT	368.54998779296875	36.97178346187078	101.31642161365252		-11.847015013892692	336.85274810791014	213.32314952850342	Y	Y	상승전환/양호	Teradyne, Inc.	NMS	USD	Technology	Semiconductor Equipment & Materials	Semiconductor Equipment & Materials	Teradyne, Inc. engages in the design, development, manufacture, and sale of automated test systems and robotics products in the United States, Asia Pacific, Europe, the Middle East, and Africa. The company operates through Semiconductor Test, Robotics, and Other segments. The Semiconductor Test segment offers products and services for wafer level and device package testing, and system level testing of semiconductor devices in automotive, industrial, communications, consumer, smartphones, cloud, 	57840746496.0	15.0	5.39	2.1525816229451378	-8.171225703081175		350245000.0	89244000.0	200000000.0	283239000.0	2795752000.0	1.6672888419670606	2.8772184710212447	0.7806860850142013	68.06729108552908	-8.171225703081175		0.10032387344955768	판정불가	불리(<1)	0.0	0.0	-100.0	보류	일부부족
ON	ON	Global Semicon / PCB / Memory / OSAT	101.13999938964844	62.971313489490875	100.43599132916121		-1.8344165893829145	74.76599979400635	58.79720003128052	Y	Y	상승전환/양호	ON Semiconductor Corporation	NMS	USD	Technology	Semiconductors	Semiconductors	ON Semiconductor Corporation provides intelligent sensing and power solutions in Hong Kong, Singapore, the United Kingdom, the United States, and internationally. It operates through three segments: Power Solutions Group, Analog and Mixed-Signal Group, and Intelligent Sensing Group. The Power Solutions Group segment offers discrete, module, and integrated semiconductor devices designed to enable power conversion, including power switching, signal conditioning, and circuit protection technologies	39635132416.0		1.36	-92.30671414038657	-60.08129925266221		2947600000.0	2980500000.0	794000000.0	3004800000.0	7673300000.0	-0.0839493036942381	3.6197714960682728	3.5789712457114686	74.42937403922255	-60.08129925266221		-0.807225642136944	판정불가	불리(<1)	0.0	0.0	-100.0	보류	일부부족
NXPI	NXPI	Global Semicon / PCB / Memory / OSAT	293.8699951171875	29.538038581746484	39.678690037415556		-0.464027625830743	218.4322494506836	221.39640029907227	Y	Y	상승전환/양호	NXP Semiconductors N.V.	NMS	USD	Technology	Semiconductors	Semiconductors	NXP Semiconductors N.V. provides semiconductor products in the United States, Germany, Japan, South Korea, Taiwan, Singapore, the Netherlands, Mainland China, Hong Kong, and internationally. The company's product portfolio includes microcontrollers; application processors; communication processors; wireless connectivity solutions, such as near field communications, ultra-wideband, Bluetooth low-energy, Zigbee, Thread, and Wi-Fi and Wi-Fi/Bluetooth integrated SoCs; analog and interface products; 	74193674240.0	1.39	10.47	-19.48207171314741	-10.158612961649794		2906000000.0	10972000000.0	1250000000.0	12222000000.0	10056000000.0	-31.94821375956491	9.042619887563438	3.0770817156605195	31.119217657760494	-10.158612961649794		-0.2817748523784974	판정불가	불리(<1)	0.0	0.0	-100.0	보류	일부부족
QCOM	QCOM	Global Semicon / PCB / Memory / OSAT	190.9250030517578	28.232254573460523	5.646857991436094		0.0	138.85612525939942	157.12042465209962	Y	Y	상승전환/양호	QUALCOMM Incorporated	NMS	USD	Technology	Semiconductors	Semiconductors	QUALCOMM Incorporated engages in the development and commercialization of foundational technologies for the wireless industry worldwide. It operates through three segments: Qualcomm CDMA Technologies (QCT); Qualcomm Technology Licensing (QTL); and Qualcomm Strategic Initiatives (QSI). The QCT segment develops and supplies integrated circuits and system software with connectivity and computing technologies for use in mobile devices; automotive systems for connectivity, digital cockpit, and ADAS/A	201288384512.0	1.97	9.31	-45.365805561033326	-24.61885768137453		14790000000.0	14811000000.0	1364000000.0	14811000000.0	21206000000.0	-0.019924098671726755	12.163187855787477	6.370662648354214	20.509659199831315	-24.61885768137453		-1.1043020003745752	판정불가	불리(<1)	0.0	0.0	-100.0	보류	일부부족
TXN	TXN	Global Semicon / PCB / Memory / OSAT	283.0	26.95137373252696	75.27560276986796		0.0	222.14100036621093	193.99110069274903	Y	Y	상승전환/양호	Texas Instruments Incorporated	NMS	USD	Technology	Semiconductors	Semiconductors	Texas Instruments Incorporated designs, manufactures, and sells semiconductors to electronics designers and manufacturers in the United States, China, the rest of Asia, Europe, the Middle East, Africa, Japan, and internationally. It operates through Analog and Embedded Processing segments. The Analog segment offers power products to manage power requirements across various voltage levels, including battery-management solutions, DC/DC switching regulators, AC/DC and isolated controllers and conve	257665466368.0	2.02	5.84	4.209210252135853	-17.008653159691033		6537000000.0	13548000000.0	500000000.0	14048000000.0	16273000000.0	-7.703610081666937	2.8601479164996486	1.0106529740281442	49.778015424942964	-17.008653159691033		-0.3011098982499905	판정불가	불리(<1)	0.0	0.0	-100.0	보류	일부부족
INTC	INTC	Global Semicon / PCB / Memory / OSAT	109.86000061035156	126.04939106911841	178.12658382367482		0.0	62.661999988555905	41.38205003738403	Y	Y	상승전환/양호	Intel Corporation	NMS	USD	Technology	Semiconductors	Semiconductors	Intel Corporation designs, develops, manufactures, markets, sells, and services computing and related end products and services in the United States, Ireland, Israel, and internationally. It operates through three segments: CCG, DCAI, and Intel Foundry. The company offers client computing group products, including client and commercial CPUs, discrete client GPUs, edge computing, and connectivity products; data center and AI products, such as server CPUs, discrete GPUs, and networking products; a	552357396480.0	0.4551247016403962	-0.59				60567000000.0	44086000000.0	2499000000.0	46585000000.0	114281000000.0	3.2791484281734977	-0.9846796657381616	-0.8963040781608916					판정불가	판정불가				보류	일부부족
MCHP	MCHP	Global Semicon / PCB / Memory / OSAT	98.87999725341797	26.396514138272952	58.436144039692905		0.0	74.44775018692016	68.30534986495972	Y	Y	상승전환/양호	Microchip Technology Incorporat	NMS	USD	Technology	Semiconductors	Semiconductors	Microchip Technology Incorporated develops, manufactures, and sells smart, connected, and secure embedded control solutions in the Americas, Europe, and Asia. It operates through two segments, Semiconductor Products and Technology Licensing. The company offers general purpose 8-bit, 16-bit, 32-bit, and 64-bit mixed-signal microcontrollers; 32-bit and 64-bit embedded mixed-signal microprocessors; and specialized mixed-signal microcontrollers for automotive, industrial, computing, communications, 	53521006592.0	1.85	-0.3				771700000.0	5630400000.0	999400000.0	5666100000.0	7078300000.0	-8.97871305265677	1.426814651646797	1.4429760227339372					판정불가	판정불가				판정불가	일부부족
MPWR	MPWR	Global Semicon / PCB / Memory / OSAT	1587.0	39.59871408628302	58.07875166376477		-2.760931398111388	1298.5492477416992	1028.547099609375	Y	Y	상승전환/양호	Monolithic Power Systems, Inc.	NMS	USD	Technology	Semiconductors	Semiconductors	Monolithic Power Systems, Inc. provides semiconductor-based power electronics solutions in China, Taiwan, South Korea, Southeast Asia, Europe, the United States, Japan, and internationally. The company offers direct current (DC) to DC solutions to convert and control voltages within a range of electronic systems, such as cloud-based and on-premises CPU servers and workstations, AI systems, memory, storage solutions, notebooks, infotainment, power sources, home appliances, network infrastructure,	77969309696.0	50.0	13.98	-60.96354529797281	12.398408861499366		1413788000.0	0.0	0.0	19972000.0	3531497000.0	28.776470588235295	13.500122124974558	0.8506693210443956	111.4609105444753	12.398408861499366	8.989936675712764	0.5598232470620367	매우 불리	불리(<1)	33.29681772299873	465.4895117675223	-70.66858779032626	보류	충분
QRVO	QRVO	Global Semicon / PCB / Memory / OSAT	86.69499969482422	7.096977100882751	-7.357343451072329		-11.009031693392002	81.90837478637695	85.74794971466065	Y	Y	상승전환/양호	Qorvo, Inc.	NMS	USD	Technology	Semiconductors	Semiconductors	Qorvo, Inc. engages in development and commercialization of technologies and products for wireless, wired, and power markets in the United States, China, rest of Asia, Taiwan, and Europe. It operates through three segments: High Performance Analog (HPA), Connectivity and Sensors Group (CSG), and Advanced Cellular Group (ACG). The HPA segment supplies radio frequency and power management solutions for defense and aerospace, and 5G and 6G infrastructure markets. The CSG segment supplies connectivi	8042217984.0		3.63	297.5	-62.244425850818594		1021176000.0	1549215000.0	438740000.0	1549215000.0	3392312000.0	-5.695864651398541	5.227317303829898	6.0295487885467685	25.45202874551591	-62.244425850818594		-2.4455585239657838	판정불가	불리(<1)	0.0	0.0	-100.0	보류	일부부족
SWKS	SWKS	Global Semicon / PCB / Memory / OSAT	61.959999084472656	5.016947600801114	-19.04886550386349		-25.322407890947385	58.286250019073485	66.2364998626709	Y	N	상승전환/양호	Skyworks Solutions, Inc.	NMS	USD	Technology	Semiconductors	Semiconductors	Skyworks Solutions, Inc., together with its subsidiaries, develops, manufactures, and markets analog and mixed-signal semiconductor products and solutions in the United States, Taiwan, China, South Korea, Europe, the Middle East, Africa, and the Asia Pacific. The company offers amplifiers, antenna tuners, attenuators, automotive tuners and digital radios, wireless ASoC, DC/DC converters, demodulators, detectors, digital power isolators, diodes, directional couplers, diversity receive modules, fi	9324719104.0	3.91	2.61	-19.949664429530202	-27.942857206650984		1587100000.0	496400000.0	499400000.0	1203100000.0	5757100000.0	7.251707168019662	7.1533068140390155	11.545040219072007	20.961031385614174	-27.942857206650984		-1.1465493641283817	판정불가	불리(<1)	0.0	0.0	-100.0	보류	일부부족
COHR	COHR	Global Semicon / PCB / Memory / OSAT	336.82000732421875	59.63033522474823	155.16667221531725		-3.894768125357606	288.6750015258789	181.9953002166748	Y	Y	상승전환/양호	Coherent Corp.	NYQ	USD	Technology	Scientific & Technical Instruments	Scientific & Technical Instruments	Coherent Corp. develops, manufactures, and markets engineered materials, optoelectronic components and devices, and laser systems for the use in the industrial, communications, electronics, and instrumentation markets worldwide. It operates through three segments: Networking, Materials, and Lasers. The Networking segment offers transceivers, systems, subsystems, modules, components, optics, and semiconductor devices for datacenter and communications applications. The Materials segment provides e	63138263040.0		1.01	41.9	-40.53482550949392		909200000.0	3498615000.0	188306000.0	3893658000.0	8127775000.0	-13.811550144064077	1.0281741829603859	0.30525923656627624	347.1599578893889	-40.53482550949392		-0.1167612352413322	판정불가	불리(<1)	0.0	0.0	-100.0	보류	일부부족
AMKR	AMKR	Global Semicon / PCB / Memory / OSAT	75.97010040283203	73.17096478800431	100.7666493036111		-2.7271422700409054	57.30575256347656	40.228800506591796	Y	Y	상승전환/양호	Amkor Technology, Inc.	NMS	USD	Technology	Semiconductor Equipment & Materials	Semiconductor Equipment & Materials	Amkor Technology, Inc. provides outsourced semiconductor packaging and test services in the United States, Japan, Europe, and the Asia Pacific. It offers turnkey packaging and test services, including semiconductor wafer bump, wafer probe, wafer back-grind, package design, packaging, burn-in, system-level and final test, and drop shipment services; flip chip scale package products for smartphones, tablets, and other mobile consumer electronic devices; flip chip stacked chip scale packages that a	18830899200.0	43.0	1.74	5.616476277640303	-21.25788348738783		2604423000.0	1282816000.0	162430000.0	1560981000.0	4471106000.0	5.3318012447027305	0.7705251132358287	1.01424785428756	40.596723654097296	-21.25788348738783		0.5355633301313912	판정불가	불리(<1)	0.0	0.0	-100.0	보류	일부부족
