티커	종목코드	유니버스	현재가	3M수익률(보조,%)	6M수익률(보조,%)	12M수익률(보조,%)	52주고점대비(보조,%)	40일이평(보조)	200일이평(보조)	40일선상회(보조)	200일선상회(보조)	추세판정(보조)	종목명	시장	통화	섹터	산업	업종	사업설명	시가총액	배당수익률(%)	EPS(FY)	EPS Growth 1Y(%)	EPS Growth 3Y CAGR(%)	EPS Growth 5Y CAGR(%)	현금및단기투자	장기부채	단기위험부채	총부채	주주지분	주당순현금(린치식)	주당잉여현금흐름	잉여현금흐름수익률(%)	순현금차감PER(린치식)	사용연성장률(%)	린치PER배수	배당감안점수	린치PER판정	배당감안점수판정	그레이엄적정PER(3년)	그레이엄내재가치(3년)	그레이엄괴리율(3년,%)	종합판정	데이터상태
TSM	TSM	Global Semicon / PCB / Memory / OSAT	416.5899963378906	25.960748193217896	41.67318946845133		-0.6936838288699398	363.9365005493164	308.8393000793457	Y	Y	상승전환/양호	Taiwan Semiconductor Manufactur	NYQ	USD	Technology	Semiconductors	Semiconductors	Taiwan Semiconductor Manufacturing Company Limited, together with its subsidiaries, manufactures, packages, tests, and sells integrated circuits and other semiconductor devices in Taiwan, China, Europe, the Middle East, Africa, Japan, the United States, and internationally. It provides various wafer fabrication processes, such as processes to manufacture complementary metal- oxide-semiconductor (CMOS) logic, mixed-signal, radio frequency, embedded memory, bipolar CMOS mixed-signal, and others. T	2160602513408.0	84.0	11.66	46.54981153856048	19.574951863097922		3488739000000.0	896062000000.0	136925700000.0	1064582700000.0	5355038700000.0	499.89915933981183	191.34243405830634	45.93063581467065	-7.14486818198295	19.574951863097922	-0.3650005492709399		판정불가	판정불가	47.649903726195845	555.5978774474436	33.36803147735825	보류	충분
ASML	ASML	Global Semicon / PCB / Memory / OSAT	1528.8299560546875	13.233240308698214	48.409918488259194		-1.0299490063226502	1402.7807495117188	1131.2328982543945	Y	Y	상승전환/양호	ASML Holding N.V. - New York Re	NMS	USD	Technology	Semiconductor Equipment & Materials	Semiconductor Equipment & Materials	ASML Holding N.V. provides lithography solutions for the development, production, marketing, sales, upgrading, and servicing of advanced semiconductor equipment systems. The company offers lithography, metrology, and inspection systems. It also provides extreme ultraviolet lithography systems; and deep ultraviolet lithography systems comprising immersion and dry lithography systems solutions to manufacture various range of semiconductor nodes and technologies. In addition, the company offers met	589238042624.0	56.99999999999999	30.28	26.913730255164037	19.548786436855625		13727800000.0	2709000000.0	1681900000.0	4390900000.0	19612200000.0	28.589244865047895	28.611298861976138	1.8714506965712994	49.545598123832214	19.548786436855625	2.5344590204547504	1.545016900301269	매우 불리	양호(>=1.5)	47.59757287371125	1441.2545066159767	-5.728266187608522	보류	충분
ARM	ARM	Global Semicon / PCB / Memory / OSAT	218.0399932861328	96.64502046099352	35.65606861319315		-8.11631248121989	165.74712619781494	142.4581252670288	Y	Y	상승전환/양호	Arm Holdings plc	NMS	USD	Technology	Semiconductors	Semiconductors	Arm Holdings plc architects, develops, and licenses central processing unit products and related technologies for semiconductor companies and original equipment manufacturers. The company is involved in the licensing, marketing, research, and development of microprocessors, systems intellectual property (IPs), graphics processing units, physical IP and associated systems IPs, software, tools, and other related services. It also offers arm central processing units, accelerators, system IP product	231558168576.0		0.85	158.82352941176472	12.992845523476216		3565000000.0	0.0	40000000.0	356000000.0	6839000000.0	3.356878346226849	0.14877609500809036	0.06823339735332509	252.56837051753644	12.992845523476216	19.43903435634492	0.0514428845419268	매우 불리	불리(<1)	34.48569104695243	29.312837389909568	-86.55621065285831	보류	충분
NVDA	NVDA	Global Semicon / PCB / Memory / OSAT	211.86500549316406	23.2633229430109	6.630934063047844		-2.19057065870335	189.50862464904785	184.51057525634766	Y	Y	상승전환/양호	NVIDIA Corporation	NMS	USD	Technology	Semiconductors	Semiconductors	NVIDIA Corporation operates as a data center scale AI infrastructure company. The company operates through two segments, Compute & Networking, and Graphics segments. The Compute & Networking segment provides data center accelerated computing and networking platforms and artificial intelligence solutions and software, and automotive platforms and autonomous and electric vehicle solutions, including software. The Graphics segment offers GeForce GPUs for gaming and PCs; Quadro/NVIDIA RTX GPUs for e	5149379002368.0	2.0	4.9	64.74615806805708	201.79613706779188		114507000000.0	7469000000.0	999000000.0	11040000000.0	157293000000.0	4.4048559670781895	3.9784362139917695	1.8778165864301435	42.338806025731806	201.79613706779188	0.2098097943842622	4.813459712206642	매우 유망	안심(>=2)	60.0	294.0	38.767607852768336	매우 유망	충분
AMD	AMD	Global Semicon / PCB / Memory / OSAT	411.8800048828125	113.96363890016232	64.7190561311681		-2.2568189646257064	261.9827507019043	215.8873497772217	Y	Y	상승전환/양호	Advanced Micro Devices, Inc.	NMS	USD	Technology	Semiconductors	Semiconductors	Advanced Micro Devices, Inc. operates as a semiconductor company internationally. It operates in three segments: Data Center, Client and Gaming, and Embedded. The company offers artificial intelligence (AI) accelerators, microprocessors, and graphics processing units (GPUs) as standalone devices or as incorporated into accelerated processing units, chipsets, and data center and professional GPUs; and embedded processors and semi-custom system-on-chip (SoC) products, microprocessor and SoC develo	671611748352.0		2.99	164.16819012797075	48.64092188805236		15565000000.0	2348000000.0	874000000.0	3847000000.0	62999000000.0	8.105602122237363	4.130379836064813	1.0028114468047515	135.04160627443983	48.64092188805236	2.7762961932596513	0.3601921158224473	매우 불리	불리(<1)	60.0	179.4	-56.443624872966915	보류	충분
AVGO	AVGO	Global Semicon / PCB / Memory / OSAT	421.6499938964844	35.79272185613229	19.80735096081725		-1.336108117464685	363.98375091552737	342.85955062866213	Y	Y	상승전환/양호	Broadcom Inc.	NMS	USD	Technology	Semiconductors	Semiconductors	Broadcom Inc. designs, develops, and supplies various semiconductor devices and infrastructure software solutions internationally. The company operates in two segments: Semiconductor Solutions and Infrastructure Software. The company offers networking connectivity, such as custom silicon solutions, ethernet switching & routing, ethernet NIC controllers, physical layer devices, and fiber optic components; wireless device connectivity, including RF semiconductor devices, connectivity solutions, cu	1996372836352.0	61.0	5.15	292.2985581000848	26.2400569832006		16178000000.0	61984000000.0	3152000000.0	65136000000.0	81292000000.0	-9.674595604142553	5.6844532613607965	1.3481449884133847	83.75234747584989	26.2400569832006	3.1917746035944123	1.0416431253865022	매우 불리	보통(1~1.5)	60.0	309.0	-26.716469945957144	보류	충분
MU	MU	Global Semicon / PCB / Memory / OSAT	660.4818725585938	72.49911130877518	202.93164989060674		-0.9163284853944242	453.2822998046875	287.4850598907471	Y	Y	상승전환/양호	Micron Technology, Inc.	NMS	USD	Technology	Semiconductors	Semiconductors	Micron Technology, Inc. designs, develops, manufactures, and sells memory and storage products in the United States, Taiwan, Japan, Mainland China, Hong Kong, Europe, and internationally. It operates through the Cloud Memory Business Unit; Core Data Center Business Unit; Mobile and Client Business Unit; and Automotive and Embedded Business Unit segments. The company provides memory products, including dynamic random access memory components and modules, CXL-based memory, LPDDR components and mod	745071312896.0	9.0	21.2	997.5578406169666	-0.5711543545194875		10972000000.0	11533000000.0	106000000.0	15278000000.0	54165000000.0	-0.4974577113305591	1.4790721256673307	0.22393833761669468	31.178270295751148	-0.5711543545194875		0.2703435939686867	판정불가	불리(<1)	7.357691290961025	155.98305536837373	-76.38344641252272	보류	일부부족
MRVL	MRVL	Global Semicon / PCB / Memory / OSAT	166.3800048828125	124.20159942789306	89.95320452004407		-3.351721881059977	125.17775039672851	90.32325004577636	Y	Y	상승전환/양호	Marvell Technology, Inc.	NMS	USD	Technology	Semiconductors	Semiconductors	Marvell Technology, Inc., together with its subsidiaries, provides data infrastructure semiconductor solutions and spanning the data center core to network edge in the United States, Argentina, China, India, Israel, Japan, Singapore, South Korea, Taiwan, Vietnam, and internationally. The company develops and scales system-on-a-chip architectures, integrating analog, mixed-signal, and digital signal processing functionality. It offers a portfolio of ethernet solutions, including spanning controll	145492361216.0	14.000000000000002	3.06	97.89999999999999			2638800000.0	3970800000.0	499800000.0	4790300000.0	14308400000.0	-1.5232288192331014	1.5917283734914067	0.9566824899497502	54.870337811126014	97.89999999999999	0.5604733177847397	2.0393532182211227	헐값	안심(>=2)	8.5	26.01	-84.36711189044634	양호	충분
AMAT	AMAT	Global Semicon / PCB / Memory / OSAT	416.239990234375	36.925557947962595	80.82453009240784		-2.8883404936411616	376.5297477722168	273.76354988098143	Y	Y	상승전환/양호	Applied Materials, Inc.	NMS	USD	Technology	Semiconductor Equipment & Materials	Semiconductor Equipment & Materials	Applied Materials, Inc. provides materials engineering solutions, equipment, services, and software to the semiconductor and related industries in the United States, China, Korea, Taiwan, Japan, Southeast Asia, Europe, and internationally. The company operates through Semiconductor Systems and Applied Global Services (AGS) segments. The Semiconductor Systems segment includes semiconductor capital equipment to enable materials engineering steps, including etch, rapid thermal processing, depositio	330332143616.0	49.0	9.73	-2.4940783056987548	2.3602035200739557		9905000000.0	6455000000.0	100000000.0	7050000000.0	20415000000.0	4.3472241758304655	7.179850247502026	1.7249304285874167	42.33224728248145	2.3602035200739557	17.935846177008916	1.2132642800026492	매우 불리	보통(1~1.5)	13.220407040147911	128.6345605006392	-69.09605912007444	보류	충분
LRCX	LRCX	Global Semicon / PCB / Memory / OSAT	288.7449951171875	35.36402345036485	85.35434419040556		-2.835083598566268	244.8096248626709	177.84107452392578	Y	Y	상승전환/양호	Lam Research Corporation	NMS	USD	Technology	Semiconductor Equipment & Materials	Semiconductor Equipment & Materials	Lam Research Corporation designs, manufactures, markets, refurbishes, and services semiconductor processing equipment used in the fabrication of integrated circuits in the United States, China, Korea, Taiwan, Japan, Southeast Asia, and Europe. The company offers ALTUS systems to deposit conformal or selective films for tungsten or molybdenum metallization applications; SABRE electrochemical deposition products for copper interconnect transition that offers copper damascene manufacturing; SPEED g	361096118272.0	35.0	5.29	39.98265831925203	5.177109335177765		6428300000.0	3719694000.0	749670000.0	4484505000.0	9861619000.0	2.1658954189726134	4.329284782711258	1.4993453933129517	54.17374285410489	5.177109335177765	10.464090933139378	0.7416343641490417	매우 불리	불리(<1)	18.85421867035553	99.73881676618075	-65.45781971884858	보류	충분
KLAC	KLAC	Global Semicon / PCB / Memory / OSAT	1778.6099853515625	33.6265858923652	49.02596585684669		-8.082171299660857	1647.7192443847657	1277.3683969116212	Y	Y	상승전환/양호	KLA Corporation	NMS	USD	Technology	Semiconductor Equipment & Materials	Semiconductor Equipment & Materials	KLA Corporation, together with its subsidiaries, designs, manufactures, and markets process control, process-enabling, and yield management solutions for the semiconductor and related electronics industries worldwide. The company operates through three segments: Semiconductor Process Control; Specialty Semiconductor Process; and PCB and Component Inspection. It offers inspection and review tools to identify, locate, characterize, review, and analyze defects on various surfaces of patterned and u	232335409152.0	42.0	35.24	47.059954466062436	6.932351532134029		6910338000.0	5884257000.0	749936000.0	6088282000.0	4692453000.0	7.855013952228337	28.64399455303144	1.6104708052321897	50.248438461956134	6.932351532134029	7.248397348148882	0.9738084014129407	매우 불리	불리(<1)	22.364703064268056	788.1321359848064	-55.68831039543372	보류	충분
TER	TER	Global Semicon / PCB / Memory / OSAT	360.1600036621094	32.83664558549222	105.04413104298887		-13.853804240912815	338.6552490234375	214.72509967803956	Y	Y	상승전환/양호	Teradyne, Inc.	NMS	USD	Technology	Semiconductor Equipment & Materials	Semiconductor Equipment & Materials	Teradyne, Inc. engages in the design, development, manufacture, and sale of automated test systems and robotics products in the United States, Asia Pacific, Europe, the Middle East, and Africa. The company operates through Semiconductor Test, Robotics, and Other segments. The Semiconductor Test segment offers products and services for wafer level and device package testing, and system level testing of semiconductor devices in automotive, industrial, communications, consumer, smartphones, cloud, 	56380223488.0	14.000000000000002	5.39	2.1525816229451378	-8.171225703081175		350245000.0	89244000.0	200000000.0	283239000.0	2795752000.0	1.6672888419670606	2.8772184710212447	0.7988722905835373	66.51070775883903	-8.171225703081175		0.08763663015064223	판정불가	불리(<1)	0.0	0.0	-100.0	보류	일부부족
ON	ON	Global Semicon / PCB / Memory / OSAT	102.16999816894531	61.9175921388458	111.61971986784143		-3.4036102754826825	75.95499963760376	59.01895000457764	Y	Y	상승전환/양호	ON Semiconductor Corporation	NMS	USD	Technology	Semiconductors	Semiconductors	ON Semiconductor Corporation provides intelligent sensing and power solutions in Hong Kong, Singapore, the United Kingdom, the United States, and internationally. It operates through three segments: Power Solutions Group, Analog and Mixed-Signal Group, and Intelligent Sensing Group. The Power Solutions Group segment offers discrete, module, and integrated semiconductor devices designed to enable power conversion, including power switching, signal conditioning, and circuit protection technologies	40040751104.0		1.36	-92.30671414038657	-60.08129925266221		2947600000.0	2980500000.0	794000000.0	3004800000.0	7673300000.0	-0.0839493036942381	3.6197714960682728	3.5428908299310375	75.1867260828232	-60.08129925266221		-0.7990944995593856	판정불가	불리(<1)	0.0	0.0	-100.0	보류	일부부족
NXPI	NXPI	Global Semicon / PCB / Memory / OSAT	294.4200134277344	32.54400889382747	44.0270110874414		-3.0077333989093513	221.0379997253418	221.77690032958984	Y	Y	상승전환/양호	NXP Semiconductors N.V.	NMS	USD	Technology	Semiconductors	Semiconductors	NXP Semiconductors N.V. provides semiconductor products in the United States, Germany, Japan, South Korea, Taiwan, Singapore, the Netherlands, Mainland China, Hong Kong, and internationally. The company's product portfolio includes microcontrollers; application processors; communication processors; wireless connectivity solutions, such as near field communications, ultra-wideband, Bluetooth low-energy, Zigbee, Thread, and Wi-Fi and Wi-Fi/Bluetooth integrated SoCs; analog and interface products; 	74332536832.0	1.34	10.47	-19.48207171314741	-10.158612961649794		2906000000.0	10972000000.0	1250000000.0	12222000000.0	10056000000.0	-31.94821375956491	9.042619887563438	3.071333290928932	31.171750447688563	-10.158612961649794		-0.2829040023417648	판정불가	불리(<1)	0.0	0.0	-100.0	보류	일부부족
QCOM	QCOM	Global Semicon / PCB / Memory / OSAT	206.50999450683594	51.511364551046235	19.480443694943574		0.0	140.70700035095214	157.37124961853027	Y	Y	상승전환/양호	QUALCOMM Incorporated	NMS	USD	Technology	Semiconductors	Semiconductors	QUALCOMM Incorporated engages in the development and commercialization of foundational technologies for the wireless industry worldwide. It operates through three segments: Qualcomm CDMA Technologies (QCT); Qualcomm Technology Licensing (QTL); and Qualcomm Strategic Initiatives (QSI). The QCT segment develops and supplies integrated circuits and system software with connectivity and computing technologies for use in mobile devices; automotive systems for connectivity, digital cockpit, and ADAS/A	217798557696.0	1.91	9.3	-45.365805561033326	-24.61885768137453		14790000000.0	14811000000.0	1364000000.0	14811000000.0	21206000000.0	-0.019924098671726755	12.163187855787477	5.889878543086615	22.20751812962448	-24.61885768137453		-1.0225752174927314	판정불가	불리(<1)	0.0	0.0	-100.0	보류	일부부족
TXN	TXN	Global Semicon / PCB / Memory / OSAT	283.4549865722656	26.553706571668577	77.87084932644836		-2.067791534914809	224.4216251373291	194.36597564697266	Y	Y	상승전환/양호	Texas Instruments Incorporated	NMS	USD	Technology	Semiconductors	Semiconductors	Texas Instruments Incorporated designs, manufactures, and sells semiconductors to electronics designers and manufacturers in the United States, China, the rest of Asia, Europe, the Middle East, Africa, Japan, and internationally. It operates through Analog and Embedded Processing segments. The Analog segment offers power products to manage power requirements across various voltage levels, including battery-management solutions, DC/DC switching regulators, AC/DC and isolated controllers and conve	257970339840.0	1.96	5.85	4.209210252135853	-17.008653159691033		6537000000.0	13548000000.0	500000000.0	14048000000.0	16273000000.0	-7.703610081666937	2.8601479164996486	1.0090307286834295	49.77070028272351	-17.008653159691033		-0.30235968299033045	판정불가	불리(<1)	0.0	0.0	-100.0	보류	일부부족
INTC	INTC	Global Semicon / PCB / Memory / OSAT	112.41999816894531	133.04310584036932	203.59168748284776		-0.5220811929318669	64.3517499923706	41.84370003700256	Y	Y	상승전환/양호	Intel Corporation	NMS	USD	Technology	Semiconductors	Semiconductors	Intel Corporation designs, develops, manufactures, markets, sells, and services computing and related end products and services in the United States, Ireland, Israel, and internationally. It operates through three segments: CCG, DCAI, and Intel Foundry. The company offers client computing group products, including client and commercial CPUs, discrete client GPUs, edge computing, and connectivity products; data center and AI products, such as server CPUs, discrete GPUs, and networking products; a	565022883840.0	0.44476072597741695	-0.6				60567000000.0	44086000000.0	2499000000.0	46585000000.0	114281000000.0	3.2791484281734977	-0.9846796657381616	-0.8758936859778099					판정불가	판정불가				보류	일부부족
MCHP	MCHP	Global Semicon / PCB / Memory / OSAT	101.0199966430664	29.446431904086268	69.7815069631368		-1.8460955690652203	75.42950010299683	68.45434984207154	Y	Y	상승전환/양호	Microchip Technology Incorporat	NMS	USD	Technology	Semiconductors	Semiconductors	Microchip Technology Incorporated develops, manufactures, and sells smart, connected, and secure embedded control solutions in the Americas, Europe, and Asia. It operates through two segments, Semiconductor Products and Technology Licensing. The company offers general purpose 8-bit, 16-bit, 32-bit, and 64-bit mixed-signal microcontrollers; 32-bit and 64-bit embedded mixed-signal microprocessors; and specialized mixed-signal microcontrollers for automotive, industrial, computing, communications, 	54665506816.0	1.77	-0.3				771700000.0	5630400000.0	999400000.0	5666100000.0	7078300000.0	-8.97871305265677	1.426814651646797	1.4124081360724612					판정불가	판정불가				판정불가	일부부족
MPWR	MPWR	Global Semicon / PCB / Memory / OSAT	1598.969970703125	38.320399329663445	66.92974817605642		-3.2305507714177506	1313.379997253418	1033.2687994384767	Y	Y	상승전환/양호	Monolithic Power Systems, Inc.	NMS	USD	Technology	Semiconductors	Semiconductors	Monolithic Power Systems, Inc. provides semiconductor-based power electronics solutions in China, Taiwan, South Korea, Southeast Asia, Europe, the United States, Japan, and internationally. The company offers direct current (DC) to DC solutions to convert and control voltages within a range of electronic systems, such as cloud-based and on-premises CPU servers and workstations, AI systems, memory, storage solutions, notebooks, infotainment, power sources, home appliances, network infrastructure,	78557396992.0	48.0	14.04	-60.96354529797281	12.398408861499366		1413788000.0	0.0	0.0	19972000.0	3531497000.0	28.776470588235295	13.500122124974558	0.8443011671468768	111.83714388282691	12.398408861499366	9.020281967802617	0.5400567894042384	매우 불리	불리(<1)	33.29681772299873	467.48732083090215	-70.76322073607605	보류	충분
QRVO	QRVO	Global Semicon / PCB / Memory / OSAT	90.05999755859375	8.873302985461716	2.878680165308767		-7.554917623369162	82.2502498626709	85.77047470092774	Y	Y	상승전환/양호	Qorvo, Inc.	NMS	USD	Technology	Semiconductors	Semiconductors	Qorvo, Inc. engages in development and commercialization of technologies and products for wireless, wired, and power markets in the United States, China, rest of Asia, Taiwan, and Europe. It operates through three segments: High Performance Analog (HPA), Connectivity and Sensors Group (CSG), and Advanced Cellular Group (ACG). The HPA segment supplies radio frequency and power management solutions for defense and aerospace, and 5G and 6G infrastructure markets. The CSG segment supplies connectivi	7901954048.0		3.62	-5.2	-62.244425850818594		1021176000.0	1549215000.0	438740000.0	1549215000.0	3392312000.0	-6.018155708277772	5.523096385954115	6.132685471549946	26.540926316815337	-62.244425850818594		-2.345224319144538	판정불가	불리(<1)	0.0	0.0	-100.0	보류	일부부족
SWKS	SWKS	Global Semicon / PCB / Memory / OSAT	66.3499984741211	8.913329724858388	-7.834420832073519		-20.03133964331547	58.63650007247925	66.21639987945557	Y	Y	상승전환/양호	Skyworks Solutions, Inc.	NMS	USD	Technology	Semiconductors	Semiconductors	Skyworks Solutions, Inc., together with its subsidiaries, develops, manufactures, and markets analog and mixed-signal semiconductor products and solutions in the United States, Taiwan, China, South Korea, Europe, the Middle East, Africa, and the Asia Pacific. The company offers amplifiers, antenna tuners, attenuators, automotive tuners and digital radios, wireless ASoC, DC/DC converters, demodulators, detectors, digital power isolators, diodes, directional couplers, diversity receive modules, fi	9979436032.0	4.37	2.4	-19.949664429530202	-27.942857206650984		1587100000.0	496400000.0	499400000.0	1203100000.0	5757100000.0	7.251707168019662	7.1533068140390155	10.781171030213459	24.62428804420893	-27.942857206650984		-0.9573010665051402	판정불가	불리(<1)	0.0	0.0	-100.0	보류	일부부족
COHR	COHR	Global Semicon / PCB / Memory / OSAT	325.0	55.324025744502215	152.52525851317736		-7.2673841218905855	290.71100158691405	183.17445026397706	Y	Y	상승전환/양호	Coherent Corp.	NYQ	USD	Technology	Scientific & Technical Instruments	Scientific & Technical Instruments	Coherent Corp. develops, manufactures, and markets engineered materials, optoelectronic components and devices, and laser systems for the use in the industrial, communications, electronics, and instrumentation markets worldwide. It operates through three segments: Networking, Materials, and Lasers. The Networking segment offers transceivers, systems, subsystems, modules, components, optics, and semiconductor devices for datacenter and communications applications. The Materials segment provides e	60931604480.0		1.03	41.9	-40.53482550949392		909200000.0	3498615000.0	188306000.0	3893658000.0	8127775000.0	-13.811550144064077	1.0281741829603859	0.3163612870647341	328.9432525670525	-40.53482550949392		-0.12322741139440521	판정불가	불리(<1)	0.0	0.0	-100.0	보류	일부부족
AMKR	AMKR	Global Semicon / PCB / Memory / OSAT	73.73500061035156	66.55748779740658	109.17730669603279		-5.588985850256966	58.0823751449585	40.4961750125885	Y	Y	상승전환/양호	Amkor Technology, Inc.	NMS	USD	Technology	Semiconductor Equipment & Materials	Semiconductor Equipment & Materials	Amkor Technology, Inc. provides outsourced semiconductor packaging and test services in the United States, Japan, Europe, and the Asia Pacific. It offers turnkey packaging and test services, including semiconductor wafer bump, wafer probe, wafer back-grind, package design, packaging, burn-in, system-level and final test, and drop shipment services; flip chip scale package products for smartphones, tablets, and other mobile consumer electronic devices; flip chip stacked chip scale packages that a	18276880384.0	43.0	1.74	5.616476277640303	-21.25788348738783		2604423000.0	1282816000.0	162430000.0	1560981000.0	4471106000.0	5.3318012447027305	0.7705251132358287	1.044992346725031	39.31218354347634	-21.25788348738783		0.5530630596636031	판정불가	불리(<1)	0.0	0.0	-100.0	보류	일부부족
