티커	종목코드	유니버스	현재가	3M수익률(보조,%)	6M수익률(보조,%)	12M수익률(보조,%)	52주고점대비(보조,%)	40일이평(보조)	200일이평(보조)	40일선상회(보조)	200일선상회(보조)	추세판정(보조)	종목명	시장	통화	섹터	산업	업종	사업설명	시가총액	배당수익률(%)	EPS(FY)	EPS Growth 1Y(%)	EPS Growth 3Y CAGR(%)	EPS Growth 5Y CAGR(%)	현금및단기투자	장기부채	단기위험부채	총부채	주주지분	주당순현금(린치식)	주당잉여현금흐름	잉여현금흐름수익률(%)	순현금차감PER(린치식)	사용연성장률(%)	린치PER배수	배당감안점수	린치PER판정	배당감안점수판정	그레이엄적정PER(3년)	그레이엄내재가치(3년)	그레이엄괴리율(3년,%)	종합판정	데이터상태
GFS	GFS	Global Semicon / PCB / Memory / OSAT	73.3550033569336	79.04564601249157	113.1173947101384		-0.9251722719118671	52.06600046157837	40.58770011901856	Y	Y	상승전환/양호	GlobalFoundries Inc.	NMS	USD	Technology	Semiconductors	Semiconductors	GLOBALFOUNDRIES Inc., a semiconductor foundry, provides range of mainstream wafer fabrication services and technologies in the United States, Europe, the Middle East, Africa, and internationally. It offers semiconductor devices, including microprocessors, mobile application processors, baseband processors, network processors, radio frequency modems, microcontrollers, and power management units. The company was incorporated in 2008 and is headquartered in Malta, New York.	40297644032.0		1.39	-51.0	-15.135725474232498		4397000000.0	1065000000.0	86000000.0	1707000000.0	11928000000.0	6.075674901357807	1.8398427297329014	2.5081352948489744	48.40239457235668	-15.135725474232498		-0.31270612968550804	판정불가	불리(<1)	0.0	0.0	-100.0	보류	일부부족
UMC	UMC	Global Semicon / PCB / Memory / OSAT	15.319999694824219	53.660975772368566	101.57894588243268		0.0	10.645750021934509	8.593050003051758	Y	Y	상승전환/양호	United Microelectronics Corpora	NYQ	USD	Technology	Semiconductors	Semiconductors	United Microelectronics Corporation operates as a semiconductor wafer foundry in Taiwan, China, Hong Kong, Japan, Korea, the United States, Europe, and internationally. It manufactures and sells integrated circuits. The company offers circuit design; mask tooling; wafer fabrication; and assembly and testing services for communication devices, consumer electronics, computer, and other applications. It also provides venture capital and marketing support; consulting and planning; energy technical; 	38573608960.0	3.17	0.62	-17.259341564967112	-23.3089317909408		146070330000.0	45372054000.0	8408772000.0	59781672000.0	365824997000.0	40.03275707208512	19.531922995785553	127.49297248605241	-39.85928609235629	-23.3089317909408			판정불가	판정불가	0.0	0.0	-100.0	판정불가	일부부족
2330.TW	2330.TW	Global Semicon / PCB / Memory / OSAT	2310.0	30.508474576271194	59.31034482758621		0.0	1986.375	1547.5	Y	Y	상승전환/양호	TAIWAN SEMICONDUCTOR MANUFACTUR	TAI	TWD	Technology	Semiconductors	Semiconductors	Taiwan Semiconductor Manufacturing Company Limited, together with its subsidiaries, manufactures, packages, tests, and sells integrated circuits and other semiconductor devices in Taiwan, China, Europe, the Middle East, Africa, Japan, the United States, and internationally. It provides various wafer fabrication processes, such as processes to manufacture complementary metal- oxide-semiconductor (CMOS) logic, mixed-signal, radio frequency, embedded memory, bipolar CMOS mixed-signal, and others. T	59902919704576.0	1.07	73.58	46.54981153856048	19.574951863097922		3488739000000.0	896062000000.0	136925700000.0	1064582700000.0	5355038700000.0	99.97983186796236	38.26848681166127	1.656644450721267	30.035609787062214	19.574951863097922	1.5343899692384118	0.687349183501202	보통	불리(<1)	47.649903726195845	3506.0799161734903	51.77835134950175	보류	충분
2454.TW	2454.TW	Global Semicon / PCB / Memory / OSAT	3420.0	109.81595092024538	164.0926640926641		-0.2915451895043719	1967.25	1542.875	Y	Y	상승전환/양호	MEDIATEK INC	TAI	TWD	Technology	Semiconductors	Semiconductors	MediaTek Inc. engages in the research, development, production, manufacture, and marketing of multimedia integrated circuits (ICs) in Taiwan, rest of Asia, and internationally. The company offers multimedia, computer peripherals oriented, consumer-oriented, and other ICs for various applications. It also offers design, test runs, maintenance and repair, and technological consultation services for software and hardware solutions; and sale and delegation patents and circuit layout rights for its I	5458666455040.0	1.56	66.2	-1.0032496768530352	-3.7570524355304835		260128122000.0	60000000.0	4480763000.0	13730009000.0	400600988000.0	162.93960691300023	86.06802156385909	2.5166088176566985	49.20030805267371	-3.7570524355304835		-0.04465525771054777	판정불가	불리(<1)	0.985895128939033	65.26625753576398	-98.09162989661509	보류	일부부족
2303.TW	2303.TW	Global Semicon / PCB / Memory / OSAT	96.5	48.91974607304015	112.5550589353903		0.0	66.2424997329712	52.12475008010864	Y	Y	상승전환/양호	UNITED MICRO ELECTRONICS	TAI	TWD	Technology	Semiconductors	Semiconductors	United Microelectronics Corporation operates as a semiconductor wafer foundry in Taiwan, China, Hong Kong, Japan, Korea, the United States, Europe, and internationally. It manufactures and sells integrated circuits. The company offers circuit design; mask tooling; wafer fabrication; and assembly and testing services for communication devices, consumer electronics, computer, and other applications. It also provides venture capital and marketing support; consulting and planning; energy technical; 	1213679009792.0	3.12	3.94	-17.259341564967112	-23.3089317909408		146070330000.0	45372054000.0	8408772000.0	59781672000.0	365824997000.0	8.006551414417023	3.906384599157111	4.0480669421317215	22.46026613847284	-23.3089317909408		-0.8988732220033046	판정불가	불리(<1)	0.0	0.0	-100.0	보류	일부부족
3711.TW	3711.TW	Global Semicon / PCB / Memory / OSAT	540.0	75.60975609756098	175.51020408163268		0.0	408.55	256.0325	Y	Y	상승전환/양호	ASE TECHNOLOGY HOLDING CO LTD	TAI	TWD	Technology	Semiconductors	Semiconductors	ASE Technology Holding Co., Ltd., together with its subsidiaries, provides semiconductor manufacturing services in the United States, Taiwan, rest of Asia, Europe, and internationally. It operates through Packaging, Testing, and EMS. The company offers semiconductor packaging, interconnect materials production, front-end engineering testing, wafer probing, and final testing services, as well as integrated solutions for EMS (electronic manufacturing services) in relation to computing, peripherals	2369461420032.0	1.01	10.17	23.585762669903666	-13.347387041498415		111497789000.0	214080678000.0	40733681000.0	263662466000.0	342181952000.0	-23.378628938260114	-5.3782267829267285	-0.995967922764209	55.39612870582695	-13.347387041498415		-0.2227120798822298	판정불가	불리(<1)	0.0	0.0	-100.0	보류	일부부족
3037.TW	3037.TW	Global Semicon / PCB / Memory / OSAT	896.0	164.30678466076697	474.35897435897436		-1.6465422612513714	630.4625	290.2898966217041	Y	Y	상승전환/양호	UNIMICRON TECHNOLOGY	TAI	TWD	Technology	Electronic Components	Electronic Components	Unimicron Technology Corp., together with its subsidiaries, engages in the manufacturing, processing, and sale of printed circuit boards, electrical equipment, electronic products, and integrated circuit product testing and burn-in systems in Taiwan, China, Asia, the Americas, and internationally. The company offers PCB products, including HDI, ELIC, multi-layer and rigid flex PCBs, and FPC; IC carriers, such as FCCSP, FCBGA, CSP, memory module, and coreless; connectors comprising PCBeam and X-B	1410769354752.0	17.0	4.38	31.307777963397943	-39.15067182208464		55226513000.0	34873158000.0	22207016000.0	57080174000.0	100569302000.0	12.926710705429274	-7.04265502977378	-0.7860106060015378	201.61490623163715	-39.15067182208464		-0.10986624072644478	판정불가	불리(<1)	0.0	0.0	-100.0	보류	일부부족
8046.TW	8046.TW	Global Semicon / PCB / Memory / OSAT	947.0	147.9057591623037	247.5229357798165		-5.7711442786069655	682.3	345.485	Y	Y	상승전환/양호	NAN YA PRINTED CIRCUIT BOARD CO	TAI	TWD	Technology	Electronic Components	Electronic Components	Nan Ya Printed Circuit Board Corporation manufactures and sells printed circuit boards (PCBs) in Taiwan, the United States, Mainland China, Korea, and internationally. It offers conventional PCBs that are used in the motherboards of desktops and notebooks, and home electrical appliances; high density connector boards that are used in smartphones, game consoles, navigation systems, GPS, PDAs, automobile appliances, and MP3 players; and soft and hard composite boards used in high-end handheld devi	611918741504.0	11.0	3.01	855.5802618209663	-53.54257860278134		8823188000.0	0.0	0.0	1234627000.0	46122894000.0	13.654687812195082	0.9357680225344502	0.09881394113352168	310.08149906571595	-53.54257860278134		-0.13719805512732394	판정불가	불리(<1)	0.0	0.0	-100.0	보류	일부부족
4958.TW	4958.TW	Global Semicon / PCB / Memory / OSAT	427.0	150.4398826979472	161.96319018404907		-1.2716763005780396	270.25	178.9225	Y	Y	상승전환/양호	ZHEN DING TECHNOLOGY HOLDING LT	TAI	TWD	Technology	Electronic Components	Electronic Components	Zhen Ding Technology Holding Limited, together with its subsidiaries, engages in the design, development, manufacture, and sale of printed circuit boards (PCB) products in the United States, Mainland China, Taiwan, Singapore, and internationally. The company offers flexible circuit boards, substrate-like PCBs, high-density interconnect PCBs, rigid printed circuit boards, IC substrates, rigid-flex PCBs, and modules. Its products are used in various applications, including mobile phones, computers	456950218752.0	84.0	6.76	-26.026818555617737	-21.794946088339774		71187918000.0	26429839000.0	25689071000.0	53010937000.0	123981554000.0	41.82446892512295	-5.524613111730137	-1.2938204008735683	56.97862885723033	-21.794946088339774		1.0917260586864173	판정불가	보통(1~1.5)	0.0	0.0	-100.0	보류	일부부족
3044.TW	3044.TW	Global Semicon / PCB / Memory / OSAT	500.0	38.69625520110957	54.5595054095827		0.0	398.5375	333.0425	Y	Y	상승전환/양호	TRIPOD TECHNOLOGY CORP	TAI	TWD	Technology	Electronic Components	Electronic Components	Tripod Technology Corporation processes, manufactures, and sells printed circuit boards and other related components in Taiwan, China, Vietnam, Thailand, South Korea, Malaysia, Mexico, and internationally. The company offers printed circuit boards comprising any layer, double-sided, HDI, heavy copper, multi-layer, high layer count, flexible, rigid-flex, semi-flex, cavity, thermal, embedded ferrite, and hybrid lamination structure. It also engages in the manufacture and wholesale of electronic pa	262803013632.0	2.11	19.37	21.976442546571807	18.143871338410513		31846737000.0	1000000000.0	6478679000.0	7596649000.0	54083843000.0	58.68794686514233	11.10088164899183	2.2201763297983663	22.783275845888365	18.143871338410513	1.2557009152537502	0.8889797707499413	보통	불리(<1)	44.787742676821026	867.5385756500233	73.50771513000464	보류	충분
2327.TW	2327.TW	Global Semicon / PCB / Memory / OSAT	371.5	27.444253859348187	64.38053097345133		0.0	289.5875	220.591875	Y	Y	상승전환/양호	YAGEO CORP	TAI	TWD	Technology	Electronic Components	Electronic Components	Yageo Corporation, together with its subsidiaries, manufactures and sells electronic components in China, Europe, the United States, and the rest of Asia. It offers antennas, radio frequency, and microwave; capacitors; circuit protection; custom products; electromechanical devices; EMC; engineering kits; inductors; piezoelectric devices; power supplies; resistors; semiconductors; sensors; signal magnetics and connectors; and transformers. The company's products are used for various applications,	765375741952.0	1.48	11.49	22.099803869339073	1.3081472653207582		114742022000.0	62087637000.0	86197379000.0	150894630000.0	170877823000.0	25.557517385357823	11.919188744103925	3.2083953550750812	30.108135997793052	1.3081472653207582	23.01586128409673	0.09260444637041401	매우 불리	불리(<1)	11.116294530641516	127.72622415707103	-65.61878219190551	보류	충분
2408.TW	2408.TW	Global Semicon / PCB / Memory / OSAT	287.0	5.7090239410681365	162.10045662100455		-12.098009188361413	229.3375	156.0470000076294	Y	Y	상승전환/양호	NANYA TECHNOLOGY CORPORATION	TAI	TWD	Technology	Semiconductors	Semiconductors	Nanya Technology Corporation research, develops, manufactures, and sells semiconductor products in Taiwan, Japan, Malaysia, China, the United States, Thailand, Germany, Singapore, Poland and internationally. It offers standard dynamic random-access memory (DRAM), low power DRAM, MCP and eMCP, and KGD products, as well as modules; and other memory products and Elixir brands. The company engages in the import and export of its machinery, equipment, and raw materials. Its products have applications	889306218496.0	3.0059466898954708	2.09		-23.232591966740635		58074065000.0	14196100000.0	5059500000.0	23617455000.0	170399852000.0	14.160449855886213	1.5764312972202954	0.5492791976377336	130.54523930340375	-23.232591966740635		-0.15493973878155654	판정불가	불리(<1)	0.0	0.0	-100.0	보류	일부부족
2344.TW	2344.TW	Global Semicon / PCB / Memory / OSAT	114.0	10.679611650485432	146.220306433071		-12.307692307692308	98.91749992370606	65.48800004959107	Y	Y	상승전환/양호	WINBOND ELECTRONIC CORP	TAI	TWD	Technology	Semiconductors	Semiconductors	Winbond Electronics Corporation engages in the research, development, production and sales of integrated circuits, various semiconductor components and other system products. The company offers customized memory solutions, including CUBE(3DCaaS), pseudo static random access memory, DDR/SDR, LPDDR/LPSDR, Known Good Die wafer products; electrical simulation, wafer-level speed testing, and other services; redistribution layers; and failure analysis services, as well as low power SDR, DDR, DDR2, DDR	513000013824.0	51.0	0.88	559.2216984663919	-32.578077486406286		42427238000.0	26398931000.0	25731058000.0	54236531000.0	107935967000.0	3.5618458472363894	0.9584377366714482	0.8407348567293406	125.49790244632229	-32.578077486406286		0.14679068059701716	판정불가	불리(<1)	0.0	0.0	-100.0	보류	일부부족
2337.TW	2337.TW	Global Semicon / PCB / Memory / OSAT	164.5	137.37372692053208	445.6053137025509		-4.360465116279066	137.4849998474121	60.123500146865844	Y	Y	상승전환/양호	MACRONIX INTERNATIONAL	TAI	TWD	Technology	Semiconductors	Semiconductors	Macronix International Co., Ltd. engages in the design, manufacture, and supply of integrated circuits and memory chips. The company provides a range of NOR flash, NAND flash, e MMC, and read-only memory products. It also offers wafer foundry services to IC design and IDM companies; ArmorFlash, a security solution for a range of identification, authentication, and encryption requirements; and LybraFlash, a solution for gigabit flash memory. In addition, the company develops integrated circuit sy	317341237248.0	3.22200547112462	-1.77				14927643000.0	17385877000.0	6844010000.0	24966908000.0	45802485000.0	-1.2742734274484921	1.5426975739272604	0.9378100753357205					판정불가	판정불가				판정불가	일부부족
6239.TW	6239.TW	Global Semicon / PCB / Memory / OSAT	230.5	-6.490872210953347	53.666666666666664		-12.523719165085389	208.225	177.075	Y	Y	상승전환/양호	POWERTECH TECHNOLOGY INC	TAI	TWD	Technology	Semiconductors	Semiconductors	Powertech Technology Inc., together with its subsidiaries, researches, designs, develops, assembles, manufactures, packages, tests, and sells various integrated circuit (IC) products in Taiwan, Japan, Singapore, the United States, Europe, China, Hong Kong, Macao, and internationally. It provides chip probing and final test; IC packaging services, such as wafer level packing, flip chips, wire bond BGA, lead frame, and system in package; module assembly services; and quality management services. T	170292707328.0	2.99	7.46	-18.452077134528476	-13.944410754124926		16375176000.0	25413199000.0	4703164000.0	31892991000.0	56290777000.0	-12.233432187732218	-12.614909102229706	-5.472845597496619	32.53799359084882	-13.944410754124926		-0.3366652194929994	판정불가	불리(<1)	0.0	0.0	-100.0	보류	일부부족
2449.TW	2449.TW	Global Semicon / PCB / Memory / OSAT	339.0	18.324607329842934	93.71428571428571		-4.23728813559322	291.7875	218.885	Y	Y	상승전환/양호	KING YUAN ELECTRONICS CO	TAI	TWD	Technology	Semiconductors	Semiconductors	King Yuan Electronics Co., Ltd. designs, manufactures, sells, tests, and assembles integrated circuits. It offers test services, such as wafer probing; final test; burn-in; system level testing; and back end service. It also provides Technology Innovation, including wafer level chip scale package (WLCSP); high power burn in; and KYEC Bio Chip Testing, as well as equipment development, spare parts and test program, automation control, and vertical card. It also provides engineering services for M	414510546944.0	1.22	6.5	41.59903530182425	17.234581996226606		17963508000.0	30274865000.0	6357000.0	33144334000.0	50429320000.0	-10.06862183038982	-15.711436153899628	-4.634641933303725	53.70286489698305	17.234581996226606	3.1159946268926584	0.34364241147334684	매우 불리	불리(<1)	42.96916399245321	279.29956595094586	-17.610747507095613	보류	충분
8150.TW	8150.TW	Global Semicon / PCB / Memory / OSAT	98.0999984741211	48.861906225597366	210.44302939833835		0.0	65.76500034332275	44.952000036239625	Y	Y	상승전환/양호	CHIPMOS TECHNOLOGIES INC	TAI	TWD	Technology	Semiconductors	Semiconductors	ChipMOS TECHNOLOGIES INC. engages in the research and development, manufacture, and sale of integrated circuits, and related assembly and testing services in Taiwan, Japan, the People's Republic of China, and internationally. It operates through five segments: Testing; Assembly; Display Panel Driver Semiconductor Assembly and Testing; Bumping; and Others. The company offers leadframe-based packages, such as the small outline package, thin small outline package, and quad flat package; and substra	68220514304.0	1.38	0.77	-61.74913305398406	-45.70232815746953		15097129000.0	9867797000.0	5604561000.0	16327274000.0	23987112000.0	7.519694705225443	0.20879812384988078	0.2128421275204831	117.63675814142292	-45.70232815746953		-0.37677277797969594	판정불가	불리(<1)	0.0	0.0	-100.0	보류	일부부족
2368.TW	2368.TW	Global Semicon / PCB / Memory / OSAT	1450.0	124.45820433436535	263.40852130325817		-2.0270270270270285	1101.375	645.69	Y	Y	상승전환/양호	GOLD CIRCUIT ELECTRONICS CO	TAI	TWD	Technology	Electronic Components	Electronic Components	Gold Circuit Electronics Ltd. engages in the manufacturing, processing, and trading of electronic equipment products, such as printed circuit boards in Taiwan. Its products are used for AI/ Advanced Server, networking, notebook, handset products, automotive, and IC tests products. The company was founded in 1981 and is headquartered in Taoyuan City, Taiwan.	724969586688.0	42.0	18.93	71.06843481034197	28.12015612291836		18920059000.0	11874888000.0	6115928000.0	18073139000.0	33481159000.0	14.090933819220407	-9.077819268409273	-0.6260565012696051	75.85362209090225	28.12015612291836	2.697482252919655	0.9244140779314011	매우 불리	불리(<1)	60.0	1135.8	-21.66896551724138	보류	충분
3189.TW	3189.TW	Global Semicon / PCB / Memory / OSAT	492.5	138.05032923930125	239.6551724137931		-7.250470809792842	398.6625	199.1226251602173	Y	Y	상승전환/양호	KINSUS INTERCONNECT TECHNOLOGY 	TAI	TWD	Technology	Semiconductor Equipment & Materials	Semiconductor Equipment & Materials	Kinsus Interconnect Technology Corp., together with its subsidiaries, engages in the manufacture and sale of electronic products in Taiwan and internationally. It operates through the IC Substrate and Optics segments. The company offers system in package substrate, a carrier substrate that provides a platform for multiple chips or packages or passive components assembly for multi-chip module, multi-chip package, stack die, package in package, and embedded substrates, as well as modules in handse	259511025664.0	20.0	3.38	3164.40712634744	-38.842006005271955		20390405000.0	11197127000.0	3124539000.0	14437615000.0	32731765000.0	17.447001472464937	3.2466003383093898	0.659208190519673	140.5482244164305	-38.842006005271955		-0.13406079004915036	판정불가	불리(<1)	0.0	0.0	-100.0	보류	일부부족
2313.TW	2313.TW	Global Semicon / PCB / Memory / OSAT	249.5	45.90643274853801	181.28524079384925		-12.76223776223776	244.15	128.55799991607665	Y	Y	상승전환/양호	COMPEQ MANUFACTURING	TAI	TWD	Technology	Electronic Components	Electronic Components	Compeq Manufacturing Co., Ltd., together with its subsidiaries, manufactures and sells printed circuit boards for computers in Taiwan, the United States, rest of Asia, Europe, and internationally. The company offers high layer, rigid-flex, flexible, regular multi-layered, and high-density interconnection printed circuit boards. It also provides surface mount technology devices; and module assembly services. In addition, the company is involved in investment; trading; electronic manufacturing; ou	297359212544.0	1.12	5.5	17.284433058479443	-6.372141905534656		27233389000.0	7796664000.0	5205724000.0	13117147000.0	47862670000.0	16.308431822708886	3.8623136737190142	1.5480215125126309	42.39846694132566	-6.372141905534656		-0.12387575033793048	판정불가	불리(<1)	0.0	0.0	-100.0	보류	일부부족
2316.TW	2316.TW	Global Semicon / PCB / Memory / OSAT	116.5	18.274111675126914	17.795751468735578		-3.7190082644628086	107.66250019073486	97.76700004577637	Y	Y	상승전환/양호	WUS PRINTED CIRCUIT CO	TAI	TWD	Technology	Electronic Components	Electronic Components	WUS Printed Circuit Co., Ltd., together with its subsidiaries, manufactures, processes, assembles, and sells double side and multi-layer printed circuit boards in Taiwan, Asia, North America, Europe, and internationally. It operates through Manufacturing and Trading of Printed Circuit Boards; Assembly and Trading of PCB/Light Products; Investment; and Others segments. It is involved in imported commodity trading business; and assembly and sale of peripheral equipment, such as electronic products	21137178624.0	43.0	13.37	212.2520816393746	68.1394170953056		8070413000.0	1632969000.0	1087016000.0	2781002000.0	12575793000.0	35.48071761236807	-1.6873095047813267	-1.4483343388680916	6.0597817791796516	68.1394170953056	0.08893210475669205	18.340498246514613	매우 유망	안심(>=2)	60.0	802.1999999999999	588.5836909871244	보류	충분
6981.T	6981.T	Global Semicon / PCB / Memory / OSAT	5648.0	80.15948963317385	87.14380384360503		0.0	4129.075	3182.66	Y	Y	상승전환/양호	MURATA MANUFACTURING CO	JPX	JPY	Technology	Electronic Components	Electronic Components	Murata Manufacturing Co., Ltd. develops, manufactures, and sells ceramic-based passive electronic components and solutions in Japan and internationally. It operates through three segments: Components, Devices & Modules, and Other. The company offers capacitors; inductors; high frequency device and communication modules, including surface acoustic wave filters, RF modules, multilayer resin substrates, and connectivity modules; lithium-ion secondary batteries; and sensors; antennas and related pro	10281009807360.0	1.36	103.27	29.29693980247514	-9.372721025044118		726518000000.0	1656000000.0	781000000.0	59993000000.0	2580805000000.0	398.21190219481423	142.3194622125248	2.519820506595694	50.835558224123034	-9.372721025044118		-0.1576204000695292	판정불가	불리(<1)	0.0	0.0	-100.0	보류	일부부족
6762.T	6762.T	Global Semicon / PCB / Memory / OSAT	2896.0	49.201442555383814	14.534308878781887		0.0	2294.875	2182.2725	Y	Y	상승전환/양호	TDK CORP	JPX	JPY	Technology	Electronic Components	Electronic Components	TDK Corporation, together with its subsidiaries, engages in the manufacture and sale of electronic components in Japan, Europe, China, Asia, the Americas, and internationally. The company operates through Passive Components, Sensor Application Products, Magnetic Application Products, Energy Application Products, and Others segments. The Passive Components segment offers ceramic capacitors, aluminum electrolytic capacitors, film capacitors, high-frequency components, piezoelectric material produc	5497015500800.0	1.44	102.97	34.06449750174436	8.382446471444771		851915000000.0	346001000000.0	187145000000.0	608400000000.0	1800070000000.0	266.531358111227	116.19212850419834	4.012159133432263	25.536259511399177	8.382446471444771	3.046396967566657	0.38464703364484965	매우 불리	불리(<1)	25.264892942889542	2601.526026329336	-10.16830019581021	보류	충분
