티커	종목코드	유니버스	현재가	3M수익률(보조,%)	6M수익률(보조,%)	12M수익률(보조,%)	52주고점대비(보조,%)	40일이평(보조)	200일이평(보조)	40일선상회(보조)	200일선상회(보조)	추세판정(보조)	종목명	시장	통화	섹터	산업	업종	사업설명	시가총액	배당수익률(%)	EPS(FY)	EPS Growth 1Y(%)	EPS Growth 3Y CAGR(%)	EPS Growth 5Y CAGR(%)	현금및단기투자	장기부채	단기위험부채	총부채	주주지분	주당순현금(린치식)	주당잉여현금흐름	잉여현금흐름수익률(%)	순현금차감PER(린치식)	사용연성장률(%)	린치PER배수	배당감안점수	린치PER판정	배당감안점수판정	그레이엄적정PER(3년)	그레이엄내재가치(3년)	그레이엄괴리율(3년,%)	종합판정	데이터상태
6976.T	6976.T	Global Semicon / PCB / Memory / OSAT	6143.0	87.68713718301254	68.62475981334066		-6.726389310658975	4875.85	3711.7425	Y	Y	상승전환/양호	TAIYO YUDEN CO LTD	JPX	JPY	Technology	Electronic Components	Electronic Components	Taiyo Yuden Co., Ltd. develops, manufactures, and sells electronic components in Japan, North America, China, Europe, Hong Kong, and internationally. It offers multilayer ceramic capacitors, inductors, saw devices for communications, RF devices, circuit modules, and aluminum electrolytic capacitors, as well as conductive polymer hybrid aluminum electrolytic capacitors. Taiyo Yuden Co., Ltd. was incorporated in 1950 and is headquartered in Tokyo, Japan.	768185729024.0	1.47	30.72	-72.00913791030419	-65.01365995266472		78166000000.0	144698000000.0	19702000000.0	164400000000.0	319169000000.0	-532.0406895174406	271.41816032753337	4.41833241620598	217.28648077856252	-65.01365995266472		-0.29244184785441074	판정불가	불리(<1)	0.0	0.0	-100.0	보류	일부부족
4062.T	4062.T	Global Semicon / PCB / Memory / OSAT	13375.0	62.12121212121211	176.7718572167615		-0.7789317507418403	9222.4	6341.6825	Y	Y	상승전환/양호	IBIDEN CO LTD	JPX	JPY	Technology	Electronic Components	Electronic Components	Ibiden Co.,Ltd., together with its subsidiaries, manufactures and sells electronic and ceramics products in Japan, Asia, North America, and internationally. The company offers printed circuit boards; plastic packaging; and integrated circuit package substrates used as microprocessor units for personal computers and data centers, as well as graphic processing units for AI and vehicles. It also provides diesel particulate filter substrates for passenger cars mounted with diesel engines, buses, and	3734913417216.0	15.0	119.04	7.030803429660204	-6.4991235939926835		390656000000.0	252976000000.0	90000000000.0	343060000000.0	490493000000.0	493.042245698851	-285.15732846276734	-2.1320174090674193	108.21537091986852	-6.4991235939926835		0.07855516581190725	판정불가	불리(<1)	0.0	0.0	-100.0	보류	일부부족
6861.T	6861.T	Global Semicon / PCB / Memory / OSAT	76460.0	31.149228130360207	27.26364846870839		0.0	61547.0	58009.4	Y	Y	상승전환/양호	KEYENCE CORP	JPX	JPY	Technology	Scientific & Technical Instruments	Scientific & Technical Instruments	Keyence Corporation, together with its subsidiaries, manufactures and sells electronic application equipment. It offers photoelectric, fiber optic, laser, positioning, vision, and inductive proximity sensors; network communication units; measurement sensors, such as laser displacement and profiler/3D laser snapshot sensors, optical/laser micrometers, inductive displacement sensors, 3D interference measurement sensors, spectral interference displacement sensors, inductive displacement sensors, an	18543470968832.0	72.0	1835.04	7.849216268714043	9.533423797831464		1859417000000.0	0.0	0.0	0.0	3108552000000.0	7666.904266780825	1629.4393501546165	2.1311003794855043	37.48860827732321	9.533423797831464	3.932334182589325	2.1748853196865907	매우 불리	안심(>=2)	27.566847595662928	50586.2680119453	-33.839565770408974	보류	충분
8035.T	8035.T	Global Semicon / PCB / Memory / OSAT	47450.0	8.333333333333325	59.603094517322575		0.0	41598.0	33393.875	Y	Y	상승전환/양호	TOKYO ELECTRON	JPX	JPY	Technology	Semiconductor Equipment & Materials	Semiconductor Equipment & Materials	Tokyo Electron Limited, together with its subsidiaries, develops, manufactures, and sells semiconductor production equipment in Japan, South Korea, Taiwan, China, North America, Europe, and internationally. The company provides coaters/developers, plasma etch systems, cleaning systems, deposition systems, test systems, 3D integration systems, SiC Epitaxial CVD systems, and gas cluster beam systems, as well as other deposition and lithography and other products. It also offers engineering service	21675976425472.0	1.52	1252.68	49.50228457288242	7.57615934348288		576236000000.0	0.0	0.0	0.0	1855206000000.0	1266.8770981780767	910.4917899158987	1.9188446573570046	36.86745449901166	7.57615934348288	4.866245920596373	0.2467259936192972	매우 불리	불리(<1)	23.65231868696576	29628.78657278827	-37.55787866641038	보류	충분
6857.T	6857.T	Global Semicon / PCB / Memory / OSAT	27815.0	8.907595927956159	68.93410264196783		-11.698412698412696	24999.0	19319.825	Y	Y	상승전환/양호	ADVANTEST CORP	JPX	JPY	Technology	Semiconductor Equipment & Materials	Semiconductor Equipment & Materials	Advantest Corporation, together with its subsidiaries, manufactures and sells semiconductors, component test systems, and mechatronics-related products in Japan, rest of Asia, the Americas, and Europe. It operates in three segments: Semiconductor and Component Test System Business; Mechatronics Related Business; and Services, Support and Others. The company offers automated test equipment, including system on chip, power device, and memory test systems, as well as burn-in and SSD test systems; a	20180220510208.0	22.0	514.58	158.75260876545192	22.676473519396858		262544000000.0	3000000.0	74952000000.0	93503000000.0	506539000000.0	361.86807879970894	367.38001959036654	1.3207982009360653	53.35056146993721	22.676473519396858	2.3526833404807213	0.8374133708896736	매우 불리	불리(<1)	53.852947038793715	27711.649487222472	-0.3715639503056867	보류	충분
6146.T	6146.T	Global Semicon / PCB / Memory / OSAT	72250.0	2.511350737797957	41.97288268815092		-9.687500000000004	69300.75	54711.3	Y	Y	상승전환/양호	DISCO CORPORATION	JPX	JPY	Technology	Semiconductor Equipment & Materials	Semiconductor Equipment & Materials	Disco Corporation manufactures and sells precision cutting, grinding, and polishing machines in Japan and internationally. Its precision machines include dicing saws, laser saws, grinders, polishers, wafer mounters, die separators, surface planers, and waterjet saws. The company also offers precision processing tools, such as dicing blades, grinding wheels, and dry polishing wheels; and other products, such as accessory equipment, cut-off wheels, and related products. In addition, it is involved	7836381216768.0	70.0	1249.93	47.13021792055103	23.22934390915492		229167000000.0	0.0	0.0	0.0	492352000000.0	2112.877756062548	492.6516907645787	0.6818708522693131	56.11284011419635	23.22934390915492	2.4156015914027478	1.6614618636201988	매우 불리	양호(>=1.5)	54.95868781830984	68694.51266474002	-4.9210897373840545	보류	충분
7735.T	7735.T	Global Semicon / PCB / Memory / OSAT	10390.0	1.4896214896214843	61.39805825242719		-12.283663993246098	10001.4875	7791.26	Y	Y	상승전환/양호	SCREEN HOLDINGS CO LTD	JPX	JPY	Technology	Semiconductor Equipment & Materials	Semiconductor Equipment & Materials	SCREEN Holdings Co., Ltd. develops, manufactures, and markets semiconductor production equipment in Japan, Taiwan, South Korea, China, the United States, Europe, and internationally. It operates through Semiconductor Production Equipment, Graphic Arts Equipment, Display Production Equipment and Coater, and Printed Circuit Board (PCB)-Related Equipment segments. The company offers wafer cleaning systems, such as wet stations, spin processors, and spin scrubbers; coat/develop trackers, and spray c	1964625494016.0	1.35	311.7	40.930021677836194	29.8024843823244		260397000000.0	757000000.0	1013000000.0	4562000000.0	420639000000.0	1373.116508978095	241.51175325644226	2.3244634577135925	28.928083063913714	29.8024843823244	0.9706601199016386	1.0768941831885679	헐값	보통(1~1.5)	60.0	18702.0	80.0	보류	충분
6723.T	6723.T	Global Semicon / PCB / Memory / OSAT	3205.0	23.79297025878717	73.43073593073592		-2.8787878787878807	2625.9625	2178.6575	Y	Y	상승전환/양호	RENESAS ELECTRONICS CORP	JPX	JPY	Technology	Semiconductors	Semiconductors	Renesas Electronics Corporation engages in the design, research, development, manufacturing, sale, and service of semiconductors in Japan, China, rest of Asia, Europe, North America, and internationally. The company operates through Automotive Business and Industrial/Infrastructure/IoT Business segments. It offers microcontrollers and microprocessors; amplifiers, audio and video, data converters, power line communication, and switches and multiplexer products; custom ASICS and processor IP solut	5814814769152.0	87.0	-28.52	162.1			373099000000.0	964089000000.0	242478000000.0	1206567000000.0	2443034000000.0	-325.7409006245188	175.87385024717142	5.487483627056831		162.1			판정불가	판정불가				판정불가	일부부족
6758.T	6758.T	Global Semicon / PCB / Memory / OSAT	3127.0	-8.13748531139835	-28.753702437912963		-33.468085106382986	3308.55	3869.9674682617188	N	N	주의	SONY GROUP CORPORATION	JPX	JPY	Technology	Consumer Electronics	Consumer Electronics	Sony Group Corporation designs, develops, produces, and sells electronic equipment, instruments, and devices for the consumer, professional, and industrial markets in Japan, the United States, Europe, China, the Asia-Pacific, and internationally. The company distributes software titles and add-on content through digital networks; network services related to game, video, and music content; hardware and home gaming consoles, packaged and game software, and peripheral devices. It also develops, pro	18473275097088.0	80.0	206.38	17.62124023643765	8.973084964624945		3915606000000.0	2066842000000.0	2131404000000.0	4198246000000.0	8179745000000.0	312.94315006455844	283.38562888193434	9.062540098558822	13.635317617673426	8.973084964624945	1.5195796842923743	6.5251934321868985	보통	안심(>=2)	26.44616992924989	5457.960549998592	74.54303006071608	보류	충분
3407.T	3407.T	Global Semicon / PCB / Memory / OSAT	1524.5	4.096961420279954	25.68013190436933		-19.103210400636772	1581.625	1362.7025	N	Y	상승전환/양호	ASAHI KASEI CORP	JPX	JPY	Industrials	Conglomerates	Conglomerates	Asahi Kasei Corporation engages in material, homes, healthcare businesses. The company offers Pimel photosensitive polyimide/PBO precursor, a liquid photosensitive material for buffer coating and packaging applications; Sunfort dry film photoresist to form circuit patterns on printed wiring boards; Novacure, a latent curing agent for epoxy resin with storage stability; glass fabric for printed circuit boards; plastic optical fiber; suede products under the Dinamica name; Microza UF and MF indust	2067893846016.0	2.62	103.21	208.1701136830571	-5.873847414568534		393467000000.0	847209000000.0	310249000000.0	1195045000000.0	1859421000000.0	-334.5092773517144	61.595025637335176	4.040342777129234	18.011910448132106	-5.873847414568534		-0.18064976638310837	판정불가	불리(<1)	0.0	0.0	-100.0	보류	일부부족
5201.T	5201.T	Global Semicon / PCB / Memory / OSAT	5574.0	-0.3575259206292425	14.998968434082949		-19.567099567099568	5703.2	5240.105	N	Y	상승전환/양호	AGC INC	JPX	JPY	Industrials	Conglomerates	Conglomerates	AGC Inc. manufactures and sells architectural glass, electronics, chemicals, automotive, and ceramics worldwide. The company offers architectural glass products, including insulated, laminated, wired, toughened, solar control, sound insulation, decorative, float and patterned, and industrial glass, as well as structural glazing systems and industrial glass; automotive glass for displays, sensors and connected drive, windows, and trains; and glass substrates used for thin-film-transistor liquid c	1183717916672.0	3.77	325.52	139.9			94671000000.0	429514000000.0	216949000000.0	646463000000.0	1485126000000.0	-1576.739549846587	305.75307147256694	5.485343944610099	21.967128132976736	139.9	0.15702021538939767	6.540226793885027	매우 유망	안심(>=2)	8.5	2766.92	-50.36024398995336	양호	충분
3110.T	3110.T	Global Semicon / PCB / Memory / OSAT	28160.0	84.05228758169933	284.69945355191254		-4.347826086956519	23806.5	13312.2	Y	Y	상승전환/양호	NITTO BOSEKI CO	JPX	JPY	Consumer Cyclical	Textile Manufacturing	Textile Manufacturing	Nitto Boseki Co., Ltd. manufactures, processes, and sells glass fiber products, chemical and pharmaceutical products, and textile products in Japan. It operates through six segments: Electronic Materials Business, Medical Business, Composite Materials Business, Materials Solution Business, Insulation Materials Business, and Other Businesses. The company engages in the development, manufacture, and sale of glass fiber products for electronic materials; in vitro diagnostic reagents; glass fiber pr	1025186332672.0	40.0	394.24	75.94572368421053	25.34129768244895		28546000000.0	33743000000.0	17826000000.0	52746000000.0	129733000000.0	-142.7521202411794	525.2190285032887	1.865124390991792	71.79066588941046	25.34129768244895	2.832951445068724	0.9101642514794834	매우 불리	불리(<1)	59.1825953648979	23332.14639665735	-17.144366489142936	보류	충분
600183.SS	600183.SS	Global Semicon / PCB / Memory / OSAT	80.80999755859375	14.235227592481614	38.13674796340811		0.0	64.04849987030029	58.09230003356934	Y	Y	상승전환/양호	SHENGYI TECHNOLOGY CO LTD	SHH	CNY	Technology	Electronic Components	Electronic Components	Shengyi Technology Co.,Ltd. engages in the design, production, and sales of copper clad laminates, bonding sheets, and printed circuit boards in China and internationally. The company offers flame-retardant epoxy glass fabric reinforced laminates, composite epoxy materials, and flexible circuit materials, as well as prereg for multilayer circuit boards; and smart and rigid materials, automotive and RF materials, IMS and HTC materials, IC substrate and flexible materials, HSD materials, and speci	196297113600.0	1.31	1.62	91.75319663725077	29.622792505245087		3239977726.09	902984683.16	2304818271.34	3676930770.8	16723501226.33	0.962074242411724	1.1930143211125952	1.4763202043751626	49.28884155319877	29.622792505245087	1.6638823481773894	0.6275820557044031	보통	불리(<1)	60.0	97.2	20.282146933022972	보류	충분
002916.SZ	002916.SZ	Global Semicon / PCB / Memory / OSAT	318.75	28.80349069692962	49.5917013614108		-0.9477899032522608	262.65724792480466	211.62640029907226	Y	Y	상승전환/양호	SHENNAN CIRCUITS CO LTD	SHZ	CNY	Technology	Electronic Components	Electronic Components	Shennan Circuits Co., Ltd. engages in the design, manufacture, and sale of printed circuit boards, packaging substrates, and electronic assemblies in China and internationally. It operates through Packaging Substrates, Packaging Substrates, and Distribution Substrates segments. The company provides RF and microwave, thermal management, miniaturization, and chip package substrate solutions. It also offers schematic design, PCB / SiP design, PCB / SUB production, electronic assembly, package testi	217121849344.0	37.0	5.22	74.46731868482586	25.905809548765156		1588756438.22	2679204686.22	15009670.83	3557910474.95	17149430529.85	-1.600853970239101	0.10703819865094824	0.03358061134147396	61.36989539659753	25.905809548765156	2.3689626560820147	1.0250271593627773	매우 불리	보통(1~1.5)	60.0	313.2	-1.7411764705882349	보류	충분
688981.SS	688981.SS	Global Semicon / PCB / Memory / OSAT	123.0999984741211	-1.4884768117629399	-8.17544329708223		-12.15300493490542	104.2355001449585	111.46535007476807	Y	Y	상승전환/양호	SEMICONDUCTOR MANUFACTURING INT	SHH	CNY	Technology	Semiconductors	Semiconductors	Semiconductor Manufacturing International Corporation, an investment holding company, engages in the manufacture, testing, and sale of integrated circuits wafer and various compound semiconductors in the United States, China, and Eurasia. The company is also involved in the manufacturing, sale, and trading of semiconductor products; and research and development activities. In addition, it offers semiconductor foundry and technology services; supporting services comprising design and IP support, 	986415628288.0		0.62	39.04287790107723	-27.767740812712226		14935414000.0	9994773000.0	2593077000.0	12596181000.0	21439670000.0	2.4708609402945965	-2.60515381357045	-2.116290695257907	194.56312505455887	-27.767740812712226		-0.14271841493564452	판정불가	불리(<1)	0.0	0.0	-100.0	보류	일부부족
603501.SS	603501.SS	Global Semicon / PCB / Memory / OSAT	100.9000015258789	-22.024724663746508	-23.917957140082635		-33.25395068595913	100.34950008392335	122.05830009460449	Y	N	주의	OMNIVISION INTEGRATED CIRCUITS 	SHH	CNY	Technology	Semiconductors	Semiconductors	OmniVision Integrated Circuits Group, Inc., together with its subsidiaries, engages in the design, development, and sale of integrated circuits and computer software and hardware in China and internationally. It operates in two segments, Semiconductor Design and Electronic Components Agency. The company offers image sensors, application-specific integrated circuits, camera cube chips, liquid crystal on silicon, display solutions, in-system programming, and cable modules. It also provides semicon	127249825792.0	63.0	3.04	21.730996944226554	59.85671328521085		13072154645.060001	1617721215.79	2078985512.66	9796924850.61	28172055029.35	9.463292498146881	1.4731375786416094	1.459997578160371	30.077864811753955	59.85671328521085	0.5024977677681054	4.084622164974968	헐값	안심(>=2)	60.0	182.4	80.7730398826782	양호	충분
1888.HK	1888.HK	Global Semicon / PCB / Memory / OSAT	38.15999984741211	149.08616584570993	186.70171783894682		0.0	25.665250062942505	15.64214997291565	Y	Y	상승전환/양호	KB LAMINATES	HKG	HKD	Technology	Electronic Components	Electronic Components	Kingboard Laminates Holdings Limited, an investment holding company, manufactures and sells laminates in the People's Republic of China, Europe, other Asian countries, and the United States. The company operates through Laminates, Properties, and Investments segments. It offers glass epoxy and paper laminates. The company also provides upstream component materials, such as copper foils, glass yarns, glass fabrics, bleached kraft papers, epoxy resins, kraft papers for copper-clad laminates, and P	119643996160.0	1.39	0.78	84.16268505447569	8.55356145230186		3010761000.0	637441000.0	3552115000.0	4191710000.0	16341745000.0	0.7569613995359332	0.28112013906054395	0.736687998387423	47.95261339471305	8.55356145230186	5.6061575826766825	0.2073622426050751	매우 불리	불리(<1)	25.60712290460372	19.973555865590903	-47.65839636934525	보류	충분
0981.HK	0981.HK	Global Semicon / PCB / Memory / OSAT	74.8499984741211	-5.611607069841185	-9.601454450028479		-17.792426177545263	60.265000343322754	65.88529987335205	Y	Y	상승전환/양호	SMIC	HKG	HKD	Technology	Semiconductors	Semiconductors	Semiconductor Manufacturing International Corporation, an investment holding company, engages in the manufacture, testing, and sale of integrated circuits wafer and various compound semiconductors in the United States, China, and Eurasia. The company is also involved in the manufacturing, sale, and trading of semiconductor products; and research and development activities. In addition, it offers semiconductor foundry and technology services; supporting services comprising design and IP support, 	599782391808.0		0.71	39.04287790107723	-27.767740812712226		14935414000.0	9994773000.0	2593077000.0	12596181000.0	21439670000.0	0.821583099937418	-0.866236667172296	-1.157296840121903	104.2653737664559	-27.767740812712226		-0.26631795206440456	판정불가	불리(<1)	0.0	0.0	-100.0	보류	일부부족
2382.HK	2382.HK	Global Semicon / PCB / Memory / OSAT	65.44999694824219	2.586203339988735	-19.247384967467063		-27.997804345901134	59.69874992370605	69.33325017929077	Y	N	상승전환/양호	SUNNY OPTICAL	HKG	HKD	Technology	Electronic Components	Electronic Components	Sunny Optical Technology (Group) Company Limited, an investment holding company, engages in designing, researching, developing, manufacturing, and selling optical and optical related products, and scientific instruments. It operates through Optical Components, Optoelectronic Products, and Optical Instruments segments. The Optical Components segment offers vehicle lens sets and optical parts for vehicle light detection and ranging, handset lens sets, glass spherical and aspherical lenses for digi	70304743424.0	1.81	4.88	71.87231282040072	24.433762661282877		38549973000.0	1405760000.0	4655009000.0	6244099000.0	29148588000.0	34.57930031499529	2.931125362464284	4.478419402803358	6.3259624248456765	24.433762661282877	0.2589025076710611	4.148580231556323	매우 유망	안심(>=2)	57.367525322565754	279.9535235741209	327.7364959932816	매우 유망	충분
TTMI	TTMI	Global Semicon / PCB / Memory / OSAT	159.8800048828125	66.16088428027582	128.82495863453173		0.0	116.2424997329712	77.70274982452392	Y	Y	상승전환/양호	TTM Technologies, Inc.	NMS	USD	Technology	Electronic Components	Electronic Components	TTM Technologies, Inc. manufactures and sells mission systems, radio frequency (RF) components, RF microwave/microelectronic assemblies, and printed circuit boards (PCBs) and substrates in the United States, Taiwan, and internationally. It operates in three segments, A&D, Commercial, and RF&S Components. The company offers various engineered systems and RF and microwave assemblies; PCBs and IC substrates, custom assemblies and integrated systems, passive and advanced ceramic RF components, hi-re	16602448896.0		1.84	215.1885468658413	23.334906230221144		501234000.0	912336000.0	3815000.0	1028413000.0	1762253000.0	-3.9588732560326085	-0.006577225199269942	-0.004113851012258137	89.04286855372015	23.334906230221144	3.815865711017957	0.26206372963089164	매우 불리	불리(<1)	55.16981246044229	101.51245492721381	-36.50709793158966	보류	충분
005930.KS	005930.KS	Global Semicon / PCB / Memory / OSAT	266000.0	65.52582451773492	164.67661691542287		0.0	202796.25	126907.0	Y	Y	상승전환/양호	SamsungElec	KSC	KRW	Technology	Consumer Electronics	Consumer Electronics	Samsung Electronics Co., Ltd. engages in the consumer electronics, information technology and mobile communications, and device solutions businesses worldwide. The company operates through four divisions: Device eXperience (DX), Device Solutions (DS), SDC, and Harman. The company offers smartphones, tablets, audio sounds, watches, switches, and accessories; TVs, and sound devices; appliances, including refrigerators, washing machines and dryers, vacuum cleaners, cooking appliances, dishwashers, 	1746705888313344.0	64.0	7678.605560818366	31.645335140041773	-6.832366066754158		193837850000000.0	2813148000000.0	17584050000000.0	25239139000000.0	424313255000000.0	33139.892844403796	5753.104608252318	2.162821281297864	30.3258326412561	-6.832366066754158		1.8851134150055755	판정불가	양호(>=1.5)	0.0	0.0	-100.0	보류	일부부족
000660.KS	000660.KS	Global Semicon / PCB / Memory / OSAT	1601000.0	85.94657375145181	186.91756272401432		0.0	1062925.0	636167.5	Y	Y	상승전환/양호	SK hynix	KSC	KRW	Technology	Semiconductors	Semiconductors	SK hynix Inc. research, develops manufactures, and sells semiconductor devices in Korea, China, rest of Asia, the United States, and Europe. It offers DRAM, NAND storage, SSD, MCP, and CMM products. The company provides its products for server, networking, mobile, personal computer, consumer, and automotive applications. It is also involved in the construction, business support, industrial material distribution, semiconductor apparel manufacturing, baking, hospital, education, information and co	1134617750929408.0	21.0	60561.17247655224	116.88806343383877	168.00595548778566		55351258000000.0	14086148000000.0	8161757000000.0	24757848000000.0	120516178000000.0	58227.04939096263	34985.21698669432	2.1852103052276277	25.47462156889978	168.00595548778566	0.15162927703924065	7.419382265467294	매우 유망	안심(>=2)	60.0	3633670.3485931344	126.96254519632322	매우 유망	충분
042700.KS	042700.KS	Global Semicon / PCB / Memory / OSAT	394500.0	93.85749385749386	185.45586107091174		0.0	300825.0	168007.0	Y	Y	상승전환/양호	HANMISemi	KSC	KRW	Technology	Semiconductor Equipment & Materials	Semiconductor Equipment & Materials	HANMI Semiconductor Co., Ltd. manufactures and sells semiconductor equipment in South Korea and internationally. The company offers bonder; micro SAW equipment; vision placement equipment; meta grinder; EMI shield vision attach and detach, EMI shield vision placement, EMI shield tape mounter, EMI shield tape laser cutting, EMI shield tape demounter, vision inspection, and converlay attach equipment; laser marking, laser ablation, and laser cutting equipment; and pick and place, strip mounter, an	37419508301824.0	21.0	2256.2021643764106	40.22753487679789	32.37512374110017		278201051520.0	0.0	1339920070.0	2554319940.0	690327519530.0	2932.9704453634477	1422.1134652122028	0.36048503554174977	173.55139345984156	32.37512374110017	5.360640312843603	0.3075465006476641	매우 불리	불리(<1)	60.0	135372.12986258464	-65.68513818438919	보류	충분
