티커	종목코드	유니버스	현재가	3M수익률(보조,%)	6M수익률(보조,%)	12M수익률(보조,%)	52주고점대비(보조,%)	40일이평(보조)	200일이평(보조)	40일선상회(보조)	200일선상회(보조)	추세판정(보조)	종목명	시장	통화	섹터	산업	업종	사업설명	시가총액	배당수익률(%)	EPS(FY)	EPS Growth 1Y(%)	EPS Growth 3Y CAGR(%)	EPS Growth 5Y CAGR(%)	현금및단기투자	장기부채	단기위험부채	총부채	주주지분	주당순현금(린치식)	주당잉여현금흐름	잉여현금흐름수익률(%)	순현금차감PER(린치식)	사용연성장률(%)	린치PER배수	배당감안점수	린치PER판정	배당감안점수판정	그레이엄적정PER(3년)	그레이엄내재가치(3년)	그레이엄괴리율(3년,%)	종합판정	데이터상태
UMC	UMC	Global Semicon / PCB / Memory / OSAT	20.475000381469727	75.60034862276667	133.4663547633474		-26.90110598300737	23.06912498474121	12.251425006389617	N	Y	상승전환/양호	United Microelectronics Corpora	NYQ	USD	Technology	Semiconductors	Semiconductors	United Microelectronics Corporation operates as a semiconductor wafer foundry in Taiwan, China, Hong Kong, Japan, Korea, the United States, Europe, and internationally. It manufactures and sells integrated circuits. The company offers circuit design; mask tooling; wafer fabrication; and assembly and testing services for communication devices, consumer electronics, computer, and other applications. It also provides venture capital and marketing support; consulting and planning; energy technical; 	51377643520.0	1.94	0.62	-17.259341564967112	-23.3089317909408		146070330000.0	45372054000.0	8408772000.0	59781672000.0	365824997000.0	40.130238218838194	19.579483903181806	95.62629322782148	-31.701996511884627	-23.3089317909408			판정불가	판정불가	0.0	0.0	-100.0	판정불가	일부부족
2330.TW	2330.TW	Global Semicon / PCB / Memory / OSAT	2320.0	14.567901234567904	38.50746268656717		-7.5697211155378525	2382.875	1850.575	N	Y	상승전환/양호	TAIWAN SEMICONDUCTOR MANUFACTUR	TAI	TWD	Technology	Semiconductors	Semiconductors	Taiwan Semiconductor Manufacturing Company Limited, together with its subsidiaries, manufactures, packages, tests, and sells integrated circuits and other semiconductor devices in Taiwan, China, Europe, the Middle East, Africa, Japan, the United States, and internationally. It provides various wafer fabrication processes, such as processes to manufacture complementary metal- oxide-semiconductor (CMOS) logic, mixed-signal, radio frequency, embedded memory, bipolar CMOS mixed-signal, and others. T	60163096576000.0	1.05	85.42	46.54981153856048	19.574951863097922		3488279800000.0	896062000000.0	136925700000.0	1064582700000.0	5355038700000.0	99.96069751058748	38.26794070252923	1.6494802026952256	25.98968979734737	19.574951863097922	1.3277013388902534	0.7935820713490395	보통	불리(<1)	47.649903726195845	4070.2547762916493	75.44201621946765	보류	충분
2454.TW	2454.TW	Global Semicon / PCB / Memory / OSAT	3340.0	75.78947368421052	124.16107382550337		-28.01724137931034	4180.25	2215.05	N	Y	상승전환/양호	MEDIATEK INC	TAI	TWD	Technology	Semiconductors	Semiconductors	MediaTek Inc. engages in the research, development, production, manufacture, and marketing of multimedia integrated circuits (ICs) in Taiwan, rest of Asia, and internationally. The company offers multimedia, computer peripherals oriented, consumer-oriented, and other ICs for various applications. It also offers design, test runs, maintenance and repair, and technological consultation services for software and hardware solutions; and sale and delegation patents and circuit layout rights for its I	5331008094208.0	1.59	66.05	-1.0032496768530352	-3.7570524355304835		260128122000.0	60000000.0	4480763000.0	13730009000.0	400600988000.0	162.93870008806817	86.0675425604462	2.576872531749886	48.100852383223796	-3.7570524355304835		-0.04505226681359788	판정불가	불리(<1)	0.985895128939033	65.11837326642312	-98.05034810579572	보류	일부부족
2303.TW	2303.TW	Global Semicon / PCB / Memory / OSAT	130.0	69.05071186019616	140.29575539116865		-27.17086834733894	148.45	76.99600002288818	N	Y	상승전환/양호	UNITED MICRO ELECTRONICS	TAI	TWD	Technology	Semiconductors	Semiconductors	United Microelectronics Corporation operates as a semiconductor wafer foundry in Taiwan, China, Hong Kong, Japan, Korea, the United States, Europe, and internationally. It manufactures and sells integrated circuits. The company offers circuit design; mask tooling; wafer fabrication; and assembly and testing services for communication devices, consumer electronics, computer, and other applications. It also provides venture capital and marketing support; consulting and planning; energy technical; 	1631036375040.0	1.81	3.95	-17.259341564967112	-23.3089317909408		146070330000.0	45372054000.0	8408772000.0	59781672000.0	365824997000.0	8.026047643767638	3.915896780636361	3.012228292797201	30.879481609172746	-23.3089317909408		-0.6962206186957021	판정불가	불리(<1)	0.0	0.0	-100.0	보류	일부부족
3711.TW	3711.TW	Global Semicon / PCB / Memory / OSAT	597.0	29.36078006500542	117.0909090909091		-17.881705639614854	628.4	371.5775	N	Y	상승전환/양호	ASE TECHNOLOGY HOLDING CO LTD	TAI	TWD	Technology	Semiconductors	Semiconductors	ASE Technology Holding Co., Ltd., together with its subsidiaries, provides semiconductor manufacturing services in the United States, Taiwan, rest of Asia, Europe, and internationally. It operates through Packaging, Testing, and EMS. The company offers semiconductor packaging, interconnect materials production, front-end engineering testing, wafer probing, and final testing services, as well as integrated solutions for EMS (electronic manufacturing services) in relation to computing, peripherals	2619571437568.0	1.07	10.19	23.585762669903666	-13.347387041498415		111497789000.0	214080678000.0	40733681000.0	263662466000.0	342181952000.0	-23.378628938260114	-5.3782267829267285	-0.9008755080279276	60.88112158373505	-13.347387041498415		-0.20166164357882707	판정불가	불리(<1)	0.0	0.0	-100.0	보류	일부부족
3037.TW	3037.TW	Global Semicon / PCB / Memory / OSAT	750.0	10.619469026548668	231.858407079646		-30.87557603686636	950.725	493.1498966217041	N	Y	상승전환/양호	UNIMICRON TECHNOLOGY	TAI	TWD	Technology	Electronic Components	Electronic Components	Unimicron Technology Corp., together with its subsidiaries, engages in the manufacturing, processing, and sale of printed circuit boards, electrical equipment, electronic products, and integrated circuit product testing and burn-in systems in Taiwan, China, Asia, the Americas, and internationally. The company offers PCB products, including HDI, ELIC, multi-layer and rigid flex PCBs, and FPC; IC carriers, such as FCCSP, FCBGA, CSP, memory module, and coreless; connectors comprising PCBeam and X-B	1180609282048.0	25.0	6.99	31.307777963397943	-39.15067182208464		55226513000.0	34873158000.0	22207016000.0	57080174000.0	100569302000.0	12.929777846074714	-7.044326051426996	-0.9392434735235995	105.44638371300792	-39.15067182208464		-0.13419779155820405	판정불가	불리(<1)	0.0	0.0	-100.0	보류	일부부족
8046.TW	8046.TW	Global Semicon / PCB / Memory / OSAT	1105.0	38.81909547738693	357.5569358178054		-21.908127208480565	1008.875	549.12	Y	Y	상승전환/양호	8046.TW								2.398190045248869		855.5802618209663	-53.54257860278134		8823188000.0	0.0	0.0	1234627000.0	46122894000.0					-53.54257860278134			판정불가	판정불가				판정불가	핵심부족
4958.TW	4958.TW	Global Semicon / PCB / Memory / OSAT	478.5	54.35483870967741	222.22222222222223		-25.928792569659443	566.125	278.195	N	Y	상승전환/양호	ZHEN DING TECHNOLOGY HOLDING LT	TAI	TWD	Technology	Electronic Components	Electronic Components	Zhen Ding Technology Holding Limited, together with its subsidiaries, engages in the design, development, manufacture, and sale of printed circuit boards (PCB) products in the United States, Mainland China, Taiwan, Singapore, and internationally. The company offers flexible circuit boards, substrate-like PCBs, high-density interconnect PCBs, rigid printed circuit boards, IC substrates, rigid-flex PCBs, and modules. Its products are used in various applications, including mobile phones, computers	516502847488.0	66.0	6.77	-26.026818555617737	-21.794946088339774		71187918000.0	26429839000.0	25689071000.0	53010937000.0	123981554000.0	41.46490110198955	-5.477117634530046	-1.144643183809832	64.55466748862784	-21.794946088339774		0.6847692913831139	판정불가	불리(<1)	0.0	0.0	-100.0	보류	일부부족
3044.TW	3044.TW	Global Semicon / PCB / Memory / OSAT	388.0	-6.16686819830713	22.20472440944883		-32.28621291448517	494.8375	384.525	N	Y	상승전환/양호	TRIPOD TECHNOLOGY CORP	TAI	TWD	Technology	Electronic Components	Electronic Components	Tripod Technology Corporation processes, manufactures, and sells printed circuit boards and other related components in Taiwan, China, Vietnam, Thailand, South Korea, Malaysia, Mexico, and internationally. The company offers printed circuit boards comprising any layer, double-sided, HDI, heavy copper, multi-layer, high layer count, flexible, rigid-flex, semi-flex, cavity, thermal, embedded ferrite, and hybrid lamination structure. It also engages in the manufacture and wholesale of electronic pa	203935137792.0	3.19	19.36	21.976442546571807	18.143871338410513		31846737000.0	1000000000.0	6478679000.0	7596649000.0	54083843000.0	58.68794686514233	11.10088164899183	2.861051971389647	17.009920099940995	18.143871338410513	0.9375022442939757	1.2542017371665677	헐값	보통(1~1.5)	44.787742676821026	867.090698223255	123.47698407815852	보류	충분
2327.TW	2327.TW	Global Semicon / PCB / Memory / OSAT	630.0	97.1830985915493	149.01185770750988		-44.73684210526315	883.525	389.205	N	Y	상승전환/양호	YAGEO CORP	TAI	TWD	Technology	Electronic Components	Electronic Components	Yageo Corporation, together with its subsidiaries, manufactures and sells electronic components in China, Europe, the United States, and the rest of Asia. It offers antennas, radio frequency, and microwave; capacitors; circuit protection; custom products; electromechanical devices; EMC; engineering kits; inductors; piezoelectric devices; power supplies; resistors; semiconductors; sensors; signal magnetics and connectors; and transformers. The company's products are used for various applications,	1297000169472.0	86.0	12.65	22.099803869339073	1.3081472653207582		114742022000.0	62087637000.0	86197379000.0	150894630000.0	170877823000.0	25.57614287504765	11.927875062251228	1.8933135019446392	47.780542065213616	1.3081472653207582	36.52535408809482	1.8272741055586519	매우 불리	양호(>=1.5)	11.116294530641516	140.6211258126152	-77.67918637894996	보류	충분
2408.TW	2408.TW	Global Semicon / PCB / Memory / OSAT	381.0	84.05797101449275	58.091286307053934		-24.554455445544555	403.4125	241.25949996948242	N	Y	상승전환/양호	NANYA TECHNOLOGY CORPORATION	TAI	TWD	Technology	Semiconductors	Semiconductors	Nanya Technology Corporation research, develops, manufactures, and sells semiconductor products in Taiwan, Japan, Malaysia, China, the United States, Thailand, Germany, Singapore, Poland and internationally. It offers standard dynamic random-access memory (DRAM), low power DRAM, MCP and eMCP, and KGD products, as well as modules; and other memory products and Elixir brands. The company engages in the import and export of its machinery, equipment, and raw materials. Its products have applications	1180577169408.0	34.0	10.8		-23.232591966740635		58074065000.0	14196100000.0	5059500000.0	23617455000.0	170399852000.0	14.160449855886213	1.5764312972202954	0.4137614953334109	33.966625013343865	-23.232591966740635		0.3169996438865906	판정불가	불리(<1)	0.0	0.0	-100.0	보류	일부부족
2344.TW	2344.TW	Global Semicon / PCB / Memory / OSAT	151.0	76.19603894641351	41.78403755868545		-31.981981981981978	177.275	102.62225003242493	N	Y	상승전환/양호	WINBOND ELECTRONIC CORP	TAI	TWD	Technology	Semiconductors	Semiconductors	Winbond Electronics Corporation engages in the research, development, production and sales of integrated circuits, various semiconductor components and other system products. The company offers customized memory solutions, including CUBE(3DCaaS), pseudo static random access memory, DDR/SDR, LPDDR/LPSDR, Known Good Die wafer products; electrical simulation, wafer-level speed testing, and other services; redistribution layers; and failure analysis services, as well as low power SDR, DDR, DDR2, DDR	679500054528.0	32.0	0.88	559.2216984663919	-32.578077486406286		42427238000.0	26398931000.0	25731058000.0	54236531000.0	107935967000.0	3.5618458472363894	0.9584377366714482	0.6347269779281114	167.54335699177685	-32.578077486406286		-0.003450315767724881	판정불가	불리(<1)	0.0	0.0	-100.0	보류	일부부족
2337.TW	2337.TW	Global Semicon / PCB / Memory / OSAT	117.5	-2.4896265560165998	103.99306095952619		-36.657681940700805	152.15	93.9055001449585	N	Y	상승전환/양호	MACRONIX INTERNATIONAL	TAI	TWD	Technology	Semiconductors	Semiconductors	Macronix International Co., Ltd. engages in the design, manufacture, and supply of integrated circuits and memory chips. The company provides a range of NOR flash, NAND flash, e MMC, and read-only memory products. It also offers wafer foundry services to IC design and IDM companies; ArmorFlash, a security solution for a range of identification, authentication, and encryption requirements; and LybraFlash, a solution for gigabit flash memory. In addition, the company develops integrated circuit sy	226672312320.0	4.510807659574468	-1.78				14927643000.0	17385877000.0	6844010000.0	24966908000.0	45802485000.0	-1.2742734274484921	1.5426975739272604	1.3129341054700088					판정불가	판정불가				판정불가	일부부족
6239.TW	6239.TW	Global Semicon / PCB / Memory / OSAT	266.5	28.125	29.68369829683699		-29.683377308707126	331.1125	223.605	N	Y	상승전환/양호	POWERTECH TECHNOLOGY INC	TAI	TWD	Technology	Semiconductors	Semiconductors	Powertech Technology Inc., together with its subsidiaries, researches, designs, develops, assembles, manufactures, packages, tests, and sells various integrated circuit (IC) products in Taiwan, Japan, Singapore, the United States, Europe, China, Hong Kong, Macao, and internationally. It provides chip probing and final test; IC packaging services, such as wafer level packing, flip chips, wire bond BGA, lead frame, and system in package; module assembly services; and quality management services. T	196889395200.0	1.56	8.38	-18.452077134528476	-13.944410754124926		16375176000.0	25413199000.0	4703164000.0	31892991000.0	56290777000.0	-12.233432187732218	-12.614909102229706	-4.733549381699702	33.26174608445491	-13.944410754124926		-0.37233194922117624	판정불가	불리(<1)	0.0	0.0	-100.0	보류	일부부족
2449.TW	2449.TW	Global Semicon / PCB / Memory / OSAT	270.5	-0.18450184501844769	1.5009380863039379		-23.587570621468924	310.6625	263.4025	N	Y	상승전환/양호	KING YUAN ELECTRONICS CO	TAI	TWD	Technology	Semiconductors	Semiconductors	King Yuan Electronics Co., Ltd. designs, manufactures, sells, tests, and assembles integrated circuits. It offers test services, such as wafer probing; final test; burn-in; system level testing; and back end service. It also provides Technology Innovation, including wafer level chip scale package (WLCSP); high power burn in; and KYEC Bio Chip Testing, as well as equipment development, spare parts and test program, automation control, and vertical card. It also provides engineering services for M	330752524288.0	35.0	6.5	41.59903530182425	17.234581996226606		17963508000.0	30274865000.0	6357000.0	33144334000.0	50429320000.0	-10.06862183038982	-15.711436153899628	-5.808294326765112	43.16440335852151	17.234581996226606	2.5045227884245795	1.2101309859971565	매우 불리	보통(1~1.5)	42.96916399245321	279.29956595094586	3.2530742887045605	보류	충분
8150.TW	8150.TW	Global Semicon / PCB / Memory / OSAT	103.0	52.81898763823043	93.60901977985039		-15.918367346938778	102.3825002670288	63.34325013160706	Y	Y	상승전환/양호	CHIPMOS TECHNOLOGIES INC	TAI	TWD	Technology	Semiconductors	Semiconductors	ChipMOS TECHNOLOGIES INC. engages in the research and development, manufacture, and sale of integrated circuits, and related assembly and testing services in Taiwan, Japan, the People's Republic of China, and internationally. It operates through five segments: Testing; Assembly; Display Panel Driver Semiconductor Assembly and Testing; Bumping; and Others. The company offers leadframe-based packages, such as the small outline package, thin small outline package, and quad flat package; and substra	71628062720.0	1.11	1.25	-61.74913305398406	-45.70232815746953		15097129000.0	9867797000.0	5604561000.0	16327274000.0	23987112000.0	7.519694705225443	0.20879812384988078	0.20271662509697164	76.38424423581964	-45.70232815746953		-0.5837896100640922	판정불가	불리(<1)	0.0	0.0	-100.0	보류	일부부족
2368.TW	2368.TW	Global Semicon / PCB / Memory / OSAT	927.0	-23.38842975206612	44.167962674961124		-37.9933110367893	1247.85	864.315	N	Y	상승전환/양호	GOLD CIRCUIT ELECTRONICS CO	TAI	TWD	Technology	Electronic Components	Electronic Components	Gold Circuit Electronics Ltd. engages in the manufacturing, processing, and trading of electronic equipment products, such as printed circuit boards in Taiwan. Its products are used for AI/ Advanced Server, networking, notebook, handset products, automotive, and IC tests products. The company was founded in 1981 and is headquartered in Taoyuan City, Taiwan.	468485406720.0	1.06	19.0	71.06843481034197	28.12015612291836		18920059000.0	11874888000.0	6115928000.0	18073139000.0	33481159000.0	13.940399067628586	-8.980840084055895	-0.9688069130588884	48.05576847012481	28.12015612291836	1.7089438714374214	0.6072144313134645	보통	불리(<1)	60.0	1140.0	22.977346278317157	보류	충분
3189.TW	3189.TW	Global Semicon / PCB / Memory / OSAT	679.0	57.72357723577235	288.0		-23.79349046015713	742.475	349.54262519836425	N	Y	상승전환/양호	KINSUS INTERCONNECT TECHNOLOGY 	TAI	TWD	Technology	Semiconductor Equipment & Materials	Semiconductor Equipment & Materials	Kinsus Interconnect Technology Corp., together with its subsidiaries, engages in the manufacture and sale of electronic products in Taiwan and internationally. It operates through the IC Substrate and Optics segments. The company offers system in package substrate, a carrier substrate that provides a platform for multiple chips or packages or passive components assembly for multi-chip module, multi-chip package, stack die, package in package, and embedded substrates, as well as modules in handse	357775802368.0	22.0	3.4	3164.40712634744	-38.842006005271955		20390405000.0	11197127000.0	3124539000.0	14437615000.0	32731765000.0	17.447339210351196	3.2466631857813475	0.4781536356084459	194.57431199695554	-38.842006005271955		-0.08655821949166383	판정불가	불리(<1)	0.0	0.0	-100.0	보류	일부부족
2313.TW	2313.TW	Global Semicon / PCB / Memory / OSAT	199.0	-20.55888223552894	80.09049773755656		-33.333333333333336	247.71421699523927	174.16884342193603	N	Y	상승전환/양호	COMPEQ MANUFACTURING	TAI	TWD	Technology	Electronic Components	Electronic Components	Compeq Manufacturing Co., Ltd., together with its subsidiaries, manufactures and sells printed circuit boards for computers in Taiwan, the United States, rest of Asia, Europe, and internationally. The company offers high layer, rigid-flex, flexible, regular multi-layered, and high-density interconnection printed circuit boards. It also provides surface mount technology devices; and module assembly services. In addition, the company is involved in investment; trading; electronic manufacturing; ou	238545960960.0	1.31	5.45	17.284433058479443	-6.372141905534656		27233389000.0	7796664000.0	5205724000.0	13117147000.0	47862670000.0	16.214519041475803	3.840072380194492	1.9296846131630612	33.53862035936224	-6.372141905534656		-0.15093470903974046	판정불가	불리(<1)	0.0	0.0	-100.0	보류	일부부족
2316.TW	2316.TW	Global Semicon / PCB / Memory / OSAT	153.0	36.60714285714286	57.24562713385848		-34.7547974413646	187.575	120.95900005340576	N	Y	상승전환/양호	WUS PRINTED CIRCUIT CO	TAI	TWD	Technology	Electronic Components	Electronic Components	WUS Printed Circuit Co., Ltd., together with its subsidiaries, manufactures, processes, assembles, and sells double side and multi-layer printed circuit boards in Taiwan, Asia, North America, Europe, and internationally. It operates through Manufacturing and Trading of Printed Circuit Boards; Assembly and Trading of PCB/Light Products; Investment; and Others segments. It is involved in imported commodity trading business; and assembly and sale of peripheral equipment, such as electronic products	27759556608.0	1.25	13.37	212.2520816393746	68.1394170953056		8070413000.0	1632969000.0	1087016000.0	2781002000.0	12575793000.0	35.48071761236807	-1.6873095047813267	-1.1028166697917168	8.789774299748089	68.1394170953056	0.1289969106641162	7.894334339994859	매우 유망	안심(>=2)	60.0	802.1999999999999	424.313725490196	보류	충분
6981.T	6981.T	Global Semicon / PCB / Memory / OSAT	7632.0	68.84955752212389	130.71342200725513		-37.69795918367347	9905.875	4907.9225	N	Y	상승전환/양호	MURATA MANUFACTURING CO	JPX	JPY	Technology	Electronic Components	Electronic Components	Murata Manufacturing Co., Ltd. develops, manufactures, and sells ceramic-based passive electronic components and solutions in Japan, North America, and South America, Europe, China, Asia, and internationally. It operates through three segments: Components, Devices & Modules, and Other. The company offers capacitors; inductors; high frequency device and communication modules, including surface acoustic wave filters, RF modules, multilayer resin substrates, and connectivity modules; lithium-ion se	13892448157696.0	92.0	127.45	0.04362367311327997	-1.3891842891780914		702071000000.0	1516000000.0	1745000000.0	55768000000.0	2718743000000.0	384.85915863313676	95.04093777340812	1.2452953062553473	56.86261939087378	-1.3891842891780914		1.5935040749347642	판정불가	양호(>=1.5)	5.721631421643817	729.2219246885045	-90.44520538930156	보류	일부부족
6762.T	6762.T	Global Semicon / PCB / Memory / OSAT	2968.0	32.11662586245269	41.1652794292509		-27.80345414740939	3664.125	2603.7025	N	Y	상승전환/양호	TDK CORP	JPX	JPY	Technology	Electronic Components	Electronic Components	TDK Corporation, together with its subsidiaries, engages in the manufacture and sale of electronic components in Japan, Europe, China, Asia, the Americas, and internationally. The company operates through Passive Components, Sensor Application Products, Magnetic Application Products, Energy Application Products, and Others segments. The Passive Components segment offers ceramic capacitors, aluminum electrolytic capacitors, film capacitors, high-frequency components, piezoelectric material produc	5633721499648.0	1.35	102.99	17.050627837832977	19.664137529214678		1161949000000.0	332678000000.0	210953000000.0	615970000000.0	2187234000000.0	436.88285849812115	110.14964340685454	3.7112413546783873	24.576338882434012	19.664137529214678	1.249805075148674	0.8550556545358583	보통	불리(<1)	47.828275058429355	4925.834048267639	65.9647590386671	보류	충분
6976.T	6976.T	Global Semicon / PCB / Memory / OSAT	11035.0	88.72926286984779	220.22634939059776		-51.29110571617744	16271.125	6656.52	N	Y	상승전환/양호	TAIYO YUDEN CO LTD	JPX	JPY	Technology	Electronic Components	Electronic Components	Taiyo Yuden Co., Ltd. develops, manufactures, and sells electronic components in Japan, North America, China, Europe, Hong Kong, Taiwan and internationally. The company provides products, such as multilayer ceramic capacitors, inductors, high frequency devices, RF devices, and aluminum electrolytic capacitors, as well as conductive polymer hybrid aluminum electrolytic capacitors. Taiyo Yuden Co., Ltd. was incorporated in 1950 and is headquartered in Tokyo, Japan.	1380996087808.0	82.0	107.04	535.9965635738831	-13.923727854616875		100072000000.0	136017000000.0	35195000000.0	171212000000.0	344412000000.0	-287.2224492842623	464.3902374475859	4.208339260965889	105.77562078927747	-13.923727854616875		0.6435913269750723	판정불가	불리(<1)	0.0	0.0	-100.0	보류	일부부족
4062.T	4062.T	Global Semicon / PCB / Memory / OSAT	15685.0	67.21748400852879	115.74965612104538		-40.643330179754024	21350.5	10701.77	N	Y	상승전환/양호	IBIDEN CO LTD	JPX	JPY	Technology	Electronic Components	Electronic Components	Ibiden Co.,Ltd. provides electronics in Japan, the rest of Asia, North America, Europe, and internationally. It operates through Electronics, Ceramics, and Others segments. The company offers plastic packaging; printed circuit boards; and integrated circuit package substrates for use as MPUs for PCs and data centers, as well as GPUs for AI and vehicles. It also provides diesel particulate filter substrates for passenger cars mounted with diesel engines, buses, and trucks; substrate holding mats 	4379966177280.0	22.0	214.88	89.0369095656302	6.8780630049970926		295681000000.0	177476000000.0	15000000000.0	192537000000.0	550071000000.0	423.30130570108736	-2.997362149416777	-0.019109736368611904	71.02428655202398	6.8780630049970926	10.326204703333334	0.40659420047598005	매우 불리	불리(<1)	22.256126009994183	4782.39635702755	-69.509745890803	보류	충분
