티커	종목코드	유니버스	현재가	3M수익률(보조,%)	6M수익률(보조,%)	12M수익률(보조,%)	52주고점대비(보조,%)	40일이평(보조)	200일이평(보조)	40일선상회(보조)	200일선상회(보조)	추세판정(보조)	종목명	시장	통화	섹터	산업	업종	사업설명	시가총액	배당수익률(%)	EPS(FY)	EPS Growth 1Y(%)	EPS Growth 3Y CAGR(%)	EPS Growth 5Y CAGR(%)	현금및단기투자	장기부채	단기위험부채	총부채	주주지분	주당순현금(린치식)	주당잉여현금흐름	잉여현금흐름수익률(%)	순현금차감PER(린치식)	사용연성장률(%)	린치PER배수	배당감안점수	린치PER판정	배당감안점수판정	그레이엄적정PER(3년)	그레이엄내재가치(3년)	그레이엄괴리율(3년,%)	종합판정	데이터상태
GFS	GFS	Global Semicon / PCB / Memory / OSAT	70.69499969482422	72.00730491349734	98.24733594314539		-4.51782979381572	51.294250297546384	40.41440008163452	Y	Y	상승전환/양호	GlobalFoundries Inc.	NMS	USD	Technology	Semiconductors	Semiconductors	GLOBALFOUNDRIES Inc., a semiconductor foundry, provides range of mainstream wafer fabrication services and technologies in the United States, Europe, the Middle East, Africa, and internationally. It offers semiconductor devices, including microprocessors, mobile application processors, baseband processors, network processors, radio frequency modems, microcontrollers, and power management units. The company was incorporated in 2008 and is headquartered in Malta, New York.	38816673792.0		1.39	-51.0	-15.135725474232498		4397000000.0	1065000000.0	86000000.0	1707000000.0	11928000000.0	6.068416301575783	1.837644672355932	2.599398373702053	46.4939448872291	-15.135725474232498		-0.32554186380493516	판정불가	불리(<1)	0.0	0.0	-100.0	보류	일부부족
UMC	UMC	Global Semicon / PCB / Memory / OSAT	14.859999656677246	49.34673308073903	89.54080825843016		0.0	10.496000027656555	8.55130000591278	Y	Y	상승전환/양호	United Microelectronics Corpora	NYQ	USD	Technology	Semiconductors	Semiconductors	United Microelectronics Corporation operates as a semiconductor wafer foundry in Taiwan, China, Hong Kong, Japan, Korea, the United States, Europe, and internationally. It manufactures and sells integrated circuits. The company offers circuit design; mask tooling; wafer fabrication; and assembly and testing services for communication devices, consumer electronics, computer, and other applications. It also provides venture capital and marketing support; consulting and planning; energy technical; 	37378797568.0	3.45	0.62	-17.259341564967112	-23.3089317909408		146070330000.0	45372054000.0	8408772000.0	59781672000.0	365824997000.0	40.03275707208512	19.531922995785553	131.43959251041443	-40.601221637754634	-23.3089317909408			판정불가	판정불가	0.0	0.0	-100.0	판정불가	일부부족
2330.TW	2330.TW	Global Semicon / PCB / Memory / OSAT	2250.0	27.840909090909083	54.10958904109589		-1.098901098901095	1973.875	1541.35	Y	Y	상승전환/양호	TAIWAN SEMICONDUCTOR MANUFACTUR	TAI	TWD	Technology	Semiconductors	Semiconductors	Taiwan Semiconductor Manufacturing Company Limited, together with its subsidiaries, manufactures, packages, tests, and sells integrated circuits and other semiconductor devices in Taiwan, China, Europe, the Middle East, Africa, Japan, the United States, and internationally. It provides various wafer fabrication processes, such as processes to manufacture complementary metal- oxide-semiconductor (CMOS) logic, mixed-signal, radio frequency, embedded memory, bipolar CMOS mixed-signal, and others. T	58346996498432.0	1.07	73.58	46.54981153856048	19.574951863097922		3488739000000.0	896062000000.0	136925700000.0	1064582700000.0	5355038700000.0	99.97983186796236	38.26848681166127	1.7008216360738342	29.220170809079068	19.574951863097922	1.4927327031727728	0.7065308412462559	보통	불리(<1)	47.649903726195845	3506.0799161734903	55.82577405215512	보류	충분
2454.TW	2454.TW	Global Semicon / PCB / Memory / OSAT	3430.0	130.97643097643098	157.89473684210526		0.0	1923.375	1532.175	Y	Y	상승전환/양호	MEDIATEK INC	TAI	TWD	Technology	Semiconductors	Semiconductors	MediaTek Inc. engages in the research, development, production, manufacture, and marketing of multimedia integrated circuits (ICs) in Taiwan, rest of Asia, and internationally. The company offers multimedia, computer peripherals oriented, consumer-oriented, and other ICs for various applications. It also offers design, test runs, maintenance and repair, and technological consultation services for software and hardware solutions; and sale and delegation patents and circuit layout rights for its I	5474627878912.0	1.7	65.94	-1.0032496768530352	-3.7570524355304835		260128122000.0	60000000.0	4480763000.0	13730009000.0	400600988000.0	162.93960691300023	86.06802156385909	2.5092717657101775	49.54595682570518	-3.7570524355304835		-0.04151806862398213	판정불가	불리(<1)	0.985895128939033	65.00992480223984	-98.1046669153866	보류	일부부족
2303.TW	2303.TW	Global Semicon / PCB / Memory / OSAT	91.4000015258789	35.2071059008515	100.87912423270092		0.0	65.32249975204468	51.859500083923336	Y	Y	상승전환/양호	UNITED MICRO ELECTRONICS	TAI	TWD	Technology	Semiconductors	Semiconductors	United Microelectronics Corporation operates as a semiconductor wafer foundry in Taiwan, China, Hong Kong, Japan, Korea, the United States, Europe, and internationally. It manufactures and sells integrated circuits. The company offers circuit design; mask tooling; wafer fabrication; and assembly and testing services for communication devices, consumer electronics, computer, and other applications. It also provides venture capital and marketing support; consulting and planning; energy technical; 	1149536436224.0	3.43	3.94	-17.259341564967112	-23.3089317909408		146070330000.0	45372054000.0	8408772000.0	59781672000.0	365824997000.0	8.006551414417023	3.906384599157111	4.273943691402523	21.165850282096926	-23.3089317909408		-0.9391983561253543	판정불가	불리(<1)	0.0	0.0	-100.0	보류	일부부족
3711.TW	3711.TW	Global Semicon / PCB / Memory / OSAT	524.0	75.83892617449663	171.50259067357513		-0.19047619047618536	403.05	254.0525	Y	Y	상승전환/양호	ASE TECHNOLOGY HOLDING CO LTD	TAI	TWD	Technology	Semiconductors	Semiconductors	ASE Technology Holding Co., Ltd., together with its subsidiaries, provides semiconductor manufacturing services in the United States, Taiwan, rest of Asia, Europe, and internationally. It operates through Packaging, Testing, and EMS. The company offers semiconductor packaging, interconnect materials production, front-end engineering testing, wafer probing, and final testing services, as well as integrated solutions for EMS (electronic manufacturing services) in relation to computing, peripherals	2299255324672.0	1.02	10.19	23.585762669903666	-13.347387041498415		111497789000.0	214080678000.0	40733681000.0	263662466000.0	342181952000.0	-23.378628938260114	-5.3782267829267285	-1.0263791570470855	53.71723542083024	-13.347387041498415		-0.22948662463590136	판정불가	불리(<1)	0.0	0.0	-100.0	보류	일부부족
3037.TW	3037.TW	Global Semicon / PCB / Memory / OSAT	858.0	162.38532110091742	439.62264150943395		-5.81778265642151	617.7875	286.3848966217041	Y	Y	상승전환/양호	UNIMICRON TECHNOLOGY	TAI	TWD	Technology	Electronic Components	Electronic Components	Unimicron Technology Corp., together with its subsidiaries, engages in the manufacturing, processing, and sale of printed circuit boards, electrical equipment, electronic products, and integrated circuit product testing and burn-in systems in Taiwan, China, Asia, the Americas, and internationally. The company offers PCB products, including HDI, ELIC, multi-layer and rigid flex PCBs, and FPC; IC carriers, such as FCCSP, FCBGA, CSP, memory module, and coreless; connectors comprising PCBeam and X-B	1350937608192.0	16.0	4.33	31.307777963397943	-39.15067182208464		55226513000.0	34873158000.0	22207016000.0	57080174000.0	100569302000.0	12.926710705429274	-7.04265502977378	-0.8208222645423986	195.1670414075221	-39.15067182208464		-0.11861978157338798	판정불가	불리(<1)	0.0	0.0	-100.0	보류	일부부족
8046.TW	8046.TW	Global Semicon / PCB / Memory / OSAT	940.0	153.71120107962213	241.1978221415608		-6.467661691542292	669.2	341.375	Y	Y	상승전환/양호	NAN YA PRINTED CIRCUIT BOARD CO	TAI	TWD	Technology	Electronic Components	Electronic Components	Nan Ya Printed Circuit Board Corporation manufactures and sells printed circuit boards (PCBs) in Taiwan, the United States, Mainland China, Korea, and internationally. It offers conventional PCBs that are used in the motherboards of desktops and notebooks, and home electrical appliances; high density connector boards that are used in smartphones, game consoles, navigation systems, GPS, PDAs, automobile appliances, and MP3 players; and soft and hard composite boards used in high-end handheld devi	607395577856.0	10.0	2.99	855.5802618209663	-53.54257860278134		8823188000.0	0.0	0.0	1234627000.0	46122894000.0	13.654687812195082	0.9357680225344502	0.09954978963132449	309.8144856815401	-53.54257860278134		-0.14054403720663658	판정불가	불리(<1)	0.0	0.0	-100.0	보류	일부부족
4958.TW	4958.TW	Global Semicon / PCB / Memory / OSAT	412.0	150.45592705167175	154.32098765432102		-4.739884393063587	263.6375	177.325	Y	Y	상승전환/양호	ZHEN DING TECHNOLOGY HOLDING LT	TAI	TWD	Technology	Electronic Components	Electronic Components	Zhen Ding Technology Holding Limited, together with its subsidiaries, engages in the design, development, manufacture, and sale of printed circuit boards (PCB) products in the United States, Mainland China, Taiwan, Singapore, and internationally. The company offers flexible circuit boards, substrate-like PCBs, high-density interconnect PCBs, rigid printed circuit boards, IC substrates, rigid-flex PCBs, and modules. Its products are used in various applications, including mobile phones, computers	440898093056.0	81.0	6.78	-26.026818555617737	-21.794946088339774		71187918000.0	26429839000.0	25689071000.0	53010937000.0	123981554000.0	41.82446892512295	-5.524613111730137	-1.3409255125558583	54.598160925498085	-21.794946088339774		1.0843781715001075	판정불가	보통(1~1.5)	0.0	0.0	-100.0	보류	일부부족
3044.TW	3044.TW	Global Semicon / PCB / Memory / OSAT	488.0	40.836940836940826	49.00763358778626		0.0	394.975	331.7625	Y	Y	상승전환/양호	TRIPOD TECHNOLOGY CORP	TAI	TWD	Technology	Electronic Components	Electronic Components	Tripod Technology Corporation processes, manufactures, and sells printed circuit boards and other related components in Taiwan, China, Vietnam, Thailand, South Korea, Malaysia, Mexico, and internationally. The company offers printed circuit boards comprising any layer, double-sided, HDI, heavy copper, multi-layer, high layer count, flexible, rigid-flex, semi-flex, cavity, thermal, embedded ferrite, and hybrid lamination structure. It also engages in the manufacture and wholesale of electronic pa	256495730688.0	2.13	19.38	21.976442546571807	18.143871338410513		31846737000.0	1000000000.0	6478679000.0	7596649000.0	54083843000.0	58.68794686514233	11.10088164899183	2.2747708297114406	22.15232472316087	18.143871338410513	1.2209260256527765	0.9152028778818693	보통	불리(<1)	44.787742676821026	867.9864530767915	77.8660764501622	보류	충분
2327.TW	2327.TW	Global Semicon / PCB / Memory / OSAT	338.0	14.18918918918919	62.5		-3.012912482065999	286.5125	219.34	Y	Y	상승전환/양호	YAGEO CORP	TAI	TWD	Technology	Electronic Components	Electronic Components	Yageo Corporation, together with its subsidiaries, manufactures and sells electronic components in China, Europe, the United States, and the rest of Asia. It offers antennas, radio frequency, and microwave; capacitors; circuit protection; custom products; electromechanical devices; EMC; engineering kits; inductors; piezoelectric devices; power supplies; resistors; semiconductors; sensors; signal magnetics and connectors; and transformers. The company's products are used for various applications,	696358010880.0	1.43	11.47	22.099803869339073	1.3081472653207582		114742022000.0	62087637000.0	86197379000.0	150894630000.0	170877823000.0	25.557517385357823	11.919188744103925	3.526387202397611	27.239972329088246	1.3081472653207582	20.823322458583434	0.1005194583988921	매우 불리	불리(<1)	11.116294530641516	127.5038982664582	-62.27695317560409	보류	충분
2408.TW	2408.TW	Global Semicon / PCB / Memory / OSAT	282.0	5.816135084427776	156.36363636363635		-13.629402756508425	227.4125	154.8565000152588	Y	Y	상승전환/양호	NANYA TECHNOLOGY CORPORATION	TAI	TWD	Technology	Semiconductors	Semiconductors	Nanya Technology Corporation research, develops, manufactures, and sells semiconductor products in Taiwan, Japan, Malaysia, China, the United States, Thailand, Germany, Singapore, Poland and internationally. It offers standard dynamic random-access memory (DRAM), low power DRAM, MCP and eMCP, and KGD products, as well as modules; and other memory products and Elixir brands. The company engages in the import and export of its machinery, equipment, and raw materials. Its products have applications	873813049344.0	3.0592436170212767	2.1		-23.232591966740635		58074065000.0	14196100000.0	5059500000.0	23617455000.0	170399852000.0	14.160449855886213	1.5764312972202954	0.5590181905036509	127.54264292576846	-23.232591966740635		-0.15816943954549004	판정불가	불리(<1)	0.0	0.0	-100.0	보류	일부부족
2344.TW	2344.TW	Global Semicon / PCB / Memory / OSAT	108.5	3.8277511961722466	138.72386837993713		-16.538461538461537	98.59249992370606	65.01350005149841	Y	Y	상승전환/양호	WINBOND ELECTRONIC CORP	TAI	TWD	Technology	Semiconductors	Semiconductors	Winbond Electronics Corporation engages in the research, development, production and sales of integrated circuits, various semiconductor components and other system products. The company offers customized memory solutions, including CUBE(3DCaaS), pseudo static random access memory, DDR/SDR, LPDDR/LPSDR, Known Good Die wafer products; electrical simulation, wafer-level speed testing, and other services; redistribution layers; and failure analysis services, as well as low power SDR, DDR, DDR2, DDR	488250015744.0	51.0	0.88	559.2216984663919	-32.578077486406286		42427238000.0	26398931000.0	25731058000.0	54236531000.0	107935967000.0	3.5618458472363894	0.9584377366714482	0.8833527526925791	119.24790244632229	-32.578077486406286		0.1544842478205105	판정불가	불리(<1)	0.0	0.0	-100.0	보류	일부부족
2337.TW	2337.TW	Global Semicon / PCB / Memory / OSAT	172.0	134.33242019669075	516.4874636262116		0.0	135.67999992370605	59.408250150680544	Y	Y	상승전환/양호	MACRONIX INTERNATIONAL	TAI	TWD	Technology	Semiconductors	Semiconductors	Macronix International Co., Ltd. engages in the design, manufacture, and supply of integrated circuits and memory chips. The company provides a range of NOR flash, NAND flash, e MMC, and read-only memory products. It also offers wafer foundry services to IC design and IDM companies; ArmorFlash, a security solution for a range of identification, authentication, and encryption requirements; and LybraFlash, a solution for gigabit flash memory. In addition, the company develops integrated circuit sy	331809685504.0	3.0815110465116278	-1.77				14927643000.0	17385877000.0	6844010000.0	24966908000.0	45802485000.0	-1.2742734274484921	1.5426975739272604	0.8969171941437559					판정불가	판정불가				판정불가	일부부족
6239.TW	6239.TW	Global Semicon / PCB / Memory / OSAT	234.5	-8.932038834951461	54.78547854785478		-11.005692599620499	207.525	176.5875	Y	Y	상승전환/양호	POWERTECH TECHNOLOGY INC	TAI	TWD	Technology	Semiconductors	Semiconductors	Powertech Technology Inc., together with its subsidiaries, researches, designs, develops, assembles, manufactures, packages, tests, and sells various integrated circuit (IC) products in Taiwan, Japan, Singapore, the United States, Europe, China, Hong Kong, Macao, and internationally. It provides chip probing and final test; IC packaging services, such as wafer level packing, flip chips, wire bond BGA, lead frame, and system in package; module assembly services; and quality management services. T	173247889408.0	3.08	7.44	-18.452077134528476	-13.944410754124926		16375176000.0	25413199000.0	4703164000.0	31892991000.0	56290777000.0	-12.233432187732218	-12.614909102229706	-5.3794921544689585	33.16309572415755	-13.944410754124926		-0.3276054456584034	판정불가	불리(<1)	0.0	0.0	-100.0	보류	일부부족
2449.TW	2449.TW	Global Semicon / PCB / Memory / OSAT	328.5	19.672131147540984	86.11898016997168		-7.203389830508478	290.1125	217.73	Y	Y	상승전환/양호	KING YUAN ELECTRONICS CO	TAI	TWD	Technology	Semiconductors	Semiconductors	King Yuan Electronics Co., Ltd. designs, manufactures, sells, tests, and assembles integrated circuits. It offers test services, such as wafer probing; final test; burn-in; system level testing; and back end service. It also provides Technology Innovation, including wafer level chip scale package (WLCSP); high power burn in; and KYEC Bio Chip Testing, as well as equipment development, spare parts and test program, automation control, and vertical card. It also provides engineering services for M	401671716864.0	1.13	6.51	41.59903530182425	17.234581996226606		17963508000.0	30274865000.0	6357000.0	33144334000.0	50429320000.0	-10.06862183038982	-15.711436153899628	-4.7827811731810135	52.00746879115051	17.234581996226606	3.017622870258019	0.35311432036760626	매우 불리	불리(<1)	42.96916399245321	279.7292575908704	-14.84649692819774	보류	충분
8150.TW	8150.TW	Global Semicon / PCB / Memory / OSAT	89.19999694824219	35.35659314546962	179.1862122636007		0.0	64.7725004196167	44.59425004005432	Y	Y	상승전환/양호	CHIPMOS TECHNOLOGIES INC	TAI	TWD	Technology	Semiconductors	Semiconductors	ChipMOS TECHNOLOGIES INC. engages in the research and development, manufacture, and sale of integrated circuits, and related assembly and testing services in Taiwan, Japan, the People's Republic of China, and internationally. It operates through five segments: Testing; Assembly; Display Panel Driver Semiconductor Assembly and Testing; Bumping; and Others. The company offers leadframe-based packages, such as the small outline package, thin small outline package, and quad flat package; and substra	62031294464.0	1.46	0.77	-61.74913305398406	-45.70232815746953		15097129000.0	9867797000.0	5604561000.0	16327274000.0	23987112000.0	7.519694705225443	0.20879812384988078	0.2340786221899029	106.07831460132044	-45.70232815746953		-0.417072314202462	판정불가	불리(<1)	0.0	0.0	-100.0	보류	일부부족
2368.TW	2368.TW	Global Semicon / PCB / Memory / OSAT	1445.0	130.8306709265176	260.7990012484394		-2.3648648648648685	1084.15	639.93	Y	Y	상승전환/양호	GOLD CIRCUIT ELECTRONICS CO	TAI	TWD	Technology	Electronic Components	Electronic Components	Gold Circuit Electronics Ltd. engages in the manufacturing, processing, and trading of electronic equipment products, such as printed circuit boards in Taiwan. Its products are used for AI/ Advanced Server, networking, notebook, handset products, automotive, and IC tests products. The company was founded in 1981 and is headquartered in Taoyuan City, Taiwan.	722469650432.0	41.0	18.94	71.06843481034197	28.12015612291836		18920059000.0	11874888000.0	6115928000.0	18073139000.0	33481159000.0	14.090933819220407	-9.077819268409273	-0.6282227867411262	75.5495811077497	28.12015612291836	2.686670044700628	0.9148979399943777	매우 불리	불리(<1)	60.0	1136.4	-21.356401384083036	보류	충분
3189.TW	3189.TW	Global Semicon / PCB / Memory / OSAT	482.5	142.86326414638006	229.35153583617748		-9.133709981167604	392.9625	197.0956251525879	Y	Y	상승전환/양호	KINSUS INTERCONNECT TECHNOLOGY 	TAI	TWD	Technology	Semiconductor Equipment & Materials	Semiconductor Equipment & Materials	Kinsus Interconnect Technology Corp., together with its subsidiaries, engages in the manufacture and sale of electronic products in Taiwan and internationally. It operates through the IC Substrate and Optics segments. The company offers system in package substrate, a carrier substrate that provides a platform for multiple chips or packages or passive components assembly for multi-chip module, multi-chip package, stack die, package in package, and embedded substrates, as well as modules in handse	254241767424.0	18.0	3.37	3164.40712634744	-38.842006005271955		20390405000.0	11197127000.0	3124539000.0	14437615000.0	32731765000.0	17.447001472464937	3.2466003383093898	0.6728705364371792	137.99792241173148	-38.842006005271955		-0.15103130279807847	판정불가	불리(<1)	0.0	0.0	-100.0	보류	일부부족
2313.TW	2313.TW	Global Semicon / PCB / Memory / OSAT	250.0	60.771704180064305	177.161871904999		-12.587412587412583	242.4875	127.60549991607667	Y	Y	상승전환/양호	COMPEQ MANUFACTURING	TAI	TWD	Technology	Electronic Components	Electronic Components	Compeq Manufacturing Co., Ltd., together with its subsidiaries, manufactures and sells printed circuit boards for computers in Taiwan, the United States, rest of Asia, Europe, and internationally. The company offers high layer, rigid-flex, flexible, regular multi-layered, and high-density interconnection printed circuit boards. It also provides surface mount technology devices; and module assembly services. In addition, the company is involved in investment; trading; electronic manufacturing; ou	297955131392.0	1.02	5.49	17.284433058479443	-6.372141905534656		27233389000.0	7796664000.0	5205724000.0	13117147000.0	47862670000.0	16.308431822708886	3.8623136737190142	1.5449254694876058	42.56677015979802	-6.372141905534656		-0.12573521283015882	판정불가	불리(<1)	0.0	0.0	-100.0	보류	일부부족
2316.TW	2316.TW	Global Semicon / PCB / Memory / OSAT	117.0	18.181818181818187	16.417910447761198		-3.3057851239669422	106.92250022888183	97.45000003814697	Y	Y	상승전환/양호	WUS PRINTED CIRCUIT CO	TAI	TWD	Technology	Electronic Components	Electronic Components	WUS Printed Circuit Co., Ltd., together with its subsidiaries, manufactures, processes, assembles, and sells double side and multi-layer printed circuit boards in Taiwan, Asia, North America, Europe, and internationally. It operates through Manufacturing and Trading of Printed Circuit Boards; Assembly and Trading of PCB/Light Products; Investment; and Others segments. It is involved in imported commodity trading business; and assembly and sale of peripheral equipment, such as electronic products	21227896832.0	42.0	13.37	212.2520816393746	68.1394170953056		8070413000.0	1632969000.0	1087016000.0	2781002000.0	12575793000.0	35.48071761236807	-1.6873095047813267	-1.4421448758814757	6.0971789369956575	68.1394170953056	0.08948093771432801	18.063996191257598	매우 유망	안심(>=2)	60.0	802.1999999999999	585.6410256410256	보류	충분
6981.T	6981.T	Global Semicon / PCB / Memory / OSAT	5138.0	61.21744587386257	77.17241379310344		-0.3491078355314148	4083.075	3164.85	Y	Y	상승전환/양호	MURATA MANUFACTURING CO	JPX	JPY	Technology	Electronic Components	Electronic Components	Murata Manufacturing Co., Ltd. develops, manufactures, and sells ceramic-based passive electronic components and solutions in Japan and internationally. It operates through three segments: Components, Devices & Modules, and Other. The company offers capacitors; inductors; high frequency device and communication modules, including surface acoustic wave filters, RF modules, multilayer resin substrates, and connectivity modules; lithium-ion secondary batteries; and sensors; antennas and related pro	9352660385792.0	1.36	103.27	29.29693980247514	-9.372721025044118		726518000000.0	1656000000.0	781000000.0	59993000000.0	2580805000000.0	398.21190219481423	142.3194622125248	2.769938929788338	45.897047524016514	-9.372721025044118		-0.17458031523381343	판정불가	불리(<1)	0.0	0.0	-100.0	보류	일부부족
6762.T	6762.T	Global Semicon / PCB / Memory / OSAT	2775.5	43.51085832471562	15.213781652137826		-3.9785504238021074	2277.325	2175.7225	Y	Y	상승전환/양호	TDK CORP	JPX	JPY	Technology	Electronic Components	Electronic Components	TDK Corporation, together with its subsidiaries, engages in the manufacture and sale of electronic components in Japan, Europe, China, Asia, the Americas, and internationally. The company operates through Passive Components, Sensor Application Products, Magnetic Application Products, Energy Application Products, and Others segments. The Passive Components segment offers ceramic capacitors, aluminum electrolytic capacitors, film capacitors, high-frequency components, piezoelectric material produc	5268289617920.0	1.44	102.97	34.06449750174436	8.382446471444771		851915000000.0	346001000000.0	187145000000.0	608400000000.0	1800070000000.0	266.531358111227	116.19212850419834	4.186349432685942	24.36601575108064	8.382446471444771	2.9067904977484447	0.40312074701868905	매우 불리	불리(<1)	25.264892942889542	2601.526026329336	-6.268202978586334	보류	충분
