티커	종목코드	유니버스	현재가	3M수익률(보조,%)	6M수익률(보조,%)	12M수익률(보조,%)	52주고점대비(보조,%)	40일이평(보조)	200일이평(보조)	40일선상회(보조)	200일선상회(보조)	추세판정(보조)	종목명	시장	통화	섹터	산업	업종	사업설명	시가총액	배당수익률(%)	EPS(FY)	EPS Growth 1Y(%)	EPS Growth 3Y CAGR(%)	EPS Growth 5Y CAGR(%)	현금및단기투자	장기부채	단기위험부채	총부채	주주지분	주당순현금(린치식)	주당잉여현금흐름	잉여현금흐름수익률(%)	순현금차감PER(린치식)	사용연성장률(%)	린치PER배수	배당감안점수	린치PER판정	배당감안점수판정	그레이엄적정PER(3년)	그레이엄내재가치(3년)	그레이엄괴리율(3년,%)	종합판정	데이터상태
009150.KS	009150.KS	Global Semicon / PCB / Memory / OSAT	1584000.0	208.17120622568095	486.66666666666663		-30.22026431718061	1754475.0	639746.0	N	Y	상승전환/양호	SamsungElecMech	KSC	KRW	Technology	Electronic Components	Electronic Components	Samsung Electro-Mechanics Co., Ltd. manufactures and sells various electronic components in Korea, China, Southeast Asia, Japan, the Americas, and Europe. The company operates through three segments: Component, Package Solution, and Optics Solution. It offers multilayer ceramic capacitors, inductors, tantalums, and chip resistors; camera modules; package substrates; and semiconductor PKG boards. The company is also involved in the real estate and real estate software, as well as investment busin	97380405870592.0	15.0	9713.540572348942	3.9731852611235574	-10.36699722244878		2741115492930.0	188444338600.0	2003354614630.0	2277190879280.0	9541761553950.0	35115.44046859304	3353.3490806410505	0.21170133084855114	159.4562299910025	-10.36699722244878		0.029055012637716583	판정불가	불리(<1)	0.0	0.0	-100.0	보류	일부부족
011070.KS	011070.KS	Global Semicon / PCB / Memory / OSAT	742000.0	113.83285302593661	171.7948717948718		-51.503267973856204	1007575.0	434988.0	N	Y	상승전환/양호	LG Innotek	KSC	KRW	Technology	Electronic Components	Electronic Components	LG Innotek Co., Ltd. engages in the manufacture and sale of electronic materials and components for mobile, display, semiconductor, automobile, and Internet of Things (IoT) fields in South Korea and internationally. It offers optics solutions, including camera and 3D sensing modules, and actuators; substrates and materials comprising package and tape substrates, and display masks; automotive components, such as connectivity, autonomous driving, electrification, and lighting solutions; and electr	15642239434752.0	25.0	14420.83707892161	-24.041453545052683	-29.642622092696946		1409003000000.0	1540157000000.0	722253000000.0	2282210000000.0	5763054000000.0	-5542.2240573192585	24377.182250194353	3.2853345350666245	51.83764437294513	-29.642622092696946		-0.0895608230052985	판정불가	불리(<1)	0.0	0.0	-100.0	보류	일부부족
222800.KS	222800.KS	Global Semicon / PCB / Memory / OSAT	122700.0				0.0					중립	222800.KS,0P00016I7F,139578	KOE	KRW											55114333000.0	130960931420.0	444465223250.0	587056910110.0	575653321790.0								판정불가	판정불가				판정불가	핵심부족
272210.KS	272210.KS	Global Semicon / PCB / Memory / OSAT	71700.0	-45.09954058192955	23.620689655172413		-55.93116164720344	91375.0	88216.0	N	N	중립	HANWHA SYSTEMS	KSC	KRW	Industrials	Aerospace & Defense	Aerospace & Defense	Hanwha Systems Co., Ltd. manufacture and sell various military equipments in South Korea and internationally. The company offers electro-optics, infra-red, and synthetic aperture radar (SAR) payloads to be mounted on mid-to-large sized satellites, as well as the system and payload development solutions for micro-satellites; avionics solutions for fixed wing, rotary wing, and unmanned aircrafts; and terminals for military satellite communication networks, including network controllers. It also pr	12435052298240.0	70.0	1295.4037454857798	-46.6802244215234			414802712120.0	1073225847000.0	401210396000.0	1609895393000.0	4849228707420.0	-3521.1062225392175	-1296.420434638016	-1.8081177610014172	58.06769239680646	-46.6802244215234		0.4015963889028095	판정불가	불리(<1)	8.5	11010.931836629128	-84.64305183175853	보류	일부부족
353200.KQ	353200.KQ	Global Semicon / PCB / Memory / OSAT	120900.0	36.455981941309254	152.92887029288704		-36.668412781561024	147495.0	76709.75	N	Y	상승전환/양호	353200.KQ,0P0001JYFD,174188	KOE	KRW						1.3234077750206783		100.33612913869962	-36.27084611105344		422917053930.0	6581568000.0	41020349000.0	41211519000.0	897305160160.0					-36.27084611105344			판정불가	판정불가				판정불가	핵심부족
