티커	종목코드	유니버스	현재가	3M수익률(보조,%)	6M수익률(보조,%)	12M수익률(보조,%)	52주고점대비(보조,%)	40일이평(보조)	200일이평(보조)	40일선상회(보조)	200일선상회(보조)	추세판정(보조)	종목명	시장	통화	섹터	산업	업종	사업설명	시가총액	배당수익률(%)	EPS(FY)	EPS Growth 1Y(%)	EPS Growth 3Y CAGR(%)	EPS Growth 5Y CAGR(%)	현금및단기투자	장기부채	단기위험부채	총부채	주주지분	주당순현금(린치식)	주당잉여현금흐름	잉여현금흐름수익률(%)	순현금차감PER(린치식)	사용연성장률(%)	린치PER배수	배당감안점수	린치PER판정	배당감안점수판정	그레이엄적정PER(3년)	그레이엄내재가치(3년)	그레이엄괴리율(3년,%)	종합판정	데이터상태
6976.T	6976.T	Global Semicon / PCB / Memory / OSAT	6630.0	105.32672654072468	70.48084340447416		0.0	4932.425	3732.4525	Y	Y	상승전환/양호	TAIYO YUDEN CO LTD	JPX	JPY	Technology	Electronic Components	Electronic Components	Taiyo Yuden Co., Ltd. develops, manufactures, and sells electronic components in Japan, North America, China, Europe, Hong Kong, and internationally. It offers multilayer ceramic capacitors, inductors, saw devices for communications, RF devices, circuit modules, and aluminum electrolytic capacitors, as well as conductive polymer hybrid aluminum electrolytic capacitors. Taiyo Yuden Co., Ltd. was incorporated in 1950 and is headquartered in Tokyo, Japan.	829085384704.0	1.47	30.72	-72.00913791030419	-65.01365995266472		78166000000.0	144698000000.0	19702000000.0	164400000000.0	319169000000.0	-532.0406895174406	271.41816032753337	4.093788240234289	233.13934536189583	-65.01365995266472		-0.2725565684935232	판정불가	불리(<1)	0.0	0.0	-100.0	보류	일부부족
4062.T	4062.T	Global Semicon / PCB / Memory / OSAT	16375.0	98.31657987162407	211.60799238820172		0.0	9429.3	6407.6325	Y	Y	상승전환/양호	IBIDEN CO LTD	JPX	JPY	Technology	Electronic Components	Electronic Components	Ibiden Co.,Ltd., together with its subsidiaries, manufactures and sells electronic and ceramics products in Japan, Asia, North America, and internationally. The company offers printed circuit boards; plastic packaging; and integrated circuit package substrates used as microprocessor units for personal computers and data centers, as well as graphic processing units for AI and vehicles. It also provides diesel particulate filter substrates for passenger cars mounted with diesel engines, buses, and	4572650668032.0	15.0	119.04	7.030803429660204	-6.4991235939926835		390656000000.0	252976000000.0	90000000000.0	343060000000.0	490493000000.0	493.042245698851	-285.15732846276734	-1.741418799772625	133.4169838230943	-6.4991235939926835		0.06371659860995767	판정불가	불리(<1)	0.0	0.0	-100.0	보류	일부부족
6861.T	6861.T	Global Semicon / PCB / Memory / OSAT	79350.0	34.994896223205174	30.10329562223315		0.0	61998.0	58122.15	Y	Y	상승전환/양호	KEYENCE CORP	JPX	JPY	Technology	Scientific & Technical Instruments	Scientific & Technical Instruments	Keyence Corporation, together with its subsidiaries, manufactures and sells electronic application equipment. It offers photoelectric, fiber optic, laser, positioning, vision, and inductive proximity sensors; network communication units; measurement sensors, such as laser displacement and profiler/3D laser snapshot sensors, optical/laser micrometers, inductive displacement sensors, 3D interference measurement sensors, spectral interference displacement sensors, inductive displacement sensors, an	19244368527360.0	72.0	1835.04	7.849216268714043	9.533423797831464		1859417000000.0	0.0	0.0	0.0	3108552000000.0	7666.904266780825	1629.4393501546165	2.053483743106007	39.06350582724038	9.533423797831464	4.0975316586813255	2.087201905492448	매우 불리	안심(>=2)	27.566847595662928	50586.2680119453	-36.24918965098261	보류	충분
8035.T	8035.T	Global Semicon / PCB / Memory / OSAT	51720.0	25.13912412291315	70.86223984142717		0.0	41848.0	33516.85	Y	Y	상승전환/양호	TOKYO ELECTRON	JPX	JPY	Technology	Semiconductor Equipment & Materials	Semiconductor Equipment & Materials	Tokyo Electron Limited, together with its subsidiaries, develops, manufactures, and sells semiconductor production equipment in Japan, South Korea, Taiwan, China, North America, Europe, and internationally. The company provides coaters/developers, plasma etch systems, cleaning systems, deposition systems, test systems, 3D integration systems, SiC Epitaxial CVD systems, and gas cluster beam systems, as well as other deposition and lithography and other products. It also offers engineering service	23626585735168.0	1.52	1252.68	49.50228457288242	7.57615934348288		576236000000.0	0.0	0.0	0.0	1855206000000.0	1266.8770981780767	910.4917899158987	1.7604249611676308	40.2761462638678	7.57615934348288	5.3161693726140955	0.2258448284473321	매우 불리	불리(<1)	23.65231868696576	29628.78657278827	-42.71309634031657	보류	충분
6857.T	6857.T	Global Semicon / PCB / Memory / OSAT	29715.0	10.62918838421445	73.97540983606557		-5.666666666666664	25103.5	19414.975	Y	Y	상승전환/양호	ADVANTEST CORP	JPX	JPY	Technology	Semiconductor Equipment & Materials	Semiconductor Equipment & Materials	Advantest Corporation, together with its subsidiaries, manufactures and sells semiconductors, component test systems, and mechatronics-related products in Japan, rest of Asia, the Americas, and Europe. It operates in three segments: Semiconductor and Component Test System Business; Mechatronics Related Business; and Services, Support and Others. The company offers automated test equipment, including system on chip, power device, and memory test systems, as well as burn-in and SSD test systems; a	21558701588480.0	22.0	514.58	158.75260876545192	22.676473519396858		262544000000.0	3000000.0	74952000000.0	93503000000.0	506539000000.0	361.86807879970894	367.38001959036654	1.2363453460890679	57.04289308018246	22.676473519396858	2.5155098755275804	0.7832084087424752	매우 불리	불리(<1)	53.852947038793715	27711.649487222472	-6.741882930430854	보류	충분
6146.T	6146.T	Global Semicon / PCB / Memory / OSAT	76590.0	13.736263736263732	43.29279700654818		-4.262500000000003	69424.0	54884.25	Y	Y	상승전환/양호	DISCO CORPORATION	JPX	JPY	Technology	Semiconductor Equipment & Materials	Semiconductor Equipment & Materials	Disco Corporation manufactures and sells precision cutting, grinding, and polishing machines in Japan and internationally. Its precision machines include dicing saws, laser saws, grinders, polishers, wafer mounters, die separators, surface planers, and waterjet saws. The company also offers precision processing tools, such as dicing blades, grinding wheels, and dry polishing wheels; and other products, such as accessory equipment, cut-off wheels, and related products. In addition, it is involved	8307106381824.0	70.0	1249.93	47.13021792055103	23.22934390915492		229167000000.0	0.0	0.0	0.0	492352000000.0	2112.877756062548	492.6516907645787	0.6432323942611029	59.58503455708516	23.22934390915492	2.565076086096521	1.564643615668914	매우 불리	양호(>=1.5)	54.95868781830984	68694.51266474002	-10.308770512155608	보류	충분
7735.T	7735.T	Global Semicon / PCB / Memory / OSAT	11300.0	13.113113113113117	68.97196261682244		-4.601097509497675	10029.175	7818.1225	Y	Y	상승전환/양호	SCREEN HOLDINGS CO LTD	JPX	JPY	Technology	Semiconductor Equipment & Materials	Semiconductor Equipment & Materials	SCREEN Holdings Co., Ltd. develops, manufactures, and markets semiconductor production equipment in Japan, Taiwan, South Korea, China, the United States, Europe, and internationally. It operates through Semiconductor Production Equipment, Graphic Arts Equipment, Display Production Equipment and Coater, and Printed Circuit Board (PCB)-Related Equipment segments. The company offers wafer cleaning systems, such as wet stations, spin processors, and spin scrubbers; coat/develop trackers, and spray c	2136695635968.0	1.35	311.7	40.930021677836194	29.8024843823244		260397000000.0	757000000.0	1013000000.0	4562000000.0	420639000000.0	1373.116508978095	241.51175325644226	2.1372721527118785	31.84755691697756	29.8024843823244	1.0686208743008712	0.9781750124047154	보통	불리(<1)	60.0	18702.0	65.50442477876106	보류	충분
6723.T	6723.T	Global Semicon / PCB / Memory / OSAT	3623.0	38.04534196989904	96.5283428261459		0.0	2650.95	2187.505	Y	Y	상승전환/양호	RENESAS ELECTRONICS CORP	JPX	JPY	Technology	Semiconductors	Semiconductors	Renesas Electronics Corporation engages in the design, research, development, manufacturing, sale, and service of semiconductors in Japan, China, rest of Asia, Europe, North America, and internationally. The company operates through Automotive Business and Industrial/Infrastructure/IoT Business segments. It offers microcontrollers and microprocessors; amplifiers, audio and video, data converters, power line communication, and switches and multiplexer products; custom ASICS and processor IP solut	6573190021120.0	87.0	-28.52	162.1			373099000000.0	964089000000.0	242478000000.0	1206567000000.0	2443034000000.0	-325.7409006245188	175.87385024717142	4.854370694098025		162.1			판정불가	판정불가				판정불가	일부부족
6758.T	6758.T	Global Semicon / PCB / Memory / OSAT	3130.0	-8.799533799533798	-28.489833219099836		-33.40425531914894	3302.3	3867.202468261719	N	N	주의	SONY GROUP CORPORATION	JPX	JPY	Technology	Consumer Electronics	Consumer Electronics	Sony Group Corporation designs, develops, produces, and sells electronic equipment, instruments, and devices for the consumer, professional, and industrial markets in Japan, the United States, Europe, China, the Asia-Pacific, and internationally. The company distributes software titles and add-on content through digital networks; network services related to game, video, and music content; hardware and home gaming consoles, packaged and game software, and peripheral devices. It also develops, pro	18490998128640.0	80.0	206.38	17.62124023643765	8.973084964624945		3915606000000.0	2066842000000.0	2131404000000.0	4198246000000.0	8179745000000.0	312.94315006455844	283.38562888193434	9.053853957889276	13.64985390994981	8.973084964624945	1.5211996725498902	6.518244484636546	보통	안심(>=2)	26.44616992924989	5457.960549998592	74.37573642168024	보류	충분
3407.T	3407.T	Global Semicon / PCB / Memory / OSAT	1545.5	3.9690548267742987	25.75264442636289		-17.988856460599635	1577.1625	1365.3425	N	Y	상승전환/양호	ASAHI KASEI CORP	JPX	JPY	Industrials	Conglomerates	Conglomerates	Asahi Kasei Corporation engages in material, homes, healthcare businesses. The company offers Pimel photosensitive polyimide/PBO precursor, a liquid photosensitive material for buffer coating and packaging applications; Sunfort dry film photoresist to form circuit patterns on printed wiring boards; Novacure, a latent curing agent for epoxy resin with storage stability; glass fabric for printed circuit boards; plastic optical fiber; suede products under the Dinamica name; Microza UF and MF indust	2096379068416.0	2.62	103.21	208.1701136830571	-5.873847414568534		393467000000.0	847209000000.0	310249000000.0	1195045000000.0	1859421000000.0	-334.5092773517144	61.595025637335176	3.985443263496291	18.215379104270077	-5.873847414568534		-0.1786318800142766	판정불가	불리(<1)	0.0	0.0	-100.0	보류	일부부족
5201.T	5201.T	Global Semicon / PCB / Memory / OSAT	5683.0	-0.14057283429976808	15.62563580874874		-17.994227994227995	5690.725	5247.545	N	Y	상승전환/양호	AGC INC	JPX	JPY	Industrials	Conglomerates	Conglomerates	AGC Inc. manufactures and sells architectural glass, electronics, chemicals, automotive, and ceramics worldwide. The company offers architectural glass products, including insulated, laminated, wired, toughened, solar control, sound insulation, decorative, float and patterned, and industrial glass, as well as structural glazing systems and industrial glass; automotive glass for displays, sensors and connected drive, windows, and trains; and glass substrates used for thin-film-transistor liquid c	1206865625088.0	3.77	325.52	139.9			94671000000.0	429514000000.0	216949000000.0	646463000000.0	1485126000000.0	-1576.739549846587	305.75307147256694	5.380134989839291	22.30197699018981	139.9	0.15941370257462337	6.44202978342223	매우 유망	안심(>=2)	8.5	2766.92	-51.31233503431286	양호	충분
3110.T	3110.T	Global Semicon / PCB / Memory / OSAT	31950.0	115.58704453441297	301.38190954773864		0.0	24025.25	13442.0	Y	Y	상승전환/양호	NITTO BOSEKI CO	JPX	JPY	Consumer Cyclical	Textile Manufacturing	Textile Manufacturing	Nitto Boseki Co., Ltd. manufactures, processes, and sells glass fiber products, chemical and pharmaceutical products, and textile products in Japan. It operates through six segments: Electronic Materials Business, Medical Business, Composite Materials Business, Materials Solution Business, Insulation Materials Business, and Other Businesses. The company engages in the development, manufacture, and sale of glass fiber products for electronic materials; in vitro diagnostic reagents; glass fiber pr	1163164123136.0	40.0	394.24	75.94572368421053	25.34129768244895		28546000000.0	33743000000.0	17826000000.0	52746000000.0	129733000000.0	-142.7521202411794	525.2190285032887	1.6438780234844717	81.4040993309689	25.34129768244895	3.2123098173993005	0.802678221606352	매우 불리	불리(<1)	59.1825953648979	23332.14639665735	-26.972937725642097	보류	충분
600183.SS	600183.SS	Global Semicon / PCB / Memory / OSAT	82.0	16.34505688759038	27.428130449726428		0.0	64.4984998703003	58.35105003356934	Y	Y	상승전환/양호	SHENGYI TECHNOLOGY CO LTD	SHH	CNY	Technology	Electronic Components	Electronic Components	Shengyi Technology Co.,Ltd. engages in the design, production, and sales of copper clad laminates, bonding sheets, and printed circuit boards in China and internationally. The company offers flame-retardant epoxy glass fabric reinforced laminates, composite epoxy materials, and flexible circuit materials, as well as prereg for multilayer circuit boards; and smart and rigid materials, automotive and RF materials, IMS and HTC materials, IC substrate and flexible materials, HSD materials, and speci	199187775488.0	1.24	1.62	91.75319663725077	29.622792505245087		3239977726.09	902984683.16	2304818271.34	3676930770.8	16723501226.33	0.962074242411724	1.1930143211125952	1.4548955135519455	50.023410961474234	29.622792505245087	1.688679787788979	0.6169669743035758	보통	불리(<1)	60.0	97.2	18.536585365853654	보류	충분
002916.SZ	002916.SZ	Global Semicon / PCB / Memory / OSAT	323.5	33.9544513457557	46.333735596054225		0.0	264.15024795532224	212.67185028076173	Y	Y	상승전환/양호	SHENNAN CIRCUITS CO LTD	SHZ	CNY	Technology	Electronic Components	Electronic Components	Shennan Circuits Co., Ltd. engages in the design, manufacture, and sale of printed circuit boards, packaging substrates, and electronic assemblies in China and internationally. It operates through Packaging Substrates, Packaging Substrates, and Distribution Substrates segments. The company provides RF and microwave, thermal management, miniaturization, and chip package substrate solutions. It also offers schematic design, PCB / SiP design, PCB / SUB production, electronic assembly, package testi	220357394432.0	36.0	5.23	74.46731868482586	25.905809548765156		1588756438.22	2679204686.22	15009670.83	3557910474.95	17149430529.85	-1.600853970239101	0.10703819865094824	0.033087542086846444	62.16077513771301	25.905809548765156	2.399491705545871	0.9958982881345512	매우 불리	불리(<1)	60.0	313.8	-2.998454404945905	보류	충분
688981.SS	688981.SS	Global Semicon / PCB / Memory / OSAT	125.33999633789062	2.8051166505155267	-6.8104116446909835		-10.55449085104252	104.70650005340576	111.66465003967285	Y	Y	상승전환/양호	SEMICONDUCTOR MANUFACTURING INT	SHH	CNY	Technology	Semiconductors	Semiconductors	Semiconductor Manufacturing International Corporation, an investment holding company, engages in the manufacture, testing, and sale of integrated circuits wafer and various compound semiconductors in the United States, China, and Eurasia. The company is also involved in the manufacturing, sale, and trading of semiconductor products; and research and development activities. In addition, it offers semiconductor foundry and technology services; supporting services comprising design and IP support, 	1004365021184.0		0.62	39.04287790107723	-27.767740812712226		14935414000.0	9994773000.0	2593077000.0	12596181000.0	21439670000.0	2.4708609402945965	-2.60515381357045	-2.078469674235107	198.1760248348323	-27.767740812712226		-0.140116549597031	판정불가	불리(<1)	0.0	0.0	-100.0	보류	일부부족
603501.SS	603501.SS	Global Semicon / PCB / Memory / OSAT	100.26000213623047	-19.547424228426834	-24.82566858599976		-33.67731471149361	99.97975006103516	121.94370010375977	Y	N	주의	OMNIVISION INTEGRATED CIRCUITS 	SHH	CNY	Technology	Semiconductors	Semiconductors	OmniVision Integrated Circuits Group, Inc., together with its subsidiaries, engages in the design, development, and sale of integrated circuits and computer software and hardware in China and internationally. It operates in two segments, Semiconductor Design and Electronic Components Agency. The company offers image sensors, application-specific integrated circuits, camera cube chips, liquid crystal on silicon, display solutions, in-system programming, and cable modules. It also provides semicon	126447968256.0	61.0	3.04	21.730996944226554	59.85671328521085		13072154645.060001	1617721215.79	2078985512.66	9796924850.61	28172055029.35	9.462880618100037	1.4730734618476904	1.469253371694646	29.86747418359554	59.85671328521085	0.49898286331359715	4.046432334462027	매우 유망	안심(>=2)	60.0	182.4	81.92698595014991	매우 유망	충분
1888.HK	1888.HK	Global Semicon / PCB / Memory / OSAT	41.220001220703125	177.9501108075673	199.12918736911632		0.0	26.153250074386598	15.79514997959137	Y	Y	상승전환/양호	KB LAMINATES	HKG	HKD	Technology	Electronic Components	Electronic Components	Kingboard Laminates Holdings Limited, an investment holding company, manufactures and sells laminates in the People's Republic of China, Europe, other Asian countries, and the United States. The company operates through Laminates, Properties, and Investments segments. It offers glass epoxy and paper laminates. The company also provides upstream component materials, such as copper foils, glass yarns, glass fabrics, bleached kraft papers, epoxy resins, kraft papers for copper-clad laminates, and P	129238097920.0	1.31	0.78	84.16268505447569	8.55356145230186		3010761000.0	637441000.0	3552115000.0	4191710000.0	16341745000.0	0.7569613995359332	0.28112013906054395	0.681999346762146	51.875692078419476	8.55356145230186	6.064806147439222	0.19013840697086618	매우 불리	불리(<1)	25.60712290460372	19.973555865590903	-51.54401922831822	보류	충분
0981.HK	0981.HK	Global Semicon / PCB / Memory / OSAT	76.75	-0.6472491909385147	-4.182270334503713		-15.705659058164889	60.63875036239624	66.03679986953735	Y	Y	상승전환/양호	SMIC	HKG	HKD	Technology	Semiconductors	Semiconductors	Semiconductor Manufacturing International Corporation, an investment holding company, engages in the manufacture, testing, and sale of integrated circuits wafer and various compound semiconductors in the United States, China, and Eurasia. The company is also involved in the manufacturing, sale, and trading of semiconductor products; and research and development activities. In addition, it offers semiconductor foundry and technology services; supporting services comprising design and IP support, 	615007322112.0		0.7	39.04287790107723	-27.767740812712226		14935414000.0	9994773000.0	2593077000.0	12596181000.0	21439670000.0	0.821583099937418	-0.866236667172296	-1.1286471233515256	108.46916700008941	-27.767740812712226		-0.2559966263287459	판정불가	불리(<1)	0.0	0.0	-100.0	보류	일부부족
2382.HK	2382.HK	Global Semicon / PCB / Memory / OSAT	67.19999694824219	6.836240569237728	-16.883119089047447		-26.072611858966155	60.007499885559085	69.29675016403198	Y	N	상승전환/양호	SUNNY OPTICAL	HKG	HKD	Technology	Electronic Components	Electronic Components	Sunny Optical Technology (Group) Company Limited, an investment holding company, engages in designing, researching, developing, manufacturing, and selling optical and optical related products, and scientific instruments. It operates through Optical Components, Optoelectronic Products, and Optical Instruments segments. The Optical Components segment offers vehicle lens sets and optical parts for vehicle light detection and ranging, handset lens sets, glass spherical and aspherical lenses for digi	72184545280.0	1.84	4.87	71.87231282040072	24.433762661282877		38549973000.0	1405760000.0	4655009000.0	6244099000.0	29148588000.0	34.57930031499529	2.931125362464284	4.361793892225699	6.698294996559938	24.433762661282877	0.27414095362290997	3.922455292694091	매우 유망	안심(>=2)	57.367525322565754	279.37984832089523	315.7438407862952	매우 유망	충분
TTMI	TTMI	Global Semicon / PCB / Memory / OSAT	153.5	65.80254586742787	131.55830122193458		-6.766277594112314	117.81299953460693	78.26884979248047	Y	Y	상승전환/양호	TTM Technologies, Inc.	NMS	USD	Technology	Electronic Components	Electronic Components	TTM Technologies, Inc. manufactures and sells mission systems, radio frequency (RF) components, RF microwave/microelectronic assemblies, and printed circuit boards (PCBs) and substrates in the United States, Taiwan, and internationally. It operates in three segments, A&D, Commercial, and RF&S Components. The company offers various engineered systems and RF and microwave assemblies; PCBs and IC substrates, custom assemblies and integrated systems, passive and advanced ceramic RF components, hi-re	15940983808.0		1.84	215.1885468658413	23.334906230221144		501234000.0	912336000.0	3815000.0	1028413000.0	1762253000.0	-3.958611135695166	-0.006576789715641856	-0.0042845535606787334	85.57533213896477	23.334906230221144	3.6672670245460752	0.27268262531926685	매우 불리	불리(<1)	55.16981246044229	101.51245492721381	-33.8681075392744	보류	충분
005930.KS	005930.KS	Global Semicon / PCB / Memory / OSAT	266000.0	65.52582451773492	164.67661691542287		0.0	202796.25	126907.0	Y	Y	상승전환/양호	SamsungElec	KSC	KRW	Technology	Consumer Electronics	Consumer Electronics	Samsung Electronics Co., Ltd. engages in the consumer electronics, information technology and mobile communications, and device solutions businesses worldwide. The company operates through four divisions: Device eXperience (DX), Device Solutions (DS), SDC, and Harman. The company offers smartphones, tablets, audio sounds, watches, switches, and accessories; TVs, and sound devices; appliances, including refrigerators, washing machines and dryers, vacuum cleaners, cooking appliances, dishwashers, 	1782821999869952.0	56.00000000000001	7678.605560818366	31.645335140041773	-6.832366066754158		193837850000000.0	2813148000000.0	17584050000000.0	25239139000000.0	424313255000000.0	33139.892844403796	5753.104608252318	2.162821281297864	30.3258326412561	-6.832366066754158		1.6213119196060208	판정불가	양호(>=1.5)	0.0	0.0	-100.0	보류	일부부족
000660.KS	000660.KS	Global Semicon / PCB / Memory / OSAT	1601000.0	85.94657375145181	186.91756272401432		0.0	1062925.0	636167.5	Y	Y	상승전환/양호	SK hynix	KSC	KRW	Technology	Semiconductors	Semiconductors	SK hynix Inc. research, develops manufactures, and sells semiconductor devices in Korea, China, rest of Asia, the United States, and Europe. It offers DRAM, NAND storage, SSD, MCP, and CMM products. The company provides its products for server, networking, mobile, personal computer, consumer, and automotive applications. It is also involved in the construction, business support, industrial material distribution, semiconductor apparel manufacturing, baking, hospital, education, information and co	1172178447892480.0	19.0	60561.17247655224	116.88806343383877	168.00595548778566		55351258000000.0	14086148000000.0	8161757000000.0	24757848000000.0	120516178000000.0	58227.04939096263	34985.21698669432	2.1852103052276277	25.47462156889978	168.00595548778566	0.15162927703924065	7.340872757697347	매우 유망	안심(>=2)	60.0	3633670.3485931344	126.96254519632322	매우 유망	충분
042700.KS	042700.KS	Global Semicon / PCB / Memory / OSAT	394500.0	93.85749385749386	185.45586107091174		0.0	300825.0	168007.0	Y	Y	상승전환/양호	HANMISemi	KSC	KRW	Technology	Semiconductor Equipment & Materials	Semiconductor Equipment & Materials	HANMI Semiconductor Co., Ltd. manufactures and sells semiconductor equipment in South Korea and internationally. The company offers bonder; micro SAW equipment; vision placement equipment; meta grinder; EMI shield vision attach and detach, EMI shield vision placement, EMI shield tape mounter, EMI shield tape laser cutting, EMI shield tape demounter, vision inspection, and converlay attach equipment; laser marking, laser ablation, and laser cutting equipment; and pick and place, strip mounter, an	37277229121536.0	20.0	2256.2021643764106	40.22753487679789	32.37512374110017		278201051520.0	0.0	1339920070.0	2554319940.0	690327519530.0	2932.9704453634477	1422.1134652122028	0.36048503554174977	173.55139345984156	32.37512374110017	5.360640312843603	0.3017845186775718	매우 불리	불리(<1)	60.0	135372.12986258464	-65.68513818438919	보류	충분
