티커	종목코드	유니버스	현재가	3M수익률(보조,%)	6M수익률(보조,%)	12M수익률(보조,%)	52주고점대비(보조,%)	40일이평(보조)	200일이평(보조)	40일선상회(보조)	200일선상회(보조)	추세판정(보조)	종목명	시장	통화	섹터	산업	업종	사업설명	시가총액	배당수익률(%)	EPS(FY)	EPS Growth 1Y(%)	EPS Growth 3Y CAGR(%)	EPS Growth 5Y CAGR(%)	현금및단기투자	장기부채	단기위험부채	총부채	주주지분	주당순현금(린치식)	주당잉여현금흐름	잉여현금흐름수익률(%)	순현금차감PER(린치식)	사용연성장률(%)	린치PER배수	배당감안점수	린치PER판정	배당감안점수판정	그레이엄적정PER(3년)	그레이엄내재가치(3년)	그레이엄괴리율(3년,%)	종합판정	데이터상태
TSM	TSM	Global Semicon / PCB / Memory / OSAT	430.7300109863281	16.225041525233273	35.445425539837046		-9.807985346552828	429.94450149536135	349.07060012817385	Y	Y	상승전환/양호	Taiwan Semiconductor Manufactur	NYQ	USD	Technology	Semiconductors	Semiconductors	Taiwan Semiconductor Manufacturing Company Limited, together with its subsidiaries, manufactures, packages, tests, and sells integrated circuits and other semiconductor devices in Taiwan, China, Europe, the Middle East, Africa, Japan, the United States, and internationally. It provides various wafer fabrication processes, such as processes to manufacture complementary metal- oxide-semiconductor (CMOS) logic, mixed-signal, radio frequency, embedded memory, bipolar CMOS mixed-signal, and others. T	2233969934336.0	87.0	11.5	46.54981153856048	19.574951863097922		3488279800000.0	896062000000.0	136925700000.0	1064582700000.0	5355038700000.0	499.80348759148404	191.33970352740297	44.422189921072466	-6.006389270013558	19.574951863097922	-0.30684056400346055		판정불가	판정불가	47.649903726195845	547.9738928512522	27.21980797122714	보류	충분
ASML	ASML	Global Semicon / PCB / Memory / OSAT	1760.4300537109375	19.086371920228373	47.40020537887415		-11.511274250050253	1737.8350006103515	1340.6733480834962	Y	Y	상승전환/양호	ASML Holding N.V. - New York Re	NMS	USD	Technology	Semiconductor Equipment & Materials	Semiconductor Equipment & Materials	ASML Holding N.V. provides lithography solutions for the development, production, marketing, sales, upgrading, and servicing of advanced semiconductor equipment systems. The company offers lithography, metrology, and inspection systems. It also provides extreme ultraviolet lithography systems; and deep ultraviolet lithography systems comprising immersion and dry lithography systems solutions to manufacture various range of semiconductor nodes and technologies. In addition, the company offers met	678500827136.0	49.0	29.48	26.913730255164037	19.548786436855625		13727800000.0	2709000000.0	1681900000.0	4390900000.0	19612200000.0	28.589244865047895	28.611298861976138	1.6252448543277433	58.74629609382258	19.548786436855625	3.005112173258351	1.1668614192693556	매우 불리	보통(1~1.5)	47.59757287371125	1403.1764483170077	-20.29354160597572	보류	충분
ARM	ARM	Global Semicon / PCB / Memory / OSAT	306.75	105.9692574267367	171.26812436587576		-30.1984239829586	335.63974838256837	182.16592502593994	N	Y	상승전환/양호	Arm Holdings plc	NMS	USD	Technology	Semiconductors	Semiconductors	Arm Holdings plc researches, develops, licenses, and markets central processing unit (CPU) intellectual property (IP), graphics processing unit IP, systems IP, compute subsystems (CSS), and associated software, tools and related services. The company provides a product portfolio, including CPU IP, GPU and neural processing unit (NPU) accelerators, system IP such as interconnects, compute platform products including pre-integrated CSSs, and development tools and software. The company serves semic	327633174528.0		0.84	14.141414141414144	19.934937871784243		4451000000.0	0.0	64000000.0	457000000.0	8286000000.0	4.167295677708262	0.8885112554808224	0.289653221020643	360.21750514558545	19.934937871784243	18.069657776833832	0.0553413912067581	매우 불리	불리(<1)	48.369875743568485	40.63069562459753	-86.75445945408393	보류	충분
NVDA	NVDA	Global Semicon / PCB / Memory / OSAT	208.00999450683594	10.2740757686262	12.413533319353265		-11.762963578590501	209.12825050354004	191.81835044860838	N	Y	상승전환/양호	NVIDIA Corporation	NMS	USD	Technology	Semiconductors	Semiconductors	NVIDIA Corporation operates as a data center scale AI infrastructure company in the United States, Taiwan, China, Hong Kong, Europe, and internationally. It operates through Compute & Networking, and Graphics segments. The Compute & Networking segment provides data center accelerated computing and networking platforms and artificial intelligence solutions and software, and automotive platforms and autonomous and electric vehicle solutions, including software. The Graphics segment offers GeForce 	5038210023424.0	47.0	6.54	64.74615806805708	201.79613706779188		114507000000.0	7469000000.0	999000000.0	11040000000.0	157293000000.0	4.419222988315925	3.991412410717972	1.918856072363773	31.130087388152905	201.79613706779188	0.15426503123642546	7.992143869229084	매우 유망	안심(>=2)	60.0	392.4	88.6447816751922	매우 유망	충분
AMD	AMD	Global Semicon / PCB / Memory / OSAT	550.010009765625	124.45724160765023	168.71703607926935		-5.319234443788467	506.4557487487793	289.609299697876	Y	Y	상승전환/양호	Advanced Micro Devices, Inc.	NMS	USD	Technology	Semiconductors	Semiconductors	Advanced Micro Devices, Inc. operates as a semiconductor company internationally. It operates in three segments: Data Center, Client and Gaming, and Embedded. The company offers artificial intelligence (AI) accelerators, microprocessors, and graphics processing units (GPUs) as standalone devices or as incorporated into accelerated processing units, chipsets, and data center and professional GPUs; and embedded processors and semi-custom system-on-chip (SoC) products, microprocessor and SoC develo	896846659584.0		3.01	164.16819012797075	48.64092188805236		15565000000.0	2348000000.0	874000000.0	3847000000.0	62999000000.0	8.105602122237363	4.130379836064813	0.7509644847781746	180.03468692471353	48.64092188805236	3.7013008786935706	0.27017527965815225	매우 불리	불리(<1)	60.0	180.6	-67.16423396058578	보류	충분
AVGO	AVGO	Global Semicon / PCB / Memory / OSAT	391.885009765625	5.473024529874859	17.867239177196637		-18.623459973538804	402.34662704467775	362.7112252807617	N	Y	상승전환/양호	Broadcom Inc.	NMS	USD	Technology	Semiconductors	Semiconductors	Broadcom Inc. designs, develops, and supplies various semiconductor devices and infrastructure software solutions internationally. The company operates in two segments: Semiconductor Solutions and Infrastructure Software. The company offers networking connectivity, such as custom silicon solutions, ethernet switching & routing, ethernet NIC controllers, physical layer devices, and fiber optic components; wireless device connectivity, including RF semiconductor devices, connectivity solutions, cu	1864448212992.0	65.0	6.0	292.2985581000848	26.2400569832006		16178000000.0	61984000000.0	3152000000.0	65136000000.0	81292000000.0	-9.628003752675784	5.657077522584728	1.443555477145722	66.91883558638347	26.2400569832006	2.550254964355688	1.363443583315517	매우 불리	보통(1~1.5)	60.0	360.0	-8.13631778992886	보류	충분
MU	MU	Global Semicon / PCB / Memory / OSAT	939.8300170898438	123.45515235098689	187.39222330857328		-22.555953417015008	966.8037490844727	468.3506504058838	N	Y	상승전환/양호	Micron Technology, Inc.	NMS	USD	Technology	Semiconductors	Semiconductors	Micron Technology, Inc. designs, develops, manufactures, and sells memory and storage products in the United States, Taiwan, Japan, Mainland China, Hong Kong, Europe, and internationally. It operates through the Cloud Memory Business Unit; Core Data Center Business Unit; Mobile and Client Business Unit; and Automotive and Embedded Business Unit segments. The company provides memory products, including dynamic random access memory components and modules, CXL-based memory, LPDDR components and mod	1061437571072.0	5.0	44.26	997.5578406169666	-0.5711543545194875		10972000000.0	11533000000.0	106000000.0	15278000000.0	54165000000.0	-0.4967269364997238	1.4768993406088045	0.15714536817859684	21.245520651295607	-0.5711543545194875		0.2084602075972391	판정불가	불리(<1)	7.357691290961025	325.65141653793495	-65.34996641772466	보류	일부부족
MRVL	MRVL	Global Semicon / PCB / Memory / OSAT	224.4949951171875	74.71786560794497	169.01737966081055		-29.053819071061216	249.08287544250487	127.51452514648437	N	Y	상승전환/양호	Marvell Technology, Inc.	NMS	USD	Technology	Semiconductors	Semiconductors	Marvell Technology, Inc., together with its subsidiaries, provides data infrastructure semiconductor solutions and spanning the data center core to network edge in the United States, Argentina, China, India, Israel, Japan, Singapore, South Korea, Taiwan, Vietnam, and internationally. The company develops and scales system-on-a-chip architectures, integrating analog, mixed-signal, and digital signal processing functionality. It offers a portfolio of ethernet solutions, including spanning controll	201494233088.0	10.0	2.9	-80.60000000000001			2638800000.0	3970800000.0	499800000.0	4790300000.0	14308400000.0	-1.5209534928698676	1.5893507257699466	0.7079671085497018	77.93653400346805	-80.60000000000001		-0.9058652774686955	판정불가	불리(<1)	8.5	24.65	-89.01979975672394	보류	일부부족
AMAT	AMAT	Global Semicon / PCB / Memory / OSAT	585.9099731445312	46.66449409678233	108.03505988873935		-18.961276190244636	535.9812477111816	351.1587995147705	Y	Y	상승전환/양호	Applied Materials, Inc.	NMS	USD	Technology	Semiconductor Equipment & Materials	Semiconductor Equipment & Materials	Applied Materials, Inc. provides materials engineering solutions, equipment, services, and software to the semiconductor and related industries in the United States, China, Korea, Taiwan, Japan, Southeast Asia, Europe, and internationally. The company operates through Semiconductor Systems and Applied Global Services (AGS) segments. The Semiconductor Systems segment includes semiconductor capital equipment to enable materials engineering steps, including etch, rapid thermal processing, depositio	465188749312.0	36.0	10.6	-2.4940783056987548	2.3602035200739557		9905000000.0	6455000000.0	100000000.0	7050000000.0	20415000000.0	4.345310187952551	7.176689116218444	1.2248791529698217	54.864590844960254	2.3602035200739557	23.24570333800752	0.6991796152909366	매우 불리	불리(<1)	13.220407040147911	140.13631462556785	-76.08227866928641	보류	충분
LRCX	LRCX	Global Semicon / PCB / Memory / OSAT	335.0299987792969	27.068950210837038	66.71476293107538		-22.68478776891094	343.5832489013672	229.27129920959473	N	Y	상승전환/양호	Lam Research Corporation	NMS	USD	Technology	Semiconductor Equipment & Materials	Semiconductor Equipment & Materials	Lam Research Corporation designs, manufactures, markets, refurbishes, and services semiconductor processing equipment used in the fabrication of integrated circuits in the United States, China, Korea, Taiwan, Japan, Southeast Asia, and Europe. The company offers ALTUS systems to deposit conformal or selective films for tungsten or molybdenum metallization applications; SABRE electrochemical deposition products for copper interconnect transition that offers copper damascene manufacturing; SPEED g	418978791424.0	30.0	5.29	39.98265831925203	5.177109335177765		6428300000.0	3719694000.0	749670000.0	4484505000.0	9861619000.0	2.1658954189726134	4.329284782711258	1.2922081003149817	62.92327095658303	5.177109335177765	12.154132138764739	0.5590476909480743	매우 불리	불리(<1)	18.85421867035553	99.73881676618075	-70.22988474775826	보류	충분
KLAC	KLAC	Global Semicon / PCB / Memory / OSAT	224.32000732421875	29.1213917286274	69.34923445140878		-25.650454516811074	222.50175094604492	155.6518999862671	Y	Y	상승전환/양호	KLA Corporation	NMS	USD	Technology	Semiconductor Equipment & Materials	Semiconductor Equipment & Materials	KLA Corporation, together with its subsidiaries, designs, manufactures, and markets process control, process-enabling, and yield management solutions for the semiconductor and related electronics industries worldwide. The company operates through three segments: Semiconductor Process Control; Specialty Semiconductor Process; and PCB and Component Inspection. It offers inspection and review tools to identify, locate, characterize, review, and analyze defects on various surfaces of patterned and u	292906074112.0	40.0	3.54	47.059954466062436	6.932351532134029		6910338000.0	5884257000.0	749936000.0	6088282000.0	4692453000.0	0.7855013952228337	2.8643994553031438	1.2769255357428335	63.14534065790845	6.932351532134029	9.108790915349042	0.7432433025643378	매우 불리	불리(<1)	22.364703064268056	79.17104884750891	-64.70620262905047	보류	충분
TER	TER	Global Semicon / PCB / Memory / OSAT	347.0400085449219	-5.6930846613816755	60.436416467951815		-28.273807214861623	387.90599822998047	274.95384941101076	N	Y	상승전환/양호	Teradyne, Inc.	NMS	USD	Technology	Semiconductor Equipment & Materials	Semiconductor Equipment & Materials	Teradyne, Inc. engages in the design, development, manufacture, and sale of automated test systems and robotics products in the United States, Asia Pacific, Europe, the Middle East, and Africa. The company operates through Semiconductor Test, Robotics, and Other segments. The Semiconductor Test segment offers products and services for wafer level and device package testing, and system level testing of semiconductor devices in automotive, industrial, communications, consumer, smartphones, cloud, 	54326390784.0	14.000000000000002	5.39	2.1525816229451378	-8.171225703081175		350245000.0	89244000.0	200000000.0	283239000.0	2795752000.0	1.6672888419670606	2.8772184710212447	0.8290739972849006	64.07657137346101	-8.171225703081175		0.0909657644281037	판정불가	불리(<1)	0.0	0.0	-100.0	보류	일부부족
ON	ON	Global Semicon / PCB / Memory / OSAT	92.0999984741211	34.15877119740816	51.256362945174374		-31.232730896149995	111.98799991607666	72.347649974823	N	Y	상승전환/양호	ON Semiconductor Corporation	NMS	USD	Technology	Semiconductors	Semiconductors	ON Semiconductor Corporation provides intelligent sensing and power solutions in Hong Kong, Singapore, the United Kingdom, the United States, and internationally. It operates through three segments: Power Solutions Group, Analog and Mixed-Signal Group, and Intelligent Sensing Group. The Power Solutions Group segment offers discrete, module, and integrated semiconductor devices designed to enable power conversion, including power switching, signal conditioning, and circuit protection technologies	35843993600.0		1.36	-92.30671414038657	-60.08129925266221		2947600000.0	2980500000.0	794000000.0	3004800000.0	7673300000.0	-0.08453550139298319	3.6450474855953177	3.9577063474322736	67.78274557023093	-60.08129925266221		-0.8863804312914839	판정불가	불리(<1)	0.0	0.0	-100.0	보류	일부부족
NXPI	NXPI	Global Semicon / PCB / Memory / OSAT	284.2099914550781	39.066398319435145	19.471180875308903		-14.566994323695837	300.43274993896483	238.55819999694825	N	Y	상승전환/양호	NXP Semiconductors N.V.	NMS	USD	Technology	Semiconductors	Semiconductors	NXP Semiconductors N.V. provides semiconductor products in the United States, Germany, Japan, South Korea, Taiwan, Singapore, the Netherlands, Mainland China, Hong Kong, and internationally. The company's product portfolio includes microcontrollers; application processors; communication processors; wireless connectivity solutions, such as near field communications, ultra-wideband, Bluetooth low-energy, Zigbee, Thread, and Wi-Fi and Wi-Fi/Bluetooth integrated SoCs; analog and interface products; 	71754801152.0	1.39	10.46	-19.48207171314741	-10.158612961649794		2906000000.0	10972000000.0	1250000000.0	12222000000.0	10056000000.0	-31.94821375956491	9.042619887563438	3.1816685406687055	30.225449829315775	-10.158612961649794		-0.2901069466680057	판정불가	불리(<1)	0.0	0.0	-100.0	보류	일부부족
QCOM	QCOM	Global Semicon / PCB / Memory / OSAT	186.77999877929688	45.85350799638728	2.6997326628538376		-25.591588080540774	209.63200035095215	168.9619497680664	N	Y	상승전환/양호	QUALCOMM Incorporated	NMS	USD	Technology	Semiconductors	Semiconductors	QUALCOMM Incorporated engages in the development and commercialization of foundational technologies for the wireless industry worldwide. It operates through three segments: Qualcomm CDMA Technologies (QCT); Qualcomm Technology Licensing (QTL); and Qualcomm Strategic Initiatives (QSI). The QCT segment develops and supplies integrated circuits and system software with connectivity and computing technologies for use in mobile devices; automotive systems for connectivity, digital cockpit, and ADAS/A	196866113536.0	1.95	9.31	-45.365805561033326	-24.61885768137453		14790000000.0	14811000000.0	1364000000.0	14811000000.0	21206000000.0	-0.019924098671726755	12.163187855787477	6.51203979830825	20.064438547579872	-24.61885768137453		-1.1298027416824379	판정불가	불리(<1)	0.0	0.0	-100.0	보류	일부부족
TXN	TXN	Global Semicon / PCB / Memory / OSAT	304.364990234375	41.74311753844098	61.509681699792694		-8.40104991196393	303.21637496948244	219.21562561035157	Y	Y	상승전환/양호	Texas Instruments Incorporated	NMS	USD	Technology	Semiconductors	Semiconductors	Texas Instruments Incorporated designs, manufactures, and sells semiconductors to electronics designers and manufacturers in the United States, China, the rest of Asia, Europe, the Middle East, Africa, Japan, and internationally. It operates through Analog and Embedded Processing segments. The Analog segment offers power products to manage power requirements across various voltage levels, including battery-management solutions, DC/DC switching regulators, AC/DC and isolated controllers and conve	277000388608.0	1.84	5.86	4.209210252135853	-17.008653159691033		6537000000.0	13548000000.0	500000000.0	14048000000.0	16273000000.0	-7.703610081666937	2.8601479164996486	0.939709890515727	53.25402735768633	-17.008653159691033		-0.28483579387919644	판정불가	불리(<1)	0.0	0.0	-100.0	보류	일부부족
INTC	INTC	Global Semicon / PCB / Memory / OSAT	105.11000061035156	68.49951716989828	155.67988092874097		-25.4221663192822	118.6152494430542	62.84404995918274	N	Y	상승전환/양호	Intel Corporation	NMS	USD	Technology	Semiconductors	Semiconductors	Intel Corporation designs, develops, manufactures, markets, sells, and services computing and related end products and services in the United States, Ireland, Israel, and internationally. It operates through three segments: CCG, DCAI, and Intel Foundry. The company offers client computing group products, including client and commercial CPUs, discrete client GPUs, edge computing, and connectivity products; data center and AI products, such as server CPUs, discrete GPUs, and networking products; a	528282845184.0	0.4756921292898922	-0.6				60567000000.0	44086000000.0	2499000000.0	46585000000.0	114281000000.0	3.2791484281734977	-0.9846796657381616	-0.9368087337268908					판정불가	판정불가				보류	일부부족
MCHP	MCHP	Global Semicon / PCB / Memory / OSAT	85.72000122070312	19.78759662549607	16.578270969369946		-16.712006659782517	92.54825000762939	74.40139993667603	N	Y	상승전환/양호	Microchip Technology Incorporat	NMS	USD	Technology	Semiconductors	Semiconductors	Microchip Technology Incorporated develops, manufactures, and sells smart, connected, and secure embedded control solutions in the Americas, Europe, and Asia. It operates in two segments, Semiconductor Products and Technology Licensing. The company offers general-purpose 8-bit, 16-bit, 32-bit, and 64-bit mixed-signal microcontrollers; 32-bit and 64-bit embedded mixed-signal microprocessors; and specialized mixed-signal microcontrollers for automotive, industrial, computing, communications, light	46546677760.0	2.05	0.22		-53.15729227199735		240300000.0	5496400000.0	999400000.0	5535200000.0	6432400000.0	-9.679592968336749	1.6040268403229216	1.8712398710693399	433.63451904109036	-53.15729227199735		-0.1178579887620859	판정불가	불리(<1)	0.0	0.0	-100.0	보류	일부부족
MPWR	MPWR	Global Semicon / PCB / Memory / OSAT	1305.7349853515625	-3.5539381099852774	36.14310948812858		-22.732546258449492	1490.51337890625	1182.0030249023437	N	Y	상승전환/양호	Monolithic Power Systems, Inc.	NMS	USD	Technology	Semiconductors	Semiconductors	Monolithic Power Systems, Inc. provides semiconductor-based power electronics solutions in China, Taiwan, South Korea, Southeast Asia, Europe, the United States, Japan, and internationally. The company offers direct current (DC) to DC solutions to convert and control voltages within a range of electronic systems, such as cloud-based and on-premises CPU servers and workstations, AI systems, memory, storage solutions, notebooks, infotainment, power sources, home appliances, network infrastructure,	64150761472.0	59.0	13.93	-60.96354529797281	12.398408861499366		1413788000.0	0.0	0.0	19972000.0	3531497000.0	28.776470588235295	13.500122124974558	1.03390981144154	91.66967083728122	12.398408861499366	7.393664127494777	0.7788662074311964	매우 불리	불리(<1)	33.29681772299873	463.8246708813723	-64.47788593513944	보류	충분
QRVO	QRVO	Global Semicon / PCB / Memory / OSAT	84.67500305175781	6.095734421733745	2.1657889211209147		-21.763835881528472	96.28924980163575	87.27192478179931	N	N	중립	Qorvo, Inc.	NMS	USD	Technology	Semiconductors	Semiconductors	Qorvo, Inc. engages in development and commercialization of technologies and products for wireless, wired, and power markets in the United States, China, rest of Asia, Taiwan, and Europe. It operates through three segments: High Performance Analog (HPA), Connectivity and Sensors Group (CSG), and Advanced Cellular Group (ACG). The HPA segment supplies radio frequency, analog mixed signal, and power management solutions for defense and aerospace markets, as well as offers compound semiconductor fo	7469860352.0		3.62	509.528005034613	48.674328044757466		1219015000.0	1549154000.0	438740000.0	1549154000.0	3344299000.0	-3.742308613757475	7.703200724160561	9.097372833222055	24.424671730805326	48.674328044757466	0.501797820574865	1.992834482330731	헐값	양호(>=1.5)	60.0	217.20000000000002	156.51017676047317	양호	충분
SWKS	SWKS	Global Semicon / PCB / Memory / OSAT	58.83000183105469	4.382542927526978	-3.016811772107997		-29.47733981975166	71.36100025177002	65.62519996643067	N	N	주의	Skyworks Solutions, Inc.	NMS	USD	Technology	Semiconductors	Semiconductors	Skyworks Solutions, Inc., together with its subsidiaries, develops, manufactures, and markets analog and mixed-signal semiconductor products and solutions in the United States, Taiwan, China, South Korea, Europe, the Middle East, Africa, and the Asia Pacific. The company offers amplifiers, antenna tuners, attenuators, automotive tuners and digital radios, wireless ASoC, DC/DC converters, demodulators, detectors, digital power isolators, diodes, directional couplers, diversity receive modules, fi	8848382976.0	4.7	2.4	-19.949664429530202	-27.942857206650984		1587100000.0	496400000.0	499400000.0	1203100000.0	5757100000.0	7.251707168019662	7.1533068140390155	12.15928368416774	21.490956109597928	-27.942857206650984		-1.0815180622080678	판정불가	불리(<1)	0.0	0.0	-100.0	보류	일부부족
COHR	COHR	Global Semicon / PCB / Memory / OSAT	318.3699951171875	3.5349577616869965	83.86948099317932		-25.421072362308816	374.04999923706055	243.23475009918212	N	Y	상승전환/양호	Coherent Corp.	NYQ	USD	Technology	Scientific & Technical Instruments	Scientific & Technical Instruments	Coherent Corp. develops, manufactures, and markets engineered materials, optoelectronic components and devices, and laser systems for the use in the industrial, communications, electronics, and instrumentation markets worldwide. It operates through three segments: Networking, Materials, and Lasers. The Networking segment offers transceivers, systems, subsystems, modules, components, optics, and semiconductor devices for datacenter and communications applications. The Materials segment provides e	62285692928.0		2.11	1118.3	-40.53482550949392		909200000.0	3498615000.0	188306000.0	3893658000.0	8127775000.0	-13.235657263398496	0.9853029494004428	0.30948360854098916	157.15907695762368	-40.53482550949392		-0.25792226764238196	판정불가	불리(<1)	0.0	0.0	-100.0	보류	일부부족
AMKR	AMKR	Global Semicon / PCB / Memory / OSAT	67.5199966430664	16.4941299337509	32.39215028052236		-27.82469862057615	74.89700031280518	51.62620006561279	N	Y	상승전환/양호	Amkor Technology, Inc.	NMS	USD	Technology	Semiconductor Equipment & Materials	Semiconductor Equipment & Materials	Amkor Technology, Inc. provides outsourced semiconductor packaging and test services in the United States, Japan, Europe, and the Asia Pacific. It offers turnkey packaging and test services, including semiconductor wafer bump, wafer probe, wafer back-grind, package design, packaging, burn-in, system-level and final test, and drop shipment services; flip chip scale package products for smartphones, tablets, and other mobile consumer electronic devices; flip chip stacked chip scale packages that a	16736351232.0	46.0	1.74	5.616476277640303	-21.25788348738783		2604423000.0	1282816000.0	162430000.0	1560981000.0	4471106000.0	5.3318012447027305	0.7705251132358287	1.1411806154391353	35.74034218296763	-21.25788348738783		0.6922741921705282	판정불가	불리(<1)	0.0	0.0	-100.0	보류	일부부족
