티커	종목코드	유니버스	현재가	3M수익률(보조,%)	6M수익률(보조,%)	12M수익률(보조,%)	52주고점대비(보조,%)	40일이평(보조)	200일이평(보조)	40일선상회(보조)	200일선상회(보조)	추세판정(보조)	종목명	시장	통화	섹터	산업	업종	사업설명	시가총액	배당수익률(%)	EPS(FY)	EPS Growth 1Y(%)	EPS Growth 3Y CAGR(%)	EPS Growth 5Y CAGR(%)	현금및단기투자	장기부채	단기위험부채	총부채	주주지분	주당순현금(린치식)	주당잉여현금흐름	잉여현금흐름수익률(%)	순현금차감PER(린치식)	사용연성장률(%)	린치PER배수	배당감안점수	린치PER판정	배당감안점수판정	그레이엄적정PER(3년)	그레이엄내재가치(3년)	그레이엄괴리율(3년,%)	종합판정	데이터상태
TSM	TSM	Global Semicon / PCB / Memory / OSAT	401.1449890136719	8.271252095458003	17.41744872200277		-16.002893217425708	430.63762588500975	352.3542250061035	N	Y	상승전환/양호	Taiwan Semiconductor Manufactur	NYQ	USD	Technology	Semiconductors	Semiconductors	Taiwan Semiconductor Manufacturing Company Limited, together with its subsidiaries, manufactures, packages, tests, and sells integrated circuits and other semiconductor devices in Taiwan, China, Europe, the Middle East, Africa, Japan, the United States, and internationally. It provides various wafer fabrication processes, such as processes to manufacture complementary metal- oxide-semiconductor (CMOS) logic, mixed-signal, radio frequency, embedded memory, bipolar CMOS mixed-signal, and others. T	2080528007168.0	95.0	13.35	46.54981153856048	19.574951863097922		3488279800000.0	896062000000.0	136925700000.0	1064582700000.0	5355038700000.0	499.80348759148404	191.33970352740297	47.69839054897972	-7.390149706203159	19.574951863097922	-0.37753092614929157		판정불가	판정불가	47.649903726195845	636.1262147447145	58.577629576979206	보류	충분
ASML	ASML	Global Semicon / PCB / Memory / OSAT	1739.06494140625	19.130352324779597	30.599652545128485		-12.585200225899785	1769.328872680664	1360.9199725341796	N	Y	상승전환/양호	ASML Holding N.V. - New York Re	NMS	USD	Technology	Semiconductor Equipment & Materials	Semiconductor Equipment & Materials	ASML Holding N.V. provides lithography solutions for the development, production, marketing, sales, upgrading, and servicing of advanced semiconductor equipment systems. The company offers lithography, metrology, and inspection systems. It also provides extreme ultraviolet lithography systems; and deep ultraviolet lithography systems comprising immersion and dry lithography systems solutions to manufacture various range of semiconductor nodes and technologies. In addition, the company offers met	667992129536.0	52.0	29.01	26.913730255164037	19.548786436855625		13727800000.0	2709000000.0	1681900000.0	4390900000.0	19612200000.0	28.687321010153607	28.709450663889612	1.6508555822345803	58.95820821772134	19.548786436855625	3.0159523409886217	1.2135508964695754	매우 불리	보통(1~1.5)	47.59757287371125	1380.8055890663634	-20.60068855451651	보류	충분
ARM	ARM	Global Semicon / PCB / Memory / OSAT	271.1199951171875	62.61020935923061	157.93929554072017		-38.306102856031764	341.0917488098145	185.39032512664795	N	Y	상승전환/양호	Arm Holdings plc	NMS	USD	Technology	Semiconductors	Semiconductors	Arm Holdings plc researches, develops, licenses, and markets central processing unit (CPU) intellectual property (IP), graphics processing unit IP, systems IP, compute subsystems (CSS), and associated software, tools and related services. The company provides a product portfolio, including CPU IP, GPU and neural processing unit (NPU) accelerators, system IP such as interconnects, compute platform products including pre-integrated CSSs, and development tools and software. The company serves semic	289577500672.0		0.86	14.141414141414144	19.934937871784243		4451000000.0	0.0	64000000.0	457000000.0	8286000000.0	4.167295677708262	0.8885112554808224	0.3277188224707576	310.4101156273015	19.934937871784243	15.571160423161066	0.0642212894109399	매우 불리	불리(<1)	48.369875743568485	41.598093139468894	-84.65694382980172	보류	충분
NVDA	NVDA	Global Semicon / PCB / Memory / OSAT	205.13999938964844	1.7155924432372682	9.671208790563357		-12.980404424569747	206.82099990844728	192.4878003692627	N	Y	상승전환/양호	NVIDIA Corporation	NMS	USD	Technology	Semiconductors	Semiconductors	NVIDIA Corporation operates as a data center scale AI infrastructure company in the United States, Taiwan, China, Hong Kong, Europe, and internationally. It operates through Compute & Networking, and Graphics segments. The Compute & Networking segment provides data center accelerated computing and networking platforms and artificial intelligence solutions and software, and automotive platforms and autonomous and electric vehicle solutions, including software. The Graphics segment offers GeForce 	4970149052416.0	49.0	6.53	64.74615806805708	201.79613706779188		114507000000.0	7469000000.0	999000000.0	11040000000.0	157293000000.0	4.419222988315925	3.991412410717972	1.9457016781678815	30.73825059744755	201.79613706779188	0.15232328549045152	8.159089479497494	매우 유망	안심(>=2)	60.0	391.8	90.99151855597141	매우 유망	충분
AMD	AMD	Global Semicon / PCB / Memory / OSAT	508.8699951171875	82.79031874035054	123.26693541827271		-12.401229339786202	516.7257499694824	298.42159980773926	N	Y	상승전환/양호	Advanced Micro Devices, Inc.	NMS	USD	Technology	Semiconductors	Semiconductors	Advanced Micro Devices, Inc. operates as a semiconductor company internationally. It operates in three segments: Data Center, Client and Gaming, and Embedded. The company offers artificial intelligence (AI) accelerators, microprocessors, and graphics processing units (GPUs) as standalone devices or as incorporated into accelerated processing units, chipsets, and data center and professional GPUs; and embedded processors and semi-custom system-on-chip (SoC) products, microprocessor and SoC develo			3.02	164.16819012797075	48.64092188805236		15565000000.0	2348000000.0	874000000.0	3847000000.0	62999000000.0					48.64092188805236			판정불가	판정불가	60.0	181.2	-64.39169105298271	판정불가	일부부족
AVGO	AVGO	Global Semicon / PCB / Memory / OSAT	378.8500061035156	-6.811138352781965	10.44546039222678		-21.330232294044528	396.9757507324219	363.8709001159668	N	Y	상승전환/양호	Broadcom Inc.	NMS	USD	Technology	Semiconductors	Semiconductors	Broadcom Inc. designs, develops, and supplies various semiconductor devices and infrastructure software solutions internationally. The company operates in two segments: Semiconductor Solutions and Infrastructure Software. The company offers networking connectivity, such as custom silicon solutions, ethernet switching & routing, ethernet NIC controllers, physical layer devices, and fiber optic components; wireless device connectivity, including RF semiconductor devices, connectivity solutions, cu	1802409345024.0	70.0	6.01	292.2985581000848	26.2400569832006		16178000000.0	61984000000.0	3152000000.0	65136000000.0	81292000000.0	-9.628003752675784	5.657077522584728	1.4932235532389058	64.63860396941621	26.2400569832006	2.4633560822981106	1.488894423350118	매우 불리	보통(1~1.5)	60.0	360.59999999999997	-4.817211511019249	보류	충분
MU	MU	Global Semicon / PCB / Memory / OSAT	870.5701293945312	91.304659806834	158.61334900838497		-28.263119469890007	987.9125045776367	486.6019511413574	N	Y	상승전환/양호	Micron Technology, Inc.	NMS	USD	Technology	Semiconductors	Semiconductors	Micron Technology, Inc. designs, develops, manufactures, and sells memory and storage products in the United States, Taiwan, Japan, Mainland China, Hong Kong, Europe, and internationally. It operates through the Cloud Memory Business Unit; Core Data Center Business Unit; Mobile and Client Business Unit; and Automotive and Embedded Business Unit segments. The company provides memory products, including dynamic random access memory components and modules, CXL-based memory, LPDDR components and mod		6.0	44.23	997.5578406169666	-0.5711543545194875		10972000000.0	11533000000.0	106000000.0	15278000000.0	54165000000.0					-0.5711543545194875			판정불가	판정불가	7.357691290961025	325.4306857992061	-62.618670821437625	판정불가	일부부족
MRVL	MRVL	Global Semicon / PCB / Memory / OSAT	195.42999267578125	39.90263387514468	143.1326192505823		-38.239105900425294	251.6497501373291	130.4176001358032	N	Y	상승전환/양호	Marvell Technology, Inc.	NMS	USD	Technology	Semiconductors	Semiconductors	Marvell Technology, Inc., together with its subsidiaries, provides data infrastructure semiconductor solutions and spanning the data center core to network edge in the United States, Argentina, China, India, Israel, Japan, Singapore, South Korea, Taiwan, Vietnam, and internationally. The company develops and scales system-on-a-chip architectures, integrating analog, mixed-signal, and digital signal processing functionality. It offers a portfolio of ethernet solutions, including spanning controll	175407104000.0	13.0	2.91	-80.60000000000001			2638800000.0	3970800000.0	499800000.0	4790300000.0	14308400000.0	-1.5209534928698676	1.5893507257699466	0.8132583458705249	67.68073751500037	-80.60000000000001		-0.9988070828131494	판정불가	불리(<1)	8.5	24.735	-87.34329379982354	보류	일부부족
AMAT	AMAT	Global Semicon / PCB / Memory / OSAT	529.2999877929688	33.345086042594204	65.8831672518866		-26.791149682853565	552.480997467041	360.00804946899416	N	Y	상승전환/양호	Applied Materials, Inc.	NMS	USD	Technology	Semiconductor Equipment & Materials	Semiconductor Equipment & Materials	Applied Materials, Inc. provides materials engineering solutions, equipment, services, and software to the semiconductor and related industries in the United States, China, Korea, Taiwan, Japan, Southeast Asia, Europe, and internationally. The company operates through Semiconductor Systems and Applied Global Services (AGS) segments. The Semiconductor Systems segment includes semiconductor capital equipment to enable materials engineering steps, including etch, rapid thermal processing, depositio	420242718720.0	40.0	10.65	-2.4940783056987548	2.3602035200739557		9905000000.0	6455000000.0	100000000.0	7050000000.0	20415000000.0	4.345310187952551	7.176689116218444	1.3558831063161758	49.29151902394518	2.3602035200739557	20.88443585678605	0.859381174670148	매우 불리	불리(<1)	13.220407040147911	140.79733497757528	-73.39933152754068	보류	충분
LRCX	LRCX	Global Semicon / PCB / Memory / OSAT	306.7699890136719	14.637511964407102	41.06312930137943		-29.20637885222549	348.3369987487793	234.1096990966797	N	Y	상승전환/양호	Lam Research Corporation	NMS	USD	Technology	Semiconductor Equipment & Materials	Semiconductor Equipment & Materials	Lam Research Corporation designs, manufactures, markets, refurbishes, and services semiconductor processing equipment used in the fabrication of integrated circuits in the United States, China, Korea, Taiwan, Japan, Southeast Asia, and Europe. The company offers ALTUS systems to deposit conformal or selective films for tungsten or molybdenum metallization applications; SABRE electrochemical deposition products for copper interconnect transition that offers copper damascene manufacturing; SPEED g	383637651456.0	33.0	5.29	39.98265831925203	5.177109335177765		6428300000.0	3719694000.0	749670000.0	4484505000.0	9861619000.0	2.1658954189726134	4.329284782711258	1.4112478201113454	57.58111410107736	5.177109335177765	11.122251892541923	0.6630144263649018	매우 불리	불리(<1)	18.85421867035553	99.73881676618075	-67.48742695240124	보류	충분
KLAC	KLAC	Global Semicon / PCB / Memory / OSAT	209.76499938964844	17.092954649427483	35.77373938894128		-30.47462618722041	227.30947494506836	158.45792987823486	N	Y	상승전환/양호	KLA Corporation	NMS	USD	Technology	Semiconductor Equipment & Materials	Semiconductor Equipment & Materials	KLA Corporation, together with its subsidiaries, designs, manufactures, and markets process control, process-enabling, and yield management solutions for the semiconductor and related electronics industries worldwide. The company operates through three segments: Semiconductor Process Control; Specialty Semiconductor Process; and PCB and Component Inspection. It offers inspection and review tools to identify, locate, characterize, review, and analyze defects on various surfaces of patterned and u	274010816512.0	43.0	3.53	47.059954466062436	6.932351532134029		6910338000.0	5884257000.0	749936000.0	6088282000.0	4692453000.0	0.7855013952228337	2.8643994553031438	1.3655278352621572	59.20099093326505	6.932351532134029	8.539813749900942	0.8434377659053175	매우 불리	불리(<1)	22.364703064268056	78.94740181686623	-62.363882417667924	보류	충분
TER	TER	Global Semicon / PCB / Memory / OSAT	338.7099914550781	-10.954838028505753	48.75274308065507		-29.995454278538126	387.6922477722168	279.9509991455078	N	Y	상승전환/양호	Teradyne, Inc.	NMS	USD	Technology	Semiconductor Equipment & Materials	Semiconductor Equipment & Materials	Teradyne, Inc. engages in the design, development, manufacture, and sale of automated test systems and robotics products in the United States, Asia Pacific, Europe, the Middle East, and Africa. The company operates through Semiconductor Test, Robotics, and Other segments. The Semiconductor Test segment offers products and services for wafer level and device package testing, and system level testing of semiconductor devices in automotive, industrial, communications, consumer, smartphones, cloud, 	53022392320.0	16.0	5.38	2.1525816229451378	-8.171225703081175		350245000.0	89244000.0	200000000.0	283239000.0	2795752000.0	1.6672888419670606	2.8772184710212447	0.8494637133852722	62.64734249314333	-8.171225703081175		0.12496578442693997	판정불가	불리(<1)	0.0	0.0	-100.0	보류	일부부족
ON	ON	Global Semicon / PCB / Memory / OSAT	87.67500305175781	5.619805801078592	45.44625883746656		-34.53669241661043	109.25212535858154	73.33647506713868	N	Y	상승전환/양호	ON Semiconductor Corporation	NMS	USD	Technology	Semiconductors	Semiconductors	ON Semiconductor Corporation provides intelligent sensing and power solutions in Hong Kong, Singapore, the United Kingdom, the United States, and internationally. It operates through three segments: Power Solutions Group, Analog and Mixed-Signal Group, and Intelligent Sensing Group. The Power Solutions Group segment offers discrete, module, and integrated semiconductor devices designed to enable power conversion, including power switching, signal conditioning, and circuit protection technologies	34104332288.0		1.36	-92.30671414038657	-60.08129925266221		2947600000.0	2980500000.0	794000000.0	3004800000.0	7673300000.0	-0.08453550139298319	3.6450474855953177	4.157453502959687	64.52907246555205	-60.08129925266221		-0.9310733434877091	판정불가	불리(<1)	0.0	0.0	-100.0	보류	일부부족
NXPI	NXPI	Global Semicon / PCB / Memory / OSAT	268.9425048828125	24.493128918439112	12.716889355875761		-19.15637297401479	297.4680633544922	239.70241271972657	N	Y	상승전환/양호	NXP Semiconductors N.V.	NMS	USD	Technology	Semiconductors	Semiconductors	NXP Semiconductors N.V. provides semiconductor products in the United States, Germany, Japan, South Korea, Taiwan, Singapore, the Netherlands, Mainland China, Hong Kong, and internationally. The company's product portfolio includes microcontrollers; application processors; communication processors; wireless connectivity solutions, such as near field communications, ultra-wideband, Bluetooth low-energy, Zigbee, Thread, and Wi-Fi and Wi-Fi/Bluetooth integrated SoCs; analog and interface products; 	67900203008.0	1.52	10.45	-19.48207171314741	-10.158612961649794		2906000000.0	10972000000.0	1250000000.0	12222000000.0	10056000000.0	-31.94821375956491	9.042619887563438	3.362287374955334	28.793370205012195	-10.158612961649794		-0.3000209041227842	판정불가	불리(<1)	0.0	0.0	-100.0	보류	일부부족
QCOM	QCOM	Global Semicon / PCB / Memory / OSAT	171.83999633789062	26.167401019246796	6.4749965845234625		-31.543305946496247	206.23650016784669	169.07904975891114	N	Y	상승전환/양호	QCOM								2.0891527447084837		-45.365805561033326	-24.61885768137453		14790000000.0	14811000000.0	1364000000.0	14811000000.0	21206000000.0					-24.61885768137453			판정불가	판정불가				판정불가	핵심부족
TXN	TXN	Global Semicon / PCB / Memory / OSAT	286.5050048828125	24.664953333947714	51.49376706851159		-13.776030475697853	301.81637420654295	221.9391256713867	N	Y	상승전환/양호	Texas Instruments Incorporated	NMS	USD	Technology	Semiconductors	Semiconductors	Texas Instruments Incorporated designs, manufactures, and sells semiconductors to electronics designers and manufacturers in the United States, China, the rest of Asia, Europe, the Middle East, Africa, Japan, and internationally. It operates through Analog and Embedded Processing segments. The Analog segment offers power products to manage power requirements across various voltage levels, including battery-management solutions, DC/DC switching regulators, AC/DC and isolated controllers and conve	260746149888.0	2.0	5.85	4.209210252135853	-17.008653159691033		6537000000.0	13548000000.0	500000000.0	14048000000.0	16273000000.0	-7.703610081666937	2.8601479164996486	0.9982889889373899	50.292070934099044	-17.008653159691033		-0.2984298097280154	판정불가	불리(<1)	0.0	0.0	-100.0	보류	일부부족
INTC	INTC	Global Semicon / PCB / Memory / OSAT	97.41000366210938	42.20438490818887	101.59355189843558		-30.885481783210434	117.00424976348877	64.49130001068116	N	Y	상승전환/양호	Intel Corporation	NMS	USD	Technology	Semiconductors	Semiconductors	Intel Corporation designs, develops, manufactures, markets, sells, and services computing and related end products and services in the United States, Ireland, Israel, and internationally. It operates through three segments: CCG, DCAI, and Intel Foundry. The company offers client computing group products, including client and commercial CPUs, discrete client GPUs, edge computing, and connectivity products; data center and AI products, such as server CPUs, discrete GPUs, and networking products; a	490034987008.0	0.5132943036675919	-0.6				60567000000.0	44086000000.0	2499000000.0	46585000000.0	114281000000.0	3.2791484281734977	-0.9846796657381616	-1.0108609267214135					판정불가	판정불가				보류	일부부족
MCHP	MCHP	Global Semicon / PCB / Memory / OSAT	81.47000122070312	3.4408316543531825	9.429153203782214		-20.84142764269348	91.21100025177002	74.86434999465942	N	Y	상승전환/양호	Microchip Technology Incorporat	NMS	USD	Technology	Semiconductors	Semiconductors	Microchip Technology Incorporated develops, manufactures, and sells smart, connected, and secure embedded control solutions in the Americas, Europe, and Asia. It operates in two segments, Semiconductor Products and Technology Licensing. The company offers general-purpose 8-bit, 16-bit, 32-bit, and 64-bit mixed-signal microcontrollers; 32-bit and 64-bit embedded mixed-signal microprocessors; and specialized mixed-signal microcontrollers for automotive, industrial, computing, communications, light	44238893056.0	2.25	0.22		-53.15729227199735		240300000.0	5496400000.0	999400000.0	5535200000.0	6432400000.0	-9.679592968336749	1.6040268403229216	1.9688557951258592	414.31633722290854	-53.15729227199735		-0.1228705887226659	판정불가	불리(<1)	0.0	0.0	-100.0	보류	일부부족
MPWR	MPWR	Global Semicon / PCB / Memory / OSAT	1351.6949462890625	-7.944633856810901	33.89216630432949		-20.012844944215658	1465.8223815917968	1192.9502249145507	N	Y	상승전환/양호	Monolithic Power Systems, Inc.	NMS	USD	Technology	Semiconductors	Semiconductors	Monolithic Power Systems, Inc. provides semiconductor-based power electronics solutions in China, Taiwan, South Korea, Southeast Asia, Europe, the United States, Japan, and internationally. The company offers direct current (DC) to DC solutions to convert and control voltages within a range of electronic systems, such as cloud-based and on-premises CPU servers and workstations, AI systems, memory, storage solutions, notebooks, infotainment, power sources, home appliances, network infrastructure,	66408771584.0	61.0	13.91	-60.96354529797281	12.398408861499366		1413788000.0	0.0	0.0	19972000.0	3531497000.0	28.776470588235295	13.500122124974558	0.9987550935244477	95.10556978438728	12.398408861499366	7.670788312177501	0.771757206522184	매우 불리	불리(<1)	33.29681772299873	463.1587345269124	-65.73496588128361	보류	충분
QRVO	QRVO	Global Semicon / PCB / Memory / OSAT	85.87000274658203	4.847376247543389	6.48561929131779		-20.659706104424792	95.04499988555908	87.06844982147217	N	N	중립	Qorvo, Inc.	NMS	USD	Technology	Semiconductors	Semiconductors	Qorvo, Inc. engages in development and commercialization of technologies and products for wireless, wired, and power markets in the United States, China, rest of Asia, Taiwan, and Europe. It operates through three segments: High Performance Analog (HPA), Connectivity and Sensors Group (CSG), and Advanced Cellular Group (ACG). The HPA segment supplies radio frequency, analog mixed signal, and power management solutions for defense and aerospace markets, as well as offers compound semiconductor fo	7575280640.0		3.62	509.528005034613	48.674328044757466		1219015000.0	1549154000.0	438740000.0	1549154000.0	3344299000.0	-3.742308613757475	7.703200724160561	8.970770324643059	24.754782143740194	48.674328044757466	0.5085798435877215	1.9662596003522443	헐값	양호(>=1.5)	60.0	217.20000000000002	152.9404833501597	양호	충분
SWKS	SWKS	Global Semicon / PCB / Memory / OSAT	59.68000030517578	1.169687416640386	2.086899144388066		-28.458401324452677	69.84900045394897	65.10879991531372	N	N	중립	Skyworks Solutions, Inc.	NMS	USD	Technology	Semiconductors	Semiconductors	Skyworks Solutions, Inc., together with its subsidiaries, develops, manufactures, and markets analog and mixed-signal semiconductor products and solutions in the United States, Taiwan, China, South Korea, Europe, the Middle East, Africa, and the Asia Pacific. The company offers amplifiers, antenna tuners, attenuators, automotive tuners and digital radios, wireless ASoC, DC/DC converters, demodulators, detectors, digital power isolators, diodes, directional couplers, diversity receive modules, fi	8976228352.0	4.79	2.4	-19.949664429530202	-27.942857206650984		1587100000.0	496400000.0	499400000.0	1203100000.0	5757100000.0	7.251707168019662	7.1533068140390155	11.98610384963192	21.845122140481717	-27.942857206650984		-1.0598639393160394	판정불가	불리(<1)	0.0	0.0	-100.0	보류	일부부족
COHR	COHR	Global Semicon / PCB / Memory / OSAT	290.9064025878906	-15.684188785837838	48.45192519954355		-31.8544841515057	363.60715942382814	247.7790821838379	N	Y	상승전환/양호	COHR											-40.53482550949392		909200000.0	3498615000.0	188306000.0	3893658000.0	8127775000.0					-40.53482550949392			판정불가	판정불가				판정불가	핵심부족
AMKR	AMKR	Global Semicon / PCB / Memory / OSAT	62.98500061035156	-6.50883472979068	28.018291938312		-32.67236926170462	74.46737537384033	52.53047504425049	N	Y	상승전환/양호	Amkor Technology, Inc.	NMS	USD	Technology	Semiconductor Equipment & Materials	Semiconductor Equipment & Materials	Amkor Technology, Inc. provides outsourced semiconductor packaging and test services in the United States, Japan, Europe, and the Asia Pacific. It offers turnkey packaging and test services, including semiconductor wafer bump, wafer probe, wafer back-grind, package design, packaging, burn-in, system-level and final test, and drop shipment services; flip chip scale package products for smartphones, tablets, and other mobile consumer electronic devices; flip chip stacked chip scale packages that a	15612250112.0	53.0	1.74	5.616476277640303	-21.25788348738783		2604423000.0	1282816000.0	162430000.0	1560981000.0	4471106000.0	5.3318012447027305	0.7705251132358287	1.2233469965374473	33.13402262393611	-21.25788348738783		0.9579916351503176	판정불가	불리(<1)	0.0	0.0	-100.0	보류	일부부족
GFS	GFS	Global Semicon / PCB / Memory / OSAT	57.525001525878906	5.0684959376783745	38.514334738087456		-36.0549109478505	76.64537467956544	50.74639995574951	N	Y	상승전환/양호	GlobalFoundries Inc.	NMS	USD	Technology	Semiconductors	Semiconductors	GLOBALFOUNDRIES Inc., a semiconductor foundry, provides range of mainstream wafer fabrication services and technologies in the United States, Europe, the Middle East, Africa, and internationally. It offers semiconductor devices, including microprocessors, mobile application processors, baseband processors, network processors, radio frequency modems, microcontrollers, and power management units. The company also provides quantum technology solutions. GLOBALFOUNDRIES Inc. has a strategic partnersh	31564017664.0	84.0	1.39	-51.0	-15.135725474232498		4397000000.0	1065000000.0	86000000.0	1707000000.0	11928000000.0	6.0725258640166855	1.8388891346917273	3.196678115452917	37.01616954090807	-15.135725474232498		1.8603835939767563	판정불가	양호(>=1.5)	0.0	0.0	-100.0	보류	일부부족
