티커	종목코드	유니버스	현재가	3M수익률(보조,%)	6M수익률(보조,%)	12M수익률(보조,%)	52주고점대비(보조,%)	40일이평(보조)	200일이평(보조)	40일선상회(보조)	200일선상회(보조)	추세판정(보조)	종목명	시장	통화	섹터	산업	업종	사업설명	시가총액	배당수익률(%)	EPS(FY)	EPS Growth 1Y(%)	EPS Growth 3Y CAGR(%)	EPS Growth 5Y CAGR(%)	현금및단기투자	장기부채	단기위험부채	총부채	주주지분	주당순현금(린치식)	주당잉여현금흐름	잉여현금흐름수익률(%)	순현금차감PER(린치식)	사용연성장률(%)	린치PER배수	배당감안점수	린치PER판정	배당감안점수판정	그레이엄적정PER(3년)	그레이엄내재가치(3년)	그레이엄괴리율(3년,%)	종합판정	데이터상태
SHRIRAMFIN.NS	SHRIRAMFIN.NS	India Nifty 50	1007.5	1.5625	18.808962264150942		-8.790510386751604	950.0962524414062	883.9977496337891	Y	Y	상승전환/양호	SHRIRAM FINANCE LIMITED	NSI	INR	Financial Services	Credit Services	Credit Services	Shriram Finance Limited, a non-banking finance company, provides financing services in India. It offers fixed and recurring deposits; commercial vehicle loans for commercial goods vehicles, passenger commercial vehicles, tractors and farm equipment, and construction equipment; two-wheeler, gold, used car loan, and personal loans; and green finance services. The company also provides business loans, such as MSME loans; working capital loans, including tyre, tax, fuel, toll financing, repair/top-u	2370562162688.0	1.4590570719602978	53.2	4.923056955228389	18.58582810449043		79431300000.0	0.0	0.0	1812116200000.0	659185900000.0	33.75867622880106	-57.28073163206761	-5.685432420056339	18.303408341563888	18.58582810449043	0.9848045639215661	1.0951449480003268	헐값	보통(1~1.5)	45.67165620898086	2429.732110317782	141.1644774508965	보류	충분
HDFCLIFE.NS	HDFCLIFE.NS	India Nifty 50	581.7999877929688	-7.060704825404351	-25.17041957646704		-28.552131092394394	593.3449981689453	698.6097476196289	N	N	주의	HDFC LIFE INS CO LTD	NSI	INR	Financial Services	Insurance - Life	Insurance - Life	HDFC Life Insurance Company Limited provides individual and group insurance solutions in India. It offers insurance and investment products, such as protection, pension, savings, investment, annuity, and health, as well as term, investment, and life insurance plans. The company was formerly known as HDFC Standard Life Insurance Company Limited changed its name to HDFC Life Insurance Company Limited in January 2019. HDFC Life Insurance Company Limited was incorporated in 2000 and is headquartered	1263631859712.0	37.0	8.85	5.605195436321675	11.805242919673354		73289900000.0	30990000000.0	0.0	30990000000.0	177495400000.0	19.47567359846219	102.84823665593547	17.677593470925544	63.53947053045272	11.805242919673354	5.382309450368416	0.7681090590183993	매우 불리	불리(<1)	32.11048583934671	284.1777996782184	-51.15541326217045	보류	충분
SBILIFE.NS	SBILIFE.NS	India Nifty 50	1793.5999755859375	-6.054890977499861	-11.466510984188949		-14.979148058505798	1821.0349914550782	1921.2924993896484	N	N	주의	SBI LIFE INSURANCE CO LTD	NSI	INR	Financial Services	Insurance - Life	Insurance - Life	SBI Life Insurance Company Limited operates as a private life insurance company in India. The company's life insurance business comprises individual and group life insurance products, including participating, non-participating, pension, group gratuity, group leave encashment, group superannuation, group immediate annuity, unit-linked and variable insurance products, health, and micro insurance. It also provides accident and disability benefit, level term, and critical illness insurance products.	1799288389632.0	15.0	24.57	2.361911076119827	12.812939479871188		33806300000.0	0.0	0.0	0.0	190860000000.0	33.69942090492378	342.2911097116141	19.08402734003125	71.62802420354146	12.812939479871188	5.590288186100255	0.38829689620973873	매우 불리	불리(<1)	34.12587895974238	838.4728460408703	-53.251959330175836	보류	충분
BAJAJFINSV.NS	BAJAJFINSV.NS	India Nifty 50	1764.5999755859375	-0.5242713061688442	-15.289717591039686		-18.928609004196584	1756.8024871826171	1939.7115014648436	Y	N	주의	BAJAJ FINSERV LTD.	NSI	INR	Financial Services	Financial Conglomerates	Financial Conglomerates	Bajaj Finserv Ltd., through its subsidiaries, provides financial services in India. The company operates through Life Insurance, General Insurance, Windmill, Retail Financing, and Investments and Others segments. It offers personal, business, home, home renovation, commercial, car, and gold loans; two- and three-wheeler loans; mortgages; education loans; unsecured and secured loans to small and medium-sized enterprises and professionals, as well as micro, small and medium enterprises; loans agai	2820727635968.0	7.000000000000001	60.95	10.46694716483081	15.161158100432036		891201400000.0	3597117900000.0	312442200000.0	3613782200000.0	779145300000.0	-1692.7759949660017	-355.01592039577963	-20.118776227337086	56.724790328989975	15.161158100432036	3.74145497020927	0.39067853705412947	매우 불리	불리(<1)	38.82231620086407	2366.2201724426654	34.09385725832617	보류	충분
UPL.NS	UPL.NS	India Nifty 50	614.4000244140625	0.9198483464815999	-17.89937269216797		-23.71018277276884	636.9749984741211	691.6202487182617	N	N	주의	UPL LIMITED	NSI	INR	Basic Materials	Agricultural Inputs	Agricultural Inputs	UPL Limited, together with its subsidiaries, manufactures and sells pesticides, insecticides, and micronutrients in India, Brazil, the United States, the United Kingdom, and internationally. It operates in three segments: Crop Protection, Seeds, and Non-Agro. The company offers herbicides, fungicides, insecticides, acaricides, seed treatment, adjuvants, bio-solutions, public health products, fumigants, soil and water technologies, agrochemical products, and other agricultural related products un	519342620672.0	98.0	22.34	114.26978818283166	-18.649219802963866		95190000000.0	155350000000.0	65110000000.0	235760000000.0	346960000000.0	-71.2653240496002	64.54866202564354	10.505966709099978	30.692271641166638	-18.649219802963866		2.585366802586397	판정불가	안심(>=2)	0.0	0.0	-100.0	보류	일부부족
LTIM.NS	LTIM.NS	India Nifty 50											LTIM.NS													0.0	0.0	0.0	0.0									판정불가	판정불가				판정불가	핵심부족
