티커	종목코드	유니버스	현재가	3M수익률(보조,%)	6M수익률(보조,%)	12M수익률(보조,%)	52주고점대비(보조,%)	40일이평(보조)	200일이평(보조)	40일선상회(보조)	200일선상회(보조)	추세판정(보조)	종목명	시장	통화	섹터	산업	업종	사업설명	시가총액	배당수익률(%)	EPS(FY)	EPS Growth 1Y(%)	EPS Growth 3Y CAGR(%)	EPS Growth 5Y CAGR(%)	현금및단기투자	장기부채	단기위험부채	총부채	주주지분	주당순현금(린치식)	주당잉여현금흐름	잉여현금흐름수익률(%)	순현금차감PER(린치식)	사용연성장률(%)	린치PER배수	배당감안점수	린치PER판정	배당감안점수판정	그레이엄적정PER(3년)	그레이엄내재가치(3년)	그레이엄괴리율(3년,%)	종합판정	데이터상태
HDFCLIFE.NS	HDFCLIFE.NS	India Nifty 50	614.3499755859375	-12.721984049179124	-20.24018492879747		-24.554834238542	602.5212524414062	716.3902481079101	Y	N	주의	HDFC LIFE INS CO LTD	NSI	INR	Financial Services	Insurance - Life	Insurance - Life	HDFC Life Insurance Company Limited provides individual and group insurance solutions in India. It offers insurance and investment products, such as protection, pension, savings, investment, annuity, and health, as well as term, investment, and life insurance plans. The company was formerly known as HDFC Standard Life Insurance Company Limited changed its name to HDFC Life Insurance Company Limited in January 2019. HDFC Life Insurance Company Limited was incorporated in 2000 and is headquartered	1325324697600.0	35.0	8.83	5.605195436321675	11.805242919673354		73289900000.0	30990000000.0	0.0	30990000000.0	177495400000.0	19.607981274187132	103.54693449945601	16.8547145136122	67.35469924255383	11.805242919673354	5.705490323312848	0.6949068653862002	매우 불리	불리(<1)	32.11048583934671	283.5355899614314	-53.84787153429789	보류	충분
SBILIFE.NS	SBILIFE.NS	India Nifty 50	1859.9000244140625	-8.935565893971075	-6.8186360513996735		-11.836370007737596	1859.8700012207032	1925.741000366211	Y	N	주의	SBI LIFE INSURANCE CO LTD	NSI	INR	Financial Services	Insurance - Life	Insurance - Life	SBI Life Insurance Company Limited operates as a private life insurance company in India. The company's life insurance business comprises individual and group life insurance products, including participating, non-participating, pension, group gratuity, group leave encashment, group superannuation, group immediate annuity, unit-linked and variable insurance products, health, and micro insurance. It also provides accident and disability benefit, level term, and critical illness insurance products.	1865798778880.0	14.000000000000002	24.61	2.361911076119827	12.812939479871188		33806300000.0	0.0	0.0	0.0	190860000000.0	33.69942090492378	342.2911097116141	18.40373704062123	74.20563199955866	12.812939479871188	5.7914604307726485	0.36133294410902206	매우 불리	불리(<1)	34.12587895974238	839.83788119926	-54.844998646427776	보류	충분
BAJAJFINSV.NS	BAJAJFINSV.NS	India Nifty 50	1752.199951171875	-14.564335920564597	-15.743418499227879		-19.498305956218896	1761.1649932861328	1958.6660028076171	N	N	주의	BAJAJ FINSERV LTD.	NSI	INR	Financial Services	Financial Conglomerates	Financial Conglomerates	Bajaj Finserv Ltd., through its subsidiaries, provides financial services in India. The company operates through Life Insurance, General Insurance, Windmill, Retail Financing, and Investments and Others segments. It offers personal, business, home, home renovation, commercial, car, and gold loans; two- and three-wheeler loans; mortgages; education loans; unsecured and secured loans to small and medium-sized enterprises and professionals, as well as micro, small and medium enterprises; loans agai	2800906141696.0	7.000000000000001	60.96	10.46694716483081	15.161158100432036		891201400000.0	3597117900000.0	312442200000.0	3613782200000.0	779145300000.0	-1692.7759949660017	-355.01592039577963	-20.261153423634344	56.51207260724863	15.161158100432036	3.7274245300323234	0.3921490944855116	매우 불리	불리(<1)	38.82231620086407	2366.608395604674	35.06497326528753	보류	충분
UPL.NS	UPL.NS	India Nifty 50	629.0	-14.28181923362699	-18.649768485572704		-21.89730936014904	634.8324966430664	698.3239990234375	N	N	주의	UPL LIMITED	NSI	INR	Basic Materials	Agricultural Inputs	Agricultural Inputs	UPL Limited, together with its subsidiaries, manufactures and sells pesticides, insecticides, and micronutrients in India, Brazil, the United States, the United Kingdom, and internationally. It operates in three segments: Crop Protection, Seeds, and Non-Agro. The company offers herbicides, fungicides, insecticides, acaricides, seed treatment, adjuvants, bio-solutions, public health products, fumigants, soil and water technologies, agrochemical products, and other agricultural related products un	531683737600.0	95.0	22.33	114.26978818283166	-18.649219802963866		95190000000.0	155350000000.0	65110000000.0	235760000000.0	346960000000.0	-71.2653240496002	64.54866202564354	10.262108430150006	31.359844337196606	-18.649219802963866		2.434667065820693	판정불가	안심(>=2)	0.0	0.0	-100.0	보류	일부부족
LTIM.NS	LTIM.NS	India Nifty 50											LTIM.NS													0.0	0.0	0.0	0.0									판정불가	판정불가				판정불가	핵심부족
