티커	종목코드	유니버스	현재가	3M수익률(보조,%)	6M수익률(보조,%)	12M수익률(보조,%)	52주고점대비(보조,%)	40일이평(보조)	200일이평(보조)	40일선상회(보조)	200일선상회(보조)	추세판정(보조)	종목명	시장	통화	섹터	산업	업종	사업설명	시가총액	배당수익률(%)	EPS(FY)	EPS Growth 1Y(%)	EPS Growth 3Y CAGR(%)	EPS Growth 5Y CAGR(%)	현금및단기투자	장기부채	단기위험부채	총부채	주주지분	주당순현금(린치식)	주당잉여현금흐름	잉여현금흐름수익률(%)	순현금차감PER(린치식)	사용연성장률(%)	린치PER배수	배당감안점수	린치PER판정	배당감안점수판정	그레이엄적정PER(3년)	그레이엄내재가치(3년)	그레이엄괴리율(3년,%)	종합판정	데이터상태
HDFCLIFE.NS	HDFCLIFE.NS	India Nifty 50	567.7000122070312	-2.1881481173010697	-24.291520878769536		-28.730146141866232	589.0974960327148	687.4094979858398	N	N	주의	HDFC LIFE INS CO LTD	NSI	INR	Financial Services	Insurance - Life	Insurance - Life	HDFC Life Insurance Company Limited engages in the provision of individual and group insurance solutions in India. It offers insurance and investment products, such as protection, pension, savings, investment, annuity, and health, as well as term, investment, life insurance, and NRI plans. The company was formerly known as HDFC Standard Life Insurance Company Limited changed its name to HDFC Life Insurance Company Limited in January 2019. HDFC Life Insurance Company Limited was incorporated in 2	1233007673344.0	37.0	8.86	5.605195436321675	11.805242919673354		76825800000.0	30990000000.0	0.0	30990000000.0	177495400000.0	21.103668801212137	102.84823665593547	18.116652183271107	61.69258954918951	11.805242919673354	5.22586362423591	0.7911038145150212	매우 불리	불리(<1)	32.11048583934671	284.4989045366118	-49.885696949243766	보류	충분
SBILIFE.NS	SBILIFE.NS	India Nifty 50	1788.699951171875	-2.6186899160274835	-12.098878091717523		-15.211420725704961	1806.5999908447266	1919.4109991455077	N	N	주의	SBI LIFE INSURANCE CO LTD	NSI	INR	Financial Services	Insurance - Life	Insurance - Life	SBI Life Insurance Company Limited operates as a private life insurance company in India. The company's life insurance business comprises individual and group life insurance products, including participating, non-participating, pension, group gratuity, group leave encashment, group superannuation, group immediate annuity, unit-linked and variable insurance products, health, and micro insurance. It also provides accident and disability benefit, level term, and critical illness insurance products.	1794496266240.0	15.0	24.62	2.361911076119827	12.812939479871188		33806300000.0	0.0	0.0	0.0	190860000000.0	33.697103390760724	342.2675703013411	19.134990755554217	71.28362501141812	12.812939479871188	5.563409171127589	0.39017291103554497	매우 불리	불리(<1)	34.12587895974238	840.1791399888574	-53.02850321886518	보류	충분
BAJAJFINSV.NS	BAJAJFINSV.NS	India Nifty 50	1895.5999755859375	13.352862538890165	-7.073878479391338		-12.910048215696202	1758.5374877929687	1927.6215002441406	Y	N	상승전환/양호	BAJAJ FINSERV LTD.	NSI	INR	Financial Services	Financial Conglomerates	Financial Conglomerates	Bajaj Finserv Ltd., through its subsidiaries, provides financial services in India. The company operates through Life Insurance, General Insurance, Windmill, Retail Financing, and Investments and Others segments. It offers personal, business, home, home renovation, commercial, car, and gold loans; two- and three-wheeler loans; mortgages; education loans; unsecured and secured loans to small and medium-sized enterprises and professionals, as well as micro, small and medium enterprises; loans agai	3030132195328.0	7.000000000000001	61.05	10.46694716483081	15.161158100432036		891201400000.0	3597117900000.0	312442200000.0	3613782200000.0	779145300000.0	-1692.7759949660017	-355.01592039577963	-18.728419759872743	58.77765717529794	15.161158100432036	3.8768580068842495	0.3770337091582062	매우 불리	불리(<1)	38.82231620086407	2370.1024040627517	25.03178068095002	보류	충분
UPL.NS	UPL.NS	India Nifty 50	607.4000244140625	-0.05758545223158995	-23.611896401355324		-24.5793701089834	621.3425018310547	684.772248840332	N	N	주의	UPL LIMITED	NSI	INR	Basic Materials	Agricultural Inputs	Agricultural Inputs	UPL Limited, together with its subsidiaries, manufactures and sells pesticides, insecticides, and micronutrients in India, Brazil, the United States, the United Kingdom, and internationally. It operates in three segments: Crop Protection, Seeds, and Non-Agro. The company offers herbicides, fungicides, insecticides, acaricides, seed treatment, adjuvants, bio-solutions, public health products, fumigants, soil and water technologies, agrochemical products, and other agricultural related products un	513425604608.0	1.02	22.31	114.26978818283166	-18.649219802963866		95190000000.0	155350000000.0	65110000000.0	235760000000.0	346960000000.0	-71.2653240496002	64.54866202564354	10.627043041019197	30.419782539832482	-18.649219802963866		-0.5795314210375992	판정불가	불리(<1)	0.0	0.0	-100.0	보류	일부부족
LTIM.NS	LTIM.NS	India Nifty 50											LTIM.NS													0.0	0.0	0.0	0.0									판정불가	판정불가				판정불가	핵심부족
