티커	종목코드	유니버스	현재가	3M수익률(보조,%)	6M수익률(보조,%)	12M수익률(보조,%)	52주고점대비(보조,%)	40일이평(보조)	200일이평(보조)	40일선상회(보조)	200일선상회(보조)	추세판정(보조)	종목명	시장	통화	섹터	산업	업종	사업설명	시가총액	배당수익률(%)	EPS(FY)	EPS Growth 1Y(%)	EPS Growth 3Y CAGR(%)	EPS Growth 5Y CAGR(%)	현금및단기투자	장기부채	단기위험부채	총부채	주주지분	주당순현금(린치식)	주당잉여현금흐름	잉여현금흐름수익률(%)	순현금차감PER(린치식)	사용연성장률(%)	린치PER배수	배당감안점수	린치PER판정	배당감안점수판정	그레이엄적정PER(3년)	그레이엄내재가치(3년)	그레이엄괴리율(3년,%)	종합판정	데이터상태
RELIANCE.NS	RELIANCE.NS	India Nifty 50	1295.5	-5.091575091575096	-12.655067243197616		-18.639706068373172	1310.507501220703	1414.7095037841798	N	N	주의	RELIANCE INDUSTRIES LTD	NSI	INR	Energy	Oil & Gas Refining & Marketing	Oil & Gas Refining & Marketing	Reliance Industries Limited engages in hydrocarbon exploration and production, petroleum refining and marketing, petrochemicals, advanced materials and composites, renewable, financial services, retail, and digital services worldwide. It operates through the Oil to Chemicals, Oil and Gas, Retail, Digital Services, and Others segments. The company is involved in refining and marketing products, including liquefied petroleum gas, propylene, naphtha, gasoline, jet/aviation turbine fuel, kerosine oi	17531318304768.0	46.0	59.74	15.976050999310809	6.58907750634663		4170970000000.0	2707510000000.0	1036700000000.0	3980000000000.0	9040300000000.0	108.1443162370115	51.134040224211695	3.9470505769364492	19.87538807771993	6.58907750634663	3.0164143703843007	2.645939656660005	매우 불리	안심(>=2)	21.67815501269326	1295.0529804582955	-0.03450556091891821	보류	충분
TCS.NS	TCS.NS	India Nifty 50	2189.199951171875	-15.19659302065175	-32.42375956354325		-34.15741780290319	2170.202487182617	2723.3624908447264	Y	N	주의	TATA CONSULTANCY SERV LT	NSI	INR	Technology	Information Technology Services	Information Technology Services	Tata Consultancy Services Limited provides information technology (IT) and IT enabled services. It offers TCS ADD, a suite of AI powered life sciences platforms; TCS BaNCS, a financial services platform; TCS BFSI Platforms, a cloud-native, subscription-based as-a-service digital ecosystem for insurers and financial firms; TCS Chroma, a cloud-based AI-led hire-to-retire modular platform; TCS Customer Intelligence & Insights, an AI-powered, real-time customer data analytics solution; TCS ERP on Cl	7920716611584.0	2.95	137.54	1.3531604638230332	5.300128040832486		763410000000.0	0.0	18300000000.0	112830000000.0	1072400000000.0	210.99821278563113	132.52305192027143	6.053492365982014	14.382737664579352	5.300128040832486	2.7136585293362594	0.5736131905645638	매우 불리	불리(<1)	19.100256081664973	2627.0492214722003	20.000423902163234	보류	충분
HDFCBANK.NS	HDFCBANK.NS	India Nifty 50	815.4500122070312	1.9439914137219017	-12.967607494214217		-19.49353415419761	781.5000030517579	884.5397500610352	Y	N	상승전환/양호	HDFC BANK LTD	NSI	INR	Financial Services	Banks - Regional	Banks - Regional	HDFC Bank Limited provides banking and financial products and services to individuals and businesses in India, Bahrain, Hong Kong, Singapore, and Dubai. The company operates through Treasury, Retail Banking, Wholesale Banking, Other Banking Business, Insurance Business, and Other segments. It offers savings, salary, current, rural, public provident fund, pension, and demat accounts; fixed and recurring deposits; and safe deposit lockers, as well as offshore accounts and deposits, and overdrafts 	12558914289664.0	1.61	44.84	8.166893276325982	20.388517319859577		9196249400000.0	5866163200000.0	1306013100000.0	7326106100000.0	7676891400000.0	216.22241466329902	73.3202331844539	8.991382928060945	13.36368415574782	20.388517319859577	0.6554514948828981	1.6461416674830536	헐값	양호(>=1.5)	49.277034639719155	2209.582233245007	170.9647679401868	양호	충분
ICICIBANK.NS	ICICIBANK.NS	India Nifty 50	1416.199951171875	5.152947715151646	0.21937411644579186		-4.863631976452554	1332.4124969482423	1344.079503173828	Y	Y	상승전환/양호	ICICI BANK LTD.	NSI	INR	Financial Services	Banks - Regional	Banks - Regional	ICICI Bank Limited, together with its subsidiaries, engages in the provision of various banking and financial services to retail and corporate customers in India and internationally. The company operates through Retail Banking, Wholesale Banking, Treasury, Other Banking, Life Insurance, General Insurance, and Others segments. It offers savings, salary, pension, current, trade, escrow, foreign currency, and vostro accounts, as well as time, fixed, recurring, and security deposits. The company als	10158660911104.0	85.0	74.75	6.22878665548352	16.78079563417647		2649807200000.0	2202642800000.0	226221340000.0	2202642800000.0	3630604100000.0	62.338356142632456	88.65719053216873	6.260217030710022	18.11186080306679	16.78079563417647	1.0793207424670268	5.619565915443787	보통	안심(>=2)	42.06159126835294	3144.1039473093824	122.00988954333067	보류	충분
INFY.NS	INFY.NS	India Nifty 50	1076.300048828125	-18.381732867157464	-32.55842895150713		-36.30607067537143	1113.6175033569336	1373.019503479004	N	N	주의	INFOSYS LIMITED	NSI	INR	Technology	Information Technology Services	Information Technology Services	Infosys Limited provides consulting, technology, outsourcing, and digital services worldwide. The company offers insight services, such as applied and generative AI, sustainability services, and Infosys Topaz, an AI-first set of services, solutions, and platforms; blockchain, Internet of Things, and engineering services; cybersecurity and quality engineering services; and enterprise agile DevOps, API economy and microservices, application modernization, and digital process automation. It also pr	4357861408768.0	4.57	75.52	4.9081697276757374	3.582523363792678		5163000000.0	0.0	333000000.0	967000000.0	9786000000.0	1.275152362128282	0.9219724516414638	0.08566128494050586	14.234969497695932	3.582523363792678	3.9734477774977925	0.5727109822829085	매우 불리	불리(<1)	15.665046727585356	1183.024328867246	9.915848294843265	보류	충분
BHARTIARTL.NS	BHARTIARTL.NS	India Nifty 50	1918.300048828125	3.8659387877107543	-6.149704069074124		-11.300684693284435	1862.9999969482421	1950.2940032958984	Y	N	상승전환/양호	BHARTI AIRTEL LIMITED	NSI	INR	Communication Services	Telecom Services	Telecom Services	Bharti Airtel Limited operates as a telecommunications company in India and internationally. It operates through the Mobile Services India, Mobile Services Africa, Mobile Services South Asia, Airtel Business, Passive Tower Infrastructure Services, Homes Services, Digital TV Services, and Others segments. The company provides voice and data telecom services through wireless technology including 2G/3G/4G/5G services; passive infrastructure service, including the setup, operation, and maintenance o	11967618088960.0	1.24	44.35	-20.44605898778463	47.33977446458364		866742000000.0	1000849000000.0	215865000000.0	1954117000000.0	1490566000000.0	-21.499956768424898	121.06585303901463	6.311100972601906	43.73844432010259	47.33977446458364	0.9239259125077725	1.1106882107888765	헐값	보통(1~1.5)	60.0	2661.0	38.71656843388942	보류	충분
SBIN.NS	SBIN.NS	India Nifty 50	1030.0999755859375	-4.642446138769962	1.472683919847606		-16.10197633001257	1008.704997253418	1016.0812475585938	Y	Y	상승전환/양호	STATE BANK OF INDIA	NSI	INR	Financial Services	Banks - Regional	Banks - Regional	State Bank of India provides banking products and services in India and internationally. The company operates through the Treasury, Corporate/Wholesale Banking, Retail Banking, and Other Banking Business segments. It offers personal banking products and services, including current, savings, salary, and deposit accounts; home, personal, pension, auto, education, and gold loans, as well as loans against insurance property, and securities; debit, business debit, prepaid, and green remit cards; over	9508458856448.0	1.71	91.18	7.397300658448813	14.39206891326348		6671134748000.0	0.0	0.0	7268922204000.0	5961308694000.0	722.7181373127248	32.21283031494877	3.12715572064989	3.371154181544337	14.39206891326348	0.23423693993276673	4.776426127708898	매우 유망	안심(>=2)	37.28413782652696	3399.5676870227285	230.02308199153188	매우 유망	충분
ITC.NS	ITC.NS	India Nifty 50	276.6499938964844	-9.827247423761253	-18.247636262927703		-34.84456195955911	287.60749969482424	339.1052502441406	N	N	주의	ITC LTD	NSI	INR	Consumer Defensive	Tobacco	Tobacco	ITC Limited engages in the fast-moving consumer goods, paperboards, paper and packaging, and agri businesses in India and internationally. The company offers cigarettes and cigars; foods, including staples, spices, biscuits, confectionery and gums, snacks, noodles and pasta, beverages, dairy products, ready-to-eat meals, chocolates, coffee, and frozen foods; personal care products; education and stationery, such as balls, gels and roller pens, mechanical pencils, geometry boxes, erasers, sharpen	3466277421056.0	5.81	16.51	-40.45618236934057	2.5366068168754863		463380800000.0	600000000.0	21265200000.0	23993600000.0	725073000000.0	36.935390350805385	12.994502001064214	4.697091013103885	14.519358179629252	2.5366068168754863	5.723929338609027	0.5748605905036371	매우 불리	불리(<1)	13.573213633750973	224.0937570932286	-18.997375009131943	보류	충분
LT.NS	LT.NS	India Nifty 50	3783.89990234375	-7.6218888178816275	-5.8497162890333465		-14.354590916781984	4033.162493896484	3962.897998046875	N	N	주의	LARSEN & TOUBRO LTD.	NSI	INR	Industrials	Engineering & Construction	Engineering & Construction	Larsen & Toubro Limited engages in engineering, procurement, and construction projects (EPC) in India and internationally. The company operates through four segments: Infrastructure Projects, Energy Projects, Hi-Tech Manufacturing, and Others. The Infrastructure Projects segment is involved in the engineering and construction of building and factories, transportation infrastructure, heavy civil infrastructure, power transmission & distribution, renewables, water and effluent treatment, and miner	5205621473280.0	99.0	117.0	6.96197607119986	15.382271021915606		1378585600000.0	637385900000.0	579444300000.0	1254970400000.0	1092898000000.0	538.7686122042837	86.73058760988204	2.2920951887802596	27.73616487298689	15.382271021915606	1.8031254834523656	4.123939684729667	보통	안심(>=2)	39.26454204383121	4593.9514191282515	21.407847397938706	보류	충분
HINDUNILVR.NS	HINDUNILVR.NS	India Nifty 50	2102.60009765625	-6.167437886488337	-12.617399205239154		-21.911905912562368	2160.1400146484375	2305.4805029296876	N	N	주의	HINDUSTAN UNILEVER LTD.	NSI	INR	Consumer Defensive	Household & Personal Products	Household & Personal Products	Hindustan Unilever Limited, a fast-moving consumer goods company, manufactures and sells food, home care, and personal care products in India and internationally. It operates through Home Care, Beauty & Wellbeing, Personal Care, Foods, and Others segments. The company offers detergent bars, detergent powders, detergent liquids, and scourers; skin care and hair care products; skin cleansing, oral care, bodywash, and deodorants; and culinary products, such as tomato based products, fruit based pro	4940251004928.0	2.08	45.16	41.233918677810124	14.118426432640984		142350000000.0	0.0	0.0	14780000000.0	487380000000.0	60.58500569959985	41.01990059239503	1.9509130927045784	45.21734038876551	14.118426432640984	3.202718136082477	0.35823483410062684	매우 불리	불리(<1)	36.73685286528197	1659.0362753961335	-21.09596697700876	보류	충분
BAJFINANCE.NS	BAJFINANCE.NS	India Nifty 50	1021.2999877929688	12.447012143459268	7.290677760159214		-6.658139651379735	954.5300033569335	968.614750366211	Y	Y	상승전환/양호	BAJAJ FINANCE LIMITED	NSI	INR	Financial Services	Credit Services	Credit Services	Bajaj Finance Limited operates as a deposit-taking non-banking financial company in India. The company offers financing for various products, such as consumer electronics, furniture, digital products, lifestyle products, lifecare services, e-commerce purchases, retail spends, and two and three-wheelers; and personal, unsecured, home, secured, gold, and car loans. It also provides secured and unsecured loans to micro, small, and medium enterprises; loans against property, mutual funds, insurance 	6350317289472.0	54.0	30.5	14.302174203110752	18.22815698685951		40161800000.0	0.0	0.0	3528467100000.0	1139990200000.0	6.459086323005958	-107.35321256476016	-10.51142796904861	33.273472179343045	18.22815698685951	1.8253887215986535	2.170743005044735	보통	안심(>=2)	44.95631397371902	1371.1675761984302	34.257083382672505	보류	충분
KOTAKBANK.NS	KOTAKBANK.NS	India Nifty 50	378.3999938964844	-1.3555818885018556	-11.311116427928457		-14.989216829753438	390.247501373291	405.28515060424803	N	N	주의	KOTAK MAHINDRA BANK LTD	NSI	INR	Financial Services	Banks - Regional	Banks - Regional	Kotak Mahindra Bank Limited provides a range of banking and financial services to corporate and individual customers in India. It operates through Corporate/Wholesale Banking; Retail Banking; Treasury, BMU, and Corporate Centre; Vehicle Financing; Other Lending Activities; Advisory and Transactional Services; Asset Management; and Insurance segments. The company offers savings, current, retail institution, corporate, private banking, and salary accounts; debit and credit card; NRE and NRO fixed 	3763742441472.0	17.0	19.39	-12.82698142894313	8.923950945073944		1034828436000.0	0.0	0.0	953935315000.0	1812258709000.0	104.03982130354765	40.88743538979645	10.805347793156063	14.149570530837375	8.923950945073944	1.5855724239102853	1.8321369463882773	보통	양호(>=1.5)	26.347901890147888	510.8858176499676	35.01211043616619	보류	충분
AXISBANK.NS	AXISBANK.NS	India Nifty 50	1312.300048828125	-3.4434499005590813	2.990119221179488		-6.464714980176412	1322.5224975585938	1281.8825006103516	N	Y	상승전환/양호	AXIS BANK LIMITED	NSI	INR	Financial Services	Banks - Regional	Banks - Regional	Axis Bank Limited provides various financial products and services in India and internationally. The company operates through four segments: Treasury, Retail Banking, Corporate/Wholesale Banking, and Other Banking Business. It provides fixed, recurring, and safe deposits; and saving, salary, current, safe custody, pension disbursement, and demat and trading accounts. The company also offers home, personal, car, two-wheeler, business, commercial vehicle construction equipment, education, gold loa	4082454757376.0	8.0	84.46	-5.953496528796354	34.605620932767664		1180410900000.0	0.0	0.0	2805106200000.0	2150353500000.0	379.4416249684026	-34.86661524356495	-2.656908782004588	11.04497305067159	34.605620932767664	0.3191670241123526	3.8574671696620415	매우 유망	안심(>=2)	60.0	5067.599999999999	286.1616864622791	보류	충분
ASIANPAINT.NS	ASIANPAINT.NS	India Nifty 50	2670.0	8.360389610389607	-7.816596809043819		-10.055583628095	2683.6974853515626	2570.9614990234377	N	Y	상승전환/양호	ASIAN PAINTS LIMITED	NSI	INR	Basic Materials	Specialty Chemicals	Specialty Chemicals	Asian Paints Limited, together with its subsidiaries, engages in the manufacture, distribution, and sale of paints, coatings, and products related to home decoration and bath fittings, kitchen, and wardrobe in India, Asia, the Middle East, Africa, and the South Pacific region. The company offers wall coverings, waterproofing products, adhesives; and bath fittings and sanitaryware, modular kitchens and wardrobes, fabric, furnishings, rugs, decorative lightings, unplasticized polyvinyl chloride wi	2559580307456.0	1.04	45.16	17.945970119136234	1.7462094983582643		165304500000.0	12471700000.0	10460900000.0	39289300000.0	213715900000.0	159.42597353067228	58.42479874143516	2.188194709417047	55.592870382403184	1.7462094983582643	31.836311985858508	0.05011810829685426	매우 불리	불리(<1)	11.992418996716529	541.5776418917184	-79.7161931875761	보류	충분
MARUTI.NS	MARUTI.NS	India Nifty 50	13583.0	0.9663272132609757	-18.085876251356893		-21.449225075179278	13511.75	14717.045	Y	N	상승전환/양호	MARUTI SUZUKI INDIA LTD.	NSI	INR	Consumer Cyclical	Auto Manufacturers	Auto Manufacturers	Maruti Suzuki India Limited manufactures, purchases, and sells motor vehicles, components, and spare parts in India. The company offers passenger vehicles, utility vehicles, and multi-purpose vehicles. It is also involved in the facilitation of pre-owned car sales, fleet management, and car financing activities. In addition, the company offers driving school, insurance, accessories, and financing products and services. It also exports its products to South Africa, Saudi Arabia, Chile, Japan, Mex	4270529970176.0	1.04	459.97	1.2365346684873213	21.109694032148575		346247000000.0	0.0	0.0	1025000000.0	1071563000000.0	1101.2855130123712	276.7884463948441	2.037756360118119	27.13593166290764	21.109694032148575	1.285472523741061	0.8162496245679008	보통	불리(<1)	50.71938806429715	23329.396927934762	71.75437626396793	보류	충분
SUNPHARMA.NS	SUNPHARMA.NS	India Nifty 50	1951.5	16.472694717994617	12.413594470046085		0.0	1849.8225067138671	1756.3615026855468	Y	Y	상승전환/양호	SUN PHARMACEUTICAL IND L	NSI	INR	Healthcare	Drug Manufacturers - Specialty & Generic	Drug Manufacturers - Specialty & Generic	Sun Pharmaceutical Industries Limited, a generic pharmaceutical company, develops, manufactures, and markets branded and generic formulations, and active pharmaceutical ingredients (APIs) in India, the United States, and internationally. The company offers formulations in various therapeutic areas, including neuropsychiatry, cardiology, diabetes, gastroenterology, pain/analgesics, gynecology, ophthalmology, urology, dermatology, respiratory, anti-infectives, oncology, psychiatry, neurology, orth	4682301833216.0	82.0	47.79	5.035940942662842	10.649894433841345		577924100000.0	312600000.0	40503500000.0	46273200000.0	835700900000.0	240.7381658760219	36.717715992777784	1.8815124772112624	35.79748554350237	10.649894433841345	3.3612995664775296	2.5881676611406106	매우 불리	안심(>=2)	29.79978886768269	1424.1319099865557	-27.023729952008424	보류	충분
TITAN.NS	TITAN.NS	India Nifty 50	4579.39990234375	1.1820853566004708	8.219108532494257		-0.5386449745169442	4299.894989013672	4081.0025073242186	Y	Y	상승전환/양호	TITAN COMPANY LIMITED	NSI	INR	Consumer Cyclical	Luxury Goods	Luxury Goods	Titan Company Limited, together with its subsidiaries, manufactures and sells watches, jewelry, eyewear, fragrances, women's bags, and other accessories and products in India and internationally. The company operates through four segments: Watches and Wearables, Jewellery, Eyecare, and Others. The company designs, manufactures, and retails watches and wearables under the Nebula, Titan, Titan Clock, Zoop, Titan Octane, Titan Raga, Xylys, Edge, Fastrack, Sonata, Titan Smart, Fastrack smart, SF, Ti	4062134927360.0	33.0	57.17	52.02277494755769	16.0006707482786		67030000000.0	930000000.0	273550000000.0	306210000000.0	157030000000.0	74.51705451872884	52.84961446048424	1.1540729263114946	78.79802077706877	16.0006707482786	4.924669847702859	0.6218515422729808	매우 불리	불리(<1)	40.5013414965572	2315.461693358175	-49.43744283671065	보류	충분
ULTRACEMCO.NS	ULTRACEMCO.NS	India Nifty 50	11812.0	-0.6225811879522092	-2.36402711191932		-9.500459699662889	11385.075	11816.97	Y	N	주의	ULTRATECH CEMENT LIMITED	NSI	INR	Basic Materials	Building Materials	Building Materials	UltraTech Cement Limited, together with its subsidiaries, engages in the manufacture and sale of clinker, cement, ready mix concrete, and related products in India, the United Arab Emirates, Bahrain, and Sri Lanka. The company offers ordinary Portland, Portland pozzolana, composite, Weather Plus, and Portland slag; white cement, wall care putty, and value-added products; ready-mix concrete; dry mix mortars, such as tile and marble binders, plasters and mortars, industrial and precision grouts, r	3474731565056.0	67.0	277.05	35.21263894845432	17.26452648493617		129572000000.0	150188200000.0	77618400000.0	237550900000.0	766235400000.0	-70.08269225339998	191.66118216110237	1.6225972075948387	42.88786389551849	17.26452648493617	2.484161030013738	1.9647638942852845	매우 불리	양호(>=1.5)	43.02905296987234	11921.199125303132	0.9244761708697258	보류	충분
WIPRO.NS	WIPRO.NS	India Nifty 50	174.64999389648438	-14.521345127329333	-33.61839990692776		-35.948221184662174	184.99024963378906	220.2342002105713	N	N	주의	WIPRO LTD	NSI	INR	Technology	Information Technology Services	Information Technology Services	Wipro Limited operates as an information technology (IT), consulting, and business process services company worldwide. It operates through IT Services and IT Products segments. The IT Services segment offers AI-powered IT and IT-enabled services, including digital strategy advisory, customer-centric design, technology and IT consulting, custom application design, development, re-engineering and maintenance, systems integration, package implementation, cloud and infrastructure, business process, 	1727633948672.0	9.6	12.56	0.47200694306988034	5.155220759982337		981695000000.0	1962000000.0	165912000000.0	202910000000.0	885368000000.0	99.0431826132032	13.517316530890803	7.739660465664007	6.019650579879074	5.155220759982337	1.167680466102813	2.451175622934371	보통	안심(>=2)	18.810441519964677	236.25914549075634	35.275782277317404	보류	충분
ONGC.NS	ONGC.NS	India Nifty 50	247.17999267578125	-12.980107974537347	4.866142987233335		-17.98938364919972	253.6477481842041	259.2912998199463	N	N	중립	OIL AND NATURAL GAS CORP.	NSI	INR	Energy	Oil & Gas Integrated	Oil & Gas Integrated	Oil and Natural Gas Corporation Limited, together with its subsidiaries, engages in the exploration, development, production, and distribution of crude oil, natural gas, and value-added products in India and internationally. It operates through Exploration and Production, Refining & Marketing, and Petrochemicals segments. The company engages in the refining and marketing of petroleum products; liquefied natural gas supply; pipelines for transportation of petroleum products; SEZ development; heli	3109593284608.0	7.43	32.93	14.351058725840993	4.110173577502096		887528900000.0	938229200000.0	482321800000.0	1743164900000.0	3717678000000.0	-4.030141077935627	46.68327231719152	18.886347479759255	7.6286101959829	4.110173577502096	1.8560311510296572	1.5127491484070008	보통	양호(>=1.5)	16.72034715500419	550.601031814288	122.75307392556454	보류	충분
NTPC.NS	NTPC.NS	India Nifty 50	344.3500061035156	-12.512703057999296	2.0447454872963844		-16.0531458176263	362.83874740600584	357.348500213623	N	N	중립	NTPC LTD	NSI	INR	Utilities	Utilities - Regulated Electric	Utilities - Regulated Electric	NTPC Limited operates as an integrated power company in India and Mauritius. It operates through two segments: Generation and Others. The company generates power from fossil fuels, hydro, solar, wind, nuclear, and renewable energy sources. It also engages in the coal mining and energy trading business. NTPC Limited was incorporated in 1975 and is based in New Delhi, India.	3339047141376.0	3.26	30.43	15.49820129909496	16.949816418059882		523473900000.0	2076637000000.0	595945000000.0	2710045800000.0	2031756700000.0	-160.17495895357803	7.066377149950866	2.052091483868489	16.579854257544977	16.949816418059882	0.9781730874606575	1.2189381223820481	헐값	보통(1~1.5)	42.399632836119764	1290.2208272031244	274.68296916924373	보류	충분
POWERGRID.NS	POWERGRID.NS	India Nifty 50	280.70001220703125	-11.757306877986585	8.567018162769703		-12.527261593660487	287.80749893188477	286.27350036621095	N	N	중립	POWER GRID CORP. LTD.	NSI	INR	Utilities	Utilities - Regulated Electric	Utilities - Regulated Electric	Power Grid Corporation of India Limited, an electric power transmission utility, engages in the power transmission business in India and internationally. It operates in three segments: Transmission Services, Telecom Services, and Consultancy Services. As of 31 March 2025, the company owned and operated 180,195 circuit kilometers of transmission lines, and 282 substations with an aggregate transformation capacity of 551,961 mega volt amperes. It also provides telecom services that offer overhead 	2610679513088.0	4.28	20.12	2.6190224618334312	1.0867601620135003		269860400000.0	1210718000000.0	269372100000.0	1480706000000.0	1004940300000.0	-101.16091581902914	3.92605692174576	1.3986664592127211	18.97917137306463	1.0867601620135003	17.463992550022148	0.28277104708744255	매우 불리	불리(<1)	10.673520324027	214.75122891942326	-23.49439986449564	보류	충분
