티커	종목코드	유니버스	현재가	3M수익률(보조,%)	6M수익률(보조,%)	12M수익률(보조,%)	52주고점대비(보조,%)	40일이평(보조)	200일이평(보조)	40일선상회(보조)	200일선상회(보조)	추세판정(보조)	종목명	시장	통화	섹터	산업	업종	사업설명	시가총액	배당수익률(%)	EPS(FY)	EPS Growth 1Y(%)	EPS Growth 3Y CAGR(%)	EPS Growth 5Y CAGR(%)	현금및단기투자	장기부채	단기위험부채	총부채	주주지분	주당순현금(린치식)	주당잉여현금흐름	잉여현금흐름수익률(%)	순현금차감PER(린치식)	사용연성장률(%)	린치PER배수	배당감안점수	린치PER판정	배당감안점수판정	그레이엄적정PER(3년)	그레이엄내재가치(3년)	그레이엄괴리율(3년,%)	종합판정	데이터상태
M&M.NS	M&M.NS	India Nifty 50	3132.89990234375	3.1882942450489615	-14.857598130316529		-17.607301104424312	3104.5275024414063	3414.255506591797	Y	N	상승전환/양호	MAHINDRA & MAHINDRA LTD	NSI	INR	Consumer Cyclical	Auto Manufacturers	Auto Manufacturers	Mahindra & Mahindra Limited provides mobility products and farm solutions in India and internationally. It operates through five segments: Automotive; Farm Equipment; Auto Investments; Farm Investments; and Investments in Industrial Businesses and Consumer Services. The company offers commercial vehicles, trucks, buses, vans, passenger cars, utility vehicles, and electric vehicles (EV), as well as motorcycles; aero and defense products; offers construction equipment, such as rotaries, tillers, l	3761867849728.0	1.05	152.19	32.25089140002011	18.47775261729612		1104695000000.0	734699300000.0	561445700000.0	1339631500000.0	930963500000.0	308.1340171096516	17.088395109658443	0.5454497635521156	18.56078510568433	18.47775261729612	1.0044936465006296	1.052097338884423	보통	보통(1~1.5)	45.45550523459224	6917.873341652593	120.81373670691717	보류	충분
TATASTEEL.NS	TATASTEEL.NS	India Nifty 50	199.00999450683594	6.456612767624659	15.777529358011467		-10.003170030091136	209.64475135803224	188.44755012512206	N	Y	상승전환/양호	TATA STEEL LIMITED	NSI	INR	Basic Materials	Steel	Steel	Tata Steel Limited engages in the manufacture and distribution of steel products in India and internationally. It offers reinforcement bars (rebars) and wire rods, cut-and-bend reinforcement bars, welded wire mesh, prefabricated cages (pre-cages), steel couplers and carpet reinforcement, hot-rolled, cold rolled, coated coil, tubes, rebar, metallic coated, pre-finished steels, alloy steels, and profiles and construction systems. The company also provides solutions in building envelopes, structura	2482022383616.0	2.04	8.64	215.56317625149467	7.205668401450982		152593300000.0	637536700000.0	212027200000.0	923816800000.0	1021676500000.0	-38.88304404652014	16.44135707841275	8.261573555215588	27.533916499231022	7.205668401450982	3.8211467646341606	0.33579198228879636	매우 불리	불리(<1)	22.911336802901964	197.953949977073	-0.5306489919664203	보류	충분
HCLTECH.NS	HCLTECH.NS	India Nifty 50	1166.800048828125	-12.178227437228106	-30.265354836346837		-32.93867277109428	1173.0124938964843	1451.9949981689454	N	N	주의	HCL TECHNOLOGIES LTD	NSI	INR	Technology	Information Technology Services	Information Technology Services	HCL Technologies Limited provides IT and business services, engineering, research and development services, software products, and IP-led offerings. It operates through IT and Business Services, Engineering and R&D Services, and HCL Software segments. The company provides application development, management, modernization, and testing services, as well as commercial applications; automation services, including digital integration, business process management, robotic process automation for intel	3157088796672.0	8.28	61.31	-4.301322599194934	3.8683596866436742		557570000000.0	370000000.0	1220000000.0	52150000000.0	751650000000.0	205.9305398048444	68.56836512920455	5.876616580370489	15.67231298357985	3.8683596866436742	4.051410482249572	0.7751478482704957	매우 불리	불리(<1)	16.23671937328735	995.4732647762474	-14.683474192853307	보류	충분
TECHM.NS	TECHM.NS	India Nifty 50	1462.4000244140625	9.17506714550671	-7.349214280648642		-17.303777187030366	1448.8099975585938	1491.7285021972657	Y	N	상승전환/양호	TECH MAHINDRA LIMITED	NSI	INR	Technology	Information Technology Services	Information Technology Services	Tech Mahindra Limited provides information technology services and solutions in the Americas, Europe, India, and internationally. It operates through Information technology Business and Business Process Services segments. It offers application development maintenance, intelligent automation, testing, performance engineering, cloud consulting, engineering and network, data analytics, and artificial intelligence (AI) services. The company also provides business process services, such as Consulting	1295426650112.0	3.53	54.25	13.157709043866861	-0.14094743522335973		127309000000.0	0.0	696000000.0	21862000000.0	296154000000.0	143.71843634119998	61.821652274019385	4.227410506149941	24.307494711020507	-0.14094743522335973		0.13942418192690648	판정불가	불리(<1)	8.21810512955328	445.8322032782654	-69.51366275743216	보류	일부부족
COALINDIA.NS	COALINDIA.NS	India Nifty 50	455.75	-0.9884831443913056	18.88613349256978		-5.377347498119301	462.7412498474121	420.0492495727539	N	Y	상승전환/양호	COAL INDIA LTD	NSI	INR	Energy	Thermal Coal	Thermal Coal	Coal India Limited, together with its subsidiaries, produces and sells coal and coal products in India. The company offers coking coal for steel making and metallurgical industries, as well as for hard coke manufacturing; semi coking coal for blend-able coal in steel making, merchant coke manufacturing, and other metallurgical industries; and non-coking coal for thermal grade coal for cement, fertilizer, glass, ceramic, paper, chemical, and brick manufacturing, as well as power generation and ot	2808663506944.0	4.88	50.46	-12.42470944167401	-0.706993307310555		1116782200000.0	92323600000.0	45891000000.0	140721800000.0	1191015600000.0	166.23458728687848	49.839873462265636	10.93579231207145	5.737523042273514	-0.706993307310555		0.7273185069485796	판정불가	불리(<1)	7.08601338537889	357.5602354262188	-21.544654870824175	보류	일부부족
NESTLEIND.NS	NESTLEIND.NS	India Nifty 50	1407.300048828125	15.979892905284455	13.647742335141988		-5.302464709801469	1429.0724975585938	1286.585501098633	N	Y	상승전환/양호	NESTLE INDIA LIMITED	NSI	INR	Consumer Defensive	Packaged Foods	Packaged Foods	Nestlé India Limited engages in the manufacture and sale of food products in India and internationally. The company provides milk products and nutrition, including dairy whitener, condensed milk, UHT milk, yogurt, maternal and infant formula, baby foods, health care nutrition; prepared dishes and cooking aids, such as noodles, sauces, seasonings, pasta, cereals, and pet foods; powdered and liquid beverages comprising instant coffee and tea, as well as ready to drink beverages; and confectionery 	2713716785152.0	1.758686786134173	18.09	34.17959272459547			15759300000.0	224800000.0	7308600000.0	11668500000.0	40102100000.0	8.055999916030286	4.801551232581211	0.3411888769974476	77.34903531852376	34.17959272459547	2.263018051202926	0.46462479283336383	매우 불리	불리(<1)	8.5	153.765	-89.07375863959915	보류	충분
ADANIENT.NS	ADANIENT.NS	India Nifty 50	2951.89990234375	49.23659769179727	29.333159334282488		-3.1592431720597114	2712.875	2344.6774603271483	Y	Y	상승전환/양호	ADANI ENTERPRISES LIMITED	NSI	INR	Energy	Thermal Coal	Thermal Coal	Adani Enterprises Limited, together with its subsidiaries, operates in the new energy ecosystem, data center, airports, roads, copper and PVC, and other sectors in India and internationally. It operates through the Integrated Resources Management (IRM), Mining Services, Commercial Mining, New Energy Ecosystem, Airport, Road, copper, and Others segments. The company engages in the integrated ecosystem for manufacturing green hydrogen, including solar cells, modules, and wind turbine generators; c	4049970135040.0	0.1688419040240073	73.59	31.560360614171003	55.91755566442864		137557900000.0	761661500000.0	105360600000.0	1066217900000.0	809259500000.0	-479.4551230841857	-238.24510806639495	-8.070907413806038	46.62800686816056	55.91755566442864	0.8338706210261346	1.2028478447949842	헐값	보통(1~1.5)	60.0	4415.400000000001	49.578242693604224	보류	충분
ADANIPORTS.NS	ADANIPORTS.NS	India Nifty 50	1828.5999755859375	33.09556322089697	20.081423493067362		0.0	1759.915005493164	1513.1650024414062	Y	Y	상승전환/양호	ADANI PORT & SEZ LTD	NSI	INR	Industrials	Marine Shipping	Marine Shipping	Adani Ports and Special Economic Zone Limited, together with its subsidiaries, develops, operates, and maintains port infrastructure in India and internationally. The company is involved in the operation of ports and terminals, including bulk and break bulk, container, liquid, dry bulk, general, LPG/LNG, and crude cargo; terminal and ports related infrastructure development activities; and development of infrastructure at contiguous Special Economic Zone at Mundra. It also offers logistic servic	4213019508736.0	1.3945094794080946	58.3	15.45124505175206	34.11377534025834		94579700000.0	502613300000.0	46788100000.0	632361600000.0	961253000000.0	-177.10106067169426	21.857766504498944	1.1953279446750003	34.40310525313262	34.11377534025834	1.0084813219876263	1.0321244131424205	보통	보통(1~1.5)	60.0	3498.0	91.29388858703979	보류	충분
JSWSTEEL.NS	JSWSTEEL.NS	India Nifty 50	1287.199951171875	12.360333327827956	14.36694368475122		-1.957504209329053	1281.2650054931642	1188.4065032958983	Y	Y	상승전환/양호	JSW STEEL LIMITED	NSI	INR	Basic Materials	Steel	Steel	JSW Steel Limited manufactures and sells iron and steel products in India and internationally. The company offers color coated steel products, color-coated roofing sheets, galvalume coil and sheets, aluminum-zinc sheets, galvanized corrugated sheets, tin plate products, lead-free coils and sheets, Al-Zn-Mg coated galvanized steel, multi-utility steel sheets, hot rolled and cold-rolled coils, cold rolled close annealed, electrical, coated steel products, TMT bars, wire rods, alloy steel products,	3141832278016.0	56.00000000000001	91.24	536.8721461187215	75.2799343943875		622520000000.0	756080000000.0	397410000000.0	1191270000000.0	1000530000000.0	-54.71915933908321	43.01001308338541	3.3413622370191063	14.707574643916685	75.2799343943875	0.1953717781801522	8.926008371386185	매우 유망	안심(>=2)	60.0	5474.4	325.2952305518712	매우 유망	충분
CIPLA.NS	CIPLA.NS	India Nifty 50	1350.800048828125	3.9076960637019154	-10.979304923253142		-18.802592651375882	1369.175	1423.7405029296874	N	N	주의	CIPLA LTD	NSI	INR	Healthcare	Drug Manufacturers - Specialty & Generic	Drug Manufacturers - Specialty & Generic	Cipla Limited, together with its subsidiaries, manufactures, develops, sells, and distributes pharmaceutical products in India, the United States, South Africa, and internationally. It offers generic and branded generic medicines, vaccines, active pharmaceutical ingredients, and formulations for various therapeutic areas, such as MI, angina, heart disease, pulmonary disease, kidney disorders, alzheimer's disease, hypertension, arrhythmia, lipid abnormalities and diabetes, obesity, central nervou	1091237511168.0	3.7385251831913124	48.06	-26.42550431292816	11.454373804227448		190380200000.0	1174700000.0	1405000000.0	6137700000.0	344319500000.0	234.21006008531464	10.654391168123082	0.7887467266059257	23.233249869804627	11.454373804227448	2.028329987033422	0.6539291348630651	매우 불리	불리(<1)	31.408747608454895	1509.5044100623422	11.748915864483411	보류	충분
DRREDDY.NS	DRREDDY.NS	India Nifty 50	1269.0	-0.6186877800153257	-0.8051315903223943		-6.319206934055266	1300.4999969482421	1264.5524993896483	N	Y	상승전환/양호	DR. REDDY S LABORATORIES	NSI	INR	Healthcare	Drug Manufacturers - Specialty & Generic	Drug Manufacturers - Specialty & Generic	Dr. Reddy's Laboratories Limited, together with its subsidiaries, operates as an integrated pharmaceutical company North America, Europe, India, Russia, and internationally. The company operates through Global Generics, Pharmaceutical Services and Active Ingredients (PSAI), and Others segment. Its Global Generics segment manufactures and markets prescription and over-the-counter finished pharmaceutical products that are marketed under a brand name or as a generic finished dosages with therapeuti	1056700694528.0	63.0	51.46	-24.21830786644029	-1.6674294475082507		160260000000.0	12203000000.0	62934000000.0	77341000000.0	377063000000.0	177.80278441127476	22.012637283334566	1.734644387969627	21.20476516884425	-1.6674294475082507		2.892395650889193	판정불가	안심(>=2)	5.1651411049834985	265.79816126245083	-79.05451841903461	보류	일부부족
GRASIM.NS	GRASIM.NS	India Nifty 50	3150.39990234375	18.685956082278633	11.0586229270488		-0.6684384745783811	3000.5850158691405	2828.468000488281	Y	Y	상승전환/양호	GRASIM INDUSTRIES LTD	NSI	INR	Basic Materials	Building Materials	Building Materials	Grasim Industries Limited, together with its subsidiaries, primarily produces cellulosic fibres, diversified chemicals, fashion yarns, and fabrics in india and internationally. The company operates through Cellulosic Fibres, Chemicals, Building Materials, Financial Services, and Others segments. It offers cellulosic staple fibre; and cellulosic fashion yarn; chlor-alkali comprising caustic soda; chlorine derivatives, and specialty chemicals, that include epoxy polymers and curing agents. The com	2136515543040.0	1.2671657960089702	73.17	34.02344508970015	-10.06389336340252		719038100000.0	1568286200000.0	681192000000.0	2278530600000.0	1034699200000.0	-1252.3666261398396	-493.0715214428983	-15.651077219627773	60.17174427338512	-10.06389336340252		-0.14619366072265377	판정불가	불리(<1)	0.0	0.0	-100.0	보류	일부부족
HINDALCO.NS	HINDALCO.NS	India Nifty 50	1007.9000244140625	9.417575606664187	18.28424519329328		-12.333646410376687	1070.4800018310548	903.446252746582	N	Y	상승전환/양호	HINDALCO  INDUSTRIES  LTD	NSI	INR	Basic Materials	Aluminum	Aluminum	Hindalco Industries Limited, together with its subsidiaries, manufactures and distributes aluminum and copper products in India, the United States, Brazil, South Korea, the United Kingdom, Germany, China, and internationally. It operates through Novelis, Aluminium Upstream, Aluminium Downstream, and Copper segments. The company offers primary aluminum, such as ingots, wirerods, primary foundry alloys, and billets; flat rolled products, including building and pattern sheets, PCB entry and cold-ro	2253818691584.0	51.0	60.22	-16.311480532466717	9.86859005895193		416180000000.0	755950000000.0	210640000000.0	991610000000.0	1365830000000.0	-151.94397181036086	-88.75062732284844	-8.805499074617362	19.260112856599523	9.86859005895193	1.9516580120914453	3.1603444129401956	보통	안심(>=2)	28.23718011790386	1700.4429867001704	68.71147390721755	보류	충분
HEROMOTOCO.NS	HEROMOTOCO.NS	India Nifty 50	5016.39990234375	-4.965427633915887	-15.832216403628351		-21.00779619961026	5009.222497558594	5460.014001464844	Y	N	주의	HERO MOTOCORP LIMITED	NSI	INR	Consumer Cyclical	Auto Manufacturers	Auto Manufacturers	Hero MotoCorp Limited primarily engages in the manufacture and sale of motorised two wheelers in India, Asia, Central and Latin America, Africa, and the Middle East. The company offers motorcycles and scooters, as well as electric scooters. It provides engines, parts, and accessories, as well as non-banking financial and other related services. The company is also involved in merchandise business. The company was formerly known as Hero Honda Motors Ltd. and changed its name to Hero MotoCorp Limi	1003746230272.0	2.98	286.77	31.1352341451828	26.895886141440116		254871500000.0	0.0	4985500000.0	7786100000.0	216111900000.0	1273.7655938661862	360.55845209289697	7.187593874332821	13.050996647060584	26.895886141440116	0.485241370313214	2.2891651074149135	매우 유망	안심(>=2)	60.0	17206.199999999997	242.9989700773449	매우 유망	충분
BPCL.NS	BPCL.NS	India Nifty 50	317.95001220703125	4.262993762785716	-12.902335888489159		-18.117429255095995	299.2475021362305	335.6597508239746	Y	N	상승전환/양호	BHARAT PETROLEUM CORP  LT	NSI	INR	Energy	Oil & Gas Refining & Marketing	Oil & Gas Refining & Marketing	Bharat Petroleum Corporation Limited engages in refining crude oil and marketing petroleum products in India and internationally. It operates through two segments, Downstream Petroleum; and Exploration and Production of Hydrocarbons. The company operates fuel stations that sell motor spirits, high-speed diesel, blended fuels, compressed and liquefied natural gas, automotive liquefied petroleum gas (LPG), and lubricants; operate convenience stores, restaurants, and electric vehicle charging facil	1358468481024.0	8.64915834068078	60.48	93.77912578590414	129.7482877705289		455243700000.0	222031700000.0	212787400000.0	544244200000.0	1001702600000.0	54.58335103397644	73.36114067795111	23.07316806460207	4.354607492940722	129.7482877705289	0.03356196499981736	31.781841724097184	매우 유망	안심(>=2)	60.0	3628.7999999999997	1041.3114831513603	매우 유망	충분
EICHERMOT.NS	EICHERMOT.NS	India Nifty 50	7509.0	9.981691688026363	3.8732881449716317		-8.31501831501832	7182.75	7133.21	Y	Y	상승전환/양호	EICHER MOTORS LTD	NSI	INR	Consumer Cyclical	Auto Manufacturers	Auto Manufacturers	Eicher Motors Limited, an automobile company, engages in the manufacture and sale of motorcycles and commercial vehicles in India and internationally. The company designs, develops, manufactures, assembles, and sells two-wheelers, as well as related parts and accessories; motorcycle accessories; protective and performance gears, and riding apparel products for men and women; and lifestyle apparel products and accessories. It also owns the Royal Enfield motorcycle brand that offers Classic 350, B	2061201965056.0	2.3838060993474497	200.35	16.491707572595704	23.697524323492836		119936500000.0	2016300000.0	1173800000.0	5139500000.0	251001500000.0	429.5856505521197	128.58330637802095	1.7123892179787048	35.33523508583919	23.697524323492836	1.491093947345764	0.7381111335323347	보통	불리(<1)	55.89504864698567	11198.57299642358	49.13534420593395	보류	충분
APOLLOHOSP.NS	APOLLOHOSP.NS	India Nifty 50	8427.5	12.516688918558083	18.68046753978312		-1.1320976067573874	8111.4625	7593.29	Y	Y	상승전환/양호	APOLLO HOSPITALS ENTER. L	NSI	INR	Healthcare	Medical Care Facilities	Medical Care Facilities	Apollo Hospitals Enterprise Limited, together with its subsidiaries, provides healthcare services in India. It operates through Healthcare Services, Retail Health & Diagnostics, Digital Health & Pharmacy Distribution, and Others segments. The company's healthcare facilities comprise primary, secondary, and tertiary care, as well as specialty facilities. It offers services in cardiac sciences, oncology, neurosciences, gastroenterology, orthopedics, urology, organ transplantation, pulmonology, obs	1211745173504.0	24.0	135.09	34.290061553357766	33.336300616284454		38725000000.0	24301000000.0	32284000000.0	84929000000.0	94801000000.0	100.31668399779261	62.15544959014647	0.7375312914879439	61.641744881206655	33.336300616284454	1.8490877434401125	0.9301537574379267	보통	불리(<1)	60.0	8105.400000000001	-3.8220112726193967	보류	충분
BRITANNIA.NS	BRITANNIA.NS	India Nifty 50	5232.0	-10.441629578911327	-11.554391006677378		-16.958971510197607	5393.1375	5807.3475	N	N	주의	BRITANNIA INDUSTRIES LTD	NSI	INR	Consumer Defensive	Packaged Foods	Packaged Foods	Britannia Industries Limited manufactures and sells various food products in India and internationally. The company offers biscuits under the Good Day, Marie Gold, NutriChoice, Milk Bikis, Tiger, 50-50, Jim Jam, Britannia Bourbon, Little Hearts, Treat, Pure Magic, Nice Time, and Biscafe brand names; cakes under the Muffills, Fudge It, Gobbles, Layerz, Tiffin Fun, Rollyo, and Nut & Raisin Romance Cake brand names; rusks under the Toastea brand; center filled croissants under the Treat Croissant b	1260222939136.0	1.73	105.39	16.2828803936238	2.9516551243742306		50909800000.0	2861100000.0	10717200000.0	13802800000.0	51065600000.0	199.48121358404097	99.88985848100158	1.909209833352477	47.75138804835334	2.9516551243742306	16.177834481417246	0.09804228349621082	매우 불리	불리(<1)	14.403310248748461	1517.9648671156003	-70.98691003219419	보류	충분
BAJAJ-AUTO.NS	BAJAJ-AUTO.NS	India Nifty 50	10042.0	10.680039678165997	11.39212423738214		-7.091640838229174	10230.8875	9426.8025	N	Y	상승전환/양호	BAJAJ AUTO LIMITED	NSI	INR	Consumer Cyclical	Auto Manufacturers	Auto Manufacturers	Bajaj Auto Limited, together with its subsidiaries, engages in the development, manufacture, and distribution of automobiles in India and internationally. The company offers motorcycles, bikes, commercial vehicles, electric two-wheelers, and three-wheeler, as well as related parts and accessories. It also exports its products. The company was founded in 1945 and is based in Pune, India.	2804446920704.0	5.775741884086835	384.64	46.68404159607249	21.03071664453431		241990300000.0	153389400000.0	66416500000.0	226397800000.0	388319900000.0	317.25695632790735	67.11312956259701	0.6683243334255826	25.282713819862973	21.03071664453431	1.202180327337239	1.0602682417565896	보통	보통(1~1.5)	50.56143328906862	19447.949700307352	93.66609938565378	보류	충분
TATACONSUM.NS	TATACONSUM.NS	India Nifty 50	1124.5	2.9102269835393324	-2.157839360871183		-11.526357199055859	1168.6899963378905	1143.5654974365234	N	N	주의	TATA CONSUMER PRODUCT LTD	NSI	INR	Consumer Defensive	Packaged Foods	Packaged Foods	Tata Consumer Products Limited, together with its subsidiaries, manufactures, distributes, and trades in food products in India, the United States, the United Kingdom, and internationally. It operates through Branded Business and Non Branded Business segments. The company provides tea, coffee, water, salt, pulses, spices, snacks, ready-to-eat packaged and processed food products, ready to cook, ready to drink beverages, breakfast cereals, sauces, instant masala noodles, meal solutions, staples, 	1112856068096.0	88.0	15.63	20.63638567975783	8.611325596691376		55932700000.0	3021400000.0	18181700000.0	28195100000.0	217875300000.0	53.46491486482811	19.939265753150654	1.7731672523922322	68.52431766699755	8.611325596691376	7.9574644922642115	1.4098838030928835	매우 불리	보통(1~1.5)	25.722651193382752	402.04503815257243	-64.24677295219455	보류	충분
DIVISLAB.NS	DIVISLAB.NS	India Nifty 50	6663.5	9.759512436171969	3.631415241057545		-4.5822295410610785	6660.5625	6346.475	Y	Y	상승전환/양호	DIVI S LABORATORIES LTD	NSI	INR	Healthcare	Drug Manufacturers - Specialty & Generic	Drug Manufacturers - Specialty & Generic	Divi's Laboratories Limited engages in the manufacture and sale of generic active pharmaceutical ingredients (APIs), intermediates, and nutraceuticals in India, North America, Asia, Europe, and internationally. The company also undertakes custom synthesis contract manufacturing services of APIs and intermediates; and supplies a range of carotenoids, such as beta carotene, astaxanthin, lycopene, and canthaxanthin, as well as lutein and vitamins used in the food, beverage, dietary supplement, pet 	1768949809152.0	45.0	96.66	17.206754906435417	12.078780055201644		67160000000.0	0.0	0.0	70000000.0	167610000000.0	252.98662463181142	8.211894605380419	0.12323695663510796	66.32022941618237	12.078780055201644	5.490639709729793	0.860654140639541	매우 불리	불리(<1)	32.65756011040329	3156.679760271582	-52.62730156416925	보류	충분
INDUSINDBK.NS	INDUSINDBK.NS	India Nifty 50	936.2000122070312	13.47191395170999	10.642319351739783		-2.944221863747709	909.1987518310547	849.8817514038086	Y	Y	상승전환/양호	INDUSIND BANK LIMITED	NSI	INR	Financial Services	Banks - Regional	Banks - Regional	IndusInd Bank Limited provides various banking products and financial services to individuals, corporations, government entities, and public sector undertakings in India. It operates in four segments: Treasury, Corporate/Wholesale Banking, Retail Banking, and Other Banking Operations. The company offers savings, salary, RFC, and uniformed personnel accounts; current accounts comprising smart, everyday, premium, trade, startup, and specialized accounts; fixed, recurring, sweep in/out, senior citi	729424068608.0	16.0	11.39	-65.46976556372644	-50.74727610509653		489323500000.0	0.0	0.0	427891900000.0	657396300000.0	628.0361064836869	3.8630130645566805	0.41262689747780235	27.05565458501706	-50.74727610509653		-1.2842888718848058	판정불가	불리(<1)	0.0	0.0	-100.0	보류	일부부족
