티커	종목코드	유니버스	현재가	3M수익률(보조,%)	6M수익률(보조,%)	12M수익률(보조,%)	52주고점대비(보조,%)	40일이평(보조)	200일이평(보조)	40일선상회(보조)	200일선상회(보조)	추세판정(보조)	종목명	시장	통화	섹터	산업	업종	사업설명	시가총액	배당수익률(%)	EPS(FY)	EPS Growth 1Y(%)	EPS Growth 3Y CAGR(%)	EPS Growth 5Y CAGR(%)	현금및단기투자	장기부채	단기위험부채	총부채	주주지분	주당순현금(린치식)	주당잉여현금흐름	잉여현금흐름수익률(%)	순현금차감PER(린치식)	사용연성장률(%)	린치PER배수	배당감안점수	린치PER판정	배당감안점수판정	그레이엄적정PER(3년)	그레이엄내재가치(3년)	그레이엄괴리율(3년,%)	종합판정	데이터상태
RELIANCE.NS	RELIANCE.NS	India Nifty 50	1269.199951171875	-9.65262620608297	-17.34826964375358		-20.291407884716193	1360.8025024414062	1425.9770037841797	N	N	주의	RELIANCE INDUSTRIES LTD	NSI	INR	Energy	Oil & Gas Refining & Marketing	Oil & Gas Refining & Marketing	Reliance Industries Limited engages in hydrocarbon exploration and production, petroleum refining and marketing, petrochemicals, advanced materials and composites, renewable, financial services, retail, and digital services worldwide. It operates through the Oil to Chemicals, Oil and Gas, Retail, Digital Services, and Others segments. The company is involved in refining and marketing products, including liquefied petroleum gas, propylene, naphtha, gasoline, jet/aviation turbine fuel, kerosine oi	17175412736000.0	47.0	59.63	15.976050999310809	6.58907750634663		4170970000000.0	2707510000000.0	1036700000000.0	3980000000000.0	9040300000000.0	108.1443162370115	51.134040224211695	4.02884038696966	19.47099840574985	6.58907750634663	2.955041640805605	2.752251137287423	매우 불리	안심(>=2)	21.67815501269326	1292.6683834068992	1.8490728914191568	보류	충분
TCS.NS	TCS.NS	India Nifty 50	2151.0	-15.89771982057917	-33.38907368621125		-38.81034420612072	2374.0849670410157	2851.2299877929686	N	N	주의	TATA CONSULTANCY SERV LT	NSI	INR	Technology	Information Technology Services	Information Technology Services	Tata Consultancy Services Limited provides information technology (IT) and IT enabled services. It offers TCS ADD, a suite of AI powered life sciences platforms; TCS BaNCS, a financial services platform; TCS BFSI Platforms, a cloud-native, subscription-based as-a-service digital ecosystem for insurers and financial firms; TCS Chroma, a cloud-based AI-led hire-to-retire modular platform; TCS Customer Intelligence & Insights, an AI-powered, real-time customer data analytics solution; TCS ERP on Cl	7782505906176.0	5.76	135.97	1.3531604638230332	5.300128040832486		763410000000.0	0.0	18300000000.0	112830000000.0	1072400000000.0	210.99821278563113	132.52305192027143	6.160997299873149	14.267866347093983	5.300128040832486	2.6919852194463108	0.7751774352081146	매우 불리	불리(<1)	19.100256081664973	2597.0618194239864	20.737416058762737	보류	충분
HDFCBANK.NS	HDFCBANK.NS	India Nifty 50	738.3499755859375	-13.84983535355988	-25.95768486285911		-27.105345267115123	771.7300033569336	906.8987496948242	N	N	주의	HDFC BANK LTD	NSI	INR	Financial Services	Banks - Regional	Banks - Regional	HDFC Bank Limited provides banking and financial products and services to individuals and businesses in India, Bahrain, Hong Kong, Singapore, and Dubai. The company operates through Treasury, Retail Banking, Wholesale Banking, Other Banking Business, Insurance Business, and Other segments. It offers savings, salary, current, rural, public provident fund, pension, and demat accounts; fixed and recurring deposits; and safe deposit lockers, as well as offshore accounts and deposits, and overdrafts 	11368774238208.0	1.76	44.84	8.166893276325982	20.388517319859577		9196249400000.0	5866163200000.0	1306013100000.0	7326106100000.0	7676891400000.0	216.27388895398335	73.33768792892087	9.932645812132895	11.643088461907986	20.388517319859577	0.5710610673276842	1.9022888464964938	헐값	양호(>=1.5)	49.277034639719155	2209.582233245007	199.25947129496868	양호	충분
ICICIBANK.NS	ICICIBANK.NS	India Nifty 50	1275.0	-2.9237112608699434	-8.055091591910667		-14.349051396555412	1279.3800018310546	1349.226001586914	N	N	주의	ICICI BANK LTD.	NSI	INR	Financial Services	Banks - Regional	Banks - Regional	ICICI Bank Limited, together with its subsidiaries, engages in the provision of various banking and financial services to retail and corporate customers in India and internationally. The company operates through Retail Banking, Wholesale Banking, Treasury, Other Banking, Life Insurance, General Insurance, and Others segments. It offers savings, salary, pension, current, trade, escrow, foreign currency, and vostro accounts, as well as time, fixed, recurring, and security deposits. The company als	9142831939584.0	88.0	74.76	6.22878665548352	16.78079563417647		2649807200000.0	2202642800000.0	226221340000.0	2202642800000.0	3630604100000.0	62.35864845046877	88.68605011579433	6.955768636532889	16.220456815804322	16.78079563417647	0.9666083283184178	6.459793138013463	헐값	안심(>=2)	42.06159126835294	3144.5245632220663	146.62937750761301	양호	충분
INFY.NS	INFY.NS	India Nifty 50	1180.300048828125	-9.790581870655668	-26.120426460620294		-30.1514963473541	1194.1149963378907	1428.2515020751953	N	N	주의	INFOSYS LIMITED	NSI	INR	Technology	Information Technology Services	Information Technology Services	Infosys Limited provides consulting, technology, outsourcing, and digital services worldwide. The company offers insight services, such as applied and generative AI, sustainability services, and Infosys Topaz, an AI-first set of services, solutions, and platforms; blockchain, Internet of Things, and engineering services; cybersecurity and quality engineering services; and enterprise agile DevOps, API economy and microservices, application modernization, and digital process automation. It also pr	4778568450048.0	4.21	76.01	4.9081697276757374	3.582523363792678		5163000000.0	0.0	333000000.0	967000000.0	9786000000.0	1.2752540708840512	0.9220459900465162	0.07811962652733774	15.511443162179198	3.582523363792678	4.329753524833356	0.5023725569773424	매우 불리	불리(<1)	15.665046727585356	1190.700201763763	0.881144836515424	보류	충분
BHARTIARTL.NS	BHARTIARTL.NS	India Nifty 50	1799.0	-3.8379328070416108	-14.488071192787888		-16.816939907674268	1843.0974975585937	1954.9305029296875	N	N	주의	BHARTI AIRTEL LIMITED	NSI	INR	Communication Services	Telecom Services	Telecom Services	Bharti Airtel Limited operates as a telecommunications company in India and internationally. It operates through the Mobile Services India, Mobile Services Africa, Mobile Services South Asia, Airtel Business, Passive Tower Infrastructure Services, Homes Services, Digital TV Services, and Others segments. The company provides voice and data telecom services through wireless technology including 2G/3G/4G/5G services; passive infrastructure service, including the setup, operation, and maintenance o	10958557675520.0	88.0	44.43	-20.44605898778463	47.33977446458364		1232854000000.0	1000849000000.0	215865000000.0	1954117000000.0	1490566000000.0	38.092693332988986	124.50262814200362	6.920657484269239	39.63329522095456	47.33977446458364	0.8372092108424695	3.41479994812614	헐값	안심(>=2)	60.0	2665.8	48.18232351306282	양호	충분
SBIN.NS	SBIN.NS	India Nifty 50	1002.7000122070312	-12.274714592560699	5.758890204311018		-18.333607075186286	1019.0325012207031	989.5122485351562	N	Y	상승전환/양호	STATE BANK OF INDIA	NSI	INR	Financial Services	Banks - Regional	Banks - Regional	State Bank of India provides banking products and services in India and internationally. The company operates through the Treasury, Corporate/Wholesale Banking, Retail Banking, and Other Banking Business segments. It offers personal banking products and services, including current, savings, salary, and deposit accounts; home, personal, pension, auto, education, and gold loans, as well as loans against insurance property, and securities; debit, business debit, prepaid, and green remit cards; over	9255540228096.0	1.77	91.12	7.397300658448813	14.39206891326348		6671134748000.0	0.0	0.0	7268922204000.0	5961308694000.0	722.7181373127248	32.21283031494877	3.2126089481185387	3.072672024739974	14.39206891326348	0.213497589766837	5.259939486913251	매우 유망	안심(>=2)	37.28413782652696	3397.3306387531366	238.81825046309834	매우 유망	충분
ITC.NS	ITC.NS	India Nifty 50	280.0	-9.589929298154853	-30.529708849954062		-34.42622950819673	301.09750137329104	354.85525009155276	N	N	주의	ITC LTD	NSI	INR	Consumer Defensive	Tobacco	Tobacco	ITC Limited engages in the fast-moving consumer goods, paperboards, paper and packaging, and agri businesses in India and internationally. The company offers cigarettes and cigars; foods, including staples, spices, biscuits, confectionery and gums, snacks, noodles and pasta, beverages, dairy products, ready-to-eat meals, chocolates, coffee, and frozen foods; personal care products; education and stationery, such as balls, gels and roller pens, mechanical pencils, geometry boxes, erasers, sharpen	3508251131904.0	5.73	16.52	-40.45618236934057	2.5366068168754863		515980800000.0	600000000.0	21262200000.0	23990600000.0	725073000000.0	41.13349349694361	12.994502001064214	4.640893571808648	14.45923162851431	2.5366068168754863	5.700225802564366	0.5717182647917014	매우 불리	불리(<1)	13.573213633750973	224.22948922956607	-19.91803956086926	보류	충분
LT.NS	LT.NS	India Nifty 50	3900.60009765625	-1.2456314386464218	-2.0835424732726815		-11.713179614797042	3998.257501220703	3903.1380029296874	N	N	주의	LARSEN & TOUBRO LTD.	NSI	INR	Industrials	Engineering & Construction	Engineering & Construction	Larsen & Toubro Limited engages in engineering, procurement, and construction projects (EPC) in India and internationally. The company operates through four segments: Infrastructure Projects, Energy Projects, Hi-Tech Manufacturing, and Others. The Infrastructure Projects segment is involved in the engineering and construction of building and factories, transportation infrastructure, heavy civil infrastructure, power transmission & distribution, renewables, water and effluent treatment, and miner	5365931442176.0	98.0	117.04	6.96197607119986	15.382271021915606		1378585600000.0	637385900000.0	579444300000.0	1254970400000.0	1092898000000.0	538.7925050713411	86.73443386661012	2.223617692024521	28.723578200486234	15.382271021915606	1.8673171314926675	3.947358864223827	보통	안심(>=2)	39.26454204383121	4595.522000810005	17.815769003628755	보류	충분
HINDUNILVR.NS	HINDUNILVR.NS	India Nifty 50	2132.800048828125	-4.173963444391338	-13.378275886447533		-20.79031525384695	2229.872491455078	2364.287999267578	N	N	주의	HINDUSTAN UNILEVER LTD.	NSI	INR	Consumer Defensive	Household & Personal Products	Household & Personal Products	Hindustan Unilever Limited, a fast-moving consumer goods company, manufactures and sells food, home care, and personal care products in India and internationally. It operates through Home Care, Beauty & Wellbeing, Personal Care, Foods, and Others segments. The company offers detergent bars, detergent powders, detergent liquids, and scourers; skin care and hair care products; skin cleansing, oral care, bodywash, and deodorants; and culinary products, such as tomato based products, fruit based pro	5011208667136.0	2.09	45.16	41.233918677810124	14.118426432640984		142350000000.0	0.0	0.0	14780000000.0	487380000000.0	60.58500569959985	41.01990059239503	1.9232886184025348	45.886072699923055	14.118426432640984	3.2500840599230743	0.35323193899459965	매우 불리	불리(<1)	36.73685286528197	1659.0362753961335	-22.21322967862378	보류	충분
BAJFINANCE.NS	BAJFINANCE.NS	India Nifty 50	886.9000244140625	-6.66175404964916	-13.817894718237723		-18.941643776043072	919.7225021362304	963.7187493896485	N	N	주의	BAJAJ FINANCE LIMITED	NSI	INR	Financial Services	Credit Services	Credit Services	Bajaj Finance Limited operates as a deposit-taking non-banking financial company in India. The company offers financing for various products, such as consumer electronics, furniture, digital products, e-commerce purchases, retail spends, and two and three-wheelers; and personal, unsecured, home, and secured, gold, and car loans. It also provides secured and unsecured loans to micro, small, and medium enterprises, SMEs, and professionals; loans against property, mutual funds, insurance policies, 	5514634723328.0	62.0	30.49	14.302174203110752	18.22815698685951		157553200000.0	0.0	0.0	3665797400000.0	1139990200000.0	25.338747747008906	-107.35321256476016	-12.104319495952648	28.25717535805358	18.22815698685951	1.5501937677201203	2.839213614604748	보통	안심(>=2)	44.95631397371902	1370.7180130586928	54.55158138757168	보류	충분
KOTAKBANK.NS	KOTAKBANK.NS	India Nifty 50	381.70001220703125	-4.527257663477058	-10.625638239209712		-14.390161766578103	380.8237503051758	405.78195083618164	Y	N	주의	KOTAK MAHINDRA BANK LTD	NSI	INR	Financial Services	Banks - Regional	Banks - Regional	Kotak Mahindra Bank Limited provides a range of banking and financial services to corporate and individual customers in India. It operates through Treasury, BMU, and Corporate Centre; Retail Banking; Corporate/Wholesale Banking; Vehicle Financing; Other Lending Activities; Broking; Advisory and Transactional Services; Asset Management; and Insurance segments. The company offers savings, current, retail institution, corporate, and salary accounts; NRE and NRO fixed deposits and foreign currency n	3796566016000.0	13.0	19.38	-12.826996667719726	8.923946239014779		1020911100000.0	0.0	0.0	953935300000.0	1812258700000.0	102.64059694896929	40.88745117429887	10.711933420668013	14.399350632510938	8.923946239014779	1.6135631307994809	1.5225649266095906	보통	양호(>=1.5)	26.347892478029557	510.6221562242128	33.77577676032537	보류	충분
AXISBANK.NS	AXISBANK.NS	India Nifty 50	1292.4000244140625	-1.7783875623733958	0.9687519073486417		-7.883105886381858	1291.8424987792969	1248.3105010986328	Y	Y	상승전환/양호	AXIS BANK LIMITED	NSI	INR	Financial Services	Banks - Regional	Banks - Regional	Axis Bank Limited provides various financial products and services in India and internationally. The company operates through four segments: Treasury, Retail Banking, Corporate/Wholesale Banking, and Other Banking Business. It provides fixed, recurring, and safe deposits; and saving, salary, current, safe custody, pension disbursement, and demat and trading accounts. The company also offers home, personal, business, car, two-wheeler, commercial vehicle construction equipment, education, gold, tr	4019436650496.0	8.0	84.46	-5.953496528796354	34.605620932767664		1093515700000.0	0.0	0.0	2805108200000.0	2150353500000.0	351.6064058326919	-34.87625022859313	-2.6985646525660685	11.138925154882436	34.605620932767664	0.32188196179237216	3.824931071925973	매우 유망	안심(>=2)	60.0	5067.599999999999	292.1076991852817	보류	충분
ASIANPAINT.NS	ASIANPAINT.NS	India Nifty 50	2708.10009765625	18.80237322466549	-8.423503910072505		-8.772103835059797	2568.2275146484376	2548.1365002441407	Y	Y	상승전환/양호	ASIAN PAINTS LIMITED	NSI	INR	Basic Materials	Specialty Chemicals	Specialty Chemicals	Asian Paints Limited, together with its subsidiaries, engages in the manufacture, distribution, and sale of paints, coatings, and products related to home decoration and bath fittings in India, Asia, the Middle East, Africa, and the South Pacific region. The company offers wall coverings; waterproofing products; adhesives; and bath fittings and sanitaryware, modular kitchens and wardrobes, fabric, furnishings and rugs, decorative lightings, unplasticized polyvinyl chloride windows and door syste	2596104568832.0	1.03	45.21	17.945970119136234	1.7462094983582643		176915300000.0	12471700000.0	10460900000.0	39289300000.0	213715900000.0	171.53766090059506	58.42479874143516	2.157409129448333	56.10622509966058	1.7462094983582643	32.13029430455511	0.049481309666207784	매우 불리	불리(<1)	11.992418996716529	542.1772628415542	-79.97942309035082	보류	충분
MARUTI.NS	MARUTI.NS	India Nifty 50	13120.0	-7.338088848082491	-17.969238464424166		-24.126763821420305	13229.325	14894.91	N	N	주의	MARUTI SUZUKI INDIA LTD.	NSI	INR	Consumer Cyclical	Auto Manufacturers	Auto Manufacturers	Maruti Suzuki India Limited manufactures, purchases, and sells motor vehicles, components, and spare parts in India. The company offers passenger vehicles, utility vehicles, and multi-purpose vehicles. It is also involved in the facilitation of pre-owned car sales, fleet management, and car financing activities. In addition, the company offers driving school, insurance, accessories, and financing products and services. It also exports its products to South Africa, Saudi Arabia, Chile, Japan, Mex	4124961669120.0	1.08	467.41	1.2365346684873213	21.109694032148575		346247000000.0	0.0	0.0	1025000000.0	1071563000000.0	1101.2855130123712	276.7884463948441	2.1096680365460676	25.713430365177526	21.109694032148575	1.2180863600399792	0.8629612508721909	보통	불리(<1)	50.71938806429715	23706.749175133133	80.69168578607571	보류	충분
SUNPHARMA.NS	SUNPHARMA.NS	India Nifty 50	1779.0	-1.1337125784860014	-2.161362138963452		-6.65337630283378	1794.632504272461	1722.9175	N	Y	상승전환/양호	SUN PHARMACEUTICAL IND L	NSI	INR	Healthcare	Drug Manufacturers - Specialty & Generic	Drug Manufacturers - Specialty & Generic	Sun Pharmaceutical Industries Limited, a generic pharmaceutical company, develops, manufactures, and markets branded and generic formulations, and active pharmaceutical ingredients (APIs) in India, the United States, and internationally. The company offers formulations in various therapeutic areas, including neuropsychiatry, cardiology, diabetes, gastroenterology, pain/analgesics, gynecology, ophthalmology, urology, dermatology, respiratory, anti-infectives, oncology, psychiatry, neurology, orth	4268416827392.0	92.0	47.76	5.035940942662842	10.649894433841345		581099300000.0	312600000.0	40503500000.0	46273200000.0	835700900000.0	242.06153257542027	36.717715992777784	2.063952557210668	32.18045367304397	10.649894433841345	3.0216687942733627	3.189821233621273	매우 불리	안심(>=2)	29.79978886768269	1423.2379163205253	-19.997868672258278	보류	충분
TITAN.NS	TITAN.NS	India Nifty 50	4104.89990234375	-3.29124516087248	8.012314699098155		-9.30201747904288	4264.942529296875	3975.670513916016	N	Y	상승전환/양호	TITAN COMPANY LIMITED	NSI	INR	Consumer Cyclical	Luxury Goods	Luxury Goods	Titan Company Limited, together with its subsidiaries, manufactures and sells watches, jewelry, eyewear, and other accessories and products in India and internationally. It operates through four segments: Watches and Wearables, Jewellery, Eyecare, and Others. The company designs, manufactures, and retails watches and wearables under the Nebula, Titan, Titan Clocks, Zoop, Titan Octane, Raga, Xylys, Edge, Fastrack, Sonata, Titan Smart, Fastrack smart, SF, Titan World, and Helios brands; jewellery 	3641232064512.0	26.0	57.02	52.02277494755769	16.0006707482786		88030000000.0	930000000.0	273550000000.0	306210000000.0	157030000000.0	98.19115655947476	52.84961446048424	1.2874763262877376	70.26848028383506	16.0006707482786	4.391595914277203	0.5977170785340103	매우 불리	불리(<1)	40.5013414965572	2309.3864921336917	-43.74073553376746	보류	충분
ULTRACEMCO.NS	ULTRACEMCO.NS	India Nifty 50	10911.0	-8.97639109034788	-6.004479669193663		-16.40361630401471	11634.75	11970.395	N	N	주의	ULTRATECH CEMENT LIMITED	NSI	INR	Basic Materials	Building Materials	Building Materials	UltraTech Cement Limited, together with its subsidiaries, engages in the manufacture and sale of clinker, cement, ready mix concrete, and related products in India, the United Arab Emirates, Bahrain, and Sri Lanka. The company offers ordinary Portland, Portland pozzolana, composite, Weather Plus, and Portland slag; white cement, wall care putty, and value-added products; ready-mix concrete; dry mix mortars, such as tile and marble binders, plasters and mortars, industrial and precision grouts, r	3209684844544.0	72.0	277.43	35.21263894845432	17.26452648493617		129572000000.0	150188200000.0	77618400000.0	237550900000.0	766235400000.0	-70.08269225339998	191.66118216110237	1.7565867671258582	39.58145367210972	17.26452648493617	2.292646352429402	2.25521091833559	매우 불리	안심(>=2)	43.02905296987234	11937.550165431683	9.408396713698863	보류	충분
WIPRO.NS	WIPRO.NS	India Nifty 50	181.6699981689453	-7.026610110751951	-29.29202376221065		-33.37367909101114	199.6394992828369	229.83185020446777	N	N	주의	WIPRO LTD	NSI	INR	Technology	Information Technology Services	Information Technology Services	Wipro Limited operates as an information technology (IT), consulting, and business process services company worldwide. It operates through IT Services and IT Products segments. The IT Services segment offers AI-powered IT and IT-enabled services, including digital strategy advisory, customer-centric design, technology and IT consulting, custom application design, development, re-engineering and maintenance, systems integration, package implementation, cloud and infrastructure, business process, 	1905784520704.0	9.35	12.56	0.47200694306988034	5.155220759982337		981695000000.0	1962000000.0	165912000000.0	202910000000.0	885368000000.0	93.39360534029133	12.746267759549157	7.016165513303784	7.028375225211304	5.155220759982337	1.3633509702958646	2.063808532582471	보통	안심(>=2)	18.810441519964677	236.25914549075634	30.04852087412113	보류	충분
ONGC.NS	ONGC.NS	India Nifty 50	259.0	-7.1518233855550895	6.923174077633187		-14.067682400500193	284.4937469482422	258.32299995422363	N	Y	상승전환/양호	OIL AND NATURAL GAS CORP.	NSI	INR	Energy	Oil & Gas Integrated	Oil & Gas Integrated	Oil and Natural Gas Corporation Limited, together with its subsidiaries, engages in the exploration, development, production, and distribution of crude oil, natural gas, and value-added products in India and internationally. It operates through Exploration and Production, Refining & Marketing, and Petrochemicals segments. The company engages in the refining and marketing of petroleum products; liquefied natural gas supply; pipelines for transportation of petroleum products; SEZ development; heli	3258292371456.0	6.99	32.92	14.351058725840993	4.110173577502096		887528900000.0	938229200000.0	482321800000.0	1743164900000.0	3717678000000.0	-4.030141077935627	46.68327231719152	18.024429466097114	7.9899799841414225	4.110173577502096	1.9439519605391524	1.3892617502839573	보통	보통(1~1.5)	16.72034715500419	550.433828342738	112.52271364584479	보류	충분
NTPC.NS	NTPC.NS	India Nifty 50	355.6499938964844	-6.5554418830580214	10.125400357158188		-13.298395096832671	390.764998626709	354.7247503662109	N	Y	상승전환/양호	NTPC LTD	NSI	INR	Utilities	Utilities - Regulated Electric	Utilities - Regulated Electric	NTPC Limited operates as an integrated power company in India. It operates through two segments: Generation and Others. The company generates power from fossil fuels, hydro, solar, wind, nuclear, and renewable energy sources. It also engages in the coal mining and energy trading business. NTPC Limited was incorporated in 1975 and is based in New Delhi, India.	3448619401216.0	3.13	30.44	15.49820129909496	16.949816418059882		523473900000.0	2076637000000.0	595945000000.0	2710045800000.0	2031756700000.0	-160.17495895357803	7.066377149950866	1.9868908396516405	16.94562920006775	16.949816418059882	0.9997529638145419	1.1849554938909912	헐값	보통(1~1.5)	42.399632836119764	1290.6448235314856	262.89746820778555	보류	충분
POWERGRID.NS	POWERGRID.NS	India Nifty 50	285.70001220703125	-4.496066175454194	6.168712644744434		-10.969143770319889	305.24624862670896	286.1075001525879	N	N	중립	POWER GRID CORP. LTD.	NSI	INR	Utilities	Utilities - Regulated Electric	Utilities - Regulated Electric	Power Grid Corporation of India Limited, an electric power transmission utility, engages in the power transmission business in India and internationally. It operates in three segments: Transmission Services, Telecom Services, and Consultancy Services. As of 31 March 2025, the company owned and operated 180,195 circuit kilometers of transmission lines, and 282 substations with an aggregate transformation capacity of 551,961 mega volt amperes. It also provides telecom services that offer overhead 	2657182547968.0	4.22	20.12	2.6190224618334312	1.0867601620135003		269860400000.0	1210718000000.0	269372100000.0	1480706000000.0	1004940300000.0	-101.16091581902914	3.92605692174576	1.3741885733280124	19.227680319386696	1.0867601620135003	17.692662090007527	0.27599585981585373	매우 불리	불리(<1)	10.673520324027	214.75122891942326	-24.8333147554069	보류	충분
