티커	종목코드	유니버스	현재가	3M수익률(보조,%)	6M수익률(보조,%)	12M수익률(보조,%)	52주고점대비(보조,%)	40일이평(보조)	200일이평(보조)	40일선상회(보조)	200일선상회(보조)	추세판정(보조)	종목명	시장	통화	섹터	산업	업종	사업설명	시가총액	배당수익률(%)	EPS(FY)	EPS Growth 1Y(%)	EPS Growth 3Y CAGR(%)	EPS Growth 5Y CAGR(%)	현금및단기투자	장기부채	단기위험부채	총부채	주주지분	주당순현금(린치식)	주당잉여현금흐름	잉여현금흐름수익률(%)	순현금차감PER(린치식)	사용연성장률(%)	린치PER배수	배당감안점수	린치PER판정	배당감안점수판정	그레이엄적정PER(3년)	그레이엄내재가치(3년)	그레이엄괴리율(3년,%)	종합판정	데이터상태
RELIANCE.NS	RELIANCE.NS	India Nifty 50	1304.0	-0.05364844010657954	-16.9638321620289		-18.105887080786275	1321.729995727539	1418.8375036621094	N	N	주의	RELIANCE INDUSTRIES LTD	NSI	INR	Energy	Oil & Gas Refining & Marketing	Oil & Gas Refining & Marketing	Reliance Industries Limited engages in hydrocarbon exploration and production, petroleum refining and marketing, petrochemicals, advanced materials and composites, renewable, financial services, retail, and digital services worldwide. It operates through the Oil to Chemicals, Oil and Gas, Retail, Digital Services, and Others segments. The company is involved in refining and marketing products, including liquefied petroleum gas, propylene, naphtha, gasoline, jet/aviation turbine fuel, kerosine oi	17646342897664.0	46.0	59.7	15.976050999310809	6.58907750634663		4170970000000.0	2707510000000.0	1036700000000.0	3980000000000.0	9040300000000.0	108.1443162370115	51.134040224211695	3.9213221030837184	20.03108348011706	6.58907750634663	3.040043687575845	2.6253735879313154	매우 불리	안심(>=2)	21.67815501269326	1294.1858542577877	-0.7526185385132167	보류	충분
TCS.NS	TCS.NS	India Nifty 50	2093.5	-15.376527642988414	-34.704633775731295		-38.782970638374394	2208.0199798583985	2763.596987915039	N	N	주의	TATA CONSULTANCY SERV LT	NSI	INR	Technology	Information Technology Services	Information Technology Services	Tata Consultancy Services Limited provides information technology (IT) and IT enabled services. It offers TCS ADD, a suite of AI powered life sciences platforms; TCS BaNCS, a financial services platform; TCS BFSI Platforms, a cloud-native, subscription-based as-a-service digital ecosystem for insurers and financial firms; TCS Chroma, a cloud-based AI-led hire-to-retire modular platform; TCS Customer Intelligence & Insights, an AI-powered, real-time customer data analytics solution; TCS ERP on Cl	7574465806336.0	6.0	136.08	1.3531604638230332	5.300128040832486		763410000000.0	0.0	18300000000.0	112830000000.0	1072400000000.0	210.99821278563113	132.52305192027143	6.330215042764338	13.83378738399742	5.300128040832486	2.6100855068823132	0.8168499144279312	매우 불리	불리(<1)	19.100256081664973	2599.1628475929697	24.153945430760437	보류	충분
HDFCBANK.NS	HDFCBANK.NS	India Nifty 50	801.0499877929688	3.8975340846911566	-19.183819821659366		-20.915197108781168	769.9150039672852	890.3492501831055	Y	N	상승전환/양호	HDFC BANK LTD	NSI	INR	Financial Services	Banks - Regional	Banks - Regional	HDFC Bank Limited provides banking and financial products and services to individuals and businesses in India, Bahrain, Hong Kong, Singapore, and Dubai. The company operates through Treasury, Retail Banking, Wholesale Banking, Other Banking Business, Insurance Business, and Other segments. It offers savings, salary, current, rural, public provident fund, pension, and demat accounts; fixed and recurring deposits; and safe deposit lockers, as well as offshore accounts and deposits, and overdrafts 	12337146757120.0	1.63	44.81	8.166893276325982	20.388517319859577		9196249400000.0	5866163200000.0	1306013100000.0	7326106100000.0	7676891400000.0	216.22223538138184	73.32017239060885	9.153008365010853	13.05127767042149	20.388517319859577	0.6401288267150649	1.687077531861943	헐값	양호(>=1.5)	49.277034639719155	2208.1039222058153	175.6512022788395	양호	충분
ICICIBANK.NS	ICICIBANK.NS	India Nifty 50	1411.4000244140625	14.617508237069377	5.100900942338438		-5.186077686282897	1300.5250061035156	1344.2050036621094	Y	Y	상승전환/양호	ICICI BANK LTD.	NSI	INR	Financial Services	Banks - Regional	Banks - Regional	ICICI Bank Limited, together with its subsidiaries, engages in the provision of various banking and financial services to retail and corporate customers in India and internationally. The company operates through Retail Banking, Wholesale Banking, Treasury, Other Banking, Life Insurance, General Insurance, and Others segments. It offers savings, salary, pension, current, trade, escrow, foreign currency, and vostro accounts, as well as time, fixed, recurring, and security deposits. The company als	10123465457664.0	86.0	74.76	6.22878665548352	16.78079563417647		2649807200000.0	2202642800000.0	226221340000.0	2202642800000.0	3630604100000.0	62.34306491895182	88.66388732215728	6.281981421883974	18.04517067275429	16.78079563417647	1.0753465488848895	5.695750818769548	보통	안심(>=2)	42.06159126835294	3144.5245632220663	122.79470800827737	보류	충분
INFY.NS	INFY.NS	India Nifty 50	1047.199951171875	-19.82851092343363	-35.17395472668047		-38.02817369439021	1128.9574996948243	1390.722502746582	N	N	주의	INFOSYS LIMITED	NSI	INR	Technology	Information Technology Services	Information Technology Services	Infosys Limited provides consulting, technology, outsourcing, and digital services worldwide. The company offers insight services, such as applied and generative AI, sustainability services, and Infosys Topaz, an AI-first set of services, solutions, and platforms; blockchain, Internet of Things, and engineering services; cybersecurity and quality engineering services; and enterprise agile DevOps, API economy and microservices, application modernization, and digital process automation. It also pr	4240037117952.0	4.8	75.47	4.9081697276757374	3.582523363792678		5163000000.0	0.0	333000000.0	967000000.0	9786000000.0	1.275152362128282	0.9219724516414638	0.08804168206938182	13.858815407575815	3.582523363792678	3.8684508097398775	0.6048513611928503	매우 불리	불리(<1)	15.665046727585356	1182.2410765308668	12.895448019060085	보류	충분
BHARTIARTL.NS	BHARTIARTL.NS	India Nifty 50	1910.4000244140625	6.559570079374288	-9.270519765812379		-11.665969965972478	1850.5874969482422	1951.1295025634765	Y	N	상승전환/양호	BHARTI AIRTEL LIMITED	NSI	INR	Communication Services	Telecom Services	Telecom Services	Bharti Airtel Limited operates as a telecommunications company in India and internationally. It operates through the Mobile Services India, Mobile Services Africa, Mobile Services South Asia, Airtel Business, Passive Tower Infrastructure Services, Homes Services, Digital TV Services, and Others segments. The company provides voice and data telecom services through wireless technology including 2G/3G/4G/5G services; passive infrastructure service, including the setup, operation, and maintenance o	11918332919808.0	85.0	44.44	-20.44605898778463	47.33977446458364		1232854000000.0	1000849000000.0	215865000000.0	1954117000000.0	1490566000000.0	37.19490757423862	121.56829410855048	6.363499400908802	42.15133026192223	47.33977446458364	0.8903998960421106	3.1396345890448423	헐값	안심(>=2)	60.0	2666.3999999999996	39.57286253792891	양호	충분
SBIN.NS	SBIN.NS	India Nifty 50	1040.0	0.7020091987412158	5.884747207759711		-15.295654126042013	995.3849990844726	1009.025747680664	Y	Y	상승전환/양호	STATE BANK OF INDIA	NSI	INR	Financial Services	Banks - Regional	Banks - Regional	State Bank of India provides banking products and services in India and internationally. The company operates through the Treasury, Corporate/Wholesale Banking, Retail Banking, and Other Banking Business segments. It offers personal banking products and services, including current, savings, salary, and deposit accounts; home, personal, pension, auto, education, and gold loans, as well as loans against insurance property, and securities; debit, business debit, prepaid, and green remit cards; over	9599842254848.0	1.65	91.17	7.397300658448813	14.39206891326348		6671134748000.0	0.0	0.0	7268922204000.0	5961308694000.0	722.7181373127248	32.21283031494877	3.097387530283535	3.4801125664941885	14.39206891326348	0.24180766417029714	4.609640810964919	매우 유망	안심(>=2)	37.28413782652696	3399.194845644463	226.8456582350445	매우 유망	충분
ITC.NS	ITC.NS	India Nifty 50	289.95001220703125	-1.6618598592682665	-28.05210615210143		-31.712197824052147	292.666251373291	344.1807504272461	N	N	주의	ITC LTD	NSI	INR	Consumer Defensive	Tobacco	Tobacco	ITC Limited engages in the fast-moving consumer goods, paperboards, paper and packaging, and agri businesses in India and internationally. The company offers cigarettes and cigars; foods, including staples, spices, biscuits, confectionery and gums, snacks, noodles and pasta, beverages, dairy products, ready-to-eat meals, chocolates, coffee, and frozen foods; personal care products; education and stationery, such as balls, gels and roller pens, mechanical pencils, geometry boxes, erasers, sharpen	3632919478272.0	5.52	16.52	-40.45618236934057	2.5366068168754863		463380800000.0	600000000.0	21265200000.0	23993600000.0	725073000000.0	36.935390350805385	12.994502001064214	4.481635266076771	15.315655076042727	2.5366068168754863	6.03785142188811	0.5260373635260243	매우 불리	불리(<1)	13.573213633750973	224.22948922956607	-22.666156306466767	보류	충분
LT.NS	LT.NS	India Nifty 50	4026.60009765625	8.018353150725277	-1.3934101222909279		-8.861275012933412	4032.9999938964843	3952.692498779297	N	Y	상승전환/양호	LARSEN & TOUBRO LTD.	NSI	INR	Industrials	Engineering & Construction	Engineering & Construction	Larsen & Toubro Limited engages in engineering, procurement, and construction projects (EPC) in India and internationally. The company operates through four segments: Infrastructure Projects, Energy Projects, Hi-Tech Manufacturing, and Others. The Infrastructure Projects segment is involved in the engineering and construction of building and factories, transportation infrastructure, heavy civil infrastructure, power transmission & distribution, renewables, water and effluent treatment, and miner	5539511140352.0	94.0	116.91	6.96197607119986	15.382271021915606		1378585600000.0	637385900000.0	579444300000.0	1254970400000.0	1092898000000.0	538.7686122042837	86.73058760988204	2.1539409304729573	29.833474343101244	15.382271021915606	1.93947137588439	3.666427509044363	보통	안심(>=2)	39.26454204383121	4590.417610344307	14.002322033822946	보류	충분
HINDUNILVR.NS	HINDUNILVR.NS	India Nifty 50	2201.199951171875	5.5832645633896005	-4.952716266182133		-18.250023347771172	2181.607501220703	2322.1145007324217	Y	N	상승전환/양호	HINDUSTAN UNILEVER LTD.	NSI	INR	Consumer Defensive	Household & Personal Products	Household & Personal Products	Hindustan Unilever Limited, a fast-moving consumer goods company, manufactures and sells food, home care, and personal care products in India and internationally. It operates through Home Care, Beauty & Wellbeing, Personal Care, Foods, and Others segments. The company offers detergent bars, detergent powders, detergent liquids, and scourers; skin care and hair care products; skin cleansing, oral care, bodywash, and deodorants; and culinary products, such as tomato based products, fruit based pro	5171920240640.0	1.99	45.32	41.233918677810124	14.118426432640984		142350000000.0	0.0	0.0	14780000000.0	487380000000.0	60.58500569959985	41.01990059239503	1.8635245094638881	47.233339485266434	14.118426432640984	3.3455101891571775	0.3410393295961152	매우 불리	불리(<1)	36.73685286528197	1664.9141718545789	-24.363337780004414	보류	충분
BAJFINANCE.NS	BAJFINANCE.NS	India Nifty 50	1031.4000244140625	21.219962861700647	4.5196632724777475		-5.735045341117983	933.7787551879883	968.1872506713867	Y	Y	상승전환/양호	BAJAJ FINANCE LIMITED	NSI	INR	Financial Services	Credit Services	Credit Services	Bajaj Finance Limited operates as a deposit-taking non-banking financial company in India. The company offers financing for various products, such as consumer electronics, furniture, digital products, e-commerce purchases, retail spends, and two and three-wheelers; and personal, unsecured, home, and secured, gold, and car loans. It also provides secured and unsecured loans to micro, small, and medium enterprises, SMEs, and professionals; loans against property, mutual funds, insurance policies, 	6413118078976.0	53.0	30.55	14.302174203110752	18.22815698685951		157553200000.0	0.0	0.0	3665797400000.0	1139990200000.0	25.338747747008906	-107.35321256476016	-10.4084942819104	32.93162935080372	18.22815698685951	1.8066351619938203	2.1629101988274733	보통	안심(>=2)	44.95631397371902	1373.415391897116	33.160302442047374	보류	충분
KOTAKBANK.NS	KOTAKBANK.NS	India Nifty 50	396.75	10.040220061751226	-9.874608400382412		-11.014665357968612	391.0562515258789	406.3665008544922	Y	N	상승전환/양호	KOTAK MAHINDRA BANK LTD	NSI	INR	Financial Services	Banks - Regional	Banks - Regional	Kotak Mahindra Bank Limited provides a range of banking and financial services to corporate and individual customers in India. It operates through Treasury, BMU, and Corporate Centre; Retail Banking; Corporate/Wholesale Banking; Vehicle Financing; Other Lending Activities; Broking; Advisory and Transactional Services; Asset Management; and Insurance segments. The company offers savings, current, retail institution, corporate, and salary accounts; NRE and NRO fixed deposits and foreign currency n	3946260201472.0	13.0	19.41	-12.826996667719726	8.923946239014779		1020911100000.0	0.0	0.0	953935300000.0	1812258700000.0	102.64059694896929	40.88745117429887	10.305595759117548	15.15246795729164	8.923946239014779	1.6979559884668805	1.446889463868794	보통	보통(1~1.5)	26.347892478029557	511.4125929985537	28.900464523895074	보류	충분
AXISBANK.NS	AXISBANK.NS	India Nifty 50	1342.0999755859375	7.773221148501919	5.727111215822789		-4.340700243340168	1308.8425018310547	1274.5520013427733	Y	Y	상승전환/양호	AXIS BANK LIMITED	NSI	INR	Financial Services	Banks - Regional	Banks - Regional	Axis Bank Limited provides various financial products and services in India and internationally. The company operates through four segments: Treasury, Retail Banking, Corporate/Wholesale Banking, and Other Banking Business. It provides fixed, recurring, and safe deposits; and saving, salary, current, safe custody, pension disbursement, and demat and trading accounts. The company also offers home, personal, car, two-wheeler, business, commercial vehicle construction equipment, education, gold loa	4174975336448.0	7.000000000000001	84.48	-5.953496528796354	34.605620932767664		1180410900000.0	0.0	0.0	2805106200000.0	2150353500000.0	379.4584027050037	-34.86815693759174	-2.598029772138913	11.394904982018629	34.605620932767664	0.32927902100519524	3.651247728561327	매우 유망	안심(>=2)	60.0	5068.8	277.67678207333626	보류	충분
ASIANPAINT.NS	ASIANPAINT.NS	India Nifty 50	2737.800048828125	25.339925267911447	-1.1446091775365597		-7.771600174225202	2665.2824951171874	2562.748498535156	Y	Y	상승전환/양호	ASIAN PAINTS LIMITED	NSI	INR	Basic Materials	Specialty Chemicals	Specialty Chemicals	Asian Paints Limited, together with its subsidiaries, engages in the manufacture, distribution, and sale of paints, coatings, and products related to home decoration and bath fittings, kitchen, and wardrobe in India, Asia, the Middle East, Africa, and the South Pacific region. The company offers wall coverings, waterproofing products, adhesives; and bath fittings and sanitaryware, modular kitchens and wardrobes, fabric, furnishings, rugs, decorative lightings, unplasticized polyvinyl chloride wi	2624576290816.0	1.0	45.01	17.945970119136234	1.7462094983582643		165304500000.0	12471700000.0	10460900000.0	39289300000.0	213715900000.0	159.42597353067228	58.42479874143516	2.1340053217707786	57.28447179065658	1.7462094983582643	32.805039626982776	0.04793985896202654	매우 불리	불리(<1)	11.992418996716529	539.7787790422109	-80.28421471928692	보류	충분
MARUTI.NS	MARUTI.NS	India Nifty 50	14366.0	13.225094577553588	-13.96059172306402		-16.92111959287532	13355.125	14792.985	Y	N	상승전환/양호	MARUTI SUZUKI INDIA LTD.	NSI	INR	Consumer Cyclical	Auto Manufacturers	Auto Manufacturers	Maruti Suzuki India Limited manufactures, purchases, and sells motor vehicles, components, and spare parts in India. The company offers passenger vehicles, utility vehicles, and multi-purpose vehicles. It is also involved in the facilitation of pre-owned car sales, fleet management, and car financing activities. In addition, the company offers driving school, insurance, accessories, and financing products and services. It also exports its products to South Africa, Saudi Arabia, Chile, Japan, Mex	4516707041280.0	98.0	466.31	1.2365346684873213	21.109694032148575		346247000000.0	0.0	0.0	1025000000.0	1071563000000.0	1101.2855130123712	276.7884463948441	1.9266911206657669	28.446129156543133	21.109694032148575	1.3475386764593407	4.187202180538197	보통	안심(>=2)	50.71938806429715	23650.957848262406	64.63147604247811	보류	충분
SUNPHARMA.NS	SUNPHARMA.NS	India Nifty 50	1904.800048828125	12.40411166473121	10.763511246837854		-0.0524714017409611	1838.7950073242187	1744.5890020751954	Y	Y	상승전환/양호	SUN PHARMACEUTICAL IND L	NSI	INR	Healthcare	Drug Manufacturers - Specialty & Generic	Drug Manufacturers - Specialty & Generic	Sun Pharmaceutical Industries Limited, a generic pharmaceutical company, develops, manufactures, and markets branded and generic formulations, and active pharmaceutical ingredients (APIs) in India, the United States, and internationally. The company offers formulations in various therapeutic areas, including neuropsychiatry, cardiology, diabetes, gastroenterology, pain/analgesics, gynecology, ophthalmology, urology, dermatology, respiratory, anti-infectives, oncology, psychiatry, neurology, orth	4570253099008.0	86.0	47.71	5.035940942662842	10.649894433841345		581099300000.0	312600000.0	40503500000.0	46273200000.0	835700900000.0	242.06153257542027	36.717715992777784	1.9276414873764482	34.85094353914703	10.649894433841345	3.2724215019825817	2.7732360911628513	매우 불리	안심(>=2)	29.79978886768269	1421.7479268771413	-25.359728557764793	보류	충분
TITAN.NS	TITAN.NS	India Nifty 50	4461.10009765625	5.063469891316852	10.109838273633232		-1.4317551445170773	4211.500006103515	4037.690509033203	Y	Y	상승전환/양호	TITAN COMPANY LIMITED	NSI	INR	Consumer Cyclical	Luxury Goods	Luxury Goods	Titan Company Limited, together with its subsidiaries, manufactures and sells watches, jewelry, eyewear, and other accessories and products in India and internationally. It operates through four segments: Watches and Wearables, Jewellery, Eyecare, and Others. The company designs, manufactures, and retails watches and wearables under the Nebula, Titan, Titan Clocks, Zoop, Titan Octane, Raga, Xylys, Edge, Fastrack, Sonata, Titan Smart, Fastrack smart, SF, Titan World, and Helios brands; jewellery 	3957197635584.0	33.0	57.36	52.02277494755769	16.0006707482786		88030000000.0	930000000.0	273550000000.0	306210000000.0	157030000000.0	98.19115655947476	52.84961446048424	1.1846767233097977	76.06187135803304	16.0006707482786	4.753667677726323	0.6442212093050685	매우 불리	불리(<1)	40.5013414965572	2323.156948242521	-47.92412415352326	보류	충분
ULTRACEMCO.NS	ULTRACEMCO.NS	India Nifty 50	11723.0	7.010497489730727	-0.5176510522742706		-10.182347532945146	11377.45	11853.75	Y	N	상승전환/양호	ULTRATECH CEMENT LIMITED	NSI	INR	Basic Materials	Building Materials	Building Materials	UltraTech Cement Limited, together with its subsidiaries, engages in the manufacture and sale of clinker, cement, ready mix concrete, and related products in India, the United Arab Emirates, Bahrain, and Sri Lanka. The company offers ordinary Portland, Portland pozzolana, composite, Weather Plus, and Portland slag; white cement, wall care putty, and value-added products; ready-mix concrete; dry mix mortars, such as tile and marble binders, plasters and mortars, industrial and precision grouts, r	3448550719488.0	67.0	278.02	35.21263894845432	17.26452648493617		129572000000.0	150188200000.0	77618400000.0	237550900000.0	766235400000.0	-70.08269225339998	191.66118216110237	1.6349158249688849	42.41810910097619	17.26452648493617	2.4569517813296122	1.9865224610636156	매우 불리	양호(>=1.5)	43.02905296987234	11962.937306683907	2.0467227389227016	보류	충분
WIPRO.NS	WIPRO.NS	India Nifty 50	176.0800018310547	-10.750667634884525	-33.12063102117394		-35.423774834073896	188.44849967956543	223.32580017089845	N	N	주의	WIPRO LTD	NSI	INR	Technology	Information Technology Services	Information Technology Services	Wipro Limited operates as an information technology (IT), consulting, and business process services company worldwide. It operates through IT Services and IT Products segments. The IT Services segment offers AI-powered IT and IT-enabled services, including digital strategy advisory, customer-centric design, technology and IT consulting, custom application design, development, re-engineering and maintenance, systems integration, package implementation, cloud and infrastructure, business process, 	1741720780800.0	9.77	12.56	0.47200694306988034	5.155220759982337		981695000000.0	1962000000.0	165912000000.0	202910000000.0	885368000000.0	99.04652539074915	13.51777274989537	7.677063044822892	6.13323857008802	5.155220759982337	1.1897140502105352	2.4334975053429466	보통	안심(>=2)	18.810441519964677	236.25914549075634	34.17715983297318	보류	충분
ONGC.NS	ONGC.NS	India Nifty 50	237.83999633789062	-15.614691790874524	-1.056663821169379		-21.088254427909302	263.5647487640381	258.8959999847412	N	N	주의	OIL AND NATURAL GAS CORP.	NSI	INR	Energy	Oil & Gas Integrated	Oil & Gas Integrated	Oil and Natural Gas Corporation Limited, together with its subsidiaries, engages in the exploration, development, production, and distribution of crude oil, natural gas, and value-added products in India and internationally. It operates through Exploration and Production, Refining & Marketing, and Petrochemicals segments. The company engages in the refining and marketing of petroleum products; liquefied natural gas supply; pipelines for transportation of petroleum products; SEZ development; heli	2992093528064.0	7.84	32.94	14.351058725840993	4.110173577502096		887528900000.0	938229200000.0	482321800000.0	1743164900000.0	3717678000000.0	-4.030141077935627	46.68327231719152	19.62801590816975	7.342748555428849	4.110173577502096	1.786481377725976	1.6274796130213058	보통	양호(>=1.5)	16.72034715500419	550.768235285838	131.57090639346532	보류	충분
NTPC.NS	NTPC.NS	India Nifty 50	356.45001220703125	-2.6358901217160335	8.162653743128567		-13.103363822639757	371.492497253418	356.93000015258787	N	N	중립	NTPC LTD	NSI	INR	Utilities	Utilities - Regulated Electric	Utilities - Regulated Electric	NTPC Limited operates as an integrated power company in India. It operates through two segments: Generation and Others. The company generates power from fossil fuels, hydro, solar, wind, nuclear, and renewable energy sources. It also engages in the coal mining and energy trading business. NTPC Limited was incorporated in 1975 and is based in New Delhi, India.	3456377028608.0	3.17	30.45	15.49820129909496	16.949816418059882		523473900000.0	2076637000000.0	595945000000.0	2710045800000.0	2031756700000.0	-160.17495895357803	7.066377149950866	1.9824314512427659	16.966337312335277	16.949816418059882	1.0009746945847622	1.1858668166070168	보통	보통(1~1.5)	42.399632836119764	1291.0688198598468	262.20192892291885	보류	충분
POWERGRID.NS	POWERGRID.NS	India Nifty 50	287.8500061035156	-2.4733145668059953	8.786847869876556		-10.299155008282735	291.67249755859376	286.46775024414063	N	Y	상승전환/양호	POWER GRID CORP. LTD.	NSI	INR	Utilities	Utilities - Regulated Electric	Utilities - Regulated Electric	Power Grid Corporation of India Limited, an electric power transmission utility, engages in the power transmission business in India and internationally. It operates in three segments: Transmission Services, Telecom Services, and Consultancy Services. As of 31 March 2025, the company owned and operated 180,195 circuit kilometers of transmission lines, and 282 substations with an aggregate transformation capacity of 551,961 mega volt amperes. It also provides telecom services that offer overhead 	2677178892288.0	4.25	20.12	2.6190224618334312	1.0867601620135003		269860400000.0	1210718000000.0	269372100000.0	1480706000000.0	1004940300000.0	-101.16091581902914	3.92605692174576	1.3639245574078207	19.33453886294954	1.0867601620135003	17.79098971306362	0.2760221073718105	매우 불리	불리(<1)	10.673520324027	214.75122891942326	-25.394745747479618	보류	충분
