티커	종목코드	유니버스	현재가	3M수익률(보조,%)	6M수익률(보조,%)	12M수익률(보조,%)	52주고점대비(보조,%)	40일이평(보조)	200일이평(보조)	40일선상회(보조)	200일선상회(보조)	추세판정(보조)	종목명	시장	통화	섹터	산업	업종	사업설명	시가총액	배당수익률(%)	EPS(FY)	EPS Growth 1Y(%)	EPS Growth 3Y CAGR(%)	EPS Growth 5Y CAGR(%)	현금및단기투자	장기부채	단기위험부채	총부채	주주지분	주당순현금(린치식)	주당잉여현금흐름	잉여현금흐름수익률(%)	순현금차감PER(린치식)	사용연성장률(%)	린치PER배수	배당감안점수	린치PER판정	배당감안점수판정	그레이엄적정PER(3년)	그레이엄내재가치(3년)	그레이엄괴리율(3년,%)	종합판정	데이터상태
RELIANCE.NS	RELIANCE.NS	India Nifty 50	1349.5999755859375	-6.088650858429268	-11.11111557774077		-15.242106751224805	1371.3475036621094	1430.36150390625	N	N	주의	RELIANCE INDUSTRIES LTD	NSI	INR	Energy	Oil & Gas Refining & Marketing	Oil & Gas Refining & Marketing	Reliance Industries Limited engages in the hydrocarbon exploration and production, oil and chemicals, retail, and digital service businesses worldwide. It operates through Oil to Chemicals, Oil and Gas, Retail, Digital Services, and Others segments. The company offers refining and marketing products, including liquefied petroleum gas, propylene, naphtha, gasoline, jet/aviation turbine fuel, kerosine oil, diesel, sulphur, and petroleum coke. It also provides polymers, including high-density and l	18263423582208.0	40.0	59.69	15.976050999310809	6.58907750634663		4566910000000.0	2707510000000.0	1036700000000.0	3980000000000.0	9040300000000.0	137.40282727993878	51.134040224211695	3.788829367902998	20.308211564851714	6.58907750634663	3.0821023952580235	2.2941004606717965	매우 불리	안심(>=2)	21.67815501269326	1293.9690727076606	-4.12202903709481	보류	충분
TCS.NS	TCS.NS	India Nifty 50	2327.199951171875	-14.01759154641693	-24.982271039854766		-34.2097102578885	2435.8124816894533	2901.409990234375	N	N	주의	TATA CONSULTANCY SERV LT	NSI	INR	Technology	Information Technology Services	Information Technology Services	Tata Consultancy Services Limited provides information technology (IT) and IT enabled services. It offers TCS ADD, a suite of AI powered life sciences platforms; TCS BaNCS, a financial services platform; TCS BFSI Platforms, a cloud-native, subscription-based as-a-service digital ecosystem for insurers and financial firms; TCS Chroma, a cloud-based AI-led hire-to-retire modular platform; TCS Customer Intelligence & Insights, an AI-powered, real-time customer data analytics solution; TCS ERP on Cl	8420012851200.0	5.33	135.92	1.3531604638230332	5.300128040832486		763410000000.0	0.0	18300000000.0	112830000000.0	1072400000000.0	210.99821278563113	132.52305192027143	5.694527960673885	15.56946540896295	5.300128040832486	2.937564015249237	0.6827548513459548	매우 불리	불리(<1)	19.100256081664973	2596.1068066199027	11.55495277973937	보류	충분
HDFCBANK.NS	HDFCBANK.NS	India Nifty 50	759.1500244140625	-18.000644369869356	-23.822183160592804		-25.05183077143157	777.1500030517578	922.6147494506836	N	N	주의	HDFC BANK LTD	NSI	INR	Financial Services	Banks - Regional	Banks - Regional	HDFC Bank Limited provides banking and financial products and services to individuals and businesses in India, Bahrain, Hong Kong, Singapore, and Dubai. The company operates through Treasury, Retail Banking, Wholesale Banking, Other Banking Business, Insurance Business, and Other segments. It offers savings, salary, current, rural, public provident fund, pension, and demat accounts; fixed and recurring deposits; and safe deposit lockers, as well as offshore accounts and deposits, and overdrafts 	11688044658688.0	1.71	44.81	8.166893276325982	20.388517319859577		9196249400000.0	5866163200000.0	1306013100000.0	7326106100000.0	7676891400000.0	216.29238855811627	73.34396107729431	9.661326314769422	12.114653779423035	20.388517319859577	0.5941900330154303	1.8241146401884238	헐값	양호(>=1.5)	49.277034639719155	2208.1039222058153	190.86529028436826	양호	충분
ICICIBANK.NS	ICICIBANK.NS	India Nifty 50	1242.800048828125	-11.958056792098326	-9.876718721673317		-16.512154426246152	1278.3275054931642	1361.325003051758	N	N	주의	ICICI BANK LTD.	NSI	INR	Financial Services	Banks - Regional	Banks - Regional	ICICI Bank Limited, together with its subsidiaries, engages in the provision of various banking and financial services to retail and corporate customers in India and internationally. The company operates through Retail Banking, Wholesale Banking, Treasury, Other Banking, Life Insurance, General Insurance, and Others segments. It offers savings, salary, pension, current, trade, escrow, foreign currency, and vostro accounts, as well as time, fixed, recurring, and security deposits. The company als	8909350764544.0	89.0	74.73	6.22878665548352	16.78079563417647		2649807200000.0	2202642800000.0	226221340000.0	2202642800000.0	3630604100000.0	62.37670776393327	88.71173394985372	7.138053626044092	15.795842915351155	16.78079563417647	0.9413047664546179	6.696749024477423	헐값	안심(>=2)	42.06159126835294	3143.2627154840156	152.91781396757239	양호	충분
INFY.NS	INFY.NS	India Nifty 50	1181.199951171875	-13.503224056147333	-21.650307090725786		-30.098241387137126	1227.8574920654296	1445.4690008544922	N	N	주의	INFOSYS LIMITED	NSI	INR	Technology	Information Technology Services	Information Technology Services	Infosys Limited provides consulting, technology, outsourcing, and digital services worldwide. It provides digital marketing and digital workplace, digital commerce, digital experience and interactions, and metaverse; data analytics and AI, applied AI, generative AI, and sustainability; blockchain, engineering, and Internet of Things; enterprise agile DevOps, API economy and microservices, application modernization, cloud, digital process automation, digital supply chain, Microsoft business appli	4780325339136.0	4.19	76.99	4.9081697276757374	3.582523363792678		5163000000.0	0.0	333000000.0	967000000.0	9786000000.0	1.2757573468626915	0.9224098732981653	0.07809091698514187	15.325681177101082	3.582523363792678	4.277901250273042	0.5071567960976521	매우 불리	불리(<1)	15.665046727585356	1206.0519475567964	2.1039618533903237	보류	충분
BHARTIARTL.NS	BHARTIARTL.NS	India Nifty 50	1885.300048828125	-7.100619584723944	-10.7423495686506		-12.826555167462727	1840.8725036621095	1959.0555041503906	Y	N	주의	BHARTI AIRTEL LIMITED	NSI	INR	Communication Services	Telecom Services	Telecom Services	Bharti Airtel Limited operates as a telecommunications company in India and internationally. It operates through the Mobile Services India, Mobile Services Africa, Mobile Services South Asia, Airtel Business, Passive Tower Infrastructure Services, Homes Services, Digital TV Services, and Others segments. The company provides voice and data telecom services through wireless technology including 2G/3G/4G/5G services; passive infrastructure service, including the setup, operation, and maintenance o	11484251815936.0	84.0	44.38	-20.44605898778463	47.33977446458364		1232854000000.0	1000849000000.0	215865000000.0	1954117000000.0	1490566000000.0	38.092693332988986	124.50262814200362	6.603862776081327	41.622518149958	47.33977446458364	0.879229329263009	3.1554980405412154	헐값	안심(>=2)	60.0	2662.8	41.240117277626865	양호	충분
SBIN.NS	SBIN.NS	India Nifty 50	950.9000244140625	-21.289624730530367	-2.306462396360631		-22.552534077380926	1040.1350006103517	979.0777484130859	N	N	주의	STATE BANK OF INDIA	NSI	INR	Financial Services	Banks - Regional	Banks - Regional	State Bank of India provides banking products and services in India and internationally. It operates through the Treasury, Corporate/Wholesale Banking, Retail Banking, and Other Banking Business segments. The company offers personal banking products and services, including current, savings, salary, and deposit accounts; home, personal, pension, auto, education, and gold loans, as well as loans against insurance policies, property, and securities; debit, business debit, prepaid, and green remit c	8777394290688.0	1.82	91.19	7.3972935485642655	14.392067814644104		4018432100000.0	0.0	0.0	7773021500000.0	5961308700000.0	435.33729596757667	32.21282836491673	3.387614632228665	5.6537200180555525	14.392067814644104	0.39283583782886455	2.867504539112253	매우 유망	안심(>=2)	37.28413562928821	3399.9403280347915	257.549715084907	매우 유망	충분
ITC.NS	ITC.NS	India Nifty 50	308.04998779296875	-3.113704681230256	-24.330635427541814		-30.447055308615123	303.78625259399416	363.02375015258787	Y	N	주의	ITC LTD	NSI	INR	Consumer Defensive	Tobacco	Tobacco	ITC Limited engages in the fast-moving consumer goods, paperboards, paper and packaging, and agri businesses in India and internationally. The company offers cigarettes and cigars; foods, including staples, spices, biscuits, confectionery and gums, snacks, noodles and pasta, beverages, dairy products, ready-to-eat meals, chocolates, coffee, and frozen foods; personal care products; education and stationery, such as balls, gels and roller pens, mechanical pencils, geometry boxes, erasers, sharpen	3859702611968.0	4.67	16.27	69.83725324774987	31.6085110433352		394500400000.0	0.0	915600000.0	2848400000.0	700300500000.0	31.48580552077542	12.249793620151923	3.976560332923839	16.998413169772178	31.6085110433352	0.5377796235471956	2.1342292766390867	헐값	안심(>=2)	60.0	976.1999999999999	216.8966202511506	양호	충분
LT.NS	LT.NS	India Nifty 50	3928.5	-6.497679400214206	-2.462942929574796		-11.081688663323341	3904.732501220703	3881.1625048828123	Y	Y	상승전환/양호	LARSEN & TOUBRO LTD.	NSI	INR	Industrials	Engineering & Construction	Engineering & Construction	Larsen & Toubro Limited engages in engineering, procurement, and construction projects (EPC) in India and internationally. The company operates through four segments: Infrastructure Projects, Energy Projects, Hi-Tech Manufacturing, and Others. The Infrastructure Projects segment is involved in the engineering and construction of building and factories, transportation infrastructure, heavy civil infrastructure, power transmission & distribution, renewables, water and effluent treatment, and miner	5404312469504.0	97.0	116.93	6.96197607119986	15.382271021915606		1378585600000.0	637385900000.0	579444300000.0	1254970400000.0	1092898000000.0	538.7925050713411	86.73443386661012	2.2078257316179233	28.989202898560325	15.382271021915606	1.8845853682631448	3.8766940717606553	보통	안심(>=2)	39.26454204383121	4591.202901185184	16.869107832128893	보류	충분
HINDUNILVR.NS	HINDUNILVR.NS	India Nifty 50	2179.0	-6.037084950409655	-10.144329896907212		-19.074503417841683	2215.2749938964844	2388.369000244141	N	N	주의	HINDUSTAN UNILEVER LTD.	NSI	INR	Consumer Defensive	Household & Personal Products	Household & Personal Products	Hindustan Unilever Limited, a consumer good company, manufactures and sells food, home care, personal care, and refreshment products in India and internationally. It operates through the Home Care, Beauty and Wellbeing, Personal Care, Foods, and Other segments. The Home Care segment offers detergent bars, detergent powders, detergent liquids, and scourers. Its Beauty and Wellbeing segment provides skin care and hair care products. The Personal Care segment offers skin cleansing, oral care, and d	5119759351808.0	1.99	45.29	41.233918677810124	14.118426432640984		163650000000.0	0.0	0.0	14780000000.0	487390000000.0	69.65041224263797	41.01990059239503	1.8825103530240952	46.574289859955	14.118426432640984	3.298830084369597	0.34586520763016837	매우 불리	불리(<1)	36.73685286528197	1663.8120662686204	-23.643319583817334	보류	충분
BAJFINANCE.NS	BAJFINANCE.NS	India Nifty 50	907.6500244140625	-10.377682111669962	-11.604014291784171		-17.04519451981681	906.0412460327149	962.1204989624024	Y	N	주의	BAJAJ FINANCE LIMITED	NSI	INR	Financial Services	Credit Services	Credit Services	Bajaj Finance Limited operates as a deposit-taking non-banking financial company in India. The company offers financing for various products, such as consumer electronics, furniture, digital products, e-commerce purchases, retail spends, and two and three-wheelers; and personal, unsecured, home, and secured, gold, and car loans. It also provides secured and unsecured loans to micro, small, and medium enterprises, SMEs, and professionals; loans against property, mutual funds, insurance policies, 	5643655708672.0	57.99999999999999	30.55	14.302174203110752	18.22815698685951		157553200000.0	0.0	0.0	3665797400000.0	1139990200000.0	25.338747747008906	-107.35321256476016	-11.827599810187026	28.880892853258707	18.22815698685951	1.5844110226875183	2.639397520504927	보통	안심(>=2)	44.95631397371902	1373.415391897116	51.315524150812465	보류	충분
KOTAKBANK.NS	KOTAKBANK.NS	India Nifty 50	380.8500061035156	-10.514567518383867	-9.44647433001985		-14.580805944446041	375.0149978637695	406.64980087280276	Y	N	주의	KOTAK MAHINDRA BANK LTD	NSI	INR	Financial Services	Banks - Regional	Banks - Regional	Kotak Mahindra Bank Limited provides a range of banking and financial services to corporate and individual customers in India. It operates through Treasury, BMU, and Corporate Centre; Retail Banking; Corporate/Wholesale Banking; Vehicle Financing; Other Lending Activities; Broking; Advisory and Transactional Services; Asset Management; and Insurance segments. The company offers savings, current, retail institution, corporate, and salary accounts; NRE and NRO fixed deposits and foreign currency n	3788111347712.0	13.0	19.39	-12.826996667719726	8.923946239014779		1020911100000.0	0.0	0.0	953935300000.0	1812258700000.0	102.64059694896929	40.88745117429887	10.73584101852045	14.348087114726473	8.923946239014779	1.6078186410399677	1.5280048179044479	보통	양호(>=1.5)	26.347892478029557	510.8856351489931	34.143528150589965	보류	충분
AXISBANK.NS	AXISBANK.NS	India Nifty 50	1253.300048828125	-7.730250771218694	0.29610061735576565		-10.669989392150747	1280.2224975585937	1234.560001220703	N	Y	상승전환/양호	AXIS BANK LIMITED	NSI	INR	Financial Services	Banks - Regional	Banks - Regional	Axis Bank Limited provides various financial products and services in India and internationally. The company operates through four segments: Treasury, Retail Banking, Corporate/Wholesale Banking, and Other Banking Business. It provides fixed, recurring, and safe deposits; and saving, salary, current, safe custody, pension disbursement, and demat and trading accounts. The company also offers home, personal, business, car, two-wheeler, commercial vehicle construction equipment, education, gold, tr	3897267847168.0	8.0	84.49	-5.953496528796354	34.605620932767664		1093515700000.0	0.0	0.0	2805108200000.0	2150353500000.0	351.65743888453346	-34.8813122566348	-2.7831573364454845	10.671589654912909	34.605620932767664	0.3083773493226964	3.9924343336377444	매우 유망	안심(>=2)	60.0	5069.4	304.4841460542548	보류	충분
ASIANPAINT.NS	ASIANPAINT.NS	India Nifty 50	2598.800048828125	8.409815691748923	-10.010729709883591		-12.454099753137104	2427.745013427734	2535.9135021972656	Y	Y	상승전환/양호	ASIAN PAINTS LIMITED	NSI	INR	Basic Materials	Specialty Chemicals	Specialty Chemicals	Asian Paints Limited, together with its subsidiaries, engages in the manufacture, distribution, and sale of paints, coatings, and products related to home decoration and bath fittings in India, Asia, the Middle East, Africa, and the South Pacific region. The company offers wall coverings; waterproofing products; adhesives; and bath fittings and sanitaryware, modular kitchens and wardrobes, fabric, furnishings and rugs, decorative lightings, unplasticized polyvinyl chloride windows and door syste	2491324825600.0	96.0	40.02	-32.837444576510514	6.562551277275386		89298600000.0	2596200000.0	6041300000.0	22902900000.0	193998100000.0	90.4427225533116	27.057898466917806	1.0411689225232623	62.67759435969048	6.562551277275386	9.550796894605403	1.6363511127867396	매우 불리	양호(>=1.5)	21.62510255455077	865.4366042331219	-66.6986075122104	보류	충분
MARUTI.NS	MARUTI.NS	India Nifty 50	13010.0	-13.560560760082385	-18.06272830331276		-24.762896136941936	13140.55	14870.275	N	N	주의	MARUTI SUZUKI INDIA LTD.	NSI	INR	Consumer Cyclical	Auto Manufacturers	Auto Manufacturers	Maruti Suzuki India Limited manufactures, purchases, and sells motor vehicles, components, and spare parts in India. The company offers passenger vehicles, utility vehicles, and multi-purpose vehicles. It is also involved in the facilitation of pre-owned car sales, fleet management, and car financing activities. In addition, the company offers driving school, insurance, accessories, and financing products and services. It also exports its products to South Africa, Saudi Arabia, Chile, Japan, Mex	4090377273344.0	1.08	466.81	1.2365346684873213	21.109694032148575		346247000000.0	0.0	0.0	1025000000.0	1071563000000.0	1101.2855130123712	276.7884463948441	2.127505352765904	25.510838428884618	21.109694032148575	1.2084892556961466	0.8698143768973237	보통	불리(<1)	50.71938806429715	23676.317542294553	81.98553068635321	보류	충분
SUNPHARMA.NS	SUNPHARMA.NS	India Nifty 50	1891.300048828125	11.220232215708625	7.222632952589403		-0.7608353252439026	1767.4475006103517	1711.6679992675781	Y	Y	상승전환/양호	SUN PHARMACEUTICAL IND L	NSI	INR	Healthcare	Drug Manufacturers - Specialty & Generic	Drug Manufacturers - Specialty & Generic	Sun Pharmaceutical Industries Limited, a generic pharmaceutical company, develops, manufactures, and markets branded and generic formulations, and active pharmaceutical ingredients (APIs) in India, the United States, and internationally. The company offers formulations in various therapeutic areas, including neuropsychiatry, cardiology, diabetes, gastroenterology, pain/analgesics, gynecology, ophthalmology, urology, dermatology, respiratory, anti-infectives, oncology, psychiatry, neurology, orth	4537862062080.0	88.0	45.5	14.124961624329856	49.47111675709046		423665100000.0	25200000.0	18671100000.0	23621900000.0	722180200000.0	176.56555057837548	49.77841839232644	2.631968334330125	37.68647248900548	49.47111675709046	0.7617873813936908	3.6477576084414856	헐값	안심(>=2)	60.0	2730.0	44.34515568756765	양호	충분
TITAN.NS	TITAN.NS	India Nifty 50	4083.10009765625	-2.343880742174398	5.5446413324022		-9.7836853276007	4279.072528076172	3930.1605126953127	N	Y	상승전환/양호	TITAN COMPANY LIMITED	NSI	INR	Consumer Cyclical	Luxury Goods	Luxury Goods	Titan Company Limited, together with its subsidiaries, manufactures and sells watches, jewelry, eyewear, and other accessories and products in India and internationally. It operates through four segments: Watches and Wearables, Jewellery, Eyecare, and Others. The company designs, manufactures, and retails watches and wearables under the Nebula, Titan, Titan Clocks, Zoop, Titan Octane, Raga, Xylys, Edge, Fastrack, Sonata, Titan Smart, Fastrack smart, SF, Titan World, and Helios brands; jewellery 	3621894488064.0	27.0	57.08	52.02277494755769	16.0006707482786		88030000000.0	930000000.0	273550000000.0	306210000000.0	157030000000.0	98.19115655947476	52.84961446048424	1.2943502044150368	69.81270043967722	16.0006707482786	4.363110868160816	0.6159433810390134	매우 불리	불리(<1)	40.5013414965572	2311.816572623485	-43.38084990983943	보류	충분
ULTRACEMCO.NS	ULTRACEMCO.NS	India Nifty 50	11474.0	-11.609275094368687	-2.5810833757853646		-12.090101133925835	11549.75	12036.83	N	N	주의	ULTRATECH CEMENT LIMITED	NSI	INR	Basic Materials	Building Materials	Building Materials	UltraTech Cement Limited, together with its subsidiaries, engages in the manufacture and sale of clinker, cement, ready mix concrete, and related products in India, the United Arab Emirates, Bahrain, and Sri Lanka. The company offers ordinary Portland, Portland pozzolana, composite, Weather Plus, and Portland slag; white cement, wall care putty, and value-added products; ready-mix concrete; dry mix mortars, such as tile and marble binders, plasters and mortars, industrial and precision grouts, r	3375302443008.0	68.0	277.24	35.21263894845432	17.26452648493617		129572000000.0	150188200000.0	77618400000.0	237550900000.0	766235400000.0	-70.08269225339998	191.66118216110237	1.6703955217108453	41.63931139898067	17.26452648493617	2.411842076022893	2.047693000202291	매우 불리	안심(>=2)	43.02905296987234	11929.374645367408	3.9687523563483484	보류	충분
WIPRO.NS	WIPRO.NS	India Nifty 50	199.74000549316406	-6.339674276432794	-18.156114322685145		-26.746618382332287	198.12074928283693	232.65180030822754	Y	N	주의	WIPRO LTD	NSI	INR	Technology	Information Technology Services	Information Technology Services	Wipro Limited operates as an information technology (IT), consulting, and business process services company worldwide. It operates through IT Services and IT Products segments. The IT Services segment offers AI-powered IT and IT-enabled services, including digital strategy advisory, customer-centric design, technology and IT consulting, custom application design, development, re-engineering and maintenance, systems integration, package implementation, cloud and infrastructure, business process, 	2094295678976.0	8.62	12.56	18.924057509144255	2.439636282496571		942772000000.0	63954000000.0	97863000000.0	192035000000.0	828309000000.0	83.81582402969823	14.724597420764118	7.371881954448057	9.229632282123076	2.439636282496571	3.7832001222239766	1.1982748547759632	매우 불리	보통(1~1.5)	13.379272564993142	168.04366341631388	-15.868800042630903	보류	충분
ONGC.NS	ONGC.NS	India Nifty 50	295.8500061035156	8.948635390502524	19.270309398780338		-1.8414027555935797	287.82374877929686	256.04365020751953	Y	Y	상승전환/양호	OIL AND NATURAL GAS CORP.	NSI	INR	Energy	Oil & Gas Integrated	Oil & Gas Integrated	Oil and Natural Gas Corporation Limited, together with its subsidiaries, engages in the exploration, development, production, and distribution of crude oil, natural gas, and value-added products in India and internationally. It operates through Exploration and Production, Refining & Marketing, and Petrochemicals segments. The company engages in the refining and marketing of petroleum products; liquefied natural gas supply; pipelines for transportation of petroleum products; SEZ development; heli	3721875685376.0	6.2	30.25	-26.286672741612062	-7.331705014416712		590156440000.0	984741250000.0	550817790000.0	1878173020000.0	3434404760000.0	-31.36534599421354	27.973924444550995	9.455441564115816	10.817036432982782	-7.331705014416712		-0.10462246488936393	판정불가	불리(<1)	0.0	0.0	-100.0	보류	일부부족
NTPC.NS	NTPC.NS	India Nifty 50	388.79998779296875	5.337301913760517	17.746812059230344		-5.216973129503888	389.27749862670896	351.96050064086916	N	Y	상승전환/양호	NTPC LTD	NSI	INR	Utilities	Utilities - Regulated Electric	Utilities - Regulated Electric	NTPC Limited operates as an integrated power company in India. It operates through two segments: Generation and Others. The company generates power from fossil fuels, hydro, solar, wind, nuclear, and renewable energy sources. It also engages in the coal mining and energy trading business. NTPC Limited was incorporated in 1975 and is based in New Delhi, India.	3770063781888.0	2.89	18.09	12.54364692490686	11.990471885936493		89387200000.0	2010538800000.0	465212400000.0	2500961500000.0	1840711600000.0	-198.12496103828423	9.438903921738346	2.427701702183295	32.44471801167789	11.990471885936493	2.705874991436491	0.4586408142176035	매우 불리	불리(<1)	32.48094377187299	587.5802728331823	51.12661812789503	보류	충분
POWERGRID.NS	POWERGRID.NS	India Nifty 50	299.54998779296875	-0.3161438292949237	9.504661363639922		-6.653165007663631	307.35625076293945	285.9297506713867	N	Y	상승전환/양호	POWER GRID CORP. LTD.	NSI	INR	Utilities	Utilities - Regulated Electric	Utilities - Regulated Electric	Power Grid Corporation of India Limited, an electric power transmission utility, engages in the power transmission business in India and internationally. It operates in three segments: Transmission Services, Telecom Services, and Consultancy Services. As of 31 March 2025, the company owned and operated 180,195 circuit kilometers of transmission lines, and 282 substations with an aggregate transformation capacity of 551,961 mega volt amperes. It also provides telecom services that offer overhead 	2785995915264.0	4.08	20.12	2.6190224618334312	1.0867601620135003		269860400000.0	1210718000000.0	269372100000.0	1480706000000.0	1004940300000.0	-101.16091581902914	3.92605692174576	1.3106516714196026	19.916048887276236	1.0867601620135003	18.32607559921655	0.25942696722914693	매우 불리	불리(<1)	10.673520324027	214.75122891942326	-28.308717185511412	보류	충분
