티커	종목코드	유니버스	현재가	3M수익률(보조,%)	6M수익률(보조,%)	12M수익률(보조,%)	52주고점대비(보조,%)	40일이평(보조)	200일이평(보조)	40일선상회(보조)	200일선상회(보조)	추세판정(보조)	종목명	시장	통화	섹터	산업	업종	사업설명	시가총액	배당수익률(%)	EPS(FY)	EPS Growth 1Y(%)	EPS Growth 3Y CAGR(%)	EPS Growth 5Y CAGR(%)	현금및단기투자	장기부채	단기위험부채	총부채	주주지분	주당순현금(린치식)	주당잉여현금흐름	잉여현금흐름수익률(%)	순현금차감PER(린치식)	사용연성장률(%)	린치PER배수	배당감안점수	린치PER판정	배당감안점수판정	그레이엄적정PER(3년)	그레이엄내재가치(3년)	그레이엄괴리율(3년,%)	종합판정	데이터상태
RELIANCE.NS	RELIANCE.NS	India Nifty 50	1332.699951171875	-4.472799477174005	-14.37841624337456		-16.303466036272884	1352.1075012207032	1422.5705041503907	N	N	주의	RELIANCE INDUSTRIES LTD	NSI	INR	Energy	Oil & Gas Refining & Marketing	Oil & Gas Refining & Marketing	Reliance Industries Limited engages in hydrocarbon exploration and production, petroleum refining and marketing, petrochemicals, advanced materials and composites, renewable, financial services, retail, and digital services worldwide. It operates through the Oil to Chemicals, Oil and Gas, Retail, Digital Services, and Others segments. The company is involved in refining and marketing products, including liquefied petroleum gas, propylene, naphtha, gasoline, jet/aviation turbine fuel, kerosine oi	18034724962304.0	45.0	59.66	15.976050999310809	6.58907750634663		4170970000000.0	2707510000000.0	1036700000000.0	3980000000000.0	9040300000000.0	108.1443162370115	51.134040224211695	3.8368756732712646	20.525572157808643	6.58907750634663	3.115090411068669	2.5134050885261363	매우 불리	안심(>=2)	21.67815501269326	1293.3187280572797	-2.9549954646555188	보류	충분
TCS.NS	TCS.NS	India Nifty 50	2223.0	-7.728704754510074	-30.973451327433633		-36.76215489084442	2313.9099670410155	2823.558486328125	N	N	주의	TATA CONSULTANCY SERV LT	NSI	INR	Technology	Information Technology Services	Information Technology Services	Tata Consultancy Services Limited provides information technology (IT) and IT enabled services. It offers TCS ADD, a suite of AI powered life sciences platforms; TCS BaNCS, a financial services platform; TCS BFSI Platforms, a cloud-native, subscription-based as-a-service digital ecosystem for insurers and financial firms; TCS Chroma, a cloud-based AI-led hire-to-retire modular platform; TCS Customer Intelligence & Insights, an AI-powered, real-time customer data analytics solution; TCS ERP on Cl	8043008360448.0	4.9482681061628435	136.12	1.3531604638230332	5.300128040832486		763410000000.0	0.0	18300000000.0	112830000000.0	1072400000000.0	210.99821278563113	132.52305192027143	5.961450828622197	14.781088651295686	5.300128040832486	2.788817277133938	0.693345151278622	매우 불리	불리(<1)	19.100256081664973	2599.926857836236	16.955774081702035	보류	충분
HDFCBANK.NS	HDFCBANK.NS	India Nifty 50	787.0999755859375	-6.364501731362527	-21.407890605498004		-22.2924319661997	766.7524993896484	900.3499996948242	Y	N	주의	HDFC BANK LTD	NSI	INR	Financial Services	Banks - Regional	Banks - Regional	HDFC Bank Limited provides banking and financial products and services to individuals and businesses in India, Bahrain, Hong Kong, Singapore, and Dubai. The company operates through Treasury, Retail Banking, Wholesale Banking, Other Banking Business, Insurance Business, and Other segments. It offers savings, salary, current, rural, public provident fund, pension, and demat accounts; fixed and recurring deposits; and safe deposit lockers, as well as offshore accounts and deposits, and overdrafts 	12118368714752.0	4.160843732159953	44.82	8.166893276325982	20.388517319859577		9196249400000.0	5866163200000.0	1306013100000.0	7326106100000.0	7676891400000.0	216.29238855811627	73.34396107729431	9.318252236343314	12.735555266127204	20.388517319859577	0.6246435219554709	1.927623926795995	헐값	양호(>=1.5)	49.277034639719155	2208.5966925522125	180.59925817023134	양호	충분
ICICIBANK.NS	ICICIBANK.NS	India Nifty 50	1336.800048828125	5.02003481722586	-2.137624536740479		-10.19749625469808	1274.310006713867	1345.9795025634767	Y	N	상승전환/양호	ICICI BANK LTD.	NSI	INR	Financial Services	Banks - Regional	Banks - Regional	ICICI Bank Limited, together with its subsidiaries, engages in the provision of various banking and financial services to retail and corporate customers in India and internationally. The company operates through Retail Banking, Wholesale Banking, Treasury, Other Banking, Life Insurance, General Insurance, and Others segments. It offers savings, salary, pension, current, trade, escrow, foreign currency, and vostro accounts, as well as time, fixed, recurring, and security deposits. The company als	9587189088256.0	82.0	74.72	6.22878665548352	16.78079563417647		2649807200000.0	2202642800000.0	226221340000.0	2202642800000.0	3630604100000.0	62.35084772560009	88.67495597738957	6.633374681211632	17.056332991200815	16.78079563417647	1.016419802912275	5.791443898588076	보통	안심(>=2)	42.06159126835294	3142.842099571332	135.10188395986611	보류	충분
INFY.NS	INFY.NS	India Nifty 50	1157.699951171875	-7.369186594496268	-27.56225838181291		-31.48893847087181	1168.4875	1417.4050024414062	N	N	주의	INFOSYS LIMITED	NSI	INR	Technology	Information Technology Services	Information Technology Services	Infosys Limited provides consulting, technology, outsourcing, and digital services worldwide. It provides digital marketing and digital workplace, digital commerce, digital experience and interactions, and metaverse; data analytics and AI, applied AI, generative AI, and sustainability; blockchain, engineering, and Internet of Things; enterprise agile DevOps, API economy and microservices, application modernization, cloud, digital process automation, digital supply chain, Microsoft business appli	4687069708288.0	4.37	76.05	4.9081697276757374	3.582523363792678		5163000000.0	0.0	333000000.0	967000000.0	9786000000.0	1.2752540708840512	0.9220459900465162	0.07964464273434413	15.206110415529137	3.582523363792678	4.244525121374511	0.522982087231934	매우 불리	불리(<1)	15.665046727585356	1191.3268036328664	2.9046258857446494	보류	충분
BHARTIARTL.NS	BHARTIARTL.NS	India Nifty 50	1875.699951171875	4.857999774803212	-9.969279106628548		-13.270449275429396	1840.0199951171876	1951.998002319336	Y	N	상승전환/양호	BHARTI AIRTEL LIMITED	NSI	INR	Communication Services	Telecom Services	Telecom Services	Bharti Airtel Limited operates as a telecommunications company in India and internationally. It operates through the Mobile Services India, Mobile Services Africa, Mobile Services South Asia, Airtel Business, Passive Tower Infrastructure Services, Homes Services, Digital TV Services, and Others segments. The company provides voice and data telecom services through wireless technology including 2G/3G/4G/5G services; passive infrastructure service, including the setup, operation, and maintenance o	11425773780992.0	86.0	44.29	-20.44605898778463	47.33977446458364		1232854000000.0	1000849000000.0	215865000000.0	1954117000000.0	1490566000000.0	38.092693332988986	124.50262814200362	6.637662279844839	41.490342240661235	47.33977446458364	0.876437260420441	3.213754509209818	헐값	안심(>=2)	60.0	2657.4	41.6751116477742	양호	충분
SBIN.NS	SBIN.NS	India Nifty 50	1026.5	-3.768627825257831	6.577373615753879		-16.39518169267512	1007.5787506103516	995.3029983520507	Y	Y	상승전환/양호	STATE BANK OF INDIA	NSI	INR	Financial Services	Banks - Regional	Banks - Regional	State Bank of India provides banking products and services in India and internationally. The company operates through the Treasury, Corporate/Wholesale Banking, Retail Banking, and Other Banking Business segments. It offers personal banking products and services, including current, savings, salary, and deposit accounts; home, personal, pension, auto, education, and gold loans, as well as loans against insurance property, and securities; debit, business debit, prepaid, and green remit cards; over	9475229483008.0	1.71	91.17	7.397300658448813	14.39206891326348		6671134748000.0	0.0	0.0	7268922204000.0	5961308694000.0	722.7181373127248	32.21283031494877	3.138122777881029	3.332037541815018	14.39206891326348	0.23151900966401504	4.832499247440174	매우 유망	안심(>=2)	37.28413782652696	3399.194845644463	231.1441642128069	매우 유망	충분
ITC.NS	ITC.NS	India Nifty 50	290.75	-5.677210056772097	-27.330668441735572		-31.523788078063188	298.32375183105466	351.35400009155273	N	N	주의	ITC LTD	NSI	INR	Consumer Defensive	Tobacco	Tobacco	ITC Limited engages in the fast-moving consumer goods, paperboards, paper and packaging, and agri businesses in India and internationally. The company offers cigarettes and cigars; foods, including staples, spices, biscuits, confectionery and gums, snacks, noodles and pasta, beverages, dairy products, ready-to-eat meals, chocolates, coffee, and frozen foods; personal care products; education and stationery, such as balls, gels and roller pens, mechanical pencils, geometry boxes, erasers, sharpen	3642942816256.0	5.49	16.51	-40.45618236934057	2.5366068168754863		515980800000.0	600000000.0	21262200000.0	23990600000.0	725073000000.0	41.13349349694361	12.994502001064214	4.46930421360764	15.119110024412864	2.5366068168754863	5.960367970246218	0.5308914879192561	매우 불리	불리(<1)	13.573213633750973	224.0937570932286	-22.9256209481587	보류	충분
LT.NS	LT.NS	India Nifty 50	4207.7001953125	21.280345700995483	3.2792541777043605		-4.762225791474595	3997.0825012207033	3917.3110009765624	Y	Y	상승전환/양호	LARSEN & TOUBRO LTD.	NSI	INR	Industrials	Engineering & Construction	Engineering & Construction	Larsen & Toubro Limited engages in engineering, procurement, and construction projects (EPC) in India and internationally. The company operates through four segments: Infrastructure Projects, Energy Projects, Hi-Tech Manufacturing, and Others. The Infrastructure Projects segment is involved in the engineering and construction of building and factories, transportation infrastructure, heavy civil infrastructure, power transmission & distribution, renewables, water and effluent treatment, and miner	5788399566848.0	3.089573733053124	116.8	6.96197607119986	15.382271021915606		1378585600000.0	637385900000.0	579444300000.0	1254970400000.0	1092898000000.0	538.7925050713411	86.73443386661012	2.0613263740423995	31.411880909598963	15.382271021915606	2.0420834390998226	0.5880528074116069	매우 불리	불리(<1)	39.26454204383121	4586.098510719486	8.992996122407494	보류	충분
HINDUNILVR.NS	HINDUNILVR.NS	India Nifty 50	2197.60009765625	1.0065793526620848	-2.7868706218900585		-18.38371767240402	2219.452490234375	2350.062999267578	N	N	주의	HINDUSTAN UNILEVER LTD.	NSI	INR	Consumer Defensive	Household & Personal Products	Household & Personal Products	Hindustan Unilever Limited, a fast-moving consumer goods company, manufactures and sells food, home care, and personal care products in India and internationally. It operates through Home Care, Beauty & Wellbeing, Personal Care, Foods, and Others segments. The company offers detergent bars, detergent powders, detergent liquids, and scourers; skin care and hair care products; skin cleansing, oral care, bodywash, and deodorants; and culinary products, such as tomato based products, fruit based pro	5163461902336.0	2.0	45.32	41.233918677810124	14.118426432640984		142350000000.0	0.0	0.0	14780000000.0	487380000000.0	60.58500569959985	41.01990059239503	1.8665771191102027	47.15390758951125	14.118426432640984	3.3398840738011812	0.3418258900822529	매우 불리	불리(<1)	36.73685286528197	1664.9141718545789	-24.239438575279593	보류	충분
BAJFINANCE.NS	BAJFINANCE.NS	India Nifty 50	958.4000244140625	9.138529609851819	-5.78983230961102		-12.406890917239311	920.0887512207031	964.598999633789	Y	N	상승전환/양호	BAJAJ FINANCE LIMITED	NSI	INR	Financial Services	Credit Services	Credit Services	Bajaj Finance Limited operates as a deposit-taking non-banking financial company in India. The company offers financing for various products, such as consumer electronics, furniture, digital products, e-commerce purchases, retail spends, and two and three-wheelers; and personal, unsecured, home, and secured, gold, and car loans. It also provides secured and unsecured loans to micro, small, and medium enterprises, SMEs, and professionals; loans against property, mutual funds, insurance policies, 	5959213121536.0	56.00000000000001	30.52	14.302174203110752	18.22815698685951		157553200000.0	0.0	0.0	3665797400000.0	1139990200000.0	25.338747747008906	-107.35321256476016	-11.20129484871338	30.572125709929672	18.22815698685951	1.6771923640974127	2.427968460261518	보통	안심(>=2)	44.95631397371902	1372.0667024779045	43.16221489213188	보류	충분
KOTAKBANK.NS	KOTAKBANK.NS	India Nifty 50	404.5	9.368661166599068	-7.079850869630389		-9.276451511778971	383.8112503051758	405.79540069580077	Y	N	상승전환/양호	KOTAK MAHINDRA BANK LTD	NSI	INR	Financial Services	Banks - Regional	Banks - Regional	Kotak Mahindra Bank Limited provides a range of banking and financial services to corporate and individual customers in India. It operates through Treasury, BMU, and Corporate Centre; Retail Banking; Corporate/Wholesale Banking; Vehicle Financing; Other Lending Activities; Broking; Advisory and Transactional Services; Asset Management; and Insurance segments. The company offers savings, current, retail institution, corporate, and salary accounts; NRE and NRO fixed deposits and foreign currency n	4023345217536.0	0.3510506798516687	19.37	-12.826996667719726	8.923946239014779		1020911100000.0	0.0	0.0	953935300000.0	1812258700000.0	102.64059694896929	40.88745117429887	10.108146149394035	15.583861799227192	8.923946239014779	1.7462971405067185	0.5951667846108849	보통	불리(<1)	26.347892478029557	510.35867729943254	26.17025396772128	보류	충분
AXISBANK.NS	AXISBANK.NS	India Nifty 50	1350.9000244140625	11.212651577929943	5.03849234571383		-3.7134693931530682	1289.2625061035155	1256.5090020751952	Y	Y	상승전환/양호	AXIS BANK LIMITED	NSI	INR	Financial Services	Banks - Regional	Banks - Regional	Axis Bank Limited provides various financial products and services in India and internationally. The company operates through four segments: Treasury, Retail Banking, Corporate/Wholesale Banking, and Other Banking Business. It provides fixed, recurring, and safe deposits; and saving, salary, current, safe custody, pension disbursement, and demat and trading accounts. The company also offers home, personal, business, car, two-wheeler, commercial vehicle construction equipment, education, gold, tr	4201638526976.0	7.000000000000001	84.54	-5.953496528796354	34.605620932767664		1093515700000.0	0.0	0.0	2805108200000.0	2150353500000.0	351.58436799609325	-34.874064269830825	-2.581542944671798	11.820625223775362	34.605620932767664	0.34158107570849994	3.519747910549129	매우 유망	안심(>=2)	60.0	5072.400000000001	275.4830045398879	보류	충분
ASIANPAINT.NS	ASIANPAINT.NS	India Nifty 50	2738.0	23.461246349091923	-0.9693304526482649		-7.764864409634498	2603.930010986328	2554.0560009765627	Y	Y	상승전환/양호	ASIAN PAINTS LIMITED	NSI	INR	Basic Materials	Specialty Chemicals	Specialty Chemicals	Asian Paints Limited, together with its subsidiaries, engages in the manufacture, distribution, and sale of paints, coatings, and products related to home decoration and bath fittings, kitchen, and wardrobe in India, Asia, the Middle East, Africa, and the South Pacific region. The company offers wall coverings, waterproofing products, adhesives; and bath fittings and sanitaryware, modular kitchens and wardrobes, fabric, furnishings, rugs, decorative lightings, unplasticized polyvinyl chloride wi	2624768180224.0	1.0	45.07	17.945970119136234	1.7462094983582643		165304500000.0	12471700000.0	10460900000.0	39289300000.0	213715900000.0	159.42597353067228	58.42479874143516	2.133849479234301	57.212647580859276	1.7462094983582643	32.763908130524406	0.04800004220180539	매우 불리	불리(<1)	11.992418996716529	540.4983241820139	-80.2593745733377	보류	충분
MARUTI.NS	MARUTI.NS	India Nifty 50	13630.0	6.843301716704553	-17.503934148408185		-21.177423085820035	13237.775	14866.895	Y	N	상승전환/양호	MARUTI SUZUKI INDIA LTD.	NSI	INR	Consumer Cyclical	Auto Manufacturers	Auto Manufacturers	Maruti Suzuki India Limited manufactures, purchases, and sells motor vehicles, components, and spare parts in India. The company offers passenger vehicles, utility vehicles, and multi-purpose vehicles. It is also involved in the facilitation of pre-owned car sales, fleet management, and car financing activities. In addition, the company offers driving school, insurance, accessories, and financing products and services. It also exports its products to South Africa, Saudi Arabia, Chile, Japan, Mex	4285306765312.0	3.008070432868672	466.86	1.2365346684873213	21.109694032148575		346247000000.0	0.0	0.0	1025000000.0	1071563000000.0	1101.2855130123712	276.7884463948441	2.030729614048746	26.836127505007127	21.109694032148575	1.2712703208363703	0.8987050929951542	보통	불리(<1)	50.71938806429715	23678.85351169777	73.72599788479654	보류	충분
SUNPHARMA.NS	SUNPHARMA.NS	India Nifty 50	1820.4000244140625	2.0861414457610694	1.4998619690026471		-4.48105898971799	1813.2975036621094	1728.0009997558593	Y	Y	상승전환/양호	SUN PHARMACEUTICAL IND L	NSI	INR	Healthcare	Drug Manufacturers - Specialty & Generic	Drug Manufacturers - Specialty & Generic	Sun Pharmaceutical Industries Limited, a generic pharmaceutical company, develops, manufactures, and markets branded and generic formulations, and active pharmaceutical ingredients (APIs) in India, the United States, and internationally. The company offers formulations in various therapeutic areas, including neuropsychiatry, cardiology, diabetes, gastroenterology, pain/analgesics, gynecology, ophthalmology, urology, dermatology, respiratory, anti-infectives, oncology, psychiatry, neurology, orth	4367749218304.0	89.0	47.72	5.035940942662842	10.649894433841345		581099300000.0	312600000.0	40503500000.0	46273200000.0	835700900000.0	242.06153257542027	36.717715992777784	2.0170135959318185	33.07498935118697	10.649894433841345	3.1056635872452536	3.0128473625726255	매우 불리	안심(>=2)	29.79978886768269	1422.045924765818	-21.882778197416464	보류	충분
TITAN.NS	TITAN.NS	India Nifty 50	4380.5	7.081743123936457	12.893666695630657		-3.2126186058258677	4222.35502319336	3993.7080139160157	Y	Y	상승전환/양호	TITAN COMPANY LIMITED	NSI	INR	Consumer Cyclical	Luxury Goods	Luxury Goods	Titan Company Limited, together with its subsidiaries, manufactures and sells watches, jewelry, eyewear, and other accessories and products in India and internationally. It operates through four segments: Watches and Wearables, Jewellery, Eyecare, and Others. The company designs, manufactures, and retails watches and wearables under the Nebula, Titan, Titan Clocks, Zoop, Titan Octane, Raga, Xylys, Edge, Fastrack, Sonata, Titan Smart, Fastrack smart, SF, Titan World, and Helios brands; jewellery 	3885701791744.0	25.0	57.26	52.02277494755769	16.0006707482786		88030000000.0	930000000.0	273550000000.0	306210000000.0	157030000000.0	98.19115655947476	52.84961446048424	1.2064744768972546	74.78709122320163	16.0006707482786	4.673997259224113	0.5482319218153885	매우 불리	불리(<1)	40.5013414965572	2319.1068140928655	-47.05839940434048	보류	충분
ULTRACEMCO.NS	ULTRACEMCO.NS	India Nifty 50	11373.0	2.4686908730516155	-2.985583894907451		-12.86392889978547	11519.675	11923.55	N	N	주의	ULTRATECH CEMENT LIMITED	NSI	INR	Basic Materials	Building Materials	Building Materials	UltraTech Cement Limited, together with its subsidiaries, engages in the manufacture and sale of clinker, cement, ready mix concrete, and related products in India, the United Arab Emirates, Bahrain, and Sri Lanka. The company offers ordinary Portland, Portland pozzolana, composite, Weather Plus, and Portland slag; white cement, wall care putty, and value-added products; ready-mix concrete; dry mix mortars, such as tile and marble binders, plasters and mortars, industrial and precision grouts, r	3345591304192.0	68.0	277.94	35.21263894845432	17.26452648493617		129572000000.0	150188200000.0	77618400000.0	237550900000.0	766235400000.0	-70.08269225339998	191.66118216110237	1.685229773684185	41.17105379669497	17.26452648493617	2.3847195480639436	2.0709823680000348	매우 불리	안심(>=2)	43.02905296987234	11959.494982446318	5.156906554526675	보류	충분
WIPRO.NS	WIPRO.NS	India Nifty 50	184.47000122070312	-5.453333686824835	-29.213354988400162		-32.34679571041532	195.8679992675781	227.74555015563965	N	N	주의	WIPRO LTD	NSI	INR	Technology	Information Technology Services	Information Technology Services	Wipro Limited operates as an information technology (IT), consulting, and business process services company worldwide. It operates through IT Services and IT Products segments. The IT Services segment offers AI-powered IT and IT-enabled services, including digital strategy advisory, customer-centric design, technology and IT consulting, custom application design, development, re-engineering and maintenance, systems integration, package implementation, cloud and infrastructure, business process, 	1935294595072.0	9.48663733083771	12.57	0.47200694306988034	5.155220759982337		981695000000.0	1962000000.0	165912000000.0	202910000000.0	885368000000.0	93.38700066091454	12.745366359378387	6.909181045718977	7.2460620970396645	5.155220759982337	1.4055774591240766	2.0206641752079233	보통	안심(>=2)	18.810441519964677	236.447249905956	28.176531870386	보류	충분
ONGC.NS	ONGC.NS	India Nifty 50	245.0	-5.93204510766161	2.932524830790717		-18.712672541013696	279.0699966430664	258.65375	N	N	중립	OIL AND NATURAL GAS CORP.	NSI	INR	Energy	Oil & Gas Integrated	Oil & Gas Integrated	Oil and Natural Gas Corporation Limited, together with its subsidiaries, engages in the exploration, development, production, and distribution of crude oil, natural gas, and value-added products in India and internationally. It operates through Exploration and Production, Refining & Marketing, and Petrochemicals segments. The company engages in the refining and marketing of petroleum products; liquefied natural gas supply; pipelines for transportation of petroleum products; SEZ development; heli	3082168303616.0	7.551020408163265	32.94	14.351058725840993	4.110173577502096		887528900000.0	938229200000.0	482321800000.0	1743164900000.0	3717678000000.0	-4.030141077935627	46.68327231719152	19.054396864159806	7.560113572493493	4.110173577502096	1.839366009716809	1.5424628048040343	보통	양호(>=1.5)	16.72034715500419	550.768235285838	124.80336134115836	보류	충분
NTPC.NS	NTPC.NS	India Nifty 50	355.54998779296875	-7.0214452228218205	9.383172172098675		-13.322774936067095	384.2649978637695	355.18825027465823	N	Y	상승전환/양호	NTPC LTD	NSI	INR	Utilities	Utilities - Regulated Electric	Utilities - Regulated Electric	NTPC Limited operates as an integrated power company in India. It operates through two segments: Generation and Others. The company generates power from fossil fuels, hydro, solar, wind, nuclear, and renewable energy sources. It also engages in the coal mining and energy trading business. NTPC Limited was incorporated in 1975 and is based in New Delhi, India.	3447649730560.0	3.19	30.44	15.49820129909496	16.949816418059882		523473900000.0	2076637000000.0	595945000000.0	2710045800000.0	2031756700000.0	-160.17495895357803	7.066377149950866	1.9874496955588443	16.942343848441087	16.949816418059882	0.999559135660559	1.188726695563613	헐값	보통(1~1.5)	42.399632836119764	1290.6448235314856	262.99954094865785	보류	충분
POWERGRID.NS	POWERGRID.NS	India Nifty 50	286.3500061035156	-3.8287133153599884	8.630500558890763		-10.766590355284912	300.60249786376954	286.14775024414064	N	Y	상승전환/양호	POWER GRID CORP. LTD.	NSI	INR	Utilities	Utilities - Regulated Electric	Utilities - Regulated Electric	Power Grid Corporation of India Limited, an electric power transmission utility, engages in the power transmission business in India and internationally. It operates in three segments: Transmission Services, Telecom Services, and Consultancy Services. As of 31 March 2025, the company owned and operated 180,195 circuit kilometers of transmission lines, and 282 substations with an aggregate transformation capacity of 551,961 mega volt amperes. It also provides telecom services that offer overhead 	2663228112896.0	4.3	20.1	2.6190224618334312	1.0867601620135003		269860400000.0	1210718000000.0	269372100000.0	1480706000000.0	1004940300000.0	-101.16091581902914	3.92605692174576	1.3710692642089517	19.27915034440521	1.0867601620135003	17.74002306883026	0.27940858729683243	매우 불리	불리(<1)	10.673520324027	214.53775851294273	-25.07848648852926	보류	충분
