티커	종목코드	유니버스	현재가	3M수익률(보조,%)	6M수익률(보조,%)	12M수익률(보조,%)	52주고점대비(보조,%)	40일이평(보조)	200일이평(보조)	40일선상회(보조)	200일선상회(보조)	추세판정(보조)	종목명	시장	통화	섹터	산업	업종	사업설명	시가총액	배당수익률(%)	EPS(FY)	EPS Growth 1Y(%)	EPS Growth 3Y CAGR(%)	EPS Growth 5Y CAGR(%)	현금및단기투자	장기부채	단기위험부채	총부채	주주지분	주당순현금(린치식)	주당잉여현금흐름	잉여현금흐름수익률(%)	순현금차감PER(린치식)	사용연성장률(%)	린치PER배수	배당감안점수	린치PER판정	배당감안점수판정	그레이엄적정PER(3년)	그레이엄내재가치(3년)	그레이엄괴리율(3년,%)	종합판정	데이터상태
RELIANCE.NS	RELIANCE.NS	India Nifty 50	1291.0	-4.014869888475836	-16.510382252241797		-18.92231612062506	1364.1225006103516	1427.0920037841797	N	N	주의	RELIANCE INDUSTRIES LTD	NSI	INR	Energy	Oil & Gas Refining & Marketing	Oil & Gas Refining & Marketing	Reliance Industries Limited engages in hydrocarbon exploration and production, petroleum refining and marketing, petrochemicals, advanced materials and composites, renewable, financial services, retail, and digital services worldwide. It operates through the Oil to Chemicals, Oil and Gas, Retail, Digital Services, and Others segments. The company is involved in refining and marketing products, including liquefied petroleum gas, propylene, naphtha, gasoline, jet/aviation turbine fuel, kerosine oi	17470422253568.0	46.0	59.71	15.976050999310809	6.58907750634663		4170970000000.0	2707510000000.0	1036700000000.0	3980000000000.0	9040300000000.0	108.1443162370115	51.134040224211695	3.9608086928126798	19.810009776636885	6.58907750634663	3.0064921466708796	2.6546719612611214	매우 불리	안심(>=2)	21.67815501269326	1294.4026358079145	0.2635659030142845	보류	충분
TCS.NS	TCS.NS	India Nifty 50	2198.89990234375	-15.028214666758622	-29.875308971383685		-37.44773214802007	2391.447473144531	2859.88548828125	N	N	주의	TATA CONSULTANCY SERV LT	NSI	INR	Technology	Information Technology Services	Information Technology Services	Tata Consultancy Services Limited provides information technology (IT) and IT enabled services. It offers TCS ADD, a suite of AI powered life sciences platforms; TCS BaNCS, a financial services platform; TCS BFSI Platforms, a cloud-native, subscription-based as-a-service digital ecosystem for insurers and financial firms; TCS Chroma, a cloud-based AI-led hire-to-retire modular platform; TCS Customer Intelligence & Insights, an AI-powered, real-time customer data analytics solution; TCS ERP on Cl	7955811926016.0	5.53	136.03	1.3531604638230332	5.300128040832486		763410000000.0	0.0	18300000000.0	112830000000.0	1072400000000.0	210.99821278563113	132.52305192027143	6.026788749184015	14.613700577505837	5.300128040832486	2.7572353846777027	0.7410941522575588	매우 불리	불리(<1)	19.100256081664973	2598.2078347888864	18.15944109231733	보류	충분
HDFCBANK.NS	HDFCBANK.NS	India Nifty 50	747.0499877929688	-13.99873748960263	-24.525156899756873		-26.24642414979518	774.9300033569336	909.5004995727539	N	N	주의	HDFC BANK LTD	NSI	INR	Financial Services	Banks - Regional	Banks - Regional	HDFC Bank Limited provides banking and financial products and services to individuals and businesses in India, Bahrain, Hong Kong, Singapore, and Dubai. The company operates through Treasury, Retail Banking, Wholesale Banking, Other Banking Business, Insurance Business, and Other segments. It offers savings, salary, current, rural, public provident fund, pension, and demat accounts; fixed and recurring deposits; and safe deposit lockers, as well as offshore accounts and deposits, and overdrafts 	11502732967936.0	1.72	44.8	8.166893276325982	20.388517319859577		9196249400000.0	5866163200000.0	1306013100000.0	7326106100000.0	7676891400000.0	216.27388895398335	73.33768792892087	9.8169719733996	11.847680777655924	20.388517319859577	0.5810957507005969	1.8660628805559167	헐값	양호(>=1.5)	49.277034639719155	2207.611151859418	195.51049968977674	양호	충분
ICICIBANK.NS	ICICIBANK.NS	India Nifty 50	1262.0999755859375	-7.56555199802742	-8.07720498281591		-15.215639104847211	1283.075003051758	1350.909501953125	N	N	주의	ICICI BANK LTD.	NSI	INR	Financial Services	Banks - Regional	Banks - Regional	ICICI Bank Limited, together with its subsidiaries, engages in the provision of various banking and financial services to retail and corporate customers in India and internationally. The company operates through Retail Banking, Wholesale Banking, Treasury, Other Banking, Life Insurance, General Insurance, and Others segments. It offers savings, salary, pension, current, trade, escrow, foreign currency, and vostro accounts, as well as time, fixed, recurring, and security deposits. The company als	9048799838208.0	88.0	74.73	6.22878665548352	16.78079563417647		2649807200000.0	2202642800000.0	226221340000.0	2202642800000.0	3630604100000.0	62.36917520897794	88.70102120089479	7.028050306372505	16.054205812618218	16.78079563417647	0.9567011101619968	6.5266881997875785	헐값	안심(>=2)	42.06159126835294	3143.2627154840156	149.05021601198723	양호	충분
INFY.NS	INFY.NS	India Nifty 50	1197.5	-8.405998344945454	-23.286354900704676		-29.133627328838973	1199.1499969482422	1430.829501953125	N	N	주의	INFOSYS LIMITED	NSI	INR	Technology	Information Technology Services	Information Technology Services	Infosys Limited provides consulting, technology, outsourcing, and digital services worldwide. It provides digital marketing and digital workplace, digital commerce, digital experience and interactions, and metaverse; data analytics and AI, applied AI, generative AI, and sustainability; blockchain, engineering, and Internet of Things; enterprise agile DevOps, API economy and microservices, application modernization, cloud, digital process automation, digital supply chain, Microsoft business appli	4848204382208.0	4.16	76.16	4.9081697276757374	3.582523363792678		5163000000.0	0.0	333000000.0	967000000.0	9786000000.0	1.2752540708840512	0.9220459900465162	0.07699757745691159	15.706732483312972	3.582523363792678	4.3842651919748725	0.49294297028477635	매우 불리	불리(<1)	15.665046727585356	1193.0499587729007	-0.37161095842165315	보류	충분
BHARTIARTL.NS	BHARTIARTL.NS	India Nifty 50	1798.199951171875	-5.650877373554685	-14.534222853047762		-16.85393296478751	1846.3124969482421	1955.6995031738281	N	N	주의	BHARTI AIRTEL LIMITED	NSI	INR	Communication Services	Telecom Services	Telecom Services	Bharti Airtel Limited operates as a telecommunications company in India and internationally. It operates through the Mobile Services India, Mobile Services Africa, Mobile Services South Asia, Airtel Business, Passive Tower Infrastructure Services, Homes Services, Digital TV Services, and Others segments. The company provides voice and data telecom services through wireless technology including 2G/3G/4G/5G services; passive infrastructure service, including the setup, operation, and maintenance o	10953684942848.0	88.0	44.38	-20.44605898778463	47.33977446458364		1232854000000.0	1000849000000.0	215865000000.0	1954117000000.0	1490566000000.0	38.092693332988986	124.50262814200362	6.923736598973106	39.65992018564412	47.33977446458364	0.8377716335618569	3.4125074844092396	헐값	안심(>=2)	60.0	2662.8	48.08141876906797	양호	충분
SBIN.NS	SBIN.NS	India Nifty 50	977.7000122070312	-16.756065371900274	1.0751601928365107		-20.369769235617962	1022.6725006103516	987.8599984741211	N	N	중립	STATE BANK OF INDIA	NSI	INR	Financial Services	Banks - Regional	Banks - Regional	State Bank of India provides banking products and services in India and internationally. The company operates through the Treasury, Corporate/Wholesale Banking, Retail Banking, and Other Banking Business segments. It offers personal banking products and services, including current, savings, salary, and deposit accounts; home, personal, pension, auto, education, and gold loans, as well as loans against insurance property, and securities; debit, business debit, prepaid, and green remit cards; over	9024774864896.0	1.77	91.17	7.397300658448813	14.39206891326348		6671134748000.0	0.0	0.0	7268922204000.0	5961308694000.0	722.7181373127248	32.21283031494877	3.2947560512178447	2.7967738827937527	14.39206891326348	0.19432743823344917	5.7788257437240045	매우 유망	안심(>=2)	37.28413782652696	3399.194845644463	247.67257882826658	매우 유망	충분
ITC.NS	ITC.NS	India Nifty 50	280.70001220703125	-10.017630638610253	-29.991269818919143		-34.262292223177695	302.18375091552736	356.1467500305176	N	N	주의	ITC LTD	NSI	INR	Consumer Defensive	Tobacco	Tobacco	ITC Limited engages in the fast-moving consumer goods, paperboards, paper and packaging, and agri businesses in India and internationally. The company offers cigarettes and cigars; foods, including staples, spices, biscuits, confectionery and gums, snacks, noodles and pasta, beverages, dairy products, ready-to-eat meals, chocolates, coffee, and frozen foods; personal care products; education and stationery, such as balls, gels and roller pens, mechanical pencils, geometry boxes, erasers, sharpen	3517021945856.0	5.71	16.51	-40.45618236934057	2.5366068168754863		515980800000.0	600000000.0	21262200000.0	23990600000.0	725073000000.0	41.13349349694361	12.994502001064214	4.62932006981178	14.510388777110093	2.5366068168754863	5.720393354056952	0.5683243187725182	매우 불리	불리(<1)	13.573213633750973	224.0937570932286	-20.166103545464942	보류	충분
LT.NS	LT.NS	India Nifty 50	3953.199951171875	1.8183653155070756	-1.9178774054862902		-10.522625929887807	4001.709997558594	3900.8180029296873	N	Y	상승전환/양호	LARSEN & TOUBRO LTD.	NSI	INR	Industrials	Engineering & Construction	Engineering & Construction	Larsen & Toubro Limited engages in engineering, procurement, and construction projects (EPC) in India and internationally. The company operates through four segments: Infrastructure Projects, Energy Projects, Hi-Tech Manufacturing, and Others. The Infrastructure Projects segment is involved in the engineering and construction of building and factories, transportation infrastructure, heavy civil infrastructure, power transmission & distribution, renewables, water and effluent treatment, and miner	5438291574784.0	96.0	116.69	6.96197607119986	15.382271021915606		1378585600000.0	637385900000.0	579444300000.0	1254970400000.0	1092898000000.0	538.7925050713411	86.73443386661012	2.194031036575795	29.26049743851687	15.382271021915606	1.9022222009239416	3.8065747602533326	보통	안심(>=2)	39.26454204383121	4581.779411094664	15.900522809033601	보류	충분
HINDUNILVR.NS	HINDUNILVR.NS	India Nifty 50	2121.5	-6.182286552400407	-14.37969334921262		-21.209985773727002	2230.8624877929688	2368.3169995117187	N	N	주의	HINDUSTAN UNILEVER LTD.	NSI	INR	Consumer Defensive	Household & Personal Products	Household & Personal Products	Hindustan Unilever Limited, a consumer good company, manufactures and sells food, home care, personal care, and refreshment products in India and internationally. It operates through the Home Care, Beauty and Wellbeing, Personal Care, Foods, and Other segments. The Home Care segment offers detergent bars, detergent powders, detergent liquids, and scourers. Its Beauty and Wellbeing segment provides skin care and hair care products. The Personal Care segment offers skin cleansing, oral care, and d	4984657674240.0	2.12	45.33	41.233918677810124	14.118426432640984		163650000000.0	0.0	0.0	14780000000.0	487390000000.0	69.65041224263797	41.01990059239503	1.933532905604291	45.26471625319572	14.118426432640984	3.206073741231269	0.35874358168531634	매우 불리	불리(<1)	36.73685286528197	1665.2815403832315	-21.5045231966424	보류	충분
BAJFINANCE.NS	BAJFINANCE.NS	India Nifty 50	889.4000244140625	-5.893551223228255	-13.271572460842274		-18.713155913847135	921.3600021362305	963.7619995117187	N	N	주의	BAJAJ FINANCE LIMITED	NSI	INR	Financial Services	Credit Services	Credit Services	Bajaj Finance Limited operates as a deposit-taking non-banking financial company in India. The company offers financing for various products, such as consumer electronics, furniture, digital products, e-commerce purchases, retail spends, and two and three-wheelers; and personal, unsecured, home, and secured, gold, and car loans. It also provides secured and unsecured loans to micro, small, and medium enterprises, SMEs, and professionals; loans against property, mutual funds, insurance policies, 	5530179338240.0	62.0	30.52	14.302174203110752	18.22815698685951		157553200000.0	0.0	0.0	3665797400000.0	1139990200000.0	25.338747747008906	-107.35321256476016	-12.070295662009292	28.311313128016174	18.22815698685951	1.5531637756041659	2.8337843823806153	보통	안심(>=2)	44.95631397371902	1372.0667024779045	54.26879523438548	보류	충분
KOTAKBANK.NS	KOTAKBANK.NS	India Nifty 50	377.45001220703125	-6.421220653170733	-11.909540111761508		-15.343375811262739	380.51499938964844	405.9675508117676	N	N	주의	KOTAK MAHINDRA BANK LTD	NSI	INR	Financial Services	Banks - Regional	Banks - Regional	Kotak Mahindra Bank Limited provides a range of banking and financial services to corporate and individual customers in India. It operates through Treasury, BMU, and Corporate Centre; Retail Banking; Corporate/Wholesale Banking; Vehicle Financing; Other Lending Activities; Broking; Advisory and Transactional Services; Asset Management; and Insurance segments. The company offers savings, current, retail institution, corporate, and salary accounts; NRE and NRO fixed deposits and foreign currency n	3754293460992.0	13.0	19.38	-12.826996667719726	8.923946239014779		1020911100000.0	0.0	0.0	953935300000.0	1812258700000.0	102.64059694896929	40.88745117429887	10.832547318046478	14.180052386896902	8.923946239014779	1.588988997367874	1.5461117942888303	보통	양호(>=1.5)	26.347892478029557	510.6221562242128	35.28206112340424	보류	충분
AXISBANK.NS	AXISBANK.NS	India Nifty 50	1272.300048828125	-5.846221945193475	1.1367288416633592		-9.31574847982003	1295.4399993896484	1246.262000732422	N	Y	상승전환/양호	AXIS BANK LIMITED	NSI	INR	Financial Services	Banks - Regional	Banks - Regional	Axis Bank Limited provides various financial products and services in India and internationally. The company operates through four segments: Treasury, Retail Banking, Corporate/Wholesale Banking, and Other Banking Business. It provides fixed, recurring, and safe deposits; and saving, salary, current, safe custody, pension disbursement, and demat and trading accounts. The company also offers home, personal, business, car, two-wheeler, commercial vehicle construction equipment, education, gold, tr	3956924743680.0	8.0	84.47	-5.953496528796354	34.605620932767664		1093515700000.0	0.0	0.0	2805108200000.0	2150353500000.0	351.6064058326919	-34.87625022859313	-2.741196957487861	10.899652456439364	34.605620932767664	0.3149676891397319	3.908897196772256	매우 유망	안심(>=2)	60.0	5068.2	298.34943059761395	보류	충분
ASIANPAINT.NS	ASIANPAINT.NS	India Nifty 50	2686.699951171875	17.569578530496056	-9.061060114424812		-9.493011582554322	2551.872509765625	2546.880499267578	Y	Y	상승전환/양호	ASIAN PAINTS LIMITED	NSI	INR	Basic Materials	Specialty Chemicals	Specialty Chemicals	Asian Paints Limited, together with its subsidiaries, engages in the manufacture, distribution, and sale of paints, coatings, and products related to home decoration and bath fittings in India, Asia, the Middle East, Africa, and the South Pacific region. The company offers wall coverings; waterproofing products; adhesives; and bath fittings and sanitaryware, modular kitchens and wardrobes, fabric, furnishings and rugs, decorative lightings, unplasticized polyvinyl chloride windows and door syste	2575589441536.0	1.03	44.98	17.945970119136234	1.7462094983582643		176915300000.0	12471700000.0	10460900000.0	39289300000.0	213715900000.0	171.53766090059506	58.42479874143516	2.1745933600047764	55.91734749380347	1.7462094983582643	32.02212995999354	0.049648447624700234	매우 불리	불리(<1)	11.992418996716529	539.4190064723094	-79.9226182202807	보류	충분
MARUTI.NS	MARUTI.NS	India Nifty 50	13050.0	-7.8259641192258815	-19.637908738222798		-24.531575294934072	13248.15	14899.77	N	N	주의	MARUTI SUZUKI INDIA LTD.	NSI	INR	Consumer Cyclical	Auto Manufacturers	Auto Manufacturers	Maruti Suzuki India Limited manufactures, purchases, and sells motor vehicles, components, and spare parts in India. The company offers passenger vehicles, utility vehicles, and multi-purpose vehicles. It is also involved in the facilitation of pre-owned car sales, fleet management, and car financing activities. In addition, the company offers driving school, insurance, accessories, and financing products and services. It also exports its products to South Africa, Saudi Arabia, Chile, Japan, Mex	4102953369600.0	1.07	466.38	1.2365346684873213	21.109694032148575		346247000000.0	0.0	0.0	1025000000.0	1071563000000.0	1101.2855130123712	276.7884463948441	2.1209842635620237	25.62012626396421	21.109694032148575	1.2136663953985578	0.8657136894498936	보통	불리(<1)	50.71938806429715	23654.508205426904	81.26059927530194	보류	충분
SUNPHARMA.NS	SUNPHARMA.NS	India Nifty 50	1782.199951171875	1.8109083788560465	-0.9613808740275065		-6.485470379342873	1788.1150024414062	1721.448999633789	N	Y	상승전환/양호	SUN PHARMACEUTICAL IND L	NSI	INR	Healthcare	Drug Manufacturers - Specialty & Generic	Drug Manufacturers - Specialty & Generic	Sun Pharmaceutical Industries Limited, a generic pharmaceutical company, develops, manufactures, and markets branded and generic formulations, and active pharmaceutical ingredients (APIs) in India, the United States, and internationally. The company offers formulations in various therapeutic areas, including neuropsychiatry, cardiology, diabetes, gastroenterology, pain/analgesics, gynecology, ophthalmology, urology, dermatology, respiratory, anti-infectives, oncology, psychiatry, neurology, orth	4276094500864.0	93.0	47.88	5.035940942662842	10.649894433841345		581099300000.0	312600000.0	40503500000.0	46273200000.0	835700900000.0	242.06153257542027	36.717715992777784	2.0602467174704087	32.16663363818828	10.649894433841345	3.0203711255554664	3.2222798195080014	매우 불리	안심(>=2)	29.79978886768269	1426.8138909846473	-19.940863535179975	보류	충분
TITAN.NS	TITAN.NS	India Nifty 50	4260.2001953125	1.3271880473987308	9.635085227745721		-5.870649213732204	4281.117529296875	3969.4050146484374	N	Y	상승전환/양호	TITAN COMPANY LIMITED	NSI	INR	Consumer Cyclical	Luxury Goods	Luxury Goods	Titan Company Limited, together with its subsidiaries, manufactures and sells watches, jewelry, eyewear, and other accessories and products in India and internationally. It operates through four segments: Watches and Wearables, Jewellery, Eyecare, and Others. The company designs, manufactures, and retails watches and wearables under the Nebula, Titan, Titan Clocks, Zoop, Titan Octane, Raga, Xylys, Edge, Fastrack, Sonata, Titan Smart, Fastrack smart, SF, Titan World, and Helios brands; jewellery 	3778990309376.0	26.0	57.12	52.02277494755769	16.0006707482786		88030000000.0	930000000.0	273550000000.0	306210000000.0	157030000000.0	98.19115655947476	52.84961446048424	1.2405429800842387	72.86430389973785	16.0006707482786	4.553828089211622	0.5764231386341386	매우 불리	불리(<1)	40.5013414965572	2313.4366262833473	-45.6965278573335	보류	충분
ULTRACEMCO.NS	ULTRACEMCO.NS	India Nifty 50	10912.0	-9.87032295366317	-6.463226470084004		-16.395954642966593	11669.375	11987.275	N	N	주의	ULTRATECH CEMENT LIMITED	NSI	INR	Basic Materials	Building Materials	Building Materials	UltraTech Cement Limited, together with its subsidiaries, engages in the manufacture and sale of clinker, cement, ready mix concrete, and related products in India, the United Arab Emirates, Bahrain, and Sri Lanka. The company offers ordinary Portland, Portland pozzolana, composite, Weather Plus, and Portland slag; white cement, wall care putty, and value-added products; ready-mix concrete; dry mix mortars, such as tile and marble binders, plasters and mortars, industrial and precision grouts, r	3209978970112.0	70.0	277.12	35.21263894845432	17.26452648493617		129572000000.0	150188200000.0	77618400000.0	237550900000.0	766235400000.0	-70.08269225339998	191.66118216110237	1.7564257895995452	39.629339969159204	17.26452648493617	2.2954200338907076	2.2020181651485533	매우 불리	안심(>=2)	43.02905296987234	11924.211159011023	9.276128656625948	보류	충분
WIPRO.NS	WIPRO.NS	India Nifty 50	198.3699951171875	1.4420823428385798	-20.705921345842647		-27.249061008404052	200.74999961853027	230.47480026245117	N	N	주의	WIPRO LTD	NSI	INR	Technology	Information Technology Services	Information Technology Services	Wipro Limited operates as an information technology (IT), consulting, and business process services company worldwide. It operates through IT Services and IT Products segments. The IT Services segment offers AI-powered IT and IT-enabled services, including digital strategy advisory, customer-centric design, technology and IT consulting, custom application design, development, re-engineering and maintenance, systems integration, package implementation, cloud and infrastructure, business process, 	2080973651968.0	8.32	12.57	0.47200694306988034	5.155220759982337		981695000000.0	1962000000.0	165912000000.0	202910000000.0	885368000000.0	93.39360534029133	12.746267759549157	6.425501876944279	8.351343657668748	5.155220759982337	1.6199778916349183	1.6135392473770989	보통	양호(>=1.5)	18.810441519964677	236.447249905956	19.19506766447934	보류	충분
ONGC.NS	ONGC.NS	India Nifty 50	264.75	-4.405131492794901	8.709044632742424		-12.159918592789287	285.7537467956543	258.0802500152588	N	Y	상승전환/양호	OIL AND NATURAL GAS CORP.	NSI	INR	Energy	Oil & Gas Integrated	Oil & Gas Integrated	Oil and Natural Gas Corporation Limited, together with its subsidiaries, engages in the exploration, development, production, and distribution of crude oil, natural gas, and value-added products in India and internationally. It operates through Exploration and Production, Refining & Marketing, and Petrochemicals segments. The company engages in the refining and marketing of petroleum products; liquefied natural gas supply; pipelines for transportation of petroleum products; SEZ development; heli	3330628911104.0	6.91	32.94	14.351058725840993	4.110173577502096		887528900000.0	938229200000.0	482321800000.0	1743164900000.0	3717678000000.0	-4.030141077935627	46.68327231719152	17.632964048042123	8.159688557314379	4.110173577502096	1.9852418403879968	1.3505630147640337	보통	보통(1~1.5)	16.72034715500419	550.768235285838	108.03332777557624	보류	충분
NTPC.NS	NTPC.NS	India Nifty 50	361.6499938964844	-1.1344980959466677	10.057817157361026		-11.83569401895661	391.9737487792969	354.51150039672854	N	Y	상승전환/양호	NTPC LTD	NSI	INR	Utilities	Utilities - Regulated Electric	Utilities - Regulated Electric	NTPC Limited operates as an integrated power company in India. It operates through two segments: Generation and Others. The company generates power from fossil fuels, hydro, solar, wind, nuclear, and renewable energy sources. It also engages in the coal mining and energy trading business. NTPC Limited was incorporated in 1975 and is based in New Delhi, India.	3506799378432.0	3.1	30.45	15.49820129909496	16.949816418059882		523473900000.0	2076637000000.0	595945000000.0	2710045800000.0	2031756700000.0	-160.17495895357803	7.066377149950866	1.953927075683426	17.137108467982344	16.949816418059882	1.0110497981395776	1.1699649596966384	보통	보통(1~1.5)	42.399632836119764	1291.0688198598468	256.9940112398817	보류	충분
POWERGRID.NS	POWERGRID.NS	India Nifty 50	285.6499938964844	-2.157909932224744	6.805003125355857		-10.98473065455119	305.9237487792969	286.1227502441406	N	N	중립	POWER GRID CORP. LTD.	NSI	INR	Utilities	Utilities - Regulated Electric	Utilities - Regulated Electric	Power Grid Corporation of India Limited, an electric power transmission utility, engages in the power transmission business in India and internationally. It operates in three segments: Transmission Services, Telecom Services, and Consultancy Services. As of 31 March 2025, the company owned and operated 180,195 circuit kilometers of transmission lines, and 282 substations with an aggregate transformation capacity of 551,961 mega volt amperes. It also provides telecom services that offer overhead 	2656717504512.0	4.3	20.12	2.6190224618334312	1.0867601620135003		269860400000.0	1210718000000.0	269372100000.0	1480706000000.0	1004940300000.0	-101.16091581902914	3.92605692174576	1.3744291985416632	19.225194319856534	1.0867601620135003	17.690374557194808	0.28019275500637425	매우 불리	불리(<1)	10.673520324027	214.75122891942326	-24.82015280656854	보류	충분
