티커	종목코드	유니버스	현재가	3M수익률(보조,%)	6M수익률(보조,%)	12M수익률(보조,%)	52주고점대비(보조,%)	40일이평(보조)	200일이평(보조)	40일선상회(보조)	200일선상회(보조)	추세판정(보조)	종목명	시장	통화	섹터	산업	업종	사업설명	시가총액	배당수익률(%)	EPS(FY)	EPS Growth 1Y(%)	EPS Growth 3Y CAGR(%)	EPS Growth 5Y CAGR(%)	현금및단기투자	장기부채	단기위험부채	총부채	주주지분	주당순현금(린치식)	주당잉여현금흐름	잉여현금흐름수익률(%)	순현금차감PER(린치식)	사용연성장률(%)	린치PER배수	배당감안점수	린치PER판정	배당감안점수판정	그레이엄적정PER(3년)	그레이엄내재가치(3년)	그레이엄괴리율(3년,%)	종합판정	데이터상태
RELIANCE.NS	RELIANCE.NS	India Nifty 50	1313.5999755859375	-6.691296347134035	-16.069261000776912		-17.5029871692399	1345.5049957275392	1421.3260040283203	N	N	주의	RELIANCE INDUSTRIES LTD	NSI	INR	Energy	Oil & Gas Refining & Marketing	Oil & Gas Refining & Marketing	Reliance Industries Limited engages in hydrocarbon exploration and production, petroleum refining and marketing, petrochemicals, advanced materials and composites, renewable, financial services, retail, and digital services worldwide. It operates through the Oil to Chemicals, Oil and Gas, Retail, Digital Services, and Others segments. The company is involved in refining and marketing products, including liquefied petroleum gas, propylene, naphtha, gasoline, jet/aviation turbine fuel, kerosine oi	17776255172608.0	46.0	59.71	15.976050999310809	6.58907750634663		4170970000000.0	2707510000000.0	1036700000000.0	3980000000000.0	9040300000000.0	108.1443162370115	51.134040224211695	3.8926645230335906	20.18850543207044	6.58907750634663	3.063935036827959	2.6049019667798823	매우 불리	안심(>=2)	21.67815501269326	1294.4026358079145	-1.461429669215697	보류	충분
TCS.NS	TCS.NS	India Nifty 50	2109.0	-11.527814548171378	-35.740402193784284		-39.08145580589255	2272.384973144531	2799.1819873046875	N	N	주의	TATA CONSULTANCY SERV LT	NSI	INR	Technology	Information Technology Services	Information Technology Services	Tata Consultancy Services Limited provides information technology (IT) and IT enabled services. It offers TCS ADD, a suite of AI powered life sciences platforms; TCS BaNCS, a financial services platform; TCS BFSI Platforms, a cloud-native, subscription-based as-a-service digital ecosystem for insurers and financial firms; TCS Chroma, a cloud-based AI-led hire-to-retire modular platform; TCS Customer Intelligence & Insights, an AI-powered, real-time customer data analytics solution; TCS ERP on Cl	7630546272256.0	6.02	135.93	1.3531604638230332	5.300128040832486		763410000000.0	0.0	18300000000.0	112830000000.0	1072400000000.0	210.99821278563113	132.52305192027143	6.283691413953125	13.963082374857418	5.300128040832486	2.6344801988338853	0.8107184171036648	매우 불리	불리(<1)	19.100256081664973	2596.29780918072	23.105633436733996	보류	충분
HDFCBANK.NS	HDFCBANK.NS	India Nifty 50	793.2000122070312	6.591411164918037	-19.512936356465627		-21.69019714794875	767.0650024414062	896.2205001831055	Y	N	상승전환/양호	HDFC BANK LTD	NSI	INR	Financial Services	Banks - Regional	Banks - Regional	HDFC Bank Limited provides banking and financial products and services to individuals and businesses in India, Bahrain, Hong Kong, Singapore, and Dubai. The company operates through Treasury, Retail Banking, Wholesale Banking, Other Banking Business, Insurance Business, and Other segments. It offers savings, salary, current, rural, public provident fund, pension, and demat accounts; fixed and recurring deposits; and safe deposit lockers, as well as offshore accounts and deposits, and overdrafts 	12215836999680.0	1.68	44.85	8.166893276325982	20.388517319859577		9196249400000.0	5866163200000.0	1306013100000.0	7326106100000.0	7676891400000.0	216.22950848508373	73.32263867358061	9.243902867520738	12.864448243521684	20.388517319859577	0.6309653635770257	1.715465514113511	헐값	양호(>=1.5)	49.277034639719155	2210.0750035914043	178.62770670439144	양호	충분
ICICIBANK.NS	ICICIBANK.NS	India Nifty 50	1373.5999755859375	12.341541706077198	1.4400709217620378		-7.725379677957744	1279.1050109863281	1344.749503173828	Y	Y	상승전환/양호	ICICI BANK LTD.	NSI	INR	Financial Services	Banks - Regional	Banks - Regional	ICICI Bank Limited, together with its subsidiaries, engages in the provision of various banking and financial services to retail and corporate customers in India and internationally. The company operates through Retail Banking, Wholesale Banking, Treasury, Other Banking, Life Insurance, General Insurance, and Others segments. It offers savings, salary, pension, current, trade, escrow, foreign currency, and vostro accounts, as well as time, fixed, recurring, and security deposits. The company als	9852186263552.0	82.0	74.81	6.22878665548352	16.78079563417647		2649807200000.0	2202642800000.0	226221340000.0	2202642800000.0	3630604100000.0	62.34402871396725	88.66525802494132	6.454954834075279	17.52781642657359	16.78079563417647	1.0445164108235552	5.635658956606641	보통	안심(>=2)	42.06159126835294	3146.6276427854837	129.0788947810824	보류	충분
INFY.NS	INFY.NS	India Nifty 50	1056.5999755859375	-15.929349575444363	-35.522059738249425		-37.47189341610632	1154.6150024414062	1406.8215032958985	N	N	주의	INFOSYS LIMITED	NSI	INR	Technology	Information Technology Services	Information Technology Services	Infosys Limited provides consulting, technology, outsourcing, and digital services worldwide. It provides digital marketing and digital workplace, digital commerce, digital experience and interactions, and metaverse; data analytics and AI, applied AI, generative AI, and sustainability; blockchain, engineering, and Internet of Things; enterprise agile DevOps, API economy and microservices, application modernization, cloud, digital process automation, digital supply chain, Microsoft business appli	4278097281024.0	4.86	75.45	4.9081697276757374	3.582523363792678		5163000000.0	0.0	333000000.0	967000000.0	9786000000.0	1.275152362128282	0.9219724516414638	0.08725842068377714	13.987075191833124	3.582523363792678	3.9042523304092436	0.6035946220352172	매우 불리	불리(<1)	15.665046727585356	1181.927775596315	11.861423708710305	보류	충분
BHARTIARTL.NS	BHARTIARTL.NS	India Nifty 50	1877.300048828125	4.532547653404051	-10.50674107231705		-13.19646316120292	1846.854998779297	1952.1955029296876	Y	N	상승전환/양호	BHARTI AIRTEL LIMITED	NSI	INR	Communication Services	Telecom Services	Telecom Services	Bharti Airtel Limited operates as a telecommunications company in India and internationally. It operates through the Mobile Services India, Mobile Services Africa, Mobile Services South Asia, Airtel Business, Passive Tower Infrastructure Services, Homes Services, Digital TV Services, and Others segments. The company provides voice and data telecom services through wireless technology including 2G/3G/4G/5G services; passive infrastructure service, including the setup, operation, and maintenance o	11711035736064.0	84.0	44.31	-20.44605898778463	47.33977446458364		1232854000000.0	1000849000000.0	215865000000.0	1954117000000.0	1490566000000.0	37.19638643168536	121.57312762444701	6.4759561318041365	41.527954466180084	47.33977446458364	0.8772317767852578	3.1626834539020052	헐값	안심(>=2)	60.0	2658.6000000000004	41.61827789114423	양호	충분
SBIN.NS	SBIN.NS	India Nifty 50	1034.5999755859375	0.2616485229185006	5.539119501084433		-15.735467141134873	999.8774963378906	1001.0569973754883	Y	Y	상승전환/양호	STATE BANK OF INDIA	NSI	INR	Financial Services	Banks - Regional	Banks - Regional	State Bank of India provides banking products and services in India and internationally. The company operates through the Treasury, Corporate/Wholesale Banking, Retail Banking, and Other Banking Business segments. It offers personal banking products and services, including current, savings, salary, and deposit accounts; home, personal, pension, auto, education, and gold loans, as well as loans against insurance property, and securities; debit, business debit, prepaid, and green remit cards; over	9549997146112.0	1.69	91.15	7.397300658448813	14.39206891326348		6671134748000.0	0.0	0.0	7268922204000.0	5961308694000.0	722.7181373127248	32.21283031494877	3.1135541344571642	3.421632893836672	14.39206891326348	0.2377443378334129	4.70011524095172	매우 유망	안심(>=2)	37.28413782652696	3398.4491628879323	228.4795324843544	매우 유망	충분
ITC.NS	ITC.NS	India Nifty 50	290.3500061035156	-0.034431433745074624	-27.60253959828045		-31.617992951057673	296.4187515258789	348.4552500915527	N	N	주의	ITC LTD	NSI	INR	Consumer Defensive	Tobacco	Tobacco	ITC Limited engages in the fast-moving consumer goods, paperboards, paper and packaging, and agri businesses in India and internationally. The company offers cigarettes and cigars; foods, including staples, spices, biscuits, confectionery and gums, snacks, noodles and pasta, beverages, dairy products, ready-to-eat meals, chocolates, coffee, and frozen foods; personal care products; education and stationery, such as balls, gels and roller pens, mechanical pencils, geometry boxes, erasers, sharpen	3637931147264.0	5.52	16.5	-40.45618236934057	2.5366068168754863		515980800000.0	600000000.0	21262200000.0	23990600000.0	725073000000.0	41.13349349694361	12.994502001064214	4.475461246049161	15.104031067064971	2.5366068168754863	5.9544234315626605	0.5334077228193264	매우 불리	불리(<1)	13.573213633750973	223.95802495689105	-22.86618899637788	보류	충분
LT.NS	LT.NS	India Nifty 50	4181.7001953125	25.11070839788554	2.6561972581931936		-5.350714042652804	4014.732489013672	3932.4440002441406	Y	Y	상승전환/양호	LARSEN & TOUBRO LTD.	NSI	INR	Industrials	Engineering & Construction	Engineering & Construction	Larsen & Toubro Limited engages in engineering, procurement, and construction projects (EPC) in India and internationally. The company operates through four segments: Infrastructure Projects, Energy Projects, Hi-Tech Manufacturing, and Others. The Infrastructure Projects segment is involved in the engineering and construction of building and factories, transportation infrastructure, heavy civil infrastructure, power transmission & distribution, renewables, water and effluent treatment, and miner	5752632115200.0	91.0	117.02	6.96197607119986	15.382271021915606		1378585600000.0	637385900000.0	579444300000.0	1254970400000.0	1092898000000.0	538.7925050713411	86.73443386661012	2.074142808320777	31.130641687242857	15.382271021915606	2.0238001035666353	3.417284876126097	매우 불리	안심(>=2)	39.26454204383121	4594.736709969128	9.877238811132937	보류	충분
HINDUNILVR.NS	HINDUNILVR.NS	India Nifty 50	2157.800048828125	5.145702181502765	-5.359646981222587		-19.861844664331585	2201.702496337891	2338.115500488281	N	N	주의	HINDUSTAN UNILEVER LTD.	NSI	INR	Consumer Defensive	Household & Personal Products	Household & Personal Products	Hindustan Unilever Limited, a fast-moving consumer goods company, manufactures and sells food, home care, and personal care products in India and internationally. It operates through Home Care, Beauty & Wellbeing, Personal Care, Foods, and Others segments. The company offers detergent bars, detergent powders, detergent liquids, and scourers; skin care and hair care products; skin cleansing, oral care, bodywash, and deodorants; and culinary products, such as tomato based products, fruit based pro	5069948321792.0	2.04	45.15	41.233918677810124	14.118426432640984		142350000000.0	0.0	0.0	14780000000.0	487380000000.0	60.58500569959985	41.01990059239503	1.9010056383432024	46.44994558424197	14.118426432640984	3.290022851048924	0.3478674997225979	매우 불리	불리(<1)	36.73685286528197	1658.6689068674807	-23.13148255936487	보류	충분
BAJFINANCE.NS	BAJFINANCE.NS	India Nifty 50	990.9500122070312	21.948073096174014	-1.7207156397883394		-9.431980067111612	925.7625015258789	966.6582501220703	Y	Y	상승전환/양호	BAJAJ FINANCE LIMITED	NSI	INR	Financial Services	Credit Services	Credit Services	Bajaj Finance Limited operates as a deposit-taking non-banking financial company in India. The company offers financing for various products, such as consumer electronics, furniture, digital products, e-commerce purchases, retail spends, and two and three-wheelers; and personal, unsecured, home, and secured, gold, and car loans. It also provides secured and unsecured loans to micro, small, and medium enterprises, SMEs, and professionals; loans against property, mutual funds, insurance policies, 	6161604542464.0	56.00000000000001	30.51	14.302174203110752	18.22815698685951		157553200000.0	0.0	0.0	3665797400000.0	1139990200000.0	25.338747747008906	-107.35321256476016	-10.833363059925137	31.64900899573983	18.22815698685951	1.7362703765693523	2.3453548576150087	보통	안심(>=2)	44.95631397371902	1371.6171393381674	38.4143622223001	보류	충분
KOTAKBANK.NS	KOTAKBANK.NS	India Nifty 50	405.95001220703125	13.855006620487309	-6.008331108166831		-8.951234570436295	387.1600006103516	406.0788507080078	Y	N	상승전환/양호	KOTAK MAHINDRA BANK LTD	NSI	INR	Financial Services	Banks - Regional	Banks - Regional	Kotak Mahindra Bank Limited provides a range of banking and financial services to corporate and individual customers in India. It operates through Treasury, BMU, and Corporate Centre; Retail Banking; Corporate/Wholesale Banking; Vehicle Financing; Other Lending Activities; Broking; Advisory and Transactional Services; Asset Management; and Insurance segments. The company offers savings, current, retail institution, corporate, and salary accounts; NRE and NRO fixed deposits and foreign currency n	4037767593984.0	12.0	19.4	-12.826996667719726	8.923946239014779		1020911100000.0	0.0	0.0	953935300000.0	1812258700000.0	102.64059694896929	40.88745117429887	10.072040878138118	15.634505941137215	8.923946239014779	1.7519722242144855	1.338318352865893	보통	보통(1~1.5)	26.347892478029557	511.1491140737734	25.914299471209624	보류	충분
AXISBANK.NS	AXISBANK.NS	India Nifty 50	1384.5	18.272683143274104	12.506096820031587		-1.3186029935851717	1293.7500061035157	1264.2845025634765	Y	Y	상승전환/양호	AXIS BANK LIMITED	NSI	INR	Financial Services	Banks - Regional	Banks - Regional	Axis Bank Limited provides various financial products and services in India and internationally. The company operates through four segments: Treasury, Retail Banking, Corporate/Wholesale Banking, and Other Banking Business. It provides fixed, recurring, and safe deposits; and saving, salary, current, safe custody, pension disbursement, and demat and trading accounts. The company also offers home, personal, business, car, two-wheeler, commercial vehicle construction equipment, education, gold, tr	4306348539904.0	7.000000000000001	84.54	-5.953496528796354	34.605620932767664		1093515700000.0	0.0	0.0	2805108200000.0	2150353500000.0	351.56758442998733	-34.87239948829804	-2.518772082939548	12.218268459545925	34.605620932767664	0.35307178805673695	3.4051978044615563	매우 유망	안심(>=2)	60.0	5072.400000000001	266.3705308775732	보류	충분
ASIANPAINT.NS	ASIANPAINT.NS	India Nifty 50	2667.5	25.74835895910217	-4.72873698923737		-10.139801246420754	2631.1550048828126	2558.150500488281	Y	Y	상승전환/양호	ASIAN PAINTS LIMITED	NSI	INR	Basic Materials	Specialty Chemicals	Specialty Chemicals	Asian Paints Limited, together with its subsidiaries, engages in the manufacture, distribution, and sale of paints, coatings, and products related to home decoration and bath fittings, kitchen, and wardrobe in India, Asia, the Middle East, Africa, and the South Pacific region. The company offers wall coverings, waterproofing products, adhesives; and bath fittings and sanitaryware, modular kitchens and wardrobes, fabric, furnishings, rugs, decorative lightings, unplasticized polyvinyl chloride wi	2557183524864.0	1.03	45.24	17.945970119136234	1.7462094983582643		165304500000.0	12471700000.0	10460900000.0	39289300000.0	213715900000.0	159.42597353067228	58.42479874143516	2.1902455010847297	55.43930208818142	1.7462094983582643	31.74836818852712	0.05007655929619104	매우 불리	불리(<1)	11.992418996716529	542.5370354114558	-79.66121704174486	보류	충분
MARUTI.NS	MARUTI.NS	India Nifty 50	13248.0	7.227842978551191	-19.28841233093701		-23.386537126995144	13273.275	14830.895	N	N	주의	MARUTI SUZUKI INDIA LTD.	NSI	INR	Consumer Cyclical	Auto Manufacturers	Auto Manufacturers	Maruti Suzuki India Limited manufactures, purchases, and sells motor vehicles, components, and spare parts in India. The company offers passenger vehicles, utility vehicles, and multi-purpose vehicles. It is also involved in the facilitation of pre-owned car sales, fleet management, and car financing activities. In addition, the company offers driving school, insurance, accessories, and financing products and services. It also exports its products to South Africa, Saudi Arabia, Chile, Japan, Mex	4165205229568.0	1.04	466.75	1.2365346684873213	21.109694032148575		346247000000.0	0.0	0.0	1025000000.0	1071563000000.0	1101.2855130123712	276.7884463948441	2.0892847704924824	26.024026753053302	21.109694032148575	1.2327998081554639	0.8511247795097595	보통	불리(<1)	50.71938806429715	23673.274379010694	78.69319428601067	보류	충분
SUNPHARMA.NS	SUNPHARMA.NS	India Nifty 50	1874.4000244140625	6.5969061868418555	7.4216286427920775		-1.6476032957062015	1831.0075073242188	1734.9060009765626	Y	Y	상승전환/양호	SUN PHARMACEUTICAL IND L	NSI	INR	Healthcare	Drug Manufacturers - Specialty & Generic	Drug Manufacturers - Specialty & Generic	Sun Pharmaceutical Industries Limited, a generic pharmaceutical company, develops, manufactures, and markets branded and generic formulations, and active pharmaceutical ingredients (APIs) in India, the United States, and internationally. The company offers formulations in various therapeutic areas, including neuropsychiatry, cardiology, diabetes, gastroenterology, pain/analgesics, gynecology, ophthalmology, urology, dermatology, respiratory, anti-infectives, oncology, psychiatry, neurology, orth	4497313628160.0	86.0	47.82	5.035940942662842	10.649894433841345		581099300000.0	312600000.0	40503500000.0	46273200000.0	835700900000.0	242.06153257542027	36.717715992777784	1.958905010378227	34.13505838223844	10.649894433841345	3.205201572117946	2.8313967813258922	매우 불리	안심(>=2)	29.79978886768269	1425.0259036525863	-23.974291234975343	보류	충분
TITAN.NS	TITAN.NS	India Nifty 50	4323.7998046875	12.216129742322689	10.017549101765532		-4.465412448728523	4213.462518310547	4011.7735095214844	Y	Y	상승전환/양호	TITAN COMPANY LIMITED	NSI	INR	Consumer Cyclical	Luxury Goods	Luxury Goods	Titan Company Limited, together with its subsidiaries, manufactures and sells watches, jewelry, eyewear, and other accessories and products in India and internationally. It operates through four segments: Watches and Wearables, Jewellery, Eyecare, and Others. The company designs, manufactures, and retails watches and wearables under the Nebula, Titan, Titan Clocks, Zoop, Titan Octane, Raga, Xylys, Edge, Fastrack, Sonata, Titan Smart, Fastrack smart, SF, Titan World, and Helios brands; jewellery 	3835406057472.0	26.0	57.26	52.02277494755769	16.0006707482786		88030000000.0	930000000.0	273550000000.0	306210000000.0	157030000000.0	98.19115655947476	52.84961446048424	1.2222955929455646	73.79686776332564	16.0006707482786	4.612110887367951	0.5691389353133415	매우 불리	불리(<1)	40.5013414965572	2319.1068140928655	-46.36414915466981	보류	충분
ULTRACEMCO.NS	ULTRACEMCO.NS	India Nifty 50	11430.0	10.306890561667625	-0.574112734864296		-12.427214220042904	11447.45	11890.98	N	N	주의	ULTRATECH CEMENT LIMITED	NSI	INR	Basic Materials	Building Materials	Building Materials	UltraTech Cement Limited, together with its subsidiaries, engages in the manufacture and sale of clinker, cement, ready mix concrete, and related products in India, the United Arab Emirates, Bahrain, and Sri Lanka. The company offers ordinary Portland, Portland pozzolana, composite, Weather Plus, and Portland slag; white cement, wall care putty, and value-added products; ready-mix concrete; dry mix mortars, such as tile and marble binders, plasters and mortars, industrial and precision grouts, r	3362358820864.0	69.0	277.02	35.21263894845432	17.26452648493617		129572000000.0	150188200000.0	77618400000.0	237550900000.0	766235400000.0	-70.08269225339998	191.66118216110237	1.6768257406920593	41.513546647366255	17.26452648493617	2.4045575002354163	2.077984982051854	매우 불리	안심(>=2)	43.02905296987234	11919.908253714035	4.286161449816572	보류	충분
WIPRO.NS	WIPRO.NS	India Nifty 50	174.47999572753906	-6.963846659985695	-34.02155883020226		-36.010566936147	192.9519992828369	225.95495018005371	N	N	주의	WIPRO LTD	NSI	INR	Technology	Information Technology Services	Information Technology Services	Wipro Limited operates as an information technology (IT), consulting, and business process services company worldwide. It operates through IT Services and IT Products segments. The IT Services segment offers AI-powered IT and IT-enabled services, including digital strategy advisory, customer-centric design, technology and IT consulting, custom application design, development, re-engineering and maintenance, systems integration, package implementation, cloud and infrastructure, business process, 	1830581960704.0	9.74	12.56	0.47200694306988034	5.155220759982337		981695000000.0	1962000000.0	165912000000.0	202910000000.0	885368000000.0	93.3822163998166	12.74471340811086	7.304398051460575	6.456829564309113	5.155220759982337	1.2524836209596648	2.30689390383129	보통	안심(>=2)	18.810441519964677	236.25914549075634	35.40758326226068	보류	충분
ONGC.NS	ONGC.NS	India Nifty 50	240.0	-9.587497094248443	3.052943719775536		-20.371597591197087	273.1124977111816	258.83859992980956	N	N	중립	OIL AND NATURAL GAS CORP.	NSI	INR	Energy	Oil & Gas Integrated	Oil & Gas Integrated	Oil and Natural Gas Corporation Limited, together with its subsidiaries, engages in the exploration, development, production, and distribution of crude oil, natural gas, and value-added products in India and internationally. It operates through Exploration and Production, Refining & Marketing, and Petrochemicals segments. The company engages in the refining and marketing of petroleum products; liquefied natural gas supply; pipelines for transportation of petroleum products; SEZ development; heli	3019267112960.0	7.57	32.94	14.351058725840993	4.110173577502096		887528900000.0	938229200000.0	482321800000.0	1743164900000.0	3717678000000.0	-4.030141077935627	46.68327231719152	19.451363465496467	7.4083224370958005	4.110173577502096	1.8024354196734704	1.576628673586856	보통	양호(>=1.5)	16.72034715500419	550.768235285838	129.4867647024325	보류	충분
NTPC.NS	NTPC.NS	India Nifty 50	357.04998779296875	-4.121913629188311	11.613002377394753		-12.95709966659807	379.11499710083007	355.9725003051758	N	Y	상승전환/양호	NTPC LTD	NSI	INR	Utilities	Utilities - Regulated Electric	Utilities - Regulated Electric	NTPC Limited operates as an integrated power company in India. It operates through two segments: Generation and Others. The company generates power from fossil fuels, hydro, solar, wind, nuclear, and renewable energy sources. It also engages in the coal mining and energy trading business. NTPC Limited was incorporated in 1975 and is based in New Delhi, India.	3462194790400.0	3.11	30.44	15.49820129909496	16.949816418059882		523473900000.0	2076637000000.0	595945000000.0	2710045800000.0	2031756700000.0	-160.17495895357803	7.066377149950866	1.9791002356925502	16.991621115195358	16.949816418059882	1.002466380526159	1.1805710757121746	보통	보통(1~1.5)	42.399632836119764	1290.6448235314856	261.47454632594776	보류	충분
POWERGRID.NS	POWERGRID.NS	India Nifty 50	290.8999938964844	-3.707385627524129	10.419426994705038		-9.348706940043561	297.046248626709	286.4040002441406	N	Y	상승전환/양호	POWER GRID CORP. LTD.	NSI	INR	Utilities	Utilities - Regulated Electric	Utilities - Regulated Electric	Power Grid Corporation of India Limited, an electric power transmission utility, engages in the power transmission business in India and internationally. It operates in three segments: Transmission Services, Telecom Services, and Consultancy Services. As of 31 March 2025, the company owned and operated 180,195 circuit kilometers of transmission lines, and 282 substations with an aggregate transformation capacity of 551,961 mega volt amperes. It also provides telecom services that offer overhead 	2705545494528.0	4.2	20.12	2.6190224618334312	1.0867601620135003		269860400000.0	1210718000000.0	269372100000.0	1480706000000.0	1004940300000.0	-101.16091581902914	3.92605692174576	1.3496242709248156	19.486128713494708	1.0867601620135003	17.930477574179463	0.27130890079527525	매우 불리	불리(<1)	10.673520324027	214.75122891942326	-26.17695653997104	보류	충분
