티커	종목코드	유니버스	현재가	3M수익률(보조,%)	6M수익률(보조,%)	12M수익률(보조,%)	52주고점대비(보조,%)	40일이평(보조)	200일이평(보조)	40일선상회(보조)	200일선상회(보조)	추세판정(보조)	종목명	시장	통화	섹터	산업	업종	사업설명	시가총액	배당수익률(%)	EPS(FY)	EPS Growth 1Y(%)	EPS Growth 3Y CAGR(%)	EPS Growth 5Y CAGR(%)	현금및단기투자	장기부채	단기위험부채	총부채	주주지분	주당순현금(린치식)	주당잉여현금흐름	잉여현금흐름수익률(%)	순현금차감PER(린치식)	사용연성장률(%)	린치PER배수	배당감안점수	린치PER판정	배당감안점수판정	그레이엄적정PER(3년)	그레이엄내재가치(3년)	그레이엄괴리율(3년,%)	종합판정	데이터상태
M&M.NS	M&M.NS	India Nifty 50	3136.89990234375	3.815852560268773	-15.429204582171796		-17.50210438386016	3089.575	3393.8750061035157	Y	N	상승전환/양호	MAHINDRA & MAHINDRA LTD	NSI	INR	Consumer Cyclical	Auto Manufacturers	Auto Manufacturers	Mahindra & Mahindra Limited provides mobility products and farm solutions in India and internationally. It operates through five segments: Automotive; Farm Equipment; Auto Investments; Farm Investments; and Investments in Industrial Businesses and Consumer Services. The company offers commercial vehicles, trucks, buses, vans, passenger cars, utility vehicles, and electric vehicles (EV), as well as motorcycles; aero and defense products; offers construction equipment, such as rotaries, tillers, l	3766670852096.0	1.04	152.1	32.25089140002011	18.47775261729612		1104695000000.0	734699300000.0	561445700000.0	1339631500000.0	930963500000.0	308.1340171096516	17.088395109658443	0.5447542364004273	18.598066306601567	18.47775261729612	1.006511272869452	1.0494506415631015	보통	보통(1~1.5)	45.45550523459224	6913.782346181479	120.40175209339043	보류	충분
TATASTEEL.NS	TATASTEEL.NS	India Nifty 50	189.8000030517578	-3.2126480651062383	5.3976016891770895		-14.168136905553808	203.1785011291504	190.08885032653808	N	N	중립	TATA STEEL LIMITED	NSI	INR	Basic Materials	Steel	Steel	Tata Steel Limited engages in the manufacture and distribution of steel products in India and internationally. It offers reinforcement bars (rebars) and wire rods, cut-and-bend reinforcement bars, welded wire mesh, prefabricated cages (pre-cages), steel couplers and carpet reinforcement; hot-rolled, cold rolled, coated coil, tubes, rebar, wire rods; and metallic coated, pre-finished steels, alloy steels, and profiles and construction systems. The company also provides solutions in building envel	2367156649984.0	2.13	8.65	215.56317625149467	7.205668401450982		152593300000.0	637536700000.0	212027200000.0	923816800000.0	1021676500000.0	-38.88304404652014	16.44135707841275	8.662464074844745	26.437346485350048	7.205668401450982	3.6689651830254144	0.3531242595252226	매우 불리	불리(<1)	22.911336802901964	198.183063345102	4.416786174159415	보류	충분
HCLTECH.NS	HCLTECH.NS	India Nifty 50	1139.0	-18.834179407949	-29.834290288954623		-34.14662256721296	1142.9949981689454	1431.3864978027343	N	N	주의	HCL TECHNOLOGIES LTD	NSI	INR	Technology	Information Technology Services	Information Technology Services	HCL Technologies Limited provides IT and business services, engineering, research and development services, software products, and IP-led offerings. It operates through IT and Business Services, Engineering and R&D Services, and HCL Software segments. The company provides application development, management, modernization, and testing services, as well as commercial applications; automation services, including digital integration, business process management, robotic process automation for intel	3081868148736.0	8.9	61.34	-4.301322599194934	3.8683596866436742		557570000000.0	370000000.0	1220000000.0	52150000000.0	751650000000.0	205.9305398048444	68.56836512920455	6.020049616260277	15.211435608007102	3.8683596866436742	3.9322702230942443	0.8393921530932015	매우 불리	불리(<1)	16.23671937328735	995.9603663574461	-12.558352383016146	보류	충분
TECHM.NS	TECHM.NS	India Nifty 50	1410.0999755859375	-2.7181803666134874	-11.364639264162102		-20.261255591581616	1443.392495727539	1487.0415014648438	N	N	주의	TECH MAHINDRA LIMITED	NSI	INR	Technology	Information Technology Services	Information Technology Services	Tech Mahindra Limited provides information technology services and solutions in India, the Americas, Europe, and internationally. The company offers TechM AppGinieZ, a software development lifecycle acceleration platform; Swifter.io, a software engineering platform; ADMSNXT Reforge, an application modernization platform; Autonomous Operations Center, an AI-powered operations platform; and New Age Delivery Platform for DevSecOps and engineering. It also provides LitmusT, a quality engineering and	1249098072064.0	3.59	54.15	13.157709043866861	-0.14094743522335973		118049000000.0	0.0	696000000.0	21862000000.0	296154000000.0	133.26487280272656	61.821652274019385	4.384203485169957	23.579595619265206	-0.14094743522335973		0.14627276143610646	판정불가	불리(<1)	8.21810512955328	445.0103927653101	-68.44121690163172	보류	일부부족
COALINDIA.NS	COALINDIA.NS	India Nifty 50	438.70001220703125	-4.5370419192200195	9.949877746123125		-8.917259884505235	455.008748626709	423.3984996032715	N	Y	상승전환/양호	COAL INDIA LTD	NSI	INR	Energy	Thermal Coal	Thermal Coal	Coal India Limited, together with its subsidiaries, produces and sells coal and coal products in India. The company offers coking coal for steel making and metallurgical industries, as well as for hard coke manufacturing; semi coking coal for blend-able coal in steel making, merchant coke manufacturing, and other metallurgical industries; and non-coking coal for thermal grade coal for cement, fertilizer, glass, ceramic, paper, chemical, and brick manufacturing, as well as power generation and ot	2703589113856.0	5.01	50.47	-12.42470944167401	-0.706993307310555		1116782200000.0	92323600000.0	45891000000.0	140721800000.0	1191015600000.0	166.23458728687848	49.839873462265636	11.360809682117175	5.3985620154577525	-0.706993307310555		0.7970653445062975	판정불가	불리(<1)	7.08601338537889	357.6310955600726	-18.47935135426908	보류	일부부족
NESTLEIND.NS	NESTLEIND.NS	India Nifty 50	1459.800048828125	20.04934612073397	13.338513107773675		-1.7697279584062309	1416.5249969482422	1299.5545013427734	Y	Y	상승전환/양호	NESTLE INDIA LIMITED	NSI	INR	Consumer Defensive	Packaged Foods	Packaged Foods	Nestlé India Limited engages in the manufacture and sale of food products in India and internationally. It offers milk products and nutrition, including dairy whitener, condensed milk, UHT milk, yogurt, maternal and infant formula, baby foods, health care nutrition; prepared dishes and cooking aids, such as noodles, sauces, seasonings, pasta, cereals, and pet foods; powdered and liquid beverages comprising instant coffee and tea, as well as ready to drink beverages; and confectionery items consi	2814953390080.0	83.0	18.22	34.17959272459547			15759300000.0	224800000.0	7308600000.0	11668500000.0	40102100000.0	8.055999916030286	4.801551232581211	0.32891841841187247	79.67859763513144	34.17959272459547	2.3311745776828725	1.4706533021726942	매우 불리	보통(1~1.5)	8.5	154.87	-89.39101282231604	보류	충분
ADANIENT.NS	ADANIENT.NS	India Nifty 50	3212.10009765625	68.86237935593438	43.4165364863087		0.0	2904.8650085449217	2390.0324615478517	Y	Y	상승전환/양호	ADANI ENTERPRISES LIMITED	NSI	INR	Energy	Thermal Coal	Thermal Coal	Adani Enterprises Limited, together with its subsidiaries, operates in the new energy ecosystem, data center, airports, roads, copper and PVC, and other sectors in India and internationally. It operates through the Integrated Resources Management (IRM), Mining Services, Commercial Mining, New Energy Ecosystem, Airport, Road, copper, and Others segments. The company engages in the integrated ecosystem for manufacturing green hydrogen, including solar cells, modules, and wind turbine generators; c	4406961504256.0	4.0	73.72	31.560360614171003	55.91755566442864		137557900000.0	761661500000.0	105360600000.0	1066217900000.0	809259500000.0	-479.4551230841857	-238.24510806639495	-7.417113440525516	50.075355680146984	55.91755566442864	0.895521184449804	1.196547779852989	헐값	보통(1~1.5)	60.0	4423.2	37.7043014078996	보류	충분
ADANIPORTS.NS	ADANIPORTS.NS	India Nifty 50	1874.199951171875	35.11642881978836	27.513939917622054		-0.477909952918143	1803.5874969482422	1541.6610009765625	Y	Y	상승전환/양호	ADANI PORT & SEZ LTD	NSI	INR	Industrials	Marine Shipping	Marine Shipping	Adani Ports and Special Economic Zone Limited, together with its subsidiaries, develops, operates, and maintains port infrastructure in India and internationally. The company is involved in the operation of ports and terminals, including bulk and break bulk, container, liquid, dry bulk, general, LPG/LNG, and crude cargo; terminal and ports related infrastructure development activities; and development of infrastructure at contiguous Special Economic Zone at Mundra. It also offers logistic servic	4318080008192.0	40.0	58.19	15.45124505175206	34.11377534025834		94579700000.0	502613300000.0	46788100000.0	632361600000.0	961253000000.0	-177.10106067169426	21.857766504498944	1.1662451752190053	35.251778859659204	34.11377534025834	1.0333590612018213	2.102412353013803	보통	안심(>=2)	60.0	3491.3999999999996	86.28748751257534	보류	충분
JSWSTEEL.NS	JSWSTEEL.NS	India Nifty 50	1230.199951171875	8.521522377063096	5.614689182881394		-6.299038137279034	1273.4950042724608	1198.7250030517578	N	Y	상승전환/양호	JSW STEEL LIMITED	NSI	INR	Basic Materials	Steel	Steel	JSW Steel Limited manufactures and sells iron and steel products in India and internationally. The company offers color coated steel products, color-coated roofing sheets, galvalume coil and sheets, aluminum-zinc sheets, galvanized corrugated sheets, tin plate products, lead-free coils and sheets, Al-Zn-Mg coated galvanized steel, multi-utility steel sheets, hot rolled and cold-rolled coils, cold rolled close annealed, electrical, coated steel products, TMT bars, wire rods, alloy steel products,	3002705117184.0	57.99999999999999	91.3	536.8721461187215	75.2799343943875		622520000000.0	756080000000.0	397410000000.0	1191270000000.0	1000530000000.0	-54.71915933908321	43.01001308338541	3.4961806852954713	14.07359376244204	75.2799343943875	0.1869501332016477	9.470213269198473	매우 유망	안심(>=2)	60.0	5478.0	345.2934658940376	매우 유망	충분
CIPLA.NS	CIPLA.NS	India Nifty 50	1458.199951171875	21.425590934045747	-3.5135377450311256		-12.346719609785906	1400.6949981689454	1415.4250018310547	Y	Y	상승전환/양호	CIPLA LTD	NSI	INR	Healthcare	Drug Manufacturers - Specialty & Generic	Drug Manufacturers - Specialty & Generic	Cipla Limited, together with its subsidiaries, manufactures, develops, sells, and distributes pharmaceutical products in India, the United States, South Africa, and internationally. It offers generic and branded generic medicines, vaccines, active pharmaceutical ingredients, and formulations for various therapeutic areas, such as MI, angina, heart disease, pulmonary disease, kidney disorders, alzheimer's disease, hypertension, arrhythmia, lipid abnormalities and diabetes, obesity, central nervou	1178000031744.0	89.0	48.05	-26.42550431292816	11.454373804227448		190380200000.0	1174700000.0	1405000000.0	6137700000.0	344319500000.0	234.21006008531464	10.654391168123082	0.7306536500402935	25.473254757264527	11.454373804227448	2.2238888997898036	3.943523305579143	매우 불리	안심(>=2)	31.408747608454895	1509.1903225862577	3.4968024360036765	보류	충분
DRREDDY.NS	DRREDDY.NS	India Nifty 50	1374.0999755859375	12.83461327729607	8.077705615839136		-0.11630265630049319	1304.7449951171875	1267.8064996337891	Y	Y	상승전환/양호	DR. REDDY S LABORATORIES	NSI	INR	Healthcare	Drug Manufacturers - Specialty & Generic	Drug Manufacturers - Specialty & Generic	Dr. Reddy's Laboratories Limited, together with its subsidiaries, operates as an integrated pharmaceutical company North America, Europe, India, Russia, and internationally. The company operates through Global Generics, Pharmaceutical Services and Active Ingredients (PSAI), and Others segment. Its Global Generics segment manufactures and markets prescription and over-the-counter finished pharmaceutical products that are marketed under a brand name or as a generic finished dosages with therapeuti	1144227102720.0	59.0	51.41	-24.21830786644029	-1.6674294475082507		160260000000.0	12203000000.0	62934000000.0	77341000000.0	377063000000.0	177.8013474014925	22.012459376249403	1.6019547170767505	23.26976518545896	-1.6674294475082507		2.46382247932258	판정불가	안심(>=2)	5.1651411049834985	265.53990420720163	-80.67535776689238	보류	일부부족
GRASIM.NS	GRASIM.NS	India Nifty 50	3180.89990234375	21.668452461773178	12.439020938273249		0.0	3092.252508544922	2849.1694995117186	Y	Y	상승전환/양호	GRASIM INDUSTRIES LTD	NSI	INR	Basic Materials	Building Materials	Building Materials	Grasim Industries Limited, together with its subsidiaries, primarily produces cellulosic fibres, diversified chemicals, fashion yarns, and fabrics in india and internationally. The company operates through Cellulosic Fibres, Chemicals, Building Materials, Financial Services, and Others segments. It offers cellulosic staple fibre; and cellulosic fashion yarn; chlor-alkali comprising caustic soda; chlorine derivatives, and specialty chemicals, that include epoxy polymers and curing agents. The com	2157199753216.0	32.0	73.21	34.02344508970015	-10.06389336340252		719038100000.0	1568286200000.0	681192000000.0	2278530600000.0	1034699200000.0	-1252.3666261398396	-493.0715214428983	-15.501007154597774	60.55547778286559	-10.06389336340252		0.362248097773318	판정불가	불리(<1)	0.0	0.0	-100.0	보류	일부부족
HINDALCO.NS	HINDALCO.NS	India Nifty 50	953.2000122070312	2.7764299596830355	7.4997179524650015		-17.091410568866582	1046.7975036621094	917.785252380371	N	Y	상승전환/양호	HINDALCO  INDUSTRIES  LTD	NSI	INR	Basic Materials	Aluminum	Aluminum	Hindalco Industries Limited, together with its subsidiaries, manufactures and distributes aluminum and copper products in India, the United States, Brazil, South Korea, the United Kingdom, Germany, China, and internationally. It operates through Novelis, Aluminium Upstream, Aluminium Downstream, and Copper segments. The company offers primary aluminum, such as ingots, wirerods, primary foundry alloys, and billets; flat rolled products, including building and pattern sheets, PCB entry and cold-ro	2131501121536.0	53.0	60.18	-16.311480532466717	9.86859005895193		416180000000.0	755950000000.0	210640000000.0	991610000000.0	1365830000000.0	-151.94397181036086	-88.75062732284844	-9.310808454288203	18.36397447685929	9.86859005895193	1.8608508781050321	3.4234740490504136	보통	안심(>=2)	28.23718011790386	1699.3134994954544	78.27459900686303	보류	충분
HEROMOTOCO.NS	HEROMOTOCO.NS	India Nifty 50	4852.60009765625	-4.916232043573043	-15.914051331549995		-23.587117586705773	4943.7025146484375	5435.9530029296875	N	N	주의	HERO MOTOCORP LIMITED	NSI	INR	Consumer Cyclical	Auto Manufacturers	Auto Manufacturers	Hero MotoCorp Limited primarily engages in the manufacture and sale of motorised two wheelers in India, Asia, Central and Latin America, Africa, and the Middle East. The company offers motorcycles and scooters, as well as electric scooters. It provides engines, parts, and accessories, as well as non-banking financial and other related services. The company is also involved in merchandise business. The company was formerly known as Hero Honda Motors Ltd. and changed its name to Hero MotoCorp Limi	970971021312.0	3.8	286.67	31.1352341451828	26.895886141440116		254871500000.0	0.0	4985500000.0	7786100000.0	216111900000.0	1273.7655938661862	360.55845209289697	7.430211532721243	12.484161243904362	26.895886141440116	0.46416619918201024	2.4587864207880195	매우 유망	안심(>=2)	60.0	17200.2	254.4532756430413	매우 유망	충분
BPCL.NS	BPCL.NS	India Nifty 50	308.1499938964844	10.566910799980999	-19.752605756123863		-20.641255837282756	300.1150016784668	335.2957504272461	Y	N	상승전환/양호	BHARAT PETROLEUM CORP  LT	NSI	INR	Energy	Oil & Gas Refining & Marketing	Oil & Gas Refining & Marketing	Bharat Petroleum Corporation Limited engages in refining crude oil and marketing petroleum products in India and internationally. It operates through two segments, Downstream Petroleum; and Exploration and Production of Hydrocarbons. The company operates fuel stations that sell motor spirits, high-speed diesel, blended fuels, compressed and liquefied natural gas, automotive liquefied petroleum gas (LPG), and lubricants; operate convenience stores, restaurants, and electric vehicle charging facil	1316597006336.0	6.44	60.48	93.77912578590414	129.7482877705289		455243700000.0	222031700000.0	212787400000.0	544244200000.0	1001702600000.0	54.58335103397644	73.36114067795111	23.80695834204528	4.192570153149933	129.7482877705289	0.03231310582352236	32.48324602707216	매우 유망	안심(>=2)	60.0	3628.7999999999997	1077.6083309672265	매우 유망	충분
EICHERMOT.NS	EICHERMOT.NS	India Nifty 50	7339.5	11.271983020012133	0.36923076923076614		-10.384615384615381	7257.6875	7188.3325	Y	Y	상승전환/양호	EICHER MOTORS LTD	NSI	INR	Consumer Cyclical	Auto Manufacturers	Auto Manufacturers	Eicher Motors Limited, an automobile company, engages in the manufacture and sale of motorcycles and commercial vehicles in India and internationally. The company designs, develops, manufactures, assembles, and sells two-wheelers, as well as related parts and accessories; motorcycle accessories; protective and performance gears, and riding apparel products for men and women; and lifestyle apparel products and accessories. It also owns the Royal Enfield motorcycle brand that offers Classic 350, B	2014674681856.0	97.0	200.83	16.491707572595704	23.697524323492836		119936500000.0	2016300000.0	1173800000.0	5139500000.0	251001500000.0	429.5856505521197	128.58330637802095	1.7519355048439396	34.40678359531883	23.697524323492836	1.4519146863459165	3.507957202367332	보통	안심(>=2)	55.89504864698567	11225.402619774133	52.94505919714059	보류	충분
APOLLOHOSP.NS	APOLLOHOSP.NS	India Nifty 50	8893.5	21.537410317731464	27.231759656652365		0.0	8346.15	7638.3675	Y	Y	상승전환/양호	APOLLO HOSPITALS ENTER. L	NSI	INR	Healthcare	Medical Care Facilities	Medical Care Facilities	Apollo Hospitals Enterprise Limited, together with its subsidiaries, provides healthcare services in India. It operates through Healthcare Services, Retail Health & Diagnostics, Digital Health & Pharmacy Distribution, and Others segments. The company's healthcare facilities comprise primary, secondary, and tertiary care, as well as specialty facilities. It offers services in cardiac sciences, oncology, neurosciences, gastroenterology, orthopedics, urology, organ transplantation, pulmonology, obs	1278748786688.0	23.0	134.79	34.290061553357766	33.336300616284454		38725000000.0	24301000000.0	32284000000.0	84929000000.0	94801000000.0	100.31668399779261	62.15544959014647	0.69888626064144	65.23616971587067	33.336300616284454	1.9569108902264774	0.8635746222019369	보통	불리(<1)	60.0	8087.4	-9.06392308989712	보류	충분
BRITANNIA.NS	BRITANNIA.NS	India Nifty 50	5379.0	-2.8184281842818404	-10.81081081081081		-14.625823347353384	5248.4375	5760.0675	Y	N	주의	BRITANNIA INDUSTRIES LTD	NSI	INR	Consumer Defensive	Packaged Foods	Packaged Foods	Britannia Industries Limited manufactures and sells various food products in India and internationally. The company offers biscuits under the Good Day, Marie Gold, NutriChoice, Milk Bikis, Tiger, 50-50, Jim Jam, Britannia Bourbon, Little Hearts, Treat, Pure Magic, Nice Time, and Biscafe brand names; cakes under the Muffills, Fudge It, Gobbles, Layerz, Tiffin Fun, Rollyo, and Nut & Raisin Romance Cake brand names; rusks under the Toastea brand; center filled croissants under the Treat Croissant b	1295630467072.0	1.68	105.33	16.2828803936238	2.9516551243742306		50909800000.0	2861100000.0	10717200000.0	13802800000.0	51065600000.0	199.48121358404097	99.88985848100158	1.8570339929541102	49.1742028521405	2.9516551243742306	16.659874131658842	0.09418871798086746	매우 불리	불리(<1)	14.403310248748461	1517.1006685006753	-71.79586041084448	보류	충분
BAJAJ-AUTO.NS	BAJAJ-AUTO.NS	India Nifty 50	9785.5	9.426894045289359	4.736166113667983		-9.464773095249113	10205.8	9476.1125	N	Y	상승전환/양호	BAJAJ AUTO LIMITED	NSI	INR	Consumer Cyclical	Auto Manufacturers	Auto Manufacturers	Bajaj Auto Limited, together with its subsidiaries, engages in the development, manufacture, and distribution of automobiles in India and internationally. The company offers motorcycles, bikes, commercial vehicles, electric two-wheelers, and three-wheeler, as well as related parts and accessories. It also provides financing services for automobiles, as well as exports its products. The company was founded in 1945 and is based in Pune, India.	2732813713408.0	1.52	384.42	46.68404159607249	21.03071664453431		191971900000.0	153389400000.0	66416500000.0	226398500000.0	388319900000.0	138.15397493164838	67.11312956259701	0.6858426198211335	25.095848356142632	21.03071664453431	1.1932949685128686	0.8985835555152548	보통	불리(<1)	50.56143328906862	19436.826184983758	98.62885069729455	보류	충분
TATACONSUM.NS	TATACONSUM.NS	India Nifty 50	1116.699951171875	5.828279268938541	-6.317118190278947		-12.140051048632971	1153.332504272461	1144.9824975585936	N	N	주의	TATA CONSUMER PRODUCT LTD	NSI	INR	Consumer Defensive	Packaged Foods	Packaged Foods	Tata Consumer Products Limited, together with its subsidiaries, manufactures, distributes, and trades in food products in India, the United States, the United Kingdom, and internationally. It operates through Branded Business and Non Branded Business segments. The company provides tea, coffee, water, salt, pulses, spices, snacks, ready-to-eat packaged and processed food products, ready to cook, ready to drink beverages, breakfast cereals, sauces, instant masala noodles, meal solutions, staples, 	1105136844800.0	90.0	15.61	20.63638567975783	8.611325596691376		55932700000.0	3021400000.0	18181700000.0	28195100000.0	217875300000.0	53.46491486482811	19.939265753150654	1.7855526663385457	68.11243025669742	8.611325596691376	7.909633597278847	1.4477728253866706	매우 불리	보통(1~1.5)	25.722651193382752	401.53058512870473	-64.04310892041009	보류	충분
DIVISLAB.NS	DIVISLAB.NS	India Nifty 50	6757.0	15.376077862204385	6.233786651992768		-3.243359347032293	6710.3	6382.9525	Y	Y	상승전환/양호	DIVI S LABORATORIES LTD	NSI	INR	Healthcare	Drug Manufacturers - Specialty & Generic	Drug Manufacturers - Specialty & Generic	Divi's Laboratories Limited engages in the manufacture and sale of generic active pharmaceutical ingredients (APIs), intermediates, and nutraceuticals in India, North America, Asia, Europe, and internationally. The company also undertakes custom synthesis contract manufacturing services of APIs and intermediates; and supplies a range of carotenoids, such as beta carotene, astaxanthin, lycopene, and canthaxanthin, as well as lutein and vitamins used in the food, beverage, dietary supplement, pet 	1793771175936.0	45.0	96.9	17.206754906435417	12.078780055201644		67160000000.0	0.0	0.0	70000000.0	167610000000.0	252.98662463181142	8.211894605380419	0.1215316650196895	67.12088106675117	12.078780055201644	5.5569255140005644	0.8503878248921862	매우 불리	불리(<1)	32.65756011040329	3164.517574698079	-53.16682588873643	보류	충분
INDUSINDBK.NS	INDUSINDBK.NS	India Nifty 50	974.3499755859375	23.931564545608317	12.74588773698353		0.0	915.9075012207031	860.7310018920898	Y	Y	상승전환/양호	INDUSIND BANK LIMITED	NSI	INR	Financial Services	Banks - Regional	Banks - Regional	IndusInd Bank Limited provides various banking products and financial services to individuals, corporations, government entities, and public sector undertakings in India. It operates in four segments: Treasury, Corporate/Wholesale Banking, Retail Banking, and Other Banking Operations. The company offers savings, salary, RFC, and uniformed personnel accounts; current accounts comprising smart, everyday, premium, trade, startup, and specialized accounts; fixed, recurring, sweep in/out, senior citi	759147986944.0	16.0	11.42	-65.46976556372644	-50.74727610509653		489323500000.0	0.0	0.0	427891900000.0	657396300000.0	628.0361064836869	3.8630130645566805	0.3964707919486127	30.325207452035954	-50.74727610509653		-1.1458215466474473	판정불가	불리(<1)	0.0	0.0	-100.0	보류	일부부족
SHRIRAMFIN.NS	SHRIRAMFIN.NS	India Nifty 50	1063.5999755859375	14.612066334691542	6.765705937865318		-3.7117509420776074	964.9512542724609	909.9350003051758	Y	Y	상승전환/양호	SHRIRAM FINANCE LIMITED	NSI	INR	Financial Services	Credit Services	Credit Services	Shriram Finance Limited, a non-banking finance company, provides financing services in India. It offers fixed and recurring deposits; commercial vehicle loans for commercial goods vehicles, passenger commercial vehicles, tractors and farm equipment, and construction equipment; two-wheeler, gold, used car loan, and personal loans; and green finance services. The company also provides business loans, such as MSME loans; working capital loans, including tyre, tax, fuel, toll financing, repair/top-u	2502560579584.0	1.29	53.23	4.923056955228389	18.58582810449043		61850800000.0	0.0	0.0	1819935600000.0	659185900000.0	26.286881011544928	-57.28073163206761	-5.3855521762786465	19.487377316821203	18.58582810449043	1.0485073469560902	1.0199334564807714	보통	보통(1~1.5)	45.67165620898086	2431.102260004051	128.5729894516739	보류	충분
