티커	종목코드	유니버스	현재가	3M수익률(보조,%)	6M수익률(보조,%)	12M수익률(보조,%)	52주고점대비(보조,%)	40일이평(보조)	200일이평(보조)	40일선상회(보조)	200일선상회(보조)	추세판정(보조)	종목명	시장	통화	섹터	산업	업종	사업설명	시가총액	배당수익률(%)	EPS(FY)	EPS Growth 1Y(%)	EPS Growth 3Y CAGR(%)	EPS Growth 5Y CAGR(%)	현금및단기투자	장기부채	단기위험부채	총부채	주주지분	주당순현금(린치식)	주당잉여현금흐름	잉여현금흐름수익률(%)	순현금차감PER(린치식)	사용연성장률(%)	린치PER배수	배당감안점수	린치PER판정	배당감안점수판정	그레이엄적정PER(3년)	그레이엄내재가치(3년)	그레이엄괴리율(3년,%)	종합판정	데이터상태
RELIANCE.NS	RELIANCE.NS	India Nifty 50	1336.4000244140625	-8.371612998693001	-10.512923358334557		-16.07109317131502	1377.2725067138672	1431.5185040283204	N	N	주의	RELIANCE INDUSTRIES LTD	NSI	INR	Energy	Oil & Gas Refining & Marketing	Oil & Gas Refining & Marketing	Reliance Industries Limited engages in the hydrocarbon exploration and production, oil and chemicals, retail, and digital service businesses worldwide. It operates through Oil to Chemicals, Oil and Gas, Retail, Digital Services, and Others segments. The company offers refining and marketing products, including liquefied petroleum gas, propylene, naphtha, gasoline, jet/aviation turbine fuel, kerosine oil, diesel, sulphur, and petroleum coke. It also provides polymers, including high-density and l	18084796563456.0	40.0	59.65	15.976050999310809	6.58907750634663		4566910000000.0	2707510000000.0	1036700000000.0	3980000000000.0	9040300000000.0	137.40282727993878	51.134040224211695	3.826252565853637	20.10053976754608	6.58907750634663	3.0505848122419486	2.3178023100438523	매우 불리	안심(>=2)	21.67815501269326	1293.101946507153	-3.239904004483496	보류	충분
TCS.NS	TCS.NS	India Nifty 50	2264.0	-24.143941368296662	-25.697407285854933		-36.758008275098256	2443.6674865722657	2917.1809912109375	N	N	주의	TATA CONSULTANCY SERV LT	NSI	INR	Technology	Information Technology Services	Information Technology Services	Tata Consultancy Services Limited provides information technology (IT) and IT enabled services in the Americas, Europe, India, and internationally. The company provides TCS ADD, a suite of AI powered life sciences platforms; TCS BaNCS, a financial services platform; TCS BFSI Platforms, a cloud-native, as-a-service digital ecosystem for insurers and financial firms; TCS Chroma, a cloud-based human resource management system platform; TCS Customer Intelligence & Insights, an AI-driven customer ana	8191349882880.0	5.52	136.11	1.3531604638230332	5.300128040832486		906050000000.0	0.0	18300000000.0	112830000000.0	1072400000000.0	250.42235586961277	132.40973238392516	5.848486412717543	14.793752436488038	5.300128040832486	2.7912066128433377	0.7313984796815438	매우 불리	불리(<1)	19.100256081664973	2599.73585527542	14.82932222947968	보류	충분
HDFCBANK.NS	HDFCBANK.NS	India Nifty 50	767.5	-17.68554484087329	-22.607644393194416		-24.227467518921266	782.5825012207031	927.4882489013672	N	N	주의	HDFC BANK LTD	NSI	INR	Financial Services	Banks - Regional	Banks - Regional	HDFC Bank Limited provides banking and financial products and services to individuals and businesses in India, Bahrain, Hong Kong, Singapore, and Dubai. The company operates through Treasury, Retail Banking, Wholesale Banking, Other Banking Business, Insurance Business, and Other segments. It offers savings, salary, current, rural, public provident fund, pension, and demat accounts; fixed and recurring deposits; and safe deposit lockers, as well as offshore accounts and deposits, and overdrafts 	11815990853632.0	1.69	44.79	8.166893276325982	20.388517319859577		9196249400000.0	5866163200000.0	1306013100000.0	7326106100000.0	7676891400000.0	216.30357574058897	73.34775461011954	9.556710698386912	12.306238541179082	20.388517319859577	0.6035867320863055	1.7940914476816403	헐값	양호(>=1.5)	49.277034639719155	2207.1183815130207	187.57242755869976	양호	충분
ICICIBANK.NS	ICICIBANK.NS	India Nifty 50	1244.5	-11.517952364024175	-8.378123002079407		-16.397956441578987	1280.8650024414062	1366.1405023193358	N	N	주의	ICICI BANK LTD.	NSI	INR	Financial Services	Banks - Regional	Banks - Regional	ICICI Bank Limited, together with its subsidiaries, engages in the provision of various banking and financial services to retail and corporate customers in India and internationally. The company operates through Retail Banking, Wholesale Banking, Treasury, Other Banking, Life Insurance, General Insurance, and Others segments. It offers savings, salary, pension, current, trade, escrow, foreign currency, and vostro accounts, as well as time, fixed, recurring, and security deposits. The company als	8921205964800.0	88.0	74.76	6.22878665548352	16.78079563417647		2649807200000.0	2202642800000.0	226221340000.0	2202642800000.0	3630604100000.0	62.37901769698852	88.7150191210977	7.1285672254799275	15.812212176337766	16.78079563417647	0.9422802423106776	6.626574097644352	헐값	안심(>=2)	42.06159126835294	3144.5245632220663	152.67372946742194	양호	충분
INFY.NS	INFY.NS	India Nifty 50	1119.0	-25.290428393596144	-26.877085258089807		-33.779147374505904	1234.417495727539	1452.387000732422	N	N	주의	INFOSYS LIMITED	NSI	INR	Technology	Information Technology Services	Information Technology Services	Infosys Limited provides consulting, technology, outsourcing, and digital services worldwide. It provides digital marketing and digital workplace, digital commerce, digital experience and interactions, and metaverse; data analytics and AI, applied AI, generative AI, and sustainability; blockchain, engineering, and Internet of Things; enterprise agile DevOps, API economy and microservices, application modernization, cloud, digital process automation, digital supply chain, Microsoft business appli	4528601563136.0	4.57	76.54	4.9081697276757374	3.582523363792678		5163000000.0	0.0	333000000.0	967000000.0	9786000000.0	1.2757573468626915	0.9224098732981653	0.0824316240659665	14.603138785643287	3.582523363792678	4.07621592457209	0.5582719909371558	매우 불리	불리(<1)	15.665046727585356	1199.0026765293833	7.149479582607987	보류	충분
BHARTIARTL.NS	BHARTIARTL.NS	India Nifty 50	1905.4000244140625	-5.265252416006483	-6.703227789306276		-11.897162462060107	1833.7150024414063	1959.2595043945312	Y	N	주의	BHARTI AIRTEL LIMITED	NSI	INR	Communication Services	Telecom Services	Telecom Services	Bharti Airtel Limited operates as a telecommunications company in India and internationally. It operates through the Mobile Services India, Mobile Services Africa, Mobile Services South Asia, Airtel Business, Passive Tower Infrastructure Services, Homes Services, Digital TV Services, and Others segments. The company provides voice and data telecom services through wireless technology including 2G/3G/4G/5G services; passive infrastructure service, including the setup, operation, and maintenance o	11606690889728.0	85.0	44.45	349.3919914289541	99.0493242072451		588040000000.0	1048638000000.0	434485000000.0	2136421000000.0	1136719000000.0	-75.62517343931407	96.30068650134565	5.054092855433834	44.56749601469913	99.0493242072451	0.4499525501198642	4.12967612419918	매우 유망	안심(>=2)	60.0	2667.0	39.97060805224564	매우 유망	충분
SBIN.NS	SBIN.NS	India Nifty 50	963.2000122070312	-15.811552070548773	1.0385004238783857		-21.55074328866834	1051.4199996948241	976.2207482910156	N	N	중립	STATE BANK OF INDIA	NSI	INR	Financial Services	Banks - Regional	Banks - Regional	State Bank of India provides banking products and services in India and internationally. It operates through the Treasury, Corporate/Wholesale Banking, Retail Banking, and Other Banking Business segments. The company offers personal banking products and services, including current, savings, salary, and deposit accounts; home, personal, pension, auto, education, and gold loans, as well as loans against insurance policies, property, and securities; debit, business debit, prepaid, and green remit c	8890931478528.0	1.77	91.13	15.61708749415689	29.913474259585037		6208491788000.0	0.0	0.0	6181254399000.0	4870367587000.0	672.5976599243335	46.42058898094622	4.819413246744076	3.1888769042323912	29.913474259585037	0.10660336129998654	9.93562160318374	매우 유망	안심(>=2)	60.0	5467.799999999999	467.67025858641125	매우 유망	충분
ITC.NS	ITC.NS	India Nifty 50	309.45001220703125	-3.7181026497784986	-23.94002517765791		-30.13095134985334	303.05625381469724	365.0320004272461	Y	N	주의	ITC LTD	NSI	INR	Consumer Defensive	Tobacco	Tobacco	ITC Limited engages in the fast-moving consumer goods, paperboards, paper and packaging, and agri businesses in India and internationally. The company offers cigarettes and cigars; foods, including staples, spices, biscuits, confectionery and gums, snacks, noodles and pasta, beverages, dairy products, ready-to-eat meals, chocolates, coffee, and frozen foods; personal care products; education and stationery, such as balls, gels and roller pens, mechanical pencils, geometry boxes, erasers, sharpen	3877244239872.0	4.67	16.25	69.83725324774987	31.6085110433352		394500400000.0	0.0	915600000.0	2848400000.0	700300500000.0	31.48580552077542	12.249793620151923	3.9585694415666874	17.105489642231127	31.6085110433352	0.541167207110121	2.1208694870545237	헐값	안심(>=2)	60.0	975.0	215.07512087208966	양호	충분
LT.NS	LT.NS	India Nifty 50	3909.0	-6.236507555768767	-1.163084702907713		-11.523054851706993	3863.282501220703	3871.963504638672	Y	Y	상승전환/양호	LARSEN & TOUBRO LTD.	NSI	INR	Industrials	Engineering & Construction	Engineering & Construction	Larsen & Toubro Limited engages in engineering, procurement, and construction projects (EPC) in India and internationally. The Infrastructure Projects segment is involved in the engineering and construction of building and factories, transportation infrastructure, heavy civil infrastructure, power transmission and distribution, water and effluent treatment, and minerals and metals. The Energy Projects segment provides EPC solutions in oil & gas, refineries, petrochemicals & offshore wind energy 	5377487273984.0	96.0	117.03	6.96197607119986	15.382271021915606		1607804000000.0	637385900000.0	579444300000.0	1254966000000.0	1092898000000.0	705.4158266194269	86.73443386661012	2.2188394440166315	27.374042325733345	15.382271021915606	1.779583930534879	4.0689011033350075	보통	안심(>=2)	39.26454204383121	4595.129355389567	17.55255449960518	보류	충분
HINDUNILVR.NS	HINDUNILVR.NS	India Nifty 50	2272.199951171875	-7.393223804386606	-6.397530332775492		-15.613166873547568	2204.7274963378904	2392.734001464844	Y	N	주의	HINDUSTAN UNILEVER LTD.	NSI	INR	Consumer Defensive	Household & Personal Products	Household & Personal Products	Hindustan Unilever Limited, a consumer good company, manufactures and sells food, home care, personal care, and refreshment products in India and internationally. It operates through the Home Care, Beauty and Wellbeing, Personal Care, Foods, and Other segments. The Home Care segment offers detergent bars, detergent powders, detergent liquids, and scourers. Its Beauty and Wellbeing segment provides skin care and hair care products. The Personal Care segment offers skin cleansing, oral care, and d	5338741342208.0	1.96	45.2	41.233918677810124	14.118426432640984		163650000000.0	0.0	0.0	14780000000.0	487390000000.0	69.65041224263797	41.01990059239503	1.8052944931734216	48.72897210020435	14.118426432640984	3.451444984516532	0.32995619935462495	매우 불리	불리(<1)	36.73685286528197	1660.505749510745	-26.92079107499549	보류	충분
BAJFINANCE.NS	BAJFINANCE.NS	India Nifty 50	910.4500122070312	-5.711471082571284	-9.425984764163065		-16.789289229820746	899.442495727539	961.9422491455078	Y	N	주의	BAJAJ FINANCE LIMITED	NSI	INR	Financial Services	Credit Services	Credit Services	Bajaj Finance Limited operates as a deposit-taking non-banking financial company in India. The company offers financing for various products, such as consumer electronics, furniture, digital products, e-commerce purchases, retail spends, and two and three-wheelers; and personal, unsecured, home, and secured, gold, and car loans. It also provides secured and unsecured loans to micro, small, and medium enterprises, SMEs, and professionals; loans against property, mutual funds, insurance policies, 	5661065740288.0	59.0	30.47	14.302174203110752	18.22815698685951		157553200000.0	0.0	0.0	3665797400000.0	1139990200000.0	25.338747747008906	-107.35321256476016	-11.791225341908023	29.048613864785768	18.22815698685951	1.5936122278147271	2.658583206287839	보통	안심(>=2)	44.95631397371902	1369.8188867792185	50.455145083542405	보류	충분
KOTAKBANK.NS	KOTAKBANK.NS	India Nifty 50	387.04998779296875	-9.841602888741562	-7.266763317605374		-13.190238974287372	373.68249740600584	407.16680099487303	Y	N	주의	KOTAK MAHINDRA BANK LTD	NSI	INR	Financial Services	Banks - Regional	Banks - Regional	Kotak Mahindra Bank Limited provides a range of banking and financial services to corporate and individual customers in India. It operates through Treasury, BMU, and Corporate Centre; Retail Banking; Corporate/Wholesale Banking; Vehicle Financing; Other Lending Activities; Broking; Advisory and Transactional Services; Asset Management; and Insurance segments. The company offers savings, current, retail institution, corporate, and salary accounts; NRE and NRO fixed deposits and foreign currency n	3849779150848.0	13.0	19.39	-12.826996667719726	8.923946239014779		1020911100000.0	0.0	0.0	953935300000.0	1812261700000.0	102.64059694896929	40.88745117429887	10.563868353916439	14.667838620113432	8.923946239014779	1.6436493707219813	1.494695081315616	보통	보통(1~1.5)	26.347892478029557	510.8856351489931	31.994742607320138	보류	충분
AXISBANK.NS	AXISBANK.NS	India Nifty 50	1244.800048828125	-8.247947694484282	1.8241348734662655		-11.275834010825015	1278.0449920654296	1231.2584997558595	N	Y	상승전환/양호	AXIS BANK LIMITED	NSI	INR	Financial Services	Banks - Regional	Banks - Regional	Axis Bank Limited provides various financial products and services in India and internationally. The company operates through four segments: Treasury, Retail Banking, Corporate/Wholesale Banking, and Other Banking Business. It provides fixed, recurring, and safe deposits; and saving, salary, current, safe custody, pension disbursement, and demat and trading accounts. The company also offers home, personal, business, car, two-wheeler, commercial vehicle construction equipment, education, gold, tr	3870515265536.0	8.0	84.43	-5.953496528796354	34.605620932767664		1093515700000.0	0.0	0.0	2805108200000.0	2150353500000.0	351.6865991042724	-34.88420469290292	-2.8023942259436345	10.578152904463492	34.605620932767664	0.30567730384075154	4.027699478118723	매우 유망	안심(>=2)	60.0	5065.8	306.95692491087436	보류	충분
ASIANPAINT.NS	ASIANPAINT.NS	India Nifty 50	2605.60009765625	8.856951510303857	-1.94188824566508		-12.2250261864157	2389.485009765625	2531.100002441406	Y	Y	상승전환/양호	ASIAN PAINTS LIMITED	NSI	INR	Basic Materials	Specialty Chemicals	Specialty Chemicals	Asian Paints Limited, together with its subsidiaries, engages in the manufacture, distribution, and sale of paints, coatings, and products related to home decoration and bath fittings in India, Asia, the Middle East, Africa, and the South Pacific region. The company offers wall coverings; waterproofing products; adhesives; and bath fittings and sanitaryware, modular kitchens and wardrobes, fabric, furnishings and rugs, decorative lightings, unplasticized polyvinyl chloride windows and door syste	2497843560448.0	96.0	40.12	-32.837444576510514	6.562551277275386		89298600000.0	2596200000.0	6041300000.0	22902900000.0	193998100000.0	90.4427225533116	27.057898466917806	1.0384516983729206	62.69086179219687	6.562551277275386	9.552818582809552	1.6360048074828244	매우 불리	양호(>=1.5)	21.62510255455077	867.5991144885769	-66.70252218408395	보류	충분
MARUTI.NS	MARUTI.NS	India Nifty 50	13221.0	-12.709626303974641	-15.493767976989458		-23.54267869535045	13121.425	14859.2	Y	N	주의	MARUTI SUZUKI INDIA LTD.	NSI	INR	Consumer Cyclical	Auto Manufacturers	Auto Manufacturers	Maruti Suzuki India Limited manufactures, purchases, and sells motor vehicles, components, and spare parts in India. The company offers passenger vehicles, utility vehicles, and multi-purpose vehicles. It is also involved in the facilitation of pre-owned car sales, fleet management, and car financing activities. In addition, the company offers driving school, insurance, accessories, and financing products and services. It also exports its products to South Africa, Saudi Arabia, Chile, Japan, Mex	4156716220416.0	1.07	466.78	1.2365346684873213	21.109694032148575		346247000000.0	0.0	0.0	1025000000.0	1071563000000.0	1101.2855130123712	276.7884463948441	2.0935515195132295	25.964511090851428	21.109694032148575	1.2299804559606269	0.8542311447552567	보통	불리(<1)	50.71938806429715	23674.795960652624	79.06963134901008	보류	충분
SUNPHARMA.NS	SUNPHARMA.NS	India Nifty 50	1878.199951171875	9.977743147429742	9.445835201448038		0.0	1755.8099975585938	1707.887998046875	Y	Y	상승전환/양호	SUN PHARMACEUTICAL IND L	NSI	INR	Healthcare	Drug Manufacturers - Specialty & Generic	Drug Manufacturers - Specialty & Generic	Sun Pharmaceutical Industries Limited, a generic pharmaceutical company, develops, manufactures, and markets branded and generic formulations, and active pharmaceutical ingredients (APIs) in India, the United States, and internationally. The company offers formulations in various therapeutic areas, including neuropsychiatry, cardiology, diabetes, gastroenterology, pain/analgesics, gynecology, ophthalmology, urology, dermatology, respiratory, anti-infectives, oncology, psychiatry, neurology, orth	4506430472192.0	89.0	45.46	14.124961624329856	49.47111675709046		423665100000.0	25200000.0	18671100000.0	23621900000.0	722180200000.0	176.56555057837548	49.77841839232644	2.6503258271978942	37.43146503725252	49.47111675709046	0.7566327079504961	3.6993239943796303	헐값	안심(>=2)	60.0	2727.6	45.22415455809987	양호	충분
TITAN.NS	TITAN.NS	India Nifty 50	4169.10009765625	-2.342414038380136	9.356316347957394		-7.883510735682209	4277.055023193359	3916.451511230469	N	Y	상승전환/양호	TITAN COMPANY LIMITED	NSI	INR	Consumer Cyclical	Luxury Goods	Luxury Goods	Titan Company Limited, together with its subsidiaries, manufactures and sells watches, jewelry, eyewear, and other accessories and products in India and internationally. It operates through four segments: Watches and Wearables, Jewellery, Eyecare, and Others. The company designs, manufactures, and retails watches and wearables under the Nebula, Titan, Titan Clocks, Zoop, Titan Octane, Raga, Xylys, Edge, Fastrack, Sonata, Titan Smart, Fastrack smart, SF, Titan World, and Helios brands; jewellery 	3698180489216.0	27.0	57.07	52.02277494755769	16.0006707482786		88030000000.0	930000000.0	273550000000.0	306210000000.0	157030000000.0	98.19115655947476	52.84961446048424	1.267650409501916	71.3318545837879	16.0006707482786	4.458054021982922	0.6028256379871507	매우 불리	불리(<1)	40.5013414965572	2311.4115592085195	-44.55850171340502	보류	충분
ULTRACEMCO.NS	ULTRACEMCO.NS	India Nifty 50	11487.0	-11.794517392305925	-2.858350951374211		-11.990499540300338	11507.225	12052.845	N	N	주의	ULTRATECH CEMENT LIMITED	NSI	INR	Basic Materials	Building Materials	Building Materials	UltraTech Cement Limited, together with its subsidiaries, engages in the manufacture and sale of clinker, cement, ready mix concrete, and related products in India, the United Arab Emirates, Bahrain, and Sri Lanka. The company offers ordinary Portland, Portland pozzolana, composite, Weather Plus, and Portland slag; white cement, wall care putty, and value-added products; ready-mix concrete; dry mix mortars, such as tile and marble binders, plasters and mortars, industrial and precision grouts, r	3379126599680.0	66.0	277.1	35.21263894845432	17.26452648493617		129572000000.0	150188200000.0	77618400000.0	237550900000.0	766235400000.0	-70.08269225339998	191.66118216110237	1.668505111526964	41.707263414844455	17.26452648493617	2.4157780088110337	1.9964034958788652	매우 불리	양호(>=1.5)	43.02905296987234	11923.350577951625	3.7986469744200058	보류	충분
WIPRO.NS	WIPRO.NS	India Nifty 50	190.0	-17.915929062946745	-21.38690136921888		-30.318703691869064	197.6389995574951	233.84530044555663	N	N	주의	WIPRO LTD	NSI	INR	Technology	Information Technology Services	Information Technology Services	Wipro Limited operates as an information technology (IT), consulting, and business process services company worldwide. It operates through IT Services and IT Products segments. The IT Services segment offers AI-powered IT and IT-enabled services, including digital strategy advisory, customer-centric design, technology and IT consulting, custom application design, development, re-engineering and maintenance, systems integration, package implementation, cloud and infrastructure, business process, 	1992170668032.0	9.03	12.56	18.924057509144255	2.439636282496571		942772000000.0	63954000000.0	97863000000.0	192035000000.0	828309000000.0	83.81582402969823	14.724597420764118	7.749788116191642	8.45415413776288	2.439636282496571	3.4653338280046513	1.3566864402512113	매우 불리	보통(1~1.5)	13.379272564993142	168.04366341631388	-11.555966622992697	보류	충분
ONGC.NS	ONGC.NS	India Nifty 50	299.3500061035156	9.994493043191888	20.00401273431447		-0.6801552204652062	284.733748626709	254.93730018615722	Y	Y	상승전환/양호	OIL AND NATURAL GAS CORP.	NSI	INR	Energy	Oil & Gas Integrated	Oil & Gas Integrated	Oil and Natural Gas Corporation Limited, together with its subsidiaries, engages in the exploration, development, production, and distribution of crude oil, natural gas, and value-added products in India and internationally. It operates through Exploration and Production, Refining & Marketing, and Petrochemicals segments. The company engages in the refining and marketing of petroleum products; liquefied natural gas supply; pipelines for transportation of petroleum products; SEZ development; heli	3765906702336.0	6.15	30.24	-26.286672741612062	-7.331705014416712		590156440000.0	984741250000.0	550817790000.0	1878173020000.0	3434404760000.0	-31.36534599421354	27.973924444550995	9.344888549919581	10.936354236036019	-7.331705014416712		-0.10805292046255363	판정불가	불리(<1)	0.0	0.0	-100.0	보류	일부부족
NTPC.NS	NTPC.NS	India Nifty 50	395.25	7.726902855036344	21.001073744166376		-3.6445664949141587	388.22499923706056	350.8640008544922	Y	Y	상승전환/양호	NTPC LTD	NSI	INR	Utilities	Utilities - Regulated Electric	Utilities - Regulated Electric	NTPC Limited operates as an integrated power company in India. It operates through two segments: Generation and Others. The company generates power from fossil fuels, hydro, solar, wind, nuclear, and renewable energy sources. It also engages in the coal mining and energy trading business. NTPC Limited was incorporated in 1975 and is based in New Delhi, India.	3832607408128.0	2.86	18.07	12.54364692490686	11.990471885936493		89387200000.0	2010538800000.0	465212400000.0	2500961500000.0	1840711600000.0	-198.12496103828423	9.438903921738346	2.388084483678266	32.83757393681706	11.990471885936493	2.738639000132424	0.45224022683619564	매우 불리	불리(<1)	32.48094377187299	586.9306539577449	48.49605413225677	보류	충분
POWERGRID.NS	POWERGRID.NS	India Nifty 50	305.8500061035156	3.90691345729266	14.272375519577029		-4.689930844256596	307.2962516784668	285.8390008544922	N	Y	상승전환/양호	POWER GRID CORP. LTD.	NSI	INR	Utilities	Utilities - Regulated Electric	Utilities - Regulated Electric	Power Grid Corporation of India Limited, an electric power transmission utility, engages in the power transmission business in India and internationally. It operates in three segments: Transmission Services, Telecom Services, and Consultancy Services. As of 31 March 2025, the company owned and operated 180,195 circuit kilometers of transmission lines, and 282 substations with an aggregate transformation capacity of 551,961 mega volt amperes. It also provides telecom services that offer overhead 	2844589817856.0	4.06	15.57	-0.33210986081180227	-2.6505173375778845		103651600000.0	1133454500000.0	211070100000.0	1345177100000.0	926628100000.0	-110.72430565166513	12.998349607477243	4.249909873494631	26.754933317609552	-2.6505173375778845		0.05268122501708581	판정불가	불리(<1)	3.198965324844231	49.807890107824676	-83.7149291764385	보류	일부부족
M&M.NS	M&M.NS	India Nifty 50	3123.10009765625	-15.036181071603183	-16.697340260169202		-17.865027933247855	3139.147509765625	3437.6880041503905	N	N	주의	MAHINDRA & MAHINDRA LTD	NSI	INR	Consumer Cyclical	Auto Manufacturers	Auto Manufacturers	Mahindra & Mahindra Limited provides mobility products and farm solutions in India and internationally. It operates through five segments: Automotive; Farm Equipment; Auto Investments; Farm Investments; and Investments in Industrial Businesses and Consumer Services. The company offers commercial vehicles, trucks, buses, vans, passenger cars, utility vehicles, and electric vehicles (EV), as well as motorcycles; aero and defense products; offers construction equipment, such as rotaries, tillers, l	3750100729856.0	1.04	152.03	32.25089140002011	18.47775261729612		1104695000000.0	734699300000.0	561445700000.0	1339631500000.0	930963500000.0	308.1340171096516	17.088395109658443	0.547161300480972	18.51585924190356	18.47775261729612	1.0020622975854634	1.0541100125197083	보통	보통(1~1.5)	45.45550523459224	6910.600460815058	121.2737422665755	보류	충분
