티커	종목코드	유니버스	현재가	3M수익률(보조,%)	6M수익률(보조,%)	12M수익률(보조,%)	52주고점대비(보조,%)	40일이평(보조)	200일이평(보조)	40일선상회(보조)	200일선상회(보조)	추세판정(보조)	종목명	시장	통화	섹터	산업	업종	사업설명	시가총액	배당수익률(%)	EPS(FY)	EPS Growth 1Y(%)	EPS Growth 3Y CAGR(%)	EPS Growth 5Y CAGR(%)	현금및단기투자	장기부채	단기위험부채	총부채	주주지분	주당순현금(린치식)	주당잉여현금흐름	잉여현금흐름수익률(%)	순현금차감PER(린치식)	사용연성장률(%)	린치PER배수	배당감안점수	린치PER판정	배당감안점수판정	그레이엄적정PER(3년)	그레이엄내재가치(3년)	그레이엄괴리율(3년,%)	종합판정	데이터상태
M&M.NS	M&M.NS	India Nifty 50	3300.800048828125	-3.8172387125157026	-5.747981017528403		-13.191664906325219	3125.362518310547	3437.4550048828123	Y	N	주의	MAHINDRA & MAHINDRA LTD	NSI	INR	Consumer Cyclical	Auto Manufacturers	Auto Manufacturers	Mahindra & Mahindra Limited provides mobility products and farm solutions in India and internationally. It operates through five segments: Automotive; Farm Equipment; Auto Investments; Farm Investments; and Investments in Industrial Businesses and Consumer Services. The company offers commercial vehicles, trucks, buses, vans, passenger cars, utility vehicles, and electric vehicles (EV), as well as motorcycles; aero and defense products; offers construction equipment, such as rotaries, tillers, l	3963475984384.0	1.03	152.19	14.735229805903828	25.267893462834866		788210500000.0	797071900000.0	414657600000.0	1249493100000.0	770388600000.0	-7.379812195697049	-60.096325612044716	-1.8206593772131265	21.737169728785215	25.267893462834866	0.860268378159707	1.2098122152494473	헐값	보통(1~1.5)	59.03578692566973	8984.656412217677	172.19632450646253	보류	충분
TATASTEEL.NS	TATASTEEL.NS	India Nifty 50	215.47000122070312	11.56733587380485	16.88092980030231		-0.18992201817483734	202.03775062561036	181.10059989929198	Y	Y	상승전환/양호	TATA STEEL LIMITED	NSI	INR	Basic Materials	Steel	Steel	Tata Steel Limited engages in the manufacture and distribution of steel products in India and internationally. It offers reinforcement bars (rebars) and wire rods, cut-and-bend reinforcement bars, welded wire mesh, prefabricated cages (pre-cages), steel couplers and carpet reinforcement, hot-rolled, cold rolled, coated coil, tubes, rebar, metallic coated, pre-finished steels, alloy steels, and profiles and construction systems. The company also provides solutions in building envelopes, structura	2687309185024.0	1.7	7.35	723.1	-55.99983866003788		129944600000.0	685518100000.0	204120000000.0	948010500000.0	911696300000.0	-44.5462065708686	6.287191957897312	2.917896654883954	35.37635480157439	-55.99983866003788		-1.5349189865548647	판정불가	불리(<1)	0.0	0.0	-100.0	보류	일부부족
HCLTECH.NS	HCLTECH.NS	India Nifty 50	1189.0999755859375	-29.87143237159885	-23.27397482758692		-31.656994143305173	1339.5499938964845	1502.347998046875	N	N	주의	HCL TECHNOLOGIES LTD	NSI	INR	Technology	Information Technology Services	Information Technology Services	HCL Technologies Limited provides IT and business services, engineering, research and development services, software products, and IP-led offerings. It operates through IT and Business Services, Engineering and R&D Services, and HCL Software segments. The company provides application development, management, modernization, and testing services, as well as commercial applications; automation services, including digital integration, business process management, robotic process automation for intel	3217291214848.0	8.0	61.33	-4.301322599194934	3.8683596866436742		557570000000.0	370000000.0	1220000000.0	52150000000.0	751650000000.0	205.93923703527977	68.57126103222443	5.766652295021321	16.030665882123884	3.8683596866436742	4.14404739493929	0.7403535058314902	매우 불리	불리(<1)	16.23671937328735	995.7979991637131	-16.256158472038774	보류	충분
TECHM.NS	TECHM.NS	India Nifty 50	1466.699951171875	-15.856808461095383	2.294594868415567		-17.060623675469134	1417.6825012207032	1499.2765014648437	Y	N	중립	TECH MAHINDRA LIMITED	NSI	INR	Technology	Information Technology Services	Information Technology Services	Tech Mahindra Limited provides information technology services and solutions in the Americas, Europe, India, and internationally. It operates through Information technology Business and Business Process Services segments. It offers application development maintenance, intelligent automation, testing, performance engineering, cloud consulting, engineering and network, data analytics, and artificial intelligence (AI) services. The company also provides business process services, such as Consulting	1299083296768.0	3.51	54.17	13.157709043866861	-0.14094743522335973		127309000000.0	0.0	696000000.0	21862000000.0	296154000000.0	143.73527897175188	61.828897268300345	4.215510965204562	24.422460258447906	-0.14094743522335973		0.13794894245395528	판정불가	불리(<1)	8.21810512955328	445.1747548679012	-69.64786461523967	보류	일부부족
COALINDIA.NS	COALINDIA.NS	India Nifty 50	470.20001220703125	6.68179516892371	21.279339025644674		-2.3366911859506456	454.10125122070315	408.2727500915527	Y	Y	상승전환/양호	COAL INDIA LTD	NSI	INR	Energy	Thermal Coal	Thermal Coal	Coal India Limited, together with its subsidiaries, produces and sells coal and coal products in India. The company offers coking coal for steel making and metallurgical industries, as well as for hard coke manufacturing; semi coking coal for blend-able coal in steel making, merchant coke manufacturing, and other metallurgical industries; and non-coking coal for thermal grade coal for cement, fertilizer, glass, ceramic, paper, chemical, and brick manufacturing, as well as power generation and ot	2897714872320.0	4.66	50.47	-12.42470944167401	-0.706993307310555		1116782200000.0	92323600000.0	45891000000.0	140721800000.0	1191015600000.0	166.23458728687848	49.839873462265636	10.599717602797702	6.022695163862746	-0.706993307310555		0.6563517802475204	판정불가	불리(<1)	7.08601338537889	357.6310955600726	-23.940645198748744	보류	일부부족
NESTLEIND.NS	NESTLEIND.NS	India Nifty 50	1486.0999755859375	11.53557102638647	16.110629520948194		0.0	1284.9125061035156	1246.3570031738282	Y	Y	상승전환/양호	NESTLE INDIA LIMITED	NSI	INR	Consumer Defensive	Packaged Foods	Packaged Foods	Nestlé India Limited engages in the manufacture and sale of food products in India and internationally. The company provides milk products and nutrition, including dairy whitener, condensed milk, UHT milk, yogurt, maternal and infant formula, baby foods, health care nutrition; prepared dishes and cooking aids, such as noodles, sauces, seasonings, pasta, cereals, and pet foods; powdered and liquid beverages comprising instant coffee and tea, as well as ready to drink beverages; and confectionery 	2865668030464.0	81.0	18.18	34.17959272459547			3614200000.0	224800000.0	7308600000.0	11668500000.0	40102100000.0	1.7577009955513891	4.810989527889831	0.3237325622048382	81.64698980145138	34.17959272459547	2.3887642681797843	1.4107022561969333	매우 불리	보통(1~1.5)	8.5	154.53	-89.60164171060751	보류	충분
ADANIENT.NS	ADANIENT.NS	India Nifty 50	2540.300048828125	25.732529109666746	0.5302998536644177		-5.085183772292067	2100.339993286133	2285.983959350586	Y	Y	상승전환/양호	ADANI ENTERPRISES LIMITED	NSI	INR	Energy	Thermal Coal	Thermal Coal	Adani Enterprises Limited, together with its subsidiaries, operates in the new energy ecosystem, data center, airports, roads, copper, digital space, ropeway system, and other sectors in India and internationally. It operates through the Integrated Resources Management (IRM), Mining Services, Commercial Mining, New Energy Ecosystem, Airport, Road, and Others segments. The company engages in the integrated ecosystem for manufacturing green hydrogen, including solar cells, modules, and wind manufa	3482609778688.0	5.0	73.61	119.05220348187781	109.09359029776877		105003800000.0	646012600000.0	116351500000.0	918191700000.0	503139700000.0	-415.619202955451	-189.43046640357105	-7.457011485354177	40.15649031087591	109.09359029776877	0.36809211431459515	2.841224156157588	매우 유망	안심(>=2)	60.0	4416.6	73.86135161621708	보류	충분
ADANIPORTS.NS	ADANIPORTS.NS	India Nifty 50	1748.300048828125	23.137060762262784	19.919063005076488		0.0	1485.985009765625	1450.8290014648437	Y	Y	상승전환/양호	ADANI PORT & SEZ LTD	NSI	INR	Industrials	Marine Shipping	Marine Shipping	Adani Ports and Special Economic Zone Limited, together with its subsidiaries, develops, operates, and maintains port infrastructure in India. The company is involved in the operation of ports and terminals, including bulk and break bulk, container, liquid, LPG, LNG, and crude cargo; ports related infrastructure development activities; and development of infrastructure at contiguous Special Economic Zone at Mundra. It also offers logistic services, which include logistic parks, container rail an	4028011642880.0	43.0	58.3	36.76245031218252	31.428219096473576		87903600000.0	356813000000.0	99793500000.0	513048200000.0	624353900000.0	-116.71622132243252	39.83299880612724	2.278384584661372	31.989987481141643	31.428219096473576	1.0178746489880204	2.3266098225374305	보통	안심(>=2)	60.0	3498.0	100.08007220183335	보류	충분
JSWSTEEL.NS	JSWSTEEL.NS	India Nifty 50	1273.300048828125	4.850133665180167	5.231408994059916		-0.7328216029915846	1202.9125	1152.614503173828	Y	Y	상승전환/양호	JSW STEEL LIMITED	NSI	INR	Basic Materials	Steel	Steel	JSW Steel Limited manufactures and sells iron and steel products in India and internationally. The company offers color coated steel products, color-coated roofing sheets, galvalume coil and sheets, aluminum-zinc sheets, galvanized corrugated sheets, tin plate products, lead-free coils and sheets, Al-Zn-Mg coated galvanized steel, multi-utility steel sheets, hot rolled and cold-rolled coils, cold rolled close annealed, electrical, coated steel products, TMT bars, wire rods, alloy steel products,	3107658661888.0	22.0	30.43	-60.23604176123468	-44.651027551942825		254130000000.0	819190000000.0	345080000000.0	1192220000000.0	794960000000.0	-231.52187039803624	33.61832277308405	2.6402514320190673	49.451919790540956	-44.651027551942825		-0.4580414197847878	판정불가	불리(<1)	0.0	0.0	-100.0	보류	일부부족
CIPLA.NS	CIPLA.NS	India Nifty 50	1364.4000244140625	3.2932091146940623	-13.705645089999352		-17.985089899180462	1268.1675048828124	1445.665004272461	Y	N	상승전환/양호	CIPLA LTD	NSI	INR	Healthcare	Drug Manufacturers - Specialty & Generic	Drug Manufacturers - Specialty & Generic	Cipla Limited, together with its subsidiaries, manufactures, develops, sells, and distributes pharmaceutical products in India, the United States, South Africa, and internationally. The company operates through Pharmaceuticals and New Ventures segments. It offers generic and branded generic medicines, vaccines, active pharmaceutical ingredients, and formulations for various therapeutic areas, such as MI, angina, heart disease, pulmonary disease, kidney failure, Alzheimer's disease, hypertension,	1102138703872.0	97.0	56.28	27.925659036042273	27.955626091587817		206298700000.0	119800000.0	801200000.0	4381900000.0	311934500000.0	255.24057102436015	42.79344302960136	3.1364293655725253	19.707879413463083	27.955626091587817	0.7049700603698309	6.340389215403187	헐값	안심(>=2)	60.0	3376.8	147.49339926537726	양호	충분
DRREDDY.NS	DRREDDY.NS	India Nifty 50	1311.0	7.626633796571181	9.050079291890611		-3.7939350571939756	1271.520004272461	1258.1490008544922	Y	Y	상승전환/양호	DR. REDDY S LABORATORIES	NSI	INR	Healthcare	Drug Manufacturers - Specialty & Generic	Drug Manufacturers - Specialty & Generic	Dr. Reddy's Laboratories Limited, together with its subsidiaries, operates as an integrated pharmaceutical company North America, Europe, India, Russia, and internationally. It operates through Global Generics, Pharmaceutical Services and Active Ingredients (PSAI), and Others segment. The Global Generics segment manufactures and markets prescription and over-the-counter finished pharmaceutical products that are marketed under a brand name or as a generic finished dosages with therapeutic equival	1091531833344.0	63.0	67.88	1.5444292795057768	33.87143933281283		101162000000.0	3800000000.0	38045000000.0	46766000000.0	333388000000.0	116.93803446203343	14.448805022270106	1.1021209017749891	17.59077733556227	33.87143933281283	0.5193395285839321	5.506944774803862	헐값	안심(>=2)	60.0	4072.7999999999997	210.66361556064072	양호	충분
GRASIM.NS	GRASIM.NS	India Nifty 50	2914.800048828125	3.3983699477873275	-1.2066111270999214		-1.4837564831933103	2705.7050048828123	2783.6474938964843	Y	Y	상승전환/양호	GRASIM INDUSTRIES LTD	NSI	INR	Basic Materials	Building Materials	Building Materials	Grasim Industries Limited, together with its subsidiaries, primarily produces cellulosic fibres, diversified chemicals, fashion yarns, and fabrics in india and internationally. The company operates through Cellulosic Fibres, Chemicals, Building Materials, Financial Services, and Others segments. It offers cellulosic staple fibre; and cellulosic fashion yarn; chlor-alkali comprising caustic soda; chlorine derivatives, and specialty chemicals, that include epoxy polymers and curing agents. The com	1976738119680.0	35.0	66.62	-34.115270895672325	-21.118007440068943		536173600000.0	1239160900000.0	597216000000.0	1863145600000.0	975092300000.0	-1036.6791908279279	-506.56614304893196	-17.379104383252404	59.31370819057419	-21.118007440068943		0.23404357918962665	판정불가	불리(<1)	0.0	0.0	-100.0	보류	일부부족
HINDALCO.NS	HINDALCO.NS	India Nifty 50	1045.800048828125	8.643265671344258	21.41406843562217		-2.652890133542163	971.6637512207031	845.317251586914	Y	Y	상승전환/양호	HINDALCO  INDUSTRIES  LTD	NSI	INR	Basic Materials	Aluminum	Aluminum	Hindalco Industries Limited, together with its subsidiaries, manufactures and distributes aluminum and copper products in India, the United States, Brazil, South Korea, the United Kingdom, Germany, China, and internationally. It operates through Novelis, Aluminium Upstream, Aluminium Downstream, and Copper segments. The company offers primary aluminum, such as ingots, wirerods, primary foundry alloys, and billets; flat rolled products, including building and pattern sheets, PCB entry and cold-ro	2338569060352.0	47.0	72.25	57.56770064007879	5.23467463835805		348580000000.0	562170000000.0	57140000000.0	639290000000.0	1237090000000.0	-95.51671112509926	16.81906224736637	1.6082483708250952	15.796771764058466	5.23467463835805	3.0177179777907663	3.306667679861322	매우 불리	안심(>=2)	18.969349276716102	1370.5354852427383	31.051388530579693	보류	충분
HEROMOTOCO.NS	HEROMOTOCO.NS	India Nifty 50	5170.0	-6.577520780628843	-6.255666364460566		-18.58908747342729	5223.6	5400.873508300781	N	N	주의	HERO MOTOCORP LIMITED	NSI	INR	Consumer Cyclical	Auto Manufacturers	Auto Manufacturers	Hero MotoCorp Limited primarily engages in the manufacture and sale of motorised two wheelers in India, Asia, Central and Latin America, Africa, and the Middle East. The company offers motorcycles and scooters, as well as electric scooters. It provides engines, parts, and accessories, as well as non-banking financial and other related services. The company is also involved in merchandise business. The company was formerly known as Hero Honda Motors Ltd. and changed its name to Hero MotoCorp Limi	1034480517120.0	3.43	286.61	16.920661285024963	23.634575841285653		139920500000.0	0.0	4567600000.0	6999300000.0	192720400000.0	699.2775527140293	171.95809279385963	3.3260752958193356	15.598626870262624	23.634575841285653	0.6599918261708099	1.7350614298545615	헐값	양호(>=1.5)	55.769151682571305	15983.996563741763	209.16821206463757	양호	충분
BPCL.NS	BPCL.NS	India Nifty 50	314.04998779296875	-13.84088126393176	-12.178416545647464		-19.121813632296103	302.61125030517576	340.2160008239746	Y	N	주의	BHARAT PETROLEUM CORP  LT	NSI	INR	Energy	Oil & Gas Refining & Marketing	Oil & Gas Refining & Marketing	Bharat Petroleum Corporation Limited engages in refining crude oil and marketing petroleum products in India and internationally. It operates through two segments, Downstream Petroleum; and Exploration and Production of Hydrocarbons. The company operates fuel stations that sell motor spirits, high-speed diesel, blended fuels, compressed and liquefied natural gas, automotive liquefied petroleum gas (LPG), and lubricants; operate convenience stores, restaurants, and electric vehicle charging facil	1341805297664.0	6.7	57.58	-50.345770703425764	4.515722730025629		270798300000.0	265278800000.0	245330300000.0	611005700000.0	813840800000.0	1.2918409259902277	19.9754253026923	6.360587829686752	5.431714950798515	4.515722730025629	1.2028450982347376	2.064858489743982	보통	안심(>=2)	17.53144546005126	1009.4606295897514	221.43310581983476	보류	충분
EICHERMOT.NS	EICHERMOT.NS	India Nifty 50	7310.5	2.639522639522629	6.118449702424145		-10.738705738705734	7054.7875	6906.2575	Y	Y	상승전환/양호	EICHER MOTORS LTD	NSI	INR	Consumer Cyclical	Auto Manufacturers	Auto Manufacturers	Eicher Motors Limited, an automobile company, engages in the manufacture and sale of motorcycles and commercial vehicles in India and internationally. The company designs, develops, manufactures, assembles, and sells two-wheelers, as well as related parts and accessories; motorcycle accessories; protective and performance gears, and riding apparel products for men and women; and lifestyle apparel products and accessories. It also owns the Royal Enfield motorcycle brand that offers Classic 350, B	2005374074880.0	96.0	194.95	18.33112139184856	41.344761842853586		72882600000.0	1843600000.0	821100000.0	4581300000.0	212964900000.0	258.969455333053	107.19787590729352	1.4663549128964302	36.1709697084737	41.344761842853586	0.8748622097753316	3.797099246987512	헐값	안심(>=2)	60.0	11697.0	60.00273579098556	양호	충분
APOLLOHOSP.NS	APOLLOHOSP.NS	India Nifty 50	7760.5	11.493427196322092	-0.3786906290115577		-3.1390414378432374	7570.825	7479.5125	Y	Y	상승전환/양호	APOLLO HOSPITALS ENTER. L	NSI	INR	Healthcare	Medical Care Facilities	Medical Care Facilities	Apollo Hospitals Enterprise Limited, together with its subsidiaries, provides healthcare services in India. It operates through Healthcare Services, Retail Health & Diagnostics, Digital Health & Pharmacy Distribution, and Others segments. The company's healthcare facilities comprise primary, secondary, and tertiary care, as well as specialty facilities. It offers services in cardiac sciences, oncology, neurosciences, gastroenterology, orthopedics, urology, organ transplantation, pulmonology, obs	1115840839680.0	26.0	125.13	60.90585354996661	11.057090633672306		34427000000.0	19719000000.0	8582000000.0	54192000000.0	82123000000.0	102.29185997223613	29.46767818210256	0.37971365481737723	61.202015024596534	11.057090633672306	5.5350921008295995	0.6054880810505895	매우 불리	불리(<1)	30.614181267344613	3830.7525019828313	-50.63781325967616	보류	충분
BRITANNIA.NS	BRITANNIA.NS	India Nifty 50	5783.0	1.0484011881880084	-1.1875266979923138		-8.213633838584244	5696.2375	5856.9525	Y	N	상승전환/양호	BRITANNIA INDUSTRIES LTD	NSI	INR	Consumer Defensive	Packaged Foods	Packaged Foods	Britannia Industries Limited manufactures and sells various food products in India and internationally. The company offers biscuits under the Good Day, Marie Gold, NutriChoice, Milk Bikis, Tiger, 50-50, Jim Jam, Britannia Bourbon, Little Hearts, Treat, Pure Magic, Nice Time, and Biscafe brand names; cakes under the Muffills, Fudge It, Gobbles, Layerz, Tiffin Fun, Rollyo, and Nut & Raisin Romance Cake brand names; rusks under the Toastea brand; center filled croissants under the Treat Croissant b	1392941334528.0	1.29	100.35	1.8188530757403676	12.63195210933581		26218000000.0	7129400000.0	5294600000.0	12641400000.0	43557200000.0	79.24911794950383	87.42537041902767	1.511765008110456	56.8385738121624	12.63195210933581	4.499587500031377	0.24493844893688674	매우 불리	불리(<1)	33.76390421867162	3388.207788343697	-41.410897659628276	보류	충분
BAJAJ-AUTO.NS	BAJAJ-AUTO.NS	India Nifty 50	10319.0	8.48402018502943	14.224042506088107		0.0	9422.375	9113.15	Y	Y	상승전환/양호	BAJAJ AUTO LIMITED	NSI	INR	Consumer Cyclical	Auto Manufacturers	Auto Manufacturers	Bajaj Auto Limited, together with its subsidiaries, engages in the development, manufacture, and distribution of automobiles in India and internationally. The company offers motorcycles, bikes, commercial vehicles, electric two-wheelers, and three-wheeler, as well as related parts and accessories. It also exports its products. The company was founded in 1945 and is based in Pune, India.	2881545306112.0	2.09	318.46	-4.9753251066391275	5.9088906222743764		160658100000.0	60827400000.0	31537800000.0	92365200000.0	351887400000.0	357.50020776442824	-81.62714962234216	-0.7910374030656281	31.28022292355578	5.9088906222743764	5.293755617279608	0.25571718724072	매우 불리	불리(<1)	20.317781244548755	6470.400615138996	-37.29624367536587	보류	충분
TATACONSUM.NS	TATACONSUM.NS	India Nifty 50	1152.199951171875	1.613892438821396	-2.0737740030898344		-4.98103460581687	1098.1149871826171	1128.632999267578	Y	Y	상승전환/양호	TATA CONSUMER PRODUCT LTD	NSI	INR	Consumer Defensive	Packaged Foods	Packaged Foods	Tata Consumer Products Limited, together with its subsidiaries, produces, distributes, and trades in food products in India, the United States, the United Kingdom, and internationally. It operates through Branded Business and Non Branded Business segments. The company provides tea, coffee products, salt, mineral water, food ingredients, sweeteners, ready to cook and ready to eat options, breakfast cereals, snacks, mini meals, pulses, spices, instant noodles, blended masalas, Chinese sauces, pizz	1140330856448.0	72.0	14.88	11.139412168682039	10.961485146171789		34938300000.0	1906800000.0	16579700000.0	23926800000.0	200010800000.0	33.37992702183789	16.139568365302065	1.400761070063134	75.18951775201862	10.961485146171789	6.859427965222208	1.103365038459028	매우 불리	보통(1~1.5)	30.422970292343578	452.69379795007245	-60.71048280381817	보류	충분
DIVISLAB.NS	DIVISLAB.NS	India Nifty 50	6702.0	10.941897036914416	2.9176904176904106		-4.030930049402159	6203.3625	6298.6775	Y	Y	상승전환/양호	DIVI S LABORATORIES LTD	NSI	INR	Healthcare	Drug Manufacturers - Specialty & Generic	Drug Manufacturers - Specialty & Generic	Divi's Laboratories Limited engages in the manufacture and sale of generic active pharmaceutical ingredients (APIs), intermediates, and nutraceuticals in India, North America, Asia, Europe, and internationally. The company also undertakes custom synthesis contract manufacturing services of APIs and intermediates; and supplies a range of carotenoids, such as beta carotene, astaxanthin, lycopene, and canthaxanthin, as well as lutein and vitamins used in the food, beverage, dietary supplement, pet 	1779170410496.0	45.0	93.11	36.9375	-9.545908575211005		66630000000.0	0.0	20000000.0	40000000.0	149690000000.0	250.99015484242994	8.098886881453165	0.12084283618999053	69.28374873974407	-9.545908575211005		0.5117230529480724	판정불가	불리(<1)	0.0	0.0	-100.0	보류	일부부족
INDUSINDBK.NS	INDUSINDBK.NS	India Nifty 50	946.75	5.65227383037743	18.203381680613795		-1.850505498416033	846.245002746582	834.340001525879	Y	Y	상승전환/양호	INDUSIND BANK LIMITED	NSI	INR	Financial Services	Banks - Regional	Banks - Regional	IndusInd Bank Limited provides various banking products and financial services to individuals, corporations, government entities, and public sector undertakings in India. It operates in four segments: Treasury, Corporate/Wholesale Banking, Retail Banking, and Other Banking Operations. The company offers savings, salary, RFC, and uniformed personnel accounts; current accounts comprising smart, everyday, premium, trade, startup, and specialized accounts; fixed, recurring, sweep in/out, senior citi	737618690048.0	16.0	11.38	-65.46976556372644	-50.74727610509653		489323500000.0	0.0	0.0	427891900000.0	657396300000.0	628.0575970647141	3.863145251853582	0.40804280452638836	28.00460482735377	-50.74727610509653		-1.2407700918942013	판정불가	불리(<1)	0.0	0.0	-100.0	보류	일부부족
SHRIRAMFIN.NS	SHRIRAMFIN.NS	India Nifty 50	1004.0999755859375	-1.5588259229473045	36.01083313050288		-9.098316333629242	979.2749954223633	837.1289981079102	Y	Y	상승전환/양호	SHRIRAM FINANCE LIMITED	NSI	INR	Financial Services	Credit Services	Credit Services	Shriram Finance Limited, a non-banking finance company, provides financing services in India. It offers fixed and recurring deposits; commercial vehicle loans for commercial goods vehicles, passenger commercial vehicles, tractors and farm equipment, and construction equipment; two-wheeler, gold, used car loan, and personal loans; and green finance services. The company also provides business loans, such as MSME loans; working capital loans, including tyre, tax, fuel, toll financing, repair/top-u	2362332413952.0	1.43	53.23	4.923056955228389	18.58582810449043		79431300000.0	0.0	0.0	1812116200000.0	659185900000.0	33.76195787172872	-57.286299827531714	-5.705238643602454	18.22915682348692	18.58582810449043	0.9808095028643176	1.0980117346240346	헐값	보통(1~1.5)	45.67165620898086	2431.102260004051	142.1175499566558	보류	충분
