티커	종목코드	유니버스	현재가	3M수익률(보조,%)	6M수익률(보조,%)	12M수익률(보조,%)	52주고점대비(보조,%)	40일이평(보조)	200일이평(보조)	40일선상회(보조)	200일선상회(보조)	추세판정(보조)	종목명	시장	통화	섹터	산업	업종	사업설명	시가총액	배당수익률(%)	EPS(FY)	EPS Growth 1Y(%)	EPS Growth 3Y CAGR(%)	EPS Growth 5Y CAGR(%)	현금및단기투자	장기부채	단기위험부채	총부채	주주지분	주당순현금(린치식)	주당잉여현금흐름	잉여현금흐름수익률(%)	순현금차감PER(린치식)	사용연성장률(%)	린치PER배수	배당감안점수	린치PER판정	배당감안점수판정	그레이엄적정PER(3년)	그레이엄내재가치(3년)	그레이엄괴리율(3년,%)	종합판정	데이터상태
RELIANCE.NS	RELIANCE.NS	India Nifty 50	1437.9000244140625	3.045721603584317	-3.399393724281996		-9.696666437189105	1380.152505493164	1434.062504272461	Y	Y	상승전환/양호	RELIANCE INDUSTRIES LTD	NSI	INR	Energy	Oil & Gas Refining & Marketing	Oil & Gas Refining & Marketing	Reliance Industries Limited engages in the hydrocarbon exploration and production, oil and chemicals, retail, and digital service businesses worldwide. It operates through Oil to Chemicals, Oil and Gas, Retail, Digital Services, and Others segments. The company offers refining and marketing products, including liquefied petroleum gas, propylene, naphtha, gasoline, jet/aviation turbine fuel, kerosine oil, diesel, sulphur, and petroleum coke. It also provides polymers, including high-density and l	19458343043072.0	38.0	59.71	15.976050999310809	6.58907750634663		4566910000000.0	2707510000000.0	1036700000000.0	3980000000000.0	9040300000000.0	137.40282727993878	51.134040224211695	3.5561610234375354	21.780224370023845	6.58907750634663	3.305504351564393	2.047227647834273	매우 불리	안심(>=2)	21.67815501269326	1294.4026358079145	-9.979649917915712	보류	충분
TCS.NS	TCS.NS	India Nifty 50	2435.39990234375	-22.03975868379916	-19.76411349237074		-32.73119080665268	2469.9999877929686	2947.728992919922	N	N	주의	TATA CONSULTANCY SERV LT	NSI	INR	Technology	Information Technology Services	Information Technology Services	Tata Consultancy Services Limited provides information technology (IT) and IT enabled services in the Americas, Europe, India, and internationally. The company provides TCS ADD, a suite of AI powered life sciences platforms; TCS BaNCS, a financial services platform; TCS BFSI Platforms, a cloud-native, as-a-service digital ecosystem for insurers and financial firms; TCS Chroma, a cloud-based human resource management system platform; TCS Customer Intelligence & Insights, an AI-driven customer ana	8811489263616.0	2.6	135.93	1.3531604638230332	5.300128040832486		906050000000.0	0.0	18300000000.0	112830000000.0	1072400000000.0	250.42235586961277	132.40973238392516	5.436878446800393	16.074284900126074	5.300128040832486	3.0328106748155657	0.4914761738962661	매우 불리	불리(<1)	19.100256081664973	2596.29780918072	6.606631899842275	보류	충분
HDFCBANK.NS	HDFCBANK.NS	India Nifty 50	796.5499877929688	-14.280334916010895	-20.197368300365238		-21.35946602886567	794.9287521362305	935.5199993896484	Y	N	주의	HDFC BANK LTD	NSI	INR	Financial Services	Banks - Regional	Banks - Regional	HDFC Bank Limited provides banking and financial products and services to individuals and businesses in India, Bahrain, Hong Kong, Singapore, and Dubai. The company operates through Treasury, Retail Banking, Wholesale Banking, Other Banking Business, Insurance Business, and Other segments. It offers savings, salary, current, rural, public provident fund, pension, and demat accounts; fixed and recurring deposits; and safe deposit lockers, as well as offshore accounts and deposits, and overdrafts 	12263228440576.0	1.68	44.79	8.166893276325982	20.388517319859577		9196249400000.0	5866163200000.0	1306013100000.0	7326106100000.0	7676891400000.0	216.30357574058897	73.34775461011954	9.20817974190759	12.954820541468628	20.388517319859577	0.6353978731376358	1.7034984968890794	헐값	양호(>=1.5)	49.277034639719155	2207.1183815130207	177.08472981442975	양호	충분
ICICIBANK.NS	ICICIBANK.NS	India Nifty 50	1279.5	-5.571955719557198	-6.084851947188996		-14.046753930896195	1286.262503051758	1372.9060021972657	N	N	주의	ICICI BANK LTD.	NSI	INR	Financial Services	Banks - Regional	Banks - Regional	ICICI Bank Limited, together with its subsidiaries, engages in the provision of various banking and financial services to retail and corporate customers in India and internationally. The company operates through Retail Banking, Wholesale Banking, Treasury, Other Banking, Life Insurance, General Insurance, and Others segments. It offers savings, salary, pension, current, trade, escrow, foreign currency, and vostro accounts, as well as time, fixed, recurring, and security deposits. The company als	9170883444736.0	88.0	74.83	6.22878665548352	16.78079563417647		2649807200000.0	2202642800000.0	226221340000.0	2202642800000.0	3630604100000.0	62.38731987203824	88.72682641857487	6.934492099927696	16.26503648440414	16.78079563417647	0.9692649168122925	6.442087955637012	헐값	안심(>=2)	42.06159126835294	3147.4688746108504	145.99209649166474	양호	충분
INFY.NS	INFY.NS	India Nifty 50	1167.199951171875	-28.872641610489037	-21.86370912977713		-30.92674177744714	1258.4900024414062	1467.8695013427734	N	N	주의	INFOSYS LIMITED	NSI	INR	Technology	Information Technology Services	Information Technology Services	Infosys Limited provides consulting, technology, outsourcing, and digital services worldwide. It provides digital marketing and digital workplace, digital commerce, digital experience and interactions, and metaverse; data analytics and AI, applied AI, generative AI, and sustainability; blockchain, engineering, and Internet of Things; enterprise agile DevOps, API economy and microservices, application modernization, cloud, digital process automation, digital supply chain, Microsoft business appli	4723667107840.0	4.07	75.99	4.9081697276757374	3.582523363792678		5163000000.0	0.0	333000000.0	967000000.0	9786000000.0	1.2757573468626915	0.9224098732981653	0.07902757983943204	15.343126645940417	3.582523363792678	4.282770853920474	0.4987590561156863	매우 불리	불리(<1)	15.665046727585356	1190.386900829211	1.9865447761590715	보류	충분
BHARTIARTL.NS	BHARTIARTL.NS	India Nifty 50	1833.699951171875	-6.8573171813023475	-11.256840350372455		-15.212466242565403	1834.5300048828126	1962.7880041503906	N	N	주의	BHARTI AIRTEL LIMITED	NSI	INR	Communication Services	Telecom Services	Telecom Services	Bharti Airtel Limited operates as a telecommunications company in India and internationally. It operates through the Mobile Services India, Mobile Services Africa, Mobile Services South Asia, Airtel Business, Passive Tower Infrastructure Services, Homes Services, Digital TV Services, and Others segments. The company provides voice and data telecom services through wireless technology including 2G/3G/4G/5G services; passive infrastructure service, including the setup, operation, and maintenance o	11169931722752.0	89.0	50.57	349.3919914289541	99.0493242072451		588040000000.0	1048638000000.0	434485000000.0	2136421000000.0	1136719000000.0	-75.62517343931407	96.30068650134565	5.2517145152238305	37.756083144377875	99.0493242072451	0.38118466174871846	4.9806364576577336	매우 유망	안심(>=2)	60.0	3034.2	65.46872884306471	매우 유망	충분
SBIN.NS	SBIN.NS	India Nifty 50	1096.0	1.7499860890957342	17.300800410755144		-10.734650886675045	1068.1949966430664	970.1589987182617	Y	Y	상승전환/양호	STATE BANK OF INDIA	NSI	INR	Financial Services	Banks - Regional	Banks - Regional	State Bank of India provides banking products and services in India and internationally. It operates through the Treasury, Corporate/Wholesale Banking, Retail Banking, and Other Banking Business segments. The company offers personal banking products and services, including current, savings, salary, and deposit accounts; home, personal, pension, auto, education, and gold loans, as well as loans against insurance policies, property, and securities; debit, business debit, prepaid, and green remit c	10116756668416.0	1.5	91.89	15.61708749415689	29.913474259585037		6208491788000.0	0.0	0.0	6181254399000.0	4870367587000.0	672.5976599243335	46.42058898094622	4.235455198991443	4.607708565411541	29.913474259585037	0.15403455063181484	6.817591393560568	매우 유망	안심(>=2)	60.0	5513.4	403.0474452554744	매우 유망	충분
ITC.NS	ITC.NS	India Nifty 50	310.70001220703125	-3.5542393004459605	-25.80298215951492		-29.848720594101252	303.18250274658203	369.04175033569334	Y	N	주의	ITC LTD	NSI	INR	Consumer Defensive	Tobacco	Tobacco	ITC Limited engages in the fast-moving consumer goods, paperboards, paper and packaging, and agri businesses in India and internationally. The company offers cigarettes and cigars; foods, including staples, spices, biscuits, confectionery and gums, snacks, noodles and pasta, beverages, dairy products, ready-to-eat meals, chocolates, coffee, and frozen foods; personal care products; education and stationery, such as balls, gels and roller pens, mechanical pencils, geometry boxes, erasers, sharpen	3892906033152.0	4.61	16.26	69.83725324774987	31.6085110433352		394500400000.0	0.0	915600000.0	2848400000.0	700300500000.0	31.48580552077542	12.249793620151923	3.9426434305993587	17.171845429659026	31.6085110433352	0.5432665083817604	2.1091798893541736	헐값	안심(>=2)	60.0	975.6000000000001	214.00063137104763	양호	충분
LT.NS	LT.NS	India Nifty 50	4008.5	1.937795952131971	0.5266457680250802		-9.27095558277501	3827.6625061035156	3856.111005859375	Y	Y	상승전환/양호	LARSEN & TOUBRO LTD.	NSI	INR	Industrials	Engineering & Construction	Engineering & Construction	Larsen & Toubro Limited engages in engineering, procurement, and construction projects (EPC) in India and internationally. The Infrastructure Projects segment is involved in the engineering and construction of building and factories, transportation infrastructure, heavy civil infrastructure, power transmission and distribution, water and effluent treatment, and minerals and metals. The Energy Projects segment provides EPC solutions in oil & gas, refineries, petrochemicals & offshore wind energy 	5514366287872.0	84.0	116.77	15.146514578711724	20.15069316268372		1086811400000.0	575033400000.0	720560000000.0	1324089200000.0	976556000000.0	372.02140079171755	34.469649730668955	0.859913926173605	31.142233443592385	20.15069316268372	1.5454671058791898	3.344355290102453	보통	안심(>=2)	48.80138632536744	5698.537881213156	42.161354152754285	보류	충분
HINDUNILVR.NS	HINDUNILVR.NS	India Nifty 50	2317.10009765625	-2.3556638155815435	-6.175088839068666		-13.945628254520626	2187.9074951171874	2400.342001953125	Y	N	주의	HINDUSTAN UNILEVER LTD.	NSI	INR	Consumer Defensive	Household & Personal Products	Household & Personal Products	Hindustan Unilever Limited, a consumer good company, manufactures and sells food, home care, personal care, and refreshment products in India and internationally. It operates through the Home Care, Beauty and Wellbeing, Personal Care, Foods, and Other segments. The Home Care segment offers detergent bars, detergent powders, detergent liquids, and scourers. Its Beauty and Wellbeing segment provides skin care and hair care products. The Personal Care segment offers skin cleansing, oral care, and d	5444238049280.0	1.89	45.15	3.6197333852291624	6.246571280477831		179190000000.0	0.0	10000000.0	16480000000.0	494020000000.0	76.26432856558691	45.16104639820541	1.949033036763749	49.63091404409	6.246571280477831	7.945305002633939	0.16394159642616388	매우 불리	불리(<1)	20.99314256095566	947.8403866271481	-59.0936797428005	보류	충분
BAJFINANCE.NS	BAJFINANCE.NS	India Nifty 50	980.75	5.474003952302975	-6.799396133052116		-10.364211660534428	895.2149948120117	962.4304989624023	Y	Y	상승전환/양호	BAJAJ FINANCE LIMITED	NSI	INR	Financial Services	Credit Services	Credit Services	Bajaj Finance Limited operates as a deposit-taking non-banking financial company in India. The company offers financing for various products, such as consumer electronics, furniture, digital products, e-commerce purchases, retail spends, and two and three-wheelers; and personal, unsecured, home, and secured, gold, and car loans. It also provides secured and unsecured loans to micro, small, and medium enterprises, SMEs, and professionals; loans against property, mutual funds, insurance policies, 	6098182471680.0	56.00000000000001	30.48	14.302174203110752	18.22815698685951		157553200000.0	0.0	0.0	3665797400000.0	1139990200000.0	25.338747747008906	-107.35321256476016	-10.946032379786914	31.345513525360598	18.22815698685951	1.7196205599917345	2.3680631975227975	보통	안심(>=2)	44.95631397371902	1370.2684499189556	39.71638541105844	보류	충분
KOTAKBANK.NS	KOTAKBANK.NS	India Nifty 50	376.6000061035156	-7.696076935412832	-11.894066078866771		-15.534019989130687	373.883748626709	409.01565124511717	Y	N	주의	KOTAK MAHINDRA BANK LTD	NSI	INR	Financial Services	Banks - Regional	Banks - Regional	Kotak Mahindra Bank Limited provides a range of banking and financial services to corporate and individual customers in India. It operates through Treasury, BMU, and Corporate Centre; Retail Banking; Corporate/Wholesale Banking; Vehicle Financing; Other Lending Activities; Broking; Advisory and Transactional Services; Asset Management; and Insurance segments. The company offers savings, current, retail institution, corporate, and salary accounts; NRE and NRO fixed deposits and foreign currency n	3745838792704.0	13.0	19.38	21.483209368805568	22.320547630053778		811127235000.0	0.0	0.0	867510344000.0	1574893498000.0	81.54929807499096	15.787405554573438	4.19208850204691	15.224494738313968	22.320547630053778	0.6820842835332033	2.3199815978894907	헐값	안심(>=2)	53.141095260107555	1029.8744261408845	173.4663859399418	양호	충분
AXISBANK.NS	AXISBANK.NS	India Nifty 50	1294.199951171875	-5.560425560760485	4.48893724219841		-7.7548145992961555	1277.3599945068358	1226.4950006103516	Y	Y	상승전환/양호	AXIS BANK LIMITED	NSI	INR	Financial Services	Banks - Regional	Banks - Regional	Axis Bank Limited provides various financial products and services in India and internationally. The company operates through four segments: Treasury, Retail Banking, Corporate/Wholesale Banking, and Other Banking Business. It provides fixed, recurring, and safe deposits; and saving, salary, current, safe custody, pension disbursement, and demat and trading accounts. The company also offers home, personal, business, car, two-wheeler, commercial vehicle construction equipment, education, gold, tr	4023162241024.0	8.0	84.53	-5.953496528796354	34.605620932767664		1093515700000.0	0.0	0.0	2805108200000.0	2150353500000.0	351.7700440352962	-34.892481693112295	-2.696065755644464	11.149058406915637	34.605620932767664	0.3221747827780984	3.8214546356972954	매우 유망	안심(>=2)	60.0	5071.8	291.88689471109745	보류	충분
ASIANPAINT.NS	ASIANPAINT.NS	India Nifty 50	2519.0	4.263245033112573	-0.7759858018188126		-15.142327774970521	2325.5900024414063	2524.1544995117188	Y	N	상승전환/양호	ASIAN PAINTS LIMITED	NSI	INR	Basic Materials	Specialty Chemicals	Specialty Chemicals	Asian Paints Limited, together with its subsidiaries, engages in the manufacture, distribution, and sale of paints, coatings, and products related to home decoration and bath fittings in India, Asia, the Middle East, Africa, and the South Pacific region. The company offers wall coverings; waterproofing products; adhesives; and bath fittings and sanitaryware, modular kitchens and wardrobes, fabric, furnishings and rugs, decorative lightings, unplasticized polyvinyl chloride windows and door syste	2414824914944.0	1.03	40.1	-32.837444576510514	6.562551277275386		89298600000.0	2596200000.0	6041300000.0	22902900000.0	193998100000.0	90.4427225533116	27.057898466917806	1.0741523805842719	60.56252562211192	6.562551277275386	9.228503224321628	0.12536715071379517	매우 불리	불리(<1)	21.62510255455077	867.1666124374859	-65.57496576270401	보류	충분
MARUTI.NS	MARUTI.NS	India Nifty 50	13722.0	-6.007260771285705	-15.32765642354683		-20.645385149201946	13117.425	14829.045	Y	N	주의	MARUTI SUZUKI INDIA LTD.	NSI	INR	Consumer Cyclical	Auto Manufacturers	Auto Manufacturers	Maruti Suzuki India Limited manufactures, purchases, and sells motor vehicles, components, and spare parts in India. The company offers passenger vehicles, utility vehicles, and multi-purpose vehicles. It is also involved in the facilitation of pre-owned car sales, fleet management, and car financing activities. In addition, the company offers driving school, insurance, accessories, and financing products and services. It also exports its products to South Africa, Saudi Arabia, Chile, Japan, Mex	4314231996416.0	1.04	467.22	1.2365346684873213	21.109694032148575		346247000000.0	0.0	0.0	1025000000.0	1071563000000.0	1101.2855130123712	276.7884463948441	2.0171144614111944	27.01235924615305	21.109694032148575	1.2796187005370676	0.8199836908100876	보통	불리(<1)	50.71938806429715	23697.112491400916	72.69430470340268	보류	충분
SUNPHARMA.NS	SUNPHARMA.NS	India Nifty 50	1850.199951171875	16.416025566482894	7.826792053556408		0.0	1747.4325012207032	1701.816498413086	Y	Y	상승전환/양호	SUN PHARMACEUTICAL IND L	NSI	INR	Healthcare	Drug Manufacturers - Specialty & Generic	Drug Manufacturers - Specialty & Generic	Sun Pharmaceutical Industries Limited, a generic pharmaceutical company, develops, manufactures, and markets branded and generic formulations, and active pharmaceutical ingredients (APIs) in India, the United States, and internationally. The company offers formulations in various therapeutic areas, including neuropsychiatry, cardiology, diabetes, gastroenterology, pain/analgesics, gynecology, ophthalmology, urology, dermatology, respiratory, anti-infectives, oncology, psychiatry, neurology, orth	4439249256448.0	91.0	45.52	14.124961624329856	49.47111675709046		423665100000.0	25200000.0	18671100000.0	23621900000.0	722180200000.0	176.56555057837548	49.77841839232644	2.69043453172712	36.76701231532292	49.47111675709046	0.7432015835796405	3.8205746921282504	헐값	안심(>=2)	60.0	2731.2000000000003	47.61647779042042	양호	충분
TITAN.NS	TITAN.NS	India Nifty 50	4359.60009765625	9.609297649132099	16.23430704698543		-3.6744030640487924	4266.690020751953	3889.316008300781	Y	Y	상승전환/양호	TITAN COMPANY LIMITED	NSI	INR	Consumer Cyclical	Luxury Goods	Luxury Goods	Titan Company Limited, together with its subsidiaries, manufactures and sells watches, jewelry, eyewear, and other accessories and products in India and internationally. It operates through four segments: Watches and Wearables, Jewellery, Eyecare, and Others. The company designs, manufactures, and retails watches and wearables under the Nebula, Titan, Titan Clocks, Zoop, Titan Octane, Raga, Xylys, Edge, Fastrack, Sonata, Titan Smart, Fastrack smart, SF, Titan World, and Helios brands; jewellery 	3867162443776.0	25.0	53.8	-4.548054919908462	15.371576412667975		44190000000.0	5950000000.0	175010000000.0	207770000000.0	116240000000.0	43.109412478005915	-11.667950291510492	-0.26763808675440803	80.2321688694841	15.371576412667975	5.2195146883805235	0.5031844082183736	매우 불리	불리(<1)	39.243152825335955	2111.281622003074	-51.57166770552847	보류	충분
ULTRACEMCO.NS	ULTRACEMCO.NS	India Nifty 50	12093.0	-4.734520245785411	0.3318675848336561		-7.347532945142509	11433.6	12078.44	Y	Y	상승전환/양호	ULTRATECH CEMENT LIMITED	NSI	INR	Basic Materials	Building Materials	Building Materials	UltraTech Cement Limited, together with its subsidiaries, engages in the manufacture and sale of clinker, cement, ready mix concrete, and related products in India, the United Arab Emirates, Bahrain, and Sri Lanka. The company offers ordinary Portland, Portland pozzolana, composite, Weather Plus, and Portland slag; white cement, wall care putty, and value-added products; ready-mix concrete; dry mix mortars, such as tile and marble binders, plasters and mortars, industrial and precision grouts, r	3557393432576.0	65.0	277.54	35.21263894845432	17.26452648493617		129572000000.0	150188200000.0	77618400000.0	237550900000.0	766235400000.0	-70.08269225339998	191.66118216110237	1.5848935926660246	43.82461155960726	17.26452648493617	2.538419550506965	1.8771307618561672	매우 불리	양호(>=1.5)	43.02905296987234	11942.283361258369	-1.246313063273219	보류	충분
WIPRO.NS	WIPRO.NS	India Nifty 50	199.1199951171875	-15.947657134936522	-17.691800337179377		-26.974003259819334	198.76124877929686	236.2532004547119	Y	N	주의	WIPRO LTD	NSI	INR	Technology	Information Technology Services	Information Technology Services	Wipro Limited operates as an information technology (IT), consulting, and business process services company worldwide. It operates through IT Services and IT Products segments. The IT Services segment offers AI-powered IT and IT-enabled services, including digital strategy advisory, customer-centric design, technology and IT consulting, custom application design, development, re-engineering and maintenance, systems integration, package implementation, cloud and infrastructure, business process, 	2086585106432.0	8.51	12.57	18.924057509144255	2.439636282496571		942772000000.0	63954000000.0	97863000000.0	192035000000.0	828309000000.0	83.88077602313997	14.736008057910235	7.400566703126773	9.167797859510543	2.439636282496571	3.7578543675899065	1.194358389036422	매우 불리	보통(1~1.5)	13.379272564993142	168.1774561419638	-15.53964430192617	보류	충분
ONGC.NS	ONGC.NS	India Nifty 50	280.79998779296875	4.4021403606670395	10.320979507193817		-6.834773231810576	280.95374908447263	253.32580017089845	N	Y	상승전환/양호	OIL AND NATURAL GAS CORP.	NSI	INR	Energy	Oil & Gas Integrated	Oil & Gas Integrated	Oil and Natural Gas Corporation Limited, together with its subsidiaries, engages in the exploration, development, production, and distribution of crude oil, natural gas, and value-added products in India and internationally. It operates through Exploration and Production, Refining & Marketing, and Petrochemicals segments. The company engages in the refining and marketing of petroleum products; liquefied natural gas supply; pipelines for transportation of petroleum products; SEZ development; heli	3532542181376.0	6.38	30.24	-26.286672741612062	-7.331705014416712		590156440000.0	984741250000.0	550817790000.0	1878173020000.0	3434404760000.0	-31.36534599421354	27.973924444550995	9.962224238120664	10.32292770460259	-7.331705014416712		-0.09219332360454136	판정불가	불리(<1)	0.0	0.0	-100.0	보류	일부부족
NTPC.NS	NTPC.NS	India Nifty 50	394.8500061035156	10.912923062785286	14.399540224803541		-3.742078412169414	385.7574981689453	348.9865007019043	Y	Y	상승전환/양호	NTPC LTD	NSI	INR	Utilities	Utilities - Regulated Electric	Utilities - Regulated Electric	NTPC Limited operates as an integrated power company in India. It operates through two segments: Generation and Others. The company generates power from fossil fuels, hydro, solar, wind, nuclear, and renewable energy sources. It also engages in the coal mining and energy trading business. NTPC Limited was incorporated in 1975 and is based in New Delhi, India.	3828728987648.0	2.85	18.06	12.54364692490686	11.990471885936493		89387200000.0	2010538800000.0	465212400000.0	2500961500000.0	1840711600000.0	-198.12496103828423	9.438903921738346	2.390503678823244	32.83360836887043	11.990471885936493	2.738308273536811	0.451990281397361	매우 불리	불리(<1)	32.48094377187299	586.6058445200262	48.564223237276316	보류	충분
POWERGRID.NS	POWERGRID.NS	India Nifty 50	315.95001220703125	23.177392673306542	8.387654273424094		-1.542530939109299	305.7975021362305	285.4682507324219	Y	Y	상승전환/양호	POWER GRID CORP. LTD.	NSI	INR	Utilities	Utilities - Regulated Electric	Utilities - Regulated Electric	Power Grid Corporation of India Limited, an electric power transmission utility, engages in the power transmission business in India and internationally. It operates in three segments: Transmission Services, Telecom Services, and Consultancy Services. As of 31 March 2025, the company owned and operated 180,195 circuit kilometers of transmission lines, and 282 substations with an aggregate transformation capacity of 551,961 mega volt amperes. It also provides telecom services that offer overhead 	2938525974528.0	3.83	15.59	-0.33210986081180227	-2.6505173375778845		221761000000.0	1098579500000.0	211070100000.0	1345177100000.0	926628100000.0	-94.27543813970085	12.998349607477243	4.114052573278544	26.31337077272175	-2.6505173375778845		0.044824461016786506	판정불가	불리(<1)	3.198965324844231	49.87186941432156	-84.21526586881654	보류	일부부족
