티커	종목코드	유니버스	현재가	3M수익률(보조,%)	6M수익률(보조,%)	12M수익률(보조,%)	52주고점대비(보조,%)	40일이평(보조)	200일이평(보조)	40일선상회(보조)	200일선상회(보조)	추세판정(보조)	종목명	시장	통화	섹터	산업	업종	사업설명	시가총액	배당수익률(%)	EPS(FY)	EPS Growth 1Y(%)	EPS Growth 3Y CAGR(%)	EPS Growth 5Y CAGR(%)	현금및단기투자	장기부채	단기위험부채	총부채	주주지분	주당순현금(린치식)	주당잉여현금흐름	잉여현금흐름수익률(%)	순현금차감PER(린치식)	사용연성장률(%)	린치PER배수	배당감안점수	린치PER판정	배당감안점수판정	그레이엄적정PER(3년)	그레이엄내재가치(3년)	그레이엄괴리율(3년,%)	종합판정	데이터상태
TATASTEEL.NS	TATASTEEL.NS	India Nifty 50	216.83999633789062	4.244989214094952	19.774637858705656		-1.9400390947376667	206.29075050354004	183.02969993591307	Y	Y	상승전환/양호	TATA STEEL LIMITED	NSI	INR	Basic Materials	Steel	Steel	Tata Steel Limited engages in the manufacture and distribution of steel products in India and internationally. It offers reinforcement bars (rebars) and wire rods, cut-and-bend reinforcement bars, welded wire mesh, prefabricated cages (pre-cages), steel couplers and carpet reinforcement, hot-rolled, cold rolled, coated coil, tubes, rebar, metallic coated, pre-finished steels, alloy steels, and profiles and construction systems. The company also provides solutions in building envelopes, structura	2704395468800.0	1.63	7.34	723.1	-55.99983866003788		129944600000.0	685518100000.0	204120000000.0	948010500000.0	911696300000.0	-44.5462065708686	6.287191957897312	2.899461383544899	35.611199306370466	-55.99983866003788		-1.5267623590063053	판정불가	불리(<1)	0.0	0.0	-100.0	보류	일부부족
HCLTECH.NS	HCLTECH.NS	India Nifty 50	1132.5999755859375	-28.00203463457086	-27.8598741665008		-34.90430716170847	1306.6274963378905	1488.948497314453	N	N	주의	HCL TECHNOLOGIES LTD	NSI	INR	Technology	Information Technology Services	Information Technology Services	HCL Technologies Limited provides IT and business services, engineering, research and development services, software products, and IP-led offerings. It operates through IT and Business Services, Engineering and R&D Services, and HCL Software segments. The company provides application development, management, modernization, and testing services, as well as commercial applications; automation services, including digital integration, business process management, robotic process automation for intel	3064421941248.0	8.54	61.37	-4.301322599194934	3.8683596866436742		557570000000.0	370000000.0	1220000000.0	52150000000.0	751650000000.0	205.93923703527977	68.57126103222443	6.054323018747186	15.099572080017236	3.8683596866436742	3.903352661892245	0.8217689627817261	매우 불리	불리(<1)	16.23671937328735	996.4474679386446	-12.021235262419626	보류	충분
TECHM.NS	TECHM.NS	India Nifty 50	1370.5	-16.666665429584558	-2.6633522727272707		-22.50056655285909	1429.9149993896485	1493.8430017089843	N	N	주의	TECH MAHINDRA LIMITED	NSI	INR	Technology	Information Technology Services	Information Technology Services	Tech Mahindra Limited provides information technology services and solutions in the Americas, Europe, India, and internationally. It operates through Information technology Business and Business Process Services segments. It offers application development maintenance, intelligent automation, testing, performance engineering, cloud consulting, engineering and network, data analytics, and artificial intelligence (AI) services. The company also provides business process services, such as Consulting	1213877190656.0	3.8	54.14	13.157709043866861	-0.14094743522335973		127309000000.0	0.0	696000000.0	21862000000.0	296154000000.0	143.73527897175188	61.828897268300345	4.511411694148147	22.659119339273143	-0.14094743522335973		0.16148255852268328	판정불가	불리(<1)	8.21810512955328	444.92821171401454	-67.53533661335173	보류	일부부족
COALINDIA.NS	COALINDIA.NS	India Nifty 50	462.20001220703125	7.25142107316783	20.741908815578313		-3.998338251515543	455.6825012207031	410.8482499694824	Y	Y	상승전환/양호	COAL INDIA LTD	NSI	INR	Energy	Thermal Coal	Thermal Coal	Coal India Limited, together with its subsidiaries, produces and sells coal and coal products in India. The company offers coking coal for steel making and metallurgical industries, as well as for hard coke manufacturing; semi coking coal for blend-able coal in steel making, merchant coke manufacturing, and other metallurgical industries; and non-coking coal for thermal grade coal for cement, fertilizer, glass, ceramic, paper, chemical, and brick manufacturing, as well as power generation and ot	2848413188096.0	4.85	50.44	-12.42470944167401	-0.706993307310555		1116782200000.0	92323600000.0	45891000000.0	140721800000.0	1191015600000.0	166.23458728687848	49.839873462265636	10.78318306922525	5.867672976212386	-0.706993307310555		0.7060732098542714	판정불가	불리(<1)	7.08601338537889	357.4185151585112	-22.670163193675062	보류	일부부족
NESTLEIND.NS	NESTLEIND.NS	India Nifty 50	1430.5	9.315300832057606	12.806563168572271		-3.741334802459406	1326.622506713867	1254.7810028076171	Y	Y	상승전환/양호	NESTLE INDIA LIMITED	NSI	INR	Consumer Defensive	Packaged Foods	Packaged Foods	Nestlé India Limited engages in the manufacture and sale of food products in India and internationally. The company provides milk products and nutrition, including dairy whitener, condensed milk, UHT milk, yogurt, maternal and infant formula, baby foods, health care nutrition; prepared dishes and cooking aids, such as noodles, sauces, seasonings, pasta, cereals, and pet foods; powdered and liquid beverages comprising instant coffee and tea, as well as ready to drink beverages; and confectionery 	2758453755904.0	82.0	18.1	34.17959272459547			3614200000.0	224800000.0	7308600000.0	11668500000.0	40102100000.0	1.7577009955513891	4.801551232581211	0.33565545142126607	78.9360386190303	34.17959272459547	2.3094493622280146	1.4718193965282964	매우 불리	보통(1~1.5)	8.5	153.85000000000002	-89.24501922404752	보류	충분
ADANIENT.NS	ADANIENT.NS	India Nifty 50	2716.0	21.881175687694565	18.366035408723103		0.0	2197.852487182617	2284.037456665039	Y	Y	상승전환/양호	ADANI ENTERPRISES LIMITED	NSI	INR	Energy	Thermal Coal	Thermal Coal	Adani Enterprises Limited, together with its subsidiaries, operates in the new energy ecosystem, data center, airports, roads, copper, digital space, ropeway system, and other sectors in India and internationally. It operates through the Integrated Resources Management (IRM), Mining Services, Commercial Mining, New Energy Ecosystem, Airport, Road, and Others segments. The company engages in the integrated ecosystem for manufacturing green hydrogen, including solar cells, modules, and wind manufa	3723484725248.0	5.0	73.52	31.560360614171003	55.91755566442864		328628900000.0	761661500000.0	105360600000.0	1066217900000.0	809259500000.0	-332.6686443283854	-238.24510806639495	-8.771911195375367	41.467201364640715	55.91755566442864	0.7415775040935781	1.4690539428680456	헐값	보통(1~1.5)	60.0	4411.2	62.415316642120764	보류	충분
ADANIPORTS.NS	ADANIPORTS.NS	India Nifty 50	1795.0999755859375	15.46279230489831	21.751217163695014		0.0	1545.8025115966798	1461.6570025634765	Y	Y	상승전환/양호	ADANI PORT & SEZ LTD	NSI	INR	Industrials	Marine Shipping	Marine Shipping	Adani Ports and Special Economic Zone Limited, together with its subsidiaries, develops, operates, and maintains port infrastructure in India. The company is involved in the operation of ports and terminals, including bulk and break bulk, container, liquid, LPG, LNG, and crude cargo; ports related infrastructure development activities; and development of infrastructure at contiguous Special Economic Zone at Mundra. It also offers logistic services, which include logistic parks, container rail an	4135836712960.0	42.0	58.17	15.45124505175206	34.11377534025834		186454500000.0	504241600000.0	46788100000.0	633989900000.0	961253000000.0	-137.9308774517142	21.857766504498944	1.2176350510708664	33.23071777613291	34.11377534025834	0.9741143407518629	2.290464378561364	헐값	안심(>=2)	60.0	3490.2000000000003	94.42928235018032	양호	충분
JSWSTEEL.NS	JSWSTEEL.NS	India Nifty 50	1278.800048828125	2.7891708000271187	7.326902965012594		-1.395633838014232	1219.657504272461	1161.0845037841798	Y	Y	상승전환/양호	JSW STEEL LIMITED	NSI	INR	Basic Materials	Steel	Steel	JSW Steel Limited manufactures and sells iron and steel products in India and internationally. The company offers color coated steel products, color-coated roofing sheets, galvalume coil and sheets, aluminum-zinc sheets, galvanized corrugated sheets, tin plate products, lead-free coils and sheets, Al-Zn-Mg coated galvanized steel, multi-utility steel sheets, hot rolled and cold-rolled coils, cold rolled close annealed, electrical, coated steel products, TMT bars, wire rods, alloy steel products,	3121082007552.0	55.00000000000001	91.3	-60.23604176123468	-44.651027551942825		254130000000.0	819190000000.0	345080000000.0	1192220000000.0	794960000000.0	-231.52187039803624	33.61832277308405	2.6288959563218213	16.542408753846235	-44.651027551942825		0.6256025106168996	판정불가	불리(<1)	0.0	0.0	-100.0	보류	일부부족
CIPLA.NS	CIPLA.NS	India Nifty 50	1432.0999755859375	6.705908772608948	-5.465710442519178		-13.915604916888945	1274.115005493164	1440.5915032958985	Y	N	상승전환/양호	CIPLA LTD	NSI	INR	Healthcare	Drug Manufacturers - Specialty & Generic	Drug Manufacturers - Specialty & Generic	Cipla Limited, together with its subsidiaries, manufactures, develops, sells, and distributes pharmaceutical products in India, the United States, South Africa, and internationally. The company operates through Pharmaceuticals and New Ventures segments. It offers generic and branded generic medicines, vaccines, active pharmaceutical ingredients, and formulations for various therapeutic areas, such as MI, angina, heart disease, pulmonary disease, kidney failure, Alzheimer's disease, hypertension,	1156851171328.0	90.0	47.99	27.925659036042273	27.955626091587817		206298700000.0	119800000.0	801200000.0	4381900000.0	311934500000.0	255.23491042552476	42.79249397783893	2.9880940372427953	24.523131176503703	27.955626091587817	0.8772163104543385	4.8099741114872145	헐값	안심(>=2)	60.0	2879.4	101.0613818230048	양호	충분
DRREDDY.NS	DRREDDY.NS	India Nifty 50	1336.699951171875	6.4251553480792145	10.334292296481639		-1.9079768791098073	1269.9675018310547	1259.4960003662109	Y	Y	상승전환/양호	DR. REDDY S LABORATORIES	NSI	INR	Healthcare	Drug Manufacturers - Specialty & Generic	Drug Manufacturers - Specialty & Generic	Dr. Reddy's Laboratories Limited, together with its subsidiaries, operates as an integrated pharmaceutical company North America, Europe, India, Russia, and internationally. It operates through Global Generics, Pharmaceutical Services and Active Ingredients (PSAI), and Others segment. The Global Generics segment manufactures and markets prescription and over-the-counter finished pharmaceutical products that are marketed under a brand name or as a generic finished dosages with therapeutic equival	1112929468416.0	61.0	50.32	1.5444292795057768	33.87143933281283		101162000000.0	3800000000.0	38045000000.0	46766000000.0	333388000000.0	116.93803446203343	14.448805022270106	1.0809310653152149	24.240101683422928	33.87143933281283	0.7156501808277282	3.913821838366814	헐값	안심(>=2)	60.0	3019.2	125.86968731113437	양호	충분
GRASIM.NS	GRASIM.NS	India Nifty 50	2933.800048828125	-0.6804514093276093	5.692052641425072		-1.6888916013807376	2752.1875122070314	2790.7724951171876	Y	Y	상승전환/양호	GRASIM INDUSTRIES LTD	NSI	INR	Basic Materials	Building Materials	Building Materials	Grasim Industries Limited, together with its subsidiaries, primarily produces cellulosic fibres, diversified chemicals, fashion yarns, and fabrics in india and internationally. The company operates through Cellulosic Fibres, Chemicals, Building Materials, Financial Services, and Others segments. It offers cellulosic staple fibre; and cellulosic fashion yarn; chlor-alkali comprising caustic soda; chlorine derivatives, and specialty chemicals, that include epoxy polymers and curing agents. The com	1989623414784.0	34.0	66.71	-34.115270895672325	-21.118007440068943		536173600000.0	1239160900000.0	597216000000.0	1863145600000.0	975092300000.0	-1036.6791908279279	-506.56614304893196	-17.26655309216708	59.518501568821065	-21.118007440068943		0.2164367754627634	판정불가	불리(<1)	0.0	0.0	-100.0	보류	일부부족
HINDALCO.NS	HINDALCO.NS	India Nifty 50	1067.5	10.176486025538644	34.488188976377955		-3.2448153035205762	991.363752746582	858.5807516479492	Y	Y	상승전환/양호	HINDALCO  INDUSTRIES  LTD	NSI	INR	Basic Materials	Aluminum	Aluminum	Hindalco Industries Limited, together with its subsidiaries, manufactures and distributes aluminum and copper products in India, the United States, Brazil, South Korea, the United Kingdom, Germany, China, and internationally. It operates through Novelis, Aluminium Upstream, Aluminium Downstream, and Copper segments. The company offers primary aluminum, such as ingots, wirerods, primary foundry alloys, and billets; flat rolled products, including building and pattern sheets, PCB entry and cold-ro	2387093487616.0	45.0	72.27	57.56770064007879	5.23467463835805		348580000000.0	562170000000.0	57140000000.0	639290000000.0	1237090000000.0	-95.51671112509926	16.81906224736637	1.5755561824230793	16.092662392764623	5.23467463835805	3.074243100964223	3.121588796950337	매우 불리	안심(>=2)	18.969349276716102	1370.9148722282725	28.422938850423662	보류	충분
HEROMOTOCO.NS	HEROMOTOCO.NS	India Nifty 50	5064.5	-11.975319370817761	-6.515920627595751		-20.250373986300296	5172.4625	5427.270505371093	N	N	주의	HERO MOTOCORP LIMITED	NSI	INR	Consumer Cyclical	Auto Manufacturers	Auto Manufacturers	Hero MotoCorp Limited primarily engages in the manufacture and sale of motorised two wheelers in India, Asia, Central and Latin America, Africa, and the Middle East. The company offers motorcycles and scooters, as well as electric scooters. It provides engines, parts, and accessories, as well as non-banking financial and other related services. The company is also involved in merchandise business. The company was formerly known as Hero Honda Motors Ltd. and changed its name to Hero MotoCorp Limi	1013370716160.0	3.64	286.85	31.1352341451828	26.895886141440116		254871500000.0	0.0	4985500000.0	7786100000.0	216111900000.0	1273.7655938661862	360.55845209289697	7.119329688871496	13.215040634944442	26.895886141440116	0.4913405925891109	2.3106918082941252	매우 유망	안심(>=2)	60.0	17211.0	239.83611412775198	매우 유망	충분
BPCL.NS	BPCL.NS	India Nifty 50	284.45001220703125	-26.37504653466527	-23.97433733869586		-26.744779513438345	297.2050018310547	338.49425094604493	N	N	주의	BHARAT PETROLEUM CORP  LT	NSI	INR	Energy	Oil & Gas Refining & Marketing	Oil & Gas Refining & Marketing	Bharat Petroleum Corporation Limited engages in refining crude oil and marketing petroleum products in India and internationally. It operates through two segments, Downstream Petroleum; and Exploration and Production of Hydrocarbons. The company operates fuel stations that sell motor spirits, high-speed diesel, blended fuels, compressed and liquefied natural gas, automotive liquefied petroleum gas (LPG), and lubricants; operate convenience stores, restaurants, and electric vehicle charging facil	1215336808448.0	6.78	57.58	-50.345770703425764	4.515722730025629		270798300000.0	265278800000.0	245330300000.0	611005700000.0	813840800000.0	1.2918409259902277	19.9754253026923	7.022472998930156	4.917647990292481	4.515722730025629	1.0890057437748333	2.2969766750941862	보통	안심(>=2)	17.53144546005126	1009.4606295897514	254.88155607989066	보류	충분
EICHERMOT.NS	EICHERMOT.NS	India Nifty 50	7014.5	-3.8582785087719285	2.058780736214172		-14.352869352869357	7048.7375	6961.48	N	Y	상승전환/양호	EICHER MOTORS LTD	NSI	INR	Consumer Cyclical	Auto Manufacturers	Auto Manufacturers	Eicher Motors Limited, an automobile company, engages in the manufacture and sale of motorcycles and commercial vehicles in India and internationally. The company designs, develops, manufactures, assembles, and sells two-wheelers, as well as related parts and accessories; motorcycle accessories; protective and performance gears, and riding apparel products for men and women; and lifestyle apparel products and accessories. It also owns the Royal Enfield motorcycle brand that offers Classic 350, B	1924177068032.0	1.0	194.84	18.33112139184856	41.344761842853586		72882600000.0	1843600000.0	821100000.0	4581300000.0	212964900000.0	258.969455333053	107.19787590729352	1.5282326025702975	34.67219536371868	41.344761842853586	0.838611563310087	1.2212887415592828	헐값	보통(1~1.5)	60.0	11690.4	66.66048898709815	보류	충분
APOLLOHOSP.NS	APOLLOHOSP.NS	India Nifty 50	8082.5	11.96149051115112	7.752299693374209		-0.4495627540337499	7636.8125	7504.5275	Y	Y	상승전환/양호	APOLLO HOSPITALS ENTER. L	NSI	INR	Healthcare	Medical Care Facilities	Medical Care Facilities	Apollo Hospitals Enterprise Limited, together with its subsidiaries, provides healthcare services in India. It operates through Healthcare Services, Retail Health & Diagnostics, Digital Health & Pharmacy Distribution, and Others segments. The company's healthcare facilities comprise primary, secondary, and tertiary care, as well as specialty facilities. It offers services in cardiac sciences, oncology, neurosciences, gastroenterology, orthopedics, urology, organ transplantation, pulmonology, obs	1162139533312.0	25.0	125.03	60.90585354996661	11.057090633672306		34427000000.0	19719000000.0	8582000000.0	54192000000.0	82123000000.0	102.29185997223613	29.46767818210256	0.36458618227160605	63.82634679699083	11.057090633672306	5.772435888570869	0.5649248694799536	매우 불리	불리(<1)	30.614181267344613	3827.691083856097	-52.642238368622365	보류	충분
BRITANNIA.NS	BRITANNIA.NS	India Nifty 50	5406.0	-7.959479015918958	-9.150491555331486		-14.19728592968812	5615.1375	5846.535	N	N	주의	BRITANNIA INDUSTRIES LTD	NSI	INR	Consumer Defensive	Packaged Foods	Packaged Foods	Britannia Industries Limited manufactures and sells various food products in India and internationally. The company offers biscuits under the Good Day, Marie Gold, NutriChoice, Milk Bikis, Tiger, 50-50, Jim Jam, Britannia Bourbon, Little Hearts, Treat, Pure Magic, Nice Time, and Biscafe brand names; cakes under the Muffills, Fudge It, Gobbles, Layerz, Tiffin Fun, Rollyo, and Nut & Raisin Romance Cake brand names; rusks under the Toastea brand; center filled croissants under the Treat Croissant b	1302133997568.0	1.68	105.3	16.2828803936238	2.9516551243742306		50909800000.0	2861100000.0	10717200000.0	13802800000.0	51065600000.0	199.48121358404097	99.88985848100158	1.8477591283944057	49.444622852953074	2.9516551243742306	16.75149052633161	0.0936735858649108	매우 불리	불리(<1)	14.403310248748461	1516.668569193213	-71.94471755099495	보류	충분
BAJAJ-AUTO.NS	BAJAJ-AUTO.NS	India Nifty 50	10377.5	6.174544710456309	16.666666666666675		-3.118144050786542	9630.9375	9197.5725	Y	Y	상승전환/양호	BAJAJ AUTO LIMITED	NSI	INR	Consumer Cyclical	Auto Manufacturers	Auto Manufacturers	Bajaj Auto Limited, together with its subsidiaries, engages in the development, manufacture, and distribution of automobiles in India and internationally. The company offers motorcycles, bikes, commercial vehicles, electric two-wheelers, and three-wheeler, as well as related parts and accessories. It also exports its products. The company was founded in 1945 and is based in Pune, India.	2898142429184.0	1.44	384.6	46.68404159607249	21.03071664453431		241990300000.0	153389400000.0	66416500000.0	226397800000.0	388319900000.0	317.25695632790735	67.11312956259701	0.6467177023618117	26.157678220676267	21.03071664453431	1.2437844445721449	0.8590485919645724	보통	불리(<1)	50.56143328906862	19445.92724297579	87.38547090316348	보류	충분
TATACONSUM.NS	TATACONSUM.NS	India Nifty 50	1234.0	7.099466437655044	6.728944137151216		-2.9110936270652976	1121.1899871826172	1133.365498046875	Y	Y	상승전환/양호	TATA CONSUMER PRODUCT LTD	NSI	INR	Consumer Defensive	Packaged Foods	Packaged Foods	Tata Consumer Products Limited, together with its subsidiaries, produces, distributes, and trades in food products in India, the United States, the United Kingdom, and internationally. It operates through Branded Business and Non Branded Business segments. The company provides tea, coffee products, salt, mineral water, food ingredients, sweeteners, ready to cook and ready to eat options, breakfast cereals, snacks, mini meals, pulses, spices, instant noodles, blended masalas, Chinese sauces, pizz	1221288263680.0	81.0	15.6	11.139412168682039	10.961485146171789		34938300000.0	1906800000.0	16579700000.0	23926800000.0	200010800000.0	33.37992702183789	16.139568365302065	1.307906674659811	76.96282519090784	10.961485146171789	7.0212041675562995	1.1948818785960555	매우 불리	보통(1~1.5)	30.422970292343578	474.5983365605598	-61.53984306640521	보류	충분
DIVISLAB.NS	DIVISLAB.NS	India Nifty 50	6760.5	10.583135683323786	1.031158932974674		-3.1932412114269337	6282.0625	6298.81	Y	Y	상승전환/양호	DIVI S LABORATORIES LTD	NSI	INR	Healthcare	Drug Manufacturers - Specialty & Generic	Drug Manufacturers - Specialty & Generic	Divi's Laboratories Limited engages in the manufacture and sale of generic active pharmaceutical ingredients (APIs), intermediates, and nutraceuticals in India, North America, Asia, Europe, and internationally. The company also undertakes custom synthesis contract manufacturing services of APIs and intermediates; and supplies a range of carotenoids, such as beta carotene, astaxanthin, lycopene, and canthaxanthin, as well as lutein and vitamins used in the food, beverage, dietary supplement, pet 	1794700345344.0	43.0	93.44	36.9375	-9.545908575211005		66630000000.0	0.0	20000000.0	40000000.0	149690000000.0	250.99015484242994	8.098886881453165	0.11979715821985304	69.66513104834729	-9.545908575211005		0.4802128542839029	판정불가	불리(<1)	0.0	0.0	-100.0	보류	일부부족
INDUSINDBK.NS	INDUSINDBK.NS	India Nifty 50	886.4000244140625	-4.441564495066985	7.299364557583399		-8.106982495450833	855.0937530517579	836.0930017089844	Y	Y	상승전환/양호	INDUSIND BANK LIMITED	NSI	INR	Financial Services	Banks - Regional	Banks - Regional	IndusInd Bank Limited provides various banking products and financial services to individuals, corporations, government entities, and public sector undertakings in India. It operates in four segments: Treasury, Corporate/Wholesale Banking, Retail Banking, and Other Banking Operations. The company offers savings, salary, RFC, and uniformed personnel accounts; current accounts comprising smart, everyday, premium, trade, startup, and specialized accounts; fixed, recurring, sweep in/out, senior citi	690599690240.0	17.0	11.44	-65.46976556372644	-50.74727610509653		489323500000.0	0.0	0.0	427891900000.0	657396300000.0	628.0575970647141	3.863145251853582	0.43582413644530743	22.582380013054934	-50.74727610509653		-1.4944074134607221	판정불가	불리(<1)	0.0	0.0	-100.0	보류	일부부족
SHRIRAMFIN.NS	SHRIRAMFIN.NS	India Nifty 50	937.9000244140625	-10.556928642881003	12.687737374731455		-15.091431726987736	969.4437484741211	847.6777481079101	N	Y	상승전환/양호	SHRIRAM FINANCE LIMITED	NSI	INR	Financial Services	Credit Services	Credit Services	Shriram Finance Limited, a non-banking finance company, provides financing services in India. It offers fixed and recurring deposits; commercial vehicle loans for commercial goods vehicles, passenger commercial vehicles, tractors and farm equipment, and construction equipment; two-wheeler, gold, used car loan, and personal loans; and green finance services. The company also provides business loans, such as MSME loans; working capital loans, including tyre, tax, fuel, toll financing, repair/top-u	2206719803392.0	1.48	53.21	4.923056955228389	18.58582810449043		79431300000.0	0.0	0.0	1812116200000.0	659185900000.0	33.75988950514179	-57.282790283775334	-6.10755824636659	16.991921347658725	18.58582810449043	0.9142407458053154	1.1809040127916584	헐값	보통(1~1.5)	45.67165620898086	2430.1888268798716	159.1095813648253	보류	충분
HDFCLIFE.NS	HDFCLIFE.NS	India Nifty 50	608.7000122070312	-13.530790304466533	-20.316796340735166		-25.24867722805495	605.2212524414062	719.4022479248047	Y	N	주의	HDFC LIFE INS CO LTD	NSI	INR	Financial Services	Insurance - Life	Insurance - Life	HDFC Life Insurance Company Limited provides individual and group insurance solutions in India. It offers insurance and investment products, such as protection, pension, savings, investment, annuity, and health, as well as term, investment, and life insurance plans. The company was formerly known as HDFC Standard Life Insurance Company Limited changed its name to HDFC Life Insurance Company Limited in January 2019. HDFC Life Insurance Company Limited was incorporated in 2000 and is headquartered	1313136181248.0	34.0	8.88	5.605195436321675	11.805242919673354		73289900000.0	30990000000.0	0.0	30990000000.0	177495400000.0	19.607981274187132	103.54693449945601	17.011160246902968	66.33919267261757	11.805242919673354	5.619468665237187	0.6904703098471698	매우 불리	불리(<1)	32.11048583934671	285.14111425339877	-53.1557239140622	보류	충분
