티커	종목코드	유니버스	현재가	3M수익률(보조,%)	6M수익률(보조,%)	12M수익률(보조,%)	52주고점대비(보조,%)	40일이평(보조)	200일이평(보조)	40일선상회(보조)	200일선상회(보조)	추세판정(보조)	종목명	시장	통화	섹터	산업	업종	사업설명	시가총액	배당수익률(%)	EPS(FY)	EPS Growth 1Y(%)	EPS Growth 3Y CAGR(%)	EPS Growth 5Y CAGR(%)	현금및단기투자	장기부채	단기위험부채	총부채	주주지분	주당순현금(린치식)	주당잉여현금흐름	잉여현금흐름수익률(%)	순현금차감PER(린치식)	사용연성장률(%)	린치PER배수	배당감안점수	린치PER판정	배당감안점수판정	그레이엄적정PER(3년)	그레이엄내재가치(3년)	그레이엄괴리율(3년,%)	종합판정	데이터상태
HDFCLIFE.NS	HDFCLIFE.NS	India Nifty 50	568.75	-7.737855667526771	-24.633938700048674		-28.59832920519437	580.1037475585938	678.8582485961914	N	N	주의	HDFC LIFE INS CO LTD	NSI	INR	Financial Services	Insurance - Life	Insurance - Life	HDFC Life Insurance Company Limited engages in the provision of individual and group insurance solutions in India. It offers insurance and investment products, such as protection, pension, savings, investment, annuity, and health, as well as term, investment, life insurance, and NRI plans. The company was formerly known as HDFC Standard Life Insurance Company Limited changed its name to HDFC Life Insurance Company Limited in January 2019. HDFC Life Insurance Company Limited was incorporated in 2	1235288195072.0	38.0	8.89	5.605195436321675	11.805242919673354		76825800000.0	30990000000.0	0.0	30990000000.0	177495400000.0	21.103668801212137	102.84823665593547	18.083206444999643	61.6025119458704	11.805242919673354	5.218233319300041	0.8084937017412017	매우 불리	불리(<1)	32.11048583934671	285.46221911179225	-49.80884059572883	보류	충분
SBILIFE.NS	SBILIFE.NS	India Nifty 50	1866.4000244140625	-5.302146161932653	-11.039083679024664		-11.528254739482657	1800.6799926757812	1919.6784997558593	Y	N	주의	SBI LIFE INSURANCE CO LTD	NSI	INR	Financial Services	Insurance - Life	Insurance - Life	SBI Life Insurance Company Limited operates as a private life insurance company in India. The company's life insurance business comprises individual and group life insurance products, including participating, non-participating, pension, group gratuity, group leave encashment, group superannuation, group immediate annuity, unit-linked and variable insurance products, health, and micro insurance. It also provides accident and disability benefit, level term, and critical illness insurance products.	1872486465536.0	15.0	24.66	2.361911076119827	12.812939479871188		33806300000.0	0.0	0.0	0.0	190860000000.0	33.6964143081205	342.2605711644043	18.338007216424764	74.31888118839993	12.812939479871188	5.800299088679304	0.3742378657364984	매우 불리	불리(<1)	34.12587895974238	841.5441751472471	-54.91083561191865	보류	충분
BAJAJFINSV.NS	BAJAJFINSV.NS	India Nifty 50	1849.5999755859375	0.5818669329391346	-7.469110360929099		-15.02343597349023	1784.4799865722657	1919.981000366211	Y	N	상승전환/양호	BAJAJ FINSERV LTD.	NSI	INR	Financial Services	Financial Conglomerates	Financial Conglomerates	Bajaj Finserv Ltd., through its subsidiaries, provides financial services in India. The company operates through Life Insurance, General Insurance, Windmill, Retail Financing, and Investments and Others segments. It offers personal, home, business, gold, loan for doctors and lawyers; loan against properties, securities, car, fixed deposit, insurance policy, mutual funds, and shares; unsecured and secured loans to small and medium-sized enterprises; two- and three-wheeler loans; used car and trac	2957017088000.0	7.000000000000001	60.94	10.46694716483081	15.161158100432036		1872086700000.0	3206940100000.0	390180700000.0	3613785100000.0	779150700000.0	-834.9443545235367	-354.9659445151457	-19.19149811854293	44.05225352985681	15.161158100432036	2.905599508826538	0.503065253753979	매우 불리	불리(<1)	38.82231620086407	2365.8319492806563	27.91046607422132	보류	충분
UPL.NS	UPL.NS	India Nifty 50	597.2999877929688	-10.139916229318457	-22.814498076231125		-25.833487812748825	612.557502746582	680.8864987182617	N	N	주의	UPL LIMITED	NSI	INR	Basic Materials	Agricultural Inputs	Agricultural Inputs	UPL Limited, together with its subsidiaries, manufactures and sells pesticides, insecticides, and micronutrients in India, Brazil, the United States, the United Kingdom, and internationally. It operates in three segments: Crop Protection, Seeds, and Non-Agro. The company offers herbicides, fungicides, insecticides, acaricides, seed treatment, adjuvants, bio-solutions, public health products, fumigants, soil and water technologies, agrochemical products, and other agricultural related products un	504888229888.0	1.01	22.3	114.26978818283166	-18.649219802963866		95190000000.0	155350000000.0	65110000000.0	235760000000.0	346960000000.0	-71.2653240496002	64.54866202564354	10.806740891482635	29.9805072575143	-18.649219802963866		-0.5883562826824013	판정불가	불리(<1)	0.0	0.0	-100.0	보류	일부부족
LTIM.NS	LTIM.NS	India Nifty 50											LTIM.NS													0.0	0.0	0.0	0.0									판정불가	판정불가				판정불가	핵심부족
