티커	종목코드	유니버스	현재가	3M수익률(보조,%)	6M수익률(보조,%)	12M수익률(보조,%)	52주고점대비(보조,%)	40일이평(보조)	200일이평(보조)	40일선상회(보조)	200일선상회(보조)	추세판정(보조)	종목명	시장	통화	섹터	산업	업종	사업설명	시가총액	배당수익률(%)	EPS(FY)	EPS Growth 1Y(%)	EPS Growth 3Y CAGR(%)	EPS Growth 5Y CAGR(%)	현금및단기투자	장기부채	단기위험부채	총부채	주주지분	주당순현금(린치식)	주당잉여현금흐름	잉여현금흐름수익률(%)	순현금차감PER(린치식)	사용연성장률(%)	린치PER배수	배당감안점수	린치PER판정	배당감안점수판정	그레이엄적정PER(3년)	그레이엄내재가치(3년)	그레이엄괴리율(3년,%)	종합판정	데이터상태
HDFCLIFE.NS	HDFCLIFE.NS	India Nifty 50	591.75	-0.059107515684519996	-22.79339936390291		-27.330221187422012	593.3649963378906	694.0152478027344	N	N	주의	HDFC LIFE INS CO LTD	NSI	INR	Financial Services	Insurance - Life	Insurance - Life	HDFC Life Insurance Company Limited provides individual and group insurance solutions in India. It offers insurance and investment products, such as protection, pension, savings, investment, annuity, and health, as well as term, investment, and life insurance plans. The company was formerly known as HDFC Standard Life Insurance Company Limited changed its name to HDFC Life Insurance Company Limited in January 2019. HDFC Life Insurance Company Limited was incorporated in 2000 and is headquartered	1285242617856.0	35.0	8.84	5.605195436321675	11.805242919673354		73289900000.0	30990000000.0	0.0	30990000000.0	177495400000.0	19.47567359846219	102.84823665593547	17.38035262457718	64.73691475130518	11.805242919673354	5.483742705829591	0.7230070061182473	매우 불리	불리(<1)	32.11048583934671	283.8566948198249	-52.03097679428392	보류	충분
SBILIFE.NS	SBILIFE.NS	India Nifty 50	1767.699951171875	-3.525628769019895	-12.85249803314783		-16.206870053913224	1819.2924865722657	1920.8419982910157	N	N	주의	SBI LIFE INSURANCE CO LTD	NSI	INR	Financial Services	Insurance - Life	Insurance - Life	SBI Life Insurance Company Limited operates as a private life insurance company in India. The company's life insurance business comprises individual and group life insurance products, including participating, non-participating, pension, group gratuity, group leave encashment, group superannuation, group immediate annuity, unit-linked and variable insurance products, health, and micro insurance. It also provides accident and disability benefit, level term, and critical illness insurance products.	1773428146176.0	15.0	24.65	2.361911076119827	12.812939479871188		33806300000.0	0.0	0.0	0.0	190860000000.0	33.697103390760724	342.2675703013411	19.362311464365828	70.34494311485251	12.812939479871188	5.490148706732182	0.39537937267872797	매우 불리	불리(<1)	34.12587895974238	841.2029163576497	-52.41257342344867	보류	충분
BAJAJFINSV.NS	BAJAJFINSV.NS	India Nifty 50	1780.5	6.266786034019689	-12.882867332305626		-18.198110809733414	1756.5549896240234	1935.572501220703	Y	N	상승전환/양호	BAJAJ FINSERV LTD.	NSI	INR	Financial Services	Financial Conglomerates	Financial Conglomerates	Bajaj Finserv Ltd., through its subsidiaries, provides financial services in India. The company operates through Life Insurance, General Insurance, Windmill, Retail Financing, and Investments and Others segments. It offers personal, business, home, home renovation, commercial, car, and gold loans; two- and three-wheeler loans; mortgages; education loans; unsecured and secured loans to small and medium-sized enterprises and professionals, as well as micro, small and medium enterprises; loans agai	2846144069632.0	7.000000000000001	61.07	10.46694716483081	15.161158100432036		891201400000.0	3597117900000.0	312442200000.0	3613782200000.0	779145300000.0	-1692.7759949660017	-355.01592039577963	-19.939113754326293	56.87368585174393	15.161158100432036	3.7512758243793556	0.38965573917964214	매우 불리	불리(<1)	38.82231620086407	2370.878850386769	33.158037089961745	보류	충분
UPL.NS	UPL.NS	India Nifty 50	599.25	-0.522912398140496	-20.264784813611513		-25.591355539060913	632.4362487792969	688.7919985961914	N	N	주의	UPL LIMITED	NSI	INR	Basic Materials	Agricultural Inputs	Agricultural Inputs	UPL Limited, together with its subsidiaries, manufactures and sells pesticides, insecticides, and micronutrients in India, Brazil, the United States, the United Kingdom, and internationally. It operates in three segments: Crop Protection, Seeds, and Non-Agro. The company offers herbicides, fungicides, insecticides, acaricides, seed treatment, adjuvants, bio-solutions, public health products, fumigants, soil and water technologies, agrochemical products, and other agricultural related products un	506536525824.0	1.01	22.32	114.26978818283166	-18.649219802963866		95190000000.0	155350000000.0	65110000000.0	235760000000.0	346960000000.0	-71.2653240496002	64.54866202564354	10.7715748061149	30.041009142007177	-18.649219802963866		-0.5871713469937484	판정불가	불리(<1)	0.0	0.0	-100.0	보류	일부부족
LTIM.NS	LTIM.NS	India Nifty 50											LTIM.NS													0.0	0.0	0.0	0.0									판정불가	판정불가				판정불가	핵심부족
