티커	종목코드	유니버스	현재가	3M수익률(보조,%)	6M수익률(보조,%)	12M수익률(보조,%)	52주고점대비(보조,%)	40일이평(보조)	200일이평(보조)	40일선상회(보조)	200일선상회(보조)	추세판정(보조)	종목명	시장	통화	섹터	산업	업종	사업설명	시가총액	배당수익률(%)	EPS(FY)	EPS Growth 1Y(%)	EPS Growth 3Y CAGR(%)	EPS Growth 5Y CAGR(%)	현금및단기투자	장기부채	단기위험부채	총부채	주주지분	주당순현금(린치식)	주당잉여현금흐름	잉여현금흐름수익률(%)	순현금차감PER(린치식)	사용연성장률(%)	린치PER배수	배당감안점수	린치PER판정	배당감안점수판정	그레이엄적정PER(3년)	그레이엄내재가치(3년)	그레이엄괴리율(3년,%)	종합판정	데이터상태
HDFCLIFE.NS	HDFCLIFE.NS	India Nifty 50	560.5999755859375	-16.14688717045648	-26.314407915252268		-31.155595727643938	601.5662490844727	705.3624975585938	N	N	주의	HDFC LIFE INS CO LTD	NSI	INR	Financial Services	Insurance - Life	Insurance - Life	HDFC Life Insurance Company Limited provides individual and group insurance solutions in India. It offers insurance and investment products, such as protection, pension, savings, investment, annuity, and health, as well as term, investment, and life insurance plans. The company was formerly known as HDFC Standard Life Insurance Company Limited changed its name to HDFC Life Insurance Company Limited in January 2019. HDFC Life Insurance Company Limited was incorporated in 2000 and is headquartered	1209444728832.0	37.0	8.86	5.605195436321675	11.805242919673354		73289900000.0	30990000000.0	0.0	30990000000.0	177495400000.0	19.606785760694013	103.54062116430772	18.469608575363807	61.060179438515064	11.805242919673354	5.1722933491490215	0.7992974041096309	매우 불리	불리(<1)	32.11048583934671	284.4989045366118	-49.25099591036294	보류	충분
SBILIFE.NS	SBILIFE.NS	India Nifty 50	1769.0999755859375	-8.884425328030964	-11.673076338222222		-16.1405056080821	1851.559994506836	1924.4815002441405	N	N	주의	SBI LIFE INSURANCE CO LTD	NSI	INR	Financial Services	Insurance - Life	Insurance - Life	SBI Life Insurance Company Limited operates as a private life insurance company in India. The company's life insurance business comprises individual and group life insurance products, including participating, non-participating, pension, group gratuity, group leave encashment, group superannuation, group immediate annuity, unit-linked and variable insurance products, health, and micro insurance. It also provides accident and disability benefit, level term, and critical illness insurance products.	1774710685696.0	15.0	24.7	2.361911076119827	12.812939479871188		33806300000.0	0.0	0.0	0.0	190860000000.0	33.69942090492378	342.2911097116141	19.348319169935273	70.2591317684621	12.812939479871188	5.4834514655155795	0.3958622712778221	매우 불리	불리(<1)	34.12587895974238	842.9092103056367	-52.3537831700857	보류	충분
BAJAJFINSV.NS	BAJAJFINSV.NS	India Nifty 50	1693.0999755859375	-9.406605304274729	-17.377512398548255		-22.21354867120251	1774.7774932861328	1947.032001953125	N	N	주의	BAJAJ FINSERV LTD.	NSI	INR	Financial Services	Financial Conglomerates	Financial Conglomerates	Bajaj Finserv Ltd., through its subsidiaries, provides financial services in India. The company operates through Life Insurance, General Insurance, Windmill, Retail Financing, and Investments and Others segments. It offers personal, business, home, home renovation, commercial, car, and gold loans; two- and three-wheeler loans; mortgages; education loans; unsecured and secured loans to small and medium-sized enterprises and professionals, as well as micro, small and medium enterprises; loans agai	2706434424832.0	8.0	60.96	10.46694716483081	15.161158100432036		891201400000.0	3597117900000.0	312442200000.0	3613782200000.0	779145300000.0	-1692.7759949660017	-355.01592039577963	-20.968396758314164	55.542584818765405	15.161158100432036	3.663479033121002	0.4169982037387445	매우 불리	불리(<1)	38.82231620086407	2366.608395604674	39.77960130710257	보류	충분
UPL.NS	UPL.NS	India Nifty 50	628.4000244140625	0.007965119769171025	-16.927752756506397		-21.971808100339718	644.1762496948243	694.7919989013672	N	N	주의	UPL LIMITED	NSI	INR	Basic Materials	Agricultural Inputs	Agricultural Inputs	UPL Limited, together with its subsidiaries, manufactures and sells pesticides, insecticides, and micronutrients in India, Brazil, the United States, the United Kingdom, and internationally. It operates in three segments: Crop Protection, Seeds, and Non-Agro. The company offers herbicides, fungicides, insecticides, acaricides, seed treatment, adjuvants, bio-solutions, public health products, fumigants, soil and water technologies, agrochemical products, and other agricultural related products un	531176587264.0	96.0	22.31	114.26978818283166	-18.649219802963866		95190000000.0	155350000000.0	65110000000.0	235760000000.0	346960000000.0	-71.2653240496002	64.54866202564354	10.271906352300112	31.361064476183895	-18.649219802963866		2.466459014992223	판정불가	안심(>=2)	0.0	0.0	-100.0	보류	일부부족
LTIM.NS	LTIM.NS	India Nifty 50											LTIM.NS													0.0	0.0	0.0	0.0									판정불가	판정불가				판정불가	핵심부족
