티커	종목코드	유니버스	현재가	3M수익률(보조,%)	6M수익률(보조,%)	12M수익률(보조,%)	52주고점대비(보조,%)	40일이평(보조)	200일이평(보조)	40일선상회(보조)	200일선상회(보조)	추세판정(보조)	종목명	시장	통화	섹터	산업	업종	사업설명	시가총액	배당수익률(%)	EPS(FY)	EPS Growth 1Y(%)	EPS Growth 3Y CAGR(%)	EPS Growth 5Y CAGR(%)	현금및단기투자	장기부채	단기위험부채	총부채	주주지분	주당순현금(린치식)	주당잉여현금흐름	잉여현금흐름수익률(%)	순현금차감PER(린치식)	사용연성장률(%)	린치PER배수	배당감안점수	린치PER판정	배당감안점수판정	그레이엄적정PER(3년)	그레이엄내재가치(3년)	그레이엄괴리율(3년,%)	종합판정	데이터상태
M&M.NS	M&M.NS	India Nifty 50	2990.10009765625	-10.274565711740436	-18.561389635952796		-21.362818892005787	3126.932513427734	3423.535509033203	N	N	주의	MAHINDRA & MAHINDRA LTD	NSI	INR	Consumer Cyclical	Auto Manufacturers	Auto Manufacturers	Mahindra & Mahindra Limited provides mobility products and farm solutions in India and internationally. It operates through five segments: Automotive; Farm Equipment; Auto Investments; Farm Investments; and Investments in Industrial Businesses and Consumer Services. The company offers commercial vehicles, trucks, buses, vans, passenger cars, utility vehicles, and electric vehicles (EV), as well as motorcycles; aero and defense products; offers construction equipment, such as rotaries, tillers, l	3590399197184.0	1.11	152.16	32.25089140002011	18.47775261729612		1104695000000.0	734699300000.0	561445700000.0	1339631500000.0	930963500000.0	308.1340171096516	17.088395109658443	0.571499098744318	17.625960045653247	18.47775261729612	0.9539017222881558	1.111301317293447	헐값	보통(1~1.5)	45.45550523459224	6916.509676495555	131.31365006532621	보류	충분
TATASTEEL.NS	TATASTEEL.NS	India Nifty 50	203.17999267578125	2.3783058562117043	21.83245635937947		-8.117402347340352	211.6665012359619	187.28980010986328	N	Y	상승전환/양호	TATA STEEL LIMITED	NSI	INR	Basic Materials	Steel	Steel	Tata Steel Limited engages in the manufacture and distribution of steel products in India and internationally. It offers reinforcement bars (rebars) and wire rods, cut-and-bend reinforcement bars, welded wire mesh, prefabricated cages (pre-cages), steel couplers and carpet reinforcement; hot-rolled, cold rolled, coated coil, tubes, rebar, wire rods; and metallic coated, pre-finished steels, alloy steels, and profiles and construction systems. The company also provides solutions in building envel	2534029918208.0	1.97	8.66	215.56317625149467	7.205668401450982		152593300000.0	637536700000.0	212027200000.0	923816800000.0	1021676500000.0	-38.88304404652014	16.44135707841275	8.092015784570178	27.951851815508242	7.205668401450982	3.8791476735009995	0.32826692349449776	매우 불리	불리(<1)	22.911336802901964	198.412176713131	-2.346597172221754	보류	충분
HCLTECH.NS	HCLTECH.NS	India Nifty 50	1146.300048828125	-15.508211831364271	-30.72041183717593		-34.11690138839105	1215.5524963378907	1462.6544982910157	N	N	주의	HCL TECHNOLOGIES LTD	NSI	INR	Technology	Information Technology Services	Information Technology Services	HCL Technologies Limited provides IT and business services, engineering, research and development services, software products, and IP-led offerings. It operates through IT and Business Services, Engineering and R&D Services, and HCL Software segments. The company provides application development, management, modernization, and testing services, as well as commercial applications; automation services, including digital integration, business process management, robotic process automation for intel	3101620436992.0	8.34	61.36	-4.301322599194934	3.8683596866436742		557570000000.0	370000000.0	1220000000.0	52150000000.0	751650000000.0	205.9305398048444	68.56836512920455	5.981711786482321	15.325448321761419	3.8683596866436742	3.9617433649398617	0.7966070179694761	매우 불리	불리(<1)	16.23671937328735	996.2851007449118	-13.086883162621788	보류	충분
TECHM.NS	TECHM.NS	India Nifty 50	1483.800048828125	11.421499078858144	-5.024642997283557		-16.09364236919394	1454.9600006103515	1493.5705017089845	Y	N	상승전환/양호	TECH MAHINDRA LIMITED	NSI	INR	Technology	Information Technology Services	Information Technology Services	Tech Mahindra Limited provides information technology services and solutions in the Americas, Europe, India, and internationally. It operates through Information technology Business and Business Process Services segments. It offers application development maintenance, intelligent automation, testing, performance engineering, cloud consulting, engineering and network, data analytics, and artificial intelligence (AI) services. The company also provides business process services, such as Consulting	1314229190656.0	3.39	54.12	13.157709043866861	-0.14094743522335973		127309000000.0	0.0	696000000.0	21862000000.0	296154000000.0	143.73527897175188	61.828897268300345	4.166929184099404	24.760989834744514	-0.14094743522335973		0.1312165865121266	판정불가	불리(<1)	8.21810512955328	444.7638496114235	-70.02535146412154	보류	일부부족
COALINDIA.NS	COALINDIA.NS	India Nifty 50	466.8999938964844	6.005217608444613	23.176364314117315		-3.0623897408727174	461.36374893188474	417.9674996948242	Y	Y	상승전환/양호	COAL INDIA LTD	NSI	INR	Energy	Thermal Coal	Thermal Coal	Coal India Limited, together with its subsidiaries, produces and sells coal and coal products in India. The company offers coking coal for steel making and metallurgical industries, as well as for hard coke manufacturing; semi coking coal for blend-able coal in steel making, merchant coke manufacturing, and other metallurgical industries; and non-coking coal for thermal grade coal for cement, fertilizer, glass, ceramic, paper, chemical, and brick manufacturing, as well as power generation and ot	2877378002944.0	4.73	50.44	-12.42470944167401	-0.706993307310555		1116782200000.0	92323600000.0	45891000000.0	140721800000.0	1191015600000.0	166.23458728687848	49.839873462265636	10.674635706531097	5.960852629056422	-0.706993307310555		0.6749045720538591	판정불가	불리(<1)	7.08601338537889	357.4185151585112	-23.448592882664755	보류	일부부족
NESTLEIND.NS	NESTLEIND.NS	India Nifty 50	1410.4000244140625	12.615777460873211	13.522214801889731		-5.093866658737289	1415.3600006103516	1279.5805017089845	N	Y	상승전환/양호	NESTLE INDIA LIMITED	NSI	INR	Consumer Defensive	Packaged Foods	Packaged Foods	Nestlé India Limited engages in the manufacture and sale of food products in India and internationally. It offers milk products and nutrition, including dairy whitener, condensed milk, UHT milk, yogurt, maternal and infant formula, baby foods, health care nutrition; prepared dishes and cooking aids, such as noodles, sauces, seasonings, pasta, cereals, and pet foods; powdered and liquid beverages comprising instant coffee and tea, as well as ready to drink beverages; and confectionery items consi	2719694716928.0	86.0	18.19	34.17959272459547			15759300000.0	224800000.0	7308600000.0	11668500000.0	40102100000.0	8.055999916030286	4.801551232581211	0.34043896408580754	77.0942289443668	34.17959272459547	2.2555631240418546	1.558866264961547	매우 불리	양호(>=1.5)	8.5	154.615	-89.03750727994823	보류	충분
ADANIENT.NS	ADANIENT.NS	India Nifty 50	2979.89990234375	46.08068369427525	34.35682553548796		-2.2406682606850414	2604.9574951171876	2326.942457885742	Y	Y	상승전환/양호	ADANI ENTERPRISES LIMITED	NSI	INR	Energy	Thermal Coal	Thermal Coal	Adani Enterprises Limited, together with its subsidiaries, operates in the new energy ecosystem, data center, airports, roads, copper and PVC, and other sectors in India and internationally. It operates through the Integrated Resources Management (IRM), Mining Services, Commercial Mining, New Energy Ecosystem, Airport, Road, copper, and Others segments. The company engages in the integrated ecosystem for manufacturing green hydrogen, including solar cells, modules, and wind turbine generators; c	4088385765376.0	4.0	73.66	31.560360614171003	55.91755566442864		137557900000.0	761661500000.0	105360600000.0	1066217900000.0	809259500000.0	-479.4551230841857	-238.24510806639495	-7.995070837077798	46.96382060043356	55.91755566442864	0.8398761362580284	1.275823706384644	헐값	보통(1~1.5)	60.0	4419.599999999999	48.31370666255928	보류	충분
ADANIPORTS.NS	ADANIPORTS.NS	India Nifty 50	1826.4000244140625	23.61421485035955	21.307123673622442		0.0	1722.9025085449218	1499.2760028076173	Y	Y	상승전환/양호	ADANI PORT & SEZ LTD	NSI	INR	Industrials	Marine Shipping	Marine Shipping	Adani Ports and Special Economic Zone Limited, together with its subsidiaries, develops, operates, and maintains port infrastructure in India and internationally. The company is involved in the operation of ports and terminals, including bulk and break bulk, container, liquid, dry bulk, general, LPG/LNG, and crude cargo; terminal and ports related infrastructure development activities; and development of infrastructure at contiguous Special Economic Zone at Mundra. It also offers logistic servic	4207950954496.0	42.0	58.3	15.45124505175206	34.11377534025834		94579700000.0	502613300000.0	46788100000.0	632361600000.0	961253000000.0	-177.10106067169426	21.857766504498944	1.1967677514410489	34.36537024160818	34.11377534025834	1.0073751702601186	2.214839380607135	보통	안심(>=2)	60.0	3498.0	91.52430755809986	보류	충분
JSWSTEEL.NS	JSWSTEEL.NS	India Nifty 50	1261.699951171875	2.2695956154819674	9.65582982298956		-3.899769387622465	1275.8550048828124	1181.8045031738282	N	Y	상승전환/양호	JSW STEEL LIMITED	NSI	INR	Basic Materials	Steel	Steel	JSW Steel Limited manufactures and sells iron and steel products in India and internationally. The company offers color coated steel products, color-coated roofing sheets, galvalume coil and sheets, aluminum-zinc sheets, galvanized corrugated sheets, tin plate products, lead-free coils and sheets, Al-Zn-Mg coated galvanized steel, multi-utility steel sheets, hot rolled and cold-rolled coils, cold rolled close annealed, electrical, coated steel products, TMT bars, wire rods, alloy steel products,	3079591165952.0	56.00000000000001	91.27	536.8721461187215	75.2799343943875		622520000000.0	756080000000.0	397410000000.0	1191270000000.0	1000530000000.0	-54.71915933908321	43.01001308338541	3.408893932621416	14.423349518033946	75.2799343943875	0.19159620201673927	9.10190342612472	매우 유망	안심(>=2)	60.0	5476.2	334.033463733883	매우 유망	충분
CIPLA.NS	CIPLA.NS	India Nifty 50	1376.5	4.18559270904264	-9.500328731097962		-17.257753053573943	1347.7149993896485	1429.7735028076172	Y	N	상승전환/양호	CIPLA LTD	NSI	INR	Healthcare	Drug Manufacturers - Specialty & Generic	Drug Manufacturers - Specialty & Generic	Cipla Limited, together with its subsidiaries, manufactures, develops, sells, and distributes pharmaceutical products in India, the United States, South Africa, and internationally. It offers generic and branded generic medicines, vaccines, active pharmaceutical ingredients, and formulations for various therapeutic areas, such as MI, angina, heart disease, pulmonary disease, kidney disorders, alzheimer's disease, hypertension, arrhythmia, lipid abnormalities and diabetes, obesity, central nervou	1111999119360.0	94.0	48.02	-26.42550431292816	11.454373804227448		190380200000.0	1174700000.0	1405000000.0	6137700000.0	344319500000.0	234.21006008531464	10.654391168123082	0.7740204263075251	23.78779550009757	11.454373804227448	2.0767434262812556	4.433129324816791	매우 불리	안심(>=2)	31.408747608454895	1508.2480601580041	9.571235754304697	보류	충분
DRREDDY.NS	DRREDDY.NS	India Nifty 50	1268.5	-2.7074741145970305	-0.7122711145766902		-6.912743417277312	1292.9149963378907	1264.2644989013672	N	Y	상승전환/양호	DR. REDDY S LABORATORIES	NSI	INR	Healthcare	Drug Manufacturers - Specialty & Generic	Drug Manufacturers - Specialty & Generic	Dr. Reddy's Laboratories Limited, together with its subsidiaries, operates as an integrated pharmaceutical company North America, Europe, India, Russia, and internationally. The company operates through Global Generics, Pharmaceutical Services and Active Ingredients (PSAI), and Others segment. Its Global Generics segment manufactures and markets prescription and over-the-counter finished pharmaceutical products that are marketed under a brand name or as a generic finished dosages with therapeuti	1056284344320.0	63.0	51.41	-24.21830786644029	-1.6674294475082507		160260000000.0	12203000000.0	62934000000.0	77341000000.0	377063000000.0	177.80278441127476	22.012637283334566	1.735328126396103	21.21566262572895	-1.6674294475082507		2.8909099675308596	판정불가	안심(>=2)	5.1651411049834985	265.53990420720163	-79.06662166281421	보류	일부부족
GRASIM.NS	GRASIM.NS	India Nifty 50	3095.5	13.872134755858468	13.3716712098785		-2.3994228563836484	2944.890020751953	2819.84	Y	Y	상승전환/양호	GRASIM INDUSTRIES LTD	NSI	INR	Basic Materials	Building Materials	Building Materials	Grasim Industries Limited, together with its subsidiaries, primarily produces cellulosic fibres, diversified chemicals, fashion yarns, and fabrics in india and internationally. The company operates through Cellulosic Fibres, Chemicals, Building Materials, Financial Services, and Others segments. It offers cellulosic staple fibre; and cellulosic fashion yarn; chlor-alkali comprising caustic soda; chlorine derivatives, and specialty chemicals, that include epoxy polymers and curing agents. The com	2099283886080.0	33.0	73.2	34.02344508970015	-10.06389336340252		719038100000.0	1568286200000.0	681192000000.0	2278530600000.0	1034699200000.0	-1252.3666261398396	-493.0715214428983	-15.92865519117746	59.39708505655518	-10.06389336340252		0.3861486908786647	판정불가	불리(<1)	0.0	0.0	-100.0	보류	일부부족
HINDALCO.NS	HINDALCO.NS	India Nifty 50	1076.699951171875	12.284901841544361	32.794766574022404		-6.349482743353341	1072.4237503051759	894.2022518920899	Y	Y	상승전환/양호	HINDALCO  INDUSTRIES  LTD	NSI	INR	Basic Materials	Aluminum	Aluminum	Hindalco Industries Limited, together with its subsidiaries, manufactures and distributes aluminum and copper products in India, the United States, Brazil, South Korea, the United Kingdom, Germany, China, and internationally. It operates through Novelis, Aluminium Upstream, Aluminium Downstream, and Copper segments. The company offers primary aluminum, such as ingots, wirerods, primary foundry alloys, and billets; flat rolled products, including building and pattern sheets, PCB entry and cold-ro	2407666024448.0	47.0	60.24	-16.311480532466717	9.86859005895193		416180000000.0	755950000000.0	210640000000.0	991610000000.0	1365830000000.0	-151.94397181036086	-88.75062732284844	-8.242837498622778	20.395815454552388	9.86859005895193	2.0667405711164455	2.7882479220147456	매우 불리	안심(>=2)	28.23718011790386	1701.0077303025287	57.98345012007851	보류	충분
HEROMOTOCO.NS	HEROMOTOCO.NS	India Nifty 50	4855.39990234375	-11.920183177437638	-23.416405325808366		-23.54302964579561	5051.249987792969	5463.811499023437	N	N	주의	HERO MOTOCORP LIMITED	NSI	INR	Consumer Cyclical	Auto Manufacturers	Auto Manufacturers	Hero MotoCorp Limited primarily engages in the manufacture and sale of motorised two wheelers in India, Asia, Central and Latin America, Africa, and the Middle East. The company offers motorcycles and scooters, as well as electric scooters. It provides engines, parts, and accessories, as well as non-banking financial and other related services. The company is also involved in merchandise business. The company was formerly known as Hero Honda Motors Ltd. and changed its name to Hero MotoCorp Limi	971531288576.0	3.14	286.53	31.1352341451828	26.895886141440116		254871500000.0	0.0	4985500000.0	7786100000.0	216111900000.0	1273.7655938661862	360.55845209289697	7.425926995608576	12.500032486921313	26.895886141440116	0.46475629846089206	2.402864646381234	매우 유망	안심(>=2)	60.0	17191.8	254.07588140580032	매우 유망	충분
BPCL.NS	BPCL.NS	India Nifty 50	289.1000061035156	-18.04393873748671	-18.792133116989994		-25.54725336286745	300.78875122070315	336.1015008544922	N	N	주의	BHARAT PETROLEUM CORP  LT	NSI	INR	Energy	Oil & Gas Refining & Marketing	Oil & Gas Refining & Marketing	Bharat Petroleum Corporation Limited engages in refining crude oil and marketing petroleum products in India and internationally. It operates through two segments, Downstream Petroleum; and Exploration and Production of Hydrocarbons. The company operates fuel stations that sell motor spirits, high-speed diesel, blended fuels, compressed and liquefied natural gas, automotive liquefied petroleum gas (LPG), and lubricants; operate convenience stores, restaurants, and electric vehicle charging facil	1235204308992.0	7.01	60.48	93.77912578590414	129.7482877705289		455243700000.0	222031700000.0	212787400000.0	544244200000.0	1001702600000.0	54.58335103397644	73.36114067795111	25.375696689429784	3.8775901962556083	129.7482877705289	0.029885482597762393	35.268886305362905	매우 유망	안심(>=2)	60.0	3628.7999999999997	1155.2057846379516	매우 유망	충분
EICHERMOT.NS	EICHERMOT.NS	India Nifty 50	7203.0	-5.47864313365265	1.4507042253521174		-12.051282051282053	7151.675	7090.77	Y	Y	상승전환/양호	EICHER MOTORS LTD	NSI	INR	Consumer Cyclical	Auto Manufacturers	Auto Manufacturers	Eicher Motors Limited, an automobile company, engages in the manufacture and sale of motorcycles and commercial vehicles in India and internationally. The company designs, develops, manufactures, assembles, and sells two-wheelers, as well as related parts and accessories; motorcycle accessories; protective and performance gears, and riding apparel products for men and women; and lifestyle apparel products and accessories. It also owns the Royal Enfield motorcycle brand that offers Classic 350, B	1977205784576.0	99.0	200.93	16.491707572595704	23.697524323492836		119936500000.0	2016300000.0	1173800000.0	5139500000.0	251001500000.0	429.5856505521197	128.58330637802095	1.7851354488132853	33.71031876498223	23.697524323492836	1.422524914620009	3.6397616165810085	보통	안심(>=2)	55.89504864698567	11230.992124638831	55.921034633330976	보류	충분
APOLLOHOSP.NS	APOLLOHOSP.NS	India Nifty 50	8524.0	10.350184477959745	18.372448271073473		0.0	7991.2375	7575.46	Y	Y	상승전환/양호	APOLLO HOSPITALS ENTER. L	NSI	INR	Healthcare	Medical Care Facilities	Medical Care Facilities	Apollo Hospitals Enterprise Limited, together with its subsidiaries, provides healthcare services in India. It operates through Healthcare Services, Retail Health & Diagnostics, Digital Health & Pharmacy Distribution, and Others segments. The company's healthcare facilities comprise primary, secondary, and tertiary care, as well as specialty facilities. It offers services in cardiac sciences, oncology, neurosciences, gastroenterology, orthopedics, urology, organ transplantation, pulmonology, obs	1225620455424.0	24.0	135.41	34.290061553357766	33.336300616284454		38725000000.0	24301000000.0	32284000000.0	84929000000.0	94801000000.0	100.31668399779261	62.15544959014647	0.729181717387922	62.20872399381292	33.336300616284454	1.8660956028043667	0.9216762044819782	보통	불리(<1)	60.0	8124.599999999999	-4.685593618019713	보류	충분
BRITANNIA.NS	BRITANNIA.NS	India Nifty 50	5107.5	-14.633127193715524	-13.086020590487536		-18.935005158320774	5471.75	5820.15	N	N	주의	BRITANNIA INDUSTRIES LTD	NSI	INR	Consumer Defensive	Packaged Foods	Packaged Foods	Britannia Industries Limited manufactures and sells various food products in India and internationally. The company offers biscuits under the Good Day, Marie Gold, NutriChoice, Milk Bikis, Tiger, 50-50, Jim Jam, Britannia Bourbon, Little Hearts, Treat, Pure Magic, Nice Time, and Biscafe brand names; cakes under the Muffills, Fudge It, Gobbles, Layerz, Tiffin Fun, Rollyo, and Nut & Raisin Romance Cake brand names; rusks under the Toastea brand; center filled croissants under the Treat Croissant b	1230234845184.0	1.78	105.12	16.2828803936238	2.9516551243742306		50909800000.0	2861100000.0	10717200000.0	13802800000.0	51065600000.0	199.48121358404097	99.88985848100158	1.955748575252111	46.68967643089763	2.9516551243742306	15.818134051415011	0.10134264115917033	매우 불리	불리(<1)	14.403310248748461	1514.0759733484383	-70.35583018407365	보류	충분
BAJAJ-AUTO.NS	BAJAJ-AUTO.NS	India Nifty 50	10184.0	3.7489812550937307	12.096862960924604		-5.777860017578762	10191.3	9387.7225	N	Y	상승전환/양호	BAJAJ AUTO LIMITED	NSI	INR	Consumer Cyclical	Auto Manufacturers	Auto Manufacturers	Bajaj Auto Limited, together with its subsidiaries, engages in the development, manufacture, and distribution of automobiles in India and internationally. The company offers motorcycles, bikes, commercial vehicles, electric two-wheelers, and three-wheeler, as well as related parts and accessories. It also exports its products. The company was founded in 1945 and is based in Pune, India.	2844103540736.0	1.47	384.69	46.68404159607249	21.03071664453431		241990300000.0	153389400000.0	66416500000.0	226397800000.0	388319900000.0	317.25695632790735	67.11312956259701	0.6590055927199235	25.64855609366527	21.03071664453431	1.2195759434727156	0.877270305679764	보통	불리(<1)	50.56143328906862	19450.477771971808	90.99055157081509	보류	충분
TATACONSUM.NS	TATACONSUM.NS	India Nifty 50	1106.5	-0.9134012373844147	-3.6485565589778446		-12.94256490952006	1170.6374938964843	1142.8239978027343	N	N	주의	TATA CONSUMER PRODUCT LTD	NSI	INR	Consumer Defensive	Packaged Foods	Packaged Foods	Tata Consumer Products Limited, together with its subsidiaries, manufactures, distributes, and trades in food products in India, the United States, the United Kingdom, and internationally. It operates through Branded Business and Non Branded Business segments. The company provides tea, coffee, water, salt, pulses, spices, snacks, ready-to-eat packaged and processed food products, ready to cook, ready to drink beverages, breakfast cereals, sauces, instant masala noodles, meal solutions, staples, 	1095035322368.0	90.0	15.61	20.63638567975783	8.611325596691376		55932700000.0	3021400000.0	18181700000.0	28195100000.0	217875300000.0	53.46526402630301	19.939395969825576	1.8020240370380094	67.45898372669424	8.611325596691376	7.833751374191817	1.4617967859730714	매우 불리	보통(1~1.5)	25.722651193382752	401.53058512870473	-63.71165068877499	보류	충분
DIVISLAB.NS	DIVISLAB.NS	India Nifty 50	6753.0	6.10417157671459	4.616576297443853		-3.3006372162955544	6596.05	6330.2775	Y	Y	상승전환/양호	DIVI S LABORATORIES LTD	NSI	INR	Healthcare	Drug Manufacturers - Specialty & Generic	Drug Manufacturers - Specialty & Generic	Divi's Laboratories Limited engages in the manufacture and sale of generic active pharmaceutical ingredients (APIs), intermediates, and nutraceuticals in India, North America, Asia, Europe, and internationally. The company also undertakes custom synthesis contract manufacturing services of APIs and intermediates; and supplies a range of carotenoids, such as beta carotene, astaxanthin, lycopene, and canthaxanthin, as well as lutein and vitamins used in the food, beverage, dietary supplement, pet 	1792709230592.0	46.0	96.51	17.206754906435417	12.078780055201644		67160000000.0	0.0	0.0	70000000.0	167610000000.0	252.98662463181142	8.211894605380419	0.12160365179002545	67.35067221394868	12.078780055201644	5.575949881208788	0.8623340813987187	매우 불리	불리(<1)	32.65756011040329	3151.7811262550217	-53.32768952680258	보류	충분
INDUSINDBK.NS	INDUSINDBK.NS	India Nifty 50	922.7999877929688	0.5393051521160874	6.929314923866592		-4.333401290786654	900.0662521362304	845.5460012817383	Y	Y	상승전환/양호	INDUSIND BANK LIMITED	NSI	INR	Financial Services	Banks - Regional	Banks - Regional	IndusInd Bank Limited provides various banking products and financial services to individuals, corporations, government entities, and public sector undertakings in India. It operates in four segments: Treasury, Corporate/Wholesale Banking, Retail Banking, and Other Banking Operations. The company offers savings, salary, RFC, and uniformed personnel accounts; current accounts comprising smart, everyday, premium, trade, startup, and specialized accounts; fixed, recurring, sweep in/out, senior citi	718983659520.0	17.0	11.37	-65.46976556372644	-50.74727610509653		489323500000.0	0.0	0.0	427891900000.0	657396300000.0	628.0361064836869	3.8630130645566805	0.418618673131512	25.924703721132968	-50.74727610509653		-1.3017420167308165	판정불가	불리(<1)	0.0	0.0	-100.0	보류	일부부족
SHRIRAMFIN.NS	SHRIRAMFIN.NS	India Nifty 50	911.7000122070312	-9.508683651907567	10.08875026624343		-17.463332214594885	961.6762542724609	873.7047491455078	N	Y	상승전환/양호	SHRIRAM FINANCE LIMITED	NSI	INR	Financial Services	Credit Services	Credit Services	Shriram Finance Limited, a non-banking finance company, provides financing services in India. It offers fixed and recurring deposits; commercial vehicle loans for commercial goods vehicles, passenger commercial vehicles, tractors and farm equipment, and construction equipment; two-wheeler, gold, used car loan, and personal loans; and green finance services. The company also provides business loans, such as MSME loans; working capital loans, including tyre, tax, fuel, toll financing, repair/top-u	2145075593216.0	1.54	53.26	4.923056955228389	18.58582810449043		79431300000.0	0.0	0.0	1812116200000.0	659185900000.0	33.75988950514179	-57.282790283775334	-6.283074423253096	16.484042859592368	18.58582810449043	0.8869146301643529	1.2209279165261842	헐값	보통(1~1.5)	45.67165620898086	2432.4724096903205	166.80622761009113	보류	충분
