티커	종목코드	유니버스	현재가	3M수익률(보조,%)	6M수익률(보조,%)	12M수익률(보조,%)	52주고점대비(보조,%)	40일이평(보조)	200일이평(보조)	40일선상회(보조)	200일선상회(보조)	추세판정(보조)	종목명	시장	통화	섹터	산업	업종	사업설명	시가총액	배당수익률(%)	EPS(FY)	EPS Growth 1Y(%)	EPS Growth 3Y CAGR(%)	EPS Growth 5Y CAGR(%)	현금및단기투자	장기부채	단기위험부채	총부채	주주지분	주당순현금(린치식)	주당잉여현금흐름	잉여현금흐름수익률(%)	순현금차감PER(린치식)	사용연성장률(%)	린치PER배수	배당감안점수	린치PER판정	배당감안점수판정	그레이엄적정PER(3년)	그레이엄내재가치(3년)	그레이엄괴리율(3년,%)	종합판정	데이터상태
HDFCLIFE.NS	HDFCLIFE.NS	India Nifty 50	606.3499755859375	-17.05198692394836	-18.785160003512015		-25.537273157850194	610.9237518310547	724.3349975585937	N	N	주의	HDFC LIFE INS CO LTD	NSI	INR	Financial Services	Insurance - Life	Insurance - Life	HDFC Life Insurance Company Limited provides individual and group insurance solutions in India. It offers insurance and investment products, such as protection, pension, savings, investment, annuity, and health, as well as term, investment, and life insurance plans. The company was formerly known as HDFC Standard Life Insurance Company Limited changed its name to HDFC Life Insurance Company Limited in January 2019. HDFC Life Insurance Company Limited was incorporated in 2000 and is headquartered	1308066578432.0	35.0	8.85	5.605195436321675	11.805242919673354		73289900000.0	30990000000.0	0.0	30990000000.0	177495400000.0	19.607981274187132	103.54693449945601	17.077090569583177	66.29853043070625	11.805242919673354	5.6160242429421094	0.7059770799685093	매우 불리	불리(<1)	32.11048583934671	284.1777996782184	-53.13304013847658	보류	충분
SBILIFE.NS	SBILIFE.NS	India Nifty 50	1859.0	-6.877726066716439	-5.653675549825953		-11.879033279087581	1880.6899993896484	1923.3060009765625	N	N	주의	SBI LIFE INSURANCE CO LTD	NSI	INR	Financial Services	Insurance - Life	Insurance - Life	SBI Life Insurance Company Limited operates as a private life insurance company in India. The company's life insurance business comprises individual and group life insurance products, including participating, non-participating, pension, group gratuity, group leave encashment, group superannuation, group immediate annuity, unit-linked and variable insurance products, health, and micro insurance. It also provides accident and disability benefit, level term, and critical illness insurance products.	1864748236800.0	15.0	24.59	2.361911076119827	12.812939479871188		33806300000.0	0.0	0.0	0.0	190860000000.0	33.702089062665465	342.31821067209836	18.414104931258652	74.22927657329542	12.812939479871188	5.793305797620271	0.3746896206432533	매우 불리	불리(<1)	34.12587895974238	839.1553636200651	-54.85985133835045	보류	충분
BAJAJFINSV.NS	BAJAJFINSV.NS	India Nifty 50	1836.0999755859375	-5.7491915919927745	-14.080487805992625		-15.643669337190646	1771.325003051758	1974.1730029296875	Y	N	주의	BAJAJ FINSERV LTD.	NSI	INR	Financial Services	Financial Conglomerates	Financial Conglomerates	Bajaj Finserv Ltd., through its subsidiaries, provides financial services in India. The company operates through Life Insurance, General Insurance, Windmill, Retail Financing, and Investments and Others segments. It offers personal, business, home, home renovation, commercial, car, and gold loans; two- and three-wheeler loans; mortgages; education loans; unsecured and secured loans to small and medium-sized enterprises and professionals, as well as micro, small and medium enterprises; loans agai	2933164605440.0	7.000000000000001	59.94	8.892227217441784	24.870504525892258		1768601000000.0	2517024900000.0	312442200000.0	2844515200000.0	723953100000.0	-468.4977983575814	-400.48158959006093	-21.81153504248912	38.44841131036902	24.870504525892258	1.5459441633096358	0.8289160316306025	보통	불리(<1)	58.241009051784516	3490.966082563964	90.12941174131458	보류	충분
UPL.NS	UPL.NS	India Nifty 50	660.0	-7.814793107490326	-8.339697078119324		-18.048051156913147	629.891244506836	702.244748840332	Y	N	주의	UPL LIMITED	NSI	INR	Basic Materials	Agricultural Inputs	Agricultural Inputs	UPL Limited, together with its subsidiaries, manufactures and sells pesticides, insecticides, and micronutrients in India, Brazil, the United States, the United Kingdom, and internationally. It operates in three segments: Crop Protection, Seeds, and Non-Agro. The company offers herbicides, fungicides, insecticides, acaricides, seed treatment, adjuvants, bio-solutions, public health products, fumigants, soil and water technologies, agrochemical products, and other agricultural related products un	557887520768.0	93.0	20.93	-52.2	-37.22478418802345		103680000000.0	182630000000.0	54510000000.0	250990000000.0	321990000000.0	-93.52389185033138	100.16947808567475	15.177193649344659	36.00209707837226	-37.22478418802345		1.5492213048190104	판정불가	양호(>=1.5)	0.0	0.0	-100.0	보류	일부부족
LTIM.NS	LTIM.NS	India Nifty 50											LTIM.NS													0.0	0.0	0.0	0.0									판정불가	판정불가				판정불가	핵심부족
