티커	종목코드	유니버스	현재가	3M수익률(보조,%)	6M수익률(보조,%)	12M수익률(보조,%)	52주고점대비(보조,%)	40일이평(보조)	200일이평(보조)	40일선상회(보조)	200일선상회(보조)	추세판정(보조)	종목명	시장	통화	섹터	산업	업종	사업설명	시가총액	배당수익률(%)	EPS(FY)	EPS Growth 1Y(%)	EPS Growth 3Y CAGR(%)	EPS Growth 5Y CAGR(%)	현금및단기투자	장기부채	단기위험부채	총부채	주주지분	주당순현금(린치식)	주당잉여현금흐름	잉여현금흐름수익률(%)	순현금차감PER(린치식)	사용연성장률(%)	린치PER배수	배당감안점수	린치PER판정	배당감안점수판정	그레이엄적정PER(3년)	그레이엄내재가치(3년)	그레이엄괴리율(3년,%)	종합판정	데이터상태
3407.T	3407.T	Japan Nikkei 225	1770.0	2.282577289800636	39.31523022432113		-6.075882196869198	1597.825	1405.27	Y	Y	상승전환/양호	ASAHI KASEI CORP	JPX	JPY	Industrials	Conglomerates	Conglomerates	Asahi Kasei Corporation engages in material, homes, healthcare businesses. The company offers Pimel photosensitive polyimide/PBO precursor, a liquid photosensitive material for buffer coating and packaging applications; Sunfort dry film photoresist to form circuit patterns on printed wiring boards; Novacure, a latent curing agent for epoxy resin with storage stability; glass fabric for printed circuit boards; plastic optical fiber; suede products under the Dinamica name; Microza UF and MF indust	2374448447488.0	2.49	117.0	208.1701136830571	-5.873847414568534		393467000000.0	847209000000.0	310249000000.0	1195045000000.0	1859421000000.0	-334.50939744990666	61.5950477516732	3.4799462006595028	17.98725980726416	-5.873847414568534		-0.1881246755107171	판정불가	불리(<1)	0.0	0.0	-100.0	보류	일부부족
3382.T	3382.T	Japan Nikkei 225	1837.5	-21.035668242372154	-8.808933002481389		-22.631578947368425	1997.5375	2070.8175	N	N	주의	SEVEN & I HOLDINGS CO LTD	JPX	JPY	Consumer Defensive	Grocery Stores	Grocery Stores	Seven & i Holdings Co., Ltd. operates convenience stores in Japan, North America, and internationally. It operates through Domestic Convenience Store Business, Overseas Convenience Store Business, Superstore Business, Financial-Related, and Others segments. The company is also involved in operating seven-eleven; online food shopping and internet shopping business; provision of multi-copy services, such as tickets; franchising and/or licensing activities; leasing, non-life insurance, life insuran	4251294892032.0	3.27	118.89	69.15894330552152	1.3788835802272414		461634000000.0	1648323000000.0	581693000000.0	3793778000000.0	3620448000000.0	-513.330901208645	113.51306178692491	6.177581593846253	19.773159232977076	1.3788835802272414	14.339977295050854	0.23511081489062075	매우 불리	불리(<1)	11.257767160454483	1338.4359377064334	-27.159948968357373	보류	충분
3092.T	3092.T	Japan Nikkei 225	990.5	-9.502055733211511	-22.768031189083825		-37.11111111111111	1071.7125	1261.4825	N	N	주의	ZOZO INC	JPX	JPY	Consumer Cyclical	Internet Retail	Internet Retail	ZOZO, Inc. operates online shopping Websites in Japan and internationally. It operates ZOZOTOWN a fashion online shopping website; WEAR, an outfit-sharing app; Multi-Size platform, a new way of shopping for clothes where users select their height and weight to purchase their ideal size; ZOZOUSED, a website for secondhand/vintage apparel; ZOZOFIT, a body management service; ZOZOGLASS, a skin tone capturing device that solves customers' challenge of cosmetic product color selection; ZOZOMAT, a 3D 	887420223488.0	4.04	54.18	2.2665253377235572	9.548609328331903		96486000000.0	0.0	20000000000.0	20000000000.0	98718000000.0	109.10694215100195	60.8701530693187	6.1453965743885615	16.267867439073424	9.548609328331903	1.7036897080713789	0.8353036671354801	보통	불리(<1)	27.597218656663806	1495.217306818045	50.955810885214035	보류	충분
1925.T	1925.T	Japan Nikkei 225	4431.0	-19.038918326329256	-19.377729257641917		-22.39929947460595	4820.2	5204.405	N	N	주의	DAIWA HOUSE INDUSTRY CO	JPX	JPY	Real Estate	Real Estate - Development	Real Estate - Development	Daiwa House Industry Co., Ltd., together with its subsidiaries, engages in the construction work business in Japan, the United States, and internationally. It operates through Single-Family Houses Business; Rental Housing Business; Condominiums Business; Commercial Facilities Business; Logistics, Business and Corporate Facilities Business; Environmental and Energy Business; and Other Businesses segments. The Single-Family Houses segment engages in the construction of single-family houses; and sa	2726365757440.0	2.96	566.28	8.805296700942588	13.001588369205708		334002000000.0	1778496000000.0	530580000000.0	2432828000000.0	2614236000000.0	-2332.285097744747	62.60625150748467	1.4129147259644477	11.94335858187601	13.001588369205708	0.9186076533667135	1.3364405212975303	헐값	보통(1~1.5)	34.50317673841141	19538.458923427614	340.94919709834375	보류	충분
1928.T	1928.T	Japan Nikkei 225	3344.0	-10.083355740790534	-1.4441497200117892		-12.598013591217983	3477.275	3450.795	N	N	주의	SEKISUI HOUSE	JPX	JPY	Consumer Cyclical	Residential Construction	Residential Construction	Sekisui House, Ltd. designs, constructs, and contracts built-to-order detached houses in Japan and internationally. It operates through Detached Houses, Rental Housing and Commercial Buildings, Architectural/Civil Engineering, Rental Housing Management, Remodeling, Development, and Overseas segments. It also engages in the design, construction, contracting, and sale of rental housing, office buildings, commercial buildings, and other properties; design, construction, and contracting of civil eng	2168354242560.0	4.37	358.14	6.609861969178477	7.946221780206719		435177000000.0	1253525000000.0	595364000000.0	1893674000000.0	2139611000000.0	-1262.4201676377754	187.02560996532156	5.592871111403157	12.862065582280046	7.946221780206719	1.6186391392093062	0.9575617307669982	보통	불리(<1)	24.39244356041344	8735.90973672647	161.2413198781839	보류	충분
4755.T	4755.T	Japan Nikkei 225	753.0	-11.265611399520491	-27.596153846153847		-28.693181818181824	770.2474975585938	888.2674996948242	N	N	주의	RAKUTEN GROUP INC	JPX	JPY	Consumer Cyclical	Internet Retail	Internet Retail	Rakuten Group, Inc. provides various services in e-commerce, fintech, digital content, and communications to various users in Japan, the Americas, Europe, rest of Asia, and internationally. It operates in three segments: Internet Services, FinTech, and Mobile. The company operates a range of e-commerce sites comprising Rakuten Ichiba, an Internet shopping mall; online cash-back sites; travel booking sites; portal sites; and digital content sites, as well as provides messaging services. It also o	1631571804160.0	2.3904382470119523	-82.23				5837566000000.0	5569622000000.0	0.0	5569622000000.0	992402000000.0	123.26687861962898	100.34778871296454	13.326399563474705					판정불가	판정불가				판정불가	일부부족
4689.T	4689.T	Japan Nikkei 225	398.0	4.709285348343184	-7.4848933736280765		-29.56998457001805	411.30000228881835	432.48000137329103	N	N	주의	LY CORPORATION	JPX	JPY	Consumer Cyclical	Internet Retail	Internet Retail	LY Corporation engages in the online advertising and e-commerce businesses in Japan. The company offers LINE, a communication app; and Yahoo! JAPAN, an internet service that provides search, news, weather, shopping, auction, and other services. It also provides reuse, membership, and payment-related services. The company was formerly known as Z Holdings Corporation and changed its name to LY Corporation in October 2023. LY Corporation was incorporated in 1996 and is headquartered in Chiyoda, Jap	2747877556224.0	2.76	27.86	35.57098560941352	25.674352242677358		1043944000000.0	1694398000000.0	0.0	1694398000000.0	2998170000000.0	-94.92127727362713	61.2690494075405	15.394233519482537	17.69279530773967	25.674352242677358	0.6891233375823872	1.607114746319301	헐값	양호(>=1.5)	59.848704485354716	1667.3849069619823	318.940931397483	양호	충분
9201.T	9201.T	Japan Nikkei 225	2699.5	-14.38312718046305	-8.661816951446454		-16.42414860681115	2569.3125	2894.8725	Y	N	주의	JAPAN AIRLINES CO LTD	JPX	JPY	Industrials	Airlines	Airlines	Japan Airlines Co., Ltd., together with its subsidiaries, provides scheduled and non-scheduled air transport services in Japan, Asia, Oceania, the Americas, and internationally. The company engages in full-service and low-cost carrier, and cargo and mail; air transport-related businesses, such as airport passenger service, ground handling, maintenance, cargo, and passenger sales; and airport peripheral businesses, including mileage, lifestyle, and infrastructure. It also engages in the air mobil	1152368115712.0	3.56	306.93	12.041786170368663			756034000000.0	801461000000.0	94562000000.0	896023000000.0	975057000000.0	-105.68652849391353	846.7229535896572	31.36591789552351	9.139499327188329	12.041786170368663	0.7589820312270601	1.7070723036169193	헐값	양호(>=1.5)	8.5	2608.905	-3.3559918503426434	양호	충분
9202.T	9202.T	Japan Nikkei 225	2874.5	-14.72856719074459	-5.288303130148275		-15.53041434028798	2825.9125	2952.005	Y	N	주의	ANA HOLDINGS INC	JPX	JPY	Industrials	Airlines	Airlines	ANA Holdings Inc., together with its subsidiaries, provides air transportation services in Japan and internationally. It operates through Aviation Business, Aviation related business, Travel business, and Trading company business segments. The Air Transportation segment offers domestic and international passenger, cargo and mail, and other transportation services. The Aviation related business segment provides air transportation related services, such as airport handling, and maintenance service	1293432782848.0	2.09	321.08	-2.590756029714125			1978127000000.0	966910000000.0	374085000000.0	1349058000000.0	1130317000000.0	2259.0363043884704	261.6077334430764	9.10098220362068	1.9168546642940376	-2.590756029714125		-0.2612383917476341	판정불가	불리(<1)	8.5	2729.18	-5.055487910941037	보류	일부부족
9101.T	9101.T	Japan Nikkei 225	5321.0	5.366336633663371	7.083920305896552		-15.660168013948327	5793.3	5319.235	N	Y	상승전환/양호	NIPPON YUSEN KABUSHIKI KAISHA	JPX	JPY	Industrials	Marine Shipping	Marine Shipping	Nippon Yusen Kabushiki Kaisha, together with its subsidiaries, provides logistics services in Japan, North America, Asia, and internationally. It operates in seven segments: Liner Trade, Air Cargo Transportation, Logistics, Automotive, Dry Bulk, Energy, and Others. The company offers liner trade services, such as ocean cargo shipping, ship owning and chartering, shipping agency, container terminal operations, harbor transport, and tugboat operations; air cargo transport; and logistics services, 	2120285945856.0	3.76	504.96	108.9679488020717	-22.063347354968577		156012000000.0	564763000000.0	54412000000.0	738461000000.0	2918874000000.0	-1012.8717483594529	753.9191746726373	14.168749758929472	12.543313823588905	-22.063347354968577		-1.4592114661555688	판정불가	불리(<1)	0.0	0.0	-100.0	보류	일부부족
9104.T	9104.T	Japan Nikkei 225	5560.0	7.9192546583851	24.273580688422		-20.820279122757047	6202.9	5137.65	N	Y	상승전환/양호	MITSUI O.S.K. LINES LTD	JPX	JPY	Industrials	Marine Shipping	Marine Shipping	Mitsui O.S.K. Lines, Ltd., together with its subsidiaries, provides marine transportation and vessel chartering services in Japan, North America, Europe, Singapore, rest of Asia, and internationally. It operates through Dry Bulk Business; Energy Business; Container Ships; Car Carriers, Terminal and Logistics; Ferries and Coastal RoRo Ships, Cruise; Real Property; and Associated Businesses segments. The company engages in the dry bulk shipping of raw materials, such as iron ore, coal, wood chips,	1907638009856.0	3.69	618.83	62.61814401626595	-15.643474639273236		163790000000.0	1458018000000.0	246952000000.0	1815443000000.0	2686669000000.0	-3768.0851363152024	1049.576213431091	18.877270025739044	15.073744221054575	-15.643474639273236		-0.7929996996086058	판정불가	불리(<1)	0.0	0.0	-100.0	보류	일부부족
9107.T	9107.T	Japan Nikkei 225	2503.5	9.27542557835006	19.214285714285715		-12.921739130434784	2595.3375	2314.315	N	Y	상승전환/양호	KAWASAKI KISEN KAISHA	JPX	JPY	Industrials	Marine Shipping	Marine Shipping	Kawasaki Kisen Kaisha, Ltd. engages in the provision of marine, land, and air transportation services in Japan, the United States, Europe, Asia, and internationally. It offers dry bulk carrier, car carrier, liquefied natural gas carrier, crude oil and product, containerships, and liquefied gas business. The company also engages in the offshore and energy development business. In addition, it operates container terminals; and offers warehousing and cargo consolidation services. Kawasaki Kisen Kai	1600779845632.0	4.79	210.54	199.4283697261469	-21.955642905984497		306717000000.0	243840000000.0	51412000000.0	344860000000.0	1648433000000.0	99.47401994636589	223.19915320535551	8.915484449984243	11.418381210476081	-21.955642905984497		-1.5033341933123976	판정불가	불리(<1)	0.0	0.0	-100.0	보류	일부부족
4911.T	4911.T	Japan Nikkei 225	2647.0	-15.754296626352637	-2.017397741995186		-24.479315263908695	3169.8625	2710.8675	N	N	주의	SHISEIDO COMPANY LIMITED	JPX	JPY	Consumer Defensive	Household & Personal Products	Household & Personal Products	Shiseido Company, Limited produces and sells in Japan and internationally. It offers fragrances, skincare, and makeup products through retail channels. The company also engages in the restaurant and food businesses; and operates beauty salons. In addition, it operates and supports SABFA, a professional hair makeup training school. Further, the company manages childcare facilities. It serves its products under the BAUM, BENEFIQUE, Clé de Peau Beauté, Dr. Dennis Gross Skincare, Drunk Elephant, EFF	1026855600128.0	2.27	-101.91	127.1			148369000000.0	181617000000.0	30000000000.0	323159000000.0	600756000000.0	-83.21263292706917	163.84239057800937	6.189738971590834		127.1			판정불가	판정불가				판정불가	일부부족
2502.T	2502.T	Japan Nikkei 225	1498.0	-10.833333333333329	-13.858539390454283		-24.32432432432432	1582.0	1713.53	N	N	주의	ASAHI GROUP HLDGS	JPX	JPY	Consumer Defensive	Beverages - Brewers	Beverages - Brewers	Asahi Group Holdings, Ltd., together with its subsidiaries, manufactures and sells beer, alcohol and non-alcohol beverages, and food products in Japan, Europe, Oceania, and Southeast Asia. The company offers alcoholic beverage products, including beers, non-alcohol beer, new genre, wines, shochu, whiskey and spirits, ready-to-drink beverages, and happoshu products. It also provides non-alcoholic beverage products beverages, such as carbonated drinks, coffee, tea, lactic acid bacteria drinks, and	2195763232768.0	3.47	115.5	17.06984086351806	7.760084287882463		118119000000.0	828047000000.0	451129000000.0	1279176000000.0	2668801000000.0	-485.2990895921203	182.83685993064938	12.205397859188876	17.171420689109265	7.760084287882463	2.212787909523458	0.6539985532475474	매우 불리	불리(<1)	24.020168575764927	2774.3294705008493	85.20223434585108	보류	충분
2503.T	2503.T	Japan Nikkei 225	2708.5	5.062063615205581	15.995717344753757		-2.255503428365213	2575.25	2372.52	Y	Y	상승전환/양호	KIRIN HOLDINGS COMPANY LIMITED	JPX	JPY	Consumer Defensive	Beverages - Brewers	Beverages - Brewers	Kirin Holdings Company, Limited engages in food and beverages, alcoholic beverages, pharmaceuticals, and health science businesses. The company's products include beer, wine, soft drinks, dairy products, margarine, jams, and honey. It engages in the management and operation of a chain of Kirin City beer pubs. The company also produces and sells pharmaceutical products. In addition, it manufactures and sells amino acids and nucleic acids for pharmaceutical and industrial use, as well as bulk phar	2215719206912.0	2.81	182.01	153.44762428281857	9.948278401174782		138070000000.0	842434000000.0	81000000000.0	923434000000.0	1286991000000.0	-875.1623756745414	77.35717542278843	2.8560891793534586	19.689370780037038	9.948278401174782	1.9791736807156441	0.6479779645426934	보통	불리(<1)	28.396556802349565	5168.457303595644	90.82360360330972	보류	충분
4507.T	4507.T	Japan Nikkei 225	3029.0	-12.884670693126255	12.644105615470425		-17.330786026200872	3259.0625	2926.7675	N	Y	상승전환/양호	SHIONOGI & CO	JPX	JPY	Healthcare	Drug Manufacturers - Specialty & Generic	Drug Manufacturers - Specialty & Generic	Shionogi & Co., Ltd. engages in the research, development, manufacture, and distribution of pharmaceuticals, diagnostic reagents, and medical devices in Japan and internationally. It is also involved in consumer healthcare business; manufacturing, sale, analytical testing, and pharmaceutical engineering of medicinal drugs and investigational drugs; contracted monitoring of epidemiological components in sewage; promotion of implementation in social infrastructure; and business related to providin	2546543886336.0	2.51	200.82	5.187310991791638	14.283423809909968		914843000000.0	0.0	3464000000.0	21882000000.0	1361924000000.0	1075.0521815590314	168.46197171728707	5.561636570395743	9.729846720650178	14.283423809909968	0.6811984892515422	1.7259700272840248	헐값	양호(>=1.5)	37.06684761981994	7443.764339012239	145.7498956425302	양호	충분
4523.T	4523.T	Japan Nikkei 225	4143.0	-17.14	-6.710200405314115		-22.15332581736189	4779.25	4720.12	N	N	주의	EISAI CO LTD	JPX	JPY	Healthcare	Drug Manufacturers - Specialty & Generic	Drug Manufacturers - Specialty & Generic	Eisai Co., Ltd. engages in the research and development, manufacture, sale, and import and export of pharmaceuticals in India. It also offers prescription medicines. In addition, the company focuses on neurology and oncology and therapeutic areas. The company was formerly known as Nihon Eisai Co., Ltd. and changed its name to Eisai Co., Ltd. in 1955. Eisai Co., Ltd. was incorporated in 1941 and is headquartered in Tokyo, Japan.	1122813083648.0	3.86	136.72	9.493715660150448	-1.06864249893871		266537000000.0	99832000000.0	87691000000.0	187523000000.0	841417000000.0	590.9139039239533	25.337287935265397	0.6115686202091576	25.98073505029291	-1.06864249893871		0.10743951222541795	판정불가	불리(<1)	6.36271500212258	869.9103950901991	-79.00288691551535	보류	일부부족
4543.T	4543.T	Japan Nikkei 225	2335.0	19.958900590804006	-8.233444684613877		-16.47290287962797	2126.0625	2317.66	Y	Y	상승전환/양호	TERUMO CORP	JPX	JPY	Healthcare	Medical Instruments & Supplies	Medical Instruments & Supplies	Terumo Corporation engages in the manufacture and sale of medical products and equipment in Japan, Europe, China, the United States, Asia, and internationally. The company operates through four segments: Cardiac and Vascular Company, Medical Care Solutions Company, Blood and Cell Technologies Company, and Terumo Organ Technologies. The Cardiac and Vascular Company segment offers angiographic guidewires, angiographic catheters, introducer sheaths, vascular closure devices, PTCA balloon catheters,	3443581255680.0	1.54	92.23	9.968601349953943	9.616488063845852		222648000000.0	159838000000.0	15000000000.0	174838000000.0	1368535000000.0	42.58065359996231	87.07103019293677	3.7289520425240585	24.855462933969832	9.616488063845852	2.584671531743114	0.4488545674439376	매우 불리	불리(<1)	27.732976127691703	2557.8123882570058	9.542286434989533	보류	충분
