티커	종목코드	유니버스	현재가	3M수익률(보조,%)	6M수익률(보조,%)	12M수익률(보조,%)	52주고점대비(보조,%)	40일이평(보조)	200일이평(보조)	40일선상회(보조)	200일선상회(보조)	추세판정(보조)	종목명	시장	통화	섹터	산업	업종	사업설명	시가총액	배당수익률(%)	EPS(FY)	EPS Growth 1Y(%)	EPS Growth 3Y CAGR(%)	EPS Growth 5Y CAGR(%)	현금및단기투자	장기부채	단기위험부채	총부채	주주지분	주당순현금(린치식)	주당잉여현금흐름	잉여현금흐름수익률(%)	순현금차감PER(린치식)	사용연성장률(%)	린치PER배수	배당감안점수	린치PER판정	배당감안점수판정	그레이엄적정PER(3년)	그레이엄내재가치(3년)	그레이엄괴리율(3년,%)	종합판정	데이터상태
3407.T	3407.T	Japan Nikkei 225	1690.0	-3.400971706201772	39.1519143680527		-10.321040063677367	1578.125	1387.8975	Y	Y	상승전환/양호	ASAHI KASEI CORP	JPX	JPY	Industrials	Conglomerates	Conglomerates	Asahi Kasei Corporation engages in material, homes, healthcare businesses. The company offers Pimel photosensitive polyimide/PBO precursor, a liquid photosensitive material for buffer coating and packaging applications; Sunfort dry film photoresist to form circuit patterns on printed wiring boards; Novacure, a latent curing agent for epoxy resin with storage stability; glass fabric for printed circuit boards; plastic optical fiber; suede products under the Dinamica name; Microza UF and MF indust	2305948385280.0	2.6	116.95	208.1701136830571	-5.873847414568534		393467000000.0	847209000000.0	310249000000.0	1195045000000.0	1859421000000.0	-334.50939744990666	61.5950477516732	3.6446773817558107	17.31089694270976	-5.873847414568534		-0.18912061145088546	판정불가	불리(<1)	0.0	0.0	-100.0	보류	일부부족
3382.T	3382.T	Japan Nikkei 225	1878.5	-19.515852613538986	-2.516865594187856		-20.905263157894737	2018.075	2072.7775	N	N	주의	SEVEN & I HOLDINGS CO LTD	JPX	JPY	Consumer Defensive	Grocery Stores	Grocery Stores	Seven & i Holdings Co., Ltd. operates convenience stores, superstores, and department stores in Japan, North America, and internationally. It operates through Domestic Convenience Store operations, Overseas Convenience Store Operations, Superstore Operations, Financial Services, and Others segments. The company engages in the operation of convenience stores comprising directly managed corporate stores and franchised stores; retail business that provides daily life necessities, such as food and o	4500840513536.0	3.19	118.72	-22.951790333135968	-6.358884380543916		1391663000000.0	2022104000000.0	672625000000.0	4098791000000.0	4030288000000.0	-272.71987244136085	145.97221068503674	7.770679301838528	18.120113480806612	-6.358884380543916		-0.1748821487183564	판정불가	불리(<1)	0.0	0.0	-100.0	보류	일부부족
3092.T	3092.T	Japan Nikkei 225	1026.5	-11.926211926211927	-20.054517133956384		-35.19570707070707	1082.025	1274.625	N	N	주의	ZOZO INC	JPX	JPY	Consumer Cyclical	Internet Retail	Internet Retail	ZOZO, Inc. operates online shopping Websites in Japan and internationally. It operates ZOZOTOWN a fashion online shopping website; WEAR, an outfit-sharing app; Multi-Size platform, a new way of shopping for clothes where users select their height and weight to purchase their ideal size; ZOZOUSED, a website for secondhand/vintage apparel; ZOZOFIT, a body management service; ZOZOGLASS, a skin tone capturing device that solves customers' challenge of cosmetic product color selection; ZOZOMAT, a 3D 	924561833984.0	3.9	54.2	2.2665253377235572	9.548609328331903		96486000000.0	0.0	20000000000.0	20000000000.0	98718000000.0	109.10694215100195	60.8701530693187	5.92987365507245	16.926071178025794	9.548609328331903	1.7726216034207254	0.7945499689137258	보통	불리(<1)	27.597218656663806	1495.7692511911785	45.7154652889604	보류	충분
1925.T	1925.T	Japan Nikkei 225	4483.0	-19.573017581628992	-15.415094339622637		-21.488616462346755	4907.2	5217.165	N	N	주의	DAIWA HOUSE INDUSTRY CO	JPX	JPY	Real Estate	Real Estate - Development	Real Estate - Development	Daiwa House Industry Co., Ltd., together with its subsidiaries, engages in the construction work business in Japan, the United States, and internationally. It operates through Single-Family Houses Business; Rental Housing Business; Condominiums Business; Commercial Facilities Business; Logistics, Business and Corporate Facilities Business; Environmental and Energy Business; and Other Businesses segments. The Single-Family Houses segment engages in the construction of single-family houses; and sa	2814312972288.0	2.92	566.65	8.805296700942588	13.001588369205708		334002000000.0	1778496000000.0	530580000000.0	2432828000000.0	2614236000000.0	-2332.285097744747	62.60625150748467	1.3965257976240166	12.027327446827401	13.001588369205708	0.9250660077282676	1.3237843934651954	헐값	보통(1~1.5)	34.50317673841141	19551.225098820825	336.11923039975073	보류	충분
1928.T	1928.T	Japan Nikkei 225	3339.0	-8.269230769230774	1.767753733617794		-12.728698379508629	3498.35	3446.8	N	N	중립	SEKISUI HOUSE	JPX	JPY	Consumer Cyclical	Residential Construction	Residential Construction	Sekisui House, Ltd. designs, constructs, and contracts built-to-order detached houses in Japan and internationally. It operates through Detached Houses, Rental Housing and Commercial Buildings, Architectural/Civil Engineering, Rental Housing Management, Remodeling, Development, and Overseas segments. It also engages in the design, construction, contracting, and sale of rental housing, office buildings, commercial buildings, and other properties; design, construction, and contracting of civil eng	2205303701504.0	4.37	357.94	6.609861969178477	7.946221780206719		435177000000.0	1253525000000.0	595364000000.0	1893674000000.0	2139611000000.0	-1262.4201676377754	187.02560996532156	5.601246180452877	12.855283476665852	7.946221780206719	1.6177856385392033	0.958066914865191	보통	불리(<1)	24.39244356041344	8731.031248014388	161.48641054250933	보류	충분
4755.T	4755.T	Japan Nikkei 225	763.7000122070312	-19.70349786450747	-23.74438220598789		-27.67992308645537	767.5399993896484	888.5769995117188	N	N	주의	RAKUTEN GROUP INC	JPX	JPY	Consumer Cyclical	Internet Retail	Internet Retail	Rakuten Group, Inc. provides various services in e-commerce, fintech, digital content, and communications to various users in Japan, the Americas, Europe, rest of Asia, and internationally. It operates in three segments: Internet Services, FinTech, and Mobile. The company operates a range of e-commerce sites comprising Rakuten Ichiba, an Internet shopping mall; online cash-back sites; travel booking sites; portal sites; and digital content sites, as well as provides messaging services. It also o	1729822588928.0	2.356946407265525	-82.25				5837566000000.0	5569622000000.0	0.0	5569622000000.0	992402000000.0	123.26687861962898	100.34778871296454	13.139686671336767					판정불가	판정불가				판정불가	일부부족
4689.T	4689.T	Japan Nikkei 225	407.3999938964844	-3.9830295504817426	-4.72404394731022		-27.906563175115718	409.38750076293945	435.92750106811525	N	N	주의	LY CORPORATION	JPX	JPY	Consumer Cyclical	Internet Retail	Internet Retail	LY Corporation engages in the online advertising and e-commerce businesses in Japan. The company offers LINE, a communication app; and Yahoo! JAPAN, an internet service that provides search, news, weather, shopping, auction, and other services. It also provides reuse, membership, and payment-related services. The company was formerly known as Z Holdings Corporation and changed its name to LY Corporation in October 2023. LY Corporation was incorporated in 1996 and is headquartered in Chiyoda, Jap	2895163424768.0	2.7	27.87	35.57098560941352	25.674352242677358		1043944000000.0	1694398000000.0	0.0	1694398000000.0	2998170000000.0	-94.92272586221418	61.26998443125974	15.039269845160513	18.023778965148853	25.674352242677358	0.7020149445168361	1.57427320305817	헐값	양호(>=1.5)	59.848704485354716	1667.983394006836	309.42155596365853	양호	충분
9201.T	9201.T	Japan Nikkei 225	2521.0	-19.79000954502068	-14.845465293024828		-21.95046439628483	2573.125	2904.0375	N	N	주의	JAPAN AIRLINES CO LTD	JPX	JPY	Industrials	Airlines	Airlines	Japan Airlines Co., Ltd., together with its subsidiaries, provides scheduled and non-scheduled air transport services in Japan, Asia, Oceania, the Americas, and internationally. The company engages in full-service and low-cost carrier, and cargo and mail; air transport-related businesses, such as airport passenger service, ground handling, maintenance, cargo, and passenger sales; and airport peripheral businesses, including mileage, lifestyle, and infrastructure. It also engages in the air mobil	1101218578432.0	3.81	307.06	12.041786170368663			756034000000.0	801461000000.0	94562000000.0	896023000000.0	975057000000.0	-105.68652849391353	846.7229535896572	33.586789115020125	8.55431032532376	12.041786170368663	0.7103855029724271	1.8530758842640784	헐값	양호(>=1.5)	8.5	2610.01	3.530741769139234	양호	충분
9202.T	9202.T	Japan Nikkei 225	2717.0	-18.79856545128512	-5.099545930841776		-20.158683514545995	2845.5375	2956.02	N	N	주의	ANA HOLDINGS INC	JPX	JPY	Industrials	Airlines	Airlines	ANA Holdings Inc., together with its subsidiaries, provides air transportation services in Japan and internationally. It operates through Aviation Business, Aviation related business, Travel business, and Trading company business segments. The Air Transportation segment offers domestic and international passenger, cargo and mail, and other transportation services. The Aviation related business segment provides air transportation related services, such as airport handling, and maintenance service	1229197541376.0	2.21	321.15	-2.590756029714125			1978127000000.0	966910000000.0	374085000000.0	1349058000000.0	1130317000000.0	2259.0363043884704	261.6077334430764	9.62855110206391	1.4260118188121738	-2.590756029714125		-0.2670076255267533	판정불가	불리(<1)	8.5	2729.7749999999996	0.47018770702980106	보류	일부부족
9101.T	9101.T	Japan Nikkei 225	5558.0	10.234034113447056	8.959027641638894		-11.903629735298782	5848.8	5313.0	N	Y	상승전환/양호	NIPPON YUSEN KABUSHIKI KAISHA	JPX	JPY	Industrials	Marine Shipping	Marine Shipping	Nippon Yusen Kabushiki Kaisha, together with its subsidiaries, provides logistics services in Japan, North America, Asia, and internationally. It operates in seven segments: Liner Trade, Air Cargo Transportation, Logistics, Automotive, Dry Bulk, Energy, and Others. The company offers liner trade services, such as ocean cargo shipping, ship owning and chartering, shipping agency, container terminal operations, harbor transport, and tugboat operations; air cargo transport; and logistics services, 	2267584135168.0	3.6	504.67	108.9679488020717	-22.063347354968577		156012000000.0	564763000000.0	54412000000.0	738461000000.0	2918874000000.0	-1012.8717483594529	753.9191746726373	13.564576730346117	13.020135431786024	-22.063347354968577		-1.4180610832890457	판정불가	불리(<1)	0.0	0.0	-100.0	보류	일부부족
9104.T	9104.T	Japan Nikkei 225	5851.0	16.414643851969757	32.886668180785826		-16.676160637994876	6315.9	5115.935	N	Y	상승전환/양호	MITSUI O.S.K. LINES LTD	JPX	JPY	Industrials	Marine Shipping	Marine Shipping	Mitsui O.S.K. Lines, Ltd., together with its subsidiaries, provides marine transportation and vessel chartering services in Japan, North America, Europe, Singapore, rest of Asia, and internationally. It operates through Dry Bulk Business; Energy Business; Container Ships; Car Carriers, Terminal and Logistics; Ferries and Coastal RoRo Ships, Cruise; Real Property; and Associated Businesses segments. The company engages in the dry bulk shipping of raw materials, such as iron ore, coal, wood chips,	2000375119872.0	3.5	619.04	62.61814401626595	-15.643474639273236		163790000000.0	1458018000000.0	246952000000.0	1815443000000.0	2686669000000.0	-3768.0851363152024	1049.576213431091	17.938407339447803	15.538713388981655	-15.643474639273236		-0.7814980774331066	판정불가	불리(<1)	0.0	0.0	-100.0	보류	일부부족
9107.T	9107.T	Japan Nikkei 225	2541.0	9.9524015577672	20.79866888519135		-11.617391304347823	2618.55	2302.9225	N	Y	상승전환/양호	KAWASAKI KISEN KAISHA	JPX	JPY	Industrials	Marine Shipping	Marine Shipping	Kawasaki Kisen Kaisha, Ltd. engages in the provision of marine, land, and air transportation services in Japan, the United States, Europe, Asia, and internationally. It offers dry bulk carrier, car carrier, liquefied natural gas carrier, crude oil and product, containerships, and liquefied gas business. The company also engages in the offshore and energy development business. In addition, it operates container terminals; and offers warehousing and cargo consolidation services. Kawasaki Kisen Kai	1631436406784.0	4.72	210.39	199.4283697261469	-21.955642905984497		306717000000.0	243840000000.0	51412000000.0	344860000000.0	1648433000000.0	99.47401994636589	223.19915320535551	8.783910004146222	11.604762488966369	-21.955642905984497		-1.485221513354701	판정불가	불리(<1)	0.0	0.0	-100.0	보류	일부부족
4911.T	4911.T	Japan Nikkei 225	2986.5	4.496151154653605	17.740981667652278		-14.793152639087015	3197.75	2701.51	N	Y	상승전환/양호	SHISEIDO COMPANY LIMITED	JPX	JPY	Consumer Defensive	Household & Personal Products	Household & Personal Products	Shiseido Company, Limited produces and sells in Japan and internationally. It offers fragrances, skincare, and makeup products through retail channels. The company also engages in the restaurant and food businesses; and operates beauty salons. In addition, it operates and supports SABFA, a professional hair makeup training school. Further, the company manages childcare facilities. It serves its products under the BAUM, BENEFIQUE, Clé de Peau Beauté, Dr. Dennis Gross Skincare, Drunk Elephant, EFF	1187876175872.0	2.01	-101.84	127.1			148369000000.0	181617000000.0	30000000000.0	323159000000.0	600756000000.0	-83.21263292706917	163.84239057800937	5.486100471388227		127.1			판정불가	판정불가				판정불가	일부부족
2502.T	2502.T	Japan Nikkei 225	1543.5	-8.96490710704807	-8.830478440637924		-22.02576408183885	1583.3875	1721.9125	N	N	주의	ASAHI GROUP HLDGS	JPX	JPY	Consumer Defensive	Beverages - Brewers	Beverages - Brewers	Asahi Group Holdings, Ltd., together with its subsidiaries, manufactures and sells beer, alcohol and non-alcohol beverages, and food products in Japan, Europe, Oceania, and Southeast Asia. The company offers alcoholic beverage products, including beers, non-alcohol beer, new genre, wines, shochu, whiskey and spirits, ready-to-drink beverages, and happoshu products. It also provides non-alcoholic beverage products beverages, such as carbonated drinks, coffee, tea, lactic acid bacteria drinks, and	2312061321216.0	3.37	115.45	17.06984086351806	7.760084287882463		118119000000.0	828047000000.0	451129000000.0	1279176000000.0	2668801000000.0	-485.2990895921203	182.83685993064938	11.845601550414601	17.572967428255698	7.760084287882463	2.2645330612834016	0.633363962763985	매우 불리	불리(<1)	24.020168575764927	2773.1284620720608	79.66494733217108	보류	충분
2503.T	2503.T	Japan Nikkei 225	2601.5	6.750102585145679	19.00731930466606		-5.123997082421594	2545.625	2353.9625	Y	Y	상승전환/양호	KIRIN HOLDINGS COMPANY LIMITED	JPX	JPY	Consumer Defensive	Beverages - Brewers	Beverages - Brewers	Kirin Holdings Company, Limited engages in food and beverages, alcoholic beverages, pharmaceuticals, and health science businesses. The company's products include beer, wine, soft drinks, dairy products, margarine, jams, and honey. It engages in the management and operation of a chain of Kirin City beer pubs. The company also produces and sells pharmaceutical products. In addition, it manufactures and sells amino acids and nucleic acids for pharmaceutical and industrial use, as well as bulk phar	2212902207488.0	2.92	182.11	153.44762428281857	9.948278401174782		138070000000.0	842434000000.0	81000000000.0	923434000000.0	1286991000000.0	-875.1623756745414	77.35717542278843	2.9735604621483156	19.091002007987157	9.948278401174782	1.9190257085821723	0.6740493975010344	보통	불리(<1)	28.396556802349565	5171.29695927588	98.78135534406611	보류	충분
4507.T	4507.T	Japan Nikkei 225	3049.0	-13.40528259017325	17.5178261707458		-16.784934497816593	3306.375	2913.9525	N	Y	상승전환/양호	SHIONOGI & CO	JPX	JPY	Healthcare	Drug Manufacturers - Specialty & Generic	Drug Manufacturers - Specialty & Generic	Shionogi & Co., Ltd. engages in the research, development, manufacture, and distribution of pharmaceuticals, diagnostic reagents, and medical devices in Japan and internationally. The company was formerly known as Shionogi Shoten Co., Ltd. and changed its name to Shionogi & Co., Ltd. in 1943. The company was founded in 1878 and is headquartered in Osaka, Japan.	2576753623040.0	2.49	200.62	5.187310991791638	14.283423809909968		914843000000.0	0.0	3464000000.0	21882000000.0	1361924000000.0	1075.0521815590314	168.46197171728707	5.525154861177011	9.839237456090961	14.283423809909968	0.6888570686577549	1.7047483491239874	헐값	양호(>=1.5)	37.06684761981994	7436.350969488276	143.8947513771163	양호	충분
4523.T	4523.T	Japan Nikkei 225	4429.0	-2.9366644751260162	1.980198019801982		-16.77940623825629	4849.425	4713.96	N	N	중립	EISAI CO LTD	JPX	JPY	Healthcare	Drug Manufacturers - Specialty & Generic	Drug Manufacturers - Specialty & Generic	Eisai Co., Ltd. engages in the research and development, manufacture, sale, and import and export of pharmaceuticals in India. It also offers prescription medicines. In addition, the company focuses on neurology and oncology and therapeutic areas. The company was formerly known as Nihon Eisai Co., Ltd. and changed its name to Eisai Co., Ltd. in 1955. Eisai Co., Ltd. was incorporated in 1941 and is headquartered in Tokyo, Japan.	1259920424960.0	3.61	136.86	9.493715660150448	-1.06864249893871		266537000000.0	99832000000.0	87691000000.0	187523000000.0	841417000000.0	590.9139039239533	25.337287935265397	0.5720769459305802	28.04388496329129	-1.06864249893871		0.09062073619214528	판정불가	불리(<1)	6.36271500212258	870.8011751904963	-80.33865036824348	보류	일부부족
4543.T	4543.T	Japan Nikkei 225	2279.0	9.567307692307692	-8.730476571886259		-18.476122339474156	2093.65	2320.65	Y	N	상승전환/양호	TERUMO CORP	JPX	JPY	Healthcare	Medical Instruments & Supplies	Medical Instruments & Supplies	Terumo Corporation engages in the manufacture and sale of medical products and equipment in Japan, Europe, China, the United States, Asia, and internationally. The company operates through four segments: Cardiac and Vascular Company, Medical Care Solutions Company, Blood and Cell Technologies Company, and Terumo Organ Technologies. The Cardiac and Vascular Company segment offers angiographic guidewires, angiographic catheters, introducer sheaths, vascular closure devices, PTCA balloon catheters,	3383840473088.0	1.58	92.07	9.968601349953943	9.616488063845852		222648000000.0	159838000000.0	15000000000.0	174838000000.0	1368535000000.0	42.58065359996231	87.07103019293677	3.8205805262368044	24.290424094710957	9.616488063845852	2.5259142353676114	0.4609424693529248	매우 불리	불리(<1)	27.732976127691703	2553.375112076575	12.0392765281516	보류	충분
