티커	종목코드	유니버스	현재가	3M수익률(보조,%)	6M수익률(보조,%)	12M수익률(보조,%)	52주고점대비(보조,%)	40일이평(보조)	200일이평(보조)	40일선상회(보조)	200일선상회(보조)	추세판정(보조)	종목명	시장	통화	섹터	산업	업종	사업설명	시가총액	배당수익률(%)	EPS(FY)	EPS Growth 1Y(%)	EPS Growth 3Y CAGR(%)	EPS Growth 5Y CAGR(%)	현금및단기투자	장기부채	단기위험부채	총부채	주주지분	주당순현금(린치식)	주당잉여현금흐름	잉여현금흐름수익률(%)	순현금차감PER(린치식)	사용연성장률(%)	린치PER배수	배당감안점수	린치PER판정	배당감안점수판정	그레이엄적정PER(3년)	그레이엄내재가치(3년)	그레이엄괴리율(3년,%)	종합판정	데이터상태
4063.T	4063.T	Japan Nikkei 225	6942.0	10.348116356700054	44.987468671679196		-11.068408916218297	7261.475	5722.8	N	Y	상승전환/양호	SHIN-ETSU CHEMICAL CO	JPX	JPY	Basic Materials	Chemicals	Chemicals	Shin-Etsu Chemical Co., Ltd. provides infrastructure, electronics, and functional materials in Japan. The company operates through Electronic Materials; Living environment basic materials; Functional materials; and Processing, trading and technical services segments It offers polyvinyl chloride resin, caustic soda, methanol, chloromethanes, and polyvinyl alcohol; and semiconductor silicon, rare earth magnets, semiconductor encapsulating materials, LED packaging materials, photoresists, photomask	13031718256640.0	1.53	252.69	-11.153493963720528	-12.50031528966865		1674130000000.0	236366000000.0	6929000000.0	243295000000.0	4464428000000.0	773.1789660783816	191.82126578431843	2.763198873297586	24.412604511146537	-12.50031528966865		-0.4493709503490183	판정불가	불리(<1)	0.0	0.0	-100.0	보류	일부부족
6981.T	6981.T	Japan Nikkei 225	10740.0	188.47703464947622	239.9810066476733		-12.326530612244902	8616.35	4402.37	Y	Y	상승전환/양호	MURATA MANUFACTURING CO	JPX	JPY	Technology	Electronic Components	Electronic Components	Murata Manufacturing Co., Ltd. develops, manufactures, and sells ceramic-based passive electronic components and solutions in Japan, North America, and South America, Europe, China, Asia, and internationally. It operates through three segments: Components, Devices & Modules, and Other. The company offers capacitors; inductors; high frequency device and communication modules, including surface acoustic wave filters, RF modules, multilayer resin substrates, and connectivity modules; lithium-ion se	20742213206016.0	65.0	127.81	0.04362367311327997	-1.3891842891780914		702071000000.0	1516000000.0	1745000000.0	55768000000.0	2718743000000.0	384.858856714945	95.04086321473532	0.8849242384984668	81.01980395340783	-1.3891842891780914		0.7851267542859357	판정불가	불리(<1)	5.721631421643817	731.2817120002962	-93.19104551210152	보류	일부부족
6762.T	6762.T	Japan Nikkei 225	3593.0	71.38087288337707	61.956276763579		-12.600340549744594	3526.35	2507.7525	Y	Y	상승전환/양호	TDK CORP	JPX	JPY	Technology	Electronic Components	Electronic Components	TDK Corporation, together with its subsidiaries, engages in the manufacture and sale of electronic components in Japan, Europe, China, Asia, the Americas, and internationally. The company operates through Passive Components, Sensor Application Products, Magnetic Application Products, Energy Application Products, and Others segments. The Passive Components segment offers ceramic capacitors, aluminum electrolytic capacitors, film capacitors, high-frequency components, piezoelectric material produc	6776410341376.0	1.11	103.12	17.050627837832977	19.664137529214678		1161949000000.0	332678000000.0	210953000000.0	615970000000.0	2187234000000.0	436.88285849812115	110.14964340685454	3.0656733483677856	30.6062562209259	19.664137529214678	1.556450476175459	0.6787546107978776	보통	불리(<1)	47.828275058429355	4932.051724025236	37.26834745408394	보류	충분
6976.T	6976.T	Japan Nikkei 225	18610.0	347.3557692307692	453.3749628308058		-10.721995682417852	13185.275	5757.5525	Y	Y	상승전환/양호	TAIYO YUDEN CO LTD	JPX	JPY	Technology	Electronic Components	Electronic Components	Taiyo Yuden Co., Ltd. develops, manufactures, and sells electronic components in Japan, North America, China, Europe, Hong Kong, Taiwan and internationally. The company provides products, such as multilayer ceramic capacitors, inductors, high frequency devices, RF devices, and aluminum electrolytic capacitors, as well as conductive polymer hybrid aluminum electrolytic capacitors. Taiyo Yuden Co., Ltd. was incorporated in 1950 and is headquartered in Tokyo, Japan.	2521710198784.0	48.0	107.94	535.9965635738831	-13.923727854616875		100072000000.0	136017000000.0	35195000000.0	171212000000.0	344412000000.0	-287.2224492842623	464.3902374475859	2.4953801045007302	175.07154390665428	-13.923727854616875		0.19464198112945255	판정불가	불리(<1)	0.0	0.0	-100.0	보류	일부부족
2802.T	2802.T	Japan Nikkei 225	5816.0	28.84359769605671	73.45660602445572		-5.584415584415581	5291.65	4318.355	Y	Y	상승전환/양호	AJINOMOTO CO INC	JPX	JPY	Consumer Defensive	Packaged Foods	Packaged Foods	Ajinomoto Co., Inc. engages in the seasonings and foods, frozen foods, and healthcare and other businesses in Japan and internationally. The company operates through three segments: Seasonings and Foods; Frozen Foods; and Healthcare, etc. The Seasonings and Foods segment offers sauces and seasoning products under the AJI-NO-MOTO, HON-DASHI, Cook Do, Ajinomoto KK Consommé, Pure Select Mayonnaise, Ros Dee, Masako, Aji-ngon, Sazón, Sajiku, and CRISPY FRY names. This segment also provides instant no	5613794361344.0	86.0	138.42	91.64816712204006	12.707541036729154		200033000000.0	380922000000.0	40433000000.0	421355000000.0	770819000000.0	-189.24118723875458	120.10902942968858	2.0651483739630083	43.384201612763725	12.707541036729154	3.4140516632894196	2.275195517432069	매우 불리	안심(>=2)	33.91508207345831	4694.525660608098	-19.282571172487994	보류	충분
2914.T	2914.T	Japan Nikkei 225	6026.0	0.7187029918101384	4.400554400554402		-6.617077328374399	6099.25	5666.795	N	Y	상승전환/양호	JAPAN TOBACCO INC	JPX	JPY	Consumer Defensive	Tobacco	Tobacco	Japan Tobacco Inc., a tobacco company, engages in the manufacture and sale of tobacco products in Japan and internationally. It operates through two segments: Tobacco Business and Processed Food Business. It offers tobacco products, such as cigarettes, fine cut tobacco products, cigars, pipes, and hookah products. The company provides reduced-risk products, including heated tobacco, infused tobacco, e-vapor, traditional oral, and modern oral. Further, the company provides frozen and room-tempera	10672753606656.0	4.02	280.81	184.6323365320241	4.841039520733248		1222767000000.0	1599061000000.0	79627000000.0	1678688000000.0	4086933000000.0	-211.9677604569967	198.0969728986166	3.2873709408997116	22.214193798144642	4.841039520733248	4.588723910020873	0.3988908893679199	매우 불리	불리(<1)	18.182079041466494	5105.709615634206	-15.271994430232228	보류	충분
4452.T	4452.T	Japan Nikkei 225	3250.0	7.794361525704807	2.4590163934426146		-6.528616623526029	3011.825	3146.285	Y	Y	상승전환/양호	KAO CORP	JPX	JPY	Consumer Defensive	Household & Personal Products	Household & Personal Products	Kao Corporation develops and sells hygiene living care, health beauty care, life care, cosmetics, and chemical products in Japan. It offers fabric, kitchen, home, and sanitary care products; facial, body, hair, and oral care, hair styling and color, salon, in-bathroom health care, and warming products; and self-selection cosmetics, as well as provides cosmetics counselling services. It also provides oleo chemicals, such as oleochemicals, fat and oil derivatives, surfactants, and fragrances; wate	2915660464128.0	3.6	232.05	11.426503475089778	11.753550481602094		345132000000.0	105599000000.0	26059000000.0	243142000000.0	1064077000000.0	264.7821590850582	148.24542160261038	4.5613975877726265	12.864545748394491	11.753550481602094	1.0945242264055823	1.1934778562638508	보통	보통(1~1.5)	32.00710096320419	7427.2477785115325	128.53070087727792	보류	충분
6501.T	6501.T	Japan Nikkei 225	4486.0	-6.130989746808957	-6.774729842061511		-22.894465452045377	4879.775	4828.55	N	N	주의	HITACHI	JPX	JPY	Industrials	Conglomerates	Conglomerates	Hitachi, Ltd. provides digital system and services, green energy and mobility, and connective industry solutions in Japan and internationally. It operates through Digital Systems & Services, Green Energy & Mobility, Connective Industries, and Others segments. The company offers system integration, consulting, cloud services, storage, servers, software, and ATMs; finance solutions, social infrastructure information systems, public IT solutions, industrial internet of things, digital engineering, 	20105165537280.0	1.25	176.75	30.3129324177716	7.32032464912904		2034088000000.0	539753000000.0	469284000000.0	1009037000000.0	6568369000000.0	332.31117421101493	260.2369415287097	5.801090983698388	23.50036110771703	7.32032464912904	3.2102894658521826	0.36468906200401846	매우 불리	불리(<1)	23.14064929825808	4090.1097634671155	-8.825016418477139	보류	충분
6503.T	6503.T	Japan Nikkei 225	5860.0	7.40469208211143	29.274211339069044		-10.67073170731707	6110.35	5031.64	N	Y	상승전환/양호	MITSUBISHI ELECTRIC CORP	JPX	JPY	Industrials	Electrical Equipment & Parts	Electrical Equipment & Parts	Mitsubishi Electric Corporation develops, manufactures, sells, and distributes electrical and electronic equipment. It operates through Infrastructure, Industry & Mobility, Life, Digital Innovation, Semiconductor & Device, and Others segments. The company offers public utility systems comprising rolling stock and communication systems, and supervisory control and power supply systems; energy systems consisting of supervisory control, power transmission and distribution systems, substation equipm	12024856707072.0	1.02	198.07	25.818614926994243	23.991473486048285		846185000000.0	0.0	152448000000.0	363278000000.0	4484266000000.0	413.4920870343502	162.99363210507124	2.7814612987213523	27.497894244285604	23.991473486048285	1.1461527888346	0.909577775805359	보통	불리(<1)	56.48294697209657	11187.577306763167	90.91428851131684	보류	충분
6506.T	6506.T	Japan Nikkei 225	6902.0	56.29528985507246	57.00636942675159		-9.836708033964726	6764.75	4904.7875	Y	Y	상승전환/양호	YASKAWA ELECTRIC CORP	JPX	JPY	Industrials	Electrical Equipment & Parts	Electrical Equipment & Parts	YASKAWA Electric Corporation engages in motion control, robotics, and system engineering businesses worldwide. It offers rotary servo motors, direct drive motors, linear motors/linear sliders, machine controllers, positioning sensor encoders, and servo amplifiers for use in industrial robots, semiconductor manufacturing apparatus, machine tools, flat panel display manufacturing equipment, and metal working machines; and arc and spot welding, handling/assembling, collaborative, biomedical, pallet	1822578573312.0	1.04	135.97	12.429222483082448	14.109475795852378		67600000000.0	71175000000.0	24519000000.0	109526000000.0	431188000000.0	-13.783506697525425	74.02996142634565	1.0725870968754803	50.86256899829026	14.109475795852378	3.6048517843052554	0.29785117217263696	매우 불리	불리(<1)	36.71895159170475	4992.675847924095	-27.66334616163293	보류	충분
6752.T	6752.T	Japan Nikkei 225	4393.0	63.066072754268745	122.88178589548453		-4.707158351409979	3745.35	2465.1375	Y	Y	상승전환/양호	PANASONIC HOLDINGS CORP	JPX	JPY	Technology	Consumer Electronics	Consumer Electronics	Panasonic Holdings Corporation, together with its subsidiaries, develops, manufactures, sells, services, and supplies various electrical and electronic equipment and related products in Japan, the Americas, the United States, Europe, Asia, China, and internationally. It operates through six segments: Connect, Electric Works, HVAC & CC, Energy, Industry, and Smart Life. The company offers aircraft in-flight entertainment systems and communications services; electronic-components-mounting machines	10511474229248.0	1.23	81.27	-48.242104831993004	-10.626034797019713		1164377000000.0	1162564000000.0	185819000000.0	1603197000000.0	5211272000000.0	0.7764968344883763	-28.818611418764135	-0.6560120969443236	54.04483208029423	-10.626034797019713		-0.17385630476305403	판정불가	불리(<1)	0.0	0.0	-100.0	보류	일부부족
7751.T	7751.T	Japan Nikkei 225	4135.0	-5.9799909049568	-11.36120042872455		-16.10874416717387	4236.3	4471.195	N	N	주의	CANON INC	JPX	JPY	Technology	Computer Hardware	Computer Hardware	Canon Inc., together with its subsidiaries, develops, produces, sells, and services various printing, medical, imaging, and industrial equipment in Japan, the Americas, Europe, Asia, and Oceania. It operates through four segments: Printing Business Unit, Medical Business Unit, Imaging Business Unit, and Industrial Business Unit. The company offers digital continuous-feed and cut-sheet, large-format, and document and laser multifunction printers, as well as office multifunction devices, laser ima	3542647046144.0	3.87	367.19	107.50070301515389	10.822770014651395		650873000000.0	304970000000.0	511139000000.0	946159000000.0	3491808000000.0	404.91184501173774	250.20033919659213	6.050794176459302	10.158468789967761	10.822770014651395	0.9386200368496853	1.4463567608891599	헐값	보통(1~1.5)	30.14554002930279	11069.140843359692	167.69385352744118	보류	충분
7752.T	7752.T	Japan Nikkei 225	1420.5	5.222222222222217	4.756637168141586		-9.723546234509062	1440.4	1389.4525	N	Y	상승전환/양호	RICOH CO	JPX	JPY	Industrials	Business Equipment & Supplies	Business Equipment & Supplies	Ricoh Company, Ltd., together with its subsidiaries, engages in the digital services, digital products, graphic communications, industrial solutions, and other businesses in Japan, the Americas, Europe, the Middle East, Africa, and internationally. The company is involved in the production, OEM, and sale of multifunctional printers (MFPs) laser printers, digital duplicators, wide format printers, facsimile machine, scanners, personal computers, servers, and network equipment; production and sale	797981343744.0	3.1	97.73	21.790019471001344	0.791989337189003		458247000000.0	298130000000.0	133996000000.0	520327000000.0	1156141000000.0	282.11749909723613	65.56553255685749	4.615665790697465	11.648240058352235	0.791989337189003	14.707571821225743	0.3341268138098079	매우 불리	불리(<1)	10.083978674378006	985.5072358469625	-30.6225106760322	보류	충분
8058.T	8058.T	Japan Nikkei 225	4414.0	-21.94518125552608	21.66482910694598		-24.95749744984699	5008.6	4366.53	N	Y	상승전환/양호	MITSUBISHI CORP	JPX	JPY	Industrials	Conglomerates	Conglomerates	Mitsubishi Corporation engages in the global environment and energy, material solutions, metal resources, social infrastructure, mobility, food industry, SLC, and power solutions businesses in Japan and internationally. The Global Environmental Energy segment engages in the development and production of natural gas and liquefied natural gas (LNG), LPG, and petroleum products; and development of energy businesses. The Material Solutions segment is involved in sales transactions; and business inve	15916534333440.0	2.83	209.67	-15.803889518243752	-12.151552110871766		3010528000000.0	4136045000000.0	1610898000000.0	6490183000000.0	9440567000000.0	-307.39243712264073	310.5542571969433	7.0356650928170215	22.518206882828448	-12.151552110871766		-0.4139562336990534	판정불가	불리(<1)	0.0	0.0	-100.0	보류	일부부족
8001.T	8001.T	Japan Nikkei 225	1849.5	-10.305528612997094	-0.5965804434906463		-18.524229074889863	1913.6	1921.6554986572266	N	N	주의	ITOCHU CORP	JPX	JPY	Industrials	Conglomerates	Conglomerates	ITOCHU Corporation trades and imports/exports various products worldwide.It operates through eight segments: Textile, Machinery, Metals & Minerals, Energy & Chemicals, Food, General Products & Realty, ICT & Financial Business, and The 8th. The company produces and sells raw materials, threads, and textiles; and garments, home furnishings, and industrial materials. It also engages in the plants, bridges, railways, and other infrastructure; power generation, transmission, transformation, and elect	12959298355200.0	2.38	127.99	2.275714540511742	3.9926076501856755		1009156000000.0	2925827000000.0	746882000000.0	4758069000000.0	6589966000000.0	-274.2052849728544	121.15258631143365	6.550558870583058	16.59274384696347	3.9926076501856755	4.155866366231058	0.3840599064844773	매우 불리	불리(<1)	16.48521530037135	2109.942706294529	14.081790013221362	보류	충분
8031.T	8031.T	Japan Nikkei 225	4513.0	-29.37402190923317	0.9393871617087823		-32.22706112028833	5229.325	4880.585	N	N	중립	MITSUI & CO	JPX	JPY	Industrials	Conglomerates	Conglomerates	Mitsui & Co., Ltd. operates as trading company in Japan and internationally. It operates through Energy; Mobility, Digital & Infrastructure; Chemicals; Iron & Steel Products, Wellness Ecosystem; Innovation & Corporate Development; and All Other segments. The company is involved in development, processing and marketing of underground resources; recycling, space-related, and tank terminal business; manufacture and sale of iron and steel products; steel product processing and parts manufacturing; p	12745344811008.0	3.1	290.64	-7.37175428892577	-9.646811855190096		4922346000000.0	5032042000000.0	675724000000.0	5707766000000.0	8767744000000.0	-38.70455707739414	-54.86121158741233	-1.215626226177982	15.660970812955528	-9.646811855190096		-0.41803359021487035	판정불가	불리(<1)	0.0	0.0	-100.0	보류	일부부족
8766.T	8766.T	Japan Nikkei 225	7248.0	-4.468169236852515	22.868282759789803		-8.8187193357655	7272.15	6413.66	N	Y	상승전환/양호	TOKIO MARINE HOLDINGS INC	JPX	JPY	Financial Services	Insurance - Property & Casualty	Insurance - Property & Casualty	Tokio Marine Holdings, Inc. engages in the non-life and life insurance, and financial and general businesses in Japan, the United States, and internationally. The company provides personal lines, accident and health, absence management, workers' compensation, retirement services, energy, renewables, property, natural catastrophes, aviation and space, commercial auto/motor, fine arts and specie, agriculture TNC, equestrian and blood stock, life sciences, financial lines, professional indemnity, s	13768011546624.0	3.38	279.05	51.66195272259013	35.89564170319368		1071138000000.0	227246000000.0	0.0	227246000000.0	5076842000000.0	441.43702407456414	689.9288262440135	9.518885571799302	24.3919117574823	35.89564170319368	0.6795229337079136	1.6101912016447726	헐값	양호(>=1.5)	60.0	16743.0	131.00165562913907	양호	충분
8750.T	8750.T	Japan Nikkei 225	1739.0	20.931849791376923	34.28571428571428		-5.205778141182882	1654.625	1381.2675	Y	Y	상승전환/양호	DAIICHI LIFE GROUP INC	JPX	JPY	Financial Services	Insurance - Life	Insurance - Life	Daiichi Life Group, Inc., through its subsidiaries, provides insurance products in Japan, the United States, and internationally. The company operates through three segments: Domestic Insurance Business, Overseas Insurance Business, and Other Business. It offers educational endowment insurance, individual annuity, variable product, investment trust, lump-sum payment products, group annuity plans, succession products, medical and cancer protection, saving-type disease protection, health promotion	6404291166208.0	4.14	121.21	-4.75778074942137	35.95582185531412		1974671000000.0	1345159000000.0	0.0	1345159000000.0	4254211000000.0	174.81826255834252	186.72067384399008	10.73724403933238	12.904725166584091	35.95582185531412	0.35890502568714966	3.1070651515415086	매우 유망	안심(>=2)	60.0	7272.599999999999	318.20586543990794	매우 유망	충분
8801.T	8801.T	Japan Nikkei 225	1520.5	-12.261973456433928	-14.554650182635577		-29.196740395809083	1539.025	1717.8	N	N	주의	MITSUI FUDOSAN	JPX	JPY	Real Estate	Real Estate - Diversified	Real Estate - Diversified	Mitsui Fudosan Co., Ltd. operates as a real estate company in Japan. It operates through five segments: Leasing, Property Sales, Management, Facility Operations, and Other. The Leasing segment leases office buildings and retail facilities. The Property Sales segment is involved in the development and sale of condominiums and single-family homes for individual customers, as well as leasing housing and office buildings for investors. The Management segment engages in the property management and br	4034237300736.0	2.43	100.96	10.751089487061915	12.021978506616149		175258000000.0	3584918000000.0	831166000000.0	4416084000000.0	3147488000000.0	-1266.9259923464547	121.79010997090096	8.009872408477538	27.609211493130495	12.021978506616149	2.2965613753124	0.523447709117371	매우 불리	불리(<1)	32.5439570132323	3285.6379000559327	116.08930615297157	보류	충분
8802.T	8802.T	Japan Nikkei 225	4165.0	-8.016784452296822	10.243515087347799		-21.533534287867372	4121.4	3996.72	Y	Y	상승전환/양호	MITSUBISHI ESTATE CO	JPX	JPY	Real Estate	Real Estate - Diversified	Real Estate - Diversified	Mitsubishi Estate Co., Ltd. engages in real estate activities in Japan and internationally. The company develops, leases, manages, and sells office buildings and commercial facilities; operates rental offices, coworking spaces, virtual offices, hourly meeting rooms, home delivery storage services, commercial nursing homes, and building garages; offers real estate management, as well as building management services, such as security, facility management, cleaning, and planting services; and opera	4994977759232.0	1.2	181.59	17.507235049325075	10.404291483438621		2532511000000.0	3026273000000.0	555648000000.0	3581921000000.0	2689491000000.0	-409.7402602731853	-15.630744250277903	-0.3752879771975487	25.192688255262873	10.404291483438621	2.4213747082503576	0.4606214059356857	매우 불리	불리(<1)	29.308582966877243	5322.145580955239	27.782606985720015	보류	충분
9020.T	9020.T	Japan Nikkei 225	3452.0	-5.346860433232791	-15.804878048780491		-17.80952380952381	3495.625	3730.16	N	N	주의	EAST JAPAN RAILWAY CO	JPX	JPY	Industrials	Railroads	Railroads	East Japan Railway Company operates as a passenger railway company in Japan and internationally. The company operates through Transportation, Distribution and service, Real Estate & Hotels, and Others segments. It offers passenger railway, freight, bus transportation, station operations, travel agency, warehousing, financial, telecommunication, computer-related data, leasing of personal property, dry cleaning, casualty insurance, and other agency services. The company is also involved in the ope	3847865499648.0	2.43	219.55	10.504937913815017	35.67819476510492		262257000000.0	4585208000000.0	274872000000.0	4860080000000.0	3047108000000.0	-3828.776611064078	-108.92961928510407	-3.1555509642266535	33.16227105927615	35.67819476510492	0.9294828753979035	1.149143093878828	헐값	보통(1~1.5)	60.0	13173.0	281.60486674391655	보류	충분
9021.T	9021.T	Japan Nikkei 225	2744.5	-14.287945034353534	-11.238680465717987		-21.9203413940256	2652.4375	3080.8375	Y	N	주의	WEST JAPAN RAILWAY CO	JPX	JPY	Industrials	Railroads	Railroads	West Japan Railway Company, together with its subsidiaries, engages in the railway operation business in Japan. It operates through five segments: Mobility, Distribution, Real Estate, Travel and Regional Solutions, and Others. The company offers rail passenger transportation services; sells various goods through stores inside the train stations, including convenience stores, restaurants, and souvenir shops; and develops and operates shopping centers and hotels, as well as leases and sells condom	1240103387136.0	3.55	277.74	11.88244791940891	12.92983888786232		289307000000.0	1404169000000.0	137430000000.0	1541599000000.0	1207705000000.0	-2449.7948854757556	794.653619563802	28.954404064995515	18.702005060400936	12.92983888786232	1.4464221265708999	0.8811803244966625	보통	불리(<1)	34.35967777572464	9543.056905429763	247.71568247147982	보류	충분
9022.T	9022.T	Japan Nikkei 225	3485.0	-17.670682730923694	-21.73815405344711		-27.471383975026008	3466.65	4115.295	Y	N	주의	CENTRAL JAPAN RAILWAY CO	JPX	JPY	Industrials	Railroads	Railroads	Central Japan Railway Company engages in the railway and related businesses in Japan. The company operates through three segment: Transportation, Merchandise and Other, and Real Estate. It operates railway and conventional lines; and department stores. The company also engages in the wholesale and retail of food and beverage; leasing of real estate properties, such as station buildings; and bus operation, contracted accounting and financial, hotel, travel, advertising, rolling stock production, 	3306866081792.0	92.0	570.84	20.60280570564741	36.07693306663047		391493000000.0	4135277000000.0	172807000000.0	4308084000000.0	5068159000000.0	-3927.3395686809995	235.0413363592531	6.744371201126345	12.984968763017658	36.07693306663047	0.3599244076273259	9.863476409077311	매우 유망	안심(>=2)	60.0	34250.4	882.7948350071736	매우 유망	충분
