티커	종목코드	유니버스	현재가	3M수익률(보조,%)	6M수익률(보조,%)	12M수익률(보조,%)	52주고점대비(보조,%)	40일이평(보조)	200일이평(보조)	40일선상회(보조)	200일선상회(보조)	추세판정(보조)	종목명	시장	통화	섹터	산업	업종	사업설명	시가총액	배당수익률(%)	EPS(FY)	EPS Growth 1Y(%)	EPS Growth 3Y CAGR(%)	EPS Growth 5Y CAGR(%)	현금및단기투자	장기부채	단기위험부채	총부채	주주지분	주당순현금(린치식)	주당잉여현금흐름	잉여현금흐름수익률(%)	순현금차감PER(린치식)	사용연성장률(%)	린치PER배수	배당감안점수	린치PER판정	배당감안점수판정	그레이엄적정PER(3년)	그레이엄내재가치(3년)	그레이엄괴리율(3년,%)	종합판정	데이터상태
7201.T	7201.T	Japan Nikkei 225	301.8999938964844	-14.23295627940785	-23.820337321281958		-34.907287226741666	349.22999877929686	371.29299942016604	N	N	주의	NISSAN MOTOR CO	JPX	JPY	Consumer Cyclical	Auto Manufacturers	Auto Manufacturers	Nissan Motor Co., Ltd., together with its subsidiaries, manufactures and sells automotive products in Japan, North America, Europe, Asia, and internationally. It operates through Automotive and Sales Financing segments. The company engages in planning, development, and production vehicle and vehicle parts; manufacturing and sale of automotive engines, drivetrain, and its parts; development, manufacturing, and sale of electrified powertrains, parts, and automobile transmissions; and production an	1048914755584.0	11.593243030008413	-152.58				2433513000000.0	4369888000000.0	3615743000000.0	8099861000000.0	4958543000000.0	-553.8224118566981	-178.56799032389625	-59.14806026300343					판정불가	판정불가				보류	일부부족
7269.T	7269.T	Japan Nikkei 225	1971.5	1.3364173734258467	-15.476956055734192		-19.579849071996737	1865.4375	2108.6425	Y	N	상승전환/양호	SUZUKI MOTOR CORP	JPX	JPY	Consumer Cyclical	Auto Manufacturers	Auto Manufacturers	Suzuki Motor Corporation engages in the manufacture and sale of automobiles, motorcycles, outboard motors, electric wheelchairs, and other products in Japan and internationally. The company offers mini passenger cars and commercial vehicles, compact passenger cars and automobile engines, foundry and machining of engine components, motorcycles and motorcycle engines, motorized wheelchairs, and electro senior vehicles. It is also involved in the development and testing of motorcycles; development 	3772694921216.0	2.64	227.71	5.580338901574322	25.711602334646134		1801929000000.0	485229000000.0	263394000000.0	748623000000.0	3382083000000.0	682.4847431188771	152.2158157308029	7.720812362708744	5.660775797642277	25.711602334646134	0.22016425596371472	5.0084305311039925	매우 유망	안심(>=2)	59.92320466929227	13645.112935244542	592.1183330075852	매우 유망	충분
7270.T	7270.T	Japan Nikkei 225	2401.5	-7.3495370370370345	-30.310504933255945		-33.25458588104503	2443.0125	2962.2575	N	N	주의	SUBARU CORPORATION	JPX	JPY	Consumer Cyclical	Auto Manufacturers	Auto Manufacturers	Subaru Corporation manufactures and sells automobiles and aerospace products in Japan, Asia, North America, Europe, and Internationally. The company operates through three segments: Automotive, Aerospace, and Others. It manufactures, sells, and repairs automobiles and the parts; aircraft, space-related equipment, and the parts; and rents real estate properties. In addition, the company engages in the lease of production tools such as dies, network devices, and terminal equipment, as well as for 	1709873168384.0	4.83	125.6	-73.12859771284556	-23.18596163896838		2760676000000.0	337300000000.0	47200000000.0	384500000000.0	2780407000000.0	3387.3090738882834	67.82372945522327	2.8242235875587456	-7.8487983589831485	-23.18596163896838			판정불가	판정불가	0.0	0.0	-100.0	판정불가	일부부족
4901.T	4901.T	Japan Nikkei 225	3513.0	17.060979673442176	3.9041703637976877		-6.816976127320951	3293.7875	3300.015	Y	Y	상승전환/양호	FUJIFILM HOLDINGS CORPORATION	JPX	JPY	Industrials	Conglomerates	Conglomerates	FUJIFILM Holdings Corporation provides products and services in the fields of healthcare, electronics, business innovation, and imaging in Japan, the Americas, Europe, Asia, and internationally. Its Healthcare segment offers products and services, such as medical devices, biomedical contract development and manufacturing organization, pharmaceutical, regenerative medicine, and cosmetics and supplements in the areas of prevention, diagnosis, and treatment; equipment and materials for medical syst	4164289036288.0	2.13	229.4	6.0486451479396575	8.042503837346393		170553000000.0	607034000000.0	287913000000.0	1027013000000.0	3839550000000.0	-365.0715005423948	-133.83275760752275	-3.809642972033098	16.905281170629447	8.042503837346393	2.1019923039548476	0.6017352645408638	매우 불리	불리(<1)	24.585007674692786	5639.800760574525	60.54086992811059	보류	충분
5108.T	5108.T	Japan Nikkei 225	3424.0	3.039422208847431	-4.384250209438701		-10.296044013623263	3383.45	3468.445	Y	N	상승전환/양호	BRIDGESTONE CORP	JPX	JPY	Consumer Cyclical	Auto Parts	Auto Parts	Bridgestone Corporation, together with its subsidiaries, manufactures and sells tires and rubber products in Japan, China, India, the Asia Pacific, the United States, the Americas, Europe, the Middle East, and Africa. The company offers passenger car, motorcycle, trucks, buses, construction and mining vehicles, agricultural machinery, and aircraft tires; automotive components; automotive maintenance and repair services; synthetic rubber; retreading materials; and raw materials for tires. It also	4262481625088.0	3.8	119.16	14.833905870051133	2.907072532622368		740830000000.0	392312000000.0	94958000000.0	827015000000.0	3661793000000.0	278.81560961364073	298.6308955802774	8.721696716713708	26.3946323463105	2.907072532622368	9.079454348014094	0.254107442930907	매우 불리	불리(<1)	14.314145065244736	1705.6735259745626	-50.18476851709806	보류	충분
6301.T	6301.T	Japan Nikkei 225	6318.0	-1.8029219769972071	26.689392420292755		-18.989614053083727	6526.5	6007.065	N	Y	상승전환/양호	KOMATSU	JPX	JPY	Industrials	Farm & Heavy Construction Machinery	Farm & Heavy Construction Machinery	Komatsu Ltd. engages in the manufacturing and sale of construction, mining, utility, forestry, and industrial machinery worldwide. It operates in three segments: Construction Machinery and Vehicles, Retail Finance, and Industrial Machinery and Others. The company offers construction and mining equipment, such as hydraulic and mini excavators, bulldozers, wheel loaders, dump trucks, rope and hybrid shovels, continuous miners, and jumbo drills; and demolition, waste, and recycling equipment, inclu	5663367364608.0	3.01	413.83	-14.381480116647783	4.865004653908689		441011000000.0	651431000000.0	689600000000.0	1419553000000.0	3510768000000.0	-233.4050294158333	262.5579187947276	4.155712548191319	15.831150543498136	4.865004653908689	3.2540874407548452	0.49743729189303665	매우 불리	불리(<1)	18.230009307817376	7544.124751854064	19.406849507028557	보류	충분
6326.T	6326.T	Japan Nikkei 225	2704.0	4.8671708357572285	21.310004486316725		-16.59469463294263	2790.95	2425.365	N	Y	상승전환/양호	KUBOTA CORP	JPX	JPY	Industrials	Farm & Heavy Construction Machinery	Farm & Heavy Construction Machinery	Kubota Corporation engages in the manufacture and sale of agricultural and construction machinery in Japan, North America, Europe, Asia, and internationally. The company offers tractors, power tillers, combine harvesters, rice transplanters, turf equipment, utility vehicles, other agricultural machineries, implements, attachments, post-harvest machineries, vegetable production equipment, intermediate management machines, and other equipment for agricultural use, weighing and measuring control sy	3054338048000.0	1.92	163.32	-18.985666364342535	6.06183769287576		596155000000.0	1381640000000.0	860439000000.0	2242079000000.0	2622985000000.0	-690.6308227835013	124.85489694612315	4.61741482788917	20.785150764042992	6.06183769287576	3.428853066863035	0.384016348184678	매우 불리	불리(<1)	20.62367538575152	3368.2586640009376	24.565778994117515	보류	충분
6367.T	6367.T	Japan Nikkei 225	24460.0	19.25889809848855	24.57346574993633		-5.120248254460824	23773.75	20168.15	Y	Y	상승전환/양호	DAIKIN INDUSTRIES	JPX	JPY	Industrials	Building Products & Equipment	Building Products & Equipment	Daikin Industries,Ltd., together with its subsidiaries, manufactures and sells air conditioning and refrigeration equipment in Japan, the United States, China, Europe, Asia, Oceania, and internationally. The company offers split/multi-split type air conditioners, unitary, air to water heat pump systems, heating systems, air purifiers, medium/low temperature refrigeration, packaged air conditioners, VRV, ventilation products, control systems, container refrigeration units, air and water cooled ch	6870727131136.0	1.47	939.26	3.955325071669491	2.2106757352103212		933484000000.0	449387000000.0	433775000000.0	1094585000000.0	3254652000000.0	1739.2532453208014	922.506931547368	3.771491952360458	24.190050417008283	2.2106757352103212	10.942378401193638	0.15215659627655834	매우 불리	불리(<1)	12.921351470420642	12136.508582107292	-50.38222165941417	보류	충분
6273.T	6273.T	Japan Nikkei 225	70450.0	8.836706318554	30.511300481659866		-16.686376537369917	70100.0	61026.9	Y	Y	상승전환/양호	SMC CORP	JPX	JPY	Industrials	Specialty Industrial Machinery	Specialty Industrial Machinery	SMC Corporation manufactures and sells automatic control equipment in Japan, the United States, China, rest of Asia, Europe, and internationally. The company offers air management system, directional control valves, air cylinders, rotary actuators/air grippers/magnet grippers, electric actuators/cylinders, vacuum equipment, air grippers for collaborative robots, compact compressor, air preparation equipment, modular F.R.L., pressure control equipment, booster regulators, lubrication equipment, g	4495306129408.0	1.42	2641.88	7.010182674103249	-9.351822097959051		759534000000.0	0.0	5092000000.0	5092000000.0	2115090000000.0	12043.581574503407	547.5580539261595	0.7772293171414613	22.107899838560645	-9.351822097959051		-0.3587777290416501	판정불가	불리(<1)	0.0	0.0	-100.0	보류	일부부족
6146.T	6146.T	Japan Nikkei 225	79550.0	17.86931397244036	80.05885015844274		-10.092676311030747	73036.0	60555.7	Y	Y	상승전환/양호	DISCO CORPORATION	JPX	JPY	Technology	Semiconductor Equipment & Materials	Semiconductor Equipment & Materials	Disco Corporation manufactures and sells precision cutting, grinding, and polishing machines in Japan and internationally. The company offers precision machines include dicing saws, laser saws, grinders, polishers, wafer mounters, die separators, inspection systems, surface planers, and waterjet saws. It also provides precision processing tools, such as dicing blades, grinding wheels, and dry polishing wheels; and other products, such as accessory equipment, cut-off wheels, and related products.	8814087634944.0	63.0	1248.94	9.387283983501638	17.80572767187141		284575000000.0	0.0	0.0	0.0	587758000000.0	2623.5914876982993	906.4078738629394	1.1394190746234312	61.5933579774062	17.80572767187141	3.459187914836431	1.3119227515004577	매우 불리	보통(1~1.5)	44.11145534374282	55092.56103701416	-30.74473785416196	보류	충분
7735.T	7735.T	Japan Nikkei 225	16765.0	71.4650984402966	162.15793588741204		-4.879432624113478	12843.25	9141.435	Y	Y	상승전환/양호	SCREEN HOLDINGS CO LTD	JPX	JPY	Technology	Semiconductor Equipment & Materials	Semiconductor Equipment & Materials	SCREEN Holdings Co., Ltd. develops, manufactures, and markets semiconductor production equipment in Japan, Taiwan, South Korea, China, the United States, Europe, and internationally. It operates through Semiconductor Production Equipment, Graphic Arts Equipment, Display Production Equipment and Coater, and Printed Circuit Board (PCB)-Related Equipment segments. The company offers wafer cleaning systems, such as wet stations, spin processors, and spin scrubbers; coat/develop trackers, and spray c	3366708576256.0	1.37	486.19	-7.503996300280491	16.968083827819402		307370000000.0	79000000.0	3167000000.0	6091000000.0	486568000000.0	1625.1230975573626	327.0596526492477	1.9508479132075616	31.139836077341442	16.968083827819402	1.8352005089865988	0.5888946808285516	보통	불리(<1)	42.436167655638805	20632.04035249503	23.06615181923668	보류	충분
7741.T	7741.T	Japan Nikkei 225	25805.0	-8.134567461730157	9.181298921091607		-14.069264069264065	26832.125	25355.55	N	Y	상승전환/양호	HOYA CORP	JPX	JPY	Healthcare	Medical Instruments & Supplies	Medical Instruments & Supplies	HOYA Corporation, a med-tech company, provides high-tech and medical products in the Japan, Asia, the Americas, Europe, and internationally. The company operates through two segments: Life Care, and Information and Communications. It offers life care products, including eyeglasses; contact lenses; medical endoscopes; intraocular lenses; laparoscopic surgical instruments; automatic endoscope cleaning equipment; and other medical related products, such as prosthetic ceramic fillers and metallic im	8680651096064.0	1.14	743.18	25.225876042790276	14.490578286242052		583594000000.0	31517000000.0	10724000000.0	42241000000.0	1020460000000.0	1650.382888040822	663.2448000101018	2.5702181748114774	32.50170498662394	14.490578286242052	2.242954307591878	0.4809156409694448	매우 불리	불리(<1)	37.4811565724841	27855.245941538735	7.945149938146612	보류	충분
7733.T	7733.T	Japan Nikkei 225	1724.0	20.39106145251397	-13.410346559517826		-18.525519848771268	1731.4625	1787.1125	N	N	주의	OLYMPUS CORPORATION	JPX	JPY	Healthcare	Medical Devices	Medical Devices	Olympus Corporation, together with its subsidiaries, engages in the manufacture and sale of medical equipment in Japan, America, the Middle East, Asia, and Oceania. It operates through two segments, Gastrointestinal Solutions and Surgical & Interventional Solutions. The company offers gastrointestinal Solutions products offer gastrointestinal endoscopes, gastroenterology devices, and medical services. The Surgical & Interventional Solutions provides urology, respiratory, surgical endoscopes, en	1804606767104.0	1.74	61.2	-42.15603920071273	-21.959508898733272		244880000000.0	159700000000.0	79876000000.0	239576000000.0	812040000000.0	80.19520888402185	17.099147496496887	0.9918299011889146	26.8595554103918	-21.959508898733272		-0.7527864326045571	판정불가	불리(<1)	0.0	0.0	-100.0	보류	일부부족
6971.T	6971.T	Japan Nikkei 225	3509.0	43.98851046368486	59.75415433644435		-10.324559161768466	3320.225	2497.645	Y	Y	상승전환/양호	KYOCERA CORP	JPX	JPY	Industrials	Conglomerates	Conglomerates	Kyocera Corporation develops and sells products based on fine ceramic technologies in Japan, China, rest of Asia, Europe, the United States, and internationally. The company operates through Core Components Business, Electronic Components Business, and Solutions Business segments. Its Core Components Business segment offers components, such as fine ceramic components for semiconductor processing equipment, automotive camera modules, and ceramic packages, as well as organic packages and boards to	4691282362368.0	1.6	102.81	485.0064323359755	3.2725233795547037		524759000000.0	188963000000.0	56075000000.0	332724000000.0	3339431000000.0	254.8918379788954	40.37404248489996	1.150585422767169	31.65166970159619	3.2725233795547037	9.6719460888628	0.15394206452587184	매우 불리	불리(<1)	15.045046759109407	1546.7812573040383	-55.919599392874375	보류	충분
6963.T	6963.T	Japan Nikkei 225	5336.0	58.0568720379147	153.79310344827587		-6.089405139035553	4809.075	3035.455	Y	Y	상승전환/양호	ROHM CO LTD	JPX	JPY	Technology	Semiconductors	Semiconductors	ROHM Co., Ltd. manufactures and sells electronic components worldwide. The company operates through three segments: ICs, Discrete Semiconductor Devices, and Module. The company provides ICs comprising memory, amplifiers and linear, power management, motor/actuator drivers, resistors, capacitors, clocks and timers, switches and multiplexers, logic, data converters, sensors and MEMS, display drivers, interfaces, wireless LSIs, audio and video products, speech synthesis LSI, and microcontrollers. I	2078412767232.0	94.0	-410.34				449272000000.0	300000000000.0	100000000000.0	400000000000.0	757963000000.0	386.6798951366773	-55.73845934707035	-1.0445738258446469					판정불가	판정불가				보류	일부부족
6723.T	6723.T	Japan Nikkei 225	4810.0	101.29734254028038	138.70967741935485		-4.582424122197981	4221.15	2642.14	Y	Y	상승전환/양호	RENESAS ELECTRONICS CORP	JPX	JPY	Technology	Semiconductors	Semiconductors	Renesas Electronics Corporation engages in the design, research, development, manufacturing, sale, and service of semiconductors in Japan, China, rest of Asia, Europe, North America, and internationally. The company operates through Automotive Business and Industrial/Infrastructure/IoT Business segments. It offers microcontrollers and microprocessors; amplifiers, audio and video, data converters, power line communication, and switches and multiplexer products; custom ASICS and processor IP solut	8721314873344.0	57.99999999999999	-28.86	162.1			373099000000.0	964089000000.0	242478000000.0	1206567000000.0	2443034000000.0	-325.7409006245188	175.87385024717142	3.656421003059697		162.1			판정불가	판정불가				판정불가	일부부족
6702.T	6702.T	Japan Nikkei 225	3283.0	0.6746396810794142	-21.870537839124225		-29.184641932700607	3332.3	3748.975	N	N	주의	FUJITSU	JPX	JPY	Technology	Information Technology Services	Information Technology Services	Fujitsu Limited provides digital services in Japan, Europe, the United States, the Asia Pacific, East Asia, and internationally. The company operates through three segments: Service Solutions, Hardware Solutions, and Ubiquitous Solutions. It offers consulting and cloud services; system integration; software support services; business process outsourcing; IT services; and managed services. The company also provides AI for enterprises; customer relationship management; enterprise resource planning	5632823394304.0	1.68	174.66	104.45572706965658	27.82376924313961		450366000000.0	0.0	42797000000.0	133094000000.0	2024915000000.0	259.6102060257328	132.09358064644033	4.023563224076769	17.310144245816257	27.82376924313961	0.6221351282261783	1.7044207618472311	헐값	양호(>=1.5)	60.0	10479.6	219.20804142552544	양호	충분
6701.T	6701.T	Japan Nikkei 225	4047.0	2.715736040609129	-23.84267971396311		-33.37174843595654	4049.325	4734.545	N	N	주의	NEC CORP	JPX	JPY	Technology	Information Technology Services	Information Technology Services	NEC Corporation provides information technology services and social infrastructure in Japan and internationally. The company offers systems integration services, including system construction and consulting, maintenance support, and outsourcing, and cloud, system equipment, software services. It also provides core network equipment, mobile phone base stations, optical transmission systems, and marine systems, as well as software and services for telecommunications carriers. In addition, it offer	5205900394496.0	99.0	202.75	54.254693663197905	33.13991849848534		715956000000.0	272107000000.0	54966000000.0	489215000000.0	2196578000000.0	334.6409335067706	261.55129857233715	6.4628440467590105	18.310032387142932	33.13991849848534	0.5525068623201288	7.216804192616955	헐값	안심(>=2)	60.0	12165.0	200.5930318754633	양호	충분
5802.T	5802.T	Japan Nikkei 225	2894.5	17.126960040465345	90.42763157894737		-17.092731829573935	2975.55	2006.625	N	Y	상승전환/양호	SUMITOMO ELECTRIC INDUSTRIES	JPX	JPY	Consumer Cyclical	Auto Parts	Auto Parts	Sumitomo Electric Industries, Ltd. manufactures and sells various materials in Japan and internationally. It operates in Environment and Energy, Infocommunications, Automotive, Electronics, and Industrial Materials and Others segments. It offers vanadium redox flow battery, high voltage cable, sEMSA, industrial electric wires and cables, traveling cable, railway and transport machinery products, aluminum materials, heat shrink tubing and heat-resistant tubing/tapes, thermal control devices, and 	9131301797888.0	1.35	118.39	90.6931377760346	48.57956284696314		236982000000.0	301543000000.0	318999000000.0	689186000000.0	2743434000000.0	-20.694754060473198	65.05924727203548	2.247685170911573	24.623657015461383	48.57956284696314	0.5068727582632144	2.0277070467482545	헐값	안심(>=2)	60.0	7103.4	145.41026083952323	양호	충분
5713.T	5713.T	Japan Nikkei 225	7492.0	-19.76009424868802	29.194688739437822		-42.59003831417625	9071.775	7584.5	N	N	중립	SUMITOMO METAL MINING CO	JPX	JPY	Basic Materials	Other Industrial Metals & Mining	Other Industrial Metals & Mining	Sumitomo Metal Mining Co., Ltd., together with its subsidiaries, engages in the resource development, manufacture, and sale of non-ferrous metal products in Japan and internationally. It operates through Mineral Resources, Smelting and Refining, and Material segments. The company is involved in the development and operation of the Hishikari Mine and other mines; smelting and refining business, which provides metal products, such as copper, nickel and cobalt, silver, platinum, rhodium, ruthenium,	2006611787776.0	2.78	649.56	969.266694971796	3.15910539426556		157260000000.0	315197000000.0	348619000000.0	663816000000.0	2074835000000.0	-587.8722947241063	60.37027896015677	0.805796569142509	12.438993002531108	3.15910539426556	3.9375049104441064	0.4774586972640841	매우 불리	불리(<1)	14.81821078853112	9625.316999798273	28.474599570185166	보류	충분
5401.T	5401.T	Japan Nikkei 225	546.0999755859375	-8.372487317795718	-9.345957262018123		-21.762181148146485	554.7199996948242	611.4085003662109	N	N	주의	NIPPON STEEL CORPORATION	JPX	JPY	Basic Materials	Steel	Steel	Nippon Steel Corporation engages in the steelmaking and steel fabrication, engineering and construction, chemicals and materials, and system solutions businesses in Japan, North America, Asia, and internationally. Its Steelmaking and Steel Fabrication segment engages in the manufacture and sale of steel products. The company's Engineering and Construction segment engages in the design, manufacture, sale, construction, and supervision of various plants and facilities, energy pipelines, water faci	2801816043520.0	4.39	3.28	-95.10089170737835	-70.86830684523552		570672000000.0	0.0	506004000000.0	5174253000000.0	5530448000000.0	109.19247964257603	-33.047509451921876	-6.051549336998885	133.20350486078095	-70.86830684523552		-0.49907325572788813	판정불가	불리(<1)	0.0	0.0	-100.0	보류	일부부족
5411.T	5411.T	Japan Nikkei 225	1563.5	-16.9676048858205	-20.493262140859393		-33.72191606612972	1637.3875	1874.285	N	N	주의	JFE HOLDINGS INC	JPX	JPY	Basic Materials	Steel	Steel	JFE Holdings, Inc., through its subsidiaries, engages in steel, engineering, and trading businesses in Japan and internationally. It operates through the Steel, Engineering, and Trading segments. The Steel segment produces and sells various steel products, processed steel products, and raw materials, as well as transportation, facility maintenance, and construction services. Its Engineering segment is involved in engineering activities for steel structures, industrial machines, energy and enviro	992372654080.0	5.12	105.54	-23.62411285757826	-24.436208002992643		213719000000.0	0.0	443307000000.0	1959385000000.0	2619535000000.0	335.96415414848235	156.49318736114043	10.009158129909846	11.631001002951654	-24.436208002992643		-1.660751984983122	판정불가	불리(<1)	0.0	0.0	-100.0	보류	일부부족
4188.T	4188.T	Japan Nikkei 225	1130.0	21.17962466487935	27.32394366197184		-2.6281775096940962	1051.4699996948243	954.0919995117188	Y	Y	상승전환/양호	MITSUBISHI CHEMICAL GROUP CORP	JPX	JPY	Basic Materials	Specialty Chemicals	Specialty Chemicals	Mitsubishi Chemical Group Corporation engages in the manufacture and sale of performance products, industrial materials, and other products. It operates through four segments: Specialty Materials, MMA & Derivatives, Basic Materials & Polymers, and Industrial Gases. The company offers chemical products, such as industrial chemicals, basic petrochemicals, solvents, MMA monomer and derivatives, and acrylonitrile and related products; film and sheet/molding/composite products, including supplemental	1533120741376.0	2.83	-60.46	-73.72501110617503	-50.31803582803372		716112000000.0	1503457000000.0	387064000000.0	1890521000000.0	1761675000000.0	-579.5491426172383	106.10891934900884	9.390169853894587		-50.31803582803372			판정불가	판정불가				판정불가	일부부족
