티커	종목코드	유니버스	현재가	3M수익률(보조,%)	6M수익률(보조,%)	12M수익률(보조,%)	52주고점대비(보조,%)	40일이평(보조)	200일이평(보조)	40일선상회(보조)	200일선상회(보조)	추세판정(보조)	종목명	시장	통화	섹터	산업	업종	사업설명	시가총액	배당수익률(%)	EPS(FY)	EPS Growth 1Y(%)	EPS Growth 3Y CAGR(%)	EPS Growth 5Y CAGR(%)	현금및단기투자	장기부채	단기위험부채	총부채	주주지분	주당순현금(린치식)	주당잉여현금흐름	잉여현금흐름수익률(%)	순현금차감PER(린치식)	사용연성장률(%)	린치PER배수	배당감안점수	린치PER판정	배당감안점수판정	그레이엄적정PER(3년)	그레이엄내재가치(3년)	그레이엄괴리율(3년,%)	종합판정	데이터상태
7203.T	7203.T	Japan Nikkei 225	2954.5	-20.76964333601502	-2.8124999999999956		-25.088742393509122	3202.9	3180.31	N	N	주의	TOYOTA MOTOR CORP	JPX	JPY	Consumer Cyclical	Auto Manufacturers	Auto Manufacturers	Toyota Motor Corporation designs, manufactures, assembles, and sells passenger vehicles, minivans and commercial vehicles, and related parts and accessories in Japan, North America, Europe, Asia, Central and South America, Oceania, Africa, the Middle East, and internationally. It operates through Automotive, Financial Services, and All Other segments. The company offers subcompact and compact cars; mini-vehicles; mid-size, luxury, sports, and specialty cars; recreational and sport-utility vehicl	38539714625536.0	3.38	295.15	-3.636995688313671	18.686969366453667		22853922000000.0	22522159000000.0	15737369000000.0	38792879000000.0	35924826000000.0	25.454863369337687	-119.7688215246804	-4.053776325086492	9.9239205035767	18.686969366453667	0.5310609927681397	2.2236140805945057	헐값	안심(>=2)	45.873938732907334	13539.693017017598	358.2735832464917	보류	충분
6758.T	6758.T	Japan Nikkei 225	3596.0	4.08104196816208	-15.268614514608858		-23.489361702127663	3309.225	3862.2124682617186	Y	N	상승전환/양호	SONY GROUP CORPORATION	JPX	JPY	Technology	Consumer Electronics	Consumer Electronics	Sony Group Corporation designs, develops, produces, and sells electronic equipment, instruments, and devices for the consumer, professional, and industrial markets in Japan, the United States, Europe, China, the Asia-Pacific, and internationally. The company distributes software titles and add-on content through digital networks; network services related to game, video, and music content; hardware and home gaming consoles, packaged and game software, and peripheral devices. It also develops, pro	21977987284992.0	97.0	171.53	17.62124023643765	8.973084964624945		3915606000000.0	2066842000000.0	2131404000000.0	4198246000000.0	8179745000000.0	312.9222859030364	283.36673534317885	7.880053819332003	19.13996218793776	8.973084964624945	2.133041452677002	5.536744739830808	매우 불리	안심(>=2)	26.44616992924989	4536.311527964233	26.14881890890526	보류	충분
9984.T	9984.T	Japan Nikkei 225	5593.0	31.569042578216887	-1.1837455830388643		-18.0962840929892	4611.55	4425.84875	Y	Y	상승전환/양호	SOFTBANK GROUP CORP	JPX	JPY	Communication Services	Telecom Services	Telecom Services	SoftBank Group Corp. provides telecommunication services in Japan and internationally. It operates through Investment Business of Holding Companies, SoftBank Vision Funds, SoftBank, Arm, and Other segments. The company offers mobile communications and solutions to enterprise customers, and broadband services to retail customers; and sells mobile devices and software tools, as well as related services. It also provides online advertising and e-commerce services; payment and financial services; in	30551928995840.0	20.0	872.51	253.79999999999998			6684782000000.0	12376682000000.0	5629648000000.0	18913350000000.0	11561541000000.0	-998.7675390357011	-114.16067912715506	-2.041134974560255	7.554947839034167	253.79999999999998	0.029767327970977808	36.2411502810591	매우 유망	안심(>=2)	8.5	7416.335	32.60030395136779	보류	충분
6861.T	6861.T	Japan Nikkei 225	76830.0	38.882863340563986	36.65955176093916		-8.72044671498159	65308.0	58952.9	Y	Y	상승전환/양호	KEYENCE CORP	JPX	JPY	Technology	Scientific & Technical Instruments	Scientific & Technical Instruments	Keyence Corporation, together with its subsidiaries, manufactures and sells electronic application equipment. It offers photoelectric, fiber optic, laser, positioning, vision, and inductive proximity sensors; network communication units; measurement sensors, such as laser displacement and profiler/3D laser snapshot sensors, optical/laser micrometers, inductive displacement sensors, 3D interference measurement sensors, spectral interference displacement sensors, inductive displacement sensors, an	18189385728000.0	72.0	1836.24	7.849216268714043	9.533423797831464		1859417000000.0	0.0	0.0	0.0	3108552000000.0	7666.904266780825	1629.4393501546165	2.120837368416786	37.665607836241	9.533423797831464	3.950900393708362	2.1646650215314414	매우 불리	안심(>=2)	27.566847595662928	50619.348229060095	-34.115126605414424	보류	충분
8035.T	8035.T	Japan Nikkei 225	49260.0	21.33004926108375	47.61762061732095		-6.081982840800759	43854.75	34360.825	Y	Y	상승전환/양호	TOKYO ELECTRON	JPX	JPY	Technology	Semiconductor Equipment & Materials	Semiconductor Equipment & Materials	Tokyo Electron Limited, together with its subsidiaries, develops, manufactures, and sells semiconductor production equipment in Japan, South Korea, Taiwan, China, North America, Europe, and internationally. The company provides coaters/developers, plasma etch systems, cleaning systems, deposition systems, test systems, 3D integration systems, SiC Epitaxial CVD systems, and gas cluster beam systems, as well as other deposition and lithography and other products. It also offers engineering service	21543499333632.0	1.47	1251.2	49.50228457288242	7.57615934348288		576236000000.0	0.0	0.0	0.0	1855206000000.0	1266.8770981780767	910.4917899158987	1.8483389969872082	38.357674953502176	7.57615934348288	5.062944589001813	0.2358370092673445	매우 불리	불리(<1)	23.65231868696576	29593.78114113156	-39.92330259616005	보류	충분
6954.T	6954.T	Japan Nikkei 225	7966.0	18.400713436385253	59.89562424729024		-3.1842489061740364	6413.675	5513.67	Y	Y	상승전환/양호	FANUC CORPORATION	JPX	JPY	Industrials	Specialty Industrial Machinery	Specialty Industrial Machinery	Fanuc Corporation engages in the development, manufacture, sale, and maintenance services of products used in automated production systems in Japan, the United States, Europe, China, the rest of Asia, and internationally. The company offers CNC series, robots, and robomachine products, such as servo motors, lasers, compact machining centers, electric injection molding machines, wire electrical discharge machines, system basic package, and AI servo monitors. Fanuc Corporation was incorporated in 	7149860683776.0	1.34	178.44	10.812637523562053	-1.6846587496910814		622504000000.0	0.0	0.0	0.0	1724545000000.0	667.0934973130702	229.83018290924966	2.8851391276581677	40.90398174561158	-1.6846587496910814		-0.008426043993334667	판정불가	불리(<1)	5.130682500617837	915.5189854102468	-88.50716814699665	보류	일부부족
6857.T	6857.T	Japan Nikkei 225	26150.0	-4.405044781575585	27.65438125457651		-16.98412698412698	25777.25	20001.225	Y	Y	상승전환/양호	ADVANTEST CORP	JPX	JPY	Technology	Semiconductor Equipment & Materials	Semiconductor Equipment & Materials	Advantest Corporation, together with its subsidiaries, manufactures and sells semiconductors, component test systems, and mechatronics-related products in Japan, rest of Asia, the Americas, and Europe. The company offers automated test equipment, including system on chip, power device, and memory test systems, as well as burn-in and SSD test systems; and metrology and SEM tools. It also provides component test systems, such as die level, SoC, and memory test handlers, as well as change kits, and	18345013280768.0	23.0	512.54	158.75260876545192	22.676473519396858		262544000000.0	3000000.0	74952000000.0	93503000000.0	506539000000.0	361.9327807969493	367.445707122388	1.4051461075425926	50.31425297382263	22.676473519396858	2.2187864850672283	0.9078237441617446	매우 불리	불리(<1)	53.852947038793715	27601.78947526333	5.551776196035685	보류	충분
6594.T	6594.T	Japan Nikkei 225	2527.0	7.076271186440675	23.872549019607845		-22.83969465648855	2318.125	2404.9675	Y	Y	상승전환/양호	NIDEC CORPORATION	JPX	JPY	Industrials	Specialty Industrial Machinery	Specialty Industrial Machinery	Nidec Corporation, together with its subsidiaries, develops, manufactures, and sells motors, electronics and optical components, and other related products in Japan and internationally. The company offers medium- and large-size motors, small-size and precision motors, fans and blowers, motor-related products, units and modules, automotive components, mechanical equipment/machine tools, inspection and measuring equipment, electronic devices, as well as mold, molding, cutting, and machining compon	3066378846208.0	1.92	104.87	32.067815676348886	6.581109751515668		248811000000.0	0.0	257559000000.0	636046000000.0	1719296000000.0	217.05388229526966	118.29175311926029	4.681114092570649	22.026758059547348	6.581109751515668	3.346967136427782	0.3859446645999237	매우 불리	불리(<1)	21.662219503031338	2271.7169592828964	-10.10221767776429	보류	충분
9432.T	9432.T	Japan Nikkei 225	152.39999389648438	-0.06557777279713184	1.4647117130104137		-7.9154115429097445	153.94000053405762	155.54800003051758	N	N	중립	NTT INC	JPX	JPY	Communication Services	Telecom Services	Telecom Services	NTT, Inc. operates as a telecommunications company in Japan and internationally. It operates through Integrated ICT Business, Regional Communications Business, Global Solutions Business, and Others segments. The Integrated ICT Business segment offers mobile phone, domestic inter-prefectural communications, international communications, solutions, and system development and related services. Its Regional Communications Business segment provides intra-prefectural communications and related ancilla	12645088362496.0	3.54	12.6	-21.84450274751255	-5.396142906163259		2947924000000.0	7187500000000.0	2822577000000.0	11171213000000.0	10221587000000.0	-52.06813130800157	2.8460904300772	1.867513480355103	16.22762898448301	-5.396142906163259		-0.11438164552185152	판정불가	불리(<1)	0.0	0.0	-100.0	보류	일부부족
9433.T	9433.T	Japan Nikkei 225	2688.5	5.8048012593467035	9.801919542577098		-3.947838513754909	2638.225	2595.955	Y	Y	상승전환/양호	KDDI CORPORATION	JPX	JPY	Communication Services	Telecom Services	Telecom Services	KDDI Corporation engages in the provision of mobile telecommunications services in Japan and internationally. It operates in two segments, Personal Services and Business Services. The Personal Services segment offers 5G telecommunication services and other services, such as finance, energy, and LX through its multi-brands comprising au, UQ mobile, and povo; and entertainment services, including video and games to individual customers. The Business Services segment provides smartphones and other 	10522764247040.0	3.12	183.62	9.184865088183702	-0.8533760598208318		1807347000000.0	2297564000000.0	1734528000000.0	4437562000000.0	5032495000000.0	-128.76461847547895	148.69959003823178	5.530949973525452	15.342907191348866	-0.8533760598208318		0.1477310598252989	판정불가	불리(<1)	6.7932478803583365	1247.3761757913978	-53.60326666202724	보류	일부부족
9434.T	9434.T	Japan Nikkei 225	225.0	5.485230558296417	4.214917258348194		-8.833064336383334	218.7900005340576	219.86649963378906	Y	Y	상승전환/양호	SOFTBANK CORP.	JPX	JPY	Communication Services	Telecom Services	Telecom Services	SoftBank Corp., together with its subsidiaries, provides mobile communications and fixed-line telecommunications and ISP services in Japan. It operates through Consumer, Enterprise, Distribution, Media & EC, Financial, and others segments. The Consumer segment offers mobile services to individual customers; sells mobile devices; provides internet broadband services; trades in and supplies electric power; and offers electric power trading agency services. The Enterprise segment provides mobile se	10960830988288.0	3.91	11.27	7.577380928039523	0.5805487168454748		1955997000000.0	4315628000000.0	1646524000000.0	5962152000000.0	2743630000000.0	-49.36335901937978	12.995764892843411	5.775895507930405	24.344574890805664	0.5805487168454748	41.93373300881049	0.18445788176574168	매우 불리	불리(<1)	9.66109743369095	108.88056807769699	-51.60863640991244	보류	충분
8306.T	8306.T	Japan Nikkei 225	2995.0	1.2679628064243387	30.55797733217087		-2.917341977309562	2799.925	2532.435	Y	Y	상승전환/양호	MITSUBISHI UFJ FINANCIAL GROUP 	JPX	JPY	Financial Services	Banks - Diversified	Banks - Diversified	Mitsubishi UFJ Financial Group, Inc. operates as a bank holding company that engages in a range of financial businesses in Japan, the United States, Europe, Asia/Oceania, and internationally. It operates through seven segments: Digital Services, Retail & Commercial Banking, Japanese Corporate & Investment Banking, Global Commercial Banking, Asset Management & Investor Services, Global Corporate & Investment Banking, and Global Markets. The company offers commercial banking, trust banking, and se	35081880076288.0	3.21	212.35	30.28982053156668	29.544166267570926		90045500000000.0	26368031000000.0	8729597000000.0	35097628000000.0	22274040000000.0	5641.361808742854	-2102.9751702275253	-70.21619933981721	-12.462264227656483	29.544166267570926	-0.4218181049615759		판정불가	판정불가	60.0	12741.0	325.4090150250417	보류	충분
8316.T	8316.T	Japan Nikkei 225	5732.0	-4.211229946524064	40.800786047654135		-7.607994842037391	5456.725	4811.08	Y	Y	상승전환/양호	SUMITOMO MITSUI FINANCIAL GROUP	JPX	JPY	Financial Services	Banks - Diversified	Banks - Diversified	Sumitomo Mitsui Financial Group, Inc., together with its subsidiaries, provides banking, leasing, securities, consumer finance, and other services in Japan, the Americas, Europe, the Middle East, Asia, and Oceania. It operates through four segments: Wholesale Business Unit, Retail Business Unit, Global Business Unit, and Global Markets Business Unit. The Wholesale Business Unit segment offers bilateral loans, syndicated loans, commitment lines, structured finance, project finance, and nonrecours	22683230142464.0	1.57	412.13	22.332508780346984	18.57242715860201		75590583000000.0	25435801000000.0	7064759000000.0	32500560000000.0	14704201000000.0	13138.32784682315	1173.9539234207039	20.480703479077178	-17.970853485121562	18.57242715860201	-0.9676093130777565		판정불가	판정불가	45.64485431720402	18811.613809749295	228.1858654876011	보류	충분
8411.T	8411.T	Japan Nikkei 225	6525.0	-13.679058076465145	29.92831541218639		-17.058599211897796	6602.675	5738.215	N	Y	상승전환/양호	MIZUHO FINANCIAL GROUP	JPX	JPY	Financial Services	Banks - Regional	Banks - Regional	Mizuho Financial Group, Inc., together with its subsidiaries, engages in banking, trust banking, securities, and other businesses related to financial services in Japan, the Americas, Europe, Asia/Oceania, and internationally. It operates through Retail & Business Banking Company; Corporate & Investment Banking Company; Global Corporate & Investment Banking Company; Global Markets Company; Asset Management Company; and Others segments. The company provides deposit products; syndicated, housing, 	16791671668736.0	2.3	503.08	30.403848051452663	18.621251750172508		72483086000000.0	17610426000000.0	4883298000000.0	22493724000000.0	10442214000000.0	22502.413690289388	-1708.3064192305342	-26.180941290889415	-31.759190765463522	18.621251750172508	-1.7055346864729062		판정불가	판정불가	45.742503500345016	23012.13866095357	252.67645457400104	보류	충분
7267.T	7267.T	Japan Nikkei 225	1342.5	-17.889908256880737	-13.997437540038437		-21.145374449339204	1294.625	1522.0875	Y	N	주의	HONDA MOTOR CO	JPX	JPY	Consumer Cyclical	Auto Manufacturers	Auto Manufacturers	Honda Motor Co., Ltd. develops, manufactures, and distributes motorcycles, automobiles, and power products in Japan, North America, Europe, Asia, and internationally. It operates through four segments: Motorcycle Business, Automobile Business, Financial Services Business, and Power Product and Other Businesses. The Motorcycle Business segment produces motorcycles, including sports, business, and commuter models; and various off-road vehicles, such as all-terrain vehicles and side-by-sides. The A	5225789259776.0	5.21	-106.06	-24.507168701577164	5.73538262937332		4945751000000.0	6057967000000.0	4422236000000.0	4422236000000.0	12326529000000.0	-285.7271716944333	-142.6516441770304	-10.625820795309526		5.73538262937332			판정불가	판정불가				보류	일부부족
6902.T	6902.T	Japan Nikkei 225	1838.5	-13.98830409356725	-12.452380952380949		-20.583153347732186	1915.0	2093.9425	N	N	주의	DENSO CORP	JPX	JPY	Consumer Cyclical	Auto Parts	Auto Parts	DENSO Corporation engages in the manufacture and sale of automotive parts in Japan, Rest of Asia, North America, Europe, and internationally. The company offers air-conditioning systems, including thermal management heat pump system, heat pump air-conditioning systems, personal heating and cooling devices, air quality system, heat exchangers, bus air-conditioning systems, automotive freezers, control system products, pick up systems, and cooling products, as well as heating, ventilation, and air	5005660127232.0	4.03	162.89	33.98115674683735	16.668150145776607		1211959000000.0	447020000000.0	252364000000.0	699384000000.0	4978266000000.0	284.15913995071395	116.39232133346273	6.330830640928078	9.542273068016982	16.668150145776607	0.5724854278706394	2.169100590419173	헐값	안심(>=2)	41.836300291553215	6814.714954491103	270.6671174594018	양호	충분
7974.T	7974.T	Japan Nikkei 225	7182.0	-17.086123297160004	-47.767272727272726		-50.992835209826005	8356.875	11180.98	N	N	주의	NINTENDO CO LTD	JPX	JPY	Communication Services	Electronic Gaming & Multimedia	Electronic Gaming & Multimedia	Nintendo Co., Ltd., together with its subsidiaries, develops, manufactures, and sells home entertainment products in Japan, the Americas, Europe, and internationally. It offers home console gaming hardware, software, accessories, and other products. The company also provides various services, such as Nintendo Switch Online; and services and content. In addition, it offers develop IP, including video content and mobile apps. The company was formerly known as Nintendo Playing Card Co., Ltd. and ch	8668120612864.0	3.05	364.85	-43.170635260353606	-16.429753038017836		2530105000000.0	0.0	0.0	0.0	2724326000000.0	2194.692526765244	-6.019106496854491	-0.08380822189995114	13.669473682978637	-16.429753038017836		-0.9788052816311746	판정불가	불리(<1)	0.0	0.0	-100.0	보류	일부부족
6098.T	6098.T	Japan Nikkei 225	9122.0	27.526911785264918	26.32599362969117		-2.5739613371782544	7196.175	7913.095	Y	Y	상승전환/양호	RECRUIT HOLDINGS CO LTD	JPX	JPY	Communication Services	Internet Content & Information	Internet Content & Information	Recruit Holdings Co., Ltd. provides HR technology and business solutions that transforms the world of work. It operates through three segments: HR Technology, Matching & Solutions, and Staffing. The HR Technology segment provides online matching and hiring platforms where people can find jobs and learn about companies. The Matching & Solutions segment offers HR solutions that support business clients' recruiting and hiring activities and individual users' job search activities through its job ad	13702735593472.0	28.999999999999996	347.55	15.509509294395096	11.231564061626752		846019000000.0	1011000000.0	0.0	208940000000.0	1617582000000.0	607.1742748550001	391.681901554908	4.293816066157728	24.499570493871385	11.231564061626752	2.1813142283162055	1.6421334435920316	매우 불리	양호(>=1.5)	30.963128123253504	10761.235179236755	17.970129129979775	보류	충분
4519.T	4519.T	Japan Nikkei 225	7885.0	-13.598509752355902	12.562455389007843		-24.581539933046393	8468.65	7945.76	N	N	중립	CHUGAI PHARMACEUTICAL CO	JPX	JPY	Healthcare	Drug Manufacturers - General	Drug Manufacturers - General	Chugai Pharmaceutical Co., Ltd., together with its subsidiaries, engages in the research, development, manufacture, sale, importation, and exportation of pharmaceuticals in Japan and internationally. It offers oncology products, such as Alecensa, Avastin, FoundationOne, Herceptin, Kadcyla, Lunsumio, Perjeta, Phesgo, Polivy, and Tecentriq; Actemra for humanized anti-human IL-6 receptor monoclonal antibody; CellCept, an immunosuppressant; Enspryng, a pH-dependent binding humanized anti-IL-6 recept	13060775346176.0	1.67	263.36	12.056016131489189	5.045492075929214		1532790000000.0	0.0	0.0	0.0	2025732000000.0	931.3552120470008	166.89705058004412	2.116639829803984	26.403572250732832	5.045492075929214	5.233101519809673	0.25434028441900797	매우 불리	불리(<1)	18.59098415185843	4896.121586233436	-37.905877156202465	보류	충분
4568.T	4568.T	Japan Nikkei 225	2620.5	-11.229674796747968	-22.217275155832596		-37.2184954480115	2791.1875	3320.6275	N	N	주의	DAIICHI SANKYO COMPANY LIMITED	JPX	JPY	Healthcare	Drug Manufacturers - General	Drug Manufacturers - General	Daiichi Sankyo Company, Limited manufactures and sells pharmaceutical products in Japan, the United States, Europe, and internationally. The company offers Enhertu to treat patients with HER2 positive and low breast cancer, HER2 positive gastric or gastroesophageal junction adenocarcinoma, and HER2 positive solid tumors; Turalio, an oral small molecule that targets colony stimulating factor 1 receptor, KIT proto-oncogene receptor tyrosine kinase, and FMS-like tyrosine kinase 3 harboring an inter	4796606054400.0	3.82	140.46	47.33947422171963	64.06405138615001		801618000000.0	100933000000.0	399000000.0	101332000000.0	1623416000000.0	385.065125842686	-73.65689120888159	-2.810795314210326	15.915099488518537	64.06405138615001	0.24842480524045063	4.265386555398091	매우 유망	안심(>=2)	60.0	8427.6	221.60274756725818	보류	충분
4502.T	4502.T	Japan Nikkei 225	5249.0	-4.632994186046513	26.11725132148006		-10.882852292020374	5550.35	4879.87	N	Y	상승전환/양호	TAKEDA PHARMACEUTICAL CO LTD	JPX	JPY	Healthcare	Drug Manufacturers - Specialty & Generic	Drug Manufacturers - Specialty & Generic	Takeda Pharmaceutical Company Limited engages in the research, development, manufacture, marketing, and out-licensing of pharmaceutical products in Japan and internationally. It offers pharmaceutical products in the areas of gastroenterology, rare diseases, plasma-derived therapies, immunology, oncology, and neuroscience. The company provides its products under the Entyvio, Gattex/Revestive, Takecab/Vocinti, EOHILIA, Alofisel, Dexilant, Pantoloc/Controloc, Adynovate/Adynovi, Feiba Fiber, Recombi	8302042284032.0	3.89	119.68	-25.08485635155865	-22.298100827854515		426065000000.0	3966326000000.0	548939000000.0	4515265000000.0	6935084000000.0	-2240.9029418563437	428.8778354407651	8.170657943241858	62.58274516925421	-22.298100827854515		-0.2941401943629997	판정불가	불리(<1)	0.0	0.0	-100.0	보류	일부부족
4503.T	4503.T	Japan Nikkei 225	2300.0	-8.146964856230031	35.49337260677468		-13.452492944496708	2471.1375	2034.3425	N	Y	상승전환/양호	ASTELLAS PHARMA	JPX	JPY	Healthcare	Drug Manufacturers - General	Drug Manufacturers - General	Astellas Pharma Inc. manufactures, markets, imports, and exports pharmaceuticals in Japan and internationally. The company offers XTANDI, a treatment for prostate cancer; XOSPATA, a treatment for acute myeloid leukemia; VYLOY, a treatment for gastric cancer; and PADCEV, a treatment for patients with metastatic urothelial cancer. It also provides VEOZAH, a treatment for vasomotor symptoms due to menopause; IZERVAY, a treatment for geographic atrophy secondary to age-related macular degeneration; 	4150887448576.0	3.48	162.15	197.72367263127015	-25.772893828559905		248254000000.0	564893000000.0	266533000000.0	831426000000.0	1513255000000.0	-176.74594940951175	76.57415173713801	3.329310945092957	15.274412268945493	-25.772893828559905		-1.4594927409340477	판정불가	불리(<1)	0.0	0.0	-100.0	보류	일부부족
9983.T	9983.T	Japan Nikkei 225	70190.0	3.4487840825349947	25.048993408159625		-7.352164730728616	69171.25	57845.15	Y	Y	상승전환/양호	FAST RETAILING CO LTD	JPX	JPY	Consumer Cyclical	Apparel Retail	Apparel Retail	Fast Retailing Co., Ltd. operates as an apparel designer and retailer in Japan and internationally. The company operates through UNIQLO Japan, UNIQLO International, GU, and Global Brands segments. It manufactures and retails clothing for men, women, children, and babies. The company operates stores and franchises under the UNIQLO, GU, PLST, Theory, COMPTOIR DES COTONNIERS, J Brand, and PRINCESSE TAM.TAM brand names. It sells its products through online; and provides real estate leasing services.	22598746374144.0	91.0	1558.22	16.400537634408607	16.57378386379136		2692641000000.0	240000000000.0	130000000000.0	513500000000.0	2273115000000.0	7993.23122880618	1309.57612821085	1.8657588377416299	39.915267915438015	16.57378386379136	2.408337664076859	2.6950535341937436	매우 불리	안심(>=2)	41.64756772758272	64896.07298447395	-7.542280973822557	보류	충분
