티커	종목코드	유니버스	현재가	3M수익률(보조,%)	6M수익률(보조,%)	12M수익률(보조,%)	52주고점대비(보조,%)	40일이평(보조)	200일이평(보조)	40일선상회(보조)	200일선상회(보조)	추세판정(보조)	종목명	시장	통화	섹터	산업	업종	사업설명	시가총액	배당수익률(%)	EPS(FY)	EPS Growth 1Y(%)	EPS Growth 3Y CAGR(%)	EPS Growth 5Y CAGR(%)	현금및단기투자	장기부채	단기위험부채	총부채	주주지분	주당순현금(린치식)	주당잉여현금흐름	잉여현금흐름수익률(%)	순현금차감PER(린치식)	사용연성장률(%)	린치PER배수	배당감안점수	린치PER판정	배당감안점수판정	그레이엄적정PER(3년)	그레이엄내재가치(3년)	그레이엄괴리율(3년,%)	종합판정	데이터상태
7201.T	7201.T	Japan Nikkei 225	357.5	-17.474609897022198	-1.6506189821182904		-22.919359765144918	362.7249984741211	372.22149978637697	N	N	주의	NISSAN MOTOR CO	JPX	JPY	Consumer Cyclical	Auto Manufacturers	Auto Manufacturers	Nissan Motor Co., Ltd., together with its subsidiaries, manufactures and sells vehicles and automotive parts in Japan, the United States, rest of North America, Europe, rest of Asia, and internationally. It operates through Automobile and Sales Financing segments. The company offers vehicle and vehicle parts; drivetrains; electrified power trains and automobile transmissions; engines, axles, and engine parts for automobiles and forklifts; automotive lithium-ion batteries; and motorsports. It als	1235971211264.0	9.79020979020979	-152.58				2433513000000.0	4369888000000.0	3615743000000.0	8099861000000.0	4958543000000.0	-553.8224118566981	-178.56799032389625	-49.94908820248846					판정불가	판정불가				보류	일부부족
7269.T	7269.T	Japan Nikkei 225	1890.5	-20.248892638683824	-19.826123833757425		-22.883948602896186	1838.1375	2107.8425	Y	N	주의	SUZUKI MOTOR CORP	JPX	JPY	Consumer Cyclical	Auto Manufacturers	Auto Manufacturers	Suzuki Motor Corporation engages in the manufacture and sale of automobiles, motorcycles, outboard motors, electric wheelchairs, and other products in Japan and internationally. It offers mini passenger cars and commercial vehicles, compact passenger cars and automobile engines, foundry and machining of engine components, motorcycles and motorcycle engines, outboard motors, motorized wheelchairs, and electro senior vehicles. The company is also involved in the development and testing of motorcyc	3580732375040.0	2.75	227.62	31.239018727702295	37.41370038279079		1505214000000.0	427465000000.0	297834000000.0	725299000000.0	2970660000000.0	558.6293380509051	138.51895286385042	7.327106737045777	5.851290141240202	37.41370038279079	0.15639431762626785	6.864076026535568	매우 유망	안심(>=2)	60.0	13657.2	622.4120603015076	매우 유망	충분
7270.T	7270.T	Japan Nikkei 225	2471.0	-16.703185572223155	-27.66393442622951		-31.32295719844358	2463.0125	3004.8625	Y	N	주의	SUBARU CORPORATION	JPX	JPY	Consumer Cyclical	Auto Manufacturers	Auto Manufacturers	Subaru Corporation manufactures and sells automobiles and aerospace products in Japan, Rest of Asia, North America, Europe, and Internationally. It operates through three segments: Automotive, Aerospace, and Others. The company manufactures, sells, and repairs automobiles and related components, aircraft, space-related devices, and the parts; and rents and manages real estate properties. It also involved in the shipping, land freight, and warehousing of vehicles; leasing and rental of vehicles; 	1770327506944.0	4.69	125.53	-12.21084230972983	69.02526664269493		2980398000000.0	352500000000.0	47000000000.0	399500000000.0	2714517000000.0	3673.1811254665167	317.0799597053723	12.832050170189085	-9.576843188612417	69.02526664269493	-0.1387440230863049		판정불가	판정불가	60.0	7531.8	204.80777013354916	보류	충분
4901.T	4901.T	Japan Nikkei 225	3479.0	7.2441430332922385	5.232909860859047		-7.718832891246685	3138.775	3306.615	Y	Y	상승전환/양호	FUJIFILM HOLDINGS CORPORATION	JPX	JPY	Industrials	Conglomerates	Conglomerates	FUJIFILM Holdings Corporation provides products and services in the fields of healthcare, electronics, business innovation, and imaging in Japan, the Americas, Europe, Asia, and internationally. The Healthcare segment offers products and services, such as medical devices, biomedical contract development and manufacturing organization, pharmaceutical, regenerative medicine, and cosmetics and supplements in the areas of prevention, diagnosis, and treatment; equipment and materials for medical syst	4246603300864.0	2.16	224.74	7.162774271176842	7.308813587292584		172111000000.0	470805000000.0	215103000000.0	802285000000.0	3348480000000.0	-249.55623923808875	-108.48269724665094	-3.118214925169616	16.5905323451014	7.308813587292584	2.2699350786489356	0.5707359709942273	매우 불리	불리(<1)	23.117627174585166	5195.45553121627	49.33761227985829	보류	충분
5108.T	5108.T	Japan Nikkei 225	3457.0	-8.930453108535296	-4.264746607587922		-9.431490699502232	3359.775	3456.045	Y	Y	상승전환/양호	BRIDGESTONE CORP	JPX	JPY	Consumer Cyclical	Auto Parts	Auto Parts	Bridgestone Corporation, together with its subsidiaries, manufactures and sells tires and rubber products in Japan, China, India, the Asia Pacific, the United States, the Americas, Europe, the Middle East, and Africa. The company offers passenger car, motorcycle, trucks, buses, construction and mining vehicles, agricultural machinery, and aircraft tires; automotive components; automotive maintenance and repair services; synthetic rubber; retreading materials; and raw materials for tires. It also	4281747898368.0	3.76	118.92	14.833905870051133	2.907072532622368		740830000000.0	392312000000.0	94958000000.0	827015000000.0	3661793000000.0	277.6424386158517	297.37434790626435	8.602092794511552	26.7352637183329	2.907072532622368	9.196627678985346	0.24937373361500167	매우 불리	불리(<1)	14.314145065244736	1702.238131158904	-50.759672225660864	보류	충분
6301.T	6301.T	Japan Nikkei 225	7112.0	-5.588742864728524	40.58114251828424		-8.80882164380049	6648.6	5863.335	Y	Y	상승전환/양호	KOMATSU	JPX	JPY	Industrials	Farm & Heavy Construction Machinery	Farm & Heavy Construction Machinery	Komatsu Ltd. manufactures and sells construction, mining, and utility equipment in Japan, the Americas, Europe, China, rest of Asia, Oceania, the Middle East, Africa, and CIS countries. It operates in three segments: Construction, Mining and Utility Equipment; Retail Finance; and Industrial Machinery and Others. The company offers construction and mining equipment, including excavators, hydraulic and mini excavators, wheel loaders, bulldozers, motor graders, dump trucks, backhoe loaders, rope an	6270092312576.0	2.67	413.92	11.739946012719038	25.028774565435775		386879000000.0	496189000000.0	654408000000.0	1220702000000.0	3173399000000.0	-121.25037432489658	345.31787148323303	4.855425639528024	17.474996072489603	25.028774565435775	0.698196231173947	1.5850518335189319	헐값	양호(>=1.5)	58.55754913087155	24238.140736250352	240.80625332185534	양호	충분
6326.T	6326.T	Japan Nikkei 225	2965.0	-6.643576826196473	39.299976509278835		-8.544108574953736	2705.55	2332.805	Y	Y	상승전환/양호	KUBOTA CORP	JPX	JPY	Industrials	Farm & Heavy Construction Machinery	Farm & Heavy Construction Machinery	Kubota Corporation engages in the manufacture and sale of agricultural and construction machinery in Japan, North America, Europe, Asia, and internationally. The company offers tractors, power tillers, combine harvesters, rice transplanters, turf equipment, utility vehicles, other agricultural machineries, implements, attachments, post-harvest machineries, vegetable production equipment, intermediate management machines, and other equipment for agricultural use, weighing and measuring control sy	3309671809024.0	1.75	163.37	-18.985666364342535	6.06183769287576		596155000000.0	1381640000000.0	860439000000.0	2242079000000.0	2622985000000.0	-690.6308227835013	124.85489694612315	4.210957738486447	22.37638992950665	6.06183769287576	3.6913541838648607	0.34911072418230754	매우 불리	불리(<1)	20.62367538575152	3369.2898477702256	13.635408019231887	보류	충분
6367.T	6367.T	Japan Nikkei 225	23795.0	19.482801908109472	21.65132924335378		-7.699767261442981	22535.625	19799.375	Y	Y	상승전환/양호	DAIKIN INDUSTRIES	JPX	JPY	Industrials	Building Products & Equipment	Building Products & Equipment	Daikin Industries,Ltd. manufactures, distributes, and sells air-conditioning and refrigeration equipment, and chemical products in Japan, the Americas, China, Asia, Europe, Europe, and internationally. It offers air-conditioning and refrigeration equipment products, such as split/multi-split typeair conditioners, unitary, air to water heat pump systems, heating systems, air purifiers, skyair, multi-split type air conditioners, ventilations, control systems, packaged air-conditioning systems, air	6953523740672.0	1.51	939.9	1.7079570206407046	6.739137570446063		802663000000.0	414920000000.0	397373000000.0	986849000000.0	2805493000000.0	1324.0707061809235	916.7583738065204	3.8527353385438974	23.90778731122362	6.739137570446063	3.547603393061638	0.3450397756622784	매우 불리	불리(<1)	21.978275140892126	20657.38080492451	-13.18604410622186	보류	충분
6273.T	6273.T	Japan Nikkei 225	64000.0	-15.14187218244497	22.746451860375917		-24.31409649952696	70702.75	59154.15	N	Y	상승전환/양호	SMC CORP	JPX	JPY	Industrials	Specialty Industrial Machinery	Specialty Industrial Machinery	SMC Corporation manufactures, processes, and sells automatic control equipment worldwide. The company offers air management system, directional control valves, air cylinders, rotary actuators, air grippers, magnet grippers, electric actuators/cylinders, vacuum equipment, air grippers for collaborative robots, compact compressor, air preparation equipment, modular F.R.L., pressure control equipment, booster regulators, lubrication equipment, gas generator, fittings and tubing, flow control equipm	4108458655744.0	1.56	2643.2	-12.324403743810318	-6.779115212428066		715319000000.0	0.0	5041000000.0	5041000000.0	1928280000000.0	11329.262921070775	1407.2746950504916	2.198866711016393	19.926882974776493	-6.779115212428066		-0.2619132766039946	판정불가	불리(<1)	0.0	0.0	-100.0	보류	일부부족
6146.T	6146.T	Japan Nikkei 225	68710.0	-8.993377483443709	56.40792169360347		-14.112499999999994	69257.0	57135.1	N	Y	상승전환/양호	DISCO CORPORATION	JPX	JPY	Technology	Semiconductor Equipment & Materials	Semiconductor Equipment & Materials	Disco Corporation manufactures and sells precision cutting, grinding, and polishing machines in Japan and internationally. Its precision machines include dicing saws, laser saws, grinders, polishers, wafer mounters, die separators, surface planers, and waterjet saws. The company also offers precision processing tools, such as dicing blades, grinding wheels, and dry polishing wheels; and other products, such as accessory equipment, cut-off wheels, and related products. In addition, it is involved	7832042733568.0	73.0	1250.52	47.13021792055103	23.22934390915492		229167000000.0	0.0	0.0	0.0	492352000000.0	2112.877756062548	492.6516907645787	0.7170014419510677	53.25554348905852	23.22934390915492	2.2925978321785476	1.8069357217042668	매우 불리	양호(>=1.5)	54.95868781830984	68726.93829055282	0.02465185642965828	보류	충분
7735.T	7735.T	Japan Nikkei 225	13345.0	16.42311886586696	115.15517936316		0.0	10797.525	8318.9475	Y	Y	상승전환/양호	SCREEN HOLDINGS CO LTD	JPX	JPY	Technology	Semiconductor Equipment & Materials	Semiconductor Equipment & Materials	SCREEN Holdings Co., Ltd. develops, manufactures, and markets semiconductor production equipment in Japan, Taiwan, South Korea, China, the United States, Europe, and internationally. It operates through Semiconductor Production Equipment, Graphic Arts Equipment, Display Production Equipment and Coater, and Printed Circuit Board (PCB)-Related Equipment segments. The company offers wafer cleaning systems, such as wet stations, spin processors, and spin scrubbers; coat/develop trackers, and spray c	2541340327936.0	1.72	487.09	40.930021677836194	29.8024843823244		260397000000.0	757000000.0	1013000000.0	4562000000.0	420639000000.0	1373.118513232713	241.51210577645318	1.8097572557246397	24.578376658866507	29.8024843823244	0.824708985451016	1.2825291442082627	헐값	보통(1~1.5)	60.0	29225.399999999998	118.99887598351442	보류	충분
7741.T	7741.T	Japan Nikkei 225	27495.0	-2.724217229789494	18.974469926438765		-8.441558441558438	27961.25	24709.6	N	Y	상승전환/양호	HOYA CORP	JPX	JPY	Healthcare	Medical Instruments & Supplies	Medical Instruments & Supplies	HOYA Corporation, a med-tech company, provides high-tech and medical products internationally. It operates through two segments: Life Care, and Information and Communications. It offers life care products, including eyeglasses and contact lenses; medical endoscopes; intraocular lenses; laparoscopic surgical instruments; automatic endoscope cleaning devices; and other medical related products, such as prosthetic ceramic fillers and metallic implants for orthopedics. The company also operates Eyec	8841218490368.0	1.07	745.11	11.427090684544815	7.101464551222003		543101000000.0	28007000000.0	9276000000.0	37283000000.0	974023000000.0	1539.8256463002429	559.590099198571	2.0352431322006583	34.834016928641084	7.101464551222003	4.905187750693894	0.23458289544848027	매우 불리	불리(<1)	22.702929102444006	16916.179503522053	-38.47543370241115	보류	충분
7733.T	7733.T	Japan Nikkei 225	1852.0	21.204188481675402	-10.596186338402125		-12.476370510396972	1666.2625	1791.2925	Y	Y	상승전환/양호	OLYMPUS CORPORATION	JPX	JPY	Healthcare	Medical Devices	Medical Devices	Olympus Corporation, together with its subsidiaries, engages in the manufacture and sale of medical equipment in Japan, America, the Middle East, Asia, and Oceania. It operates through two segments, Gastrointestinal Solutions and Surgical & Interventional Solutions. The company offers gastrointestinal Solutions products offer gastrointestinal endoscopes, gastroenterology devices, and medical services. The Surgical & Interventional Solutions provides urology, respiratory, surgical endoscopes, en	2072274796544.0	1.62	61.12	-51.41322361748968	0.6048713093102842		257134000000.0	134117000000.0	94985000000.0	229102000000.0	751733000000.0	111.72165916656574	113.75325928326187	6.142184626526019	28.473140393217182	0.6048713093102842	47.0730549704601	0.0781393017624529	매우 불리	불리(<1)	9.709742618620568	593.4594688500891	-67.95575222191744	보류	충분
6971.T	6971.T	Japan Nikkei 225	3813.0	37.97720282250769	83.40548340548341		0.0	2864.25	2343.075	Y	Y	상승전환/양호	KYOCERA CORP	JPX	JPY	Industrials	Conglomerates	Conglomerates	Kyocera Corporation develops and sells products based on fine ceramic technologies in Japan, China, rest of Asia, Europe, the United States, and internationally. It operates through Core Components Business, Electronic Components Business, and Solutions Business segments. The Core Components Business segment offers components, such as fine ceramic components for semiconductor processing equipment, automotive camera modules, and ceramic packages, as well as organic packages and boards to protect 	5155009331200.0	1.47	102.57	-76.15905178384155	-45.44565207097372		502030000000.0	202577000000.0	44386000000.0	342382000000.0	3217788000000.0	227.3050373255043	53.19089535101464	1.39498807634447	34.95851577141948	-45.44565207097372		-1.2579381904687799	판정불가	불리(<1)	0.0	0.0	-100.0	보류	일부부족
6963.T	6963.T	Japan Nikkei 225	5616.0	95.27121001390822	174.35271128480701		0.0	4098.725	2752.5175	Y	Y	상승전환/양호	ROHM CO LTD	JPX	JPY	Technology	Semiconductors	Semiconductors	ROHM Co., Ltd. manufactures and sells electronic components worldwide. The company operates through: LSI, semiconductor element, Module, and others segments. The company provides ICs comprising memory, amplifiers and linear, power management, motor/actuator drivers, resistors, clocks and timers, switches and multiplexers, logic, data converters, sensors and MEMS, display drivers, interfaces, wireless LSIs, audio and video products, speech synthesis LSI, and microcontrollers. It also offers discr	2122034839552.0	89.0	-410.53				300602000000.0	300000000000.0	100000000000.0	400000000000.0	889031000000.0	1.5594438131215482	-134.27795597503086	-2.3909892445696377					판정불가	판정불가				보류	일부부족
6723.T	6723.T	Japan Nikkei 225	4824.0	62.47894914112495	168.29810901001113		0.0	3403.75	2389.92	Y	Y	상승전환/양호	RENESAS ELECTRONICS CORP	JPX	JPY	Technology	Semiconductors	Semiconductors	Renesas Electronics Corporation engages in the design, research, development, manufacturing, sale, and service of semiconductors in Japan, China, rest of Asia, Europe, North America, and internationally. The company operates through Automotive Business and Industrial/Infrastructure/IoT Business segments. It offers microcontrollers and microprocessors; amplifiers, audio and video, data converters, power line communication, and switches and multiplexer products; custom ASICS and processor IP solut	8777558392832.0	57.99999999999999	-28.46	162.1			373099000000.0	964089000000.0	242478000000.0	1206567000000.0	2443034000000.0	-325.7409006245188	175.87385024717142	3.6458094993194736		162.1			판정불가	판정불가				판정불가	일부부족
6702.T	6702.T	Japan Nikkei 225	3576.0	-0.33444816053511683	-13.393073383385811		-22.864538395168243	3454.725	3770.32	Y	N	주의	FUJITSU	JPX	JPY	Technology	Information Technology Services	Information Technology Services	Fujitsu Limited provides digital services in Japan, Europe, the Americas, the Asia Pacific, East Asia, and internationally. The company operates through three segments: Service Solutions, Hardware Solutions, and Ubiquitous Solutions. The company offers consulting services; data driven management; network and communication services; enterprise cyber security; multi cloud and hybrid IT services. It also provides assessment and consultative; SAP landscape, integrated systems; storage solutions; ser	6045702291456.0	1.54	172.72	-13.624360455520712	6.359133040098119		236079000000.0	0.0	146992000000.0	247092000000.0	1740965000000.0	136.08598454809385	82.42206386262502	2.3048675576796707	19.916130242310714	6.359133040098119	3.131893941631297	0.3966198726355409	매우 불리	불리(<1)	21.218266080196237	3664.818917371494	2.483750485780045	보류	충분
6701.T	6701.T	Japan Nikkei 225	4273.0	-1.4074757729580112	-29.650971353309185		-29.650971353309185	4189.25	4793.97	Y	N	주의	NEC CORP	JPX	JPY	Technology	Information Technology Services	Information Technology Services	NEC Corporation provides information technology services and social infrastructure in Japan and internationally. The company offers systems integration services, including system construction and consulting, maintenance support, and outsourcing, as well as cloud, system equipment, software services. It also provides core network equipment, mobile phone base stations, optical transmission systems, and marine systems, as well as software and services for telecommunications carriers. In addition, t	5611576623104.0	94.0	202.97	17.1628065622889	7.4336089765803415		604275000000.0	255842000000.0	233886000000.0	666359000000.0	1952018000000.0	262.2758212711268	145.8661937112236	3.413671746108673	19.760182188150335	7.4336089765803415	2.6582219014216357	5.1332324778567795	매우 불리	안심(>=2)	23.367217953160683	4742.844227953024	10.995652421086444	보류	충분
5802.T	5802.T	Japan Nikkei 225	13965.0	34.60240963855421	145.08599508599508		0.0	10955.675	7294.6	Y	Y	상승전환/양호	SUMITOMO ELECTRIC INDUSTRIES	JPX	JPY	Consumer Cyclical	Auto Parts	Auto Parts	Sumitomo Electric Industries, Ltd. manufactures and sells various materials in Japan and internationally. The company operates in Environment and Energy, Infocommunications, Automotive, Electronics, and Industrial Materials segments. It offers vanadium redox flow battery, high voltage cable, sEMSA, industrial electric wires and cables, traveling cable, railway and transport machinery products, aluminum materials, heat shrink tubing and heat-resistant tubing/tapes, thermal control devices, and wa	10501620760576.0	28.000000000000004	473.41	29.41966164183192	26.2443096533858		295903000000.0	341281000000.0	346710000000.0	756562000000.0	2290394000000.0	-58.182899878016315	259.5510211866315	1.8585823214223522	29.621644874164076	26.2443096533858	1.1286882857801734	1.8312389431384193	보통	양호(>=1.5)	60.0	28404.600000000002	103.39849624060152	보류	충분
5713.T	5713.T	Japan Nikkei 225	9099.0	-27.928712871287132	92.7345901292099		-30.27586206896552	9817.525	7172.725	N	Y	상승전환/양호	SUMITOMO METAL MINING CO	JPX	JPY	Basic Materials	Other Industrial Metals & Mining	Other Industrial Metals & Mining	Sumitomo Metal Mining Co., Ltd., together with its subsidiaries, engages in the resource development, manufacture, and sale of non-ferrous metal products in Japan and internationally. It operates through Resource, Smelting, and Material segments. The company is involved in the development and operation of the Hishikari Mine and other mines; smelting and refining business, which provides metal products, such as copper, nickel and cobalt, silver, platinum, rhodium, ruthenium, palladium, slag sand,	2341337300992.0	2.29	649.67	-71.86566782136823	-61.14388471214129		168322000000.0	367258000000.0	193045000000.0	560303000000.0	1845737000000.0	-735.3028879167291	101.6005438083356	1.1166121970363292	15.137381882981712	-61.14388471214129		-3.88798308499491	판정불가	불리(<1)	0.0	0.0	-100.0	보류	일부부족
5401.T	5401.T	Japan Nikkei 225	546.7000122070312	-14.04087858380012	-12.24718905184089		-21.676216016184636	572.4175003051757	616.3175009155274	N	N	주의	NIPPON STEEL CORPORATION	JPX	JPY	Basic Materials	Steel	Steel	Nippon Steel Corporation engages in the steelmaking and steel fabrication, engineering, chemicals and materials, and system solutions businesses in Japan and internationally. The company's Steelmaking and Steel Fabrication segment engages in the manufacture and sale of steel products. Its Engineering and Construction segment engages in the design, manufacture, sale, construction, and supervision of various plants and facilities, energy pipelines, water facilities, industrial machinery and equipm	2824811839488.0	4.39	3.28	-36.249572238847264	-18.091218544964416		755376000000.0	0.0	473466000000.0	2507492000000.0	5383311000000.0	144.5337750975876	68.95880728457811	12.61364656023895	122.61165765531818	-18.091218544964416		-0.11174482758793479	판정불가	불리(<1)	0.0	0.0	-100.0	보류	일부부족
5411.T	5411.T	Japan Nikkei 225	1594.5	-27.539195637355153	-12.868852459016388		-32.40779991521832	1725.625	1892.485	N	N	주의	JFE HOLDINGS INC	JPX	JPY	Basic Materials	Steel	Steel	JFE Holdings, Inc., through its subsidiaries, engages in steel, engineering, and trading businesses in Japan and internationally. It operates through the Steel, Engineering, and Trading segments. The Steel segment produces and sells various steel products, processed steel products, and raw materials, as well as transportation, facility maintenance, and construction services. Its Engineering segment is involved in engineering activities for steel structures, industrial machines, energy and enviro	1018454278144.0	5.02	105.4	-53.465943339361054	-31.677942320653262		217073000000.0	0.0	395415000000.0	1766450000000.0	2529578000000.0	341.2366089747449	156.49318736114043	9.81456176614239	11.890544506880977	-31.677942320653262		-2.241944622908269	판정불가	불리(<1)	0.0	0.0	-100.0	보류	일부부족
4188.T	4188.T	Japan Nikkei 225	1099.0	-5.299439896596292	29.844041623321658		-5.299439896596292	992.9149993896484	929.0099996948243	Y	Y	상승전환/양호	MITSUBISHI CHEMICAL GROUP CORP	JPX	JPY	Basic Materials	Specialty Chemicals	Specialty Chemicals	Mitsubishi Chemical Group Corporation engages in the manufacture and sale of performance products, industrial materials, and other products. It operates through four segments: Specialty Materials, MMA & Derivatives, Basic Materials & Polymers, and Industrial Gases. The company offers chemical products, such as industrial chemicals, basic petrochemicals, solvents, MMA monomer and derivatives, and acrylonitrile and related products; film and sheet/molding/composite products, including supplemental	1487609528320.0	2.91	-60.45	-62.35660055520251	-36.65996406741831		458350000000.0	1612920000000.0	428067000000.0	2040987000000.0	1740570000000.0	-849.8562302314549	140.351374834919	12.77082573566142		-36.65996406741831			판정불가	판정불가				판정불가	일부부족
4005.T	4005.T	Japan Nikkei 225	586.7999877929688	3.0015754290914964	22.89004979957461		-5.901217003479086	549.7375022888184	488.62099960327146	Y	Y	상승전환/양호	SUMITOMO CHEMICAL COMPANY	JPX	JPY	Basic Materials	Chemicals	Chemicals	Sumitomo Chemical Company, Limited engages in Agro & Life Solutions, ICT & Mobility Solutions, Advanced Medical Solutions, Essential & Green Materials, and Sumitomo Pharma. The Agro & Life Solutions segment offers crop protection chemicals, fertilizers, agricultural materials, household insecticides, products for control of infectious diseases, and feed additives, etc. The ICT & Mobility Solutions segment provides optical products, semiconductor processing materials, compound semiconductor mater	981930409984.0	2.73	37.14		-38.026282243258926		299868000000.0	1033236000000.0	252892000000.0	1286128000000.0	900790000000.0	-444.0850257438706	-123.64559321737644	-21.07116492664283	27.756731651503483	-38.026282243258926		-1.2716296243526588	판정불가	불리(<1)	0.0	0.0	-100.0	보류	일부부족
