티커	종목코드	유니버스	현재가	3M수익률(보조,%)	6M수익률(보조,%)	12M수익률(보조,%)	52주고점대비(보조,%)	40일이평(보조)	200일이평(보조)	40일선상회(보조)	200일선상회(보조)	추세판정(보조)	종목명	시장	통화	섹터	산업	업종	사업설명	시가총액	배당수익률(%)	EPS(FY)	EPS Growth 1Y(%)	EPS Growth 3Y CAGR(%)	EPS Growth 5Y CAGR(%)	현금및단기투자	장기부채	단기위험부채	총부채	주주지분	주당순현금(린치식)	주당잉여현금흐름	잉여현금흐름수익률(%)	순현금차감PER(린치식)	사용연성장률(%)	린치PER배수	배당감안점수	린치PER판정	배당감안점수판정	그레이엄적정PER(3년)	그레이엄내재가치(3년)	그레이엄괴리율(3년,%)	종합판정	데이터상태
7201.T	7201.T	Japan Nikkei 225	355.70001220703125	-11.75886707486482	3.823702822573072		-23.307455461639904	354.58249816894534	369.11799987792966	Y	N	중립	NISSAN MOTOR CO	JPX	JPY	Consumer Cyclical	Auto Manufacturers	Auto Manufacturers	Nissan Motor Co., Ltd., together with its subsidiaries, manufactures and sells vehicles and automotive parts in Japan, the United States, rest of North America, Europe, rest of Asia, and internationally. It operates through Automobile and Sales Financing segments. The company offers vehicle and vehicle parts; drivetrains; electrified power trains and automobile transmissions; engines, axles, and engine parts for automobiles and forklifts; automotive lithium-ion batteries; and motorsports. It als	1248558186496.0	9.839752262822143	-152.6				2433513000000.0	4369888000000.0	3615743000000.0	8099861000000.0	4958543000000.0	-553.8224118566981	-178.56799032389625	-50.201851053061745					판정불가	판정불가				보류	일부부족
7269.T	7269.T	Japan Nikkei 225	1769.0	-21.760283060592656	-19.0574239304507		-27.840097899245364	1848.8875	2095.41	N	N	주의	SUZUKI MOTOR CORP	JPX	JPY	Consumer Cyclical	Auto Manufacturers	Auto Manufacturers	Suzuki Motor Corporation engages in the manufacture and sale of automobiles, motorcycles, outboard motors, electric wheelchairs, and other products in Japan and internationally. It offers mini passenger cars and commercial vehicles, compact passenger cars and automobile engines, foundry and machining of engine components, motorcycles and motorcycle engines, outboard motors, motorized wheelchairs, and electro senior vehicles. The company is also involved in the development and testing of motorcyc	3491985620992.0	2.94	227.67	31.239018727702295	37.41370038279079		1505214000000.0	427465000000.0	297834000000.0	725299000000.0	2970660000000.0	558.6293380509051	138.51895286385042	7.830353468844003	5.3163379538327185	37.41370038279079	0.14209602096129678	7.590506986806306	매우 유망	안심(>=2)	60.0	13660.199999999999	672.1989824759751	매우 유망	충분
7270.T	7270.T	Japan Nikkei 225	2385.0	-21.649145860709595	-26.275115919629055		-33.71317398554753	2492.3125	3023.8175	N	N	주의	SUBARU CORPORATION	JPX	JPY	Consumer Cyclical	Auto Manufacturers	Auto Manufacturers	Subaru Corporation manufactures and sells automobiles and aerospace products in Japan, Rest of Asia, North America, Europe, and Internationally. It operates through three segments: Automotive, Aerospace, and Others. The company manufactures, sells, and repairs automobiles and related components, aircraft, space-related devices, and the parts; and rents and manages real estate properties. It also involved in the shipping, land freight, and warehousing of vehicles; leasing and rental of vehicles; 	1752799510528.0	4.86	125.45	-12.21084230972983	69.02526664269493		2980398000000.0	352500000000.0	47000000000.0	399500000000.0	2714517000000.0	3673.1811254665167	317.0799597053723	13.29475722035104	-10.268482466851468	69.02526664269493	-0.1487641115536089		판정불가	판정불가	60.0	7527.0	215.59748427672955	보류	충분
4901.T	4901.T	Japan Nikkei 225	3148.0	3.1116934163118337	-11.023176936122104		-16.49867374005305	3057.3125	3297.98	Y	N	상승전환/양호	FUJIFILM HOLDINGS CORPORATION	JPX	JPY	Industrials	Conglomerates	Conglomerates	FUJIFILM Holdings Corporation provides products and services in the fields of healthcare, electronics, business innovation, and imaging in Japan, the Americas, Europe, Asia, and internationally. The Healthcare segment offers products and services, such as medical devices, biomedical contract development and manufacturing organization, pharmaceutical, regenerative medicine, and cosmetics and supplements in the areas of prevention, diagnosis, and treatment; equipment and materials for medical syst	3795371950080.0	2.38	224.77	7.162774271176842	7.308813587292584		172111000000.0	470805000000.0	215103000000.0	802285000000.0	3348480000000.0	-249.55623923808875	-108.48269724665094	-3.4460831399825587	15.115701558206561	7.308813587292584	2.068147090861281	0.6409767717352404	매우 불리	불리(<1)	23.117627174585166	5196.149060031508	65.06191423225884	보류	충분
5108.T	5108.T	Japan Nikkei 225	3330.0	-11.31824234354194	-3.61794500723589		-12.758711029604397	3338.45	3437.975	N	N	주의	BRIDGESTONE CORP	JPX	JPY	Consumer Cyclical	Auto Parts	Auto Parts	Bridgestone Corporation, together with its subsidiaries, manufactures and sells tires and rubber products in Japan, China, India, the Asia Pacific, the United States, the Americas, Europe, the Middle East, and Africa. The company offers passenger car, motorcycle, trucks, buses, construction and mining vehicles, agricultural machinery, and aircraft tires; automotive components; automotive maintenance and repair services; synthetic rubber; retreading materials; and raw materials for tires. It also	4241579048960.0	3.9	119.21	14.833905870051133	2.907072532622368		740830000000.0	392312000000.0	94958000000.0	827015000000.0	3661793000000.0	277.6424386158517	297.37434790626435	8.930160597785717	25.60487846140549	2.907072532622368	8.807787963346147	0.26585060901119845	매우 불리	불리(<1)	14.314145065244736	1706.389233227825	-48.7570800832485	보류	충분
6301.T	6301.T	Japan Nikkei 225	6322.0	-15.413433235215413	24.522355721882995		-18.93832542633671	6610.35	5779.395	N	Y	상승전환/양호	KOMATSU	JPX	JPY	Industrials	Farm & Heavy Construction Machinery	Farm & Heavy Construction Machinery	Komatsu Ltd. manufactures and sells construction, mining, and utility equipment in Japan, the Americas, Europe, China, rest of Asia, Oceania, the Middle East, Africa, and CIS countries. It operates in three segments: Construction, Mining and Utility Equipment; Retail Finance; and Industrial Machinery and Others. The company offers construction and mining equipment, including excavators, hydraulic and mini excavators, wheel loaders, bulldozers, motor graders, dump trucks, backhoe loaders, rope an	5721065259008.0	3.01	414.09	11.739946012719038	25.028774565435775		386879000000.0	496189000000.0	654408000000.0	1220702000000.0	3173399000000.0	-121.25037432489658	345.31787148323303	5.462161839342503	15.560024087335837	25.028774565435775	0.6216854143879625	1.8019750103250984	헐값	양호(>=1.5)	58.55754913087155	24248.095519602597	283.5510205568269	양호	충분
6326.T	6326.T	Japan Nikkei 225	2810.5	4.16975537435138	41.37323943661973		-13.30968537939543	2635.4	2266.6	Y	Y	상승전환/양호	KUBOTA CORP	JPX	JPY	Industrials	Farm & Heavy Construction Machinery	Farm & Heavy Construction Machinery	Kubota Corporation engages in the manufacture and sale of agricultural and construction machinery in Japan, North America, Europe, Asia, and internationally. The company offers tractors, power tillers, combine harvesters, rice transplanters, turf equipment, utility vehicles, other agricultural machineries, implements, attachments, post-harvest machineries, vegetable production equipment, intermediate management machines, and other equipment for agricultural use, weighing and measuring control sy	3191956570112.0	1.85	163.57	-18.985666364342535	6.06183769287576		596155000000.0	1381640000000.0	860439000000.0	2242079000000.0	2622985000000.0	-690.6308227835013	124.85489694612315	4.442444296250601	21.40448017841598	6.06183769287576	3.5310216576025826	0.3696346571805076	매우 불리	불리(<1)	20.62367538575152	3373.4145828473756	20.02898355621332	보류	충분
6367.T	6367.T	Japan Nikkei 225	24020.0	29.487870619946086	34.18994413407821		-6.826997672614432	21283.75	19512.5	Y	Y	상승전환/양호	DAIKIN INDUSTRIES	JPX	JPY	Industrials	Building Products & Equipment	Building Products & Equipment	Daikin Industries,Ltd. manufactures, distributes, and sells air-conditioning and refrigeration equipment, and chemical products in Japan, the Americas, China, Asia, Europe, Europe, and internationally. It offers air-conditioning and refrigeration equipment products, such as split/multi-split typeair conditioners, unitary, air to water heat pump systems, heating systems, air purifiers, skyair, multi-split type air conditioners, ventilations, control systems, packaged air-conditioning systems, air	6949131255808.0	1.5	939.18	1.7079570206407046	6.739137570446063		802663000000.0	414920000000.0	397373000000.0	986849000000.0	2805493000000.0	1324.0707061809235	916.7583738065204	3.816646019177853	24.16568633682476	6.739137570446063	3.5858722402108842	0.3409436610079183	매우 불리	불리(<1)	21.978275140892126	20641.556446823066	-14.065127198904804	보류	충분
6273.T	6273.T	Japan Nikkei 225	66780.0	0.2552169343942312	25.173383317713217		-21.02649006622517	69852.25	58349.25	N	Y	상승전환/양호	SMC CORP	JPX	JPY	Industrials	Specialty Industrial Machinery	Specialty Industrial Machinery	SMC Corporation manufactures, processes, and sells automatic control equipment worldwide. The company offers air management system, directional control valves, air cylinders, rotary actuators, air grippers, magnet grippers, electric actuators/cylinders, vacuum equipment, air grippers for collaborative robots, compact compressor, air preparation equipment, modular F.R.L., pressure control equipment, booster regulators, lubrication equipment, gas generator, fittings and tubing, flow control equipm	4237893828608.0	1.5	2637.81	-12.324403743810318	-6.779115212428066		715319000000.0	0.0	5041000000.0	5041000000.0	1928280000000.0	11329.262921070775	1407.2746950504916	2.107329582285851	21.021505369579017	-6.779115212428066		-0.251129265940567	판정불가	불리(<1)	0.0	0.0	-100.0	보류	일부부족
6146.T	6146.T	Japan Nikkei 225	63500.0	-12.08639069638654	33.57172907025663		-20.625000000000004	69411.0	55813.9	N	Y	상승전환/양호	DISCO CORPORATION	JPX	JPY	Technology	Semiconductor Equipment & Materials	Semiconductor Equipment & Materials	Disco Corporation manufactures and sells precision cutting, grinding, and polishing machines in Japan and internationally. Its precision machines include dicing saws, laser saws, grinders, polishers, wafer mounters, die separators, surface planers, and waterjet saws. The company also offers precision processing tools, such as dicing blades, grinding wheels, and dry polishing wheels; and other products, such as accessory equipment, cut-off wheels, and related products. In addition, it is involved	6681260457984.0	80.0	1250.95	47.13021792055103	23.22934390915492		229167000000.0	0.0	0.0	0.0	492352000000.0	2112.877756062548	492.6516907645787	0.775829434274927	49.07240276904549	23.22934390915492	2.1125178119949206	2.1036129898711873	매우 불리	안심(>=2)	54.95868781830984	68750.5705263147	8.26861500207039	보류	충분
7735.T	7735.T	Japan Nikkei 225	10885.0	2.014995313964385	71.34986225895317		-10.815239655878738	10327.425	8007.11	Y	Y	상승전환/양호	SCREEN HOLDINGS CO LTD	JPX	JPY	Technology	Semiconductor Equipment & Materials	Semiconductor Equipment & Materials	SCREEN Holdings Co., Ltd. develops, manufactures, and markets semiconductor production equipment in Japan, Taiwan, South Korea, China, the United States, Europe, and internationally. It operates through Semiconductor Production Equipment, Graphic Arts Equipment, Display Production Equipment and Coater, and Printed Circuit Board (PCB)-Related Equipment segments. The company offers wafer cleaning systems, such as wet stations, spin processors, and spin scrubbers; coat/develop trackers, and spray c	1989203853312.0	2.11	486.56	40.930021677836194	29.8024843823244		260397000000.0	757000000.0	1013000000.0	4562000000.0	420639000000.0	1373.118513232713	241.51210577645318	2.2187607329026475	19.549246725516454	29.8024843823244	0.6559603043399612	1.6324150403540079	헐값	양호(>=1.5)	60.0	29193.6	168.20027560863574	양호	충분
7741.T	7741.T	Japan Nikkei 225	27725.0	1.2415555961292624	11.794354838709676		-7.675657675657677	28247.75	24230.825	N	Y	상승전환/양호	HOYA CORP	JPX	JPY	Healthcare	Medical Instruments & Supplies	Medical Instruments & Supplies	HOYA Corporation, a med-tech company, provides high-tech and medical products internationally. It operates through two segments: Life Care, and Information and Communications. It offers life care products, including eyeglasses and contact lenses; medical endoscopes; intraocular lenses; laparoscopic surgical instruments; automatic endoscope cleaning devices; and other medical related products, such as prosthetic ceramic fillers and metallic implants for orthopedics. The company also operates Eyec	8996767399936.0	1.06	743.03	11.427090684544815	7.101464551222003		543101000000.0	28007000000.0	9276000000.0	37283000000.0	974023000000.0	1539.8256463002429	559.590099198571	2.018359239670229	35.24107284187685	7.101464551222003	4.962507745787825	0.23158955993881555	매우 불리	불리(<1)	22.702929102444006	16868.95741098897	-39.156150005450066	보류	충분
7733.T	7733.T	Japan Nikkei 225	1744.0	-10.033531080732526	-5.983827493261451		-17.580340264650285	1551.0125	1788.14	Y	N	주의	OLYMPUS CORPORATION	JPX	JPY	Healthcare	Medical Devices	Medical Devices	Olympus Corporation, together with its subsidiaries, manufactures and sells medical equipment in Japan, America, the Middle East, Asia, and Oceania. It operates through Endoscopic Solutions Business, Therapeutic Solutions Business, and Other segments. The company offers gastrointestinal endoscopy system products comprising video endoscopy and ultrasound systems; GI endotherapy products consisting of CRC devices and HPB devices/hemostasis products; endoscopic solutions ecosystem products, includi	2064567107584.0	1.72	61.21	-51.41322361748968	0.6048713093102842		257134000000.0	134117000000.0	94985000000.0	229102000000.0	751733000000.0	111.72165916656574	113.75325928326187	6.522549270829235	26.666857389861693	0.6048713093102842	44.086828023417205	0.08718205056266444	매우 불리	불리(<1)	9.709742618620568	594.333345685765	-65.92125311434833	보류	충분
6971.T	6971.T	Japan Nikkei 225	2834.0	6.142322097378283	41.45245819815324		-3.4412265758091976	2623.6125	2250.4025	Y	Y	상승전환/양호	KYOCERA CORP	JPX	JPY	Industrials	Conglomerates	Conglomerates	Kyocera Corporation develops and sells products based on fine ceramic technologies in Japan, China, rest of Asia, Europe, the United States, and internationally. It operates through Core Components Business, Electronic Components Business, and Solutions Business segments. The Core Components Business segment offers components, such as fine ceramic components for semiconductor processing equipment, automotive camera modules, and ceramic packages, as well as organic packages and boards to protect 	3835627307008.0	1.98	102.59	-76.15905178384155	-45.44565207097372		502030000000.0	202577000000.0	44386000000.0	342382000000.0	3217788000000.0	227.30502352231596	53.19089212097648	1.876883984508697	25.408860283435853	-45.44565207097372		-1.7106494185931342	판정불가	불리(<1)	0.0	0.0	-100.0	보류	일부부족
6963.T	6963.T	Japan Nikkei 225	4145.0	60.2861562258314	79.74848222029489		-4.865733302731234	3596.575	2571.695	Y	Y	상승전환/양호	ROHM CO LTD	JPX	JPY	Technology	Semiconductors	Semiconductors	ROHM Co., Ltd. manufactures and sells electronic components worldwide. The company operates through: LSI, semiconductor element, Module, and others segments. The company provides ICs comprising memory, amplifiers and linear, power management, motor/actuator drivers, resistors, clocks and timers, switches and multiplexers, logic, data converters, sensors and MEMS, display drivers, interfaces, wireless LSIs, audio and video products, speech synthesis LSI, and microcontrollers. It also offers discr	1594324811776.0	1.21	-410.36				300602000000.0	300000000000.0	100000000000.0	400000000000.0	889031000000.0	1.5594438131215482	-134.27795597503086	-3.2395164288306604					판정불가	판정불가				보류	일부부족
6723.T	6723.T	Japan Nikkei 225	3700.0	19.2394456977119	99.89195029713669		-3.9958484691229867	2846.3125	2248.6775	Y	Y	상승전환/양호	RENESAS ELECTRONICS CORP	JPX	JPY	Technology	Semiconductors	Semiconductors	Renesas Electronics Corporation engages in the design, research, development, manufacturing, sale, and service of semiconductors in Japan, China, rest of Asia, Europe, North America, and internationally. The company operates through Automotive Business and Industrial/Infrastructure/IoT Business segments. It offers microcontrollers and microprocessors; amplifiers, audio and video, data converters, power line communication, and switches and multiplexer products; custom ASICS and processor IP solut	6366360502272.0	76.0	-28.49	162.1			373099000000.0	964089000000.0	242478000000.0	1206567000000.0	2443034000000.0	-325.7409006245188	175.87385024717142	4.7533473039776055		162.1			판정불가	판정불가				판정불가	일부부족
6702.T	6702.T	Japan Nikkei 225	3231.0	-19.546812749003983	-16.490049108296724		-30.30629853321829	3417.7	3760.995	N	N	주의	FUJITSU	JPX	JPY	Technology	Information Technology Services	Information Technology Services	Fujitsu Limited provides digital services in Japan, Europe, the Americas, the Asia Pacific, East Asia, and internationally. The company operates through three segments: Service Solutions, Hardware Solutions, and Ubiquitous Solutions. The company offers consulting services; data driven management; network and communication services; enterprise cyber security; multi cloud and hybrid IT services. It also provides assessment and consultative; SAP landscape, integrated systems; storage solutions; ser	5780280967168.0	1.7	172.54	-13.624360455520712	6.359133040098119		236079000000.0	0.0	146992000000.0	247092000000.0	1740965000000.0	136.08598454809385	82.42206386262502	2.5509769069212327	17.937371133951007	6.359133040098119	2.8207258789594754	0.44929287463111994	매우 불리	불리(<1)	21.218266080196237	3660.9996294770585	13.308561729404467	보류	충분
6701.T	6701.T	Japan Nikkei 225	4162.0	-7.6752440106477415	-26.297148928634673		-31.47843266381297	4135.425	4793.71	Y	N	주의	NEC CORP	JPX	JPY	Technology	Information Technology Services	Information Technology Services	NEC Corporation provides information technology services and social infrastructure in Japan and internationally. The company offers systems integration services, including system construction and consulting, maintenance support, and outsourcing, as well as cloud, system equipment, software services. It also provides core network equipment, mobile phone base stations, optical transmission systems, and marine systems, as well as software and services for telecommunications carriers. In addition, t	5708557320192.0	96.0	203.11	17.1628065622889	7.4336089765803415		604275000000.0	255842000000.0	233886000000.0	666359000000.0	1952018000000.0	262.2758212711268	145.8661937112236	3.5047139286694757	19.200059961246975	7.4336089765803415	2.5828719296020215	5.387150310225526	매우 불리	안심(>=2)	23.367217953160683	4746.115638466466	14.034493956426397	보류	충분
5802.T	5802.T	Japan Nikkei 225	11380.0	36.010517509262584	92.81599457810911		-10.919765166340511	10172.85	6782.665	Y	Y	상승전환/양호	SUMITOMO ELECTRIC INDUSTRIES	JPX	JPY	Consumer Cyclical	Auto Parts	Auto Parts	Sumitomo Electric Industries, Ltd. manufactures and sells various materials in Japan and internationally. The company operates in Environment and Energy, Infocommunications, Automotive, Electronics, and Industrial Materials segments. It offers vanadium redox flow battery, high voltage cable, sEMSA, industrial electric wires and cables, traveling cable, railway and transport machinery products, aluminum materials, heat shrink tubing and heat-resistant tubing/tapes, thermal control devices, and wa	8454331170816.0	34.0	473.41	29.41966164183192	26.2443096533858		295903000000.0	341281000000.0	346710000000.0	756562000000.0	2290394000000.0	-58.182899878016315	259.5510211866315	2.2807646852955314	24.1612616967914	26.2443096533858	0.9206285863828899	2.4934256500928593	헐값	안심(>=2)	60.0	28404.600000000002	149.6010544815466	양호	충분
5713.T	5713.T	Japan Nikkei 225	9560.0	1.0784521040389183	98.17578772802653		-26.743295019157088	9813.775	6825.92	N	Y	상승전환/양호	SUMITOMO METAL MINING CO	JPX	JPY	Basic Materials	Other Industrial Metals & Mining	Other Industrial Metals & Mining	Sumitomo Metal Mining Co., Ltd., together with its subsidiaries, engages in the resource development, manufacture, and sale of non-ferrous metal products in Japan and internationally. It operates through Resource, Smelting, and Material segments. The company is involved in the development and operation of the Hishikari Mine and other mines; smelting and refining business, which provides metal products, such as copper, nickel and cobalt, silver, platinum, rhodium, ruthenium, palladium, slag sand,	2510701461504.0	2.18	649.12	-71.86566782136823	-61.14388471214129		168322000000.0	367258000000.0	193045000000.0	560303000000.0	1845737000000.0	-735.3028879167291	101.6005438083356	1.0627671946478618	15.860400061493605	-61.14388471214129		-3.717679534155997	판정불가	불리(<1)	0.0	0.0	-100.0	보류	일부부족
5401.T	5401.T	Japan Nikkei 225	549.0	-18.412842906633898	-10.528027730811074		-21.346704871060172	583.6900009155273	617.916501159668	N	N	주의	NIPPON STEEL CORPORATION	JPX	JPY	Basic Materials	Steel	Steel	Nippon Steel Corporation engages in the steelmaking and steel fabrication, engineering, chemicals and materials, and system solutions businesses in Japan and internationally. The company's Steelmaking and Steel Fabrication segment engages in the manufacture and sale of steel products. Its Engineering and Construction segment engages in the design, manufacture, sale, construction, and supervision of various plants and facilities, energy pipelines, water facilities, industrial machinery and equipm	2874461650944.0	4.37	3.29	-36.249572238847264	-18.091218544964416		755376000000.0	0.0	473466000000.0	2507492000000.0	5383311000000.0	144.5337750975876	68.95880728457811	12.560802784076158	122.9380622803685	-18.091218544964416		-0.1116108249182605	판정불가	불리(<1)	0.0	0.0	-100.0	보류	일부부족
5411.T	5411.T	Japan Nikkei 225	1652.5	-27.058044581770023	-4.0360046457607375		-29.949130987706653	1793.8875	1899.1275	N	N	주의	JFE HOLDINGS INC	JPX	JPY	Basic Materials	Steel	Steel	JFE Holdings, Inc., through its subsidiaries, engages in steel, engineering, and trading businesses in Japan and internationally. It operates through the Steel, Engineering, and Trading segments. The Steel segment produces and sells various steel products, processed steel products, and raw materials, as well as transportation, facility maintenance, and construction services. Its Engineering segment is involved in engineering activities for steel structures, industrial machines, energy and enviro	1061393465344.0	4.84	105.43	-53.465943339361054	-31.677942320653262		217073000000.0	0.0	395415000000.0	1766450000000.0	2529578000000.0	341.2366089747449	156.49318736114043	9.470086981006984	12.437289111498197	-31.677942320653262		-2.1578610965826748	판정불가	불리(<1)	0.0	0.0	-100.0	보류	일부부족
4188.T	4188.T	Japan Nikkei 225	1007.5	-7.6535288725939505	23.226520313674136		-13.183972425678592	945.1324981689453	912.3910000610351	Y	Y	상승전환/양호	MITSUBISHI CHEMICAL GROUP CORP	JPX	JPY	Basic Materials	Specialty Chemicals	Specialty Chemicals	Mitsubishi Chemical Group Corporation provides performance products, industrial materials, industrial gases, and others in Japan and internationally. It operates in five segments: Specialty Materials, MA & Derivatives, Basic Materials & Polymers, Pharma, and Industrial Gases. The company provides chemicals; film & sheet/molding/composite; information/electronics/ display/ battery; environment & living solutions; polymers/resins, high performance chemicals; carbon/carbon fibers & composite materi	1399983177728.0	3.18	-60.45	-62.35660055520251	-36.65996406741831		458350000000.0	1612920000000.0	428067000000.0	2040987000000.0	1740570000000.0	-849.8562302314549	140.351374834919	13.930657551853		-36.65996406741831			판정불가	판정불가				판정불가	일부부족
4005.T	4005.T	Japan Nikkei 225	603.7999877929688	7.8792164774198925	39.25276275222662		-3.175110418239613	522.2175010681152	475.4979995727539	Y	Y	상승전환/양호	SUMITOMO CHEMICAL COMPANY	JPX	JPY	Basic Materials	Chemicals	Chemicals	Sumitomo Chemical Company, Limited engages in Agro & Life Solutions, ICT & Mobility Solutions, Advanced Medical Solutions, Essential & Green Materials, and Sumitomo Pharma. The Agro & Life Solutions segment offers crop protection chemicals, fertilizers, agricultural materials, household insecticides, products for control of infectious diseases, and feed additives, etc. The ICT & Mobility Solutions segment provides optical products, semiconductor processing materials, compound semiconductor mater	1006866857984.0	2.65	37.13		-38.026282243258926		299868000000.0	1033236000000.0	252892000000.0	1286128000000.0	900790000000.0	-444.0850257438706	-123.64559321737644	-20.477905882265784	28.222057999914874	-38.026282243258926		-1.253497609684086	판정불가	불리(<1)	0.0	0.0	-100.0	보류	일부부족
