티커	종목코드	유니버스	현재가	3M수익률(보조,%)	6M수익률(보조,%)	12M수익률(보조,%)	52주고점대비(보조,%)	40일이평(보조)	200일이평(보조)	40일선상회(보조)	200일선상회(보조)	추세판정(보조)	종목명	시장	통화	섹터	산업	업종	사업설명	시가총액	배당수익률(%)	EPS(FY)	EPS Growth 1Y(%)	EPS Growth 3Y CAGR(%)	EPS Growth 5Y CAGR(%)	현금및단기투자	장기부채	단기위험부채	총부채	주주지분	주당순현금(린치식)	주당잉여현금흐름	잉여현금흐름수익률(%)	순현금차감PER(린치식)	사용연성장률(%)	린치PER배수	배당감안점수	린치PER판정	배당감안점수판정	그레이엄적정PER(3년)	그레이엄내재가치(3년)	그레이엄괴리율(3년,%)	종합판정	데이터상태
7203.T	7203.T	Japan Nikkei 225	3026.0	-18.502558577969296	-5.141065830721003		-23.275862068965512	3159.4	3188.6	N	N	주의	TOYOTA MOTOR CORP	JPX	JPY	Consumer Cyclical	Auto Manufacturers	Auto Manufacturers	Toyota Motor Corporation designs, manufactures, assembles, and sells passenger vehicles, minivans and commercial vehicles, and related parts and accessories in Japan, North America, Europe, Asia, Central and South America, Oceania, Africa, the Middle East, and internationally. It operates through Automotive, Financial Services, and All Other segments. The company offers subcompact and compact cars; mini-vehicles; mid-size, luxury, sports, and specialty cars; recreational and sport-utility vehicl	39386884341760.0	3.3	295.34	-19.24389192556021	16.22034398017016		20624512000000.0	25624365000000.0	17581104000000.0	43205469000000.0	39918854000000.0	-383.6189538368448	13.777849624456938	0.4553155857388281	11.544724567741738	16.22034398017016	0.7117435106096084	1.690845361067677	헐값	양호(>=1.5)	40.94068796034032	12091.42278220691	299.58436160630896	양호	충분
6758.T	6758.T	Japan Nikkei 225	3598.0	3.183252079151133	-23.21809645753308		-23.446808510638295	3351.6	3861.1474682617186	Y	N	상승전환/양호	SONY GROUP CORPORATION	JPX	JPY	Technology	Consumer Electronics	Consumer Electronics	Sony Group Corporation designs, develops, produces, and sells electronic equipment, instruments, and devices for the consumer, professional, and industrial markets in Japan, the United States, Europe, China, the Asia-Pacific, and internationally. The company distributes software titles and add-on content through digital networks; network services related to game, video, and music content; hardware and home gaming consoles, packaged and game software, and peripheral devices. It also develops, pro	20961801797632.0	97.0	171.26	17.62124023643765	8.973084964624945		3915606000000.0	2066842000000.0	2131404000000.0	4198246000000.0	8179745000000.0	312.9222859030364	283.36673534317885	7.8756735781872935	19.18181545075887	8.973084964624945	2.1377057641134933	5.52466398379578	매우 불리	안심(>=2)	26.44616992924989	4529.171062083336	25.880240747174433	보류	충분
9984.T	9984.T	Japan Nikkei 225	7070.0	58.912115082040906	29.073482428115007		0.0	4920.975	4505.36625	Y	Y	상승전환/양호	SOFTBANK GROUP CORP	JPX	JPY	Communication Services	Telecom Services	Telecom Services	SoftBank Group Corp. provides telecommunication services in Japan and internationally. It operates through Investment Business of Holding Companies, SoftBank Vision Funds, SoftBank, Arm, and Other segments. The company offers mobile communications and solutions to enterprise customers, and broadband services to retail customers; and sells mobile devices and software tools, as well as related services. It also provides online advertising and e-commerce services; payment and financial services; in	44685259177984.0	16.0	872.44	253.79999999999998			6684782000000.0	12376682000000.0	5629648000000.0	18913350000000.0	11561541000000.0	-998.7675390357011	-114.16067912715506	-1.6147196481917265	9.2485071054006	253.79999999999998	0.036440138319151306	29.172275798161213	매우 유망	안심(>=2)	8.5	7415.740000000001	4.890240452616701	보류	충분
6861.T	6861.T	Japan Nikkei 225	78860.0	35.5215672796013	40.97247050411155		-6.308661043127007	67584.0	59450.9	Y	Y	상승전환/양호	KEYENCE CORP	JPX	JPY	Technology	Scientific & Technical Instruments	Scientific & Technical Instruments	Keyence Corporation, together with its subsidiaries, manufactures and sells electronic application equipment. It offers photoelectric, fiber optic, laser, positioning, vision, and inductive proximity sensors; network communication units; measurement sensors, such as laser displacement and profiler/3D laser snapshot sensors, optical/laser micrometers, inductive displacement sensors, 3D interference measurement sensors, spectral interference displacement sensors, inductive displacement sensors, an	18703538192384.0	70.0	1837.44	7.849216268714043	9.533423797831464		1859417000000.0	0.0	0.0	0.0	3108552000000.0	7666.904266780825	1629.4393501546165	2.0662431526180782	38.74580706483976	9.533423797831464	4.06420692990205	2.0526975645322096	매우 불리	안심(>=2)	27.566847595662928	50652.42844617489	-35.76917518872066	보류	충분
8035.T	8035.T	Japan Nikkei 225	52180.0	23.795966785290634	55.02079619726678		-0.5147759771210625	45060.75	34885.45	Y	Y	상승전환/양호	TOKYO ELECTRON	JPX	JPY	Technology	Semiconductor Equipment & Materials	Semiconductor Equipment & Materials	Tokyo Electron Limited, together with its subsidiaries, develops, manufactures, and sells semiconductor production equipment in Japan, South Korea, Taiwan, China, North America, Europe, and internationally. The company provides coaters/developers, plasma etch systems, cleaning systems, deposition systems, test systems, 3D integration systems, SiC Epitaxial CVD systems, and gas cluster beam systems, as well as other deposition and lithography and other products. It also offers engineering service	23489538949120.0	1.38	1252.32	49.50228457288242	7.57615934348288		576236000000.0	0.0	0.0	0.0	1855206000000.0	1266.8770981780767	910.4917899158987	1.7449056916747772	40.65504256246161	7.57615934348288	5.366181031743169	0.22029639569858556	매우 불리	불리(<1)	23.65231868696576	29620.271738060957	-43.23443515128218	보류	충분
6954.T	6954.T	Japan Nikkei 225	8428.0	29.48225533876172	61.73479178660526		0.0	6656.325	5609.375	Y	Y	상승전환/양호	FANUC CORPORATION	JPX	JPY	Industrials	Specialty Industrial Machinery	Specialty Industrial Machinery	Fanuc Corporation engages in the development, manufacture, sale, and maintenance services of products used in automated production systems in Japan, the United States, Europe, China, the rest of Asia, and internationally. The company offers CNC series, robots, and robomachine products, such as servo motors, lasers, compact machining centers, electric injection molding machines, wire electrical discharge machines, system basic package, and AI servo monitors. Fanuc Corporation was incorporated in 	7837598613504.0	1.27	178.67	10.812637523562053	-1.6846587496910814		622504000000.0	0.0	0.0	0.0	1724545000000.0	667.0934973130702	229.83018290924966	2.7269836605274045	43.43709913632356	-1.6846587496910814		-0.009546188809471622	판정불가	불리(<1)	5.130682500617837	916.6990423853889	-89.12317225456349	보류	일부부족
6857.T	6857.T	Japan Nikkei 225	27755.0	3.582757977234552	39.96469994957135		-11.888888888888893	26140.5	20377.625	Y	Y	상승전환/양호	ADVANTEST CORP	JPX	JPY	Technology	Semiconductor Equipment & Materials	Semiconductor Equipment & Materials	Advantest Corporation, together with its subsidiaries, manufactures and sells semiconductors, component test systems, and mechatronics-related products in Japan, rest of Asia, the Americas, and Europe. The company offers automated test equipment, including system on chip, power device, and memory test systems, as well as burn-in and SSD test systems; and metrology and SEM tools. It also provides component test systems, such as die level, SoC, and memory test handlers, as well as change kits, and	18914440380416.0	22.0	513.47	158.75260876545192	22.676473519396858		262544000000.0	3000000.0	74952000000.0	93503000000.0	506539000000.0	361.9327807969493	367.445707122388	1.3238901355517494	53.348914677007514	22.676473519396858	2.3526107192714183	0.8374392204580624	매우 불리	불리(<1)	53.852947038793715	27651.87271600941	-0.37156290394736446	보류	충분
6594.T	6594.T	Japan Nikkei 225	2821.0	19.83857264231097	23.457330415754928		-13.862595419847324	2378.175	2401.9425	Y	Y	상승전환/양호	NIDEC CORPORATION	JPX	JPY	Industrials	Specialty Industrial Machinery	Specialty Industrial Machinery	Nidec Corporation, together with its subsidiaries, develops, manufactures, and sells motors, electronics and optical components, and other related products in Japan and internationally. The company offers medium- and large-size motors, small-size and precision motors, fans and blowers, motor-related products, units and modules, automotive components, mechanical equipment/machine tools, inspection and measuring equipment, electronic devices, as well as mold, molding, cutting, and machining compon	3236032937984.0	1.92	104.94	32.067815676348886	6.581109751515668		248811000000.0	0.0	257559000000.0	636046000000.0	1719296000000.0	217.05388229526966	118.29175311926029	4.193256048183633	24.813666073039172	6.581109751515668	3.770437967141399	0.34259789450267447	매우 불리	불리(<1)	21.662219503031338	2273.2333146481087	-19.417464918535675	보류	충분
9432.T	9432.T	Japan Nikkei 225	150.6999969482422	-1.5676087913743864	-1.115483606513057		-8.942600031273606	153.4775005340576	155.6125001525879	N	N	주의	NTT INC	JPX	JPY	Communication Services	Telecom Services	Telecom Services	NTT, Inc. operates as a telecommunications company in Japan and internationally. It operates through Integrated ICT Business, Regional Communications Business, Global Solutions Business, and Others segments. The Integrated ICT Business segment offers mobile phone, domestic inter-prefectural communications, international communications, solutions, and system development and related services. Its Regional Communications Business segment provides intra-prefectural communications and related ancilla	12189116137472.0	3.58	12.61	-21.84450274751255	-5.396142906163259		2947924000000.0	7187500000000.0	2822577000000.0	11171213000000.0	10221587000000.0	-52.06813130800157	2.8460904300772	1.8885802838169188	16.079946729281822	-5.396142906163259		-0.11294458475139324	판정불가	불리(<1)	0.0	0.0	-100.0	보류	일부부족
9433.T	9433.T	Japan Nikkei 225	2634.5	-1.3295880149812755	-1.1073573573573525		-5.877098963915683	2644.4875	2602.245	N	Y	상승전환/양호	KDDI CORPORATION	JPX	JPY	Communication Services	Telecom Services	Telecom Services	KDDI Corporation engages in the provision of mobile telecommunications services in Japan and internationally. It operates in two segments, Personal Services and Business Services. The Personal Services segment offers 5G telecommunication services and other services, such as finance, energy, and LX through its multi-brands comprising au, UQ mobile, and povo; and entertainment services, including video and games to individual customers. The Business Services segment provides smartphones and other 	9961220341760.0	3.19	183.62	9.184865088183702	-0.8533760598208318		1807347000000.0	2297564000000.0	1734528000000.0	4437562000000.0	5032495000000.0	-128.76461847547895	148.69959003823178	5.6443192271107145	15.048821579759716	-0.8533760598208318		0.15526956232386116	판정불가	불리(<1)	6.7932478803583365	1247.3761757913978	-52.65226130987293	보류	일부부족
9434.T	9434.T	Japan Nikkei 225	217.60000610351562	1.445224290683278	-2.7703292509823285		-11.831441080703108	219.74750061035155	220.00699966430665	N	N	주의	SOFTBANK CORP.	JPX	JPY	Communication Services	Telecom Services	Telecom Services	SoftBank Corp., together with its subsidiaries, provides mobile communications and fixed-line telecommunications and ISP services in Japan. It operates through Consumer, Enterprise, Distribution, Media & EC, Financial, and others segments. The Consumer segment offers mobile services to individual customers; sells mobile devices; provides internet broadband services; trades in and supplies electric power; and offers electric power trading agency services. The Enterprise segment provides mobile se	10348974309376.0	4.04	11.27	7.577380928039523	0.5805487168454748		1955997000000.0	4315628000000.0	1646524000000.0	5962152000000.0	2743630000000.0	-49.36335901937978	12.995764892843411	5.972318257500935	23.687964962102523	0.5805487168454748	40.80271693789235	0.1950589138508823	매우 불리	불리(<1)	9.66109743369095	108.88056807769699	-49.96297563250028	보류	충분
8306.T	8306.T	Japan Nikkei 225	3066.0	6.587867199721886	27.750000000000007		-1.3513513513513487	2851.975	2558.2025	Y	Y	상승전환/양호	MITSUBISHI UFJ FINANCIAL GROUP 	JPX	JPY	Financial Services	Banks - Diversified	Banks - Diversified	Mitsubishi UFJ Financial Group, Inc. operates as a bank holding company that engages in a range of financial businesses in Japan, the United States, Europe, Asia/Oceania, and internationally. It operates through seven segments: Digital Services, Retail & Commercial Banking, Japanese Corporate & Investment Banking, Global Commercial Banking, Asset Management & Investor Services, Global Corporate & Investment Banking, and Global Markets. The company offers commercial banking, trust banking, and se	34551363534848.0	3.13	212.47	30.28982053156668	29.544166267570926		90045500000000.0	26368031000000.0	8729597000000.0	35097628000000.0	22274040000000.0	5641.361808742854	-2102.9751702275253	-68.59018820050636	-12.121060896798861	29.544166267570926	-0.4102691809619116		판정불가	판정불가	60.0	12748.2	315.79256360078284	보류	충분
8316.T	8316.T	Japan Nikkei 225	6056.0	5.948215535339396	41.49532710280375		-2.3855577047066423	5562.275	4867.33	Y	Y	상승전환/양호	SUMITOMO MITSUI FINANCIAL GROUP	JPX	JPY	Financial Services	Banks - Diversified	Banks - Diversified	Sumitomo Mitsui Financial Group, Inc., together with its subsidiaries, provides banking, leasing, securities, consumer finance, and other services in Japan, the Americas, Europe, the Middle East, Asia, and Oceania. It operates through four segments: Wholesale Business Unit, Retail Business Unit, Global Business Unit, and Global Markets Business Unit. The Wholesale Business Unit segment offers bilateral loans, syndicated loans, commitment lines, structured finance, project finance, and nonrecours	23152776183808.0	1.49	411.81	34.37846987595883	25.239464749982776		73696930000000.0	25513660000000.0	7037125000000.0	32550785000000.0	15786049000000.0	12621.879165819093	-2818.815278468724	-46.54582692319558	-15.94395271076247	25.239464749982776	-0.631707243743089		판정불가	판정불가	58.97892949996555	24288.112957380814	301.05866838475583	보류	충분
8411.T	8411.T	Japan Nikkei 225	7304.0	4.342857142857137	40.949440370513315		-7.1564764204906535	6733.725	5811.025	Y	Y	상승전환/양호	MIZUHO FINANCIAL GROUP	JPX	JPY	Financial Services	Banks - Regional	Banks - Regional	Mizuho Financial Group, Inc., together with its subsidiaries, engages in banking, trust banking, securities, and other businesses related to financial services in Japan, the Americas, Europe, Asia/Oceania, and internationally. It operates through Retail & Business Banking Company; Corporate & Investment Banking Company; Global Corporate & Investment Banking Company; Global Markets Company; Asset Management Company; and Others segments. The company provides deposit products; syndicated, housing, 	17945092685824.0	2.05	503.25	41.01936566628983	30.991494297906243		61567751000000.0	21067585000000.0	5113342000000.0	26180927000000.0	11316526000000.0	16608.480249679764	-2115.002964482649	-28.956776622161133	-18.488783407212644	30.991494297906243	-0.5965760550133179		판정불가	판정불가	60.0	30195.0	313.4036144578313	보류	충분
7267.T	7267.T	Japan Nikkei 225	1408.5	-10.315186246418339	-8.805438653285858		-17.26872246696035	1302.2625	1517.6525	Y	N	주의	HONDA MOTOR CO	JPX	JPY	Consumer Cyclical	Auto Manufacturers	Auto Manufacturers	Honda Motor Co., Ltd. develops, manufactures, and distributes motorcycles, automobiles, and power products in Japan, North America, Europe, Asia, and internationally. It operates through four segments: Motorcycle Business, Automobile Business, Financial Services Business, and Power Product and Other Businesses. The Motorcycle Business segment produces motorcycles, including sports, business, and commuter models; and various off-road vehicles, such as all-terrain vehicles and side-by-sides. The A	5476860297216.0	4.97	-106.06	-24.507168701577164	5.73538262937332		4945751000000.0	6057967000000.0	4422236000000.0	4422236000000.0	12326529000000.0	-285.7271716944333	-142.6516441770304	-10.12791225964007		5.73538262937332			판정불가	판정불가				보류	일부부족
6902.T	6902.T	Japan Nikkei 225	1837.0	-18.536585365853664	-12.979630506868778		-20.647948164146868	1905.4875	2089.4975	N	N	주의	DENSO CORP	JPX	JPY	Consumer Cyclical	Auto Parts	Auto Parts	DENSO Corporation engages in the manufacture and sale of automotive parts in Japan, Rest of Asia, North America, Europe, and internationally. The company offers air-conditioning systems, including thermal management heat pump system, heat pump air-conditioning systems, personal heating and cooling devices, air quality system, heat exchangers, bus air-conditioning systems, automotive freezers, control system products, pick up systems, and cooling products, as well as heating, ventilation, and air	4981432778752.0	4.03	162.94	33.98115674683735	16.668150145776607		1211959000000.0	447020000000.0	252364000000.0	699384000000.0	4978266000000.0	284.15913995071395	116.39232133346273	6.336000072589153	9.53013906989865	16.668150145776607	0.5717574527796899	2.171862340514274	헐값	안심(>=2)	41.836300291553215	6816.806769505681	271.0836564782624	양호	충분
7974.T	7974.T	Japan Nikkei 225	7070.0	-15.923415388274464	-49.08174288800864		-51.757079495052885	8076.225	11039.27	N	N	주의	NINTENDO CO LTD	JPX	JPY	Communication Services	Electronic Gaming & Multimedia	Electronic Gaming & Multimedia	Nintendo Co., Ltd., together with its subsidiaries, develops, manufactures, and sells home entertainment products in Japan, the Americas, Europe, and internationally. It offers home console gaming hardware, software, accessories, and other products. The company also provides various services, such as Nintendo Switch Online; and services and content. In addition, it offers develop IP, including video content and mobile apps. The company was formerly known as Nintendo Playing Card Co., Ltd. and ch	8138972463104.0	3.1	364.81	-43.170635260353606	-16.429753038017836		2530105000000.0	0.0	0.0	0.0	2724326000000.0	2194.692526765244	-6.019106496854491	-0.08513587690034641	13.3639633596523	-16.429753038017836		-0.9974401065975869	판정불가	불리(<1)	0.0	0.0	-100.0	보류	일부부족
6098.T	6098.T	Japan Nikkei 225	9688.0	58.45600261694472	18.65278628291489		-1.6047125736339596	7602.15	7948.595	Y	Y	상승전환/양호	RECRUIT HOLDINGS CO LTD	JPX	JPY	Communication Services	Internet Content & Information	Internet Content & Information	Recruit Holdings Co., Ltd. provides HR technology and business solutions that transforms the world of work. It operates through three segments: HR Technology, Matching & Solutions, and Staffing. The HR Technology segment provides online matching and hiring platforms where people can find jobs and learn about companies. The Matching & Solutions segment offers HR solutions that support business clients' recruiting and hiring activities and individual users' job search activities through its job ad	13672118222848.0	27.0	347.8	15.509509294395096	11.231564061626752		846019000000.0	1011000000.0	0.0	208940000000.0	1617582000000.0	607.1742748550001	391.681901554908	4.042959347181132	26.10933215970385	11.231564061626752	2.3246390276940856	1.464287321781133	매우 불리	보통(1~1.5)	30.963128123253504	10768.97596126757	11.157885644793254	보류	충분
4519.T	4519.T	Japan Nikkei 225	8117.0	-11.483097055616142	3.40127388535032		-22.362505978000957	8387.475	7969.85	N	Y	상승전환/양호	CHUGAI PHARMACEUTICAL CO	JPX	JPY	Healthcare	Drug Manufacturers - General	Drug Manufacturers - General	Chugai Pharmaceutical Co., Ltd., together with its subsidiaries, engages in the research, development, manufacture, sale, importation, and exportation of pharmaceuticals in Japan and internationally. It offers oncology products, such as Alecensa, Avastin, FoundationOne, Herceptin, Kadcyla, Lunsumio, Perjeta, Phesgo, Polivy, and Tecentriq; Actemra for humanized anti-human IL-6 receptor monoclonal antibody; CellCept, an immunosuppressant; Enspryng, a pH-dependent binding humanized anti-IL-6 recept	12484758994944.0	1.63	263.8	12.056016131489189	5.045492075929214		1532790000000.0	0.0	0.0	0.0	2025732000000.0	931.3552120470008	166.89705058004412	2.056142054700556	27.23898706578089	5.045492075929214	5.398677999264197	0.24507123043188833	매우 불리	불리(<1)	18.59098415185843	4904.301619260254	-39.579874100526624	보류	충분
4568.T	4568.T	Japan Nikkei 225	2700.5	-8.47314014573801	-22.063492063492063		-35.301868711068515	2752.8625	3296.9575	N	N	주의	DAIICHI SANKYO COMPANY LIMITED	JPX	JPY	Healthcare	Drug Manufacturers - General	Drug Manufacturers - General	Daiichi Sankyo Company, Limited manufactures and sells pharmaceutical products in Japan, the United States, Europe, and internationally. The company offers Enhertu to treat patients with HER2 positive and low breast cancer, HER2 positive gastric or gastroesophageal junction adenocarcinoma, and HER2 positive solid tumors; Turalio, an oral small molecule that targets colony stimulating factor 1 receptor, KIT proto-oncogene receptor tyrosine kinase, and FMS-like tyrosine kinase 3 harboring an inter	4923981824000.0	3.7	140.43	47.33947422171963	64.06405138615001		801618000000.0	100933000000.0	399000000.0	101332000000.0	1623416000000.0	385.065125842686	-73.65689120888159	-2.7275279099752487	16.48817826787235	64.06405138615001	0.257370208582171	4.109856788617458	매우 유망	안심(>=2)	60.0	8425.800000000001	212.00888724310317	보류	충분
4502.T	4502.T	Japan Nikkei 225	5104.0	-8.151880511067123	18.33990261998608		-13.344651952461795	5480.475	4900.87	N	Y	상승전환/양호	TAKEDA PHARMACEUTICAL CO LTD	JPX	JPY	Healthcare	Drug Manufacturers - Specialty & Generic	Drug Manufacturers - Specialty & Generic	Takeda Pharmaceutical Company Limited engages in the research, development, manufacture, marketing, and out-licensing of pharmaceutical products in Japan and internationally. It offers pharmaceutical products in the areas of gastroenterology, rare diseases, plasma-derived therapies, immunology, oncology, and neuroscience. The company provides its products under the Entyvio, Gattex/Revestive, Takecab/Vocinti, EOHILIA, Alofisel, Dexilant, Pantoloc/Controloc, Adynovate/Adynovi, Feiba Fiber, Recombi	7993974325248.0	4.0	119.43	-25.08485635155865	-22.298100827854515		426065000000.0	3966326000000.0	548939000000.0	4515265000000.0	6935084000000.0	-2240.9029418563437	428.8778354407651	8.402778907538503	61.49964784272246	-22.298100827854515		-0.2975317984689861	판정불가	불리(<1)	0.0	0.0	-100.0	보류	일부부족
4503.T	4503.T	Japan Nikkei 225	2267.5	-6.475561971540522	22.303128371089542		-14.675446848541862	2455.075	2054.975	N	Y	상승전환/양호	ASTELLAS PHARMA	JPX	JPY	Healthcare	Drug Manufacturers - General	Drug Manufacturers - General	Astellas Pharma Inc. manufactures, markets, imports, and exports pharmaceuticals in Japan and internationally. The company offers XTANDI, a treatment for prostate cancer; XOSPATA, a treatment for acute myeloid leukemia; VYLOY, a treatment for gastric cancer; and PADCEV, a treatment for patients with metastatic urothelial cancer. It also provides VEOZAH, a treatment for vasomotor symptoms due to menopause; IZERVAY, a treatment for geographic atrophy secondary to age-related macular degeneration; 	4001297858560.0	3.53	162.13	197.72367263127015	-25.772893828559905		248254000000.0	564893000000.0	266533000000.0	831426000000.0	1513255000000.0	-176.74594940951175	76.57415173713801	3.377029845077751	15.075840062971146	-25.772893828559905		-1.4753999601781578	판정불가	불리(<1)	0.0	0.0	-100.0	보류	일부부족
9983.T	9983.T	Japan Nikkei 225	75090.0	11.392968402314207	29.53251681904434		-0.8843717001056017	70526.75	58565.8	Y	Y	상승전환/양호	FAST RETAILING CO LTD	JPX	JPY	Consumer Cyclical	Apparel Retail	Apparel Retail	Fast Retailing Co., Ltd. operates as an apparel designer and retailer in Japan and internationally. The company operates through UNIQLO Japan, UNIQLO International, GU, and Global Brands segments. It manufactures and retails clothing for men, women, children, and babies. The company operates stores and franchises under the UNIQLO, GU, PLST, Theory, COMPTOIR DES COTONNIERS, J Brand, and PRINCESSE TAM.TAM brand names. It sells its products through online; and provides real estate leasing services.	23169469513728.0	85.0	1554.36	16.400537634408607	16.57378386379136		2692641000000.0	240000000000.0	130000000000.0	513500000000.0	2273115000000.0	7993.23122880618	1309.57612821085	1.744008693848515	43.166813846981285	16.57378386379136	2.6045237588314127	2.3530526071220463	매우 불리	안심(>=2)	41.64756772758272	64735.31337304547	-13.789701194505966	보류	충분
