티커	종목코드	유니버스	현재가	3M수익률(보조,%)	6M수익률(보조,%)	12M수익률(보조,%)	52주고점대비(보조,%)	40일이평(보조)	200일이평(보조)	40일선상회(보조)	200일선상회(보조)	추세판정(보조)	종목명	시장	통화	섹터	산업	업종	사업설명	시가총액	배당수익률(%)	EPS(FY)	EPS Growth 1Y(%)	EPS Growth 3Y CAGR(%)	EPS Growth 5Y CAGR(%)	현금및단기투자	장기부채	단기위험부채	총부채	주주지분	주당순현금(린치식)	주당잉여현금흐름	잉여현금흐름수익률(%)	순현금차감PER(린치식)	사용연성장률(%)	린치PER배수	배당감안점수	린치PER판정	배당감안점수판정	그레이엄적정PER(3년)	그레이엄내재가치(3년)	그레이엄괴리율(3년,%)	종합판정	데이터상태
7201.T	7201.T	Japan Nikkei 225	374.1000061035156	-19.340229420077826	2.802971249824404		-19.340229420077826	356.37499923706054	370.2609999084473	Y	Y	상승전환/양호	NISSAN MOTOR CO	JPX	JPY	Consumer Cyclical	Auto Manufacturers	Auto Manufacturers	Nissan Motor Co., Ltd., together with its subsidiaries, manufactures and sells vehicles and automotive parts in Japan, the United States, rest of North America, Europe, rest of Asia, and internationally. It operates through Automobile and Sales Financing segments. The company offers vehicle and vehicle parts; drivetrains; electrified power trains and automobile transmissions; engines, axles, and engine parts for automobiles and forklifts; automotive lithium-ion batteries; and motorsports. It als	1327925952512.0	9.355787070026215	-152.6				2433513000000.0	4369888000000.0	3615743000000.0	8099861000000.0	4958543000000.0	-553.8224118566981	-178.56799032389625	-47.73268842836786					판정불가	판정불가				보류	일부부족
7269.T	7269.T	Japan Nikkei 225	1911.0	-17.20103986135182	-16.38591117917305		-22.04772588211299	1834.2	2099.085	Y	N	주의	SUZUKI MOTOR CORP	JPX	JPY	Consumer Cyclical	Auto Manufacturers	Auto Manufacturers	Suzuki Motor Corporation engages in the manufacture and sale of automobiles, motorcycles, outboard motors, electric wheelchairs, and other products in Japan and internationally. It offers mini passenger cars and commercial vehicles, compact passenger cars and automobile engines, foundry and machining of engine components, motorcycles and motorcycle engines, outboard motors, motorized wheelchairs, and electro senior vehicles. The company is also involved in the development and testing of motorcyc	3706134986752.0	2.72	227.6	31.239018727702295	37.41370038279079		1505214000000.0	427465000000.0	297834000000.0	725299000000.0	2970660000000.0	558.6293380509051	138.51895286385042	7.248506167653083	5.941874613133106	37.41370038279079	0.1588154754098099	6.7543835903377625	매우 유망	안심(>=2)	60.0	13656.0	614.5996860282575	매우 유망	충분
7270.T	7270.T	Japan Nikkei 225	2464.5	-19.775390625	-30.06526674233825		-31.50361311839911	2479.4125	3017.6925	N	N	주의	SUBARU CORPORATION	JPX	JPY	Consumer Cyclical	Auto Manufacturers	Auto Manufacturers	Subaru Corporation manufactures and sells automobiles and aerospace products in Japan, Rest of Asia, North America, Europe, and Internationally. It operates through three segments: Automotive, Aerospace, and Others. The company manufactures, sells, and repairs automobiles and related components, aircraft, space-related devices, and the parts; and rents and manages real estate properties. It also involved in the shipping, land freight, and warehousing of vehicles; leasing and rental of vehicles; 	1764246290432.0	4.71	125.44	-12.21084230972983	69.02526664269493		2980398000000.0	352500000000.0	47000000000.0	399500000000.0	2714517000000.0	3673.1811254665167	317.0799597053723	12.865894084210684	-9.635531931333839	69.02526664269493	-0.13959427322768023		판정불가	판정불가	60.0	7526.4	205.392574558734	보류	충분
4901.T	4901.T	Japan Nikkei 225	3194.0	3.53322528363047	-4.968759297828029		-15.278514588859416	3084.4125	3300.88	Y	N	상승전환/양호	FUJIFILM HOLDINGS CORPORATION	JPX	JPY	Industrials	Conglomerates	Conglomerates	FUJIFILM Holdings Corporation provides products and services in the fields of healthcare, electronics, business innovation, and imaging in Japan, the Americas, Europe, Asia, and internationally. The Healthcare segment offers products and services, such as medical devices, biomedical contract development and manufacturing organization, pharmaceutical, regenerative medicine, and cosmetics and supplements in the areas of prevention, diagnosis, and treatment; equipment and materials for medical syst	3776221544448.0	2.35	224.54	7.162774271176842	7.308813587292584		172111000000.0	470805000000.0	215103000000.0	802285000000.0	3348480000000.0	-249.55623923808875	-108.48269724665094	-3.3964526376534425	15.336048094941164	7.308813587292584	2.0982951489698785	0.6298111174076648	매우 불리	불리(<1)	23.117627174585166	5190.8320057813535	62.518221846629714	보류	충분
5108.T	5108.T	Japan Nikkei 225	3349.0	-6.582984658298463	-7.101248266296811		-12.260937909352897	3344.475	3445.195	Y	N	주의	BRIDGESTONE CORP	JPX	JPY	Consumer Cyclical	Auto Parts	Auto Parts	Bridgestone Corporation, together with its subsidiaries, manufactures and sells tires and rubber products in Japan, China, India, the Asia Pacific, the United States, the Americas, Europe, the Middle East, and Africa. The company offers passenger car, motorcycle, trucks, buses, construction and mining vehicles, agricultural machinery, and aircraft tires; automotive components; automotive maintenance and repair services; synthetic rubber; retreading materials; and raw materials for tires. It also	4218984071168.0	3.88	119.22	14.833905870051133	2.907072532622368		740830000000.0	392312000000.0	94958000000.0	827015000000.0	3661793000000.0	277.6424386158517	297.37434790626435	8.879496802217508	25.762099994834326	2.907072532622368	8.861870388763656	0.26345183560281477	매우 불리	불리(<1)	14.314145065244736	1706.5323746784775	-49.043524195924824	보류	충분
6301.T	6301.T	Japan Nikkei 225	6385.0	-16.008945014469877	21.434005325218706		-18.130529555071163	6599.65	5808.18	N	Y	상승전환/양호	KOMATSU	JPX	JPY	Industrials	Farm & Heavy Construction Machinery	Farm & Heavy Construction Machinery	Komatsu Ltd. manufactures and sells construction, mining, and utility equipment in Japan, the Americas, Europe, China, rest of Asia, Oceania, the Middle East, Africa, and CIS countries. It operates in three segments: Construction, Mining and Utility Equipment; Retail Finance; and Industrial Machinery and Others. The company offers construction and mining equipment, including excavators, hydraulic and mini excavators, wheel loaders, bulldozers, motor graders, dump trucks, backhoe loaders, rope an	5886945263616.0	2.98	413.75	11.739946012719038	25.028774565435775		386879000000.0	496189000000.0	654408000000.0	1220702000000.0	3173399000000.0	-121.25037432489658	345.31787148323303	5.408267368570604	15.725076433413646	25.028774565435775	0.628279918071964	1.7811534769981114	헐값	양호(>=1.5)	58.55754913087155	24228.185952898104	279.45475259041666	양호	충분
6326.T	6326.T	Japan Nikkei 225	2747.5	-8.629863651479885	30.05917159763314		-15.252930289944477	2654.475	2293.0975	Y	Y	상승전환/양호	KUBOTA CORP	JPX	JPY	Industrials	Farm & Heavy Construction Machinery	Farm & Heavy Construction Machinery	Kubota Corporation engages in the manufacture and sale of agricultural and construction machinery in Japan, North America, Europe, Asia, and internationally. The company offers tractors, power tillers, combine harvesters, rice transplanters, turf equipment, utility vehicles, other agricultural machineries, implements, attachments, post-harvest machineries, vegetable production equipment, intermediate management machines, and other equipment for agricultural use, weighing and measuring control sy	3070260936704.0	1.89	163.48	-18.985666364342535	6.06183769287576		596155000000.0	1381640000000.0	860439000000.0	2242079000000.0	2622985000000.0	-690.6308227835013	124.85489694612315	4.544309261005393	21.030895661753743	6.06183769287576	3.469392736541021	0.3781026648017075	매우 불리	불리(<1)	20.62367538575152	3371.558452062658	22.71368342357263	보류	충분
6367.T	6367.T	Japan Nikkei 225	24470.0	23.057581091274827	21.19861317483902		-5.081458494957336	21866.375	19644.95	Y	Y	상승전환/양호	DAIKIN INDUSTRIES	JPX	JPY	Industrials	Building Products & Equipment	Building Products & Equipment	Daikin Industries,Ltd. manufactures, distributes, and sells air-conditioning and refrigeration equipment, and chemical products in Japan, the Americas, China, Asia, Europe, Europe, and internationally. It offers air-conditioning and refrigeration equipment products, such as split/multi-split typeair conditioners, unitary, air to water heat pump systems, heating systems, air purifiers, skyair, multi-split type air conditioners, ventilations, control systems, packaged air-conditioning systems, air	6774890430464.0	1.47	939.65	1.7079570206407046	6.739137570446063		802663000000.0	414920000000.0	397373000000.0	986849000000.0	2805493000000.0	1324.0707061809235	916.7583738065204	3.7464584135942802	24.63250071177468	6.739137570446063	3.655141396697182	0.33326448120316027	매우 불리	불리(<1)	21.978275140892126	20651.886236139286	-15.603243824522739	보류	충분
6273.T	6273.T	Japan Nikkei 225	66930.0	-7.936726272352135	24.45146894756416		-20.84910122989593	70046.0	58691.15	N	Y	상승전환/양호	SMC CORP	JPX	JPY	Industrials	Specialty Industrial Machinery	Specialty Industrial Machinery	SMC Corporation manufactures, processes, and sells automatic control equipment worldwide. The company offers air management system, directional control valves, air cylinders, rotary actuators, air grippers, magnet grippers, electric actuators/cylinders, vacuum equipment, air grippers for collaborative robots, compact compressor, air preparation equipment, modular F.R.L., pressure control equipment, booster regulators, lubrication equipment, gas generator, fittings and tubing, flow control equipm	4227791585280.0	1.49	2637.04	-12.324403743810318	-6.779115212428066		715319000000.0	0.0	5041000000.0	5041000000.0	1928280000000.0	11329.262921070775	1407.2746950504916	2.1026067459293163	21.084525482711385	-6.779115212428066		-0.25085294031231414	판정불가	불리(<1)	0.0	0.0	-100.0	보류	일부부족
6146.T	6146.T	Japan Nikkei 225	69780.0	-2.7049637479085287	45.80025073129963		-12.775000000000002	69059.25	56341.85	Y	Y	상승전환/양호	DISCO CORPORATION	JPX	JPY	Technology	Semiconductor Equipment & Materials	Semiconductor Equipment & Materials	Disco Corporation manufactures and sells precision cutting, grinding, and polishing machines in Japan and internationally. Its precision machines include dicing saws, laser saws, grinders, polishers, wafer mounters, die separators, surface planers, and waterjet saws. The company also offers precision processing tools, such as dicing blades, grinding wheels, and dry polishing wheels; and other products, such as accessory equipment, cut-off wheels, and related products. In addition, it is involved	7257193971712.0	72.0	1249.06	47.13021792055103	23.22934390915492		229167000000.0	0.0	0.0	0.0	492352000000.0	2112.877756062548	492.6516907645787	0.7060070088343059	54.174436971752726	23.22934390915492	2.332155276688724	1.7578280316749535	매우 불리	양호(>=1.5)	54.95868781830984	68646.69860633809	-1.6241063251102195	보류	충분
7735.T	7735.T	Japan Nikkei 225	11035.0	4.005655042412815	86.0876897133221		-9.586235149528877	10449.425	8123.3975	Y	Y	상승전환/양호	SCREEN HOLDINGS CO LTD	JPX	JPY	Technology	Semiconductor Equipment & Materials	Semiconductor Equipment & Materials	SCREEN Holdings Co., Ltd. develops, manufactures, and markets semiconductor production equipment in Japan, Taiwan, South Korea, China, the United States, Europe, and internationally. It operates through Semiconductor Production Equipment, Graphic Arts Equipment, Display Production Equipment and Coater, and Printed Circuit Board (PCB)-Related Equipment segments. The company offers wafer cleaning systems, such as wet stations, spin processors, and spin scrubbers; coat/develop trackers, and spray c	2026075979776.0	2.08	486.64	40.930021677836194	29.8024843823244		260397000000.0	757000000.0	1013000000.0	4562000000.0	420639000000.0	1373.118513232713	241.51210577645318	2.1886008679334226	19.85426904234606	29.8024843823244	0.6661950992958647	1.6058251408966016	헐값	양호(>=1.5)	60.0	29198.399999999998	164.59809696420479	양호	충분
7741.T	7741.T	Japan Nikkei 225	26300.0	-4.084609773887671	7.281256373648781		-12.420912420912423	28082.0	24430.1	N	Y	상승전환/양호	HOYA CORP	JPX	JPY	Healthcare	Medical Instruments & Supplies	Medical Instruments & Supplies	HOYA Corporation, a med-tech company, provides high-tech and medical products internationally. It operates through two segments: Life Care, and Information and Communications. It offers life care products, including eyeglasses and contact lenses; medical endoscopes; intraocular lenses; laparoscopic surgical instruments; automatic endoscope cleaning devices; and other medical related products, such as prosthetic ceramic fillers and metallic implants for orthopedics. The company also operates Eyec	8687341535232.0	1.12	744.29	11.427090684544815	7.101464551222003		543101000000.0	28007000000.0	9276000000.0	37283000000.0	974023000000.0	1539.8256463002429	559.590099198571	2.127719008359586	33.266837326445014	7.101464551222003	4.684503750810181	0.24713694513684542	매우 불리	불리(<1)	22.702929102444006	16897.56310165805	-35.75071064008347	보류	충분
7733.T	7733.T	Japan Nikkei 225	1818.5	16.384	-13.957889756328367		-14.05954631379962	1610.85	1791.115	Y	Y	상승전환/양호	OLYMPUS CORPORATION	JPX	JPY	Healthcare	Medical Devices	Medical Devices	Olympus Corporation, together with its subsidiaries, manufactures and sells medical equipment in Japan, America, the Middle East, Asia, and Oceania. It operates through Endoscopic Solutions Business, Therapeutic Solutions Business, and Other segments. The company offers gastrointestinal endoscopy system products comprising video endoscopy and ultrasound systems; GI endotherapy products consisting of CRC devices and HPB devices/hemostasis products; endoscopic solutions ecosystem products, includi	1955557933056.0	1.65	61.28	-51.41322361748968	0.6048713093102842		257134000000.0	134117000000.0	94985000000.0	229102000000.0	751733000000.0	111.72165916656574	113.75325928326187	6.255334577028422	27.85212697182497	0.6048713093102842	46.046368116854275	0.08095867549330424	매우 불리	불리(<1)	9.709742618620568	595.0130276690685	-67.28000947654284	보류	충분
6971.T	6971.T	Japan Nikkei 225	3106.0	18.84446145016261	50.996596985901796		0.0	2691.3625	2283.9775	Y	Y	상승전환/양호	KYOCERA CORP	JPX	JPY	Industrials	Conglomerates	Conglomerates	Kyocera Corporation develops and sells products based on fine ceramic technologies in Japan, China, rest of Asia, Europe, the United States, and internationally. It operates through Core Components Business, Electronic Components Business, and Solutions Business segments. The Core Components Business segment offers components, such as fine ceramic components for semiconductor processing equipment, automotive camera modules, and ceramic packages, as well as organic packages and boards to protect 	4144559030272.0	1.8	102.81	-76.15905178384155	-45.44565207097372		502030000000.0	202577000000.0	44386000000.0	342382000000.0	3217788000000.0	227.3050373255043	53.19089535101464	1.7125207775600333	28.000145537151013	-45.44565207097372		-1.5587651861689082	판정불가	불리(<1)	0.0	0.0	-100.0	보류	일부부족
6963.T	6963.T	Japan Nikkei 225	5030.0	101.96747641035935	140.21012416427888		0.0	3752.05	2635.6275	Y	Y	상승전환/양호	ROHM CO LTD	JPX	JPY	Technology	Semiconductors	Semiconductors	ROHM Co., Ltd. manufactures and sells electronic components worldwide. The company operates through: LSI, semiconductor element, Module, and others segments. The company provides ICs comprising memory, amplifiers and linear, power management, motor/actuator drivers, resistors, clocks and timers, switches and multiplexers, logic, data converters, sensors and MEMS, display drivers, interfaces, wireless LSIs, audio and video products, speech synthesis LSI, and microcontrollers. It also offers discr	1982676074496.0	99.0	-410.45				300602000000.0	300000000000.0	100000000000.0	400000000000.0	889031000000.0	1.5594438131215482	-134.27795597503086	-2.6695418682908723					판정불가	판정불가				보류	일부부족
6723.T	6723.T	Japan Nikkei 225	4297.0	43.977215614005694	121.095960895292		0.0	3018.975	2296.935	Y	Y	상승전환/양호	RENESAS ELECTRONICS CORP	JPX	JPY	Technology	Semiconductors	Semiconductors	Renesas Electronics Corporation engages in the design, research, development, manufacturing, sale, and service of semiconductors in Japan, China, rest of Asia, Europe, North America, and internationally. The company operates through Automotive Business and Industrial/Infrastructure/IoT Business segments. It offers microcontrollers and microprocessors; amplifiers, audio and video, data converters, power line communication, and switches and multiplexer products; custom ASICS and processor IP solut	8325798821888.0	65.0	-28.79	162.1			373099000000.0	964089000000.0	242478000000.0	1206567000000.0	2443034000000.0	-325.7409006245188	175.87385024717142	4.092945083713554		162.1			판정불가	판정불가				판정불가	일부부족
6702.T	6702.T	Japan Nikkei 225	3308.0	-10.594594594594597	-21.870571563533304		-28.64538395168249	3405.725	3762.855	N	N	주의	FUJITSU	JPX	JPY	Technology	Information Technology Services	Information Technology Services	Fujitsu Limited provides digital services in Japan, Europe, the Americas, the Asia Pacific, East Asia, and internationally. The company operates through three segments: Service Solutions, Hardware Solutions, and Ubiquitous Solutions. The company offers consulting services; data driven management; network and communication services; enterprise cyber security; multi cloud and hybrid IT services. It also provides assessment and consultative; SAP landscape, integrated systems; storage solutions; ser	5846202843136.0	1.66	172.68	-13.624360455520712	6.359133040098119		236079000000.0	0.0	146992000000.0	247092000000.0	1740965000000.0	136.08598454809385	82.42206386262502	2.4915980611434407	18.368739955130334	6.359133040098119	2.8885604121355053	0.43656413339655337	매우 불리	불리(<1)	21.218266080196237	3663.9701867282865	10.76088835333393	보류	충분
6701.T	6701.T	Japan Nikkei 225	4106.0	2.5474525474525445	-30.170068027210885		-32.400395126769844	4142.525	4796.57	N	N	주의	NEC CORP	JPX	JPY	Technology	Information Technology Services	Information Technology Services	NEC Corporation provides information technology services and social infrastructure in Japan and internationally. The company offers systems integration services, including system construction and consulting, maintenance support, and outsourcing, as well as cloud, system equipment, software services. It also provides core network equipment, mobile phone base stations, optical transmission systems, and marine systems, as well as software and services for telecommunications carriers. In addition, t	5464113283072.0	97.0	202.84	17.1628065622889	7.4336089765803415		604275000000.0	255842000000.0	233886000000.0	666359000000.0	1952018000000.0	262.2758212711268	145.8661937112236	3.552513241871008	18.94953746168839	7.4336089765803415	2.5491706009004638	5.51114290719344	매우 불리	안심(>=2)	23.367217953160683	4739.806489619113	15.436105446154723	보류	충분
5802.T	5802.T	Japan Nikkei 225	12265.0	41.77551728123916	105.9613769941226		-3.9921722113502978	10372.5	6978.31	Y	Y	상승전환/양호	SUMITOMO ELECTRIC INDUSTRIES	JPX	JPY	Consumer Cyclical	Auto Parts	Auto Parts	Sumitomo Electric Industries, Ltd. manufactures and sells various materials in Japan and internationally. The company operates in Environment and Energy, Infocommunications, Automotive, Electronics, and Industrial Materials segments. It offers vanadium redox flow battery, high voltage cable, sEMSA, industrial electric wires and cables, traveling cable, railway and transport machinery products, aluminum materials, heat shrink tubing and heat-resistant tubing/tapes, thermal control devices, and wa	9312243023872.0	32.0	473.43	29.41966164183192	26.2443096533858		295903000000.0	341281000000.0	346710000000.0	756562000000.0	2290394000000.0	-58.182899878016315	259.5510211866315	2.1161925901885974	26.029577550805858	26.2443096533858	0.9918179557619936	2.237620243344387	헐값	안심(>=2)	60.0	28405.8	131.60048919690172	양호	충분
5713.T	5713.T	Japan Nikkei 225	9800.0	5.150214592274671	91.40625		-24.904214559386972	9834.75	6971.87	N	Y	상승전환/양호	SUMITOMO METAL MINING CO	JPX	JPY	Basic Materials	Other Industrial Metals & Mining	Other Industrial Metals & Mining	Sumitomo Metal Mining Co., Ltd., together with its subsidiaries, engages in the resource development, manufacture, and sale of non-ferrous metal products in Japan and internationally. It operates through Resource, Smelting, and Material segments. The company is involved in the development and operation of the Hishikari Mine and other mines; smelting and refining business, which provides metal products, such as copper, nickel and cobalt, silver, platinum, rhodium, ruthenium, palladium, slag sand,	2651387330560.0	2.12	649.74	-71.86566782136823	-61.14388471214129		168322000000.0	367258000000.0	193045000000.0	560303000000.0	1845737000000.0	-735.3028879167291	101.6005438083356	1.0367402429422001	16.214644146761362	-61.14388471214129		-3.6401591165311173	판정불가	불리(<1)	0.0	0.0	-100.0	보류	일부부족
5401.T	5401.T	Japan Nikkei 225	556.2000122070312	-17.599998191550924	-10.159904031554124		-20.31518449755999	578.1800018310547	617.2815014648437	N	N	주의	NIPPON STEEL CORPORATION	JPX	JPY	Basic Materials	Steel	Steel	Nippon Steel Corporation engages in the steelmaking and steel fabrication, engineering, chemicals and materials, and system solutions businesses in Japan and internationally. The company's Steelmaking and Steel Fabrication segment engages in the manufacture and sale of steel products. Its Engineering and Construction segment engages in the design, manufacture, sale, construction, and supervision of various plants and facilities, energy pipelines, water facilities, industrial machinery and equipm	2913658732544.0	4.31	3.28	-36.249572238847264	-18.091218544964416		755376000000.0	0.0	473466000000.0	2507492000000.0	5383311000000.0	144.5337750975876	68.95880728457811	12.398203123179718	125.50799911873281	-18.091218544964416		-0.10980350767863918	판정불가	불리(<1)	0.0	0.0	-100.0	보류	일부부족
5411.T	5411.T	Japan Nikkei 225	1630.0	-26.774483378256964	-10.266996972199284		-30.902924968206868	1762.375	1895.915	N	N	주의	JFE HOLDINGS INC	JPX	JPY	Basic Materials	Steel	Steel	JFE Holdings, Inc., through its subsidiaries, engages in steel, engineering, and trading businesses in Japan and internationally. It operates through the Steel, Engineering, and Trading segments. The Steel segment produces and sells various steel products, processed steel products, and raw materials, as well as transportation, facility maintenance, and construction services. Its Engineering segment is involved in engineering activities for steel structures, industrial machines, energy and enviro	1044217790464.0	4.91	105.46	-53.465943339361054	-31.677942320653262		217073000000.0	0.0	395415000000.0	1766450000000.0	2529578000000.0	341.2366089747449	156.49318736114043	9.600809040560762	12.220400066615353	-31.677942320653262		-2.190430933090319	판정불가	불리(<1)	0.0	0.0	-100.0	보류	일부부족
4188.T	4188.T	Japan Nikkei 225	1089.5	-2.5927581582476544	29.011249259917115		-6.118052563550192	960.3174987792969	918.4070001220703	Y	Y	상승전환/양호	MITSUBISHI CHEMICAL GROUP CORP	JPX	JPY	Basic Materials	Specialty Chemicals	Specialty Chemicals	Mitsubishi Chemical Group Corporation provides performance products, industrial materials, industrial gases, and others in Japan and internationally. It operates in five segments: Specialty Materials, MA & Derivatives, Basic Materials & Polymers, Pharma, and Industrial Gases. The company provides chemicals; film & sheet/molding/composite; information/electronics/ display/ battery; environment & living solutions; polymers/resins, high performance chemicals; carbon/carbon fibers & composite materi	1519535390720.0	2.94	-60.36	-62.35660055520251	-36.65996406741831		458350000000.0	1612920000000.0	428067000000.0	2040987000000.0	1740570000000.0	-849.8562302314549	140.351374834919	12.882182178514823		-36.65996406741831			판정불가	판정불가				판정불가	일부부족
4005.T	4005.T	Japan Nikkei 225	603.0	2.9888983774551736	34.029786214831944		-3.3033958294468646	536.1475006103516	481.0884996032715	Y	Y	상승전환/양호	SUMITOMO CHEMICAL COMPANY	JPX	JPY	Basic Materials	Chemicals	Chemicals	Sumitomo Chemical Company, Limited engages in Agro & Life Solutions, ICT & Mobility Solutions, Advanced Medical Solutions, Essential & Green Materials, and Sumitomo Pharma. The Agro & Life Solutions segment offers crop protection chemicals, fertilizers, agricultural materials, household insecticides, products for control of infectious diseases, and feed additives, etc. The ICT & Mobility Solutions segment provides optical products, semiconductor processing materials, compound semiconductor mater	979948797952.0	2.65	37.14		-38.026282243258926		299868000000.0	1033236000000.0	252892000000.0	1286128000000.0	900790000000.0	-444.0850257438706	-123.64559321737644	-20.50507350205248	28.192919379210302	-38.026282243258926		-1.2547931545303428	판정불가	불리(<1)	0.0	0.0	-100.0	보류	일부부족
