티커	종목코드	유니버스	현재가	3M수익률(보조,%)	6M수익률(보조,%)	12M수익률(보조,%)	52주고점대비(보조,%)	40일이평(보조)	200일이평(보조)	40일선상회(보조)	200일선상회(보조)	추세판정(보조)	종목명	시장	통화	섹터	산업	업종	사업설명	시가총액	배당수익률(%)	EPS(FY)	EPS Growth 1Y(%)	EPS Growth 3Y CAGR(%)	EPS Growth 5Y CAGR(%)	현금및단기투자	장기부채	단기위험부채	총부채	주주지분	주당순현금(린치식)	주당잉여현금흐름	잉여현금흐름수익률(%)	순현금차감PER(린치식)	사용연성장률(%)	린치PER배수	배당감안점수	린치PER판정	배당감안점수판정	그레이엄적정PER(3년)	그레이엄내재가치(3년)	그레이엄괴리율(3년,%)	종합판정	데이터상태
4005.T	4005.T	Japan Nikkei 225	515.7000122070312	1.6357939318856651	18.27981931353928		-17.302752983196147	562.1525009155273	501.21799972534177	N	Y	상승전환/양호	SUMITOMO CHEMICAL COMPANY	JPX	JPY	Basic Materials	Chemicals	Chemicals	Sumitomo Chemical Company, Limited engages in Agro & Life Solutions, ICT & Mobility Solutions, Advanced Medical Solutions, Essential & Green Materials, and Sumitomo Pharma. The Agro & Life Solutions segment offers crop protection chemicals, fertilizers, agricultural materials, household insecticides, products for control of infectious diseases, and feed additives, etc. The ICT & Mobility Solutions segment provides optical products, semiconductor processing materials, compound semiconductor mater	847999926272.0	3.1	37.13	57.93060558161229	105.8514181597038		303691000000.0	910033000000.0	241422000000.0	1151455000000.0	1008644000000.0	-367.16587135002885	68.5431760882865	13.291288436264256	23.777696836979803	105.8514181597038	0.22463276591254638	4.582084585680275	매우 유망	안심(>=2)	60.0	2227.8	331.9953359057969	매우 유망	충분
3407.T	3407.T	Japan Nikkei 225	1803.5	15.608974358974347	31.498359460444767		-4.298222340143276	1728.7625	1485.525	Y	Y	상승전환/양호	ASAHI KASEI CORP	JPX	JPY	Industrials	Conglomerates	Conglomerates	Asahi Kasei Corporation engages in material, homes, and healthcare businesses in Japan, the United States, China, and internationally. The company offers Pimel, a photosensitive PI material applied for semiconductor applications, such as buffer coating, passivation layers, and dielectric layers; Sunfort, a dry film photoresist; Novacure, a latent curing agent for epoxy resin; glass fabric for printed circuit boards; plastic optical fiber; sensors and devices; artificial suede products under the 	2421300133888.0	2.44	117.05	17.6277991362771			377023000000.0	837618000000.0	129926000000.0	1011221000000.0	2088459000000.0	-340.69531078718956	68.09098261857802	3.7754911349364026	18.318627174602216	17.6277991362771	1.0391896931082807	1.0954859741946175	보통	보통(1~1.5)	8.5	994.925	-44.83365677848627	보류	충분
3382.T	3382.T	Japan Nikkei 225	1953.5	-6.998333730064266	-12.926231334967685		-17.747368421052634	1892.4375	2058.1775	Y	N	주의	SEVEN & I HOLDINGS CO LTD	JPX	JPY	Consumer Defensive	Grocery Stores	Grocery Stores	Seven & i Holdings Co., Ltd. operates convenience stores in Japan, North America, and internationally. It operates through Domestic Convenience Store Business, Overseas Convenience Store Business, Superstore Business, Financial-Related, and Others segments. The company is also involved in operating seven-eleven; online food shopping and internet shopping business; provision of multi-copy services, such as tickets; franchising and/or licensing activities; leasing, non-life insurance, life insuran	4524080627712.0	3.07	118.77	69.15894330552152	1.3788835802272414		461634000000.0	1648323000000.0	581693000000.0	3793778000000.0	3620448000000.0	-513.330901208645	113.51306178692491	5.810753098895567	20.769814778215416	1.3788835802272414	15.062776202464118	0.21419948264986394	매우 불리	불리(<1)	11.257767160454483	1337.0850056471788	-31.55438926812496	보류	충분
3092.T	3092.T	Japan Nikkei 225	1148.5	4.077933846850934	-15.271117668756917		-27.079365079365083	1055.3800003051758	1211.1160000610353	Y	N	상승전환/양호	ZOZO INC	JPX	JPY	Consumer Cyclical	Internet Retail	Internet Retail	ZOZO, Inc. operates online shopping Websites in Japan. It operates ZOZOTOWN a fashion online shopping website that includes services, such as ZOZOUSED, a website for secondhand/vintage apparel; ZOZOCOSME, an online cosmetic store; ZOZOSHOES, a shoe-specialized zone; and ZOZOVILLA that brings together domestic and international brands. It also operates WEAR, an outfit-sharing app; ZOZOFIT, a 3D body scanning technology solution; ZOZOMO, and online merges offline platform that offers fulfillment s	1016089477120.0	3.48	54.09	5.689586733118679	6.634099480033329		74416000000.0	0.0	20000000000.0	20000000000.0	106788000000.0	84.15005500392762	51.43131586874645	4.478129374727597	19.67738851906216	6.634099480033329	2.9660978974290724	0.5139960249417983	매우 불리	불리(<1)	21.768198960066655	1177.4418817500055	2.5199722899438726	보류	충분
1925.T	1925.T	Japan Nikkei 225	4452.0	-11.928783382789321	-15.473704195936966		-22.031523642732054	4433.8	5094.145	Y	N	주의	DAIWA HOUSE INDUSTRY CO	JPX	JPY	Real Estate	Real Estate - Development	Real Estate - Development	Daiwa House Industry Co., Ltd., together with its subsidiaries, engages in the construction work business in Japan, the United States, and internationally. It operates through Single-Family Houses Business; Rental Housing Business; Condominiums Business; Commercial Facilities Business; Logistics, Business and Corporate Facilities Business; Environmental and Energy Business; and Other Businesses segments. The Single-Family Houses segment engages in the construction of single-family houses; and sa	2735656140800.0	2.94	566.29	7.847830233373743	4.364573650556425		434761000000.0	1919808000000.0	1156897000000.0	3211157000000.0	2896742000000.0	-2397.762114311685	-491.7355751866407	-11.045273476788875	12.095855682268246	4.364573650556425	2.771371650636755	0.6038906086871113	매우 불리	불리(<1)	17.22914730111285	9756.693825147195	119.15305087931705	보류	충분
1928.T	1928.T	Japan Nikkei 225	3381.0	-4.599322799097061	-1.7722254503195867		-11.630946157867228	3328.125	3446.645	Y	N	주의	SEKISUI HOUSE	JPX	JPY	Consumer Cyclical	Residential Construction	Residential Construction	Sekisui House, Ltd. designs, constructs, and contracts built-to-order detached houses in Japan and internationally. It operates through Detached Houses, Rental Housing and Commercial Buildings, Architectural/Civil Engineering, Rental Housing Management, Remodeling, Development, and Overseas segments. It also engages in the design, construction, contracting, and sale of rental housing, office buildings, commercial buildings, and other properties; design, construction, and contracting of civil eng	2192341598208.0	4.32	396.59	6.609861969178477	7.946221780206719		435177000000.0	1253525000000.0	595364000000.0	1893674000000.0	2139611000000.0	-1262.418642773956	187.02538405908746	5.531658800919475	11.708360379167292	7.946221780206719	1.4734499870531805	1.0476464152941545	보통	보통(1~1.5)	24.39244356041344	9673.799191624366	186.12242507022674	보류	충분
4755.T	4755.T	Japan Nikkei 225	714.5	-4.003760349551122	-23.916513835047404		-32.33901515151515	748.2824966430665	876.2224990844727	N	N	주의	RAKUTEN GROUP INC	JPX	JPY	Consumer Cyclical	Internet Retail	Internet Retail	Rakuten Group, Inc. provides various services in e-commerce, fintech, digital content, and communications to various users in Japan, the Americas, Europe, rest of Asia, and internationally. It operates in three segments: Internet Services, FinTech, and Mobile. The company operates a range of e-commerce sites comprising Rakuten Ichiba, an Internet shopping mall; online cash-back sites; travel booking sites; portal sites; and digital content sites, as well as provides messaging services. It also o	1637658132480.0	2.5192442267319803	-82.24				5837566000000.0	5569622000000.0	0.0	5569622000000.0	992402000000.0	123.26687861962898	100.34778871296454	14.044477076692027					판정불가	판정불가				판정불가	일부부족
4689.T	4689.T	Japan Nikkei 225	423.5	9.828836435835008	1.0739856801909253		-25.05750870704182	413.725	421.4915013122559	Y	Y	상승전환/양호	LY CORPORATION	JPX	JPY	Consumer Cyclical	Internet Retail	Internet Retail	LY Corporation engages in the online advertising and e-commerce businesses in Japan. It operates through three segments: Media Business, Commerce Business, and Strategic Business. The Media Business segment offers advertising solutions, including search ads, account advertising, display advertising, and various digital content and membership services such as LINE Official Accounts, LINE promotional stamps, LINE flyers, LINE News, LINE Music, LYP Premium, and Yahoo! Email. The Commerce Business s	2975434276864.0	2.6	27.87	26.212491447561327	2.689572101075477		1068032000000.0	1961998000000.0	0.0	1961998000000.0	2998805000000.0	-130.33473598515425	96.64003003101173	22.81936954687408	19.872075205782355	2.689572101075477	7.388563852902893	0.2661811635825695	매우 불리	불리(<1)	13.879144202150954	386.8117489139471	-8.663105333188403	보류	충분
9201.T	9201.T	Japan Nikkei 225	2865.5	7.081464872944698	-3.2416005402667536		-11.284829721362232	2661.975	2846.1875	Y	Y	상승전환/양호	JAPAN AIRLINES CO LTD	JPX	JPY	Industrials	Airlines	Airlines	Japan Airlines Co., Ltd., together with its subsidiaries, provides scheduled and non-scheduled air transport services in Japan, Asia, Oceania, the United States, and Europe. It engages in full-service and low-cost carrier, and cargo and mail; air transport-related businesses, such as airport passenger service, ground handling, maintenance, cargo, and passenger sales; and airport peripheral businesses, such as baggage delivery and smartphone rental services, as well as offers in-flight meals. The	1225009004544.0	3.35	306.9	28.557147928772952	58.70666510625882		1072617000000.0	726034000000.0	149883000000.0	875917000000.0	1289639000000.0	806.3300544451405	918.691354074616	32.0604206621747	6.709579490240664	58.70666510625882	0.11428991032102323	9.248964886178422	매우 유망	안심(>=2)	60.0	18414.0	542.6103646833013	매우 유망	충분
9202.T	9202.T	Japan Nikkei 225	2999.0	0.3681392235609149	-0.7610853739245527		-11.871877754922123	2857.375	2949.805	Y	Y	상승전환/양호	ANA HOLDINGS INC	JPX	JPY	Industrials	Airlines	Airlines	ANA Holdings Inc., together with its subsidiaries, provides air transportation services in Japan and internationally. The company operates through Air Transportation, Airline Related, Travel Services, and Trade and Retail segments. Its Air Transportation segment offers domestic and international passenger, cargo and mail, and other transportation services. The Airline Related segment provides air transportation-related services, such as airport passenger and ground handling, and maintenance serv	1308352184320.0	2.0	321.19	10.487038235082702	23.629655911568648		1961140000000.0	978336000000.0	186318000000.0	1171731000000.0	1491999000000.0	2229.4930895375774	410.9595998871983	13.703221069929919	2.3957997150048964	23.629655911568648	0.1013895303414874	10.69774562166031	매우 유망	안심(>=2)	55.759311823137296	17909.333364473467	497.1768377617028	매우 유망	충분
9101.T	9101.T	Japan Nikkei 225	5198.0	-10.146931719965425	5.52172147787251		-17.60976382944999	5431.175	5334.875	N	N	중립	NIPPON YUSEN KABUSHIKI KAISHA	JPX	JPY	Industrials	Marine Shipping	Marine Shipping	Nippon Yusen Kabushiki Kaisha, together with its subsidiaries, provides logistics services in Japan, North America, Europe, Asia, and internationally. The company offers container ships transport, port cargo handling, and ship agency services; and operates container terminals and tugboats. It also provides logistics services, including land transportation by truck and rail, customs clearance, and ocean and air freight forwarding services; supply chain management services comprising collection, s	2104948817920.0	3.85	504.73	-55.673666075648875	-40.64287730442143		214584000000.0	731512000000.0	215156000000.0	1201462000000.0	3071993000000.0	-1280.9320592622773	418.4200968003109	8.049636337058693	12.836431476754457	-40.64287730442143		-2.8662854914973677	판정불가	불리(<1)	0.0	0.0	-100.0	보류	일부부족
9104.T	9104.T	Japan Nikkei 225	5234.0	-23.72486155639755	15.7196550961751		-25.46283110225007	5614.625	5212.045	N	Y	상승전환/양호	MITSUI O.S.K. LINES LTD	JPX	JPY	Industrials	Marine Shipping	Marine Shipping	Mitsui O.S.K. Lines, Ltd., together with its subsidiaries, provides maritime cargo transport and ship chartering services in Japan, North America, Europe, Singapore, and internationally. It operates through Dry Bulk Business; Energy Business; Container Ship Business; Automobile Transport, Port, and Logistics Business; Ferry/Domestic RORO Ship Business/Cruise Business; Real Estate Business; and Related Businesses segments. The company engages in the dry bulk shipping of raw materials, including i	1791270191104.0	3.92	619.71	-49.87919866883514	-35.5354135614651		210324000000.0	1975121000000.0	343388000000.0	2480199000000.0	2874366000000.0	-5135.957058297135	1312.4039778404263	25.074588800925223	16.73356418049916	-35.5354135614651		-1.8893412796246263	판정불가	불리(<1)	0.0	0.0	-100.0	보류	일부부족
9107.T	9107.T	Japan Nikkei 225	2444.0	-9.263040653424914	13.965959431102814		-14.991304347826084	2550.7	2358.4625	N	Y	상승전환/양호	KAWASAKI KISEN KAISHA	JPX	JPY	Industrials	Marine Shipping	Marine Shipping	Kawasaki Kisen Kaisha, Ltd. engages in the provision of marine, land, and air transportation services in Japan, the United States, Europe, Asia, and internationally. It offers dry bulk carrier, car carrier, liquefied natural gas carrier, crude oil and product, containerships, and liquefied gas business. The company also engages in the offshore and energy development business. In addition, it operates container terminals; and offers warehousing and cargo consolidation services. Kawasaki Kisen Kai	1571136077824.0	4.91	210.43	-56.45285935085007	-42.3728638591003		424549000000.0	178382000000.0	57635000000.0	296047000000.0	1802702000000.0	389.35199456060235	278.4619551213443	11.393697018058278	9.76404507645962	-42.3728638591003		-3.83681799558878	판정불가	불리(<1)	0.0	0.0	-100.0	보류	일부부족
4911.T	4911.T	Japan Nikkei 225	2630.5	-13.041322314049586	11.461864406779654		-24.95007132667618	2756.675	2723.3825	N	N	중립	SHISEIDO COMPANY LIMITED	JPX	JPY	Consumer Defensive	Household & Personal Products	Household & Personal Products	Shiseido Company, Limited produces and sells in Japan and internationally. It offers fragrances, skincare, and makeup products through retail channels. The company also engages in the restaurant and food businesses; and operates beauty salons. In addition, it operates and supports SABFA, a professional hair makeup training school. Further, the company manages childcare facilities. It serves its products under the BAUM, BENEFIQUE, Clé de Peau Beauté, Dr. Dennis Gross Skincare, Drunk Elephant, EFF	1046201499648.0	2.28	-101.8	127.1			148369000000.0	181617000000.0	30000000000.0	323159000000.0	600756000000.0	-83.19933493382449	163.81620735406298	6.22756918281935		127.1			판정불가	판정불가				판정불가	일부부족
2502.T	2502.T	Japan Nikkei 225	1573.5	1.2874155133569376	-3.614088820826955		-20.510229856024253	1526.125	1663.855	Y	N	상승전환/양호	ASAHI GROUP HLDGS	JPX	JPY	Consumer Defensive	Beverages - Brewers	Beverages - Brewers	Asahi Group Holdings, Ltd., together with its subsidiaries, manufactures and sells beer, alcohol and non-alcohol beverages, and food products in Japan, Europe, Oceania, and Southeast Asia. The company offers alcoholic beverage products, including beers, non-alcohol beer, new genre, wines, shochu, whiskey and spirits, ready-to-drink beverages, and happoshu products. It also provides non-alcoholic beverage products beverages, such as carbonated drinks, coffee, tea, lactic acid bacteria drinks, and	2264518098944.0	3.3	115.49	17.06984086351806	7.760084287882463		118119000000.0	828047000000.0	451129000000.0	1279176000000.0	2668801000000.0	-485.2990895921203	182.83685993064938	11.61975595364788	17.826643775150405	7.760084287882463	2.29722295709946	0.6204243730555584	매우 불리	불리(<1)	24.020168575764927	2774.089268815091	76.30055728090824	보류	충분
2503.T	2503.T	Japan Nikkei 225	2833.0	14.62674489176614	18.164754953076123		-0.9613703897919934	2673.4125	2450.145	Y	Y	상승전환/양호	KIRIN HOLDINGS COMPANY LIMITED	JPX	JPY	Consumer Defensive	Beverages - Brewers	Beverages - Brewers	Kirin Holdings Company, Limited engages in food and beverages, alcoholic beverages, pharmaceuticals, and health science businesses. The company's products include beer, wine, soft drinks, dairy products, margarine, jams, and honey. It engages in the management and operation of a chain of Kirin City beer pubs. The company also produces and sells pharmaceutical products. In addition, it manufactures and sells amino acids and nucleic acids for pharmaceutical and industrial use, as well as bulk phar	2245944410112.0	2.68	182.16	153.44762428281857	9.948278401174782		138070000000.0	842434000000.0	81000000000.0	923434000000.0	1286991000000.0	-881.417671159175	77.91009223408669	2.7500915013796927	20.390962182472414	9.948278401174782	2.049697581851395	0.6193076269853391	매우 불리	불리(<1)	28.396556802349565	5172.716787115996	82.58795577536169	보류	충분
4507.T	4507.T	Japan Nikkei 225	2805.5	-18.84582007520972	2.4278933917488033		-23.430676855895193	2929.0875	2957.595	N	N	중립	SHIONOGI & CO	JPX	JPY	Healthcare	Drug Manufacturers - Specialty & Generic	Drug Manufacturers - Specialty & Generic	Shionogi & Co., Ltd. engages in the research, development, manufacture, and distribution of pharmaceuticals, diagnostic reagents, and medical devices in Japan and internationally. It is also involved in consumer healthcare business; manufacturing, sale, analytical testing, and pharmaceutical engineering of medicinal drugs and investigational drugs; contracted monitoring of epidemiological components in sewage; promotion of implementation in social infrastructure; and business related to providin	2373370511360.0	2.71	240.99	20.37374952327866	3.514297446643022		1332893000000.0	0.0	660000000000.0	684394000000.0	1685215000000.0	1566.311954548225	214.18714580359855	7.634544494870737	5.142072473761463	3.514297446643022	1.4631864695099577	1.210464745178884	보통	보통(1~1.5)	15.528594893286044	3742.236083333004	33.38927404501886	보류	충분
4523.T	4523.T	Japan Nikkei 225	4145.0	-15.786265745631855	-9.557058695177833		-22.115745960165356	4115.175	4644.715	Y	N	주의	EISAI CO LTD	JPX	JPY	Healthcare	Drug Manufacturers - Specialty & Generic	Drug Manufacturers - Specialty & Generic	Eisai Co., Ltd. engages in the research, development, manufacture, and sale of pharmaceuticals in Japan. The company operates through pharmaceuticals business and other business segments. It offers Lenvima, a multi-kinase inhibitor which is involved in tumor angiogenesis or tumor malignancy; LEQEMBI, a humanized IgG1 monoclonal antibody against amyloid-beta (Aß) protofibrils; and Dayvigo, a novel small molecule compound. The company also provides prescription drugs; and over-the-counter drugs, a	1162530127872.0	3.86	136.79	-16.95992074602115	-11.396410387377		247207000000.0	134777000000.0	51304000000.0	186081000000.0	898992000000.0	398.35455863716214	71.41540944490474	1.7229290577781602	27.38976124981971	-11.396410387377		-0.2751542928263607	판정불가	불리(<1)	0.0	0.0	-100.0	보류	일부부족
4543.T	4543.T	Japan Nikkei 225	2247.0	7.306590257879653	-3.9743589743589713		-19.620819173671975	2208.3375	2269.14	Y	N	상승전환/양호	TERUMO CORP	JPX	JPY	Healthcare	Medical Instruments & Supplies	Medical Instruments & Supplies	Terumo Corporation engages in the manufacture and sale of medical products and equipment in Japan, Europe, China, the United States, Asia, and internationally. The company operates through four segments: Cardiac and Vascular Company, Medical Care Solutions Company, Blood and Cell Technologies Company, and Terumo Organ Technologies. The Cardiac and Vascular Company segment offers angiographic guidewires, angiographic catheters, introducer sheaths, vascular closure devices, PTCA balloon catheters,	3295335415808.0	1.6	92.13	16.187659217972605	15.017446890036545		280966000000.0	99910000000.0	279886000000.0	379796000000.0	1584509000000.0	122.74292020689023	87.37745361957558	3.888627219384761	23.05717008350277	15.017446890036545	1.5353588564245395	0.720706263164802	보통	불리(<1)	38.53489378007309	3550.2197639581336	57.99820934393119	보류	충분
