티커	종목코드	유니버스	현재가	3M수익률(보조,%)	6M수익률(보조,%)	12M수익률(보조,%)	52주고점대비(보조,%)	40일이평(보조)	200일이평(보조)	40일선상회(보조)	200일선상회(보조)	추세판정(보조)	종목명	시장	통화	섹터	산업	업종	사업설명	시가총액	배당수익률(%)	EPS(FY)	EPS Growth 1Y(%)	EPS Growth 3Y CAGR(%)	EPS Growth 5Y CAGR(%)	현금및단기투자	장기부채	단기위험부채	총부채	주주지분	주당순현금(린치식)	주당잉여현금흐름	잉여현금흐름수익률(%)	순현금차감PER(린치식)	사용연성장률(%)	린치PER배수	배당감안점수	린치PER판정	배당감안점수판정	그레이엄적정PER(3년)	그레이엄내재가치(3년)	그레이엄괴리율(3년,%)	종합판정	데이터상태
7203.T	7203.T	Japan Nikkei 225	2772.0	-18.181818181818176	-17.57359500446031		-29.716024340770787	2885.4625	3190.3625	N	N	주의	TOYOTA MOTOR CORP	JPX	JPY	Consumer Cyclical	Auto Manufacturers	Auto Manufacturers	Toyota Motor Corporation designs, manufactures, assembles, and sells passenger vehicles, minivans and commercial vehicles, and related parts and accessories in Japan, North America, Europe, Asia, Central and South America, Oceania, Africa, the Middle East, and internationally. The company operates through Automotive, Financial Services, and All Other segments. The company offers subcompact and compact cars; mini-vehicles; mid-size, luxury, sports, and specialty cars; recreational and sport-utili	32266868752384.0	3.61	295.22	-19.24389192556021	16.22034398017016		20624512000000.0	25076787000000.0	17417669000000.0	43205469000000.0	39918854000000.0	-376.00331621872857	15.165205990202654	0.547085353181914	10.663245431267287	16.22034398017016	0.6573994635565936	1.8596912270276234	헐값	양호(>=1.5)	40.94068796034032	12086.50989965167	336.0212806512147	양호	충분
6758.T	6758.T	Japan Nikkei 225	3299.0	2.5170913610938372	-18.663708086785014		-29.808510638297868	3401.775	3790.2524682617186	N	N	주의	SONY GROUP CORPORATION	JPX	JPY	Technology	Consumer Electronics	Consumer Electronics	Sony Group Corporation develops, designs, produces, manufactures, supplies, and sells electronic equipment, instruments, and devices for consumer, professional, and industrial use in Japan, the United States, Europe, China, the Asia-Pacific, and internationally. The company operates through Game & Network Services, Music, Pictures, Entertainment Technology & Services, and Imaging & Sensing Solutions. It develops, designs, produces, manufactures, provides, and sells smartphones and image sensors;	19318762897408.0	1.06	171.55	-58.099999999999994			2265213000000.0	824393000000.0	217593000000.0	1669669000000.0	8119011000000.0	244.62693454769231	252.62643667019827	7.657667070936595	17.804564648512432	-58.099999999999994		-3.2036728291902197	판정불가	불리(<1)	8.5	1458.1750000000002	-55.799484692331006	보류	일부부족
9984.T	9984.T	Japan Nikkei 225	5894.0	54.21245421245422	46.2077519379845		-31.719184430027802	6666.95	4960.01125	N	Y	상승전환/양호	SOFTBANK GROUP CORP	JPX	JPY	Communication Services	Telecom Services	Telecom Services	SoftBank Group Corp. provides telecommunication services in Japan and internationally. It operates through Holding Company Investment Business, SoftBank Vision Funds, SoftBank, AI Computing Business, and Other segments. The company engages in Consumer Business, mobile services and broadband; mobile services and solutions; ICT service materials to corporate clients; media, advertising, and related services; and payment and financial services. It also offers semiconductor IP, chips, and related te	33982680924160.0	19.0	872.31	253.79999999999998			6684782000000.0	12376682000000.0	5629648000000.0	18913350000000.0	11561541000000.0	-998.7675390357011	-114.16067912715506	-1.936896490111216	7.901740824977017	253.79999999999998	0.031133730594866103	34.52403793575366	매우 유망	안심(>=2)	8.5	7414.634999999999	25.799711571089222	보류	충분
6861.T	6861.T	Japan Nikkei 225	78200.0	35.458167330677284	39.568088524005		-7.092788404419625	77094.5	61974.75	Y	Y	상승전환/양호	KEYENCE CORP	JPX	JPY	Technology	Scientific & Technical Instruments	Scientific & Technical Instruments	Keyence Corporation, together with its subsidiaries, manufactures and sells electronic application equipment in Japan and internationally. The company offers photoelectric, fiber optic, laser, inductive proximity, positioning, vision, and specific solution sensors, as well as network communication units; laser profiler/3D laser snapshot sensor, laser displacement sensors, optical micrometer/laser micrometer, spectral interference displacement sensor, inductive displacement sensors, and LVDT/cont	19659086626816.0	70.0	1837.7	11.671466126183972	7.043275268619209		2390802000000.0	0.0	0.0	0.0	3471471000000.0	9857.955506929393	1658.8342414124036	2.121271408455759	37.18890161237993	7.043275268619209	5.280057955149407	2.071673857745022	매우 불리	안심(>=2)	22.586550537238416	41507.30392228304	-46.92160623748972	보류	충분
8035.T	8035.T	Japan Nikkei 225	74700.0	84.30792005921539	146.45331573738042		-3.984575835475579	59133.5	40180.475	Y	Y	상승전환/양호	TOKYO ELECTRON	JPX	JPY	Technology	Semiconductor Equipment & Materials	Semiconductor Equipment & Materials	Tokyo Electron Limited, together with its subsidiaries, develops, manufactures, and sells semiconductor production equipment in Japan, South Korea, Taiwan, China, North America, Europe, and internationally. The company provides coaters/developers, plasma etch systems, cleaning systems, deposition systems, test systems, 3D integration systems, SiC Epitaxial CVD systems, and gas cluster beam systems, as well as other deposition and lithography and other products. It also offers engineering service	35092063846400.0	97.0	1247.49	5.572350877450916	6.798560410225418		561248000000.0	0.0	0.0	0.0	2069994000000.0	1233.905321334538	704.1606727784518	0.9426515030501363	58.89112913022587	6.798560410225418	8.662294011780832	1.7625500129348142	매우 불리	양호(>=1.5)	22.097120820450836	27565.937252304215	-63.0978082298471	보류	충분
6954.T	6954.T	Japan Nikkei 225	7051.0	20.73630136986302	24.29049885422174		-16.338395823445662	7564.775	6000.765	N	Y	상승전환/양호	FANUC CORPORATION	JPX	JPY	Industrials	Specialty Industrial Machinery	Specialty Industrial Machinery	Fanuc Corporation engages in the development, manufacture, sale, and maintenance services of products used in automated production systems in Japan, the United States, Europe, China, the rest of Asia, and internationally. It offers CNC series, robots, and robomachine products, such as, compact machining centers, electric injection molding machines, wire electrical discharge machines; and field system basic package, and AI servo monitors, as well as servo motors, lasers. The company was incorpora	6863380283392.0	1.52	178.39	12.866892116266925	-0.7965405408966175		789671000000.0	0.0	0.0	0.0	1864871000000.0	846.2346944953345	246.16935767679928	3.4912687232562654	34.78202424746155	-0.7965405408966175		0.020799808946029983	판정불가	불리(<1)	6.906918918206765	1232.1252658189046	-82.52552452391285	보류	일부부족
6857.T	6857.T	Japan Nikkei 225	31950.0	39.12475506205095	69.90162190906675		-11.002785515320335	28284.75	22605.075	Y	Y	상승전환/양호	ADVANTEST CORP	JPX	JPY	Technology	Semiconductor Equipment & Materials	Semiconductor Equipment & Materials	Advantest Corporation, together with its subsidiaries, manufactures and sells semiconductors, component test systems, and mechatronics-related products in Japan, rest of Asia, the Americas, and Europe. The company offers automated test equipment, including system on chip, power device, and memory test systems, as well as burn-in and SSD test systems; and metrology and SEM tools. It also provides component test systems, such as die level, SoC, and memory test handlers, as well as change kits, and	23440473980928.0	19.0	514.4	132.8824832327193	42.25059773479647		339966000000.0	0.0	0.0	20192000000.0	795726000000.0	469.03916828455834	412.72952374844016	1.291798196395744	61.19937953288383	42.25059773479647	1.4484855318977332	1.0008369072089223	보통	보통(1~1.5)	60.0	30864.0	-3.399061032863848	보류	충분
6594.T	6594.T	Japan Nikkei 225	2610.0	22.47770999530736	31.08990457056755		-20.30534351145038	2683.875	2367.665	N	Y	상승전환/양호	NIDEC CORPORATION	JPX	JPY	Industrials	Specialty Industrial Machinery	Specialty Industrial Machinery	Nidec Corporation, together with its subsidiaries, develops, manufactures, and sells motors, electronics and optical components, and other related products in Japan and internationally. The company offers medium- and large-size motors, small-size and precision motors, fans and blowers, motor-related products, units and modules, automotive components, mechanical equipment/machine tools, inspection and measuring equipment, electronic devices, as well as mold, molding, cutting, and machining compon	3031989747712.0	1.92	104.92	32.067815676348886	6.581109751515668		248811000000.0	0.0	257559000000.0	636046000000.0	1719296000000.0	217.05388229526966	118.29175311926029	4.532251077366295	22.807340046747335	6.581109751515668	3.465576613654661	0.3727356953547089	매우 불리	불리(<1)	21.662219503031338	2272.800070258048	-12.919537538005821	보류	충분
9432.T	9432.T	Japan Nikkei 225	146.0	-8.060455167362868	-6.828332582403551		-11.782477341389729	148.83999938964843	154.24700004577636	N	N	주의	NTT INC	JPX	JPY	Communication Services	Telecom Services	Telecom Services	NTT, Inc. operates as a telecommunications company in Japan and internationally. The company operates through the Comprehensive ICT Business, Regional Communications Business, Global Solutions Business, and Others segments. Its Comprehensive ICT Business segment offers mobile phone and fiber-optic broadband services; financial, content, and lifestyle services; and corporate communication services and solutions. This segment also engages in engineering, system development, and related businesses.	11806424694784.0	3.7	12.61	3.7015407753475893	-5.093357650896701		4814410000000.0	11315960000000.0	4395648000000.0	16919540000000.0	9727623000000.0	-79.84844708420698	-9.463371367313796	-6.4817612104889015	17.91026543094425	-5.093357650896701		-0.07779659415261059	판정불가	불리(<1)	0.0	0.0	-100.0	보류	일부부족
9433.T	9433.T	Japan Nikkei 225	2717.0	0.25830258302583786	0.18436578171090456		-2.929617720614508	2672.7375	2619.215	Y	Y	상승전환/양호	KDDI CORPORATION	JPX	JPY	Communication Services	Telecom Services	Telecom Services	KDDI Corporation engages in the provision of mobile telecommunications services in Japan and internationally. It operates in two segments, Personal Services and Business Services. The Personal Services segment offers 5G telecommunication services and other services, such as finance, energy, and LX through its multi-brands comprising au, UQ mobile, and povo; and entertainment services, including video to individual customers. The Business Services segment provides smartphones and other devices, n	10450430328832.0	3.09	183.67	7.8875096122157595	2.7737376722015927		2887775000000.0	2588058000000.0	2710284000000.0	5805637000000.0	5076738000000.0	78.7262485774807	291.5219717432485	10.72955361587223	14.364206192750691	2.7737376722015927	5.178646249322281	0.4082187065207193	매우 불리	불리(<1)	14.047475344403185	2580.099796506533	-5.038653054599451	보류	충분
9434.T	9434.T	Japan Nikkei 225	207.8000030517578	-5.157463595148892	-4.10705769350338		-15.802268848360224	216.0850009918213	217.60499992370606	N	N	주의	SOFTBANK CORP.	JPX	JPY	Communication Services	Telecom Services	Telecom Services	SoftBank Corp., together with its subsidiaries, provides mobile communications and fixed-line telecommunications and ISP services in Japan. It operates through Consumer, Enterprise, Distribution, Media/E-commerce, Financial, and others segments. The Consumer segment offers mobile services to individual customers; sells mobile devices; broadband, and supplies electric power. The Enterprise segment provides mobile services to enterprise customers; data centers, cloud services, security, global ser	9953202929664.0	4.23	11.26	4.6805655604191365	1.2020430786591874		2419495000000.0	4528164000000.0	1956418000000.0	6484582000000.0	2957859000000.0	-44.087720971247585	12.98824495235269	6.250358403083201	22.370135348401902	1.2020430786591874	18.61009455114916	0.24282566886870655	매우 불리	불리(<1)	10.904086157318375	122.7800101314049	-40.91433670440156	보류	충분
8306.T	8306.T	Japan Nikkei 225	3211.0	18.90390668394741	32.19431864965006		-4.83106105512745	3087.6375	2680.8425	Y	Y	상승전환/양호	MITSUBISHI UFJ FINANCIAL GROUP 	JPX	JPY	Financial Services	Banks - Diversified	Banks - Diversified	Mitsubishi UFJ Financial Group, Inc., together with its subsidiaries, provides various financial products and services in Japan, the United States, Europe, the Middle East, Asia, Oceania, and internationally. It operates through seven segments: Retail and Digital Business; Corporate and Wealth Management Business; Corporate Banking Business; Global Commercial Banking Business; Asset Management Business; Global CIB Business; and Market Business. The company offers retail, commercial, digital, cor	36164929060864.0	2.99	212.25	30.28982053156668	29.544166267570926		90045500000000.0	26368031000000.0	8729597000000.0	35097628000000.0	22274040000000.0	5646.731311821948	-2104.97680246361	-65.55517914866428	-11.47576589786548	29.544166267570926	-0.3884274747824522		판정불가	판정불가	60.0	12735.0	296.60541887262536	보류	충분
8316.T	8316.T	Japan Nikkei 225	6344.0	20.93023255813953	29.153094462540707		-5.70749108204518	6071.575	5151.42	Y	Y	상승전환/양호	SUMITOMO MITSUI FINANCIAL GROUP	JPX	JPY	Financial Services	Banks - Diversified	Banks - Diversified	Sumitomo Mitsui Financial Group, Inc., together with its subsidiaries, provides banking, leasing, securities, consumer finance, and other services in Japan, the Americas, Europe, the Middle East, Asia, and Oceania. It operates through Wholesale Business Unit, Retail Business Unit, Global Business Unit, and Global Markets Business Unit segments. The Wholesale Business Unit segment offers bilateral loans, syndicated loans, commitment lines, structured finance, project finance, and nonrecourse loan	24190956601344.0	1.42	411.73	34.37846987595883	25.239464749982776		73696930000000.0	25513660000000.0	7037125000000.0	32550785000000.0	15786049000000.0	12639.889841995402	-2822.8375614041224	-44.496178458450856	-15.291307026438204	25.239464749982776	-0.6058491009183797		판정불가	판정불가	58.97892949996555	24283.39464302082	282.777343048878	보류	충분
8411.T	8411.T	Japan Nikkei 225	7652.0	20.163316582914568	36.64285714285713		-7.237240877682138	7375.325	6182.78	Y	Y	상승전환/양호	MIZUHO FINANCIAL GROUP	JPX	JPY	Financial Services	Banks - Regional	Banks - Regional	Mizuho Financial Group, Inc., together with its subsidiaries, engages in banking, trust banking, securities, and other businesses related to financial services in Japan, the Americas, Europe, Asia/Oceania, and internationally. The company offers finance solutions, including corporate, syndicated, acquisition, real estate, project, ECA, and other structured finance solutions; financing and advisory solutions for capital markets comprising debt, loan, and equity capital markets; corporate finance 	18865343954944.0	1.96	502.74	41.01936566628983	30.991494297906243		61567751000000.0	21067585000000.0	5113342000000.0	26180927000000.0	11316526000000.0	16622.69117537675	-2116.8126514332503	-27.663521320350892	-17.84359942589957	30.991494297906243	-0.5757579565017963		판정불가	판정불가	60.0	30164.4	294.20282279142714	보류	충분
7267.T	7267.T	Japan Nikkei 225	1476.0	11.818181818181817	-4.34219053791316		-13.303964757709252	1390.1125	1493.025	Y	N	상승전환/양호	HONDA MOTOR CO	JPX	JPY	Consumer Cyclical	Auto Manufacturers	Auto Manufacturers	Honda Motor Co., Ltd. engages in the development, manufacturing, and distribution of motorcycles, automobiles, and power products in Japan, North America, Europe, Asia, and internationally. It operates through four segments: Motorcycle Business, Automobile Business, Financial Services Business, and Power Product and Other Businesses. The Motorcycle Business segment produces motorcycles, including sports, business, and commuter models; and various off-road vehicles, such as all-terrain vehicles a	5761019150336.0	4.74	-106.12				5660776000000.0	6057967000000.0	4915457000000.0	4915457000000.0	11817512000000.0	-102.03796839146683	61.069001296972814	4.137466212532034					판정불가	판정불가				판정불가	일부부족
6902.T	6902.T	Japan Nikkei 225	1888.0	-2.905631267678066	-11.215612508817308		-18.444924406047512	1884.5125	2061.925	Y	N	주의	DENSO CORP	JPX	JPY	Consumer Cyclical	Auto Parts	Auto Parts	DENSO Corporation engages in the manufacture and sale of automotive parts in Japan, Rest of Asia, North America, Europe, and internationally. The company offers air-conditioning systems, including thermal management heat pump system, heat pump air-conditioning systems, personal heating and cooling devices, air quality system, heat exchangers, bus air-conditioning systems, automotive freezers, products of control systems, pickup systems, and cooling products, as well as heating, ventilation, and 	5050272841728.0	3.92	257.9	15.286895070586738	30.679266281591143		1256566000000.0	573880000000.0	237402000000.0	811282000000.0	5492689000000.0	253.59400971607926	28.541890899395426	1.5117526959425542	6.337363281442113	30.679266281591143	0.2065682804560681	5.459568079821018	매우 유망	안심(>=2)	60.0	15473.999999999998	719.5974576271185	매우 유망	충분
7974.T	7974.T	Japan Nikkei 225	6935.0	-22.8587319243604	-36.86845698680018		-52.67826680313886	7214.05	10237.555	N	N	주의	NINTENDO CO LTD	JPX	JPY	Communication Services	Electronic Gaming & Multimedia	Electronic Gaming & Multimedia	Nintendo Co., Ltd., together with its subsidiaries, develops, manufactures, and sells home entertainment products in Japan, the Americas, Europe, and internationally. It offers home console gaming hardware, software, accessories, and other products. The company also provides various services, such as Nintendo Switch Online; and content through mobile application. In addition, it offers develop IP, including video content and mobile apps. The company was formerly known as Nintendo Playing Card Co	7856527507456.0	3.16	364.78	52.09715716304528	-0.6755831287621472		2641910000000.0	0.0	0.0	0.0	2954023000000.0	2291.676108117034	227.8048758336565	3.284857618365631	12.72910765909032	-0.6755831287621472		0.1951760435825712	판정불가	불리(<1)	7.148833742475706	2607.7515725802878	-62.39723759797711	보류	일부부족
6098.T	6098.T	Japan Nikkei 225	11295.0	76.51195499296766	27.641541417109284		-0.746924428822493	9922.8	8194.645	Y	Y	상승전환/양호	RECRUIT HOLDINGS CO LTD	JPX	JPY	Communication Services	Internet Content & Information	Internet Content & Information	Recruit Holdings Co., Ltd. provides HR technology and business solutions that transforms the world of work. It operates through three segments: HR Technology, Staffing and Marketing Matching Technologies. The HR Technology segment provides online matching and hiring platforms connecting job seekers and employers. The Staffing segment offers temporary staffing and other related services for clerical, manufacturing, light industry, and various professional positions across industries in Japan, Eur	15772934995968.0	23.0	347.89	21.64189334743356	22.578146380459074		876972000000.0	645000000.0	0.0	186275000000.0	1583321000000.0	629.4824021799886	391.5600390296372	3.4666670122145837	30.657729735893565	22.578146380459074	1.3578497197815673	1.4866771536281413	보통	보통(1~1.5)	53.65629276091815	18666.487688595815	65.26328188221173	보류	충분
4519.T	4519.T	Japan Nikkei 225	7574.0	-10.377470121879062	-7.532657795141007		-27.55619320899091	7715.6	8074.35	N	N	주의	CHUGAI PHARMACEUTICAL CO	JPX	JPY	Healthcare	Drug Manufacturers - General	Drug Manufacturers - General	Chugai Pharmaceutical Co., Ltd., together with its subsidiaries, engages in the research, development, manufacture, sale, importation, and exportation of pharmaceuticals in Japan and internationally. It offers oncology products, such as Alecensa, Avastin, FoundationOne, Herceptin, Kadcyla, Lunsumio, Perjeta, Phesgo, Polivy, and Tecentriq; Actemra for humanized anti-human IL-6 receptor monoclonal antibody; CellCept, an immunosuppressant; Enspryng, a pH-dependent binding humanized anti-IL-6 recept	12399179464704.0	1.74	263.58	12.056016131489189	5.045492075929214		1532790000000.0	0.0	0.0	0.0	2025732000000.0	931.3552120470008	166.89705058004412	2.2035522917882773	25.201626784858483	5.045492075929214	4.994879866146092	0.26924817726473277	매우 불리	불리(<1)	18.59098415185843	4900.211602746845	-35.30219695343485	보류	충분
4568.T	4568.T	Japan Nikkei 225	2614.0	-9.062445642720473	-21.759952110146664		-37.37422137038811	2591.8375	3160.005	Y	N	주의	DAIICHI SANKYO COMPANY LIMITED	JPX	JPY	Healthcare	Drug Manufacturers - General	Drug Manufacturers - General	Daiichi Sankyo Company, Limited manufactures and sells pharmaceutical products in Japan and internationally. The company offers Enhertu for the treatment of HER2 positive and low breast cancer, HER2 positive gastric or gastroesophageal junction adenocarcinoma, and HER2 positive solid tumors; Turalio, an oral small molecule for colony stimulating factor 1 receptor, KIT proto-oncogene receptor tyrosine kinase, and FMS-like tyrosine kinase 3, as well as symptomatic TGCT; Vanflyta, a FLT3 inhibitor 	4746565386240.0	3.83	140.37	-12.132298245851313	33.51476838423717		659279000000.0	300077000000.0	404000000.0	300481000000.0	1664179000000.0	197.40134772821523	-39.209118981422634	-1.4999662961523579	17.215919728373475	33.51476838423717	0.5136815964531788	2.1691997275457457	헐값	안심(>=2)	60.0	8422.2	222.19586840091816	보류	충분
4502.T	4502.T	Japan Nikkei 225	5176.0	-10.589048194852301	15.406911928651068		-12.122241086587437	5088.85	4981.87	Y	Y	상승전환/양호	TAKEDA PHARMACEUTICAL CO LTD	JPX	JPY	Healthcare	Drug Manufacturers - Specialty & Generic	Drug Manufacturers - Specialty & Generic	Takeda Pharmaceutical Company Limited engages in the research, development, manufacture, marketing, and out-licensing of pharmaceutical products. It offers pharmaceutical products in the areas of gastroenterology, rare diseases, plasma-derived therapies, oncology, vaccines, and neuroscience. The company provides its products under the Entyvio, Gattex/Revestive, Takecab/Vocinti, EOHILIA, Takhzyro, Advate, Elaprase, Replagal, Vpriv, Adynovate/Adynovi, Livtencity, ADZYNMA, Gammagard Liquid/Kiovig, 	8144252043264.0	3.94	-96.79				678830000000.0	4369681000000.0	512157000000.0	4881838000000.0	7429441000000.0	-2336.1674595978784	396.722693760079	7.664657916539393					판정불가	판정불가				판정불가	일부부족
4503.T	4503.T	Japan Nikkei 225	2171.0	-14.358974358974363	2.5507794048181376		-18.306679209783628	2211.0625	2123.2	N	Y	상승전환/양호	ASTELLAS PHARMA	JPX	JPY	Healthcare	Drug Manufacturers - General	Drug Manufacturers - General	Astellas Pharma Inc. engages in the research, development, manufacture, sale, and supply of pharmaceuticals in Japan and internationally. The company offers XTANDI, a treatment for prostate cancer; XOSPATA, a treatment for acute myeloid leukemia; VYLOY, a treatment for gastric adenocarcinoma and esophagogastric junction adenocarcinoma; and PADCEV, a treatment for patients with metastatic urothelial carcinoma. It also provides VEOZAH, a treatment for vasomotor symptoms associated with menopause; 	3896495570944.0	3.68	162.17	474.48716180266814	43.473155536585175		300749000000.0	320000000000.0	245952000000.0	565952000000.0	1829044000000.0	-10.745790228248923	265.44518843240235	12.22686266386008	13.453448789716033	43.473155536585175	0.3094656604440452	3.5049121064503233	매우 유망	안심(>=2)	60.0	9730.199999999999	348.1897742975587	매우 유망	충분
9983.T	9983.T	Japan Nikkei 225	84380.0	36.382737999030226	49.636460365313		0.0	77970.25	62727.05	Y	Y	상승전환/양호	FAST RETAILING CO LTD	JPX	JPY	Consumer Cyclical	Apparel Retail	Apparel Retail	Fast Retailing Co., Ltd. operates as an apparel designer and retailer in Japan and internationally. The company operates through UNIQLO Japan, UNIQLO International, GU, and Global Brands segments. It manufactures and retails clothing for men, women, children, and babies. The company operates stores and franchises under the UNIQLO, GU, PLST, Theory, COMPTOIR DES COTONNIERS, J Brand, and PRINCESSE TAM.TAM brand names. It sells its products through online; and provides real estate leasing services.	25409399816192.0	76.0	1561.03	16.400537634408607	16.57378386379136		2692641000000.0	240000000000.0	130000000000.0	513500000000.0	2273115000000.0	7993.23122880618	1309.57612821085	1.551998255760666	48.93356871501113	16.57378386379136	2.952468133840938	1.8918257199457624	매우 불리	양호(>=1.5)	41.64756772758272	65013.10264978845	-22.95199970397197	보류	충분
