티커	종목코드	유니버스	현재가	3M수익률(보조,%)	6M수익률(보조,%)	12M수익률(보조,%)	52주고점대비(보조,%)	40일이평(보조)	200일이평(보조)	40일선상회(보조)	200일선상회(보조)	추세판정(보조)	종목명	시장	통화	섹터	산업	업종	사업설명	시가총액	배당수익률(%)	EPS(FY)	EPS Growth 1Y(%)	EPS Growth 3Y CAGR(%)	EPS Growth 5Y CAGR(%)	현금및단기투자	장기부채	단기위험부채	총부채	주주지분	주당순현금(린치식)	주당잉여현금흐름	잉여현금흐름수익률(%)	순현금차감PER(린치식)	사용연성장률(%)	린치PER배수	배당감안점수	린치PER판정	배당감안점수판정	그레이엄적정PER(3년)	그레이엄내재가치(3년)	그레이엄괴리율(3년,%)	종합판정	데이터상태
2330.TW	2330.TW	Taiwan 50	2505.0	40.73033707865168	75.17482517482517		-0.19920318725099584	2326.0	1771.8	Y	Y	상승전환/양호	TAIWAN SEMICONDUCTOR MANUFACTUR	TAI	TWD	Technology	Semiconductors	Semiconductors	Taiwan Semiconductor Manufacturing Company Limited, together with its subsidiaries, manufactures, packages, tests, and sells integrated circuits and other semiconductor devices in Taiwan, China, Europe, the Middle East, Africa, Japan, the United States, and internationally. It provides various wafer fabrication processes, such as processes to manufacture complementary metal- oxide-semiconductor (CMOS) logic, mixed-signal, radio frequency, embedded memory, bipolar CMOS mixed-signal, and others. T	64960587628544.0	1.0	73.51	46.54981153856048	19.574951863097922		3488279800000.0	896062000000.0	136925700000.0	1064582700000.0	5355038700000.0	99.96069751058748	38.26794070252923	1.527662303494181	32.717171847223675	19.574951863097922	1.6713794279566556	0.6288731788668915	보통	불리(<1)	47.649903726195845	3502.744422912657	39.830116683139984	보류	충분
2317.TW	2317.TW	Taiwan 50	248.0	27.835051546391743	14.54965357967668		-19.741100323624593	262.2875	230.48	N	Y	상승전환/양호	HON HAI PRECISION INDUSTRY	TAI	TWD	Technology	Electronic Components	Electronic Components	Hon Hai Precision Industry Co., Ltd. provides electronic manufacturing services. The company offers consumer electronics, including smartphones, feature phones, wearable devices, televisions, game consoles, set-top boxes, and audio systems; cloud and networking products comprising routers, servers, edge computing, data centers, and satellite communications and other related equipment; electronic computing equipment, such as desktop computers, laptops, tablets, multi-function devices and printers	3472476078080.0	2.86	13.4	23.999718516214784	10.202197342011932		2177167157000.0	306085648000.0	940440828000.0	1286493270000.0	1772771627000.0	133.63035351031627	3.6666051717189645	1.4784698273060342	8.535048245498785	10.202197342011932	0.8365892130268895	1.5304186884825957	헐값	양호(>=1.5)	28.904394684023863	387.3188887659198	56.176971276580566	양호	충분
2454.TW	2454.TW	Taiwan 50	4335.0	187.0860927152318	204.21052631578948		-6.573275862068961	4061.25	2058.475	Y	Y	상승전환/양호	MEDIATEK INC	TAI	TWD	Technology	Semiconductors	Semiconductors	MediaTek Inc. engages in the research, development, production, manufacture, and marketing of multimedia integrated circuits (ICs) in Taiwan, rest of Asia, and internationally. The company offers multimedia, computer peripherals oriented, consumer-oriented, and other ICs for various applications. It also offers design, test runs, maintenance and repair, and technological consultation services for software and hardware solutions; and sale and delegation patents and circuit layout rights for its I	6919137787904.0	1.26	66.22	-1.0032496768530352	-3.7570524355304835		260128122000.0	60000000.0	4480763000.0	13730009000.0	400600988000.0	162.93870008806817	86.0675425604462	1.9854104396873402	63.003039865779705	-3.7570524355304835		-0.03963384053928429	판정불가	불리(<1)	0.985895128939033	65.28597543834276	-98.49397980534388	보류	일부부족
2308.TW	2308.TW	Taiwan 50	1990.0	34.00673400673399	123.59550561797752		-21.031746031746035	2182.75	1374.395	N	Y	상승전환/양호	DELTA ELECTRONIC	TAI	TWD	Technology	Electronic Components	Electronic Components	Delta Electronics, Inc., together with its subsidiaries, provides power and thermal management solutions in Mainland China, the United States, Taiwan, Thailand, and internationally. It operates through Power Electronics, Mobility, Automation, and Infrastructure segments. The company offers inductors, transformer components, networking products, EMI filters, solenoids, current sensing resistors, power modules, and stamping and over molding components; embedded power, adapters, industrial and medi	5169111629824.0	59.0	23.01	70.62397666530782	22.54086445612693		159053571000.0	56703273000.0	17326736000.0	76525994000.0	268057976000.0	39.40272982449256	19.757704684663608	0.9928494816413873	84.77171969472	22.54086445612693	3.760801625852368	0.961887581728576	매우 불리	불리(<1)	53.58172891225386	1232.9155822709613	-38.04444310196175	보류	충분
2382.TW	2382.TW	Taiwan 50	372.0	32.38434163701067	40.37735849056603		-10.79136690647482	352.325	300.4275	Y	Y	상승전환/양호	QUANTA COMPUTER	TAI	TWD	Technology	Computer Hardware	Computer Hardware	Quanta Computer Inc. manufactures, processes, and sells laptop computers and telecommunication products in the United States, Mainland China, the Netherlands, Japan, and internationally. The company provides notebook PCs; servers, storage devices, and network switches; cameras, including automotive camera, camera module, and AI dash-cam and ADAS solutions; and smart healthcare solutions. It also offers mobile computing solutions for the wireless communication of notebook PCs, wireless local area	1433880756224.0	3.54	18.92	25.603756952240488	37.322961044476074		230393427000.0	56578932000.0	258327344000.0	322496262000.0	243577029000.0	45.093699643514476	-6.625869265535222	-1.7811476520255973	17.278345684803675	37.322961044476074	0.4629414494796878	2.364981103510106	매우 유망	안심(>=2)	60.0	1135.2	205.16129032258067	보류	충분
2303.TW	2303.TW	Taiwan 50	169.0	196.49122807017542	235.3174501655987		-5.3221288515406195	131.4650001525879	69.49200004577636	Y	Y	상승전환/양호	UNITED MICRO ELECTRONICS	TAI	TWD	Technology	Semiconductors	Semiconductors	United Microelectronics Corporation operates as a semiconductor wafer foundry in Taiwan, China, Hong Kong, Japan, Korea, the United States, Europe, and internationally. It manufactures and sells integrated circuits. The company offers circuit design; mask tooling; wafer fabrication; and assembly and testing services for communication devices, consumer electronics, computer, and other applications. It also provides venture capital and marketing support; consulting and planning; energy technical; 	2120347418624.0	1.59	3.95	-17.259341564967112	-23.3089317909408		146070330000.0	45372054000.0	8408772000.0	59781672000.0	365824997000.0	8.026047643767638	3.915896780636361	2.3170986867670775	40.75289933069173	-23.3089317909408		-0.5329420028425778	판정불가	불리(<1)	0.0	0.0	-100.0	보류	일부부족
2412.TW	2412.TW	Taiwan 50	141.5	5.597014925373145	9.26640926640927		-3.4129692832764458	140.35	134.7875	Y	Y	상승전환/양호	CHUNGHWA TELECOM	TAI	TWD	Communication Services	Telecom Services	Telecom Services	Chunghwa Telecom Co., Ltd., together with its subsidiaries, operates as an integrated telecommunications service provider in Taiwan and internationally. The company operates through Consumer Business, Enterprise Business, International Business, and Others segments. Its services primarily include mobile, fixed-line, information and communication technology (ICT), and sales and other services. The company provides mobile services, including prepaid and postpaid plans; fixed-line services, such as	1097678716928.0	3.67	5.02	4.0764742262497045	2.1070421075218615		80236000000.0	24888000000.0	2240000000.0	38019000000.0	384131000000.0	7.134821964796407	6.394372131635488	4.518990905749462	26.76597172016008	2.1070421075218615	12.703102431892132	0.21583532135209588	매우 불리	불리(<1)	12.714084215043723	63.82470275951948	-54.894202996806015	보류	충분
2882.TW	2882.TW	Taiwan 50	95.0	34.943178893367175	29.781426175703295		-17.748917748917748	92.26500015258789	74.92249977111817	Y	Y	상승전환/양호	CATHAY FINANCIAL HLDG CO	TAI	TWD	Financial Services	Insurance - Life	Insurance - Life	Cathay Financial Holding Co., Ltd., through its subsidiaries, provides various financial products and services in Taiwan, rest of Asia, and internationally. The company offers consumer banking services, such as deposit and remittance services; and credit services, including secured and unsecured consumer loans, adjustable-rate mortgage, revolving mortgage, and government subsidized mortgage. It also provides corporate banking services, including corporate, sustainable, working capital, capital e	1393574936576.0	3.56	7.06	-2.836521477400711	42.07576363585104		790688699000.0	0.0	0.0	441882992000.0	928286508000.0	53.90124614754305	12.470106092966152	13.12642746628016	5.82135323689192	42.07576363585104	0.13835407212744635	7.839373729572275	매우 유망	안심(>=2)	60.0	423.59999999999997	345.8947368421052	매우 유망	충분
2891.TW	2891.TW	Taiwan 50	70.5999984741211	36.03082157698552	44.22879953777872		-2.4861920080407884	63.40499992370606	50.922750034332275	Y	Y	상승전환/양호	CTBC FINANCIAL HOLDINGS COMPANY	TAI	TWD	Financial Services	Banks - Regional	Banks - Regional	CTBC Financial Holding Co., Ltd., together with its subsidiaries, engages in corporate and personal finance, life insurance, and other businesses in Taiwan, Asia, and North America. The company offers commercial banking and capital market services; customized financing and wealth management and credit services; life insurance services; and designs, provides, and trades in various financial products. It is also involved in deposit and loan; securities and futures; venture capital; asset managemen	1389189005312.0	3.52	4.06	11.926931815510834	37.10774106785184		641748921000.0	0.0	0.0	331234874000.0	518343310000.0	32.614333243681955	0.003445766638987655	0.004880689395837203	9.35607517991112	37.10774106785184	0.2521327062944481	4.34239147148856	매우 유망	안심(>=2)	60.0	243.59999999999997	245.0425003752559	매우 유망	충분
2881.TW	2881.TW	Taiwan 50	122.5	41.78240490344003	25.899276626782108		-11.552346570397109	113.57999954223632	95.37497550964355	Y	Y	상승전환/양호	FUBON FINANCIAL HLDG CO LTD	TAI	TWD	Financial Services	Insurance - Life	Insurance - Life	Fubon Financial Holding Co., Ltd. provides various financial products and services in Taiwan, Asia, and internationally. It operates through Banking Business, Property Insurance Business, Life Insurance Business, Securities Business, and Others segments. The company offers insurance products, including property, casualty, life, health, accident, fire, transportation, fishing vessel, car, liability, engineering and nuclear, guarantee and letter of credit, and personal and commercial multiple peri	1674050928640.0	3.28	8.37	-19.809129596654984	37.10650367758417		922185721000.0	0.0	0.0	600644627000.0	982581684000.0	67.48166890931621	0.4210099576148224	0.34368159805291626	6.57327731071491	37.10650367758417	0.17714623204141405	6.1440437955890435	매우 유망	안심(>=2)	60.0	502.19999999999993	309.95918367346934	매우 유망	충분
2886.TW	2886.TW	Taiwan 50	46.150001525878906	19.404915145936585	14.374233633435463		-1.0718113261424578	42.108750343322754	40.6604999923706	Y	Y	상승전환/양호	MEGA FINANCIAL HOLDING CO	TAI	TWD	Financial Services	Banks - Regional	Banks - Regional	Mega Financial Holding Co., Ltd. provides various financial services in Taiwan. It offers brokerage, dealing and underwriting of short-term debt instruments and financial debentures; notary services for short-term debt instruments and financial debentures; guarantee or endorsement services for short-term debt instruments; brokerage for inter-bank call loans; proprietary trading in government bonds; and foreign and domestic securities brokerage, securities dealing, securities underwriting, and fu	684560416768.0	3.47	2.36	0.783077986276548	24.094823796719123		877500768000.0	0.0	0.0	108798705000.0	392369102000.0	59.15717588520136	10.708101147312195	23.20281862029313	-5.511514559034939	24.094823796719123	-0.22874267957026587		판정불가	판정불가	56.689647593438245	133.78756832051425	189.89721321134093	보류	충분
2884.TW	2884.TW	Taiwan 50	32.900001525878906	2.812504768371582	-1.791040221257001		-8.100552438502662	33.023750114440915	32.63924998283386	N	Y	상승전환/양호	E SUN FINANCIAL HOLDINGS	TAI	TWD	Financial Services	Banks - Regional	Banks - Regional	E.SUN Financial Holding Company, Ltd., together with its subsidiaries, offers various financial banking products and services in Taiwan. It operates through Corporate Banking Unit; Individual Banking Unit; Overseas Branches and Subsidiaries; and Others segments. The company provides deposits; bills/checks discounting; syndicated loans; domestic remittances; commercial acceptances; domestic letters of credit and guarantees; custodian services and warehousing; rental of safe deposit boxes; and cre	532124631040.0	4.06	2.12	31.44091638294586	29.648238579086495		406218940000.0	0.0	0.0	81352877000.0	272743929000.0	25.11555212068752	2.1025866205020405	6.3908404953968185	3.671910096788389	29.648238579086495	0.12384918203466257	9.18002829333136	매우 유망	안심(>=2)	60.0	127.2	286.62612188618107	매우 유망	충분
2885.TW	2885.TW	Taiwan 50	66.0	48.48143727148826	67.72554652932334		-4.069771697032321	60.912499809265135	44.44974988937378	Y	Y	상승전환/양호	YUANTA FINANCIAL HOLDING CO. LT	TAI	TWD	Financial Services	Financial Conglomerates	Financial Conglomerates	Yuanta Financial Holding Co., Ltd., together with its subsidiaries, provides financial services in Taiwan. The company offers brokerage, investment banking, derivative products, fixed income, institutional brokerage, international finance, strategic trading, overseas business, digital finance, reg and transfer, and wealth management services; corporate, consumer, and digital finance products and services; and life, health, accident, and investment-linked insurance products. It also provides futu	879855861760.0	2.29	2.74	2.7414463472456685	20.12129776441045		938214637000.0	217509768000.0	158925388000.0	383094061000.0	340417373000.0	54.06171778128669	-4.071624878573867	-6.169128603899798	4.357037306099748	20.12129776441045	0.21653858300364	5.143701141377689	매우 유망	안심(>=2)	48.7425955288209	133.55471174896928	102.35562386207468	보류	충분
2880.TW	2880.TW	Taiwan 50	36.70000076293945	10.87614034675255	15.408810199493072		-4.302471386785256	34.37749991416931	32.299250001907346	Y	Y	상승전환/양호	HUA NAN FINANCIAL HOLDINGS CO	TAI	TWD	Financial Services	Banks - Regional	Banks - Regional	Hua Nan Financial Holdings Co., Ltd., together with its subsidiaries, provides financial services in Taiwan and internationally. It operates through Bank, Securities, Insurance, and Other segments. The company provides various banking services, including commercial banking, offshore banking, overseas branch banking, and other banking services. It also engages in the trust business planning, managing, and operating; custody of nondiscretionary trust funds and mutual funds; trading and underwritin	510752620544.0	3.29	1.9	14.228828562366536	15.145821422405326		304634035000.0	0.0	0.0	131545560000.0	236357548000.0	21.8894015325899	0.15652701576816497	0.42650412129208926	7.795052226499765	15.145821422405326	0.5146668516088857	2.3650670818768353	헐값	안심(>=2)	38.79164284481065	73.70412140514024	100.82866450392132	양호	충분
1101.TW	1101.TW	Taiwan 50	23.0	1.9955688610396205	2.6785731771771015		-13.370995627394155	24.363749980926514	23.778500022888185	N	N	중립	TCC GROUP HOLDINGS CO LTD	TAI	TWD	Basic Materials	Building Materials	Building Materials	TCC Group Holdings Co., Ltd. manufactures and markets cement, cement-related products, and ready-mixed concrete in Asia, Europe, and Africa. It operates through Cement, Electricity and Energy, Social Aspect of Energy Transition, and Other segments. The company is also involved in the thermal and renewable energy generation; and land and marine transportation business, and production and sale of refractory materials, etc. In addition, it provides engineering, property leasing and development, ene	172343181312.0	3.33	-1.6	36.199999999999996			146558691000.0	165639430000.0	40338866000.0	212904295000.0	231910589000.0	-2.5464133928683435	0.823563607556843	3.5807113372036654		36.199999999999996			판정불가	판정불가				판정불가	일부부족
1301.TW	1301.TW	Taiwan 50	54.29999923706055	12.538858522405283	36.090218447339886		-6.379311660240439	48.49750022888183	44.162250175476075	Y	Y	상승전환/양호	FORMOSA PLASTIC	TAI	TWD	Basic Materials	Specialty Chemicals	Specialty Chemicals	Formosa Plastics Corporation engages in the manufacture and sale of plastic raw materials, chemical fibers, and related petrochemical industrial products in Taiwan, China, and internationally. It operates through Plastic, Polyolefin, Polypropylene, Tairylan, Chemical, and Other segments. The company offers plastic raw materials, such as polyvinyl chloride, high-density polyethylene, linear low-density polyethylene, ethylene vinyl acetate copolymer, polyethylene wax, polypropylene, polyacetal, an	345659736064.0	92.0	-1.08	6379.2			226906866000.0	76514793000.0	52416194000.0	130740908000.0	363222429000.0	23.62522650544532	-1.247549971008874	-2.297513791045144		6379.2			판정불가	판정불가				보류	일부부족
1303.TW	1303.TW	Taiwan 50	183.0	124.81572060145498	218.81532253530355		0.0	110.02500019073486	72.46000007629395	Y	Y	상승전환/양호	NAN YA PLASTIC	TAI	TWD	Basic Materials	Specialty Chemicals	Specialty Chemicals	Nan Ya Plastics Corporation engages in the manufacture and sale of plastic products, polyester fibers, petrochemical products, and electronic materials in Taiwan, China, the United States, and internationally. It provides plastic products, such as PP synthetic paper, adhesives, optical films, outdoor decoration materials, TPU films, synthetic leathers, PU resins, doors, Neuma fire-rated doors and windows, plastic pallets, PVC cling and PE Stectch films, BOPP film, engineering and PVC compounds, 	1451340464128.0	48.0	0.57	35.28214030056922	-47.98534220948065		82098101000.0	79337053000.0	93325453000.0	173213953000.0	355665838000.0	0.3481414662944144	-0.3379180619612948	-0.1846546786673742	320.4418570766765	-47.98534220948065		4.574243406610779e-05	판정불가	불리(<1)	0.0	0.0	-100.0	보류	일부부족
2002.TW	2002.TW	Taiwan 50	18.649999618530273	-2.6109661094519288	1.3586956803424588		-12.235295912798716	18.833750009536743	19.118750047683715	N	N	중립	CHINA STEEL CORP	TAI	TWD	Basic Materials	Steel	Steel	China Steel Corporation manufactures and sells steel products in Taiwan, Vietnam, Malaysia, China, India, and internationally. It offers steel plates primarily for use in construction structures, shipbuilding, bridge beams, oil country tabular goods, machine structures, pressure vessels, and in climate/corrosion-resistant steel plates; steel bars and wire rods for applications in general and machine structures, cold and hot forging, hard drawn steel wires, and welding electrodes; and hot-rolled 	284972122112.0	80.0	-0.29				90355113000.0	182746145000.0	77492200000.0	271100183000.0	292633521000.0	-6.061712385961833	1.1196561050556681	6.003518112371433					판정불가	판정불가				판정불가	일부부족
1216.TW	1216.TW	Taiwan 50	74.5	3.61613131980989	-3.120938203195278		-14.367816091954023	73.75499973297119	74.81449989318848	Y	N	상승전환/양호	UNI-PRESIDENT ENTERPRISES CORP	TAI	TWD	Consumer Defensive	Packaged Foods	Packaged Foods	Uni-President Enterprises Corp. engages in the manufacture and sale of beverages and instant noodles in Taiwan, China, and Southeast Asia. It operates through Beverages, Food, and Others segments. The company offers animal feeds, wheat flour, and aquatic products; dairy, tea, coffee, water, and general beverages; edible oils, snack noodles, and cooking noodles; sauce and seasoning, meat, ice cream, and frozen prepared foods. It also provides trade marketing, developing, and managing distribution	423310131200.0	4.03	3.44	-5.058179913923699	4.563089403388387		165919037000.0	98835952000.0	79360712000.0	308708893000.0	135782210000.0	11.806213992747292	7.226537944725595	9.700050932517577	18.22493779280602	4.563089403388387	3.9939909525491286	0.47150171380998407	매우 불리	불리(<1)	17.626178806776775	60.63405509531211	-18.612006583473683	보류	충분
2207.TW	2207.TW	Taiwan 50	465.0	-6.813627254509013	-20.512820512820518		-25.120772946859905	473.7125	536.07	N	N	주의	HOTAI MOTOR CO	TAI	TWD	Consumer Cyclical	Auto & Truck Dealerships	Auto & Truck Dealerships	Hotai Motor Co.,Ltd., together with its subsidiaries, exports and imports, trades, and sells vehicles, automobile air conditioners, and related parts in Taiwan and Mainland China. It is also involved in the installment sales and vehicle leasing, used vehicles selling, property and casualty insurance, trading of vehicle products/accessories, solar power, energy storage, and vehicle repairing activities, electronic parts and components manufacturing, as well as property management business. In add	259052797952.0	4.3	33.89	-7.654131088708249			50924322000.0	8733259000.0	301578234000.0	313105900000.0	86158179000.0	75.73299833254464	42.95654836882807	9.23796739114582	11.486190665903079	-7.654131088708249		-0.2920142270200194	판정불가	불리(<1)	8.5	288.065	-38.0505376344086	보류	일부부족
1326.TW	1326.TW	Taiwan 50	56.29999923706055	15.724558008723388	75.66302832219374		-5.378152542755387	50.06750011444092	39.37900004386902	Y	Y	상승전환/양호	FORMOSA CHEMICAL & FIBRE CO	TAI	TWD	Basic Materials	Chemicals	Chemicals	Formosa Chemicals & Fibre Corporation produces and sells petrochemical products, nylon, and rayon fibers in Taiwan and internationally. The company offers plastic products, including PS resin, ABS resin, PP resin, PC resin, homopolymer PP, polycarbonate, PC/ABS alloy, PP composite materials, SAN andASA resin, and nylon resin; petrochemical, such as benzene, para-xylene, ortho-xylene, meta-xylene, styrene monomer, phenol, acetone, PTA, and PIA; fibers, includes nylon 6 chip, full drawn yarn, part	329299623936.0	1.1	-0.99				225714011000.0	63844980000.0	63720846000.0	128580720000.0	345866503000.0	27.674572989185965	1.8442112794284715	3.275686153499065					판정불가	판정불가				판정불가	일부부족
3008.TW	3008.TW	Taiwan 50	4330.0	98.62385321100918	112.25490196078431		-16.650625601539936	3843.625	2633.7	Y	Y	상승전환/양호	LARGAN PRECISION CO	TAI	TWD	Technology	Electronic Components	Electronic Components	Largan Precision Co., Ltd., together with its subsidiaries, designs, manufactures, and sells precision optical plastic lenses in China, South Korea, Vietnam, Japan, Taiwan, and internationally. The company offers mobile phone lens, voice coil motors, image lens modules, sleep health monitoring products, automotive and contact lenses, silicon carbide crystals, titanium niobate anode materials, and fiber optic lasers and space communications products, as well as video cameras, cameras, monocular a	566356213760.0	1.86	157.01	-17.904416715768722	-2.029321415748375		155056231000.0	0.0	1228000.0	120112000.0	188867185000.0	1185.4615320117907	103.71201064797552	2.3951965507615594	20.027631794078143	-2.029321415748375		-0.008454390288842878	판정불가	불리(<1)	4.44135716850325	697.3374890266952	-83.89520810561905	보류	일부부족
5871.TW	5871.TW	Taiwan 50	114.5	3.153153153153143	10.6280193236715		-10.505747754286855	113.5125	108.7275	Y	Y	상승전환/양호	CHAILEASE HOLDING COMPANY LIMIT	TAI	TWD	Financial Services	Credit Services	Credit Services	Chailease Holding Company Limited, an investment holding company, provides leasing and financial products and services in Taiwan, Mainland China, ASEAN countries, and internationally. The company offers leasing services, including capital and operating leases for machinery, medical equipment, airplanes, boats, and office equipment; installment sales services for raw materials, semi-finished and finished products, furniture and fixtures, and production equipment, as well as for customers in vario	195957719040.0	4.94	11.24	-12.290661443557727	-10.052637909459694		182181078000.0	129895323000.0	544000413000.0	682487506000.0	182441248000.0	30.551074253924646	11.408862081138622	9.96407168658395	7.468765635771829	-10.052637909459694		-0.6845358602461153	판정불가	불리(<1)	0.0	0.0	-100.0	보류	일부부족
3711.TW	3711.TW	Taiwan 50	703.0	98.86845827439888	207.6586433260394		0.0	584.375	339.1825	Y	Y	상승전환/양호	ASE TECHNOLOGY HOLDING CO LTD	TAI	TWD	Technology	Semiconductors	Semiconductors	ASE Technology Holding Co., Ltd., together with its subsidiaries, provides semiconductor manufacturing services in the United States, Taiwan, rest of Asia, Europe, and internationally. It operates through Packaging, Testing, and EMS. The company offers semiconductor packaging, interconnect materials production, front-end engineering testing, wafer probing, and final testing services, as well as integrated solutions for EMS (electronic manufacturing services) in relation to computing, peripherals	3084687769600.0	97.0	10.2	23.585762669903666	-13.347387041498415		111497789000.0	214080678000.0	40733681000.0	263662466000.0	342181952000.0	-23.378628938260114	-5.3782267829267285	-0.7650393716823227	71.21359107237845	-13.347387041498415		1.1746720211522634	판정불가	보통(1~1.5)	0.0	0.0	-100.0	보류	일부부족
