티커	종목코드	유니버스	현재가	3M수익률(보조,%)	6M수익률(보조,%)	12M수익률(보조,%)	52주고점대비(보조,%)	40일이평(보조)	200일이평(보조)	40일선상회(보조)	200일선상회(보조)	추세판정(보조)	종목명	시장	통화	섹터	산업	업종	사업설명	시가총액	배당수익률(%)	EPS(FY)	EPS Growth 1Y(%)	EPS Growth 3Y CAGR(%)	EPS Growth 5Y CAGR(%)	현금및단기투자	장기부채	단기위험부채	총부채	주주지분	주당순현금(린치식)	주당잉여현금흐름	잉여현금흐름수익률(%)	순현금차감PER(린치식)	사용연성장률(%)	린치PER배수	배당감안점수	린치PER판정	배당감안점수판정	그레이엄적정PER(3년)	그레이엄내재가치(3년)	그레이엄괴리율(3년,%)	종합판정	데이터상태
2330.TW	2330.TW	Taiwan 50	2305.0	27.348066298342545	60.06944444444444		-4.948453608247427	2230.25	1680.625	Y	Y	상승전환/양호	TAIWAN SEMICONDUCTOR MANUFACTUR	TAI	TWD	Technology	Semiconductors	Semiconductors	Taiwan Semiconductor Manufacturing Company Limited, together with its subsidiaries, manufactures, packages, tests, and sells integrated circuits and other semiconductor devices in Taiwan, China, Europe, the Middle East, Africa, Japan, the United States, and internationally. It provides various wafer fabrication processes, such as processes to manufacture complementary metal- oxide-semiconductor (CMOS) logic, mixed-signal, radio frequency, embedded memory, bipolar CMOS mixed-signal, and others. T	59774112628736.0	1.05	73.67	46.54981153856048	19.574951863097922		3488279800000.0	896062000000.0	136925700000.0	1064582700000.0	5355038700000.0	99.96069751058748	38.26794070252923	1.6602143471813116	29.931305857057314	19.574951863097922	1.5290615305922086	0.6890762455068393	보통	불리(<1)	47.649903726195845	3510.368407508848	52.293640238995586	보류	충분
2317.TW	2317.TW	Taiwan 50	277.5	31.828978622327785	22.246696035242298		-10.194174757281548	246.9	226.3125	Y	Y	상승전환/양호	HON HAI PRECISION INDUSTRY	TAI	TWD	Technology	Electronic Components	Electronic Components	Hon Hai Precision Industry Co., Ltd. provides electronic manufacturing services. The company offers consumer electronics, including smartphones, feature phones, wearable devices, televisions, game consoles, set-top boxes, and audio systems; cloud and networking products comprising routers, servers, edge computing, data centers, and satellite communications and other related equipment; electronic computing equipment, such as desktop computers, laptops, tablets, multi-function devices and printers	3885532708864.0	2.67	13.39	23.999718516214784	10.202197342011932		2177167157000.0	306085648000.0	940440828000.0	1286493270000.0	1772771627000.0	133.63035351031627	3.6666051717189645	1.321299160979807	10.744559110506627	10.202197342011932	1.0531612700982844	1.1980200592339598	보통	보통(1~1.5)	28.904394684023863	387.0298448190795	39.47021434921785	보류	충분
2454.TW	2454.TW	Taiwan 50	4475.0	168.76876876876875	244.23076923076925		-3.5560344827586188	3317.75	1840.625	Y	Y	상승전환/양호	MEDIATEK INC	TAI	TWD	Technology	Semiconductors	Semiconductors	MediaTek Inc. engages in the research, development, production, manufacture, and marketing of multimedia integrated circuits (ICs) in Taiwan, rest of Asia, and internationally. The company offers multimedia, computer peripherals oriented, consumer-oriented, and other ICs for various applications. It also offers design, test runs, maintenance and repair, and technological consultation services for software and hardware solutions; and sale and delegation patents and circuit layout rights for its I	7142593003520.0	1.31	65.93	-1.0032496768530352	-3.7570524355304835		260128122000.0	60000000.0	4480763000.0	13730009000.0	400600988000.0	162.93870008806817	86.0675425604462	1.9232970404568985	65.40362960582333	-3.7570524355304835		-0.03741462744924795	판정불가	불리(<1)	0.985895128939033	65.00006585095045	-98.54748456198993	보류	일부부족
2308.TW	2308.TW	Taiwan 50	2415.0	97.95081967213115	155.55555555555554		-4.1666666666666625	2154.75	1268.96	Y	Y	상승전환/양호	DELTA ELECTRONIC	TAI	TWD	Technology	Electronic Components	Electronic Components	Delta Electronics, Inc., together with its subsidiaries, provides power and thermal management solutions in Mainland China, the United States, Taiwan, Thailand, and internationally. It operates through Power Electronics, Mobility, Automation, and Infrastructure segments. The company offers inductors, transformer components, networking products, EMI filters, solenoids, current sensing resistors, power modules, and stamping and over molding components; embedded power, adapters, industrial and medi	6273067122688.0	51.0	23.0	70.62397666530782	22.54086445612693		159053571000.0	56703273000.0	17326736000.0	76525994000.0	268057976000.0	39.40272982449256	19.757704684663608	0.8181244175844143	103.28683783371771	22.54086445612693	4.582203936089189	0.7120061568204938	매우 불리	불리(<1)	53.58172891225386	1232.3797649818387	-48.969781988329665	보류	충분
2382.TW	2382.TW	Taiwan 50	375.0	32.97872340425532	34.168157423971365		-10.07194244604317	334.25	292.7525	Y	Y	상승전환/양호	QUANTA COMPUTER	TAI	TWD	Technology	Computer Hardware	Computer Hardware	Quanta Computer Inc. manufactures, processes, and sells laptop computers and cloud-computing server related products in the United States, Mainland China, the Netherlands, Japan, and internationally. The company provides notebook PCs; servers, storage devices, and network switches; cameras, including automotive cameras, camera module, and AI dash-camera and AI body-worn camera; and smart healthcare solutions. It also offers mobile computing solutions for the wireless communication of notebook PC	1445444321280.0	3.45	18.9	25.603756952240488	37.322961044476074		230393427000.0	56578932000.0	258327344000.0	322496262000.0	243577029000.0	45.093699643514476	-6.625869265535222	-1.7668984708093927	17.45535980722146	37.322961044476074	0.4676842168664137	2.3358419130156167	매우 유망	안심(>=2)	60.0	1134.0	202.4	보류	충분
2303.TW	2303.TW	Taiwan 50	127.5	113.5678364666779	180.5280480962395		-12.671232876712324	101.80999994277954	61.09475006103516	Y	Y	상승전환/양호	UNITED MICRO ELECTRONICS	TAI	TWD	Technology	Semiconductors	Semiconductors	United Microelectronics Corporation operates as a semiconductor wafer foundry in Taiwan, China, Hong Kong, Japan, Korea, the United States, Europe, and internationally. It manufactures and sells integrated circuits. The company offers circuit design; mask tooling; wafer fabrication; and assembly and testing services for communication devices, consumer electronics, computer, and other applications. It also provides venture capital and marketing support; consulting and planning; energy technical; 	1599670321152.0	2.36	3.94	-17.259341564967112	-23.3089317909408		146070330000.0	45372054000.0	8408772000.0	59781672000.0	365824997000.0	8.026047643767638	3.915896780636361	3.071291592655969	30.323338161480294	-23.3089317909408		-0.6908517683436386	판정불가	불리(<1)	0.0	0.0	-100.0	보류	일부부족
2412.TW	2412.TW	Taiwan 50	142.0	4.4117647058823595	8.3969465648855		-0.35087719298245723	137.475	134.125	Y	Y	상승전환/양호	CHUNGHWA TELECOM	TAI	TWD	Communication Services	Telecom Services	Telecom Services	Chunghwa Telecom Co., Ltd., together with its subsidiaries, operates as an integrated telecommunications service provider in Taiwan and internationally. The company operates through Consumer Business, Enterprise Business, International Business, and Others segments. Its services primarily include mobile, fixed-line, information and communication technology (ICT), and sales and other services. The company provides mobile services, including prepaid and postpaid plans; fixed-line services, such as	1101557399552.0	3.61	5.01	4.0764742262497045	2.1070421075218615		80236000000.0	24888000000.0	2240000000.0	38019000000.0	384131000000.0	7.134821964796407	6.394372131635488	4.503078965940484	26.91919721261549	2.1070421075218615	12.77582309177283	0.21237788268227442	매우 불리	불리(<1)	12.714084215043723	63.69756191736905	-55.14256203002179	보류	충분
2882.TW	2882.TW	Taiwan 50	104.0	48.57142857142858	58.05470391573439		0.0	80.68249969482422	71.73599969863892	Y	Y	상승전환/양호	CATHAY FINANCIAL HLDG CO	TAI	TWD	Financial Services	Insurance - Life	Insurance - Life	Cathay Financial Holding Co., Ltd., through its subsidiaries, provides various financial products and services in Taiwan, rest of Asia, and internationally. The company offers consumer banking services, such as deposit and remittance services; and credit services, including secured and unsecured consumer loans, adjustable-rate mortgage, revolving mortgage, and government subsidized mortgage. It also provides corporate banking services, including corporate, sustainable, working capital, capital e	1525597863936.0	3.68	7.06	-2.836521477400711	42.07576363585104		790688699000.0	0.0	0.0	441882992000.0	928286508000.0	53.90124614754305	12.470106092966152	11.99048662785207	7.096140772302685	42.07576363585104	0.1686515028869578	6.447978570893454	매우 유망	안심(>=2)	60.0	423.59999999999997	307.30769230769226	매우 유망	충분
2891.TW	2891.TW	Taiwan 50	69.19999694824219	35.68626852596508	59.44699197067782		-1.8439759599401584	56.972499752044676	48.85400001525879	Y	Y	상승전환/양호	CTBC FINANCIAL HOLDINGS COMPANY	TAI	TWD	Financial Services	Banks - Regional	Banks - Regional	CTBC Financial Holding Co., Ltd., together with its subsidiaries, engages in corporate and personal finance, life insurance, and other businesses in Taiwan, Asia, and North America. The company offers commercial banking and capital market services; customized financing and wealth management and credit services; life insurance services; and designs, provides, and trades in various financial products. It is also involved in deposit and loan; securities and futures; venture capital; asset managemen	1361704910848.0	3.52	4.06	11.926931815510834	37.10774106785184		641748921000.0	0.0	0.0	331234874000.0	518343310000.0	32.61281070964325	0.003445605780356632	0.004979199324147018	9.011622226255897	37.10774106785184	0.2428501969381015	4.508371528211702	매우 유망	안심(>=2)	60.0	243.59999999999997	252.02313691169587	매우 유망	충분
2881.TW	2881.TW	Taiwan 50	125.0	43.34862887001489	34.12017606547526		0.0	97.76249961853027	91.94326816558838	Y	Y	상승전환/양호	FUBON FINANCIAL HLDG CO LTD	TAI	TWD	Financial Services	Insurance - Life	Insurance - Life	Fubon Financial Holding Co., Ltd. provides various financial products and services in Taiwan, Asia, and internationally. It operates through Banking Business, Property Insurance Business, Life Insurance Business, Securities Business, and Others segments. The company offers insurance products, including property, casualty, life, health, accident, fire, transportation, fishing vessel, car, liability, engineering and nuclear, guarantee and letter of credit, and personal and commercial multiple peri	1708215238656.0	3.57	8.38	-19.809129596654984	37.10650367758417		922185721000.0	0.0	0.0	600644627000.0	982581684000.0	67.48166890931621	0.4210099576148224	0.3368079660918579	6.863762659986132	37.10650367758417	0.18497465348998893	5.92626897120396	매우 유망	안심(>=2)	60.0	502.80000000000007	302.24	매우 유망	충분
2886.TW	2886.TW	Taiwan 50	43.54999923706055	11.096934666985202	8.064516281705657		0.0	40.07250003814697	40.387749919891355	Y	Y	상승전환/양호	MEGA FINANCIAL HOLDING CO	TAI	TWD	Financial Services	Banks - Regional	Banks - Regional	Mega Financial Holding Co., Ltd. provides various financial services in Taiwan. It offers brokerage, dealing and underwriting of short-term debt instruments and financial debentures; notary services for short-term debt instruments and financial debentures; guarantee or endorsement services for short-term debt instruments; brokerage for inter-bank call loans; proprietary trading in government bonds; and foreign and domestic securities brokerage, securities dealing, securities underwriting, and fu	645993594880.0	3.88	2.36	0.783077986276548	24.094823796719123		877500768000.0	0.0	0.0	108798705000.0	392369102000.0	59.15717588520136	10.708101147312195	24.588062766714643	-6.613210444127464	24.094823796719123	-0.2744660222428335		판정불가	판정불가	56.689647593438245	133.78756832051425	207.20452506153566	보류	충분
2884.TW	2884.TW	Taiwan 50	34.20000076293945	2.5487326168183833	12.131150042424444		-2.564096154719786	32.18125004768372	32.565500001907346	Y	Y	상승전환/양호	E SUN FINANCIAL HOLDINGS	TAI	TWD	Financial Services	Banks - Regional	Banks - Regional	E.SUN Financial Holding Company, Ltd., together with its subsidiaries, offers various financial banking products and services in Taiwan. It operates through Corporate Banking Unit; Individual Banking Unit; Overseas Branches and Subsidiaries; and Others segments. The company provides deposits; bills/checks discounting; syndicated loans; domestic remittances; commercial acceptances; domestic letters of credit and guarantees; custodian services and warehousing; rental of safe deposit boxes; and cre	553150840832.0	3.65	2.12	31.44091638294586	29.648238579086495		406218940000.0	0.0	0.0	81352877000.0	272743929000.0	25.11555212068752	2.1025866205020405	6.147913957886489	4.2851172840811	29.648238579086495	0.14453193476066295	7.770671459282349	매우 유망	안심(>=2)	60.0	127.2	271.92981626432953	매우 유망	충분
2885.TW	2885.TW	Taiwan 50	64.80000305175781	46.77236877053046	80.00000847710504		-0.765696748289113	55.48249998092651	41.94866493225098	Y	Y	상승전환/양호	YUANTA FINANCIAL HOLDING CO. LT	TAI	TWD	Financial Services	Financial Conglomerates	Financial Conglomerates	Yuanta Financial Holding Co., Ltd., together with its subsidiaries, provides financial services in Taiwan. The company offers brokerage, investment banking, derivative products, fixed income, institutional brokerage, international finance, strategic trading, overseas business, digital finance, reg and transfer, and wealth management services; corporate, consumer, and digital finance products and services; and life, health, accident, and investment-linked insurance products. It also provides futu	863858524160.0	2.43	2.74	2.7414463472456685	20.12129776441045		938214637000.0	217509768000.0	158925388000.0	383094061000.0	340417373000.0	54.06171778128669	-4.071624878573867	-6.283371430278686	3.91908221550041	20.12129776441045	0.19477283530052855	5.754229312979844	매우 유망	안심(>=2)	48.7425955288209	133.55471174896928	106.10294052346711	보류	충분
2880.TW	2880.TW	Taiwan 50	35.45000076293945	2.456654122265678	21.404109029793172		-6.955374848588547	33.405000066757204	31.623346519470214	Y	Y	상승전환/양호	HUA NAN FINANCIAL HOLDINGS CO	TAI	TWD	Financial Services	Banks - Regional	Banks - Regional	Hua Nan Financial Holdings Co., Ltd., together with its subsidiaries, provides financial services in Taiwan and internationally. It operates through Bank, Securities, Insurance, and Other segments. The company provides various banking services, including commercial banking, offshore banking, overseas branch banking, and other banking services. It also engages in the trust business planning, managing, and operating; custody of nondiscretionary trust funds and mutual funds; trading and underwritin	493356417024.0	3.73	1.9	14.228828562366536	15.145821422405326		304634035000.0	0.0	0.0	131545560000.0	236357548000.0	21.8894015325899	0.15652701576816497	0.44154305331300087	7.1371574896576595	15.145821422405326	0.4712294758143397	2.6447253615683803	매우 유망	안심(>=2)	38.79164284481065	73.70412140514024	107.91007001103607	매우 유망	충분
1101.TW	1101.TW	Taiwan 50	23.950000762939453	-1.4403229839913045	9.111616995370753		-12.271057024695342	24.503750038146972	23.725250034332277	N	Y	상승전환/양호	TCC GROUP HOLDINGS CO LTD	TAI	TWD	Basic Materials	Building Materials	Building Materials	TCC Group Holdings Co., Ltd. manufactures and markets cement, cement-related products, and ready-mixed concrete in Asia, Europe, and Africa. It operates through Cement, Electricity and Energy, Social Aspect of Energy Transition, and Other segments. The company is also involved in the thermal and renewable energy generation; and land and marine transportation business, and production and sale of refractory materials, etc. In addition, it provides engineering, property leasing and development, ene	179461718016.0	3.35	-1.6	36.199999999999996			146558691000.0	165639430000.0	40338866000.0	212904295000.0	231910589000.0	-2.5464133928683435	0.823563607556843	3.4386788364167247		36.199999999999996			판정불가	판정불가				판정불가	일부부족
1301.TW	1301.TW	Taiwan 50	45.54999923706055	-3.801476863920761	15.316453764710246		-16.42201974851276	49.05375003814697	43.3527501487732	N	Y	상승전환/양호	FORMOSA PLASTIC	TAI	TWD	Basic Materials	Specialty Chemicals	Specialty Chemicals	Formosa Plastics Corporation engages in the manufacture and sale of plastic raw materials, chemical fibers, and related petrochemical industrial products in Taiwan, China, and internationally. It operates through Plastic, Polyolefin, Polypropylene, Tairylan, Chemical, and Other segments. The company offers plastic raw materials, such as polyvinyl chloride, high-density polyethylene, linear low-density polyethylene, ethylene vinyl acetate copolymer, polyethylene wax, polypropylene, polyacetal, an	289959510016.0	1.09	-1.58	6379.2			226906866000.0	76514793000.0	52416194000.0	130740908000.0	363222429000.0	23.62522650544532	-1.247549971008874	-2.7388583795932053		6379.2			판정불가	판정불가				보류	일부부족
1303.TW	1303.TW	Taiwan 50	99.19999694824219	33.873143037765495	94.12915833741305		-12.212392081201607	91.7375	65.34200004577637	Y	Y	상승전환/양호	NAN YA PLASTIC	TAI	TWD	Basic Materials	Specialty Chemicals	Specialty Chemicals	Nan Ya Plastics Corporation engages in the manufacture and sale of plastic products, polyester fibers, petrochemical products, and electronic materials in Taiwan, China, the United States, and internationally. It provides plastic products, such as PP synthetic paper, adhesives, optical films, outdoor decoration materials, TPU films, synthetic leathers, PU resins, doors, Neuma fire-rated doors and windows, plastic pallets, PVC cling and PE Stectch films, BOPP film, engineering and PVC compounds, 	786737528832.0	82.0	0.57	35.28214030056922	-47.98534220948065		82098101000.0	79337053000.0	93325453000.0	173213953000.0	355665838000.0	0.3481414662944144	-0.3379180619612948	-0.34064321810171455	173.4243078630663	-47.98534220948065		0.19613546803010398	판정불가	불리(<1)	0.0	0.0	-100.0	보류	일부부족
2002.TW	2002.TW	Taiwan 50	18.75	-2.088770895552494	3.3057872952082956		-11.764705882352944	18.98750009536743	19.20325005531311	N	N	중립	CHINA STEEL CORP	TAI	TWD	Basic Materials	Steel	Steel	China Steel Corporation manufactures and sells steel products in Taiwan, Vietnam, Malaysia, China, India, and internationally. It offers steel plates primarily for use in construction structures, shipbuilding, bridge beams, oil country tabular goods, machine structures, pressure vessels, and in climate/corrosion-resistant steel plates; steel bars and wire rods for applications in general and machine structures, cold and hot forging, hard drawn steel wires, and welding electrodes; and hot-rolled 	286500126720.0	1.77	-0.29				90355113000.0	182746145000.0	77492200000.0	271100183000.0	292633521000.0	-6.061712385961833	1.1196561050556681	5.971499226963563					판정불가	판정불가				판정불가	일부부족
1216.TW	1216.TW	Taiwan 50	74.0999984741211	4.661010282656131	-1.462763987714244		-14.827587960780352	72.31499977111817	74.99099998474121	Y	N	상승전환/양호	UNI-PRESIDENT ENTERPRISES CORP	TAI	TWD	Consumer Defensive	Packaged Foods	Packaged Foods	Uni-President Enterprises Corp. engages in the manufacture and sale of beverages and instant noodles in Taiwan, China, and Southeast Asia. It operates through Beverages, Food, and Others segments. The company offers animal feeds, wheat flour, and aquatic products; dairy, tea, coffee, water, and general beverages; edible oils, snack noodles, and cooking noodles; sauce and seasoning, meat, ice cream, and frozen prepared foods. It also provides trade marketing, developing, and managing distribution	421037309952.0	4.12	3.44	-5.058179913923699	4.563089403388387		165919037000.0	98835952000.0	79360712000.0	308708893000.0	135782210000.0	11.806213992747292	7.226537944725595	9.75241308169448	18.10865827946913	4.563089403388387	3.9685083237734253	0.47949932399094003	매우 불리	불리(<1)	17.626178806776775	60.63405509531211	-18.17266350351123	보류	충분
2207.TW	2207.TW	Taiwan 50	483.0	-4.35643564356436	-20.16528925619835		-22.22222222222222	482.3875	542.4175	Y	N	주의	HOTAI MOTOR CO	TAI	TWD	Consumer Cyclical	Auto & Truck Dealerships	Auto & Truck Dealerships	Hotai Motor Co.,Ltd., together with its subsidiaries, exports and imports, trades, and sells vehicles, automobile air conditioners, and related parts in Taiwan and Mainland China. It is also involved in the installment sales and vehicle leasing, used vehicles selling, property and casualty insurance, trading of vehicle products/accessories, solar power, energy storage, and vehicle repairing activities, electronic parts and components manufacturing, as well as property management business. In add	269080641536.0	4.23	33.91	-7.654131088708249			50924322000.0	8733259000.0	301578234000.0	313105900000.0	86158179000.0	75.73299833254464	42.95654836882807	8.893695314457156	12.010233018798449	-7.654131088708249		-0.2851011369511973	판정불가	불리(<1)	8.5	288.23499999999996	-40.324016563147005	보류	일부부족
1326.TW	1326.TW	Taiwan 50	48.25	12.078979918919286	52.689871574475845		-14.601769911504425	49.27500009536743	37.606000061035154	N	Y	상승전환/양호	FORMOSA CHEMICAL & FIBRE CO	TAI	TWD	Basic Materials	Chemicals	Chemicals	Formosa Chemicals & Fibre Corporation produces and sells petrochemical products, nylon, and rayon fibers in Taiwan and internationally. The company offers plastic products, including PS resin, ABS resin, PP resin, PC resin, homopolymer PP, polycarbonate, PC/ABS alloy, PP composite materials, SAN andASA resin, and nylon resin; petrochemical, such as benzene, para-xylene, ortho-xylene, meta-xylene, styrene monomer, phenol, acetone, PTA, and PIA; fibers, includes nylon 6 chip, full drawn yarn, part	282215022592.0	1.23	-0.99				225714011000.0	63844980000.0	63720846000.0	128580720000.0	345866503000.0	27.674572989185965	1.8442112794284715	3.8221995428569358					판정불가	판정불가				판정불가	일부부족
3008.TW	3008.TW	Taiwan 50	3885.0	70.0218818380744	75.39503386004516		-2.509410288582181	3078.125	2462.875	Y	Y	상승전환/양호	LARGAN PRECISION CO	TAI	TWD	Technology	Electronic Components	Electronic Components	Largan Precision Co., Ltd., together with its subsidiaries, designs, manufactures, and sells precision optical plastic lenses in China, South Korea, Vietnam, Japan, Taiwan, and internationally. The company offers mobile phone lens, voice coil motors, image lens modules, sleep health monitoring products, automotive and contact lenses, silicon carbide crystals, titanium niobate anode materials, and fiber optic lasers and space communications products, as well as video cameras, cameras, monocular a	508151005184.0	2.26	157.31	-17.904416715768722	-2.029321415748375		155056231000.0	0.0	1228000.0	120112000.0	188867185000.0	1185.4615320117907	103.71201064797552	2.669549823628713	17.16062849143862	-2.029321415748375		0.013442315610218435	판정불가	불리(<1)	4.44135716850325	698.6698961772462	-82.01621888861656	보류	일부부족
5871.TW	5871.TW	Taiwan 50	119.5	20.100502512562812	15.458937198067634		-6.597701804692402	113.825	108.73	Y	Y	상승전환/양호	CHAILEASE HOLDING COMPANY LIMIT	TAI	TWD	Financial Services	Credit Services	Credit Services	Chailease Holding Company Limited, an investment holding company, provides leasing and financial products and services in Taiwan, Mainland China, ASEAN countries, and internationally. The company offers leasing services, including capital and operating leases for machinery, medical equipment, airplanes, boats, and office equipment; installment sales services for raw materials, semi-finished and finished products, furniture and fixtures, and production equipment, as well as for customers in vario	204514836480.0	5.28	11.24	-12.290661443557727	-10.052637909459694		182181078000.0	129895323000.0	544000413000.0	682487506000.0	182441248000.0	30.551074253924646	11.408862081138622	9.547164921454913	7.913605493423074	-10.052637909459694		-0.6030927259927462	판정불가	불리(<1)	0.0	0.0	-100.0	보류	일부부족
3711.TW	3711.TW	Taiwan 50	569.0	77.8125	161.60919540229887		-11.370716510903423	529.1125	303.615	Y	Y	상승전환/양호	ASE TECHNOLOGY HOLDING CO LTD	TAI	TWD	Technology	Semiconductors	Semiconductors	ASE Technology Holding Co., Ltd., together with its subsidiaries, provides semiconductor manufacturing services in the United States, Taiwan, rest of Asia, Europe, and internationally. It operates through Packaging, Testing, and EMS. The company offers semiconductor packaging, interconnect materials production, front-end engineering testing, wafer probing, and final testing services, as well as integrated solutions for EMS (electronic manufacturing services) in relation to computing, peripherals	2496710311936.0	98.0	10.21	23.585762669903666	-13.347387041498415		111497789000.0	214080678000.0	40733681000.0	263662466000.0	342181952000.0	-23.378628938260114	-5.3782267829267285	-0.9452068159800928	58.01945435242508	-13.347387041498415		1.4590384191533385	판정불가	보통(1~1.5)	0.0	0.0	-100.0	보류	일부부족
