티커	종목코드	유니버스	현재가	3M수익률(보조,%)	6M수익률(보조,%)	12M수익률(보조,%)	52주고점대비(보조,%)	40일이평(보조)	200일이평(보조)	40일선상회(보조)	200일선상회(보조)	추세판정(보조)	종목명	시장	통화	섹터	산업	업종	사업설명	시가총액	배당수익률(%)	EPS(FY)	EPS Growth 1Y(%)	EPS Growth 3Y CAGR(%)	EPS Growth 5Y CAGR(%)	현금및단기투자	장기부채	단기위험부채	총부채	주주지분	주당순현금(린치식)	주당잉여현금흐름	잉여현금흐름수익률(%)	순현금차감PER(린치식)	사용연성장률(%)	린치PER배수	배당감안점수	린치PER판정	배당감안점수판정	그레이엄적정PER(3년)	그레이엄내재가치(3년)	그레이엄괴리율(3년,%)	종합판정	데이터상태
6669.TW	6669.TW	Taiwan 50	5035.0	49.40652818991098	20.59880239520957		-13.039723661485315	5121.0	4163.325	N	Y	상승전환/양호	WIWYNN CORPORATION	TAI	TWD	Technology	Computer Hardware	Computer Hardware	Wiwynn Corporation engages in the research, development, design, testing, and sales of semi products, and peripheral equipment and parts in the United States, Europe, Asia, and internationally. The company also offers computer and peripheral equipment, data storage media products, electric appliances, and software products; and provides management consulting, information software, and data processing services. In addition, it provides multi-node and storage server, storage, open rack, edge/ai pl	2807125245952.0	3.12	265.59	124.43706509365401	53.35114708016857		89933848000.0	27984645000.0	72197241000.0	104069333000.0	124652762000.0	111.11518747966012	-26.109945905256076	-0.518568935556228	18.539420959073535	53.35114708016857	0.34749807593105936	3.0460038209839855	매우 유망	안심(>=2)	60.0	15935.399999999998	216.49255213505455	보류	충분
3034.TW	3034.TW	Taiwan 50	538.0	37.59590792838874	42.70557029177719		-5.114638447971787	496.725	416.3175	Y	Y	상승전환/양호	NOVATEK MICROELECTRONICS	TAI	TWD	Technology	Semiconductors	Semiconductors	Novatek Microelectronics Corp., a fabless chip design company, designs, develops and sells a range of display driver integrated circuits (IC) and system-on-a-chip (SoC) solutions in Taiwan, Asia, and internationally. The company offers display driver ICs for LCD displays, televisions (TVs), notebook computers, desktop monitors, cameras, tablets, PCs, automotive displays, smartphones, and wearable products. The company also provides SoC solutions, including timing controllers, LCD monitors, TVs, 	327379189760.0	4.3	26.86	-19.635846408771286	-16.390208004150118		42974255000.0	0.0	74993000.0	552286000.0	67739247000.0	70.62193103873939	20.017415645455976	3.720709227779921	17.400523788580067	-16.390208004150118		-0.6948186244878961	판정불가	불리(<1)	0.0	0.0	-100.0	보류	일부부족
2357.TW	2357.TW	Taiwan 50	657.0	16.903914590747338	13.864818024263425		-29.430719656283564	741.1	624.5875	N	Y	상승전환/양호	ASUSTEK COMPUTER INC	TAI	TWD	Technology	Computer Hardware	Computer Hardware	ASUSTeK Computer Inc. researches and develops, designs, manufactures, sells, and repairs 3C information products in Taiwan, China, Singapore, Europe, the United States, and internationally. The company provides phone and accessories; laptops for home, work, creators, students, gaming, and accessories; monitors, projectors, all-in-one PCs, tower PCs, gaming tower PCs, NUCs, mini-PCs, and accessories; and motherboards, graphics cards, cases, cooling, power supply units, sound cards, optical drives	487993475072.0	6.0	59.5	41.93166968721522	44.75258349821978		108306629000.0	293123000.0	29754617000.0	31769504000.0	268296918000.0	145.42175841713023	37.02223010632717	5.635042634144166	8.597953640048232	44.75258349821978	0.192121950688953	5.902867777958276	매우 유망	안심(>=2)	60.0	3570.0	443.37899543378995	매우 유망	충분
4938.TW	4938.TW	Taiwan 50	82.5999984741211	5.0890586229680235	19.36416490870856		-16.142133528811076	85.13500003814697	75.45049991607667	N	Y	상승전환/양호	PEGATRON CORPORATION	TAI	TWD	Technology	Computer Hardware	Computer Hardware	Pegatron Corporation, together with its subsidiaries, designs, develops, manufactures, and sells computer, communication, and consumer electronic products in Europe, the United States, Taiwan, China, Japan, and internationally. The company offers notebooks, desktops, PCs, motherboards, rugged computers, and servers; tablets and game consoles; and smartphones, cable modems, set-top boxes, and network switches. It also provides automotive products; and smart electronics, including Internet of Thin	221536845824.0	4.78	5.34	-14.660756568839329	-1.5555407129723142		160438242000.0	14142988000.0	59107439000.0	75095748000.0	207343291000.0	54.54617760996602	-0.83960215176223	-1.016467514857498	5.253524506396081	-1.5555407129723142		0.6137706758771105	판정불가	불리(<1)	5.388918574055372	28.77682518545568	-65.16122794545622	보류	일부부족
2892.TW	2892.TW	Taiwan 50	33.20000076293945	17.939613544736677	13.50427611261351		0.0	29.951249837875366	29.15324995994568	Y	Y	상승전환/양호	FIRST FINANCIAL HOLDING CO LTD	TAI	TWD	Financial Services	Banks - Regional	Banks - Regional	First Financial Holding Co., Ltd., together with its subsidiaries, provides various financial products and services in Asia, North America, Oceania, and Europe. It operates through four segments: Bank, Security, Insurance, and Other. The company engages in commercial banking products and services; trading and proprietary trading of securities, securities underwriting, stock brokerage services, margin trading, and issuing warrant; securities investment trust funds and discretionary investment ser	477398368256.0	2.9	1.87	6.2043853474740285	9.354208373482065		408389857000.0	0.0	0.0	128816067000.0	292366858000.0	28.40090040461961	4.267165671660615	12.852908354218995	2.566363827978526	9.354208373482065	0.2743539298583326	4.7749302884830875	매우 유망	안심(>=2)	27.20841674696413	50.87973931682293	53.25222333614836	매우 유망	충분
5880.TW	5880.TW	Taiwan 50	24.850000381469727	7.112067087368579	0.40404194533223414		-2.8633726023495787	23.53875012397766	23.816250019073486	Y	Y	상승전환/양호	TAIWAN COOPERATIVE FINANCIAL HL	TAI	TWD	Financial Services	Banks - Regional	Banks - Regional	Taiwan Cooperative Financial Holding Co., Ltd., together with its subsidiaries, provides banking, insurance, securities, bills finance, investment trust, asset management, and capital management services in Taiwan. The company offers general deposits and loans. It is also involved in the planning, management, and operation of the trust business; securities investment trust, discretionary investment, and securities investment consulting business; venture capital activities; investment consulting;	389671256064.0	2.82	1.36	10.795205957729625	1.692729712658969		499854174000.0	0.0	0.0	133679747000.0	279252593000.0	31.876552139489633	0.2601705663488455	1.046964033621709	-5.166582175014637	1.692729712658969	-3.052219226954361		판정불가	판정불가	11.885459425317938	16.164224818432398	-34.952818630595196	보류	충분
2912.TW	2912.TW	Taiwan 50	223.5	0.0	0.6756756756756799		-16.759776536312852	224.925	229.865	N	N	중립	PRESIDENT CHAIN STORE CORP	TAI	TWD	Consumer Defensive	Grocery Stores	Grocery Stores	President Chain Store Corporation operates and manages convenience stores, restaurants, drugstores, department stores, supermarkets, and online shopping stores in Taiwan and internationally. It operates through Convenience Stores, Retail Business Group, Logistics Business Group, and Other Operating segments. The company engages in the logistics and storage of publication and e-commerce; trade, enterprise information management and consultancy, and art and cultural exhibition activities; operatio	232355577856.0	4.04	10.75	-2.8466174876112804	6.49584678036641		53581230000.0	15164601000.0	21368169000.0	141409381000.0	42561437000.0	36.952488093860595	18.0470213192964	8.074729896776914	17.353256921501337	6.49584678036641	2.6714387682220693	0.6071394452364789	매우 불리	불리(<1)	21.49169356073282	231.0357057778778	3.371680437529223	보류	충분
6505.TW	6505.TW	Taiwan 50	53.599998474121094	-4.9645442836965925	11.088079739111079		-21.4076233540028	52.837499904632566	50.1210000038147	Y	Y	상승전환/양호	FORMOSA PETROCHEMICAL CORPORATI	TAI	TWD	Energy	Oil & Gas Refining & Marketing	Oil & Gas Refining & Marketing	Formosa Petrochemical Corporation, together with its subsidiaries, engages in the production and sale of petroleum products and petrochemical raw materials in Taiwan, Australia, South Korea, the Philippines, Singapore, Malaysia, Mainland China, and internationally. The company offers gasoline, diesel, jet fuel/kerosene, fuel oil/asphalt/sulfur, naphtha, base oil, liquified petroleum gas, and lubricants. It also provides ethylene, propylene, butadiene, and BTX; and electricity, steam, and other u	510591434752.0	2.18	1.04	65.39056473393204	-11.858616047153191		200328918000.0	8825000000.0	8835896000.0	21130412000.0	355792088000.0	20.103372048591428	3.8845712138199193	7.247334560457965	32.208294639932376	-11.858616047153191		-0.3005007298695499	판정불가	불리(<1)	0.0	0.0	-100.0	보류	일부부족
2603.TW	2603.TW	Taiwan 50	185.5	-8.845208845208841	0.8152173913043459		-21.729957805907173	209.7375	194.8775	N	N	중립	EVERGREEN MARINE CORP(TAIWAN)	TAI	TWD	Industrials	Marine Shipping	Marine Shipping	Evergreen Marine Corporation (Taiwan) Ltd., together with its subsidiaries, engages in the shipping carrier and agency, container terminal operations, and commercial port area ship repair businesses in Taiwan, North America, Europe, Asia, and internationally. The company provides cargo loading and discharging, terminal, inland transportation, real estate leasing, security, computer system, terminal logistics, leasing storehouse, management consultancy and self-owned property leasing, and contain	401615454208.0	8.67	31.64	-50.82184326762367	-41.016405023033144		197518389000.0	54439928000.0	0.0	165741821000.0	563818129000.0	66.08573640338783	36.58146189244278	19.720464632044628	3.774154980929588	-41.016405023033144		-8.57050258573804	판정불가	불리(<1)	0.0	0.0	-100.0	보류	일부부족
2615.TW	2615.TW	Taiwan 50	78.30000305175781	0.1278850478495741	0.3846192971254103		-16.07716989213688	80.56000003814697	78.72899990081787	N	N	중립	WAN HAI LINES	TAI	TWD	Industrials	Marine Shipping	Marine Shipping	Wan Hai Lines Ltd. operates as a fully containerized shipping company in Asia, the Middle East, India, Red Sea, the United States, and South America. The company engages in international marine and freight transportation; and management of container. It also provides cargo tracking/terminal info, shipping schedule, documentation, and other services; and storage and logistics, shipping agency, container storage, and information software services. In addition, the company is involved in the sale a	219721269248.0	3.79	11.2	-33.63087517720952	-30.337164256193983		147371856000.0	46058874000.0	8802145000.0	66661245000.0	275317207000.0	36.10395451926528	3.186486278834205	4.069586404393721	3.767504333258262	-30.337164256193983		-7.0463526801666925	판정불가	불리(<1)	0.0	0.0	-100.0	보류	일부부족
2327.TW	2327.TW	Taiwan 50	1140.0	341.86046511627904	415.83710407239823		0.0	752.725	342.4125	Y	Y	상승전환/양호	YAGEO CORP	TAI	TWD	Technology	Electronic Components	Electronic Components	Yageo Corporation, together with its subsidiaries, manufactures and sells electronic components in China, Europe, the United States, and the rest of Asia. It offers antennas, radio frequency, and microwave; capacitors; circuit protection; custom products; electromechanical devices; EMC; engineering kits; inductors; piezoelectric devices; power supplies; resistors; semiconductors; sensors; signal magnetics and connectors; and transformers. The company's products are used for various applications,	2346952687616.0	53.0	12.65	22.099803869339073	1.3081472653207582		114742022000.0	62087637000.0	86197379000.0	150894630000.0	170877823000.0	25.57614287504765	11.927875062251228	1.0463048300220374	88.09674759881045	1.3081472653207582	67.34467130289731	0.6164602978606905	매우 불리	불리(<1)	11.116294530641516	140.6211258126152	-87.6648135252092	보류	충분
3037.TW	3037.TW	Taiwan 50	1040.0	110.73961499493414	390.566037735849		-4.147465437788023	945.15	444.8848966217041	Y	Y	상승전환/양호	UNIMICRON TECHNOLOGY	TAI	TWD	Technology	Electronic Components	Electronic Components	Unimicron Technology Corp., together with its subsidiaries, engages in the manufacturing, processing, and sale of printed circuit boards, electrical equipment, electronic products, and integrated circuit product testing and burn-in systems in Taiwan, China, Asia, the Americas, and internationally. The company offers PCB products, including HDI, ELIC, multi-layer and rigid flex PCBs, and FPC; IC carriers, such as FCCSP, FCBGA, CSP, memory module, and coreless; connectors comprising PCBeam and X-B	1637111562240.0	19.0	4.39	31.307777963397943	-39.15067182208464		55226513000.0	34873158000.0	22207016000.0	57080174000.0	100569302000.0	12.929777846074714	-7.044326051426996	-0.6773390434064419	233.95677042230645	-39.15067182208464		-0.08612989393600975	판정불가	불리(<1)	0.0	0.0	-100.0	보류	일부부족
3045.TW	3045.TW	Taiwan 50	118.0	8.25688073394495	12.91866028708133		-2.0746887966805017	115.225	109.64	Y	Y	상승전환/양호	TAIWAN MOBILE CO	TAI	TWD	Consumer Cyclical	Specialty Retail	Specialty Retail	Taiwan Mobile Co., Ltd. provides telecommunications, broadband, retail, digital, and financial services in Taiwan and internationally. It operates through Telecommunications, Retail, Cable Television and Broadband, and Others segments. The company provides 5g, postpaid, prepaid, e-sim, international call, international roaming, and gaming services. Taiwan Mobile Co., Ltd. was incorporated in 1997 and is based in Taipei, Taiwan.	357638078464.0	4.07	4.83	4.492225214732648	9.403068233707245		13361407000.0	61415627000.0	21702384000.0	96404740000.0	86139857000.0	-15.855130082202884	8.641194731867953	7.323046382938944	27.713277449731446	9.403068233707245	2.9472589968439733	0.4861593241054138	매우 불리	불리(<1)	27.30613646741449	131.888639137612	11.770033167467787	보류	충분
6415.TW	6415.TW	Taiwan 50	588.0	105.95446584938703	189.6551724137931		-12.63001485884101	551.9375	316.5075	Y	Y	상승전환/양호	SILERGY CORP	TAI	TWD	Technology	Semiconductors	Semiconductors	Silergy Corp. designs, manufactures, and sales of various integrated circuit products and related technical services in China and internationally. The company offers DC-DC and AC-DC regulators, AC and DC LED drives, power and battery management IC's, power modules, protection switch IC's, low dropout regulators, sensors, ESD protection, audio products, amplifiers, data converters, motor and DC LED drivers, voltage reference products, MCU and mixed-signal ICs, clock generators, and embedded proce	228351557632.0	43.0	6.28	8.385873715869895	-25.690270567653716		24353135000.0	2695036000.0	729497000.0	3589013000.0	37316511000.0	55.76910439728803	0.22407448893146184	0.03810790628086086	84.7501426118968	-25.690270567653716		0.2042442513827278	판정불가	불리(<1)	0.0	0.0	-100.0	보류	일부부족
2395.TW	2395.TW	Taiwan 50	503.0	56.45412130637637	83.91224862888483		-3.6398467432950166	481.2125	349.0125	Y	Y	상승전환/양호	ADVANTECH CO LTD	TAI	TWD	Technology	Computer Hardware	Computer Hardware	Advantech Co., Ltd. engages in the research and development, design, manufacturing, and marketing of embedded computing boards, industrial automation products, and applied and industrial computers. The company operates through Intelligent Systems; Embedded Design-In; IoT Automation; Intelligent Service; and Advantech Service Plus and Others segments. It offers AIOT software, distribution, and services, application focus embedded, arm-based computing platforms, computer on modules, digital signag	436731772928.0	2.28	12.84	17.628700470636606	-0.5125786354135187		27070551000.0	150327000.0	77029000.0	1994309000.0	54947481000.0	31.005010054661422	7.934834737300375	1.5775019358450049	36.7597344194189	-0.5125786354135187		0.048080362725711465	판정불가	불리(<1)	7.474842729172963	95.97698064258084	-80.919089335471	보류	일부부족
2379.TW	2379.TW	Taiwan 50	829.0	69.87704918032787	61.284046692607006		-7.888888888888889	650.425	540.015	Y	Y	상승전환/양호	REALTEK SEMICONDUCTOR CORP	TAI	TWD	Technology	Semiconductors	Semiconductors	Realtek Semiconductor Corp., together with its subsidiaries, engages in the research, development, production, and sale of various integrated circuits and related application software in Taiwan, Asia, and internationally. It provides communications network ICs, including broadband access controllers, gateway controllers, digital home centers, gigabit ethernet, switch controllers, wireless LAN ICs, and DTV demodulators, as well as Bluetooth, GNSS, and Internet of Things products. The company also	425163423744.0	3.16	28.05	-3.5195699659979707	-3.0782274650865915		109685323000.0	0.0	10095000000.0	11385412000.0	52202368000.0	213.86866083145011	35.78080306046644	4.316140296799329	21.929816013139032	-3.0782274650865915		0.003728829045552203	판정불가	불리(<1)	2.343545069826817	65.73643920864222	-92.07039334033267	보류	일부부족
2474.TW	2474.TW	Taiwan 50	203.0	7.12401055408971	6.5616797900262425		-21.011673151750976	206.0625	198.47	N	Y	상승전환/양호	CATCHER TECHNOLOGY	TAI	TWD	Industrials	Metal Fabrication	Metal Fabrication	Catcher Technology Co., Ltd., together with its subsidiaries, engages in the manufacture and sale of aluminum and magnesium extrusions, alloy housings, and molds in Taiwan, China, the United States, Singapore, and internationally. Its products include chassis and interior mechanical components; upper case, lower case, keyboard cover, and monitor casings for notebook computers; casings for various server specifications and desktop computers; industrial computer casings and internal parts; and com	109380673536.0	4.92	11.31	-45.850088476855554	-13.129081883496463		166299185000.0	0.0	62082792000.0	62642682000.0	142844857000.0	308.63526850809774	1.0025591649656878	0.49387150983531414	-9.339988373837112	-13.129081883496463			판정불가	판정불가	0.0	0.0	-100.0	판정불가	일부부족
4904.TW	4904.TW	Taiwan 50	103.5	13.736263736263732	18.015967618656227		-7.9999999999999964	101.1974998474121	92.80800006866455	Y	Y	상승전환/양호	FAR EASTONE TELECOMMUNICATIONS	TAI	TWD	Communication Services	Telecom Services	Telecom Services	Far EasTone Telecommunications Co., Ltd. provides mobile telecommunications services in Taiwan and internationally. The company offers postpaid products, such as wireless postpaid and broadband, and data booster; prepaid products; and SMS and eSIM products. It also provides mobile communication and lifestyle services, including mobile communication voice, internet access, and related services, as well as mobile phones and accessories; and cable network, enterprise customer services, communicatio	373397487616.0	3.63	3.8	6.923482474870757	12.64259853453671		9372288000.0	37946397000.0	5199584000.0	53567997000.0	92140651000.0	-7.920300856084408	7.162856996345322	6.920634779077606	29.321131804232742	12.64259853453671	2.3192330061050397	0.55497852685849	매우 불리	불리(<1)	33.78519706907342	128.383748862479	24.042269432346863	보류	충분
2408.TW	2408.TW	Taiwan 50	421.0	90.9297052154195	155.9270516717325		-16.633663366336638	363.9625	217.4932499885559	Y	Y	상승전환/양호	NANYA TECHNOLOGY CORPORATION	TAI	TWD	Technology	Semiconductors	Semiconductors	Nanya Technology Corporation research, develops, manufactures, and sells semiconductor products in Taiwan, Japan, Malaysia, China, the United States, Thailand, Germany, Singapore, Poland and internationally. It offers standard dynamic random-access memory (DRAM), low power DRAM, MCP and eMCP, and KGD products, as well as modules; and other memory products and Elixir brands. The company engages in the import and export of its machinery, equipment, and raw materials. Its products have applications	1304522260480.0	30.0	10.81		-23.232591966740635		58074065000.0	14196100000.0	5059500000.0	23617455000.0	170399852000.0	14.160449855886213	1.5764312972202954	0.37444923924472573	37.63548104940923	-23.232591966740635		0.17981457509138424	판정불가	불리(<1)	0.0	0.0	-100.0	보류	일부부족
1590.TW	1590.TW	Taiwan 50	1375.0	39.31104356636273	48.168103448275865		-11.290322580645162	1387.75	1069.285	N	Y	상승전환/양호	AIRTAC INTERNATIONAL GROUP	TAI	TWD	Industrials	Specialty Industrial Machinery	Specialty Industrial Machinery	Airtac International Group manufactures and sells pneumatic control components in Taiwan and internationally. The company offers preparation units and control components comprising solenoid, pneumatic and flow control, ordinary coils, and other valves. It also provides actuators, such as standard, mini, compact, slide table, guided, rodless magnetic, clamp, free mount, and rotary table cylinders; air grippers; GA series, GP series, pressure switch, vacuum components, and other series; and cylind	275000000512.0	2.18	41.92	10.184337557847734	11.787839441212888		4192979000.0	0.0	328670000.0	457708000.0	52581178000.0	20.96489520964895	24.213870242138704	1.761008744882815	32.30045574404463	11.787839441212888	2.74015063618148	0.4324347480387547	매우 불리	불리(<1)	32.07567888242578	1344.6124587512886	-2.21000299990628	보류	충분
9910.TW	9910.TW	Taiwan 50	69.0	-14.28571428571429	-42.73858921161826		-48.88888888888889	74.1325002670288	99.71500011444091	N	N	주의	FENG TAY ENTERPRISE CO LTD	TAI	TWD	Consumer Cyclical	Footwear & Accessories	Footwear & Accessories	Feng Tay Enterprises Co., Ltd. manufactures and sells athletic shoes in Singapore, the United States, Mainland China, Switzerland, Mexico, and internationally. The company provides casual shoes, ice skates, ski boots, golf balls, soccer balls, backpacks, ice hockey helmets and clubs, shoe parts, shoe molds, and tools. It offers international trade services; manufactures and repairs molds, cutting dies, shoe lasts, and injections, as well as processes metal parts; manufactures and processes plast	68136308736.0	5.86	5.1	-14.200368069854896	-17.84382627271236		5299923000.0	3067431000.0	2765942000.0	6426104000.0	25804493000.0	2.260790953384987	5.676381861142846	8.226640378467893	13.086119420904906	-17.84382627271236		-0.9157662319333838	판정불가	불리(<1)	0.0	0.0	-100.0	보류	일부부족
5876.TW	5876.TW	Taiwan 50	42.400001525878906	8.717952630458736	5.080552984587117		-9.691159026885776	40.869999980926515	40.23799997329712	Y	Y	상승전환/양호	THE SHANGHAI COMM & SAVINGS BAN	TAI	TWD	Financial Services	Banks - Regional	Banks - Regional	The Shanghai Commercial & Savings Bank, Ltd. provides various commercial banking services in Taiwan and Hong Kong. The company offers time, savings, demand, checking, and negotiable certificate of deposit accounts, as well as remittance services. In addition, it offers traveling, human resources, insurance, microfinance, leasing, real estate, nominee, trustee, commodity trading, property holding, IT application, securities brokerage, and property management services. Further, the company is invo	205649903616.0	4.22	3.06	10.009813418913694	-0.24655051291825325		447087330000.0	0.0	0.0	66784497000.0	204918623000.0	92.17852360804248	-6.252701493850252	-14.746936954787387	-16.267490876524043	-0.24655051291825325			판정불가	판정불가	8.006898974163494	24.501110860940294	-42.21436325660035	보류	일부부족
3529.TW	3529.TW	Taiwan 50											3529.TW													0.0	0.0	0.0	0.0									판정불가	판정불가				판정불가	핵심부족
3443.TW	3443.TW	Taiwan 50	5045.0	118.39826839826841	150.9950248756219		-11.95462478184991	4810.625	2730.325	Y	Y	상승전환/양호	GLOBAL UNICHIP CORP.	TAI	TWD	Technology	Semiconductors	Semiconductors	Global Unichip Corp. engages in the research and development, production, testing, and sale of embedded memory and logic components, analog components, cell libraries, and EDA tools for various IC applications. It offers ASIC and wafer products, as well as non-recurring engineering services. The company also provides product design, technical support, and consulting services. In addition, it offers SoC design services, such as technology design, design methodology, low power solution, and testab	676085497856.0	41.0	32.95	9.244163603420642	0.5283531709970202		11319194000.0	0.0	79254000.0	269671000.0	12912792000.0	84.46466334853109	-17.266985545962644	-0.3422593765304786	150.54735467834502	0.5283531709970202	284.93697576236195	0.27584910581607536	매우 불리	불리(<1)	9.55670634199404	314.89347396870363	-93.75830576870756	보류	충분
