티커	종목코드	유니버스	현재가	3M수익률(보조,%)	6M수익률(보조,%)	12M수익률(보조,%)	52주고점대비(보조,%)	40일이평(보조)	200일이평(보조)	40일선상회(보조)	200일선상회(보조)	추세판정(보조)	종목명	시장	통화	섹터	산업	업종	사업설명	시가총액	배당수익률(%)	EPS(FY)	EPS Growth 1Y(%)	EPS Growth 3Y CAGR(%)	EPS Growth 5Y CAGR(%)	현금및단기투자	장기부채	단기위험부채	총부채	주주지분	주당순현금(린치식)	주당잉여현금흐름	잉여현금흐름수익률(%)	순현금차감PER(린치식)	사용연성장률(%)	린치PER배수	배당감안점수	린치PER판정	배당감안점수판정	그레이엄적정PER(3년)	그레이엄내재가치(3년)	그레이엄괴리율(3년,%)	종합판정	데이터상태
2330.TW	2330.TW	Taiwan 50	2205.0	23.529411764705888	51.027397260273965		-4.545454545454541	2060.625	1593.225	Y	Y	상승전환/양호	TAIWAN SEMICONDUCTOR MANUFACTUR	TAI	TWD	Technology	Semiconductors	Semiconductors	Taiwan Semiconductor Manufacturing Company Limited, together with its subsidiaries, manufactures, packages, tests, and sells integrated circuits and other semiconductor devices in Taiwan, China, Europe, the Middle East, Africa, Japan, the United States, and internationally. It provides various wafer fabrication processes, such as processes to manufacture complementary metal- oxide-semiconductor (CMOS) logic, mixed-signal, radio frequency, embedded memory, bipolar CMOS mixed-signal, and others. T	56662228467712.0	0.9297090702947844	73.65	46.54981153856048	19.574951863097922		3488739000000.0	896062000000.0	136925700000.0	1064582700000.0	5355038700000.0	99.97840536750016	38.26794080139995	1.7355075193378662	28.58142015794297	19.574951863097922	1.4601016828973028	0.7174122496391881	보통	불리(<1)	47.649903726195845	3509.4154094343244	59.15716142559295	보류	충분
2317.TW	2317.TW	Taiwan 50	245.0	11.87214611872147	-0.8097165991902799		-6.488549618320616	218.3375	219.02	Y	Y	상승전환/양호	HON HAI PRECISION INDUSTRY	TAI	TWD	Technology	Electronic Components	Electronic Components	Hon Hai Precision Industry Co., Ltd. provides electronic manufacturing services. The company offers consumer electronics, including smartphones, feature phones, wearable devices, televisions, game consoles, set-top boxes, and audio systems; cloud and networking products comprising routers, servers, edge computing, data centers, and satellite communications and other related equipment; electronic computing equipment, such as desktop computers, laptops, tablets, multi-function devices and printers	3360460898304.0	2.37	13.4	23.999718516214784	10.202197342011932		2177167157000.0	306085648000.0	940440828000.0	1286493270000.0	1772771627000.0	133.63035351031627	3.6666051717189645	1.4965735394771285	8.31116764848386	10.202197342011932	0.8146448622650196	1.5126872509069624	헐값	양호(>=1.5)	28.904394684023863	387.3188887659198	58.089342353436635	양호	충분
2454.TW	2454.TW	Taiwan 50	3155.0	75.27777777777777	137.21804511278197		-18.685567010309278	2319.75	1627.375	Y	Y	상승전환/양호	MEDIATEK INC	TAI	TWD	Technology	Semiconductors	Semiconductors	MediaTek Inc. engages in the research, development, production, manufacture, and marketing of multimedia integrated circuits (ICs) in Taiwan, rest of Asia, and internationally. The company offers multimedia, computer peripherals oriented, consumer-oriented, and other ICs for various applications. It also offers design, test runs, maintenance and repair, and technological consultation services for software and hardware solutions; and sale and delegation patents and circuit layout rights for its I	5155436101632.0	1.7	65.94	-1.0032496768530352	-3.7570524355304835		260128122000.0	60000000.0	4480763000.0	13730009000.0	400600988000.0	162.93870008806817	86.0675425604462	2.7279728228350617	45.375512585864904	-3.7570524355304835		-0.045333976814870926	판정불가	불리(<1)	0.985895128939033	65.00992480223984	-97.93946355618891	보류	일부부족
2308.TW	2308.TW	Taiwan 50	1915.0	58.26446280991735	98.03516028955532		-16.00877192982456	1861.75	1137.345	Y	Y	상승전환/양호	DELTA ELECTRONIC	TAI	TWD	Technology	Electronic Components	Electronic Components	Delta Electronics, Inc., together with its subsidiaries, provides power and thermal management solutions in Mainland China, the United States, Taiwan, Thailand, and internationally. It operates through Power Electronics, Mobility, Automation, and Infrastructure segments. The company offers inductors, transformer components, networking products, EMI filters, solenoids, current sensing resistors, power modules, and stamping and over molding components; embedded power, adapters, industrial and medi	4974295646208.0	37.0	23.17	70.62397666530782	22.54086445612693		159053571000.0	56703273000.0	17326736000.0	76525994000.0	268057976000.0	39.40272982449256	19.757704684663608	1.0317339260920944	80.94938585133825	22.54086445612693	3.5912281008076	0.7355320096618447	매우 불리	불리(<1)	53.58172891225386	1241.488658896922	-35.17030501843749	보류	충분
2382.TW	2382.TW	Taiwan 50	290.0	4.316546762589923	0.17271157167531026		-16.305916305916302	312.95	287.2375	N	Y	상승전환/양호	QUANTA COMPUTER	TAI	TWD	Technology	Computer Hardware	Computer Hardware	Quanta Computer Inc. manufactures, processes, and sells laptop computers and telecommunication products in the United States, Mainland China, the Netherlands, Japan, and internationally. The company provides notebook PCs; servers, storage devices, and network switches; cameras, including automotive camera, camera module, and AI dash-cam and ADAS solutions; and smart healthcare solutions. It also offers mobile computing solutions for the wireless communication of notebook PCs, wireless local area	1117810327552.0	4.48	18.91	25.603756952240488	37.322961044476074		230393427000.0	56578932000.0	258327344000.0	322496262000.0	243577029000.0	45.093699643514476	-6.625869265535222	-2.284782505356973	12.951152848042598	37.322961044476074	0.34700228721427806	3.2277405366885206	매우 유망	안심(>=2)	60.0	1134.6	291.2413793103448	보류	충분
2303.TW	2303.TW	Taiwan 50	113.0	82.84789869744135	139.91508208240683		0.0	74.92999982833862	54.53950008392334	Y	Y	상승전환/양호	UNITED MICRO ELECTRONICS	TAI	TWD	Technology	Semiconductors	Semiconductors	United Microelectronics Corporation operates as a semiconductor wafer foundry in Taiwan, China, Hong Kong, Japan, Korea, the United States, Europe, and internationally. It manufactures and sells integrated circuits. The company offers circuit design; mask tooling; wafer fabrication; and assembly and testing services for communication devices, consumer electronics, computer, and other applications. It also provides venture capital and marketing support; consulting and planning; energy technical; 	1356096995328.0	2.52	3.94	-17.259341564967112	-23.3089317909408		146070330000.0	45372054000.0	8408772000.0	59781672000.0	365824997000.0	8.019642889828098	3.912771910657288	3.4626300094312286	26.644760687860888	-23.3089317909408		-0.7802258775929652	판정불가	불리(<1)	0.0	0.0	-100.0	보류	일부부족
2412.TW	2412.TW	Taiwan 50	142.5	7.14285714285714	7.954545454545459		0.0	135.7375	133.49	Y	Y	상승전환/양호	CHUNGHWA TELECOM	TAI	TWD	Communication Services	Telecom Services	Telecom Services	Chunghwa Telecom Co., Ltd., together with its subsidiaries, operates as an integrated telecommunications service provider in Taiwan and internationally. The company operates through Consumer Business, Enterprise Business, International Business, and Others segments. Its services primarily include mobile, fixed-line, information and communication technology (ICT), and sales and other services. The company provides mobile services, including prepaid and postpaid plans; fixed-line services, such as	1078285107200.0	3.51	5.02	4.0764742262497045	2.1070421075218615		80236000000.0	24888000000.0	2240000000.0	38019000000.0	384131000000.0	7.134821964796407	6.394372131635488	4.4872786888670095	26.96517490741108	2.1070421075218615	12.797644058060811	0.20830727509867106	매우 불리	불리(<1)	12.714084215043723	63.82470275951948	-55.210734905600354	보류	충분
2882.TW	2882.TW	Taiwan 50	77.80000305175781	2.099745626764804	21.3728625643693		-2.749996185302739	74.59500026702881	69.80999973297119	Y	Y	상승전환/양호	CATHAY FINANCIAL HLDG CO	TAI	TWD	Financial Services	Insurance - Life	Insurance - Life	Cathay Financial Holding Co., Ltd., through its subsidiaries, provides various financial products and services in Taiwan, rest of Asia, and internationally. The company offers consumer banking services, such as deposit and remittance services; and credit services, including secured and unsecured consumer loans, adjustable-rate mortgage, revolving mortgage, and government subsidized mortgage. It also provides corporate banking services, including corporate, sustainable, working capital, capital e	1142731440128.0	4.5	7.06	-2.836521477400711	42.07576363585104		790688699000.0	0.0	0.0	441882992000.0	928286508000.0	53.90124614754305	12.470106092966152	16.028413372516447	3.3850930459227713	42.07576363585104	0.08045232583820468	13.759079293832102	매우 유망	안심(>=2)	60.0	423.59999999999997	444.47298635475977	매우 유망	충분
2891.TW	2891.TW	Taiwan 50	55.400001525878906	8.20312636788001	31.124263966577303		-1.9468999541966236	53.65999994277954	47.37725009918213	Y	Y	상승전환/양호	CTBC FINANCIAL HOLDINGS COMPANY	TAI	TWD	Financial Services	Banks - Regional	Banks - Regional	CTBC Financial Holding Co., Ltd., together with its subsidiaries, engages in corporate and personal finance, life insurance, and other businesses in Taiwan, Asia, and North America. The company offers commercial banking and capital market services; customized financing and wealth management and credit services; life insurance services; and designs, provides, and trades in various financial products. It is also involved in deposit and loan; securities and futures; venture capital; asset managemen	1137377804288.0	4.15	4.06	11.926931815510834	37.10774106785184		641748921000.0	0.0	0.0	331234874000.0	518343310000.0	32.61281070964325	0.003445605780356632	0.00621950484739083	5.612608575427503	37.10774106785184	0.1512516907230973	7.350902973794018	매우 유망	안심(>=2)	60.0	243.59999999999997	339.7111792248012	매우 유망	충분
2881.TW	2881.TW	Taiwan 50	97.19999694824219	4.854369091848532	7.284766650417018		-1.0183299705468052	89.9399995803833	89.91104858398438	Y	Y	상승전환/양호	FUBON FINANCIAL HLDG CO LTD	TAI	TWD	Financial Services	Insurance - Life	Insurance - Life	Fubon Financial Holding Co., Ltd. provides various financial products and services in Taiwan, Asia, and internationally. It operates through Banking Business, Property Insurance Business, Life Insurance Business, Securities Business, and Others segments. The company offers insurance products, including property, casualty, life, health, accident, fire, transportation, fishing vessel, car, liability, engineering and nuclear, guarantee and letter of credit, and personal and commercial multiple peri	1309176233984.0	4.27	8.37	-19.809129596654984	37.10650367758417		922185721000.0	0.0	0.0	600644627000.0	982581684000.0	67.48166890931621	0.4210099576148224	0.4331378300752469	3.550576826633928	37.10650367758417	0.09568610552706994	11.653459620196573	매우 유망	안심(>=2)	60.0	502.19999999999993	416.6666828882878	매우 유망	충분
2886.TW	2886.TW	Taiwan 50	40.650001525878906	3.8314174751908237	-0.3676414558493213		-5.465112730514177	39.42499980926514	40.509499874114994	Y	Y	상승전환/양호	MEGA FINANCIAL HOLDING CO	TAI	TWD	Financial Services	Banks - Regional	Banks - Regional	Mega Financial Holding Co., Ltd. provides various financial services in Taiwan. It offers brokerage, dealing and underwriting of short-term debt instruments and financial debentures; notary services for short-term debt instruments and financial debentures; guarantee or endorsement services for short-term debt instruments; brokerage for inter-bank call loans; proprietary trading in government bonds; and foreign and domestic securities brokerage, securities dealing, securities underwriting, and fu	599800152064.0	3.94	2.36	0.783077986276548	24.094823796719123		877500768000.0	0.0	0.0	108798705000.0	392369102000.0	58.9584401722324	10.672127791853432	26.253695919443604	-7.757812985743007	24.094823796719123	-0.32197010657531144		판정불가	판정불가	56.689647593438245	133.78756832051425	229.12069692135537	보류	충분
2884.TW	2884.TW	Taiwan 50	32.0	-5.044512535468481	5.610563715328909		-8.83190486861899	32.20999989509583	32.63106912612915	N	N	중립	E SUN FINANCIAL HOLDINGS	TAI	TWD	Financial Services	Banks - Regional	Banks - Regional	E.SUN Financial Holding Company, Ltd., together with its subsidiaries, offers various financial banking products and services in Taiwan. It operates through Corporate Banking Unit; Individual Banking Unit; Overseas Branches and Subsidiaries; and Others segments. The company provides deposits; bills/checks discounting; syndicated loans; domestic remittances; commercial acceptances; domestic letters of credit and guarantees; custodian services and warehousing; rental of safe deposit boxes; and cre	512715816960.0	3.75	2.12	31.44091638294586	29.648238579086495		406218940000.0	0.0	0.0	81352877000.0	272743929000.0	25.11555212068752	2.1025866205020405	6.570583189068876	3.2473810751473953	29.648238579086495	0.1095303205445081	10.284668724187409	매우 유망	안심(>=2)	60.0	127.2	297.5	매우 유망	충분
2885.TW	2885.TW	Taiwan 50	54.70000076293945	29.009431118895645	54.30183239974582		-3.185839357629283	50.34624986648559	39.80594645500183	Y	Y	상승전환/양호	YUANTA FINANCIAL HOLDING CO. LT	TAI	TWD	Financial Services	Financial Conglomerates	Financial Conglomerates	Yuanta Financial Holding Co., Ltd., together with its subsidiaries, provides financial services in Taiwan. The company offers brokerage, investment banking, derivative products, fixed income, institutional brokerage, international finance, strategic trading, overseas business, digital finance, reg and transfer, and wealth management services; corporate, consumer, and digital finance products and services; and life, health, accident, and investment-linked insurance products. It also provides futu	734546362368.0	2.75	2.74	2.7414463472456685	20.12129776441045		938214637000.0	217509768000.0	158925388000.0	383094061000.0	340417373000.0	54.06171778128669	-4.071624878573867	-7.443555432877598	0.23294999330392868	20.12129776441045	0.011577284727427424	98.18114797955964	매우 유망	안심(>=2)	48.7425955288209	133.55471174896928	144.15851898754593	보류	충분
2880.TW	2880.TW	Taiwan 50	32.20000076293945	-2.865763858857817	8.417508201277801		-15.485558917250708	33.75000004768371	31.32227964401245	N	Y	상승전환/양호	HUA NAN FINANCIAL HOLDINGS CO	TAI	TWD	Financial Services	Banks - Regional	Banks - Regional	Hua Nan Financial Holdings Co., Ltd., together with its subsidiaries, provides financial services in Taiwan and internationally. It operates through Bank, Securities, Insurance, and Other segments. The company provides various banking services, including commercial banking, offshore banking, overseas branch banking, and other banking services. It also engages in the trust business planning, managing, and operating; custody of nondiscretionary trust funds and mutual funds; trading and underwritin	446038704128.0	11.742623945375431	1.9	14.228828562366536	15.145821422405326		304634035000.0	0.0	0.0	131545560000.0	236357548000.0	21.8894015325899	0.15652701576816497	0.4861087331038809	5.426631173868186	15.145821422405326	0.3582922987485202	4.954905632293831	매우 유망	안심(>=2)	38.79164284481065	73.70412140514024	128.89478154910447	매우 유망	충분
1101.TW	1101.TW	Taiwan 50	24.200000762939453	-6.2015446567252885	14.69194467025785		-20.13200867233046	24.312499952316283	23.723000049591064	N	Y	상승전환/양호	TCC GROUP HOLDINGS CO LTD	TAI	TWD	Basic Materials	Building Materials	Building Materials	TCC Group Holdings Co., Ltd. manufactures and markets cement, cement-related products, and ready-mixed concrete in Asia, Europe, and Africa. It operates through Cement, Electricity and Energy, Social Aspect of Energy Transition, and Other segments. The company is also involved in the thermal and renewable energy generation; and land and marine transportation business, and production and sale of refractory materials, etc. In addition, it provides engineering, property leasing and development, ene	180960346112.0	14.458689626813854	-1.6	36.199999999999996			146558691000.0	165639430000.0	40338866000.0	212904295000.0	231910589000.0	-2.5464133928683435	0.823563607556843	3.403155295838135		36.199999999999996			판정불가	판정불가				판정불가	일부부족
1301.TW	1301.TW	Taiwan 50	45.95000076293945	-1.9210197235732696	24.694715510528663		-15.688071994606512	48.97000026702881	42.75825016021729	N	Y	상승전환/양호	FORMOSA PLASTIC	TAI	TWD	Basic Materials	Specialty Chemicals	Specialty Chemicals	Formosa Plastics Corporation engages in the manufacture and sale of plastic raw materials, chemical fibers, and related petrochemical industrial products in Taiwan, China, and internationally. It operates through Plastic, Polyolefin, Polypropylene, Tairylan, Chemical, and Other segments. The company offers plastic raw materials, such as polyvinyl chloride, high-density polyethylene, linear low-density polyethylene, ethylene vinyl acetate copolymer, polyethylene wax, polypropylene, polyacetal, an	289004650496.0	30.25027153255439	-1.58	6379.2			226906866000.0	76514793000.0	52416194000.0	130740908000.0	363222429000.0	23.62522650544532	-1.247549971008874	-2.71501621391718		6379.2			판정불가	판정불가				보류	일부부족
1303.TW	1303.TW	Taiwan 50	81.69999694824219	5.28350329219196	99.26828523961508		-13.909382892936117	84.65499992370606	60.65150005340576	N	Y	상승전환/양호	NAN YA PLASTIC	TAI	TWD	Basic Materials	Specialty Chemicals	Specialty Chemicals	Nan Ya Plastics Corporation engages in the manufacture and sale of plastic products, polyester fibers, petrochemical products, and electronic materials in Taiwan, China, the United States, and internationally. It provides plastic products, such as PP synthetic paper, adhesives, optical films, outdoor decoration materials, TPU films, synthetic leathers, PU resins, doors, Neuma fire-rated doors and windows, plastic pallets, PVC cling and PE Stectch films, BOPP film, engineering and PVC compounds, 	640810483712.0	86.0	0.57	35.28214030056922	-47.98534220948065		82098101000.0	79337053000.0	93325453000.0	173213953000.0	355665838000.0	0.3481414662944144	-0.3379180619612948	-0.41360841442303786	142.72255347710137	-47.98534220948065		0.26635354304124387	판정불가	불리(<1)	0.0	0.0	-100.0	보류	일부부족
2002.TW	2002.TW	Taiwan 50	18.200000762939453	-13.126491168748544	0.5524882837687928		-15.935329867802672	19.211250066757202	19.234250049591065	N	N	중립	CHINA STEEL CORP	TAI	TWD	Basic Materials	Steel	Steel	China Steel Corporation manufactures and sells steel products in Taiwan, Vietnam, Malaysia, China, India, and internationally. It offers steel plates primarily for use in construction structures, shipbuilding, bridge beams, oil country tabular goods, machine structures, pressure vessels, and in climate/corrosion-resistant steel plates; steel bars and wire rods for applications in general and machine structures, cold and hot forging, hard drawn steel wires, and welding electrodes; and hot-rolled 	276568113152.0	1.81	-0.29				90355113000.0	182746145000.0	77492200000.0	271100183000.0	292633521000.0	-6.061712385961833	1.1196561050556681	6.151956363296516					판정불가	판정불가				판정불가	일부부족
1216.TW	1216.TW	Taiwan 50	74.80000305175781	3.744805318693367	-4.225346333978164		-14.022984997979526	71.90499973297119	75.75099994659423	Y	N	상승전환/양호	UNI-PRESIDENT ENTERPRISES CORP	TAI	TWD	Consumer Defensive	Packaged Foods	Packaged Foods	Uni-President Enterprises Corp. engages in the manufacture and sale of beverages and instant noodles in Taiwan, China, and Southeast Asia. It operates through Beverages, Food, and Others segments. The company offers animal feeds, wheat flour, and aquatic products; dairy, tea, coffee, water, and general beverages; edible oils, snack noodles, and cooking noodles; sauce and seasoning, meat, ice cream, and frozen prepared foods. It also provides trade marketing, developing, and managing distribution	417059930112.0	15.842245342958607	3.44	-5.058179913923699	4.563089403388387		165919037000.0	98835952000.0	79360712000.0	308708893000.0	135782210000.0	11.806213992747292	7.226537944725595	9.661146590763101	18.312147982270503	4.563089403388387	4.013103045641086	1.1143059113602116	매우 불리	보통(1~1.5)	17.626178806776775	60.63405509531211	-18.938432324185317	보류	충분
2207.TW	2207.TW	Taiwan 50	468.5	-10.591603053435117	-18.944636678200688		-27.251552795031053	490.3125	548.7325	N	N	주의	HOTAI MOTOR CO	TAI	TWD	Consumer Cyclical	Auto & Truck Dealerships	Auto & Truck Dealerships	Hotai Motor Co.,Ltd., together with its subsidiaries, exports and imports, trades, and sells vehicles, automobile air conditioners, and related parts in Taiwan and Mainland China. It is also involved in the installment sales and vehicle leasing, used vehicles selling, property and casualty insurance, trading of vehicle products/accessories, solar power, energy storage, and vehicle repairing activities, electronic parts and components manufacturing, as well as property management business. In add	259888447488.0	13.15001985058698	33.92	-7.654131088708249			50924322000.0	8733259000.0	301578234000.0	313105900000.0	86158179000.0	75.73299833254464	42.95654836882807	9.168953760689021	11.579215851045264	-7.654131088708249		0.4746339331244623	판정불가	불리(<1)	8.5	288.32	-38.45891141942369	보류	일부부족
1326.TW	1326.TW	Taiwan 50	44.900001525878906	10.727502763656505	61.51080128816018		-17.765562672753042	47.881249809265135	35.944750022888186	N	Y	상승전환/양호	FORMOSA CHEMICAL & FIBRE CO	TAI	TWD	Basic Materials	Chemicals	Chemicals	Formosa Chemicals & Fibre Corporation produces and sells petrochemical products, nylon, and rayon fibers in Taiwan and internationally. The company offers plastic products, including PS resin, ABS resin, PP resin, PC resin, homopolymer PP, polycarbonate, PC/ABS alloy, PP composite materials, SAN andASA resin, and nylon resin; petrochemical, such as benzene, para-xylene, ortho-xylene, meta-xylene, styrene monomer, phenol, acetone, PTA, and PIA; fibers, includes nylon 6 chip, full drawn yarn, part	260573675520.0	16.7037856238763	-0.99				225714011000.0	63844980000.0	63720846000.0	128580720000.0	345866503000.0	27.674572989185965	1.8442112794284715	4.107374647561043					판정불가	판정불가				판정불가	일부부족
3008.TW	3008.TW	Taiwan 50	3365.0	42.283298097251574	52.95454545454545		-2.322206095791002	2549.75	2368.15	Y	Y	상승전환/양호	LARGAN PRECISION CO	TAI	TWD	Technology	Electronic Components	Electronic Components	Largan Precision Co., Ltd., together with its subsidiaries, designs, manufactures, and sells precision optical plastic lenses in China, South Korea, Vietnam, Japan, Taiwan, and internationally. The company offers mobile phone lens, voice coil motors, image lens modules, sleep health monitoring products, automotive and contact lenses, silicon carbide crystals, titanium niobate anode materials, and fiber optic lasers and space communications products, as well as video cameras, cameras, monocular a	418554249216.0	2.38	157.15	-17.904416715768722	-2.029321415748375		155056231000.0	0.0	1228000.0	120112000.0	188867185000.0	1185.4615320117907	103.71201064797552	3.0820805541746066	13.869159834477944	-2.029321415748375		0.02528477488447841	판정불가	불리(<1)	4.44135716850325	697.9592790302856	-79.25826808230948	보류	일부부족
5871.TW	5871.TW	Taiwan 50	110.0	4.761904761904767	8.374384236453203		-14.022989108921868	112.35	109.41122550964356	N	Y	상승전환/양호	CHAILEASE HOLDING COMPANY LIMIT	TAI	TWD	Financial Services	Credit Services	Credit Services	Chailease Holding Company Limited, an investment holding company, provides leasing and financial products and services in Taiwan, Mainland China, ASEAN countries, and internationally. The company offers leasing services, including capital and operating leases for machinery, medical equipment, airplanes, boats, and office equipment; installment sales services for raw materials, semi-finished and finished products, furniture and fixtures, and production equipment, as well as for customers in vario	189967745024.0	5.55	11.24	-12.290661443557727	-10.052637909459694		182181078000.0	129895323000.0	544000413000.0	682487506000.0	182441248000.0	30.551074253924646	11.408862081138622	10.371692801035111	7.068409763885708	-10.052637909459694		-0.6370086143653992	판정불가	불리(<1)	0.0	0.0	-100.0	보류	일부부족
