티커	종목코드	유니버스	현재가	3M수익률(보조,%)	6M수익률(보조,%)	12M수익률(보조,%)	52주고점대비(보조,%)	40일이평(보조)	200일이평(보조)	40일선상회(보조)	200일선상회(보조)	추세판정(보조)	종목명	시장	통화	섹터	산업	업종	사업설명	시가총액	배당수익률(%)	EPS(FY)	EPS Growth 1Y(%)	EPS Growth 3Y CAGR(%)	EPS Growth 5Y CAGR(%)	현금및단기투자	장기부채	단기위험부채	총부채	주주지분	주당순현금(린치식)	주당잉여현금흐름	잉여현금흐름수익률(%)	순현금차감PER(린치식)	사용연성장률(%)	린치PER배수	배당감안점수	린치PER판정	배당감안점수판정	그레이엄적정PER(3년)	그레이엄내재가치(3년)	그레이엄괴리율(3년,%)	종합판정	데이터상태
6669.TW	6669.TW	Taiwan 50	1710.0	34.11764705882352	9.498401999253826		-11.398963730569944	1711.1666595458985	1365.7833322143554	N	Y	상승전환/양호	WIWYNN CORPORATION	TAI	TWD	Technology	Computer Hardware	Computer Hardware	Wiwynn Corporation engages in the research, development, design, testing, and sales of semi products, and peripheral equipment and parts in the United States, Europe, Asia, and internationally. The company also offers computer and peripheral equipment, data storage media products, electric appliances, and software products; and provides management consulting, information software, and data processing services. In addition, it provides multi-node and storage server, storage, open rack, edge/ai pl	902256984064.0	8.44	88.58	124.43706509365401	53.35114708016857		89933848000.0	27984645000.0	72197241000.0	104069333000.0	124652762000.0	333.3455624389804	-78.32983771576822	-4.580692264080013	15.541368678720024	53.35114708016857	0.29130336514352073	3.9759141139722094	매우 유망	안심(>=2)	60.0	5314.8	210.80701754385967	보류	충분
3034.TW	3034.TW	Taiwan 50	516.0	34.90196078431374	33.33333333333333		-5.667276051188297	471.375	411.91	Y	Y	상승전환/양호	NOVATEK MICROELECTRONICS	TAI	TWD	Technology	Semiconductors	Semiconductors	Novatek Microelectronics Corp., a fabless chip design company, designs, develops and sells a range of display driver integrated circuits (IC) and system-on-a-chip (SoC) solutions in Taiwan, Asia, and internationally. The company offers display driver ICs for LCD displays, televisions (TVs), notebook computers, desktop monitors, cameras, tablets, PCs, automotive displays, smartphones, and wearable products. The company also provides SoC solutions, including timing controllers, LCD monitors, TVs, 	345026002944.0	5.43	26.83	-19.635846408771286	-16.390208004150118		42974255000.0	0.0	74993000.0	552286000.0	67739247000.0	70.62193103873939	20.017415645455976	3.879344117336429	16.600002570304163	-16.390208004150118		-0.66025339199386	판정불가	불리(<1)	0.0	0.0	-100.0	보류	일부부족
2357.TW	2357.TW	Taiwan 50	789.0	32.82828282828283	29.556650246305427		-15.252416756176157	712.5	620.5425	Y	Y	상승전환/양호	ASUSTEK COMPUTER INC	TAI	TWD	Technology	Computer Hardware	Computer Hardware	ASUSTeK Computer Inc. researches and develops, designs, manufactures, sells, and repairs 3C information products in Taiwan, China, Singapore, Europe, the United States, and internationally. The company provides phone and accessories; laptops for home, work, creators, students, gaming, and accessories; monitors, projectors, all-in-one PCs, tower PCs, gaming tower PCs, NUCs, mini-PCs, and accessories; and motherboards, graphics cards, cases, cooling, power supply units, sound cards, optical drives	585295069184.0	5.32	59.49	41.93166968721522	44.75258349821978		108306629000.0	293123000.0	29754617000.0	31769504000.0	268296918000.0	145.42175841713023	37.02223010632717	4.692297858850085	10.818259229834757	44.75258349821978	0.2417348538160953	4.628525018159008	매우 유망	안심(>=2)	60.0	3569.4	352.39543726235746	매우 유망	충분
4938.TW	4938.TW	Taiwan 50	82.9000015258789	6.010236267333213	16.43259140325788		-15.837561902661012	85.1150001525879	74.94049991607666	N	Y	상승전환/양호	PEGATRON CORPORATION	TAI	TWD	Technology	Computer Hardware	Computer Hardware	Pegatron Corporation, together with its subsidiaries, designs, develops, manufactures, and sells computer, communication, and consumer electronic products in Europe, the United States, Taiwan, China, Japan, and internationally. The company offers notebooks, desktops, PCs, motherboards, rugged computers, and servers; tablets and game consoles; and smartphones, cable modems, set-top boxes, and network switches. It also provides automotive products; and smart electronics, including Internet of Thin	219927625728.0	4.84	5.34	-14.660756568839329	-1.5555407129723142		160438242000.0	14142988000.0	59107439000.0	75095748000.0	207343291000.0	54.54617760996602	-0.83960215176223	-1.012789066716882	5.309704853167207	-1.5555407129723142		0.618576621084414	판정불가	불리(<1)	5.388918574055372	28.77682518545568	-65.28730439592042	보류	일부부족
2892.TW	2892.TW	Taiwan 50	32.599998474121094	12.607936493923045	16.63684287746907		0.0	29.098749780654906	28.989999961853027	Y	Y	상승전환/양호	FIRST FINANCIAL HOLDING CO LTD	TAI	TWD	Financial Services	Banks - Regional	Banks - Regional	First Financial Holding Co., Ltd., together with its subsidiaries, provides various financial products and services in Asia, North America, Oceania, and Europe. It operates through four segments: Bank, Security, Insurance, and Other. The company engages in commercial banking products and services; trading and proprietary trading of securities, securities underwriting, stock brokerage services, margin trading, and issuing warrant; securities investment trust funds and discretionary investment ser	464456843264.0	2.91	1.87	6.2043853474740285	9.354208373482065		408389857000.0	0.0	0.0	128816067000.0	292366858000.0	28.40090040461961	4.267165671660615	13.08946586315955	2.245506989038227	9.354208373482065	0.24005312896427886	5.461665643149455	매우 유망	안심(>=2)	27.20841674696413	50.87973931682293	56.07282729541496	매우 유망	충분
5880.TW	5880.TW	Taiwan 50	24.75	6.6810309745186425	3.3402889836165572		-3.2542659482382663	23.1925000667572	23.78800000190735	Y	Y	상승전환/양호	TAIWAN COOPERATIVE FINANCIAL HL	TAI	TWD	Financial Services	Banks - Regional	Banks - Regional	Taiwan Cooperative Financial Holding Co., Ltd., together with its subsidiaries, provides banking, insurance, securities, bills finance, investment trust, asset management, and capital management services in Taiwan. The company offers general deposits and loans. It is also involved in the planning, management, and operation of the trust business; securities investment trust, discretionary investment, and securities investment consulting business; venture capital activities; investment consulting;	383398903808.0	2.83	1.36	10.795205957729625	1.692729712658969		499854174000.0	0.0	0.0	133679747000.0	279252593000.0	31.876552139489633	0.2601705663488455	1.0511942074700829	-5.240111867271788	1.692729712658969	-3.095657758048407		판정불가	판정불가	11.885459425317938	16.164224818432398	-34.690000733606475	보류	충분
2912.TW	2912.TW	Taiwan 50	223.5	1.8223234624145768	-6.2893081761006275		-16.759776536312852	225.375	231.06	N	N	주의	PRESIDENT CHAIN STORE CORP	TAI	TWD	Consumer Defensive	Grocery Stores	Grocery Stores	President Chain Store Corporation operates and manages convenience stores, restaurants, drugstores, department stores, supermarkets, and online shopping stores in Taiwan and internationally. It operates through Convenience Stores, Retail Business Group, Logistics Business Group, and Other Operating segments. The company engages in the logistics and storage of publication and e-commerce; trade, enterprise information management and consultancy, and art and cultural exhibition activities; operatio	229756518400.0	4.03	10.75	-2.8466174876112804	6.49584678036641		53581230000.0	15164601000.0	21368169000.0	141409381000.0	42561437000.0	36.952488093860595	18.0470213192964	8.074729896776914	17.353256921501337	6.49584678036641	2.6714387682220693	0.6065631845353763	매우 불리	불리(<1)	21.49169356073282	231.0357057778778	3.371680437529223	보류	충분
6505.TW	6505.TW	Taiwan 50	53.5	-6.140350877192979	3.8834951456310662		-21.554248689187183	52.66500005722046	49.61925003051758	Y	Y	상승전환/양호	FORMOSA PETROCHEMICAL CORPORATI	TAI	TWD	Energy	Oil & Gas Refining & Marketing	Oil & Gas Refining & Marketing	Formosa Petrochemical Corporation, together with its subsidiaries, engages in the production and sale of petroleum products and petrochemical raw materials in Taiwan, Australia, South Korea, the Philippines, Singapore, Malaysia, Mainland China, and internationally. The company offers gasoline, diesel, jet fuel/kerosene, fuel oil/asphalt/sulfur, naphtha, base oil, liquified petroleum gas, and lubricants. It also provides ethylene, propylene, butadiene, and BTX; and electricity, steam, and other u	514401828864.0	2.24	1.04	65.39056473393204	-11.858616047153191		200328918000.0	8825000000.0	8835896000.0	21130412000.0	355792088000.0	20.103372048591428	3.8845712138199193	7.260880773495177	32.11214226096978	-11.858616047153191		-0.29953205765546176	판정불가	불리(<1)	0.0	0.0	-100.0	보류	일부부족
2603.TW	2603.TW	Taiwan 50	193.0	-11.467889908256879	5.464480874316946		-18.565400843881854	213.0125	195.015	N	N	중립	EVERGREEN MARINE CORP(TAIWAN)	TAI	TWD	Industrials	Marine Shipping	Marine Shipping	Evergreen Marine Corporation (Taiwan) Ltd., together with its subsidiaries, engages in the shipping carrier and agency, container terminal operations, and commercial port area ship repair businesses in Taiwan, North America, Europe, Asia, and internationally. The company provides cargo loading and discharging, terminal, inland transportation, real estate leasing, security, computer system, terminal logistics, leasing storehouse, management consultancy and self-owned property leasing, and contain	417853276160.0	8.29	31.63	-50.82184326762367	-41.016405023033144		197518389000.0	54439928000.0	0.0	165741821000.0	563818129000.0	66.08573640338783	36.58146189244278	18.954125332871907	4.012464862365229	-41.016405023033144		-8.156184825439668	판정불가	불리(<1)	0.0	0.0	-100.0	보류	일부부족
2615.TW	2615.TW	Taiwan 50	80.4000015258789	0.6257822158339366	0.8782993782186832		-17.368962996731984	79.85749988555908	78.95549991607666	Y	Y	상승전환/양호	WAN HAI LINES	TAI	TWD	Industrials	Marine Shipping	Marine Shipping	Wan Hai Lines Ltd. operates as a fully containerized shipping company in Asia, the Middle East, India, Red Sea, the United States, and South America. The company engages in international marine and freight transportation; and management of container. It also provides cargo tracking/terminal info, shipping schedule, documentation, and other services; and storage and logistics, shipping agency, container storage, and information software services. In addition, the company is involved in the sale a	225894776832.0	3.73	11.2	-33.63087517720952	-30.337164256193983		147371856000.0	46058874000.0	8802145000.0	66661245000.0	275317207000.0	36.10395451926528	3.186486278834205	3.963291316367138	3.955004197019074	-30.337164256193983		-6.727468020450665	판정불가	불리(<1)	0.0	0.0	-100.0	보류	일부부족
2327.TW	2327.TW	Taiwan 50	1080.0	285.0267379679144	355.6962025316456		0.0	601.6875	304.9575	Y	Y	상승전환/양호	YAGEO CORP	TAI	TWD	Technology	Electronic Components	Electronic Components	Yageo Corporation, together with its subsidiaries, manufactures and sells electronic components in China, Europe, the United States, and the rest of Asia. It offers antennas, radio frequency, and microwave; capacitors; circuit protection; custom products; electromechanical devices; EMC; engineering kits; inductors; piezoelectric devices; power supplies; resistors; semiconductors; sensors; signal magnetics and connectors; and transformers. The company's products are used for various applications,	2192548036608.0	56.00000000000001	12.64	22.099803869339073	1.3081472653207582		114742022000.0	62087637000.0	86197379000.0	150894630000.0	170877823000.0	25.57614287504765	11.927875062251228	1.1044328761343731	83.41960894975888	1.3081472653207582	63.769279775472654	0.686986524952853	매우 불리	불리(<1)	11.116294530641516	140.5099628673088	-86.98981825302697	보류	충분
3037.TW	3037.TW	Taiwan 50	968.0	66.89655172413794	350.2325581395349		-10.78341013824885	912.425	410.5823966217041	Y	Y	상승전환/양호	UNIMICRON TECHNOLOGY	TAI	TWD	Technology	Electronic Components	Electronic Components	Unimicron Technology Corp., together with its subsidiaries, engages in the manufacturing, processing, and sale of printed circuit boards, electrical equipment, electronic products, and integrated circuit product testing and burn-in systems in Taiwan, China, Asia, the Americas, and internationally. The company offers PCB products, including HDI, ELIC, multi-layer and rigid flex PCBs, and FPC; IC carriers, such as FCCSP, FCBGA, CSP, memory module, and coreless; connectors comprising PCBeam and X-B	1582016495616.0	21.0	4.36	31.307777963397943	-39.15067182208464		55226513000.0	34873158000.0	22207016000.0	57080174000.0	100569302000.0	12.929777846074714	-7.044326051426996	-0.7277196334118797	219.05280324631315	-39.15067182208464		-0.08285980162360754	판정불가	불리(<1)	0.0	0.0	-100.0	보류	일부부족
3045.TW	3045.TW	Taiwan 50	119.0	8.18181818181818	13.33333333333333		-1.2448132780082943	113.8375	109.1825	Y	Y	상승전환/양호	TAIWAN MOBILE CO	TAI	TWD	Consumer Cyclical	Specialty Retail	Specialty Retail	Taiwan Mobile Co., Ltd. provides telecommunications, broadband, retail, digital, and financial services in Taiwan and internationally. It operates through Telecommunications, Retail, Cable Television and Broadband, and Others segments. The company provides 5g, postpaid, prepaid, e-sim, international call, international roaming, and gaming services. Taiwan Mobile Co., Ltd. was incorporated in 1997 and is based in Taipei, Taiwan.	359133478912.0	4.03	4.7	4.492225214732648	9.403068233707245		13361407000.0	61415627000.0	21702384000.0	96404740000.0	86139857000.0	-15.856013197854868	8.641676038188367	7.26191263713308	28.692768765501036	9.403068233707245	3.0514261996574548	0.4681691175742717	매우 불리	불리(<1)	27.30613646741449	128.3388413968481	7.847765879704283	보류	충분
6415.TW	6415.TW	Taiwan 50	629.0	117.27115716753022	206.82926829268294		-5.41353383458647	513.975	304.6075	Y	Y	상승전환/양호	SILERGY CORP	TAI	TWD	Technology	Semiconductors	Semiconductors	Silergy Corp. designs, manufactures, and sales of various integrated circuit products and related technical services in China and internationally. The company offers DC-DC and AC-DC regulators, AC and DC LED drives, power and battery management IC's, power modules, protection switch IC's, low dropout regulators, sensors, ESD protection, audio products, amplifiers, data converters, motor and DC LED drivers, voltage reference products, MCU and mixed-signal ICs, clock generators, and embedded proce	261361565696.0	41.0	6.29	8.385873715869895	-25.690270567653716		24353135000.0	2695036000.0	729497000.0	3589013000.0	37316511000.0	55.76910439728803	0.22407448893146184	0.03562392510834052	91.13368769518473	-25.690270567653716		0.167991988687573	판정불가	불리(<1)	0.0	0.0	-100.0	보류	일부부족
2395.TW	2395.TW	Taiwan 50	494.0	41.54727793696276	72.12543554006969		-5.363984674329503	458.5625	342.8625	Y	Y	상승전환/양호	ADVANTECH CO LTD	TAI	TWD	Technology	Computer Hardware	Computer Hardware	Advantech Co., Ltd. engages in the research and development, design, manufacturing, and marketing of embedded computing boards, industrial automation products, and applied and industrial computers. The company operates through Intelligent Systems; Embedded Design-In; IoT Automation; Intelligent Service; and Advantech Service Plus and Others segments. It offers AIOT software, distribution, and services, application focus embedded, arm-based computing platforms, computer on modules, digital signag	433692868608.0	1.7	12.15	17.628700470636606	-0.5125786354135187		27070551000.0	150327000.0	77029000.0	1994309000.0	54947481000.0	31.005010054661422	7.934834737300375	1.6062418496559463	38.10658353459577	-0.5125786354135187		0.031160530660232468	판정불가	불리(<1)	7.474842729172963	90.8193391594515	-81.615518388775	보류	일부부족
2379.TW	2379.TW	Taiwan 50	819.0	69.91701244813278	53.65853658536586		0.0	595.625	528.685	Y	Y	상승전환/양호	REALTEK SEMICONDUCTOR CORP	TAI	TWD	Technology	Semiconductors	Semiconductors	Realtek Semiconductor Corp., together with its subsidiaries, engages in the research, development, production, and sale of various integrated circuits and related application software in Taiwan, Asia, and internationally. It provides communications network ICs, including broadband access controllers, gateway controllers, digital home centers, gigabit ethernet, switch controllers, wireless LAN ICs, and DTV demodulators, as well as Bluetooth, GNSS, and Internet of Things products. The company also	461576699904.0	3.11	28.09	-3.5195699659979707	-3.0782274650865915		109685323000.0	0.0	10095000000.0	11385412000.0	52202368000.0	213.86866083145011	35.78080306046644	4.368840422523375	21.542589504042358	-3.0782274650865915		0.001474870739538829	판정불가	불리(<1)	2.343545069826817	65.83018101143529	-91.9621268606306	보류	일부부족
2474.TW	2474.TW	Taiwan 50	202.5	8.000000000000007	0.496277915632759		-21.206225680933855	208.8375	197.8775	N	Y	상승전환/양호	CATCHER TECHNOLOGY	TAI	TWD	Industrials	Metal Fabrication	Metal Fabrication	Catcher Technology Co., Ltd., together with its subsidiaries, engages in the manufacture and sale of aluminum and magnesium extrusions, alloy housings, and molds in Taiwan, China, the United States, Singapore, and internationally. Its products include chassis and interior mechanical components; upper case, lower case, keyboard cover, and monitor casings for notebook computers; casings for various server specifications and desktop computers; industrial computer casings and internal parts; and com	110997135360.0	5.67	11.32	-45.850088476855554	-13.129081883496463		166299185000.0	0.0	62082792000.0	62642682000.0	142844857000.0	308.63526850809774	1.0025591649656878	0.495090945662068	-9.375907112022768	-13.129081883496463			판정불가	판정불가	0.0	0.0	-100.0	판정불가	일부부족
4904.TW	4904.TW	Taiwan 50	108.5	15.42553191489362	25.57870148590402		-3.5555555555555562	98.98500003814698	91.93250007629395	Y	Y	상승전환/양호	FAR EASTONE TELECOMMUNICATIONS	TAI	TWD	Communication Services	Telecom Services	Telecom Services	Far EasTone Telecommunications Co., Ltd. provides mobile telecommunications services in Taiwan and internationally. The company offers postpaid products, such as wireless postpaid and broadband, and data booster; prepaid products; and SMS and eSIM products. It also provides mobile communication and lifestyle services, including mobile communication voice, internet access, and related services, as well as mobile phones and accessories; and cable network, enterprise customer services, communicatio	389632163840.0	3.51	3.8	6.923482474870757	12.64259853453671		9372288000.0	37946397000.0	5199584000.0	53567997000.0	92140651000.0	-7.920300856084408	7.162856996345322	6.601711517368961	30.63692127791695	12.64259853453671	2.4233088786473633	0.527226557394965	매우 불리	불리(<1)	33.78519706907342	128.383748862479	18.326035817953002	보류	충분
2408.TW	2408.TW	Taiwan 50	459.5	66.48550724637681	200.32679738562092		0.0	318.125	201.0767499923706	Y	Y	상승전환/양호	NANYA TECHNOLOGY CORPORATION	TAI	TWD	Technology	Semiconductors	Semiconductors	Nanya Technology Corporation research, develops, manufactures, and sells semiconductor products in Taiwan, Japan, Malaysia, China, the United States, Thailand, Germany, Singapore, Poland and internationally. It offers standard dynamic random-access memory (DRAM), low power DRAM, MCP and eMCP, and KGD products, as well as modules; and other memory products and Elixir brands. The company engages in the import and export of its machinery, equipment, and raw materials. Its products have applications	1564807004160.0	28.999999999999996	2.11		-23.232591966740635		58074065000.0	14196100000.0	5059500000.0	23617455000.0	170399852000.0	14.160449855886213	1.5764312972202954	0.3430753639217183	211.0613981725658	-23.232591966740635		0.027325735938429983	판정불가	불리(<1)	0.0	0.0	-100.0	보류	일부부족
1590.TW	1590.TW	Taiwan 50	1380.0	34.63414634146342	50.81967213114753		-10.967741935483865	1398.75	1046.48	N	Y	상승전환/양호	AIRTAC INTERNATIONAL GROUP	TAI	TWD	Industrials	Specialty Industrial Machinery	Specialty Industrial Machinery	Airtac International Group manufactures and sells pneumatic control components in Taiwan and internationally. The company offers preparation units and control components comprising solenoid, pneumatic and flow control, ordinary coils, and other valves. It also provides actuators, such as standard, mini, compact, slide table, guided, rodless magnetic, clamp, free mount, and rotary table cylinders; air grippers; GA series, GP series, pressure switch, vacuum components, and other series; and cylind	278999990272.0	2.11	41.95	10.184337557847734	11.787839441212888		4192979000.0	0.0	328670000.0	457708000.0	52581178000.0	20.96489520964895	24.213870242138704	1.754628278415848	32.39654600215378	11.787839441212888	2.7483022791172655	0.42899139433842537	매우 불리	불리(<1)	32.07567888242578	1345.5747291177615	-2.4945848465390164	보류	충분
9910.TW	9910.TW	Taiwan 50	72.5999984741211	-13.468418171926178	-41.68674821355736		-46.22222335250289	74.37000007629395	101.69350009918213	N	N	주의	FENG TAY ENTERPRISE CO LTD	TAI	TWD	Consumer Cyclical	Footwear & Accessories	Footwear & Accessories	Feng Tay Enterprises Co., Ltd. manufactures and sells athletic shoes in Singapore, the United States, Mainland China, Switzerland, Mexico, and internationally. The company provides casual shoes, ice skates, ski boots, golf balls, soccer balls, backpacks, ice hockey helmets and clubs, shoe parts, shoe molds, and tools. It offers international trade services; manufactures and repairs molds, cutting dies, shoe lasts, and injections, as well as processes metal parts; manufactures and processes plast	69815025664.0	5.65	5.1	-14.200368069854896	-17.84382627271236		5299923000.0	3067431000.0	2765942000.0	6426104000.0	25804493000.0	2.260790953384987	5.676381861142846	7.818707962048019	13.79200147465414	-17.84382627271236		-0.8841230400911149	판정불가	불리(<1)	0.0	0.0	-100.0	보류	일부부족
5876.TW	5876.TW	Taiwan 50	42.5	7.32323645864299	7.868016127067756		-10.526315789473683	40.26999988555908	40.23449996948242	Y	Y	상승전환/양호	THE SHANGHAI COMM & SAVINGS BAN	TAI	TWD	Financial Services	Banks - Regional	Banks - Regional	The Shanghai Commercial & Savings Bank, Ltd. provides various commercial banking services in Taiwan and Hong Kong. The company offers time, savings, demand, checking, and negotiable certificate of deposit accounts, as well as remittance services. In addition, it offers traveling, human resources, insurance, microfinance, leasing, real estate, nominee, trustee, commodity trading, property holding, IT application, securities brokerage, and property management services. Further, the company is invo	201042182144.0	4.24	3.06	10.009813418913694	-0.24655051291825325		447087330000.0	0.0	0.0	66784497000.0	204918623000.0	92.17852360804248	-6.252701493850252	-14.712238809059416	-16.23481163661519	-0.24655051291825325			판정불가	판정불가	8.006898974163494	24.501110860940294	-42.35032738602283	보류	일부부족
3529.TW	3529.TW	Taiwan 50											3529.TW													0.0	0.0	0.0	0.0									판정불가	판정불가				판정불가	핵심부족
3443.TW	3443.TW	Taiwan 50	4860.0	93.24055666003976	118.9189189189189		-15.18324607329843	4711.875	2591.875	Y	Y	상승전환/양호	GLOBAL UNICHIP CORP.	TAI	TWD	Technology	Semiconductors	Semiconductors	Global Unichip Corp. engages in the research and development, production, testing, and sale of embedded memory and logic components, analog components, cell libraries, and EDA tools for various IC applications. It offers ASIC and wafer products, as well as non-recurring engineering services. The company also provides product design, technical support, and consulting services. In addition, it offers SoC design services, such as technology design, design methodology, low power solution, and testab	637222322176.0	41.0	28.19	9.244163603420642	0.5283531709970202		11319194000.0	0.0	79254000.0	269671000.0	12912792000.0	84.46466334853109	-17.266985545962644	-0.35528776843544535	169.4052975044863	0.5283531709970202	320.62890279396413	0.24514199840708784	매우 불리	불리(<1)	9.55670634199404	269.403551780812	-94.45671704154708	보류	충분
