티커	종목코드	유니버스	현재가	3M수익률(보조,%)	6M수익률(보조,%)	12M수익률(보조,%)	52주고점대비(보조,%)	40일이평(보조)	200일이평(보조)	40일선상회(보조)	200일선상회(보조)	추세판정(보조)	종목명	시장	통화	섹터	산업	업종	사업설명	시가총액	배당수익률(%)	EPS(FY)	EPS Growth 1Y(%)	EPS Growth 3Y CAGR(%)	EPS Growth 5Y CAGR(%)	현금및단기투자	장기부채	단기위험부채	총부채	주주지분	주당순현금(린치식)	주당잉여현금흐름	잉여현금흐름수익률(%)	순현금차감PER(린치식)	사용연성장률(%)	린치PER배수	배당감안점수	린치PER판정	배당감안점수판정	그레이엄적정PER(3년)	그레이엄내재가치(3년)	그레이엄괴리율(3년,%)	종합판정	데이터상태
3711.TW	3711.TW	Taiwan 50	472.0	56.03305785123966	100.85106382978721		-14.954954954954957	445.8375	271.2425	Y	Y	상승전환/양호	ASE TECHNOLOGY HOLDING CO LTD	TAI	TWD	Technology	Semiconductors	Semiconductors	ASE Technology Holding Co., Ltd., together with its subsidiaries, provides semiconductor manufacturing services in the United States, Taiwan, rest of Asia, Europe, and internationally. It operates through Packaging, Testing, and EMS. The company offers semiconductor packaging, interconnect materials production, front-end engineering testing, wafer probing, and final testing services, as well as integrated solutions for EMS (electronic manufacturing services) in relation to computing, peripherals	2088636514304.0	1.12	10.2	23.585762669903666	-13.347387041498415		111497789000.0	214080678000.0	40733681000.0	263662466000.0	342181952000.0	-23.378628938260114	-5.3782267829267285	-1.1394548268912559	48.566532248849036	-13.347387041498415		-0.25176570109734747	판정불가	불리(<1)	0.0	0.0	-100.0	보류	일부부족
6669.TW	6669.TW	Taiwan 50	4890.0	32.88043478260869	17.406962785114043		-15.544041450777202	4266.125	3835.025	Y	Y	상승전환/양호	WIWYNN CORPORATION	TAI	TWD	Technology	Computer Hardware	Computer Hardware	Wiwynn Corporation engages in the research, development, design, testing, and sales of semi products, and peripheral equipment and parts in the United States, Europe, Asia, and internationally. The company also offers computer and peripheral equipment, data storage media products, electric appliances, and software products; and provides management consulting, information software, and data processing services. In addition, it provides multi-node and storage server, storage, open rack, edge/ai pl	912478240768.0	3.905930470347648	265.53	124.43706509365401	53.35114708016857		89933848000.0	27984645000.0	72197241000.0	104069333000.0	124652762000.0	333.3455624389804	-78.32983771576822	-1.6018371721015996	17.160601203483672	53.35114708016857	0.3216538376896966	3.3365426345839677	매우 유망	안심(>=2)	60.0	15931.8	225.80368098159508	보류	충분
3034.TW	3034.TW	Taiwan 50	466.0	26.802721088435376	18.424396442185518		-14.808043875685561	419.1625	408.9925	Y	Y	상승전환/양호	NOVATEK MICROELECTRONICS	TAI	TWD	Technology	Semiconductors	Semiconductors	Novatek Microelectronics Corp., a fabless chip design company, designs, develops and sells a range of display driver integrated circuits (IC) and system-on-a-chip (SoC) solutions in Taiwan, Asia, and internationally. The company offers display driver ICs for LCD displays, televisions (TVs), notebook computers, desktop monitors, cameras, tablets, PCs, automotive displays, smartphones, and wearable products. The company also provides SoC solutions, including timing controllers, LCD monitors, TVs, 	287521669120.0	6.01	26.84	-19.635846408771286	-16.390208004150118		42974255000.0	0.0	74993000.0	552286000.0	67739247000.0	70.62193103873939	20.017415645455976	4.295582756535618	14.73092656338527	-16.390208004150118		-0.7046541138797636	판정불가	불리(<1)	0.0	0.0	-100.0	보류	일부부족
2357.TW	2357.TW	Taiwan 50	642.0	27.88844621513944	-5.726872246696035		-13.825503355704694	597.65	606.0075	Y	Y	상승전환/양호	ASUSTEK COMPUTER INC	TAI	TWD	Technology	Computer Hardware	Computer Hardware	ASUSTeK Computer Inc. researches and develops, designs, manufactures, sells, and repairs 3C information products in Taiwan, China, Singapore, Europe, the United States, and internationally. The company provides phone and accessories; laptops for home, work, creators, students, gaming, and accessories; monitors, projectors, all-in-one PCs, tower PCs, gaming tower PCs, NUCs, mini-PCs, and accessories; and motherboards, graphics cards, cases, cooling, power supply units, sound cards, optical drives	475366555648.0	5.3	59.51	41.93166968721522	44.75258349821978		108306629000.0	293123000.0	29754617000.0	31769504000.0	268296918000.0	145.42175841713023	37.02223010632717	5.766702508773703	8.344450371078302	44.75258349821978	0.1864574001947896	5.998308009800265	매우 유망	안심(>=2)	60.0	3570.6	456.16822429906546	매우 유망	충분
4938.TW	4938.TW	Taiwan 50	76.9000015258789	10.48851036178129	5.198362696413872		-10.685246354571554	80.34499988555908	73.92399990081788	N	Y	상승전환/양호	PEGATRON CORPORATION	TAI	TWD	Technology	Computer Hardware	Computer Hardware	Pegatron Corporation, together with its subsidiaries, designs, develops, manufactures, and sells computer, communication, and consumer electronic products in Europe, the United States, Taiwan, China, Japan, and internationally. The company offers notebooks, desktops, PCs, motherboards, rugged computers, and servers; tablets and game consoles; and smartphones, cable modems, set-top boxes, and network switches. It also provides automotive products; and smart electronics, including Internet of Thin	207053783040.0	5.2	5.34	-14.660756568839329	-1.5555407129723142		160438242000.0	14142988000.0	59107439000.0	75095748000.0	207343291000.0	54.54617970473266	-0.8396021840059298	-1.0918103606582912	4.186108955270833	-1.5555407129723142		0.8706078427411349	판정불가	불리(<1)	5.388918574055372	28.77682518545568	-62.578901671709964	보류	일부부족
2892.TW	2892.TW	Taiwan 50	29.0	0.3460220857774976	1.2216418364046078		-3.6544862708603576	28.72374987602234	28.958853588104247	Y	Y	상승전환/양호	FIRST FINANCIAL HOLDING CO LTD	TAI	TWD	Financial Services	Banks - Regional	Banks - Regional	First Financial Holding Co., Ltd., together with its subsidiaries, provides various financial products and services in Asia, North America, Oceania, and Europe. It operates through four segments: Bank, Security, Insurance, and Other. The company engages in commercial banking products and services; trading and proprietary trading of securities, securities underwriting, stock brokerage services, margin trading, and issuing warrant; securities investment trust funds and discretionary investment ser	399030255616.0	11.919410344827584	1.87	6.2043853474740285	9.354208373482065		408389857000.0	0.0	0.0	128816067000.0	292366858000.0	28.40090040461961	4.267165671660615	14.714364385036601	0.3203741151766797	9.354208373482065	0.03424919591110431	66.40242675840928	매우 유망	안심(>=2)	27.20841674696413	50.87973931682293	75.44737695456183	매우 유망	충분
5880.TW	5880.TW	Taiwan 50	22.799999237060547	-3.1847134789700027	-4.402520451215497		-10.876660098221002	23.27249994277954	23.95447811126709	N	N	주의	TAIWAN COOPERATIVE FINANCIAL HL	TAI	TWD	Financial Services	Banks - Regional	Banks - Regional	Taiwan Cooperative Financial Holding Co., Ltd., together with its subsidiaries, provides banking, insurance, securities, bills finance, investment trust, asset management, and capital management services in Taiwan. The company offers general deposits and loans. It is also involved in the planning, management, and operation of the trust business; securities investment trust, discretionary investment, and securities investment consulting business; venture capital activities; investment consulting;	355957243904.0	3.07	1.36	10.795205957729625	1.692729712658969		499854174000.0	0.0	0.0	133679747000.0	279252593000.0	31.876552139489633	0.2601705663488455	1.1410990133979828	-6.673935957668445	1.692729712658969	-3.9427062145585614		판정불가	판정불가	11.885459425317938	16.164224818432398	-29.104274739807646	보류	충분
2912.TW	2912.TW	Taiwan 50	227.5	6.308411214953269	-5.0104384133611735		-15.270018621973925	226.85	235.0125	Y	N	상승전환/양호	PRESIDENT CHAIN STORE CORP	TAI	TWD	Consumer Defensive	Grocery Stores	Grocery Stores	President Chain Store Corporation operates and manages convenience stores, restaurants, drugstores, department stores, supermarkets, and online shopping stores in Taiwan and internationally. It operates through Convenience Stores, Retail Business Group, Logistics Business Group, and Other Operating segments. The company engages in the logistics and storage of publication and e-commerce; trade, enterprise information management and consultancy, and art and cultural exhibition activities; operatio	230796148736.0	15.824175824175823	10.76	-2.8466174876112804	6.49584678036641		53581230000.0	15164601000.0	21368169000.0	141409381000.0	42561437000.0	36.952488093860595	18.0470213192964	7.932756623866551	17.708876571202545	6.49584678036641	2.726184463698764	1.260386141085773	매우 불리	보통(1~1.5)	21.49169356073282	231.25062271348514	1.6486253685648933	보류	충분
6505.TW	6505.TW	Taiwan 50	51.29999923706055	3.0120482389158765	13.873474152821764		-24.780056403825434	53.992500114440915	48.29700002670288	N	Y	상승전환/양호	FORMOSA PETROCHEMICAL CORPORATI	TAI	TWD	Energy	Oil & Gas Refining & Marketing	Oil & Gas Refining & Marketing	Formosa Petrochemical Corporation, together with its subsidiaries, engages in the production and sale of petroleum products and petrochemical raw materials in Taiwan, Australia, South Korea, the Philippines, Singapore, Malaysia, Mainland China, and internationally. The company offers gasoline, diesel, jet fuel/kerosene, fuel oil/asphalt/sulfur, naphtha, base oil, liquified petroleum gas, and lubricants. It also provides ethylene, propylene, butadiene, and BTX; and electricity, steam, and other u	487729135616.0	1.51	1.04	65.39056473393204	-11.858616047153191		200328918000.0	8825000000.0	8835896000.0	21130412000.0	355792088000.0	20.103372048591428	3.8845712138199193	7.572263687313267	29.996756911989536	-11.858616047153191		-0.3449911627952323	판정불가	불리(<1)	0.0	0.0	-100.0	보류	일부부족
2603.TW	2603.TW	Taiwan 50	197.0	4.509283819628651	6.199460916442057		-24.230769230769234	203.9125	192.6675	N	Y	상승전환/양호	EVERGREEN MARINE CORP(TAIWAN)	TAI	TWD	Industrials	Marine Shipping	Marine Shipping	Evergreen Marine Corporation (Taiwan) Ltd., together with its subsidiaries, engages in the shipping carrier and agency, container terminal operations, and commercial port area ship repair businesses in Taiwan, North America, Europe, Asia, and internationally. The company provides cargo loading and discharging, terminal, inland transportation, real estate leasing, security, computer system, terminal logistics, leasing storehouse, management consultancy and self-owned property leasing, and contain	460071632896.0	16.5	31.64	-50.82184326762367	-41.016405023033144		197518389000.0	54439928000.0	0.0	165741821000.0	563818129000.0	66.08573640338783	36.58146189244278	18.569269996163847	4.137618950588248	-41.016405023033144		-5.925244764152975	판정불가	불리(<1)	0.0	0.0	-100.0	보류	일부부족
2615.TW	2615.TW	Taiwan 50	80.4000015258789	7.200002034505215	-0.371741553541427		-36.44268654080719	76.33500003814697	79.68499992370606	Y	Y	상승전환/양호	WAN HAI LINES	TAI	TWD	Industrials	Marine Shipping	Marine Shipping	Wan Hai Lines Ltd. operates as a fully containerized shipping company in Asia, the Middle East, India, Red Sea, the United States, and South America. The company engages in international marine and freight transportation; and management of container. It also provides cargo tracking/terminal info, shipping schedule, documentation, and other services; and storage and logistics, shipping agency, container storage, and information software services. In addition, the company is involved in the sale a	227578462208.0	4.35	11.2	-33.63087517720952	-30.337164256193983		147371856000.0	46058874000.0	8802145000.0	66661245000.0	275317207000.0	36.10395451926528	3.186486278834205	3.963291316367138	3.955004197019074	-30.337164256193983		-6.570704596415035	판정불가	불리(<1)	0.0	0.0	-100.0	보류	일부부족
2327.TW	2327.TW	Taiwan 50	497.0	86.14232209737828	112.84796573875803		-0.7984031936127733	324.625	233.33	Y	Y	상승전환/양호	YAGEO CORP	TAI	TWD	Technology	Electronic Components	Electronic Components	Yageo Corporation, together with its subsidiaries, manufactures and sells electronic components in China, Europe, the United States, and the rest of Asia. It offers antennas, radio frequency, and microwave; capacitors; circuit protection; custom products; electromechanical devices; EMC; engineering kits; inductors; piezoelectric devices; power supplies; resistors; semiconductors; sensors; signal magnetics and connectors; and transformers. The company's products are used for various applications,	1070539866112.0	2.3532575452716293	11.48	22.099803869339073	1.3081472653207582		114742022000.0	62087637000.0	86197379000.0	150894630000.0	170877823000.0	25.57614287504765	11.927875062251228	2.3999748616199654	41.0647959168077	1.3081472653207582	31.391569592693063	0.08916164634082074	매우 불리	불리(<1)	11.116294530641516	127.61506121176461	-74.3229253095041	보류	충분
3037.TW	3037.TW	Taiwan 50	818.0	110.82474226804125	402.66264199857176		-10.208562019758505	696.7375	319.1548966217041	Y	Y	상승전환/양호	UNIMICRON TECHNOLOGY	TAI	TWD	Technology	Electronic Components	Electronic Components	Unimicron Technology Corp., together with its subsidiaries, engages in the manufacturing, processing, and sale of printed circuit boards, electrical equipment, electronic products, and integrated circuit product testing and burn-in systems in Taiwan, China, Asia, the Americas, and internationally. The company offers PCB products, including HDI, ELIC, multi-layer and rigid flex PCBs, and FPC; IC carriers, such as FCCSP, FCBGA, CSP, memory module, and coreless; connectors comprising PCBeam and X-B	1295829434368.0	1.9279081907090465	4.34	31.307777963397943	-39.15067182208464		55226513000.0	34873158000.0	22207016000.0	57080174000.0	100569302000.0	12.926710705429274	-7.04265502977378	-0.8609602725884816	185.50075790197482	-39.15067182208464		-0.2006609787063265	판정불가	불리(<1)	0.0	0.0	-100.0	보류	일부부족
3045.TW	3045.TW	Taiwan 50	116.5	11.483253588516739	6.392694063926951		-1.6877637130801704	110.95	108.2225	Y	Y	상승전환/양호	TAIWAN MOBILE CO	TAI	TWD	Consumer Cyclical	Specialty Retail	Specialty Retail	Taiwan Mobile Co., Ltd. provides telecommunications, broadband, retail, digital, and financial services in Taiwan and internationally. It operates through Telecommunications, Retail, Cable Television and Broadband, and Others segments. The company provides 5g, postpaid, prepaid, e-sim, international call, international roaming, and gaming services. Taiwan Mobile Co., Ltd. was incorporated in 1997 and is based in Taipei, Taiwan.	348526149632.0	14.935622317596565	4.69	4.492225214732648	9.403068233707245		13361407000.0	61415627000.0	21702384000.0	96404740000.0	86139857000.0	-15.856013197854868	8.641676038188367	7.417747672264692	28.22089833642961	9.403068233707245	3.001243597836072	0.8624350033494731	매우 불리	불리(<1)	27.30613646741449	128.06578003217396	9.927708182123563	보류	충분
6415.TW	6415.TW	Taiwan 50	482.0	67.65217391304348	129.52380952380952		-6.22568093385214	365.95	278.4625	Y	Y	상승전환/양호	SILERGY CORP	TAI	TWD	Technology	Semiconductors	Semiconductors	Silergy Corp. designs, manufactures, and sales of various integrated circuit products and related technical services in China and internationally. The company offers DC-DC and AC-DC regulators, AC and DC LED drives, power and battery management IC's, power modules, protection switch IC's, low dropout regulators, sensors, ESD protection, audio products, amplifiers, data converters, motor and DC LED drivers, voltage reference products, MCU and mixed-signal ICs, clock generators, and embedded proce	196894965760.0	2.366834854771784	6.27	8.385873715869895	-25.690270567653716		24353135000.0	2695036000.0	729497000.0	3589013000.0	37316511000.0	55.76910439728803	0.22407448893146184	0.04648848318080121	67.9794091870354	-25.690270567653716		-0.34309559308923837	판정불가	불리(<1)	0.0	0.0	-100.0	보류	일부부족
2395.TW	2395.TW	Taiwan 50	461.5	60.521739130434796	49.83766233766234		-6.67340748230536	377.0375	325.0875	Y	Y	상승전환/양호	ADVANTECH CO LTD	TAI	TWD	Technology	Computer Hardware	Computer Hardware	Advantech Co., Ltd. engages in the research and development, design, manufacturing, and marketing of embedded computing boards, industrial automation products, and applied and industrial computers. The company operates through Intelligent Systems; Embedded Design-In; IoT Automation; Intelligent Service; and Advantech Service Plus and Others segments. It offers AIOT software, distribution, and services, application focus embedded, arm-based computing platforms, computer on modules, digital signag	403738132480.0	1.82	12.14	17.628700470636606	-0.5125786354135187		27070551000.0	150327000.0	77029000.0	1994309000.0	54947481000.0	31.005010054661422	7.934834737300375	1.7193574728711538	35.460872318396916	-0.5125786354135187		0.036869407860229034	판정불가	불리(<1)	7.474842729172963	90.74459073215976	-80.33703342748434	보류	일부부족
2379.TW	2379.TW	Taiwan 50	555.0	16.596638655462193	10.33797216699801		-6.25	527.5625	520.43	Y	Y	상승전환/양호	REALTEK SEMICONDUCTOR CORP	TAI	TWD	Technology	Semiconductors	Semiconductors	Realtek Semiconductor Corp., together with its subsidiaries, engages in the research, development, production, and sale of various integrated circuits and related application software in Taiwan, Asia, and internationally. It provides communications network ICs, including broadband access controllers, gateway controllers, digital home centers, gigabit ethernet, switch controllers, wireless LAN ICs, and DTV demodulators, as well as Bluetooth, GNSS, and Internet of Things products. The company also	290793324544.0	17.117117117117118	28.08	-3.5195699659979707	-3.0782274650865915		109685323000.0	0.0	10095000000.0	11385412000.0	52202368000.0	213.86866083145011	35.78080306046644	6.446991542426385	12.148551964691947	-3.0782274650865915		1.1556018933641292	판정불가	보통(1~1.5)	2.343545069826817	65.80674556073701	-88.14292872779514	보류	일부부족
2474.TW	2474.TW	Taiwan 50	184.0	-10.243902439024389	-8.457711442786064		-20.518358531317492	200.5625	197.9325	N	N	주의	CATCHER TECHNOLOGY	TAI	TWD	Industrials	Metal Fabrication	Metal Fabrication	Catcher Technology Co., Ltd., together with its subsidiaries, engages in the manufacture and sale of aluminum and magnesium extrusions, alloy housings, and molds in Taiwan, China, the United States, Singapore, and internationally. Its products include chassis and interior mechanical components; upper case, lower case, keyboard cover, and monitor casings for notebook computers; casings for various server specifications and desktop computers; industrial computer casings and internal parts; and com	98604253184.0	6.24	11.32	-45.850088476855554	-13.129081883496463		166299185000.0	0.0	62082792000.0	62642682000.0	142844857000.0	308.63526850809774	1.0025591649656878	0.5448691113943955	-11.010182730397327	-13.129081883496463			판정불가	판정불가	0.0	0.0	-100.0	판정불가	일부부족
4904.TW	4904.TW	Taiwan 50	98.0	8.888888888888879	4.255319148936176		-0.3051912944497581	95.03000068664551	89.92700012207031	Y	Y	상승전환/양호	FAR EASTONE TELECOMMUNICATIONS	TAI	TWD	Communication Services	Telecom Services	Telecom Services	Far EasTone Telecommunications Co., Ltd. provides mobile telecommunications services in Taiwan and internationally. The company offers postpaid products, such as wireless postpaid and broadband, and data booster; prepaid products; and SMS and eSIM products. It also provides mobile communication and lifestyle services, including mobile communication voice, internet access, and related services, as well as mobile phones and accessories; and cable network, enterprise customer services, communicatio	350308171776.0	3.63	3.8	6.923482474870757	12.64259853453671		9372288000.0	37946397000.0	5199584000.0	53567997000.0	92140651000.0	-7.920300856084408	7.162856996345322	7.309037751372778	27.87376338318011	12.64259853453671	2.2047495463084834	0.5837962499300005	매우 불리	불리(<1)	33.78519706907342	128.383748862479	31.003825369876537	보류	충분
2408.TW	2408.TW	Taiwan 50	274.5	-6.949152542372882	98.91304347826086		-19.50146627565983	239.775	166.50874998092652	Y	Y	상승전환/양호	NANYA TECHNOLOGY CORPORATION	TAI	TWD	Technology	Semiconductors	Semiconductors	Nanya Technology Corporation research, develops, manufactures, and sells semiconductor products in Taiwan, Japan, Malaysia, China, the United States, Thailand, Germany, Singapore, Poland and internationally. It offers standard dynamic random-access memory (DRAM), low power DRAM, MCP and eMCP, and KGD products, as well as modules; and other memory products and Elixir brands. The company engages in the import and export of its machinery, equipment, and raw materials. Its products have applications	852122664960.0	3.1428295081967215	2.11		-23.232591966740635		58074065000.0	14196100000.0	5059500000.0	23617455000.0	170399852000.0	14.160449855886213	1.5764312972202954	0.5742919115556632	123.38367305408237	-23.232591966740635		-0.16282350785373387	판정불가	불리(<1)	0.0	0.0	-100.0	보류	일부부족
1590.TW	1590.TW	Taiwan 50	1430.0	18.181818181818187	47.42268041237114		-7.741935483870965	1253.825	988.715	Y	Y	상승전환/양호	AIRTAC INTERNATIONAL GROUP	TAI	TWD	Industrials	Specialty Industrial Machinery	Specialty Industrial Machinery	Airtac International Group manufactures and sells pneumatic control components in Taiwan and internationally. The company offers preparation units and control components comprising solenoid, pneumatic and flow control, ordinary coils, and other valves. It also provides actuators, such as standard, mini, compact, slide table, guided, rodless magnetic, clamp, free mount, and rotary table cylinders; air grippers; GA series, GP series, pressure switch, vacuum components, and other series; and cylind	280999985152.0	2.04	41.9	10.184337557847734	11.787839441212888		4192979000.0	0.0	328670000.0	457708000.0	52581178000.0	20.96489520964895	24.213870242138704	1.6932776393103988	33.62852278735921	11.787839441212888	2.852814797407782	0.4111937812032202	매우 불리	불리(<1)	32.07567888242578	1343.97094517364	-6.016017820025166	보류	충분
9910.TW	9910.TW	Taiwan 50	69.4000015258789	-25.536476611238946	-43.34693752989477		-48.592591462311916	75.67749996185303	106.53250011444092	N	N	주의	FENG TAY ENTERPRISE CO LTD	TAI	TWD	Consumer Cyclical	Footwear & Accessories	Footwear & Accessories	Feng Tay Enterprises Co., Ltd. manufactures and sells athletic shoes in Singapore, the United States, Mainland China, Switzerland, Mexico, and internationally. The company provides casual shoes, ice skates, ski boots, golf balls, soccer balls, backpacks, ice hockey helmets and clubs, shoe parts, shoe molds, and tools. It offers international trade services; manufactures and repairs molds, cutting dies, shoe lasts, and injections, as well as processes metal parts; manufactures and processes plast	69222539264.0	6.94	5.1	-14.200368069854896	-17.84382627271236		5299923000.0	3067431000.0	2765942000.0	6426104000.0	25804493000.0	2.260790953384987	5.676381861142846	8.179224403944938	13.164551092645867	-17.84382627271236		-0.8282717880751421	판정불가	불리(<1)	0.0	0.0	-100.0	보류	일부부족
5876.TW	5876.TW	Taiwan 50	40.54999923706055	2.6582259166089806	2.012576697007673		-14.631580553556745	39.48124961853027	40.585999965667725	Y	N	상승전환/양호	THE SHANGHAI COMM & SAVINGS BAN	TAI	TWD	Financial Services	Banks - Regional	Banks - Regional	The Shanghai Commercial & Savings Bank, Ltd. provides various commercial banking services in Taiwan and Hong Kong. The company offers time, savings, demand, checking, and negotiable certificate of deposit accounts, as well as remittance services. In addition, it offers traveling, human resources, insurance, microfinance, leasing, real estate, nominee, trustee, commodity trading, property holding, IT application, securities brokerage, and property management services. Further, the company is invo	194494349312.0	4.44	3.06	10.009813418913694	-0.24655051291825325		447087330000.0	0.0	0.0	66784497000.0	204918623000.0	92.17852360804248	-6.252701493850252	-15.419732704052963	-16.872066787902593	-0.24655051291825325			판정불가	판정불가	8.006898974163494	24.501110860940294	-39.57802386702001	보류	일부부족
3529.TW	3529.TW	Taiwan 50											3529.TW													0.0	0.0	0.0	0.0									판정불가	판정불가				판정불가	핵심부족
