티커	종목코드	유니버스	현재가	3M수익률(보조,%)	6M수익률(보조,%)	12M수익률(보조,%)	52주고점대비(보조,%)	40일이평(보조)	200일이평(보조)	40일선상회(보조)	200일선상회(보조)	추세판정(보조)	종목명	시장	통화	섹터	산업	업종	사업설명	시가총액	배당수익률(%)	EPS(FY)	EPS Growth 1Y(%)	EPS Growth 3Y CAGR(%)	EPS Growth 5Y CAGR(%)	현금및단기투자	장기부채	단기위험부채	총부채	주주지분	주당순현금(린치식)	주당잉여현금흐름	잉여현금흐름수익률(%)	순현금차감PER(린치식)	사용연성장률(%)	린치PER배수	배당감안점수	린치PER판정	배당감안점수판정	그레이엄적정PER(3년)	그레이엄내재가치(3년)	그레이엄괴리율(3년,%)	종합판정	데이터상태
2330.TW	2330.TW	Taiwan 50	2410.0	26.509186351706028	65.06849315068493		-0.6185567010309256	2280.5	1721.15	Y	Y	상승전환/양호	TAIWAN SEMICONDUCTOR MANUFACTUR	TAI	TWD	Technology	Semiconductors	Semiconductors	Taiwan Semiconductor Manufacturing Company Limited, together with its subsidiaries, manufactures, packages, tests, and sells integrated circuits and other semiconductor devices in Taiwan, China, Europe, the Middle East, Africa, Japan, the United States, and internationally. It provides various wafer fabrication processes, such as processes to manufacture complementary metal- oxide-semiconductor (CMOS) logic, mixed-signal, radio frequency, embedded memory, bipolar CMOS mixed-signal, and others. T	65090250342400.0	1.0	73.51	46.54981153856048	19.574951863097922		3488279800000.0	896062000000.0	136925700000.0	1064582700000.0	5355038700000.0	99.96069751058748	38.26794070252923	1.5878813569514205	31.424830669152662	19.574951863097922	1.605359282052374	0.6547354886241207	보통	불리(<1)	47.649903726195845	3502.744422912657	45.34209223703971	보류	충분
2317.TW	2317.TW	Taiwan 50	268.5	27.857142857142847	16.233766233766247		-13.10679611650486	256.6875	228.5175	Y	Y	상승전환/양호	HON HAI PRECISION INDUSTRY	TAI	TWD	Technology	Electronic Components	Electronic Components	Hon Hai Precision Industry Co., Ltd. provides electronic manufacturing services. The company offers consumer electronics, including smartphones, feature phones, wearable devices, televisions, game consoles, set-top boxes, and audio systems; cloud and networking products comprising routers, servers, edge computing, data centers, and satellite communications and other related equipment; electronic computing equipment, such as desktop computers, laptops, tablets, multi-function devices and printers	3759515631616.0	2.67	13.4	23.999718516214784	10.202197342011932		2177167157000.0	306085648000.0	940440828000.0	1286493270000.0	1772771627000.0	133.63035351031627	3.6666051717189645	1.3655885183310854	10.064898991767443	10.202197342011932	0.986542276566333	1.278919674458801	헐값	보통(1~1.5)	28.904394684023863	387.3188887659198	44.2528449779962	보류	충분
2454.TW	2454.TW	Taiwan 50	4390.0	153.757225433526	208.07017543859646		-5.3879310344827624	3734.875	1943.9	Y	Y	상승전환/양호	MEDIATEK INC	TAI	TWD	Technology	Semiconductors	Semiconductors	MediaTek Inc. engages in the research, development, production, manufacture, and marketing of multimedia integrated circuits (ICs) in Taiwan, rest of Asia, and internationally. The company offers multimedia, computer peripherals oriented, consumer-oriented, and other ICs for various applications. It also offers design, test runs, maintenance and repair, and technological consultation services for software and hardware solutions; and sale and delegation patents and circuit layout rights for its I	7126632103936.0	1.22	65.85	-1.0032496768530352	-3.7570524355304835		260128122000.0	60000000.0	4480763000.0	13730009000.0	400600988000.0	162.93870008806817	86.0675425604462	1.9605362770033303	64.19227486578485	-3.7570524355304835		-0.03952270644458433	판정불가	불리(<1)	0.985895128939033	64.92119424063532	-98.52115730659146	보류	일부부족
2308.TW	2308.TW	Taiwan 50	2150.0	46.75767918088738	119.61184882533198		-14.682539682539685	2209.0	1322.26	N	Y	상승전환/양호	DELTA ELECTRONIC	TAI	TWD	Technology	Electronic Components	Electronic Components	Delta Electronics, Inc., together with its subsidiaries, provides power and thermal management solutions in Mainland China, the United States, Taiwan, Thailand, and internationally. It operates through Power Electronics, Mobility, Automation, and Infrastructure segments. The company offers inductors, transformer components, networking products, EMI filters, solenoids, current sensing resistors, power modules, and stamping and over molding components; embedded power, adapters, industrial and medi	5584718397440.0	54.0	23.01	70.62397666530782	22.54086445612693		159053571000.0	56703273000.0	17326736000.0	76525994000.0	268057976000.0	39.40272982449256	19.757704684663608	0.9189630085890051	91.7252181736422	22.54086445612693	4.069285734456825	0.8344582436558478	매우 불리	불리(<1)	53.58172891225386	1232.9155822709613	-42.65508919669947	보류	충분
2382.TW	2382.TW	Taiwan 50	376.0	28.327645051194537	26.386554621848735		-9.832134292565954	342.45	296.165	Y	Y	상승전환/양호	QUANTA COMPUTER	TAI	TWD	Technology	Computer Hardware	Computer Hardware	Quanta Computer Inc. manufactures, processes, and sells laptop computers and telecommunication products in the United States, Mainland China, the Netherlands, Japan, and internationally. The company provides notebook PCs; servers, storage devices, and network switches; cameras, including automotive camera, camera module, and AI dash-cam and ADAS solutions; and smart healthcare solutions. It also offers mobile computing solutions for the wireless communication of notebook PCs, wireless local area	1464716886016.0	3.46	18.91	25.603756952240488	37.322961044476074		230393427000.0	56578932000.0	258327344000.0	322496262000.0	243577029000.0	45.093699643514476	-6.625869265535222	-1.7621992727487292	17.49901112408702	37.322961044476074	0.4688537735051151	2.330586611739402	매우 유망	안심(>=2)	60.0	1134.6	201.75531914893617	보류	충분
2303.TW	2303.TW	Taiwan 50	145.5	138.13421216634976	197.54600298529303		-0.3424657534246589	113.06499996185303	64.39350004196167	Y	Y	상승전환/양호	UNITED MICRO ELECTRONICS	TAI	TWD	Technology	Semiconductors	Semiconductors	United Microelectronics Corporation operates as a semiconductor wafer foundry in Taiwan, China, Hong Kong, Japan, Korea, the United States, Europe, and internationally. It manufactures and sells integrated circuits. The company offers circuit design; mask tooling; wafer fabrication; and assembly and testing services for communication devices, consumer electronics, computer, and other applications. It also provides venture capital and marketing support; consulting and planning; energy technical; 	2007429414912.0	1.96	3.94	-17.259341564967112	-23.3089317909408		146070330000.0	45372054000.0	8408772000.0	59781672000.0	365824997000.0	8.026047643767638	3.915896780636361	2.691337993564509	34.89186608026202	-23.3089317909408		-0.6118598455534505	판정불가	불리(<1)	0.0	0.0	-100.0	보류	일부부족
2412.TW	2412.TW	Taiwan 50	144.0	4.7272727272727355	10.769230769230775		-1.7064846416382284	138.9875	134.46	Y	Y	상승전환/양호	CHUNGHWA TELECOM	TAI	TWD	Communication Services	Telecom Services	Telecom Services	Chunghwa Telecom Co., Ltd., together with its subsidiaries, operates as an integrated telecommunications service provider in Taiwan and internationally. The company operates through Consumer Business, Enterprise Business, International Business, and Others segments. Its services primarily include mobile, fixed-line, information and communication technology (ICT), and sales and other services. The company provides mobile services, including prepaid and postpaid plans; fixed-line services, such as	1120951074816.0	3.61	5.03	4.0764742262497045	2.1070421075218615		80236000000.0	24888000000.0	2240000000.0	38019000000.0	384131000000.0	7.134821964796407	6.394372131635488	4.440536202524645	27.209776945368507	2.1070421075218615	12.913731931712805	0.21010984834607338	매우 불리	불리(<1)	12.714084215043723	63.95184360166993	-55.58899749884032	보류	충분
2882.TW	2882.TW	Taiwan 50	115.5	57.35694495766155	68.12227821060372		0.0	86.24749984741212	73.20749973297119	Y	Y	상승전환/양호	CATHAY FINANCIAL HLDG CO	TAI	TWD	Financial Services	Insurance - Life	Insurance - Life	Cathay Financial Holding Co., Ltd., through its subsidiaries, provides various financial products and services in Taiwan, rest of Asia, and internationally. The company offers consumer banking services, such as deposit and remittance services; and credit services, including secured and unsecured consumer loans, adjustable-rate mortgage, revolving mortgage, and government subsidized mortgage. It also provides corporate banking services, including corporate, sustainable, working capital, capital e	1657620660224.0	3.03	7.06	-2.836521477400711	42.07576363585104		790688699000.0	0.0	0.0	441882992000.0	928286508000.0	53.90124614754305	12.470106092966152	10.796628651918747	8.725035956438662	42.07576363585104	0.20736488663522235	5.169693725166271	매우 유망	안심(>=2)	60.0	423.59999999999997	266.75324675324674	매우 유망	충분
2891.TW	2891.TW	Taiwan 50	71.9000015258789	34.89681530030006	61.39170091402888		0.0	59.849999809265135	49.78575002670288	Y	Y	상승전환/양호	CTBC FINANCIAL HOLDINGS COMPANY	TAI	TWD	Financial Services	Banks - Regional	Banks - Regional	CTBC Financial Holding Co., Ltd., together with its subsidiaries, engages in corporate and personal finance, life insurance, and other businesses in Taiwan, Asia, and North America. The company offers commercial banking and capital market services; customized financing and wealth management and credit services; life insurance services; and designs, provides, and trades in various financial products. It is also involved in deposit and loan; securities and futures; venture capital; asset managemen	1387221352448.0	3.2	4.06	11.926931815510834	37.10774106785184		641748921000.0	0.0	0.0	331234874000.0	518343310000.0	32.614333243681955	0.003445766638987655	0.004792443067956575	9.67627297591058	37.10774106785184	0.26076157420138907	4.165626700300764	매우 유망	안심(>=2)	60.0	243.59999999999997	238.80388710745888	매우 유망	충분
2881.TW	2881.TW	Taiwan 50	138.0	54.1899441340782	45.41622526988882		0.0	104.98249969482421	93.45826816558838	Y	Y	상승전환/양호	FUBON FINANCIAL HLDG CO LTD	TAI	TWD	Financial Services	Insurance - Life	Insurance - Life	Fubon Financial Holding Co., Ltd. provides various financial products and services in Taiwan, Asia, and internationally. It operates through Banking Business, Property Insurance Business, Life Insurance Business, Securities Business, and Others segments. The company offers insurance products, including property, casualty, life, health, accident, fire, transportation, fishing vessel, car, liability, engineering and nuclear, guarantee and letter of credit, and personal and commercial multiple peri	1892702486528.0	3.08	8.38	-19.809129596654984	37.10650367758417		922185721000.0	0.0	0.0	600644627000.0	982581684000.0	67.48166890931621	0.4210099576148224	0.30507967943103076	8.41507530915081	37.10650367758417	0.22678168178464922	4.775537021502843	매우 유망	안심(>=2)	60.0	502.80000000000007	264.34782608695656	매우 유망	충분
2886.TW	2886.TW	Taiwan 50	45.5	15.7760836725227	11.383113095646081		0.0	40.88000011444092	40.46224994659424	Y	Y	상승전환/양호	MEGA FINANCIAL HOLDING CO	TAI	TWD	Financial Services	Banks - Regional	Banks - Regional	Mega Financial Holding Co., Ltd. provides various financial services in Taiwan. It offers brokerage, dealing and underwriting of short-term debt instruments and financial debentures; notary services for short-term debt instruments and financial debentures; guarantee or endorsement services for short-term debt instruments; brokerage for inter-bank call loans; proprietary trading in government bonds; and foreign and domestic securities brokerage, securities dealing, securities underwriting, and fu	663793696768.0	3.52	2.36	0.783077986276548	24.094823796719123		877500768000.0	0.0	0.0	108798705000.0	392369102000.0	59.15717588520136	10.708101147312195	23.53428823585098	-5.786938934407357	24.094823796719123	-0.24017353200961514		판정불가	판정불가	56.689647593438245	133.78756832051425	194.03861169343793	보류	충분
2884.TW	2884.TW	Taiwan 50	35.400001525878906	9.767446591872586	15.497559433824248		-0.2816858425946256	32.490000104904176	32.59125000953674	Y	Y	상승전환/양호	E SUN FINANCIAL HOLDINGS	TAI	TWD	Financial Services	Banks - Regional	Banks - Regional	E.SUN Financial Holding Company, Ltd., together with its subsidiaries, offers various financial banking products and services in Taiwan. It operates through Corporate Banking Unit; Individual Banking Unit; Overseas Branches and Subsidiaries; and Others segments. The company provides deposits; bills/checks discounting; syndicated loans; domestic remittances; commercial acceptances; domestic letters of credit and guarantees; custodian services and warehousing; rental of safe deposit boxes; and cre	579029172224.0	3.95	2.12	31.44091638294586	29.648238579086495		406218940000.0	0.0	0.0	81352877000.0	272743929000.0	25.11555212068752	2.1025866205020405	5.939509971390708	4.851155379807257	29.648238579086495	0.16362372985048773	6.925821984374658	매우 유망	안심(>=2)	60.0	127.2	259.32201841011613	매우 유망	충분
2885.TW	2885.TW	Taiwan 50	68.0	52.295627494183975	80.13245033112584		0.0	57.976249885559085	43.081999893188474	Y	Y	상승전환/양호	YUANTA FINANCIAL HOLDING CO. LT	TAI	TWD	Financial Services	Financial Conglomerates	Financial Conglomerates	Yuanta Financial Holding Co., Ltd., together with its subsidiaries, provides financial services in Taiwan. The company offers brokerage, investment banking, derivative products, fixed income, institutional brokerage, international finance, strategic trading, overseas business, digital finance, reg and transfer, and wealth management services; corporate, consumer, and digital finance products and services; and life, health, accident, and investment-linked insurance products. It also provides futu	917183135744.0	2.21	2.74	2.7414463472456685	20.12129776441045		938214637000.0	217509768000.0	158925388000.0	383094061000.0	340417373000.0	54.06171778128669	-4.071624878573867	-5.987683644961569	5.086964313399019	20.12129776441045	0.2528149214309918	4.389906511746114	매우 유망	안심(>=2)	48.7425955288209	133.55471174896928	96.40398786613129	보류	충분
2880.TW	2880.TW	Taiwan 50	38.349998474121094	14.820349467370054	24.512985143116172		0.0	33.60624995231628	31.92199999809265	Y	Y	상승전환/양호	HUA NAN FINANCIAL HOLDINGS CO	TAI	TWD	Financial Services	Banks - Regional	Banks - Regional	Hua Nan Financial Holdings Co., Ltd., together with its subsidiaries, provides financial services in Taiwan and internationally. It operates through Bank, Securities, Insurance, and Other segments. The company provides various banking services, including commercial banking, offshore banking, overseas branch banking, and other banking services. It also engages in the trust business planning, managing, and operating; custody of nondiscretionary trust funds and mutual funds; trading and underwritin	523277860864.0	3.26	1.9	14.228828562366536	15.145821422405326		304634035000.0	0.0	0.0	131545560000.0	236357548000.0	21.8894015325899	0.15652701576816497	0.4081539035100373	8.663472074490102	15.145821422405326	0.5720041081214758	2.124531742487162	헐값	안심(>=2)	38.79164284481065	73.70412140514024	92.18806867717717	양호	충분
1101.TW	1101.TW	Taiwan 50	24.5	-0.2036628864129142	7.929511791027188		-7.721277950919858	24.430000019073486	23.736750030517577	Y	Y	상승전환/양호	TCC GROUP HOLDINGS CO LTD	TAI	TWD	Basic Materials	Building Materials	Building Materials	TCC Group Holdings Co., Ltd. manufactures and markets cement, cement-related products, and ready-mixed concrete in Asia, Europe, and Africa. It operates through Cement, Electricity and Energy, Social Aspect of Energy Transition, and Other segments. The company is also involved in the thermal and renewable energy generation; and land and marine transportation business, and production and sale of refractory materials, etc. In addition, it provides engineering, property leasing and development, ene	182458990592.0	3.27	-1.6	36.199999999999996			146558691000.0	165639430000.0	40338866000.0	212904295000.0	231910589000.0	-2.5464133928683435	0.823563607556843	3.3614841124769104		36.199999999999996			판정불가	판정불가				판정불가	일부부족
1301.TW	1301.TW	Taiwan 50	51.70000076293945	9.302328957399663	22.657174119429424		-5.1376132790101785	47.961250114440915	43.60775014877319	Y	Y	상승전환/양호	FORMOSA PLASTIC	TAI	TWD	Basic Materials	Specialty Chemicals	Specialty Chemicals	Formosa Plastics Corporation engages in the manufacture and sale of plastic raw materials, chemical fibers, and related petrochemical industrial products in Taiwan, China, and internationally. It operates through Plastic, Polyolefin, Polypropylene, Tairylan, Chemical, and Other segments. The company offers plastic raw materials, such as polyvinyl chloride, high-density polyethylene, linear low-density polyethylene, ethylene vinyl acetate copolymer, polyethylene wax, polypropylene, polyacetal, an	333564837888.0	97.0	-1.58	6379.2			226906866000.0	76514793000.0	52416194000.0	130740908000.0	363222429000.0	23.62522650544532	-1.247549971008874	-2.4130560011580613		6379.2			판정불가	판정불가				보류	일부부족
1303.TW	1303.TW	Taiwan 50	139.0	61.252905940891125	119.24289693157553		0.0	96.15000019073486	67.83575006484985	Y	Y	상승전환/양호	NAN YA PLASTIC	TAI	TWD	Basic Materials	Specialty Chemicals	Specialty Chemicals	Nan Ya Plastics Corporation engages in the manufacture and sale of plastic products, polyester fibers, petrochemical products, and electronic materials in Taiwan, China, the United States, and internationally. It provides plastic products, such as PP synthetic paper, adhesives, optical films, outdoor decoration materials, TPU films, synthetic leathers, PU resins, doors, Neuma fire-rated doors and windows, plastic pallets, PVC cling and PE Stectch films, BOPP film, engineering and PVC compounds, 	1209450364928.0	57.99999999999999	0.57	35.28214030056922	-47.98534220948065		82098101000.0	79337053000.0	93325453000.0	173213953000.0	355665838000.0	0.3481414662944144	-0.3379180619612948	-0.24310651939661496	243.24887462053616	-47.98534220948065		0.04117041777127244	판정불가	불리(<1)	0.0	0.0	-100.0	보류	일부부족
2002.TW	2002.TW	Taiwan 50	19.100000381469727	-1.0362635414346344	2.1390353059397293		-10.117645263671871	18.78375005722046	19.164250049591065	Y	N	중립	CHINA STEEL CORP	TAI	TWD	Basic Materials	Steel	Steel	China Steel Corporation manufactures and sells steel products in Taiwan, Vietnam, Malaysia, China, India, and internationally. It offers steel plates primarily for use in construction structures, shipbuilding, bridge beams, oil country tabular goods, machine structures, pressure vessels, and in climate/corrosion-resistant steel plates; steel bars and wire rods for applications in general and machine structures, cold and hot forging, hard drawn steel wires, and welding electrodes; and hot-rolled 	297960112128.0	79.0	-0.29				90355113000.0	182746145000.0	77492200000.0	271100183000.0	292633521000.0	-6.061712385961833	1.1196561050556681	5.86207373138027					판정불가	판정불가				판정불가	일부부족
1216.TW	1216.TW	Taiwan 50	74.5	4.341734464805991	-2.4869129423188863		-14.367816091954023	72.83249988555909	74.90899993896484	Y	N	상승전환/양호	UNI-PRESIDENT ENTERPRISES CORP	TAI	TWD	Consumer Defensive	Packaged Foods	Packaged Foods	Uni-President Enterprises Corp. engages in the manufacture and sale of beverages and instant noodles in Taiwan, China, and Southeast Asia. It operates through Beverages, Food, and Others segments. The company offers animal feeds, wheat flour, and aquatic products; dairy, tea, coffee, water, and general beverages; edible oils, snack noodles, and cooking noodles; sauce and seasoning, meat, ice cream, and frozen prepared foods. It also provides trade marketing, developing, and managing distribution	422173736960.0	4.03	3.44	-5.058179913923699	4.563089403388387		165919037000.0	98835952000.0	79360712000.0	308708893000.0	135782210000.0	11.806213992747292	7.226537944725595	9.700050932517577	18.22493779280602	4.563089403388387	3.9939909525491286	0.47150171380998407	매우 불리	불리(<1)	17.626178806776775	60.63405509531211	-18.612006583473683	보류	충분
2207.TW	2207.TW	Taiwan 50	482.0	-3.792415169660679	-18.02721088435374		-22.383252818035427	475.2625	539.4325	Y	N	주의	HOTAI MOTOR CO	TAI	TWD	Consumer Cyclical	Auto & Truck Dealerships	Auto & Truck Dealerships	Hotai Motor Co.,Ltd., together with its subsidiaries, exports and imports, trades, and sells vehicles, automobile air conditioners, and related parts in Taiwan and Mainland China. It is also involved in the installment sales and vehicle leasing, used vehicles selling, property and casualty insurance, trading of vehicle products/accessories, solar power, energy storage, and vehicle repairing activities, electronic parts and components manufacturing, as well as property management business. In add	267966431232.0	4.15	33.88	-7.654131088708249			50924322000.0	8733259000.0	301578234000.0	313105900000.0	86158179000.0	75.73299833254464	42.95654836882807	8.912146964487151	11.991351879204704	-7.654131088708249		-0.2922215213102938	판정불가	불리(<1)	8.5	287.98	-40.253112033195016	보류	일부부족
1326.TW	1326.TW	Taiwan 50	54.20000076293945	17.954297852055667	60.118177861592194		-4.070795109841674	49.1037501335144	38.35600005149841	Y	Y	상승전환/양호	FORMOSA CHEMICAL & FIBRE CO	TAI	TWD	Basic Materials	Chemicals	Chemicals	Formosa Chemicals & Fibre Corporation produces and sells petrochemical products, nylon, and rayon fibers in Taiwan and internationally. The company offers plastic products, including PS resin, ABS resin, PP resin, PC resin, homopolymer PP, polycarbonate, PC/ABS alloy, PP composite materials, SAN andASA resin, and nylon resin; petrochemical, such as benzene, para-xylene, ortho-xylene, meta-xylene, styrene monomer, phenol, acetone, PTA, and PIA; fibers, includes nylon 6 chip, full drawn yarn, part	328714715136.0	1.11	-0.99				225714011000.0	63844980000.0	63720846000.0	128580720000.0	345866503000.0	27.674572989185965	1.8442112794284715	3.4026037886875735					판정불가	판정불가				판정불가	일부부족
3008.TW	3008.TW	Taiwan 50	5195.0	112.90983606557377	142.7570093457944		0.0	3405.125	2538.9	Y	Y	상승전환/양호	LARGAN PRECISION CO	TAI	TWD	Technology	Electronic Components	Electronic Components	Largan Precision Co., Ltd., together with its subsidiaries, designs, manufactures, and sells precision optical plastic lenses in China, South Korea, Vietnam, Japan, Taiwan, and internationally. The company offers mobile phone lens, voice coil motors, image lens modules, sleep health monitoring products, automotive and contact lenses, silicon carbide crystals, titanium niobate anode materials, and fiber optic lasers and space communications products, as well as video cameras, cameras, monocular a	678188679168.0	1.54	157.41	-17.904416715768722	-2.029321415748375		155056231000.0	0.0	1228000.0	120112000.0	188867185000.0	1185.4615320117907	103.71201064797552	1.9963813406732533	25.471942494048722	-2.029321415748375		-0.01921021201514963	판정불가	불리(<1)	4.44135716850325	699.1140318940965	-86.54255954005589	보류	일부부족
5871.TW	5871.TW	Taiwan 50	114.0	6.04651162790697	13.432835820895516		-10.896552349246303	113.9625	108.755	Y	Y	상승전환/양호	CHAILEASE HOLDING COMPANY LIMIT	TAI	TWD	Financial Services	Credit Services	Credit Services	Chailease Holding Company Limited, an investment holding company, provides leasing and financial products and services in Taiwan, Mainland China, ASEAN countries, and internationally. The company offers leasing services, including capital and operating leases for machinery, medical equipment, airplanes, boats, and office equipment; installment sales services for raw materials, semi-finished and finished products, furniture and fixtures, and production equipment, as well as for customers in vario	201947693056.0	5.09	11.24	-12.290661443557727	-10.052637909459694		182181078000.0	129895323000.0	544000413000.0	682487506000.0	182441248000.0	30.551074253924646	11.408862081138622	10.007773755384756	7.424281650006704	-10.052637909459694		-0.6684334112587462	판정불가	불리(<1)	0.0	0.0	-100.0	보류	일부부족
3711.TW	3711.TW	Taiwan 50	613.0	71.46853146853147	165.36796536796538		-4.517133956386288	551.65	318.7175	Y	Y	상승전환/양호	ASE TECHNOLOGY HOLDING CO LTD	TAI	TWD	Technology	Semiconductors	Semiconductors	ASE Technology Holding Co., Ltd., together with its subsidiaries, provides semiconductor manufacturing services in the United States, Taiwan, rest of Asia, Europe, and internationally. It operates through Packaging, Testing, and EMS. The company offers semiconductor packaging, interconnect materials production, front-end engineering testing, wafer probing, and final testing services, as well as integrated solutions for EMS (electronic manufacturing services) in relation to computing, peripherals	2957439139840.0	1.07	10.18	23.585762669903666	-13.347387041498415		111497789000.0	214080678000.0	40733681000.0	263662466000.0	342181952000.0	-23.378628938260114	-5.3782267829267285	-0.877361628536171	62.51263545562477	-13.347387041498415		-0.19639848731403498	판정불가	불리(<1)	0.0	0.0	-100.0	보류	일부부족
