티커	종목코드	유니버스	현재가	3M수익률(보조,%)	6M수익률(보조,%)	12M수익률(보조,%)	52주고점대비(보조,%)	40일이평(보조)	200일이평(보조)	40일선상회(보조)	200일선상회(보조)	추세판정(보조)	종목명	시장	통화	섹터	산업	업종	사업설명	시가총액	배당수익률(%)	EPS(FY)	EPS Growth 1Y(%)	EPS Growth 3Y CAGR(%)	EPS Growth 5Y CAGR(%)	현금및단기투자	장기부채	단기위험부채	총부채	주주지분	주당순현금(린치식)	주당잉여현금흐름	잉여현금흐름수익률(%)	순현금차감PER(린치식)	사용연성장률(%)	린치PER배수	배당감안점수	린치PER판정	배당감안점수판정	그레이엄적정PER(3년)	그레이엄내재가치(3년)	그레이엄괴리율(3년,%)	종합판정	데이터상태
6669.TW	6669.TW	Taiwan 50	5300.0	34.860050890585235	19.10112359550562		-8.462867012089815	4951.625	4039.825	Y	Y	상승전환/양호	WIWYNN CORPORATION	TAI	TWD	Technology	Computer Hardware	Computer Hardware	Wiwynn Corporation engages in the research, development, design, testing, and sales of semi products, and peripheral equipment and parts in the United States, Europe, Asia, and internationally. The company also offers computer and peripheral equipment, data storage media products, electric appliances, and software products; and provides management consulting, information software, and data processing services. In addition, it provides multi-node and storage server, storage, open rack, edge/ai pl	984956141568.0	2.74	265.33	124.43706509365401	53.35114708016857		89933848000.0	27984645000.0	72197241000.0	104069333000.0	124652762000.0	333.3455624389804	-78.32983771576822	-1.4779214663352496	18.718782035808314	53.35114708016857	0.3508599732200766	2.996516919363042	매우 유망	안심(>=2)	60.0	15919.8	200.37358490566035	보류	충분
3034.TW	3034.TW	Taiwan 50	480.5	26.781002638522434	21.338383838383844		-12.157221206581347	456.6875	409.6125	Y	Y	상승전환/양호	NOVATEK MICROELECTRONICS	TAI	TWD	Technology	Semiconductors	Semiconductors	Novatek Microelectronics Corp., a fabless chip design company, designs, develops and sells a range of display driver integrated circuits (IC) and system-on-a-chip (SoC) solutions in Taiwan, Asia, and internationally. The company offers display driver ICs for LCD displays, televisions (TVs), notebook computers, desktop monitors, cameras, tablets, PCs, automotive displays, smartphones, and wearable products. The company also provides SoC solutions, including timing controllers, LCD monitors, TVs, 	292389781504.0	5.92	26.82	-19.635846408771286	-16.390208004150118		42974255000.0	0.0	74993000.0	552286000.0	67739247000.0	70.62193103873939	20.017415645455976	4.165955389272836	15.282552906832983	-16.390208004150118		-0.6851085723687423	판정불가	불리(<1)	0.0	0.0	-100.0	보류	일부부족
2357.TW	2357.TW	Taiwan 50	850.0	64.41005802707932	38.888888888888886		-8.700322234156822	678.125	615.3125	Y	Y	상승전환/양호	ASUSTEK COMPUTER INC	TAI	TWD	Technology	Computer Hardware	Computer Hardware	ASUSTeK Computer Inc. researches and develops, designs, manufactures, sells, and repairs 3C information products in Taiwan, China, Singapore, Europe, the United States, and internationally. The company provides phone and accessories; laptops for home, work, creators, students, gaming, and accessories; monitors, projectors, all-in-one PCs, tower PCs, gaming tower PCs, NUCs, mini-PCs, and accessories; and motherboards, graphics cards, cases, cooling, power supply units, sound cards, optical drives	631346233344.0	4.03	59.5	41.93166968721522	44.75258349821978		108306629000.0	293123000.0	29754617000.0	31769504000.0	268296918000.0	145.42175841713023	37.02223010632717	4.355556483097314	11.841651119039827	44.75258349821978	0.2646026261145545	4.119576147601896	매우 유망	안심(>=2)	60.0	3570.0	320.0	매우 유망	충분
4938.TW	4938.TW	Taiwan 50	95.0999984741211	36.83453017859151	34.32202595330249		-3.4517781988618323	84.01749992370605	74.46699985504151	Y	Y	상승전환/양호	PEGATRON CORPORATION	TAI	TWD	Technology	Computer Hardware	Computer Hardware	Pegatron Corporation, together with its subsidiaries, designs, develops, manufactures, and sells computer, communication, and consumer electronic products in Europe, the United States, Taiwan, China, Japan, and internationally. The company offers notebooks, desktops, PCs, motherboards, rugged computers, and servers; tablets and game consoles; and smartphones, cable modems, set-top boxes, and network switches. It also provides automotive products; and smart electronics, including Internet of Thin	255062392832.0	4.35	5.34	-14.660756568839329	-1.5555407129723142		160438242000.0	14142988000.0	59107439000.0	75095748000.0	207343291000.0	54.54617760996602	-0.83960215176223	-0.8828624240101381	7.5943484764335345	-1.5555407129723142		0.3679656386192094	판정불가	불리(<1)	5.388918574055372	28.77682518545568	-69.7404567327238	보류	일부부족
2892.TW	2892.TW	Taiwan 50	30.5	4.810995189614364	8.540923793413647		0.0	28.623749828338624	28.899999980926513	Y	Y	상승전환/양호	FIRST FINANCIAL HOLDING CO LTD	TAI	TWD	Financial Services	Banks - Regional	Banks - Regional	First Financial Holding Co., Ltd., together with its subsidiaries, provides various financial products and services in Asia, North America, Oceania, and Europe. It operates through four segments: Bank, Security, Insurance, and Other. The company engages in commercial banking products and services; trading and proprietary trading of securities, securities underwriting, stock brokerage services, margin trading, and issuing warrant; securities investment trust funds and discretionary investment ser	438573793280.0	3.26	1.87	6.2043853474740285	9.354208373482065		408389857000.0	0.0	0.0	128816067000.0	292366858000.0	28.40090040461961	4.267165671660615	13.990707120198737	1.1225131526098346	9.354208373482065	0.1200008710295582	11.237470442243037	매우 유망	안심(>=2)	27.20841674696413	50.87973931682293	66.81881743220632	매우 유망	충분
5880.TW	5880.TW	Taiwan 50	23.850000381469727	3.695653832477075	-0.4175381139213563		-6.772291149895504	23.097500038146972	23.80594903945923	Y	Y	상승전환/양호	TAIWAN COOPERATIVE FINANCIAL HL	TAI	TWD	Financial Services	Banks - Regional	Banks - Regional	Taiwan Cooperative Financial Holding Co., Ltd., together with its subsidiaries, provides banking, insurance, securities, bills finance, investment trust, asset management, and capital management services in Taiwan. The company offers general deposits and loans. It is also involved in the planning, management, and operation of the trust business; securities investment trust, discretionary investment, and securities investment consulting business; venture capital activities; investment consulting;	373990326272.0	3.04	1.36	10.795205957729625	1.692729712658969		499854174000.0	0.0	0.0	133679747000.0	279252593000.0	31.876552139489633	0.2601705663488455	1.0908618959645182	-5.9018762926616954	1.692729712658969	-3.4866028808526828		판정불가	판정불가	11.885459425317938	16.164224818432398	-32.22547354342517	보류	충분
2912.TW	2912.TW	Taiwan 50	224.0	2.2831050228310446	-5.0847457627118615		-16.573556797020483	226.5875	232.055	N	N	주의	PRESIDENT CHAIN STORE CORP	TAI	TWD	Consumer Defensive	Grocery Stores	Grocery Stores	President Chain Store Corporation operates and manages convenience stores, restaurants, drugstores, department stores, supermarkets, and online shopping stores in Taiwan and internationally. It operates through Convenience Stores, Retail Business Group, Logistics Business Group, and Other Operating segments. The company engages in the logistics and storage of publication and e-commerce; trade, enterprise information management and consultancy, and art and cultural exhibition activities; operatio	232875393024.0	4.05	10.74	-2.8466174876112804	6.49584678036641		53581230000.0	15164601000.0	21368169000.0	141409381000.0	42561437000.0	36.952488093860595	18.0470213192964	8.056705946114464	17.415969451223408	6.49584678036641	2.6810930183671955	0.6055274045985194	매우 불리	불리(<1)	21.49169356073282	230.8207888422705	3.0449950188707664	보류	충분
6505.TW	6505.TW	Taiwan 50	52.400001525878906	-23.167149749807304	4.382471572716828		-23.167149749807304	52.99000015258789	49.22400005340576	N	Y	상승전환/양호	FORMOSA PETROCHEMICAL CORPORATI	TAI	TWD	Energy	Oil & Gas Refining & Marketing	Oil & Gas Refining & Marketing	Formosa Petrochemical Corporation, together with its subsidiaries, engages in the production and sale of petroleum products and petrochemical raw materials in Taiwan, Australia, South Korea, the Philippines, Singapore, Malaysia, Mainland China, and internationally. The company offers gasoline, diesel, jet fuel/kerosene, fuel oil/asphalt/sulfur, naphtha, base oil, liquified petroleum gas, and lubricants. It also provides ethylene, propylene, butadiene, and BTX; and electricity, steam, and other u	499160317952.0	2.28	1.04	65.39056473393204	-11.858616047153191		200328918000.0	8825000000.0	8835896000.0	21130412000.0	355792088000.0	20.103372048591428	3.8845712138199193	7.41330362729367	31.05445142046873	-11.858616047153191		-0.3084458301150249	판정불가	불리(<1)	0.0	0.0	-100.0	보류	일부부족
2603.TW	2603.TW	Taiwan 50	222.0	5.463182897862229	21.97802197802199		-9.939148073022308	210.3875	194.365	Y	Y	상승전환/양호	EVERGREEN MARINE CORP(TAIWAN)	TAI	TWD	Industrials	Marine Shipping	Marine Shipping	Evergreen Marine Corporation (Taiwan) Ltd., together with its subsidiaries, engages in the shipping carrier and agency, container terminal operations, and commercial port area ship repair businesses in Taiwan, North America, Europe, Asia, and internationally. The company provides cargo loading and discharging, terminal, inland transportation, real estate leasing, security, computer system, terminal logistics, leasing storehouse, management consultancy and self-owned property leasing, and contain	480639549440.0	7.14	31.65	-50.82184326762367	-41.016405023033144		197518389000.0	54439928000.0	0.0	165741821000.0	563818129000.0	66.08573640338783	36.58146189244278	16.47813598758684	4.926201061504334	-41.016405023033144		-6.876780829706567	판정불가	불리(<1)	0.0	0.0	-100.0	보류	일부부족
2615.TW	2615.TW	Taiwan 50	84.69999694824219	4.438962443716754	2.418379774852597		-20.469486433575412	78.61999969482422	79.1684998703003	Y	Y	상승전환/양호	WAN HAI LINES	TAI	TWD	Industrials	Marine Shipping	Marine Shipping	Wan Hai Lines Ltd. operates as a fully containerized shipping company in Asia, the Middle East, India, Red Sea, the United States, and South America. The company engages in international marine and freight transportation; and management of container. It also provides cargo tracking/terminal info, shipping schedule, documentation, and other services; and storage and logistics, shipping agency, container storage, and information software services. In addition, the company is involved in the sale a	237680590848.0	4.14	11.2	-33.63087517720952	-30.337164256193983		147371856000.0	46058874000.0	8802145000.0	66661245000.0	275317207000.0	36.10395451926528	3.186486278834205	3.762085470654005	4.338932359730081	-30.337164256193983		-6.037698236398336	판정불가	불리(<1)	0.0	0.0	-100.0	보류	일부부족
2327.TW	2327.TW	Taiwan 50	826.0	232.3943661971831	256.0344827586207		-2.3640661938534313	495.775	277.375	Y	Y	상승전환/양호	YAGEO CORP	TAI	TWD	Technology	Electronic Components	Electronic Components	Yageo Corporation, together with its subsidiaries, manufactures and sells electronic components in China, Europe, the United States, and the rest of Asia. It offers antennas, radio frequency, and microwave; capacitors; circuit protection; custom products; electromechanical devices; EMC; engineering kits; inductors; piezoelectric devices; power supplies; resistors; semiconductors; sensors; signal magnetics and connectors; and transformers. The company's products are used for various applications,	1700511350784.0	80.0	12.69	22.099803869339073	1.3081472653207582		114742022000.0	62087637000.0	86197379000.0	150894630000.0	170877823000.0	25.57614287504765	11.927875062251228	1.444052670974725	63.07516604609553	1.3081472653207582	48.217175327450214	1.2890675104350975	매우 불리	보통(1~1.5)	11.116294530641516	141.06577759384083	-82.9218186932396	보류	충분
3037.TW	3037.TW	Taiwan 50	969.0	149.10025706940874	442.8571428571429		-10.691244239631336	864.175	382.7648966217041	Y	Y	상승전환/양호	UNIMICRON TECHNOLOGY	TAI	TWD	Technology	Electronic Components	Electronic Components	Unimicron Technology Corp., together with its subsidiaries, engages in the manufacturing, processing, and sale of printed circuit boards, electrical equipment, electronic products, and integrated circuit product testing and burn-in systems in Taiwan, China, Asia, the Americas, and internationally. The company offers PCB products, including HDI, ELIC, multi-layer and rigid flex PCBs, and FPC; IC carriers, such as FCCSP, FCBGA, CSP, memory module, and coreless; connectors comprising PCBeam and X-B	1525347254272.0	16.0	4.37	31.307777963397943	-39.15067182208464		55226513000.0	34873158000.0	22207016000.0	57080174000.0	100569302000.0	12.929777846074714	-7.044326051426996	-0.7269686327582039	218.78037120227123	-39.15067182208464		-0.1058169510128535	판정불가	불리(<1)	0.0	0.0	-100.0	보류	일부부족
3045.TW	3045.TW	Taiwan 50	117.0	8.837209302325588	7.339449541284404		-1.2658227848101222	112.5375	108.7575	Y	Y	상승전환/양호	TAIWAN MOBILE CO	TAI	TWD	Consumer Cyclical	Specialty Retail	Specialty Retail	Taiwan Mobile Co., Ltd. provides telecommunications, broadband, retail, digital, and financial services in Taiwan and internationally. It operates through Telecommunications, Retail, Cable Television and Broadband, and Others segments. The company provides 5g, postpaid, prepaid, e-sim, international call, international roaming, and gaming services. Taiwan Mobile Co., Ltd. was incorporated in 1997 and is based in Taipei, Taiwan.	354587475968.0	4.17	4.7	4.492225214732648	9.403068233707245		13361407000.0	61415627000.0	21702384000.0	96404740000.0	86139857000.0	-15.856013197854868	8.641676038188367	7.3860478958874936	28.26723685060742	9.403068233707245	3.0061716184593514	0.4801696149305651	매우 불리	불리(<1)	27.30613646741449	128.3388413968481	9.691317433203505	보류	충분
6415.TW	6415.TW	Taiwan 50	528.0	126.60944206008584	158.82352941176472		-20.601503759398497	477.9	296.9475	Y	Y	상승전환/양호	SILERGY CORP	TAI	TWD	Technology	Semiconductors	Semiconductors	Silergy Corp. designs, manufactures, and sales of various integrated circuit products and related technical services in China and internationally. The company offers DC-DC and AC-DC regulators, AC and DC LED drives, power and battery management IC's, power modules, protection switch IC's, low dropout regulators, sensors, ESD protection, audio products, amplifiers, data converters, motor and DC LED drivers, voltage reference products, MCU and mixed-signal ICs, clock generators, and embedded proce	205050380288.0	49.0	6.29	8.385873715869895	-25.690270567653716		24353135000.0	2695036000.0	729497000.0	3589013000.0	37316511000.0	55.76910439728803	0.22407448893146184	0.042438350176413224	75.0764539908922	-25.690270567653716		0.31047989340538207	판정불가	불리(<1)	0.0	0.0	-100.0	보류	일부부족
2395.TW	2395.TW	Taiwan 50	489.5	41.066282420749275	69.0846286701209		-6.22605363984674	437.3625	337.1975	Y	Y	상승전환/양호	ADVANTECH CO LTD	TAI	TWD	Technology	Computer Hardware	Computer Hardware	Advantech Co., Ltd. engages in the research and development, design, manufacturing, and marketing of embedded computing boards, industrial automation products, and applied and industrial computers. The company operates through Intelligent Systems; Embedded Design-In; IoT Automation; Intelligent Service; and Advantech Service Plus and Others segments. It offers AIOT software, distribution, and services, application focus embedded, arm-based computing platforms, computer on modules, digital signag	425010331648.0	1.78	12.15	17.628700470636606	-0.5125786354135187		27070551000.0	150327000.0	77029000.0	1994309000.0	54947481000.0	31.005010054661422	7.934834737300375	1.6210081179367466	37.7362131642254	-0.5125786354135187		0.0335863420918986	판정불가	불리(<1)	7.474842729172963	90.8193391594515	-81.44650885404462	보류	일부부족
2379.TW	2379.TW	Taiwan 50	651.0	34.50413223140496	24.952015355086377		-0.3062787136294043	570.175	523.485	Y	Y	상승전환/양호	REALTEK SEMICONDUCTOR CORP	TAI	TWD	Technology	Semiconductors	Semiconductors	Realtek Semiconductor Corp., together with its subsidiaries, engages in the research, development, production, and sale of various integrated circuits and related application software in Taiwan, Asia, and internationally. It provides communications network ICs, including broadband access controllers, gateway controllers, digital home centers, gigabit ethernet, switch controllers, wireless LAN ICs, and DTV demodulators, as well as Bluetooth, GNSS, and Internet of Things products. The company also	333873807360.0	4.28	28.07	-3.5195699659979707	-3.0782274650865915		109685323000.0	0.0	10095000000.0	11385412000.0	52202368000.0	213.86866083145011	35.78080306046644	5.496283112206826	15.572901288512641	-3.0782274650865915		0.07717075403283374	판정불가	불리(<1)	2.343545069826817	65.78331011003876	-89.89503684945642	보류	일부부족
2474.TW	2474.TW	Taiwan 50	220.0	20.879120879120872	10.275689223057638		-14.396887159533078	208.8875	197.76	Y	Y	상승전환/양호	CATCHER TECHNOLOGY	TAI	TWD	Industrials	Metal Fabrication	Metal Fabrication	Catcher Technology Co., Ltd., together with its subsidiaries, engages in the manufacture and sale of aluminum and magnesium extrusions, alloy housings, and molds in Taiwan, China, the United States, Singapore, and internationally. Its products include chassis and interior mechanical components; upper case, lower case, keyboard cover, and monitor casings for notebook computers; casings for various server specifications and desktop computers; industrial computer casings and internal parts; and com	118540632064.0	5.22	11.31	-45.850088476855554	-13.129081883496463		166299185000.0	0.0	62082792000.0	62642682000.0	142844857000.0	308.63526850809774	1.0025591649656878	0.4557087113480399	-7.836893767294229	-13.129081883496463			판정불가	판정불가	0.0	0.0	-100.0	판정불가	일부부족
4904.TW	4904.TW	Taiwan 50	105.5	15.300546448087427	18.53932584269662		0.0	96.66000022888184	91.07350006103516	Y	Y	상승전환/양호	FAR EASTONE TELECOMMUNICATIONS	TAI	TWD	Communication Services	Telecom Services	Telecom Services	Far EasTone Telecommunications Co., Ltd. provides mobile telecommunications services in Taiwan and internationally. The company offers postpaid products, such as wireless postpaid and broadband, and data booster; prepaid products; and SMS and eSIM products. It also provides mobile communication and lifestyle services, including mobile communication voice, internet access, and related services, as well as mobile phones and accessories; and cable network, enterprise customer services, communicatio	380612902912.0	3.77	3.8	6.923482474870757	12.64259853453671		9372288000.0	37946397000.0	5199584000.0	53567997000.0	92140651000.0	-7.920300856084408	7.162856996345322	6.789437911227794	29.847447593706423	12.64259853453671	2.360863355121969	0.5498828160434542	매우 불리	불리(<1)	33.78519706907342	128.383748862479	21.690757215619904	보류	충분
2408.TW	2408.TW	Taiwan 50	363.0	72.85714285714286	165.93406593406593		-13.468414779499405	286.55	188.8804999732971	Y	Y	상승전환/양호	NANYA TECHNOLOGY CORPORATION	TAI	TWD	Technology	Semiconductors	Semiconductors	Nanya Technology Corporation research, develops, manufactures, and sells semiconductor products in Taiwan, Japan, Malaysia, China, the United States, Thailand, Germany, Singapore, Poland and internationally. It offers standard dynamic random-access memory (DRAM), low power DRAM, MCP and eMCP, and KGD products, as well as modules; and other memory products and Elixir brands. The company engages in the import and export of its machinery, equipment, and raw materials. Its products have applications	1124801970176.0	40.0	2.1		-23.232591966740635		58074065000.0	14196100000.0	5059500000.0	23617455000.0	170399852000.0	14.160449855886213	1.5764312972202954	0.4342785942755635	166.11407149719705	-23.232591966740635		0.10093911901703218	판정불가	불리(<1)	0.0	0.0	-100.0	보류	일부부족
1590.TW	1590.TW	Taiwan 50	1305.0	34.6749226006192	45.8100558659218		-15.806451612903228	1386.25	1028.52	N	Y	상승전환/양호	AIRTAC INTERNATIONAL GROUP	TAI	TWD	Industrials	Specialty Industrial Machinery	Specialty Industrial Machinery	Airtac International Group manufactures and sells pneumatic control components in Taiwan and internationally. The company offers preparation units and control components comprising solenoid, pneumatic and flow control, ordinary coils, and other valves. It also provides actuators, such as standard, mini, compact, slide table, guided, rodless magnetic, clamp, free mount, and rotary table cylinders; air grippers; GA series, GP series, pressure switch, vacuum components, and other series; and cylind	261000003584.0	2.27	41.98	10.184337557847734	11.787839441212888		4192979000.0	0.0	328670000.0	457708000.0	52581178000.0	20.96489520964895	24.213870242138704	1.8554689840719312	30.586829556702025	11.787839441212888	2.594778263586092	0.4596043344457258	매우 불리	불리(<1)	32.07567888242578	1346.536999484234	3.1829118378723376	보류	충분
9910.TW	9910.TW	Taiwan 50	86.30000305175781	-1.9318147139115727	-33.10077282809472		-36.07407181351273	73.28250007629394	103.02900009155273	Y	N	주의	FENG TAY ENTERPRISE CO LTD	TAI	TWD	Consumer Cyclical	Footwear & Accessories	Footwear & Accessories	Feng Tay Enterprises Co., Ltd. manufactures and sells athletic shoes in Singapore, the United States, Mainland China, Switzerland, Mexico, and internationally. The company provides casual shoes, ice skates, ski boots, golf balls, soccer balls, backpacks, ice hockey helmets and clubs, shoe parts, shoe molds, and tools. It offers international trade services; manufactures and repairs molds, cutting dies, shoe lasts, and injections, as well as processes metal parts; manufactures and processes plast	85219762176.0	6.94	5.1	-14.200368069854896	-17.84382627271236		5299923000.0	3067431000.0	2765942000.0	6426104000.0	25804493000.0	2.260790953384987	5.676381861142846	6.577499027130365	16.47827688203389	-17.84382627271236		-0.6617091308012125	판정불가	불리(<1)	0.0	0.0	-100.0	보류	일부부족
5876.TW	5876.TW	Taiwan 50	42.650001525878906	8.939974108778603	8.38628508188657		-10.210523103412827	39.79499979019165	40.30074998855591	Y	Y	상승전환/양호	THE SHANGHAI COMM & SAVINGS BAN	TAI	TWD	Financial Services	Banks - Regional	Banks - Regional	The Shanghai Commercial & Savings Bank, Ltd. provides various commercial banking services in Taiwan and Hong Kong. The company offers time, savings, demand, checking, and negotiable certificate of deposit accounts, as well as remittance services. In addition, it offers traveling, human resources, insurance, microfinance, leasing, real estate, nominee, trustee, commodity trading, property holding, IT application, securities brokerage, and property management services. Further, the company is invo	206862467072.0	4.48	3.06	10.009813418913694	-0.24655051291825325		447087330000.0	0.0	0.0	66784497000.0	204918623000.0	92.17852360804248	-6.252701493850252	-14.660495357910541	-16.185791530118816	-0.24655051291825325			판정불가	판정불가	8.006898974163494	24.501110860940294	-42.553083272286266	보류	일부부족
3529.TW	3529.TW	Taiwan 50											3529.TW													0.0	0.0	0.0	0.0									판정불가	판정불가				판정불가	핵심부족
3443.TW	3443.TW	Taiwan 50	4310.0	96.80365296803653	98.61751152073732		-24.78184991273996	4500.125	2472.75	N	Y	상승전환/양호	GLOBAL UNICHIP CORP.	TAI	TWD	Technology	Semiconductors	Semiconductors	Global Unichip Corp. engages in the research and development, production, testing, and sale of embedded memory and logic components, analog components, cell libraries, and EDA tools for various IC applications. It offers ASIC and wafer products, as well as non-recurring engineering services. The company also provides product design, technical support, and consulting services. In addition, it offers SoC design services, such as technology design, design methodology, low power solution, and testab	577587380224.0	47.0	28.08	9.244163603420642	0.5283531709970202		11319194000.0	0.0	79254000.0	269671000.0	12912792000.0	84.46466334853109	-17.266985545962644	-0.4006261147555138	150.48202765852812	0.5283531709970202	284.8133330487323	0.3158407280293149	매우 불리	불리(<1)	9.55670634199404	268.35231408319265	-93.77372821152686	보류	충분
